company,Founded Date,website,Headquarters Location,Industry Groups,Industries,CB Rank (Company),Full Description,Number of Employees,Number of Funding Rounds,Funding Status,Last Funding Date,Last Funding Amount Currency (in USD),Last Funding Type,Total Funding Amount Currency (in USD),Number of Founders,Number of Employees,IPO Status,IPO Date,Valuation at IPO Currency (in USD),IPqwery - Patents Granted,IPqwery - Trademarks Registered,IPqwery - Most Popular Patent Class,NA Count,age,founding_year,org_uuid,already_scraped,snapshot_in_window
Able Ninja,2021-01-01,https://www.nccdallas.com,"Tampa, Florida, United States","Hardware, Privacy and Security, Professional Services","Consulting, Security, Telecommunications",1098428.0,,11-50,0.0,,,0.0,,0.0,,11-50,Private,,,,,,6,3,2021,54320,False,False
Artisan Dental Care,2020-01-01,https://www.artisandentalcare.com,"Cornelius, North Carolina, United States",Health Care,"Dental, Health Care, Hospital, Medical",3149586.0,"Artisan Dental Care is a dental care. They provides hygienists, dental assistants, and office associates.  They offer comprehensive dental care for adults and children. Preventative dentistry, implant dentistry, restorative dentistry, emergency dental care, lake dentist, veneers, root canals, bonding. Their services includes cosmetic dentistry, technology, family dentistry, and more.",1-10,0.0,,,0.0,,0.0,,1-10,Private,,,,,,6,4,2020,91250,False,False
DataStrands,2019-01-01,https://www.datastrands.com,"Sacramento, California, United States","Information Technology, Other, Software","Information Technology, Service Industry, Software",2862383.0,DataStrands helps leaders deal smartly with the flood of data into their organizations. DataStrands uses metadata to measure and enhance all data operations. This delivers topline results more income and customer success.,11-50,0.0,,,0.0,,0.0,,11-50,Private,,,,,,6,5,2019,86675,False,False
MarknDev,2020-12-01,https://markndev.com/,"Austin, Texas, United States","Sales and Marketing, Software","Social Media Marketing, Web Development",1819003.0,"Welcome to MarknDev - where digital dreams take flight and visions transform into reality. We are a dynamic team of creative minds and technical wizards, committed to empowering businesses through unparalleled website development and strategic digital marketing solutions. Established with a vision to revolutionize the digital landscape, MarknDev has journeyed through four years of excellence. Our path has been marked by the successful fusion of innovation, dedication, and a genuine understanding of our clients' unique needs.",11-50,0.0,,,0.0,,0.0,1.0,11-50,Private,,,,,,6,3,2020,68820,False,False
Health Access Solutions,2019-01-01,https://www.healthaccesssolutions.com,"San Francisco, California, United States","Financial Services, Health Care","Health Care, Health Insurance, Insurance, Life Insurance",469658.0,"Health Access Solutions provides people better health care solutions. Their Help Desk can help with the Sedera membership, the ICHRA plan, or even understanding which benefits they should use for their   medical needs.",1-10,0.0,,,0.0,,0.0,,1-10,Private,,,,,,6,5,2019,36762,False,False
ADA WebGuard,2019-01-01,https://www.adawebguard.com,"Miami, Florida, United States",Internet Services,Internet,2305791.0,"The mission of ADA WEBGUARD™ is to generate awareness of the importance to create and maintain ADA Compliant Websites to enable those who have Eyesight and other disabilities to be able to navigate websites with freedom, confidence and the satisfaction that they deserve and are entitled to by their United States Federal Constitutional right. Our mission is to facilitate ADA Website Compliance to all of those individuals and companies that market products and services on the Internet. To provide reliable expert ADA guidance to repair existing websites and create new websites to be ADA compliant in accordance with Federal ADA guidelines. In addition, to maintain vigilance of websites in order to assure continued compliance and to certify and provide Expert Advice, Assistance, Expert Affidavits of Certification and Expert Testimony when necessary. ADA WebGuard stands for excellence, Insuring that the ADA WebGuard seal on websites certifies compliance to the highest federal standard. All companies who display the ADA WebGuard seal are in ADA Compliance. They care and respect the rights of all others to have equal access to their websites.",1-10,0.0,,,0.0,,0.0,2.0,1-10,Private,,,,,,6,5,2019,78160,False,False
Scout,2018-05-01,https://www.scout.cool,"New York, New York, United States","Data and Analytics, Information Technology","Analytics, Big Data, Information Technology",688992.0,Product Analytics for Ethereum blockchain companies,1-10,1.0,Seed,2019-05-01,0.0,Pre-Seed,0.0,2.0,1-10,Private,,,,,,2,5,2018,44134,False,False
Legacy Automotive Capital,2021-01-01,https://legacyautocapital.com,"Malvern, Pennsylvania, United States","Financial Services, Other, Real Estate, Transportation","Automotive, Financial Services, Professional Services, Real Estate",1750751.0,,1-10,0.0,,,0.0,,0.0,1.0,1-10,Private,,,,,,6,3,2021,67049,False,False
Unified Commerce Group,2020-01-01,https://www.unifiedcommercegroup.com/,"New City, New York, United States",Commerce and Shopping,Retail,222281.0,Unified Commerce Group  is a New Retail group seeking to acquire and scale purpose-driven brands across the largest global retail economies. UCG will provide brands with multi-disciplinary expertise in each operational vertical with a world class network to ensure long-term growth and profitability while offering the opportunity to compete on a global scale.,11-50,0.0,,,0.0,,0.0,1.0,11-50,Private,,,,,,6,4,2020,23853,False,False
Applied Value Technologies,2021-10-01,https://appliedvaluetech.com/,"Andover, Massachusetts, United States","Information Technology, Software","Information Services, Software",218235.0,"Applied Value Technologies is an early-stage, mission-driven venture revolutionizing the way companies view IT productivity. We help our customers scale with next-generation enterprise technology support services that accelerate user productivity through enhanced automation and a highly personalized user experience. Our goal is to be a trusted partner, collaborating with customers to design and implement user-centric, technology-enabled support solutions at scale.",11-50,0.0,,,0.0,,0.0,,11-50,Private,,,,,,6,2,2021,23542,False,False
A1 Property Ventures,2019-01-01,http://www.a1propertyventures.com/,"Pittsburgh, Pennsylvania, United States",Real Estate,"Property Management, Real Estate, Residential",1355520.0,,1-10,0.0,,,0.0,,0.0,,1-10,Private,,,,,,6,5,2019,59155,False,False
Israeli Web3 developers underground,2022-05-01,https://www.meetup.com/israel-web3-developer-underground/,"New York, New York, United States","Blockchain and Cryptocurrency, Financial Services, Internet Services, Other, Payments, Software","Blockchain, Cryptocurrency, Developer Platform, Developer Tools, Software, Web3",1385251.0,Join our Telegram group: https://t.me/+5ma6irpC0iphYjg0,1-10,0.0,,,0.0,,0.0,2.0,1-10,Private,,,,,,6,1,2022,60162,False,False
Crackerology,2021-01-01,https://www.crackerology.com,"Kansas City, Missouri, United States","Commerce and Shopping, Food and Beverage","E-Commerce, Food and Beverage, Wholesale",1483463.0,"Crackerology is a seller of dessert and wine kits. They provide red wine kits, white wine kits, jalapeno kits, citrus kits, and BBQ kits. They also provide sweet kits, lemon cookie kits, salt gluten kits, appetizers, and dessert kits.",1-10,0.0,,,0.0,,0.0,,1-10,Private,,,,,,6,3,2021,61400,False,False
Motor City Orthopedics,2019-01-01,https://motorcityorthopedics.com,"Novi, Michigan, United States",Health Care,"Health Care, Medical, Wellness",1574061.0,"Motor City Orthopedics offers treatments for the knees, elbows, and ankles. They provide regenerative medicine and ultrasound procedures. They also offer musculoskeletal and sports medicine practice services.",11-50,0.0,,,0.0,,0.0,,11-50,Private,,,,,,6,5,2019,64321,False,False
Trass Games,2022-01-01,https://trassgames.com/,"San Francisco, California, United States","Gaming, Hardware, Software","Gaming, PC Games, Virtual Reality",202380.0,,1-10,1.0,Seed,2023-07-01,0.0,Seed,0.0,,1-10,Private,,,,,,2,2,2022,22315,False,False
Flippy,2020-01-01,https://flippy-ai.com,"Irvine, California, United States","Education, Gaming, Software","EdTech, Gaming",110026.0,Master flashcards while playing your favorite video games.,1-10,2.0,Seed,2023-02-01,0.0,Pre-Seed,100000.0,1.0,1-10,Private,,,,,,1,4,2020,14388,False,False
Paysfer eMart,2022-06-01,https://www.paysfer.com/,"New York, New York, United States","Commerce and Shopping, Internet Services","E-Commerce, E-Commerce Platforms, Marketplace",291807.0,"Paysfer eMart is a new tech, e-commerce marketplace based in New York, sells all the categories of goods, in growth phase, with a low  6 % flat fee to sellers, 5 % lower prices to customers. College based team, providing  jobs to students & hire alumni.  Tech:  we just launched a best tech in space platform with faster speeds, scalable for high volume product upload & customer interaction , seo friendly, AI powered search and minimize cloud hosting costs. Above techs would minimize the need for high manual labor costs as in legacy ecommerce platforms and we plan to pass on savings to customers. We started with a concept to help struggling small businesses and public companies during the pandemic, selling their products online with no fees.  Eco friendly: We believe the growth of warehouses meant to promote immediate delivery around big cities are harmful to the environment, doubling the truck traffic on highways, carbon footprint of the  warehouses and doubling the use of packaging material. Our model would be less harmful to environmental. Products: Currently we have 200,000 products, in most of the categories, rapidly growing to a goal of 10 mil by end of the year. Vendors are based in US, UK & Asia. We are onboarding  select non-US based vendors from worldwide with high quality products. They can register on our marketplace https://marketplace.emart.ooo/ Drop shipping:   model would be added in the coming months. Sellers:   in US and around the world with high quality products, delivery methods please register at https://marketplace.emart.ooo/ or contact us at seller@paysfer.com  New Media:  A live streaming platform with a 'Shopping channel'  for products reviews by college students and a healthy living 'Mini Medicine' platform, from NY, starting in spring . Sellers on Paysfer eMart and in NY area would be offered time to showcase their products in person in NY https://www.paysfer.com/ Paysfer eMart, NY Marketplace https://marketplace.emart.ooo/",11-50,1.0,Early Stage Venture,2022-06-01,0.0,Series A,0.0,1.0,11-50,Private,,,,,,2,1,2022,28289,False,False
Fenix Capital Funding,2021-01-01,https://www.fenixcapitalfunding.com,"Brooklyn, New York, United States","Financial Services, Lending and Investments","Banking, Finance, Financial Services",551955.0,Fenix Capital Funding provides financial services in the banking and finance industry. Their mission is to foster long-lasting relationships with clients by offering alternative funding solutions. They provide a variety of funding programs to help business owners secure the capital they need for their businesses. Their services include merchant cash advances and loans. They also offer a partnership program for ISO partners to provide financial solutions for small and medium businesses nationwide.,51-100,0.0,,,0.0,,0.0,,51-100,Private,,,,,,6,3,2021,39782,False,False
Conceited Marketing,2020-01-01,https://conceitedmarketing.com/,"Millersville, Pennsylvania, United States","Advertising, Commerce and Shopping, Information Technology, Sales and Marketing, Software","Advertising, Brand Marketing, CRM, E-Commerce, Email Marketing",1266767.0,,1-10,0.0,,,0.0,,0.0,1.0,1-10,Private,,,,,,6,4,2020,57741,False,False
FORLOH,2019-01-01,https://forloh.com,"Whitefish, Montana, United States","Clothing and Apparel, Commerce and Shopping, Consumer Goods, Design, Sports","Apparel, Consumer Goods, Fashion, Sporting Goods",336960.0,,11-50,0.0,,,0.0,,0.0,,11-50,Private,,,0.0,11.0,,6,5,2019,30790,False,False
Dash Auto Services,2021-01-01,https://dashautoservices.com,"Salt Lake City, Utah, United States","Other, Professional Services, Transportation","Automotive, Customer Service",2219214.0,,11-50,0.0,,,0.0,,0.0,,11-50,Private,,,,,,6,3,2021,77896,False,False
Aepnus Technology,2021-01-01,https://aepnus.com,"Oakland, California, United States","Manufacturing, Science and Engineering","Chemical, Chemical Engineering, Manufacturing",172238.0,,1-10,2.0,Seed,2023-03-08,0.0,Seed,0.0,2.0,1-10,Private,,,,,,2,3,2021,20043,False,False
Eleven Buzz,2022-12-01,https://www.elevenbuzz.com,"Seattle, Washington, United States",Media and Entertainment,Media and Entertainment,1790126.0,"ElevenBuzz, your ultimate destination for all things media and entertainment. At ElevenBuzz, we strive to provide our readers with the latest news, reviews, and insights about the world of pop culture. Our website is designed to be a one-stop-shop for all your media and entertainment needs, featuring everything from breaking news to local places guides, movies, and TV series. Our team of experienced writers and editors is passionate about the world of media and entertainment and is dedicated to bringing you the latest and greatest in pop culture. Whether you’re interested in the latest celebrity gossip, want to stay up-to-date on the hottest movies and TV shows, or just want to find out what’s happening in your local area, ElevenBuzz has you covered. At ElevenBuzz, we believe that everyone deserves access to reliable and engaging information about the world of media and entertainment. Our website is designed to be accessible and easy to use, with a user-friendly interface that makes it simple to find the content you’re looking for. We also strive to provide a seamless and enjoyable experience for all our readers, with fast loading times and high-quality content that is optimized for all devices.",1-10,0.0,,,0.0,,0.0,1.0,1-10,Private,,,,,,6,1,2022,67807,False,False
Citadel FM,2020-01-01,https://citadelfm.com,"Hingham, Massachusetts, United States","Advertising, Media and Entertainment, Music and Audio, Sales and Marketing","Advertising, Audio",2118170.0,"Citadel FM provides restaurant and retail businesses with advertising and digital audio services. They offer services for hotels, c-stores, restaurants, and retail venues. They also include fitness and hospitality. The company's contact, phone, and physical address.",11-50,0.0,,,0.0,,0.0,,11-50,Private,,,,,,6,4,2020,74561,False,False
SubBase,2022-01-01,https://subbase.io,"Fort Lauderdale, Florida, United States","Real Estate, Software","Construction, Software",228125.0,"SubBase is a centralized technology platform simplifying outdated workflows in construction materials management. Servicing both side of the market, the platform’s user-friendly interface increases efficiency, communication, and organization - saving time and money while streamlining the entire end to end procurement process for commercial trades and their vendors. Enhance and optimize your procurement workflows by managing complex construction supply chains, effortlessly.  SubBase was built by construction folk, who understand the need for personized workflows.",1-10,0.0,,,0.0,,0.0,1.0,1-10,Private,,,,,,6,2,2022,24284,False,False
Time2Talk,2019-07-26,https://time2talk.app,"Cleveland, Ohio, United States","Education, Internet Services, Software","E-Learning, Education, Internet, Language Learning, Social Network, Software",480351.0,"Time2Talk is a mobile app that connects Spanish learning students in the US with native Spanish speakers in Latin America on-demand.  Time2Talk is designed to improve speaking skills while promoting cultural exchange, language fluency and professional growth throughout the Americas.",1-10,1.0,Seed,2021-03-17,0.0,Seed,0.0,1.0,1-10,Private,,,,,,2,4,2019,37170,False,False
Bronco Space,2019-01-01,https://www.broncospace.com,"Pomona, California, United States","Education, Information Technology, Other, Science and Engineering","Aerospace, Technical Support, Training",992714.0,Bronco Space is developing a framework for creating the next generation of the space industry. They provide technical and programmatic training services to the defense and space industries. The company's contact modes are phone and physical address.,11-50,0.0,,,0.0,,0.0,1.0,11-50,Private,,,,,,6,5,2019,52188,False,False
Glish,2021-01-01,https://drinkglish.com,"Jersey City, New Jersey, United States","Commerce and Shopping, Food and Beverage","E-Commerce, Food and Beverage, Wholesale",1530590.0,,1-10,0.0,,,0.0,,0.0,,1-10,Private,,,0.0,1.0,,6,3,2021,63622,False,False
Ambit,2021-01-01,https://ambitrd.com,"Boston, Massachusetts, United States","Biotechnology, Health Care, Science and Engineering, Software","Biotechnology, Health Care, Health Diagnostics, Medical, Software",45626.0,"""At Ambit, we believe our innovative platform and associated services will redefine the rare disease ecosystem. While there is an array of data and professional service firms in the space offering partial, disconnected capabilities, Ambit aims to provide the first and only comprehensive, integrated platform. Ambit will develop the tools stakeholders need to better navigate the inherent challenges of managing a rare disease, starting with getting an accurate diagnosis. Ambit is designing an approach built around the most critical needs of each stakeholder. We are integrating proprietary data, algorithms, applications, genetic testing, and patient services to become an irreplaceable intermediary.""",11-50,1.0,Seed,2023-11-10,1250010.0,Seed,1250010.0,1.0,11-50,Private,,,"1,428",529.0,Medical Or Veterinary Science; Hygiene,0,3,2021,5941,False,False
Shaibit Solutions,2018-09-26,https://shaibit.net,"Sheridan, Wyoming, United States","Advertising, Design, Internet Services, Sales and Marketing, Software","Advertising, Brand Marketing, Digital Marketing, Lead Generation, SEO, Web Design, Web Development",823937.0,"Shaibit Solutions is a black-owned digital marketing company focusing on the balance of innovation and growth. Our focus is on creating high converting digital experiences.  Whether that be building your brand, design for your business, building your digital billboard of a website, or marketing your products and services, we have a passion for delivering success to our clients. We define success in a variety of factors such as KPI's, Leads, Sales, and Social Proof. The sky is the limit in a unique team like ours. What makes us unique? Shai is the god of fate and destiny in Egyptian mythology and the bit is the smallest unit of measurement in technology.  Together they harmonize into a concept of a small team disrupting a huge industry, not for our own glory but for our clients. You are our mission, our concept, and our purpose.",1-10,0.0,,,0.0,,0.0,1.0,1-10,Private,,,,,,6,5,2018,47902,False,False
TEAL Concepts,2019-01-01,https://www.tealconcepts.com,"Richmond, Virginia, United States","Community and Lifestyle, Education, Professional Services","Business Development, Professional Networking, Training",2709161.0,,11-50,0.0,,,0.0,,0.0,,11-50,Private,,,,,,6,5,2019,84312,False,False
Khyria,2021-11-10,https://www.khyria.com,"Grand Rapids, Michigan, United States",Health Care,Health Care,389048.0,"We created Khyria to offer every woman her own unique health toolkit, building the next generation of menopause solutions to improve women’s experience and outcomes in midlife and beyond. We’re set on closing the data gap on female health and aging and improve long-term chronic disease outcomes.    By leveraging cutting-edge science, empathy, and data insights, Khyria aims to enhance female potential, improve women’s lives, and their impact across the world.",11-50,1.0,Seed,2021-11-14,0.0,Pre-Seed,0.0,3.0,11-50,Private,,,,,,2,2,2021,33349,False,False
Wonsulting,2019-01-01,https://www.wonsulting.com/,"Los Angeles, California, United States","Education, Professional Services","Consulting, Corporate Training, Training",149519.0,,11-50,0.0,,,0.0,,0.0,1.0,11-50,Private,,,,,,6,5,2019,18230,False,False
Fuchs Consulting Group LLC,2021-11-16,https://www.fuchs-consulting.com,"Albuquerque, New Mexico, United States",Professional Services,Consulting,2141497.0,At Fuch Consulting Group we focus on creating value for our customers by designing and executing effective agreements and improving efficient prucrement processes.  We always work in partnership with our clients and suppliers to find the right  and sustainable solutions to each requirement.,1-10,0.0,,,0.0,,0.0,,1-10,Private,,,,,,6,2,2021,74200,False,False
In Home Flooring,2022-08-01,https://inhomeflooring.com/,"Denver, Colorado, United States",Real Estate,"Home Improvement, Home Renovation, Home Services",1315947.0,"In Home Flooring is Denver’s choice for outstanding home flooring design and installation, including carpet, hardwood, tile, laminate, and vinyl.",1-10,0.0,,,0.0,,0.0,,1-10,Private,,,,,,6,1,2022,58279,False,False
Rhino Rails,2019-01-01,https://rhinorails.com,"Duncan, South Carolina, United States","Commerce and Shopping, Manufacturing","Manufacturing, Retail",885048.0,,1-10,0.0,,,0.0,,0.0,,1-10,Private,,,,,,6,5,2019,49515,False,False
Leadwork Marketing,2019-01-01,https://www.theleadwork.com,"Saratoga Springs, Utah, United States","Advertising, Internet Services, Media and Entertainment, Sales and Marketing","Advertising, Digital Marketing, SEO, Social Media",1973524.0,"Leadwork Marketing provides advertising services. They provide lead generation, advertising, marketing, sales, paid ads, ad design, funnels, digital marketing strategy, PPC, and social ads services. They provide inquiries through online applications, email, and phone calls.",1-10,0.0,,,0.0,,0.0,,1-10,Private,,,,,,6,5,2019,70674,False,False
getWise (currently in market as wiseHer),2018-10-01,https://www.wiseher.com/,"Framingham, Massachusetts, United States","Commerce and Shopping, Community and Lifestyle, Education","Marketplace, Training, Women's",725156.0,,11-50,0.0,,,0.0,,0.0,,11-50,Private,,,0.0,1.0,,6,5,2018,45216,False,False
Elite Spine Health & Wellness,2022-01-01,https://elitespine.com,"Plantation, Florida, United States",Health Care,"Health Care, Therapeutics, Wellness",2249434.0,,11-50,0.0,,,0.0,,0.0,,11-50,Private,,,,,,6,2,2022,77448,False,False
BlueReceipt,2020-01-01,https://bluereceipt.com,"Chicago, Illinois, United States","Hardware, Information Technology, Sales and Marketing, Software","Brand Marketing, Communications Infrastructure, Information Services, Marketing Automation, Software",292118.0,BlueReceipt develops a Shopify plugin that uses text marketing to boost revenue. BlueReceipt is a technology company that creates conversational infrastructure for businesses and brands.,1-10,0.0,,,0.0,,0.0,1.0,1-10,Private,,,,,,6,4,2020,28303,False,False
Java Gray,2019-11-28,https://www.JavaGray.com,"San Jose, California, United States","Design, Internet Services, Sales and Marketing, Software","Digital Marketing, Internet, SEO, Social Media Marketing, Web Design, Web Development",183115.0,"Java Gray is a full-service digital marketing agency based in Silicon Valley, with a special focus on analytics and measurement, conversion optimization, lead generation and content marketing. We build fully customized programs across all digital channels from Pay Per Click to Search Engine Optimization, Social Advertising, Website Design, Lead Generation & more. We offer flat rate fees and our clients own all of their data. We strive to create partnerships.",1-10,1.0,Seed,2019-12-01,100000.0,Pre-Seed,100000.0,1.0,1-10,Private,,,,,,0,4,2019,20866,False,False
Electus Health,2019-01-01,https://www.electushealth.com/,"Flower Mound, Texas, United States","Health Care, Professional Services","Health Care, Management Consulting",1427058.0,"Electus Health understands clinical autonomy is important to dental practices serving different communities, but dentists may benefit from operational support, management expertise and the financial resources of a partner. In today’s dentistry environment, with its ever-changing technology offerings, standard of care changes, compliance policies and procedures, and reimbursement challenges, the strength and experience of Electus Health enables practices to concentrate on what they do best – provide the highest quality care and best patient experience in the communities they serve.",11-50,0.0,,,0.0,,0.0,1.0,11-50,Private,,,,,,6,5,2019,60916,False,False
EMCIFund,2020-01-01,https://emcifund.com,"San Diego, California, United States","Financial Services, Health Care, Lending and Investments","Finance, Financial Services, Oncology, Venture Capital",315287.0,,11-50,0.0,,,0.0,,0.0,1.0,11-50,Private,,,,,,6,4,2020,29620,False,False
Venture MLS,2021-01-01,https://venturemls.com/,"Chino Hills, California, United States",Real Estate,PropTech,250089.0,"Venture MLS has launched a $10MM fund built to back seed and early-stage companies within the property technology space. Founded in 2021 by prominent veterans of organized real estate, Venture MLS seeks companies that can leverage the unmatched experience, expertise, and connections it holds in this well-defined, underserved industry.",1-10,0.0,,,0.0,,0.0,,1-10,Private,,,,,,6,3,2021,25744,False,False
