Actifai,2019-01-01,https://www.actif.ai,"Washington, District of Columbia, United States","Artificial Intelligence (AI), Data and Analytics, Hardware, Information Technology, Sales and Marketing, Science and Engineering, Software","Artificial Intelligence (AI), Enterprise Software, Machine Learning, SaaS, Sales Automation, Software, Telecommunications",226989.0,"Actifai is the only AI-powered customer engagement platform that allows cable, media, and telecom providers to match individual customers with a single optimized offer. Maximizing customer satisfaction and lifetime value begins with presenting subscribers the offer that’s right for them, based on their circumstances, intended use, and alternatives. Our unique approach, using proprietary data, machine learning, and artificial intelligence to identify a single recommended offer for individual customers, has increased providers’ ARPU by an average of 12% since the day we launched. ---------- Our platform: We’ve tailored our platform to focus on functionality that augments daily sales and support engagements and prioritized keeping that functionality natural and intuitive. Under Actifai’s hood are four technology building blocks shaped for real-life users, improving the customer and agent selling experience on day one. Data Discovery - Unparalleled access to proprietary data, combined with technology that gathers external information key to customer decision-making, all in real-time Machine Learning - Expertly designed machine learning models that analyze each unique customer situation against over a million previous customer offers and buying outcomes AI Decisions - Powerful AI identifies the single offer recommendation best suited to an individual customer and optimized for conversion, ARPU, and CLTV Dynamic Rationale - Descriptive selling points, contextually tailored to an individual, provide the rationale that motivates customers to choose the offer that’s been recommended to them ---------- Impact: Across tens of thousands of daily customer engagements, our platform's technology has helped providers gain an edge in acquisition, increase average basket size, retain customers profitably, improve online conversion, and win in new markets. We measure ourselves by our customers’ success – that’s why we’re proud of the results they’ve achieved.     - 22x Average ROI   - 30% New-sale Conversion Improvement    - Up to 14% ARPU Lift   - 17% Year-one Customer Retention Improvement   - 2x Add-On Product Upsells ---------- Our Story: Actifai’s first deployment was in partnership with a leading regional provider — we continue to view our customers as partners, even as our commitments have grown. We’re proud of the relationships we’ve built with providers across North America and the trust they’ve placed in us to solve many of their toughest challenges with AI.  *100% of customers who’ve piloted actifai have rolled out our technology* Customers (Q1/2-2023):   - Cogeco Communications   - Altafiber   - Hargray   - breezeline   - Hawaiian Telcom   - WOW! ---------- Products: Actifai’s platform addresses business needs across the customer lifetime with a suite of products for acquiring, retaining, and expanding customer relationships. All are powered by the same dynamic technology and available in our single, unified platform. Actifai Engage Actifai Digital Actifai Upsell Actifai Retention Actifai B2B",11-50,0.0,,,0.0,,0.0,1.0,11-50,Private,,,,,,6,5,2019,24192,False,False
Grapewise,2022-01-01,https://grapewise.io,"New York, New York, United States","Financial Services, Lending and Investments, Professional Services","Accounting, Angel Investment, Financial Services",1088181.0,,1-10,0.0,,,0.0,,0.0,,1-10,Private,,,,,,6,2,2022,53612,False,False
NextGen Management,2019-01-01,http://www.nextgenmanagement.com,"Davie, Florida, United States",Real Estate,Real Estate,1860117.0,,11-50,0.0,,,0.0,,0.0,,11-50,Private,,,3.0,9.0,,6,5,2019,69544,False,False
SSBC-USA,2019-01-01,https://ssbc-usa.com,"Elma, New York, United States","Manufacturing, Science and Engineering, Transportation","Automotive, Industrial Engineering, Industrial Manufacturing, Machinery Manufacturing, Manufacturing, Mechanical Engineering",1959917.0,,51-100,0.0,,,0.0,,0.0,,51-100,Private,,,,,,6,5,2019,70932,False,False
CureMBC,2020-01-01,http://curembc.com,"Annandale, Virginia, United States","Health Care, Information Technology, Payments, Software","Billing, Health Care, Information Technology",2883726.0,,11-50,0.0,,,0.0,,0.0,,11-50,Private,,,,,,6,4,2020,87863,False,False
Maincard.io,2022-06-01,https://maincard.io,"Walnut, California, United States","Blockchain and Cryptocurrency, Gaming, Internet Services, Sports","Gaming, Sports, Web3",64414.0,Maincard.io is a sports fantasy manager built on Polygon.,11-50,1.0,Seed,2023-01-01,2000000.0,Seed,2000000.0,1.0,11-50,Private,,,,,,0,1,2022,8765,False,False
Swan Beauty,2020-01-01,https://www.swanbeauty.com,"Charlotte, North Carolina, United States","Community and Lifestyle, Consumer Goods, Health Care","Beauty, Cosmetics, Health Care, Lifestyle",820177.0,Swan Beauty is an online beauty concierge service company. They provide hand-selected beauty products. They offer a variety of natural and cruelty-free products.,11-50,0.0,,,0.0,,0.0,2.0,11-50,Private,,,,,,6,4,2020,47810,False,False
The Cannabis Radar,2018-04-24,https://thecannabisradar.com/,"Colorado City, Arizona, United States","Community and Lifestyle, Food and Beverage, Health Care",Cannabis,2400716.0,"Cannabis Radar is composed of experts, specialists, and experienced cannabis advocates. It’s our guarantee that every time you visit our website you will find information that’s transparent, detailed, on a number of brands, products, news, etc. Everything that is posted on this website is accurate, genuine and updated regularly. We receive about 10,000 visitors each day and are the right resource on all CBD product reviews, news, launches, DIY guides, legality status. We also aim at developing this website continuously to make it user-friendly, for a better experience for you.",1-10,0.0,,,0.0,,0.0,,1-10,Private,,,,,,6,5,2018,79733,False,False
Foyer,2022-01-01,https://www.foyersavings.com/,"New York, New York, United States","Financial Services, Real Estate","Financial Services, Lending, Real Estate",207084.0,,1-10,2.0,Seed,2022-11-23,0.0,Pre-Seed,0.0,,1-10,Private,,,,,,2,2,2022,22678,False,False
Noteefy Inc,2022-04-01,https://noteefy.app/,"Los Angeles, California, United States",Software,Software,179580.0,"Noteefy (pronounced ‘notify’) is bringing cutting edge technology and innovation to golf operators. Noteefy has the first automated tee time assistant / waitlist for golfers and golf courses to improve the golfer booking experience, while accelerating course revenue and efficiency. The Noteefy booking assistant enables golfers to input their personalized playing preferences, then get a real time notification when their desired tee time comes available. The golfer then books on the existing POS tee sheet as they normally would and the course keeps 100% of the revenue.",1-10,0.0,,,0.0,,0.0,2.0,1-10,Private,,,,,,6,1,2022,20608,False,False
TxtCart,2019-10-01,https://www.txtcartapp.com,"New York, New York, United States","Commerce and Shopping, Internet Services, Messaging and Telecommunications, Sales and Marketing, Software","E-Commerce, Marketing, SMS, Software",644975.0,"TxtCart is a top-rated Conversational SMS Marketing & Abandoned Cart Recovery solution for DTC merchants. Get started free for 14-days and see what $1,000 in free recovered sales can do for your business.",1-10,0.0,,,0.0,,0.0,1.0,1-10,Private,,,,,,6,4,2019,42870,False,False
Major Futures,2021-01-01,https://www.majorfutures.com,"New York, New York, United States","Data and Analytics, Design, Professional Services, Sales and Marketing","Brand Marketing, Management Consulting, Market Research",1707161.0,,11-50,0.0,,,0.0,,0.0,,11-50,Private,,,,,,6,3,2021,66400,False,False
LuxyList,2021-01-01,https://luxylist.it/,"New York, New York, United States","Commerce and Shopping, Media and Entertainment","Content Creators, E-Commerce, Gift, Gift Registry",260387.0,"LuxyList recognized the need for creators and fans to exchange gifts without revealing sensitive personal information. By offering a secure gifting platform that requires only a shared link, it created a novel solution to a common privacy concern.  We handle all logistics, revolutionizing fan-creator dynamics and enriching interactions.",1-10,0.0,,,0.0,,0.0,1.0,1-10,Private,,,,,,6,3,2021,26431,False,False
KSRS Digital Broadcast,2020-01-01,https://www.suncityjamz.com,"El Paso, Texas, United States","Media and Entertainment, Music and Audio, Video","Broadcasting, Music, Video",3097594.0,"KSRS Digital Broadcast company provides digital music radio services that specialize in broadcasting services. They offer radio personality development, entertainment promoting, television, and video producing services.",1-10,0.0,,,0.0,,0.0,,1-10,Private,,,,,,6,4,2020,90578,False,False
Piedmont Technical Experts,2021-01-01,https://piedmonttechnicalexperts.com,"Greensboro, North Carolina, United States","Information Technology, Privacy and Security","Cyber Security, Information Technology, IT Management",2527575.0,,1-10,0.0,,,0.0,,0.0,,1-10,Private,,,0.0,1.0,,6,3,2021,82440,False,False
WhatIfLaptops,2022-01-01,https://whatiflaptops.com,"New York, New York, United States","Gaming, Information Technology","Gaming, Information Technology, PC Games, Video Games",2933624.0,,1-10,0.0,,,0.0,,0.0,,1-10,Private,,,,,,6,2,2022,88585,False,False
Point C,2020-01-01,https://www.pointchealth.com,"Chicago, Illinois, United States","Financial Services, Health Care","Health Care, Health Insurance, Hospital",199916.0,"Point C is a network of self-insured healthcare plan third-party administrators. The company was founded in 2020 and is headquartered in Chicago, Illinois.",101-250,0.0,,,0.0,,0.0,,101-250,Private,,,,,,6,4,2020,22110,False,False
Chef Inspirational Foods,2022-01-01,https://www.chefinspirationalfoods.com,"Islandia, New York, United States",Food and Beverage,"Food and Beverage, Food Processing",1606340.0,"Chef Inspirational Foods speciality is the deli area, which offers prepared dinners, salads, olives and antipasti.",11-50,0.0,M&A,,0.0,,0.0,,11-50,Private,,,,,,5,2,2022,65235,False,False
SkillBank.io,2020-08-01,https://skillbank.io/,"San Francisco, California, United States","Administrative Services, Professional Services, Software","Human Resources, Recruiting, Software",2133623.0,"We're an enterprise SaaS delivering hiring insight to corporate talent acquisition teams. Unique data driven solution to a customer validated problem in a big market. We’re post-product, pre-revenue with a great team ready to put capital to work to pioneer a new market segment and disrupt hiring.",1-10,0.0,,,0.0,,0.0,1.0,1-10,Private,,,,,,6,3,2020,74338,False,False
Causeway,2022-01-01,https://withcauseway.com/,"Brooklyn, New York, United States","Government and Military, Other, Social Impact","Charity, Government, Non Profit",658873.0,,1-10,0.0,M&A,,0.0,,0.0,,1-10,Private,,,,,,5,2,2022,43289,False,False
Amroth,2020-01-01,https://amroth.io,"Los Angeles, California, United States","Commerce and Shopping, Consumer Goods, Food and Beverage","Consumer Goods, Food and Beverage, Food Processing, Retail, Wine And Spirits",914961.0,,1-10,0.0,,,0.0,,0.0,,1-10,Private,,,,,,6,4,2020,50255,False,False
Seven Nutrition,2019-01-01,https://sevennutrition.com,"Austin, Texas, United States","Commerce and Shopping, Health Care, Sales and Marketing","E-Commerce, Health Care, Sales",743370.0,"Sevennutriti is confident that are giving customers supplements made from the highest-quality components available. Summer is almost over, so make the most of it while it lasts. Traditional summer foods such as a slice of watermelon or a glass of iced tea are choices for staying healthy. During the summer, fruits and vegetables are in season, so take advantage of the quantity of fresh produce.",1-10,0.0,,,0.0,,0.0,,1-10,Private,,,,,,6,5,2019,45704,False,False
US Auto Glass,2021-07-05,https://us-autoglass.com,"Wilmington, Delaware, United States",Transportation,Automotive,1034315.0,From Coast to Coast – our Mobile Technicians have you covered nationwide. We provide modern auto glass replacement solutions while ensuring a premium service.,1-10,0.0,,,0.0,,0.0,,1-10,Private,,,,,,6,2,2021,52372,False,False
AutoPylot,2021-01-01,https://www.autopylot.io/,"South Burlington, Vermont, United States","Consumer Electronics, Consumer Goods, Hardware, Science and Engineering, Software","Aerospace, Drone Management, Drones",369031.0,"AutoPylot is a mission scheduling application to help drone pilots navigate, access airspace, create missions, and track weather. The company combines all the aspects of mission scheduling into one easy-to-use application that offers real-time weather alerts, forecasts, and radar. It also allows the market to set parameters, lets autopilot track the weather, keeps stakeholders informed of mission changes, and helps drone pilots prepare for their flights more efficiently and safely.",1-10,0.0,,,0.0,,0.0,1.0,1-10,Private,,,0.0,0.0,,6,3,2021,32416,False,False
VitaMom Club,2021-01-01,https://vitamomclub.com,"Park City, Utah, United States","Food and Beverage, Health Care","Dietary Supplements, Nutrition, Wellness",1460681.0,"VitaMom Club is a nutrition company that provides vitamins that pack a potent nutritional punch. Their products include apple cider vinegar, turmeric, immunity, and hair, skin, & nails. They also provide chiropractic care. They also provide their products in combo packs.",11-50,0.0,,,0.0,,0.0,,11-50,Private,,,,,,6,3,2021,61830,False,False
Accretech SBS,2019-01-01,https://accretechsbs.com,"Portland, Oregon, United States","Design, Manufacturing","Industrial, Manufacturing, Product Design",976794.0,,11-50,0.0,,,0.0,,0.0,,11-50,Private,,,,,,6,5,2019,51784,False,False
I CAN,2021-01-01,https://canelo.app,"Beverly Hills, California, United States","Apps, Food and Beverage, Health Care, Software, Sports","Apps, Fitness, Nutrition, Software, Sports, Wellness",992949.0,,1-10,0.0,,,0.0,,0.0,1.0,1-10,Private,,,,,,6,3,2021,52197,False,False
Therapists in Motion,2019-01-01,https://therapistsinmotion.com,"Fort Smith, Arkansas, United States",Health Care,"Health Care, Personal Health, Therapeutics",2830089.0,,11-50,0.0,,,0.0,,0.0,,11-50,Private,,,,,,6,5,2019,87151,False,False
DreamGifts,2021-01-01,https://www.dreamgifts.co,"Los Angeles, California, United States","Community and Lifestyle, Internet Services","Social, Social Network",690697.0,,1-10,0.0,,,0.0,,0.0,,1-10,Private,,,,,,6,3,2021,44189,False,False
Dash Fund,2020-01-01,https://dashfund.co/,"Brooklyn, New York, United States","Financial Services, Lending and Investments",Venture Capital,132127.0,,1-10,0.0,,,0.0,,0.0,2.0,1-10,Private,,,,,,6,4,2020,16707,False,False
Brighton Park Capital,2019-01-01,https://www.bpc.com,"Greenwich, Connecticut, United States","Financial Services, Information Technology, Lending and Investments, Software","Financial Services, Information Services, Software, Venture Capital",99746.0,"Brighton Park Capital is an investment firm that specializes in software, information services, and technology-enabled services. It aims to have a very active partnership with entrepreneurs and work closely with CEOs to help build, attract, and nurture other members of the management team to facilitate the growth agenda. They partner with exceptional management teams and use our decades of operating experience to help them build world-class companies.  It was founded in 2019 and is headquartered in Greenwich, Connecticut.",11-50,0.0,M&A,,0.0,,0.0,1.0,11-50,Private,,,,,,5,5,2019,13253,False,False
KoreLock,2022-01-01,https://www.korelock.com,"Greenwood Village, Colorado, United States","Hardware, Information Technology, Internet Services, Science and Engineering, Software","Embedded Software, Embedded Systems, Information Technology, Internet of Things, Software",307455.0,"KoreLock is a rapidly growing global leader in turnkey embedded smart lock technology. The company specializes in embedded PCB solutions that assist lock manufacturers in overcoming the complexities of developing connected smart locks, lowering costs, and reducing overall time-to-market.",11-50,1.0,Early Stage Venture,2023-02-02,0.0,Series A,0.0,,11-50,Private,,,,,,2,2,2022,29163,False,False
TH3 CPA,2019-01-01,https://www.th3cpa.com/,"Cincinnati, Ohio, United States","Financial Services, Professional Services","Accounting, Consulting, Financial Services",1978380.0,,1-10,0.0,,,0.0,,0.0,2.0,1-10,Private,,,,,,6,5,2019,72229,False,False
Valiabiz,2021-01-12,https://www.valiabiz.com,"Greenwich, Connecticut, United States","Other, Professional Services","Business Development, Consulting, Small and Medium Businesses",1459537.0,,101-250,0.0,,,0.0,,0.0,1.0,101-250,Private,,,,,,6,3,2021,61856,False,False
SleepSpace,2018-10-01,https://sleepspace.com/,"New York, New York, United States","Biotechnology, Health Care, Science and Engineering","Health Care, Life Science",230481.0,"SleepSpace is the first Sleep Operating System designed to connect all the devices in the smart bedroom of the future. We give every human a deeper night of sleep using the science of sound, vibration, and light. Our technology more accurately measures sleep than any other wearable and connects with most wearables, like Apple Watch, Oura, Biostrap, Eight Mattress, and more. We developed proprietary nearable sleep sensing technology that turns your smart phone into a smart bed. We empower coaches and clinicians to get a clearer picture of their patients and give more effective personalized interventions using our platform.  SleepSpace is a tool to both deliver clinical sleep programs and to give clinicians a clear picture of the patient's objective device data and their subjective experience of sleep. We have sold the technology into major mattress brands, hotels, and corporate wellness initiatives and have received more than $3.5 mm in grant awards from the NIH.",1-10,5.0,Seed,2023-06-05,0.0,Seed,0.0,1.0,1-10,Private,,,,,,2,5,2018,24452,False,False
Spark Change,2019-01-01,https://www.sparkchange.health,"Kansas City, Missouri, United States",Health Care,Health Care,285939.0,,11-50,0.0,,,0.0,,0.0,4.0,11-50,Private,,,0.0,1.0,,6,5,2019,27922,False,False
Scent Lab,2021-01-01,https://www.shopscentlab.com,"New York, New York, United States","Commerce and Shopping, Community and Lifestyle, Consumer Goods, Real Estate","Beauty, E-Commerce, Home Decor, Lifestyle, Personalization, Retail",199328.0,,1-10,1.0,Seed,2023-06-30,0.0,Pre-Seed,0.0,,1-10,Private,,,,,,2,3,2021,22068,False,False
Des Moines Soccer Club,2020-01-01,https://www.desmoinessoccerclub.org,"Des Moines, Iowa, United States","Education, Other, Social Impact, Sports","Non Profit, Recreation, Soccer, Training",2803674.0,"Des Moines Soccer Club is a nonprofit soccer organization. They offer recreational, academy, and select programs. They address inquiries through email and online applications.",11-50,0.0,,,0.0,,0.0,,11-50,Private,,,,,,6,4,2020,86006,False,False
Thrive Publishing,2021-01-01,https://thrivepublishing.wixsite.com/thrivepublishing,"Hagerstown, Maryland, United States","Content and Publishing, Media and Entertainment, Music and Audio","Audio, Books, EBooks, Printing, Publishing",466454.0,,1-10,0.0,,,0.0,,0.0,,1-10,Private,,,,,,6,3,2021,36636,False,False
Dispatch For You,2020-01-01,https://www.dispatchforyou.com,"Sheridan, Wyoming, United States","Administrative Services, Transportation","Delivery, Freight Service, Transportation",2252261.0,,11-50,0.0,,,0.0,,0.0,,11-50,Private,,,,,,6,4,2020,77397,False,False
Ratcliff & Blake,2019-01-01,https://ratcliffblake.com/,"Oskaloosa, Iowa, United States","Financial Services, Health Care","Auto Insurance, Commercial Insurance, Health Care, Insurance",2942530.0,,1-10,0.0,,,0.0,,0.0,,1-10,Private,,,,,,6,5,2019,88453,False,False
ADEx,2019-01-01,https://intelease.com/,"San Francisco, California, United States","Information Technology, Other, Software","Information Technology, Software, Technical Support",2229929.0,,11-50,0.0,,,0.0,,0.0,,11-50,Private,,,,,,6,5,2019,77753,False,False
GameGlass,2019-01-01,http://www.gameglass.gg,"Dover, Delaware, United States","Gaming, Information Technology, Software","Gaming, Information Technology, Software",578168.0,,1-10,0.0,,,0.0,,0.0,2.0,1-10,Private,,,,,,6,5,2019,40691,False,False
Arthur Street Ventures,2022-01-01,https://www.arthurstreetx.com/,"Cleveland, Ohio, United States","Financial Services, Lending and Investments, Other, Professional Services, Sales and Marketing","Consulting, Management Consulting, Marketing, Professional Services, Venture Capital",922820.0,"ASV is a multi-disciplinary venture design, advisory firm, & holding group focused on developing ideas that turn into viable brands while minimizing risk, cost, and time-to-market all while maintaining agility. We are vision developers who work alongside passionate founders to go from sketch to shelf and ultimately to an end-user. Our industries include: Media Government Contracting Firearms, Munitions, & Defense Consumer Packaged Goods Alcohol & Spirits Hemp & CBD Apparel & Footwear",11-50,0.0,,,0.0,,0.0,1.0,11-50,Private,,,,,,6,2,2022,50433,False,False
Prime Remnant,2019-01-01,https://www.primeremnant.com,"Greenwood, Indiana, United States",Transportation,"Delivery Service, Logistics, Transportation",1263141.0,,11-50,0.0,,,0.0,,0.0,,11-50,Private,,,,,,6,5,2019,57818,False,False
Viver Joy,2020-01-01,https://www.viverjoy.com/,"Morristown, New Jersey, United States","Commerce and Shopping, Community and Lifestyle, Health Care, Internet Services","E-Commerce, Online Portals, Wellness, Women's",3071249.0,,1-10,0.0,,,0.0,,0.0,,1-10,Private,,,,,,6,4,2020,89606,False,False
Theia Technology Inc,2018-07-30,http://theiainc.herokuapp.com/home,"San Diego, California, United States","Content and Publishing, Information Technology, Internet Services, Media and Entertainment, Software","Content Delivery Network, Information Technology, Social Media, Software",2082291.0,Theia's mission is to build community thru software.  Our product Seeyia gives our users the ability to share content and watch multiple channels at the same time.  We are adding layers of perspective to the events that matter to you.  ,1-10,0.0,,,0.0,,0.0,3.0,1-10,Private,,,,,,6,5,2018,73579,False,False
CubI Marketing,2020-01-01,https://www.cubimarketing.com,"Miami, Florida, United States","Advertising, Design, Information Technology, Internet Services, Sales and Marketing, Software","Advertising, Graphic Design, Information Technology, SEO, Web Development",2026841.0,,1-10,0.0,,,0.0,,0.0,,1-10,Private,,,,,,6,4,2020,72956,False,False
Cleanetto,2021-01-01,https://cleanetto.com,"New York, New York, United States","Information Technology, Sales and Marketing, Software","CRM, Enterprise Software, Software",1453250.0,,11-50,0.0,,,0.0,,0.0,1.0,11-50,Private,,,0.0,1.0,,6,3,2021,61977,False,False
BotRx @BotRxUS,2019-06-01,https://www.botrx.com,"Palo Alto, California, United States",Software,SaaS,643633.0,"BotRx provides a cure for online bot attacks and the associated fraud. Unseen threats from automated bot attacks are increasing in volume and sophistication—and are experienced by almost every business. All companies, regardless of size, need and deserve robust cybersecurity and industry-leading protection for their websites.BotRx fortifies defenses against clever, invisible, and dynamic bots with intelligence-driven technology that is collected from over 100,000 global businesses. Designed and scaled for large enterprise, but with the small and medium-sized business in mind, our bot detection and mitigation provides the same great benefits of an enterprise cybersecurity solution, but delivered as an easy to use, affordable alternative that starts working day one.",11-50,0.0,,,0.0,,0.0,2.0,11-50,Private,,,,,,6,4,2019,42838,False,False
SAVIT Solutions,2020-01-01,https://www.savitsolutions.com,"Lake Charles, Louisiana, United States","Community and Lifestyle, Information Technology, Internet Services, Messaging and Telecommunications, Privacy and Security, Professional Services","Consulting, IT Management, Professional Networking, Security, VoIP",3034329.0,,1-10,0.0,,,0.0,,0.0,,1-10,Private,,,,,,6,4,2020,90025,False,False
Maka Social,2019-07-01,https://www.maka.social,"Tampa, Florida, United States","Apps, Software","Apps, Software",1164457.0,"Maka Social is an app with the goal of reducing the loneliness epidemic by addressing the symptoms of social anxiety and eliminating small talk. This makes chance encounters in the real world less stressful and more meaningful to unlock their full potential and increase the chances of making plans for further contact. Our business model is based on subscriptions paid by participating locations such as universities, military bases, churches, community centers, bars, and many more.",1-10,0.0,,,0.0,,0.0,3.0,1-10,Private,,,,,,6,4,2019,55745,False,False
Xenomics,2020-01-01,https://xenomics.com,"Cambridge, Massachusetts, United States","Biotechnology, Health Care, Professional Services, Science and Engineering","Biotechnology, Business Development, Consulting, Genetics",400006.0,,1-10,0.0,,,0.0,,0.0,1.0,1-10,Private,,,,,,6,4,2020,33853,False,False
