Seedlings,2022-04-20,https://seedlings.biz,"Santa Monica, California, United States","Financial Services, Real Estate","Lending, Property Management, Real Estate, Real Estate Investment, Rental Property",641649.0,"Seedlings is a company that specializes in professionally managed co-living opportunities, in residential properties located in the Southern California area. We offer tenants the opportunity to live at luxurious properties with other pre-screened tenants, while allowing tenants to pay all of their housing expenses in a single payment. Seedlings not only wants to help our tenants enjoy the very best co-living experience possible, we also want to help our tenants seamlessly transition to home ownership as well.",1-10,1.0,Seed,2022-05-01,0.0,Seed,0.0,1.0,1-10,Private,,,,,,2,1,2022,42778,False,False
vendit,2020-01-01,https://www.vendit.xyz,"Wilmington, Delaware, United States","Data and Analytics, Design, Other, Sales and Marketing","B2B, Lead Generation, Market Research",1146835.0,"vendit offers b2b data solutions, b2b demand generation, b2b lead generation, b2b market research, and revenue escalation services. they provide inquiries through phone calls, emails, and online applications.",51-100,0.0,,,0.0,,0.0,1.0,51-100,Private,,,,,,6,4,2020,54805,False,False
TeleDaddy,2019-07-04,https://www.teledaddy.com/,"Gotha, Florida, United States",Health Care,"Health Care, Medical, Telehealth, Wellness",1210042.0,TeleDaddy is direct-to-consumer telehealth company handling everything from diagnosis by US licensed physician to delivery of prescribed medication. TeleDaddy also working on innovative ways to save customers on all other medication.,11-50,0.0,,,0.0,,0.0,1.0,11-50,Private,,,,,,6,4,2019,56061,False,False
Pivotal Biologics,2020-01-01,https://pivotalbiologics.com,"Dallas, Texas, United States","Data and Analytics, Design, Health Care, Manufacturing","Manufacturing, Medical Device, Product Research",1216013.0,"Pivotal Biologics convert cutting-edge research in human biology to products that can replenish the healing environment in everybody. The promise of regenerative medicine is revealing itself every day as research and applications grow, but navigating new companies in the market can be hard, especially if they have not kept up with the science or shown a commitment to setting or meeting standards. Pivotal follows an all-encompassing ethos of truth, trust, and transparency. They hold themselves to the highest standards of product development, product communication, regulatory compliance, and safety.",11-50,0.0,,,0.0,,0.0,1.0,11-50,Private,,,,,,6,4,2020,55912,False,False
MagGenix,2021-03-01,https://maggenix.bio/,"Baltimore, Maryland, United States","Biotechnology, Health Care, Science and Engineering","Biopharma, Biotechnology, Medical, Therapeutics",399446.0,"MagGenix is developing a magnetogenetic cell therapy platform that enables the electromagnetic activation of engineered cells within clinical, industrial, and research settings. From a healthcare perspective, our technology allows for localized therapeutic activation with adjustable intensity. MagGenix-enabled CAR-T cells may replicate and function exclusively at tumor sites, while engineered regulatory T cells can secrete anti-inflammatory antibodies only at inflamed locations (e.g., arthritic joints). In doing so, we allow for localized immunostimulation/immunosuppression without disrupting the entirety of the body’s immune system, all through non-invasive electromagnetic stimulation. Within bioproduction, our system allows for cellular activation and modulation in batch or chemostatic bioreactors. It grants the ability to modulate, change, and halt synthesis in large-scale bioreactors with ultra-cost-efficient magnetic stimulation. Within research, the MagGenix-platform can solidify magnetogenetics as the clear successor of opto-/chemo- genetic processes to perturb and study biological systems. ​ MagGenix looks to pioneer its magnetogenetic cell therapy platform for patients, pipettes, and production.",1-10,0.0,,,0.0,,0.0,1.0,1-10,Private,,,,,,6,3,2021,33823,False,False
MedsNow,2021-06-01,https://www.medsnow.com,"New York, New York, United States","Financial Services, Health Care, Payments, Software","Health Care, Payments, Pharmaceutical, SaaS, Software",258000.0,,1-10,1.0,Seed,2023-06-20,0.0,Seed,0.0,2.0,1-10,Private,,,0.0,1.0,,2,2,2021,26284,False,False
HiveStrong,2020-01-01,https://www.hivestrongempower.com,"Fort Lauderdale, Florida, United States","Health Care, Media and Entertainment, Professional Services","Advice, Consulting, Mental Health, Personal Health",1546108.0,"HiveStrong offers tailored mental health care through a combination of coaching, cooperation, and services. They promote and develop long-term survivor empowerment, which is critical to attaining positive outcomes. They provide coaching with a customized plan, strategy, and client team for each client based on their specific set of circumstances.",1-10,0.0,,,0.0,,0.0,,1-10,Private,,,,,,6,4,2020,63291,False,False
Perwatch,2022-03-03,https://www.perwatch.com,"Dover, Delaware, United States","Information Technology, Software","Information Technology, Software",2204483.0,"Perwatch analyzes the collected tracking data in the most beneficial way for you. It allows their clients to access accurate and personalized data that is not available in any application, with an advanced productive/unproductive analysis customized for their company. Not only does it score their staff, it also makes an overall analysis of their company and provides them with performance analysis, whether daily or up to the year.",1-10,0.0,,,0.0,,0.0,1.0,1-10,Private,,,,,,6,2,2022,74778,False,False
GetGloby,2021-01-01,https://www.getgloby.ai/,"New York, New York, United States","Artificial Intelligence (AI), Data and Analytics, Information Technology, Science and Engineering, Software","Artificial Intelligence (AI), Information Technology, Machine Learning",61251.0,,11-50,1.0,Seed,2022-03-20,1300000.0,Pre-Seed,1300000.0,2.0,11-50,Private,,,,,,0,3,2021,8343,False,False
Kosciusko Connect,2021-01-01,https://kosciuskoconnect.com,"Warsaw, Indiana, United States","Hardware, Information Technology, Internet Services, Messaging and Telecommunications, Other","Commercial, Internet, Telecommunications, VoIP",1629561.0,"Kosciusko Connect offers residential services such as residential internet, residential phone, and streaming TV services. They provide mobile app features that include viewing and managing all connected devices, creating a guest wi-fi network, changing the wi-fi name and password, and running speed tests and troubleshooting. They also provide residential phone services for call blocking, call forwarding, call logging, call return, and call waiting.",11-50,0.0,,,0.0,,0.0,,11-50,Private,,,,,,6,3,2021,64787,False,False
Auryon Atherectomy System,2020-01-01,https://www.auryon-system.com,"Latham, New York, United States",Health Care,"Assistive Technology, Health Care, Medical Device",2360772.0,Auryon Atherectomy System represents a technological breakthrough among medical devices used in procedures to treat peripheral arterial disease. Their system is designed with technology and features that allow you to treat any lesion.,501-1000,0.0,,,0.0,,0.0,,501-1000,Private,,,,,,6,4,2020,78862,False,False
Inner AI,2021-01-01,https://www.innerai.com,"Santa Monica, California, United States","Media and Entertainment, Video",Video,214298.0,,1-10,1.0,Seed,2023-10-01,0.0,Seed,0.0,,1-10,Private,,,,,,2,3,2021,23211,False,False
Jobatto,2022-01-01,https://jobatto.com,"San Francisco, California, United States","Advertising, Commerce and Shopping, Other, Professional Services, Sales and Marketing","Advertising, Freelance, Marketplace, Peer to Peer",285983.0,"Jobatto is an all-inclusive freelance platform that provides numerous features for freelancers and employers, and the best part is that it's completely free. Our platform allows freelancers to directly connect with employers, creating lasting professional relationships and empowering them to take control of their careers. Jobatto simplifies the process with various features including freelance jobs, job bids, unpaid internships, advertising services and products, and crypto payments. Our main source of revenue is from displaying ads, so you can enjoy our platform's benefits without any fees or hidden charges.",1-10,0.0,,,0.0,,0.0,,1-10,Private,,,,,,6,2,2022,27928,False,False
As One Insurance Group,2021-01-01,https://asoneig.com,"Phoenix, Arizona, United States",Financial Services,"Health Insurance, Insurance, Life Insurance",1514815.0,"As One Insurance Group provides life insurance, health insurance, and ancillary insurance. Their aim is to assist clients in protecting their health and lives while also maximizing benefits and cost savings for both them and their employers.",51-100,0.0,,,0.0,,0.0,,51-100,Private,,,,,,6,3,2021,62358,False,False
Pryzm,2022-06-01,https://www.pryzm.io,"Boston, Massachusetts, United States","Artificial Intelligence (AI), Data and Analytics, Government and Military, Science and Engineering, Software","Aerospace, Artificial Intelligence (AI), Government",118993.0,Field critical technology faster with an AI platform for government contract capture.,1-10,1.0,Seed,2023-01-01,0.0,Pre-Seed,0.0,2.0,1-10,Private,,,,,,2,1,2022,15369,False,False
Privacy Safeguard,2018-08-03,http://privacysafeguard.co,"Cleveland, Ohio, United States","Biotechnology, Data and Analytics, Information Technology, Science and Engineering, Software","Biometrics, Information Technology, SaaS, Software",2845101.0,"We are a team of scientists, business builders, and IT professionals coming together to secure access in an increasingly digital world. Our goal was to leverage the unique proprieties of each individual's face to make an access key that was suitable for a world filled with connected technologies.",1-10,0.0,,,0.0,,0.0,,1-10,Private,,,,,,6,5,2018,86926,False,False
"Marine BioEnergy, Inc",2020-03-13,https://www.marinebiomass.com/,"La Canada Flintridge, California, United States","Agriculture and Farming, Energy, Sustainability","AgTech, Clean Energy",691431.0,"Marine BioEnergy is developing a novel system to grow giant kelp in the open ocean. Kelp does not naturally grow in the deep ocean because there are no nutrients in the top layer and kelp needs a substrate for attachment. Marine BioEnergy is building unmanned drone submarines to tow long lines of kelp.  The drones will submerge the farms below the thermocline at night where nutrients are abundant and surface the farms during the day to absorb sunlight. The drones will also submerge the farms to avoid ships and storms. In preliminary testing conducted by a team at the University of Southern California Wrigley Institute, the depth-cycled kelp is growing as well or better than the control kelp. If the kelp continues to thrive in the open ocean environment, the next step is to deploy farms to grow kelp as a biomass feedstock. The proof-of-concept experiments are funded by an award from the U.S. Dept of Energy, Advanced Research Projects Agency - Energy (ARPA-E). We are pleased to be part of the MARINER Program that ARPA-E has funded to launch ocean farming in the United States. (MARINER:  Macroalgae Research Inspiring Novel Energy Resources)",1-10,0.0,,,0.0,,0.0,,1-10,Private,,,,,,6,4,2020,44210,False,False
Just Enough Wines,2020-01-01,https://justenoughwines.com/,"San Francisco, California, United States","Food and Beverage, Sustainability","Food and Beverage, Sustainability, Wine And Spirits",316676.0,"Just Enough Wines is a producer of premium, great-tasting canned wines. It creates a wine that enables people to enjoy canned beverages that are more portable, convenient, and sustainable. The company was co-founded in 2020 by Jessica Hershfield and Kaitlyn Lo and is headquartered in San Francisco, California.",1-10,0.0,,,0.0,,0.0,2.0,1-10,Private,,,0.0,1.0,,6,4,2020,29688,False,False
ENOU Labs,2018-07-01,https://enou.co,"Wilmington, Delaware, United States","Design, Sales and Marketing, Software","Brand Marketing, Product Design, Software, UX Design, Web Design, Web Development",2298023.0,"A lot of startups struggle with designing and developing a product that is both effective and easy to use. This can be a huge challenge, and can often lead to a solution that doesn’t meet the needs of the customer. We are a digital product agency that specializes in designing and developing scalable products for startups. We understand the importance of having a great product and work tirelessly with our clients to make sure their products are not only effective but also easy to use.",11-50,0.0,,,0.0,,0.0,1.0,11-50,Private,,,,,,6,5,2018,78267,False,False
BirsCeo,2019-01-01,https://birsceo.com,"Fort Lauderdale, Florida, United States","Commerce and Shopping, Financial Services, Real Estate","Real Estate, Real Estate Investment, Rental",2004425.0,"BirsCeo company provides real estate investment services. They offer buying, selling, investing, and rental services. Their contact is done through phone and email.",1-10,0.0,,,0.0,,0.0,,1-10,Private,,,,,,6,5,2019,71773,False,False
LoanGlide,2019-01-01,https://www.loanglide.com,"Folsom, California, United States","Financial Services, Lending and Investments","Banking, Financial Services, FinTech, Lending",248012.0,"LoanGlide provides underwriting technology to assist businesses in growing by providing financing solutions to customers. The company is a point-of-sale financing solution for a wide range of industries. LoanGlide collaborates with a number of lenders to assist small businesses in providing financing to their customers. Small businesses can offer customers more convenient payment options and grow their business by utilizing LoanGlide's financing options and fast, convenient online loan platform.",11-50,0.0,,,0.0,,0.0,,11-50,Private,,,,,,6,5,2019,25622,False,False
airsales,2019-01-01,https://airsales.io/,"Santa Monica, California, United States","Information Technology, Sales and Marketing, Software","Marketing, Sales, Sales Automation",1289377.0,"airsales helps to book more meetings and close more deals at a fraction of the cost of hiring a sales development rep. They serve for mid-market tech companies, small agencies, startups, law firms, and medical practices.",11-50,0.0,,,0.0,,0.0,,11-50,Private,,,,,,6,5,2019,58850,False,False
Cookinat,2018-10-20,http://www.cookinat.com,"Miami Springs, Florida, United States","Apps, Food and Beverage, Mobile, Software","Apps, Food and Beverage, Mobile Apps, Software",719339.0,Cookinat is A top experience for chefs and diners. Is a mobile application based an on demand service to connect Chefs with Diners through the search and Select of the best Chefs dishes and Diners looking the best food to enjoy all at the comfort of your home!,1-10,1.0,Seed,2018-10-20,0.0,Pre-Seed,0.0,2.0,1-10,Private,,,,,,2,5,2018,45057,False,False
This Week in Fintech,2019-08-01,https://thisweekinfintech.com/,"New York, New York, United States","Content and Publishing, Financial Services, Media and Entertainment","Finance, FinTech, News",456357.0,"This Week in Fintech is a weekly digest of news, opinions, and all things financial technology. It was founded by Nik Milanović in 2019 and is based in New York, United States.",1-10,0.0,,,0.0,,0.0,1.0,1-10,Private,,,0.0,1.0,,6,4,2019,36230,False,False
Tenfold Coffee Company,2020-01-01,https://tenfoldcoffee.com,"Houston, Texas, United States","Commerce and Shopping, Food and Beverage","Coffee, Food and Beverage, Wholesale",2172706.0,,1-10,0.0,,,0.0,,0.0,,1-10,Private,,,,,,6,4,2020,75328,False,False
Hadarin,2020-01-01,https://www.hadarin.io,"New York, New York, United States","Information Technology, Privacy and Security, Professional Services","Information Technology, Risk Management, Security",1637199.0,"Hadarin is a company that operates in the information technology, risk management, and security sectors. The company utilizes artificial intelligence to provide managed risk services, focusing on predictive analytics. It offers solutions that allow users to analyze and visualize their risk portfolio. The company's services are designed to help businesses understand and manage their risks more effectively, using advanced technology to provide insights and predictions.",11-50,0.0,,,0.0,,0.0,,11-50,Private,,,,,,6,4,2020,64629,False,False
JourneyBinder,2018-04-20,http://journeybinder.com,"Beverly Hills, California, United States","Education, Software","Education, Software",1648056.0,JourneyBinder is a software platform that allows individuals to create ad-hoc crews around a purpose and activate effective action plans,1-10,0.0,,,0.0,,0.0,1.0,1-10,Private,,,,,,6,5,2018,65985,False,False
Veneer,2020-01-01,https://www.helloveneer.com/,"New York, New York, United States","Administrative Services, Advertising, Sales and Marketing, Software","Advertising, Marketing, Software, Virtual Workforce",779372.0,"A client facing, fluid and comprehensive client management solution for the marketing world.",1-10,0.0,,,0.0,,0.0,2.0,1-10,Private,,,,,,6,4,2020,46692,False,False
Adexpress,2021-01-01,https://www.adexpress.co,"North Port, Florida, United States","Advertising, Design, Sales and Marketing","Advertising, Email Marketing, Marketing, Web Design",640089.0,,1-10,0.0,,,0.0,,0.0,,1-10,Private,,,,,,6,3,2021,42719,False,False
Integrare Group,2019-01-01,https://www.integrare.la,"Los Angeles, California, United States","Administrative Services, Other, Real Estate","Architecture, Construction, Project Management, Residential",390093.0,,11-50,0.0,,,0.0,,0.0,1.0,11-50,Private,,,,,,6,5,2019,33411,False,False
YourStore.Com,2020-01-01,https://www.yourstore.com,"Southlake, Texas, United States","Commerce and Shopping, Information Technology, Internet Services, Professional Services","E-Commerce, Information Services, Information Technology, Management Consulting, Search Engine",1785373.0,"YourStore.Com helps eCommerce business increase their revenue by creating and managing campaigns that maximize search engine optimization. The company transforms the eCommerce brand's digital footprint and increases your bottom line. It was founded in 2020 and is located in Southlake, Texas.",1-10,0.0,,,0.0,,0.0,,1-10,Private,,,,,,6,4,2020,67903,False,False
ARX Energy,2020-03-05,https://www.arxenergy.com/,"Addison, Texas, United States",Other,Service Industry,499618.0,"ARX Energy is A Crude Oil and Refined Products Midstream and Downstream Logistics, Terminalling and Refining Company in Texas.",11-50,0.0,,,0.0,,0.0,,11-50,Private,,,,,,6,4,2020,37880,False,False
RiYSA,2021-01-01,https://riysalab.com,"Houston, Texas, United States","Education, Information Technology, Internet Services, Software","Cloud Computing, Information Technology, Training",3025475.0,,11-50,0.0,,,0.0,,0.0,,11-50,Private,,,,,,6,3,2021,88785,False,False
Almond Tree Group,2020-01-01,https://www.almondtreegroup.com,"Daytona Beach, Florida, United States","Internet Services, Professional Services, Sales and Marketing","Business Development, Marketing, SEO, Social Media Marketing",2521635.0,"Almond Tree Group specializes in marketing, SEO, business automation, social media influence, brand recognition, and building offshore teams. Their customers contact them through email, mobile, and online applications.",1-10,0.0,,,0.0,,0.0,,1-10,Private,,,,,,6,4,2020,82545,False,False
Realio,2018-08-29,https://realio.fund,"New York, New York, United States","Financial Services, Lending and Investments, Other, Real Estate","FinTech, Peer to Peer, Real Estate, Trading Platform",113433.0,"Realio is a multi-strategy digital private equity firm that uses a web-based platform to support the creation and issuance of digital, blockchain-based tokens. The company's systematic and secure approach, allows them to support digital fundraising and ongoing management for fund managers looking to create, raise and manage funds digitally using blockchain. This in turn enables the easy management of investors through a digital platform, widening access to new investors while automating compliance obligations.",11-50,0.0,,,0.0,,0.0,2.0,11-50,Private,,,0.0,1.0,,6,5,2018,14781,False,False
Zanjero,2022-01-01,https://zanjeroams.com,"Sacramento, California, United States","Data and Analytics, Energy, Professional Services, Sales and Marketing","Analytics, Consulting, Energy, Marketing",1404368.0,,1-10,0.0,,,0.0,,0.0,,1-10,Private,,,,,,6,2,2022,59762,False,False
INK Games,2019-01-01,https://www.inkgames.com,"Austin, Texas, United States","Gaming, Information Technology, Software","Gaming, Information and Communications Technology (ICT), Online Games, Software",101763.0,"INK Games is the ONLY platform with a viral tracking and payment engine that will connect millions of people together globally, allowing players to perpetually participate in the revenues that flow through their personal invites, connections, and viral reach. The INK Games Platform is creating the future of how players participate in the leisure economy by allowing them, for the first time ever, to track and monetize their global connectivity and viral reach – in perpetuity.   The INK Platform allows creators, influencers, players, in fact anyone with a smartphone, to earn revenue and get paid for their following, right from their phone.  For influencers, this means no more one-time payments from brands, no more turning one’s entire following over to brands through one-off campaigns.  It’s our vision to connect the world through INK IDs (user handles), and pay all users on the revenues that flow through their global connectivity, day-in and day-out…perpetually. Core to the INK Platform is the Company’s proprietary payment and tracking engine, which dynamically maps each user’s global viral audience, algorithmically converts platform engagement into an Impact Score, then pays users perpetually on their score.  This is a big moment for the gaming industry.  This proprietary technology is sorely needed as we transition into a new era of community economics in gaming. An award-winning group of gaming visionaries and development experts from EA, Zynga, SciPlay, and Buffalo Studios, the INK Games team has a track record of scaling mass-market franchises and achieving exceptional outcomes for investors and shareholders. The team has made significant technological advances in developing the INK platform, which will shift power from major marketing gatekeepers back to creators, influencers, players, and game developers.",11-50,4.0,Early Stage Venture,2022-08-05,18750000.0,Series B,29325000.0,3.0,11-50,Private,,,,,,0,5,2019,13493,False,False
C3 Produce,2019-01-01,https://www.c3produce.com,"Missoula, Montana, United States","Agriculture and Farming, Sustainability","Agriculture, Farming, Organic",143204.0,"C3 Produce engages in commercial vertical farming that addresses the issues faced while growing leafy green vegetables. Its services are designed to deliver freshly harvested produce bi-weekly with less than a few hours of transport time, enabling consumers to get fresh produce directly from farms. The company was founded in 2019 and is based in Missoula, Montana.",1-10,1.0,Seed,2021-09-30,135000.0,Seed,135000.0,,1-10,Private,,,,,,0,5,2019,17721,False,False
Kuhn Law Group,2019-01-01,https://kuhnlawgroup.com,"Nyack, New York, United States","Government and Military, Media and Entertainment, Music and Audio, Privacy and Security, Professional Services","Intellectual Property, Law Enforcement, Legal, Music",1510543.0,,11-50,0.0,,,0.0,,0.0,,11-50,Private,,,,,,6,5,2019,62459,False,False
New England Human Services Collaborative,2021-01-01,https://www.nehsco.org,"Peabody, Massachusetts, United States","Health Care, Other, Professional Services, Social Impact","Elder Care, Employment, Health Care, Non Profit",2057164.0,"New England Human Services Collaborative is recruiting affiliates who value innovation and believe in a person-centered approach. They aim to cover the gamut of human services at all stages of life. Their services include intellectual and developmental disability, substance abuse, food insecurity, family support, health care, and employment services.",1001-5000,0.0,,,0.0,,0.0,,1001-5000,Private,,,,,,6,3,2021,72420,False,False
Cali,2019-01-01,http://www.calibalanceinc.com,"Houston, Texas, United States",Health Care,"Health Care, Medical, Medical Device, Wellness",1647526.0,,1-10,0.0,,,0.0,,0.0,1.0,1-10,Private,,,,,,6,5,2019,65995,False,False
Digital Packages 360˚,2020-01-01,https://digitalpackages360.com/,"Colorado Springs, Colorado, United States","Advertising, Internet Services, Sales and Marketing","Advertising, Digital Marketing, Lead Generation, SEO",1608370.0,,1-10,0.0,,,0.0,,0.0,,1-10,Private,,,,,,6,4,2020,65189,False,False
West Michigan Mental Health,2022-01-01,https://www.wmmentalhealth.com,"Grand Rapids, Michigan, United States",Health Care,"Addiction Treatment, Health Care, Medical, Mental Health, Wellness",1965641.0,West Michigan Mental Health is a tool that connects local mental health patients with the network of resources available. They help patients find educational resources and profiles of organizations. They help individuals struggling with alcoholism find the help they need on a local basis.,1-10,0.0,,,0.0,,0.0,,1-10,Private,,,,,,6,2,2022,70815,False,False
Goldenberry Farms,2019-01-01,https://www.goldenberryfarms.com,"Miami, Florida, United States","Agriculture and Farming, Food and Beverage","Agriculture, Farming, Food and Beverage, Fruit",487377.0,"Goldenberry Farms is a sustainable grower, packer, and provider of farm-fresh fruit, including our exclusive sugar mangos, passionfruit, golden berries, and dragonfruit. Their customers contact them through address, phone, mail, and online applications.",51-100,0.0,,,0.0,,0.0,,51-100,Private,,,0.0,1.0,,6,5,2019,37445,False,False
