Limitless Physical Therapy & Wellness,2020-01-01,https://www.limitlessptla.com,"Los Angeles, California, United States","Health Care, Sports","Fitness, Health Care, Therapeutics, Wellness",1506642.0,,1-10,0.0,,,0.0,,0.0,,1-10,Private,,,,,,6,4,2020,62535,False,False
HMA Equity Credit (HEC),2019-02-02,https://hmaequity.com,"San Francisco, California, United States","Consumer Goods, Food and Beverage, Information Technology, Manufacturing","Consumer Goods, Food and Beverage, Industrial, Information Technology",1440998.0,"HMA Equity Credit is an operations improvement consulting firm that breaks through the traditional barriers of the consultant-client relationship. We are hands-on consultants who deliver real results and no excuses. HMA Equity Credit helps companies, with significant and complex operating asset structures around the world, improve their profitability by increasing revenue and customer service and satisfaction while reducing operating costs, fixed overhead, and working capital.",11-50,0.0,,,0.0,,0.0,,11-50,Private,,,,,,6,5,2019,60626,False,False
Arke Inc.,2022-12-29,https://www.arkeglobal.com,"Chicago, Illinois, United States",Transportation,Transportation,691331.0,"Arke is specializing in designing and manufacturing electric conversion systems for bicycles and vehicles. In an era marked by growing concerns about climate change and the environmental impact of the transportation industry, we envision a promising opportunity to bring a sustainable shift through retrofit electrification. Our method is proven to drive down the cost of owning an electric vehicle to 10%. We focus on creating high-quality, affordable, and user-friendly products that our customers can trust. Picture green transportation and mobility integrated into the circular economy.",1-10,0.0,,,0.0,,0.0,1.0,1-10,Private,,,,,,6,1,2022,44209,False,False
Tender,2022-01-01,https://tenderco.co/,"New York, New York, United States","Apps, Community and Lifestyle, Health Care, Mobile, Software","Lifestyle, Mobile Apps, Personal Health, Wellness",189037.0,,1-10,1.0,Seed,2022-01-01,0.0,Pre-Seed,0.0,,1-10,Private,,,,,,2,2,2022,21307,False,False
Cravy's,2021-01-01,http://www.cravys.com,"Claymont, Delaware, United States","Commerce and Shopping, Food and Beverage, Transportation","E-Commerce, Food Delivery, Marketplace",654419.0,Online marketplace enabling top Mediterranean restaurants to ship their authentic meals nationwide.,1-10,1.0,Seed,2021-12-14,0.0,Pre-Seed,0.0,2.0,1-10,Private,,,,,,2,3,2021,43172,False,False
Alpha Precision Media,2020-01-01,https://www.alphaprecisionmedia.com,"New York, New York, United States","Advertising, Media and Entertainment, Music and Audio, Sales and Marketing, Video","Advertising, Audio, Content Marketing, Marketing, TV, Video",685271.0,"Alpha Precision Media provides media planning, buying, and analytics services.",11-50,0.0,,,0.0,,0.0,,11-50,Private,,,,,,6,4,2020,44029,False,False
Panavance Therapeutics,2021-01-01,https://panavance.com/about-panavance,"Berwyn, Pennsylvania, United States",Health Care,"Oncology, Pharmaceutical, Therapeutics",312184.0,Panavance Therapeutics is a clinical-stage pharmaceutical company that advances the development of GP-2250 novel oncology therapeutics focused on improving the effectiveness of cancer treatments.,11-50,0.0,,,0.0,,0.0,,11-50,Private,,,,,,6,3,2021,29442,False,False
Flexia Payments,2020-01-01,https://www.flexiapayments.com/,"Las Vegas, Nevada, United States","Financial Services, Payments, Travel and Tourism","Casino, Finance, FinTech, Payments",245511.0,"Flexia is a specialty fintech company that offers an omnichannel platform built specifically for cashless gaming, without limitations of legacy systems or constraints of outdated modalities. The multi-account “Flexia” Mastercard debit card/cashless gaming card is integrated into casino management systems and other closed-loop platforms, such as online wagering accounts.  Customers can move funds seamlessly among the accounts using the Flexia mobile application.  The Flexia Platform controls instant card issuance at casino locations, as well as general account management functions, and provides casinos with unique marketing and promotional tools.  Flexia is currently fully integrated into the Win Systems casino management system (used in 20 countries) which has a growing footprint in the US. The  company is headquartered in Las Vegas, Nevada.",1-10,0.0,,,0.0,,0.0,,1-10,Private,,,1.0,3.0,Computing; Calculating,6,4,2020,25463,False,False
Voxable,2021-04-01,http://voxable.io/,"Austin, Texas, United States",Software,Software,422562.0,"Voxable is a developer of a commercial platform for voice and chat applications. Enterprises can streamline conversation design and successfully communicate with teams and stakeholders thanks to the company's platform, which replaces the spreadsheets, documents, and diagrams teams presently use to build and manage conversations.",1-10,3.0,Seed,2022-06-17,0.0,Seed,0.0,3.0,1-10,Private,,,,,,2,2,2021,34861,False,False
CDL Academy,2019-01-01,http://www.cdlacademy.net,"Fort Smith, Arkansas, United States","Education, Transportation","Education, Transportation",1956570.0,,11-50,0.0,,,0.0,,0.0,1.0,11-50,Private,,,,,,6,5,2019,70994,False,False
Trolley,2022-01-01,https://usetrolley.com,"Irvine, California, United States","Commerce and Shopping, Food and Beverage, Software","Marketplace, Restaurants, Software",124940.0,"Trolley is a Food Discovery Platform that offers customers a convenient marketplace app where they can discover, share, and order food — all at no cost to the restaurant or customer.",1-10,2.0,Seed,2019-11-15,130000.0,Pre-Seed,180000.0,2.0,1-10,Private,,,,,,0,2,2022,15972,False,False
Sobah Systems,2020-01-01,https://sobahsystems.com,"Flower Mound, Texas, United States","Apps, Artificial Intelligence (AI), Data and Analytics, Design, Mobile, Software","Machine Learning, Mobile Apps, Software, Web Design, Web Development",2310662.0,,11-50,0.0,,,0.0,,0.0,,11-50,Private,,,,,,6,4,2020,78079,False,False
Roofing Companies Mobile,2018-09-13,https://roofingcompaniesmobile.com,"Mobile, Alabama, United States",Real Estate,Home Services,2384394.0,"Roofing Companies Mobile prides itself on our reputation for honesty, integrity, and commitment to our work. If you have water leakages with your current roof, then we’re here to help you. We fix them quickly as we understand how inconvenient this is to your life. After careful examination of the issues your roof is experiencing, we provide recommendations for the proper roof replacement only if we are 100% certain that this is the best and only option. Roof replacement may be more expensive initially, but it also can save you in the long run. With the expertise that we’ve gained over the years, you can rest assured that everything is going to be handled professionally.",51-100,0.0,,,0.0,,0.0,,51-100,Private,,,,,,6,5,2018,79994,False,False
Stellus Rx,2022-01-01,https://www.stellusrx.com,"Plano, Texas, United States",Health Care,"Health Care, Hospital, Medical, Nursing and Residential Care",214548.0,,51-100,0.0,,,0.0,,0.0,1.0,51-100,Private,,,0.0,0.0,,6,2,2022,23232,False,False
Laikad,2019-01-01,https://www.laikad.com,"Miami, Florida, United States","Advertising, Sales and Marketing","Advertising, Content Marketing, Digital Marketing, Marketing",575634.0,"Laikad provides digital advertising, influencer marketing, user acquisition, mobile content, and media buying services. They also provide digital solutions for their customers' needs.",1-10,0.0,,,0.0,,0.0,,1-10,Private,,,,,,6,5,2019,40620,False,False
Nordblooms,2020-09-15,https://www.nordblooms.com,"New York, New York, United States","Commerce and Shopping, Consumer Goods, Other","B2B, E-Commerce, Flowers, Retail",1910054.0,"Nordblooms is a New York based premium florist applying Scandinavian design to flowers curating sustainable arrangements for interior design. Preserving the Art of Nature through our cutting-edge technology and focus on eco-friendly practices, we specialize in bio-preserved flowers that maintain their freshness and beauty for up to one year. Each bouquet is hand tied and shipped directly to our customers through our e-commerce store and delivered in our signature delivery box.",1-10,0.0,,,0.0,,0.0,1.0,1-10,Private,,,,,,6,3,2020,70167,False,False
Frisk Brothers Moving,2019-01-01,https://www.friskbrothersmoving.com,"Kansas City, Missouri, United States","Administrative Services, Consumer Goods, Other, Real Estate","Commercial, Fast-Moving Consumer Goods, Packaging Services, Residential",2268014.0,,11-50,0.0,,,0.0,,0.0,1.0,11-50,Private,,,,,,6,5,2019,77143,False,False
Oceana,2020-01-01,https://www.oceana.work,"Portola Valley, California, United States",Software,Software,3008827.0,"Oceana is an innovation process + technology platform that supports organizations aspiring to become innovative cultures.     Offering a proprietary bottom’s up innovation process and a platform for talent development and risk-taking, Oceana captures what’s on the minds of employees, executes on their ideas, and reveals the hidden talents of every employee (not just the job they were hired for).  From idea creation to commercialization, Oceana captures ideas around opportunity spaces, pain points, and under-addressed needs from every person of every corner of the company in a safe and trusted environment — all in support of incremental ideas, cost-cutting measures or new revenue streams for growth.    Based on the proven research and work of Deborah Perry Piscione (author of the global best-seller Secrets of Silicon Valley and architect of the Oceania Innovation Process), Oceana (the innovation process) has been brought to large enterprises and is in collaboration with a leading management consulting firm.",1-10,0.0,,,0.0,,0.0,1.0,1-10,Private,,,,,,6,4,2020,89010,False,False
Level,2020-01-01,https://www.levelleaders.com,"New York, New York, United States","Financial Services, Lending and Investments",Venture Capital,536933.0,,1-10,0.0,,,0.0,,0.0,,1-10,Private,,,,,,6,4,2020,39266,False,False
HOPE Toledo,2020-01-01,https://www.hope-toledo.org/,"Toledo, Ohio, United States","Education, Other, Social Impact","Education, Non Profit",2427946.0,,1-10,0.0,,,0.0,,0.0,,1-10,Private,,,,,,6,4,2020,80900,False,False
Platinum Medical Management,2020-04-30,https://www.platinumneighbors.com,"Wylie, Texas, United States","Community and Lifestyle, Education, Financial Services, Health Care, Professional Services","Adult, Bookkeeping and Payroll, Consulting, Health Care, Training",1047081.0,"Platinum Medical Management provides health care services. They offer employee payroll, call center, memory care, rehabilitation centers, outpatient therapy centers, transitional care, staff training, and adult day care services.",251-500,0.0,,,0.0,,0.0,,251-500,Private,,,,,,6,3,2020,52651,False,False
Zenith Dental IT,2019-06-01,https://zenithdentalit.com/,"San Antonio, Texas, United States",Health Care,Health Care,1304203.0,Our team of experienced engineers provide leading dental IT services to the largest DSO's and independent practices across the nation.,51-100,0.0,,,0.0,,0.0,1.0,51-100,Private,,,,,,6,4,2019,58530,False,False
Motif Digital,2021-01-01,https://motif.digital,"Oceanside, California, United States","Advertising, Content and Publishing, Design, Media and Entertainment, Sales and Marketing","Advertising, Brand Marketing, Creative Agency, Digital Marketing, Web Design",813208.0,,11-50,0.0,,,0.0,,0.0,,11-50,Private,,,,,,6,3,2021,47599,False,False
AdmissionWiz,2021-01-03,https://www.admissionwiz.com,"Dublin, Ohio, United States","Education, Software",EdTech,2514064.0,"AdmissionWiz is an Education Technology company based in Columbus, Ohio. It is founded by ex-international students, who once embarked on a challenging journey to pursue higher education. Learning from their own experience, and with a vision to help thousands of future students, they created the AdmissionWiz platform to streamline the process and fix a broken system. Our mission is to empower international students who aspire to pursue higher education in the United States by providing them with the right tools to turn their dream into reality. Our Vision is to establish ourselves as a proven guide and resource for aspiring students from around the world and as a trusted partner for US universities and colleges looking for support with their campus internationalization.",1-10,0.0,,,0.0,,0.0,2.0,1-10,Private,,,,,,6,3,2021,81102,False,False
Recomm,2020-01-01,https://www.recomm.app/,"San Francisco, California, United States","Artificial Intelligence (AI), Commerce and Shopping, Data and Analytics, Information Technology, Internet Services, Messaging and Telecommunications, Other, Professional Services, Sales and Marketing, Science and Engineering, Software","Artificial Intelligence (AI), Consumer Reviews, Content Marketing, Customer Service, E-Commerce, Information Technology, Lead Generation, Sales, Software, Video Chat",347653.0,Boost online store sales with shoppable videos on the product page.,1-10,0.0,,,0.0,,0.0,1.0,1-10,Private,,,0.0,1.0,,6,4,2020,31368,False,False
Intelus,2021-11-01,https://intelus.ai,"Seattle, Washington, United States","Artificial Intelligence (AI), Data and Analytics, Science and Engineering, Software","Artificial Intelligence (AI), Machine Learning, Software, Text Analytics",387319.0,"Intelus creates no-code, no-data-science AI solutions that put the power of data in the hands of domain experts at a fraction of the cost.",1-10,0.0,,,0.0,,0.0,,1-10,Private,,,,,,6,2,2021,33277,False,False
SEO Minister | SEOMinister,2020-01-01,https://www.seominister.com,"Dallas, Texas, United States",Sales and Marketing,Marketing,3208836.0,"SEO Minister has made life easy for many brands over the globe through our perfect content marketing services. Everyone has a social media page or website, concisely has an online presence. To rank your business at the top you must have relent content that fabricated your website and help to maintain at the top in search engine. Choosing a SEOMinister for content management is a worthwhile decision to generate more traffic on your site. We have the experience and best content managers that guarantee that majority of your audience will see your site. We help you to realize that by utilizing SEO techniques you can improve your ranking.",51-100,0.0,,,0.0,,0.0,,51-100,Private,,,,,,6,4,2020,90769,False,False
Boone Residential,2020-01-01,https://www.booneresidential.com,"Richmond, Virginia, United States","Professional Services, Real Estate, Sales and Marketing","Consulting, Real Estate, Rental Property, Sales",1767114.0,,1-10,0.0,,,0.0,,0.0,1.0,1-10,Private,,,,,,6,4,2020,68237,False,False
Syntegra,2022-01-01,https://syntegra.net/,"New York, New York, United States","Information Technology, Internet Services","Information Technology, Internet of Things",624910.0,"Syntegra provides solutions for the internet of things, mobile services, and Wi-Fi smart connection. They serve industries, automobile, E-Commerce and retail, financial services, healthcare, hospitality, IT & ICT, manufacturing, non-profit organizations, and the public sector industries.",51-100,0.0,,,0.0,,0.0,,51-100,Private,,,,,,6,2,2022,42215,False,False
Foundation Goods,2020-01-01,https://www.foundationgoods.com,"Salt Lake City, Utah, United States","Commerce and Shopping, Real Estate","E-Commerce, Home Decor, Retail",2588797.0,"Foundation Goods is a curated home goods store that offers a variety of products and services. They provide a selection of furniture and decor items to elevate everyday living spaces. Additionally, they offer design services and a designer trade program, allowing for a more personalized shopping experience. They also provide fabric care services, ensuring the longevity of their products. To further assist their customers, they offer a product inquiry service, gift cards, and the option to order swatches.",11-50,0.0,,,0.0,,0.0,,11-50,Private,,,,,,6,4,2020,83060,False,False
Build Financial,2018-05-01,http://www.buildfinancial.com,"New York, New York, United States",Financial Services,"Financial Services, FinTech",339184.0,Build Financial Technology provides instant emergency savings benefits to employers and partners,1-10,1.0,Seed,2020-08-01,0.0,Seed,0.0,,1-10,Private,,,,,,2,5,2018,30905,False,False
Zeleus,2020-01-01,https://zeleus.com/,"Boston, Massachusetts, United States","Education, Professional Services","Career Planning, Corporate Training, Training",410442.0,,1-10,0.0,,,0.0,,0.0,1.0,1-10,Private,,,,,,6,4,2020,34321,False,False
"BlackwellTh Company, Inc.",2021-08-27,https://www.bdpegroup.com,"Los Angeles, California, United States",Media and Entertainment,Digital Entertainment,1605144.0,A digital media & marketing production company dedicated to creating social change through community action and artistry.,1-10,0.0,,,0.0,,0.0,1.0,1-10,Private,,,,,,6,2,2021,65259,False,False
Chartnote,2020-01-27,https://www.chartnote.com,"Davis, California, United States",Health Care,Electronic Health Record (EHR),226952.0,"Chartnote is a productivity tool that helps doctors write medical notes faster using smart templates, voice recognition, and generative AI. Revenue Coverage Q1 2024 - not found",1-10,0.0,,,0.0,,0.0,1.0,1-10,Private,,,0.0,1.0,,6,4,2020,24186,False,False
Anchor Point Collective Inc.,2021-05-01,https://anchorpointcollective.com,"Savannah, Georgia, United States","Advertising, Professional Services, Sales and Marketing, Software","Advertising, Consulting, Marketing, Web Development",1411082.0,"Anchor Point Collective Inc. leverages holistic vantage point of business and design to provide clients with result-driven digital presences, backed by quantifiable value.",1-10,0.0,,,0.0,,0.0,1.0,1-10,Private,,,,,,6,2,2021,61257,False,False
project MIND,2019-01-01,https://www.projectmindhq.com,"North Las Vegas, Nevada, United States","Health Care, Other, Social Impact","Child Care, Health Care, Non Profit",2679685.0,"project MIND offers complete mental health care for people of all ages. The early intensive behavioral intervention, parent education, sibling sessions, and social skills programs.  It offers to give families the means to help their loved ones with developmental disorders.",11-50,0.0,,,0.0,,0.0,,11-50,Private,,,,,,6,5,2019,84734,False,False
Decision Tree Work,2021-01-01,https://www.decisiontree.work,"Olean, New York, United States","Administrative Services, Professional Services","Employment, Recruiting, Staffing Agency",1822590.0,"Decision Tree Work helps people find work that capitalizes on their skills and experiences while allowing them to work when they want to work and where they want to work. Industries they serve include hospitality, restaurant, green energy, construction, manufacturing, food processing, light industrial, information technology, medical staffing, security, and more.",10001+,0.0,,,0.0,,0.0,,10001+,Private,,,0.0,0.0,,6,3,2021,68775,False,False
PA Clinical Network,2019-01-01,https://paclinicalnetwork.com,"Mechanicsburg, Pennsylvania, United States",Health Care,"Health Care, Medical, Wellness",1798161.0,PA Clinical Network provides medical services on a regional and statewide basis. Their vision is to create a future for the practice of medicine by removing barriers and optimizing outcomes. They offer training and resources to practice as leaders or managers.,101-250,0.0,,,0.0,,0.0,,101-250,Private,,,,,,6,5,2019,67648,False,False
JST Events,2019-01-01,https://www.jstevents.com,"Rochester Hills, Michigan, United States","Administrative Services, Events, Food and Beverage, Media and Entertainment, Transportation","Catering, Event Management, Events, Logistics, Trade Shows, Transportation",614268.0,"JST Events provides consumer activation, corporate event, experiential training, and tradeshow solutions. Their services include staffing, transportation, sourcing competitive vehicles, trailer buildouts and booth designs, equipment rentals, budgeting, contracts and permits, event scheduling, catering, warehousing and office space, props and displays, drive course designs, and venue selections.",11-50,0.0,,,0.0,,0.0,,11-50,Private,,,,,,6,5,2019,41883,False,False
BE Mobile LLC,2019-01-01,https://nj-phone-buyers.business.site,"Boonton, New Jersey, United States","Commerce and Shopping, Consumer Electronics, Hardware","E-Commerce, Electronics",1196106.0,We buy iPhones in any condition in New Jersey. We are a direct buyer for iPhone. We buy any quantities. Currently only buying iPhone 8 and up. Sell your IPHONE with US,1-10,0.0,,,0.0,,0.0,,1-10,Private,,,,,,6,5,2019,56383,False,False
Vora Social,2020-01-01,https://www.vora-social.com/,"Los Angeles, California, United States","Apps, Internet Services, Mobile, Software","Mobile Apps, Social Network, Software",1439205.0,,1-10,0.0,,,0.0,,0.0,2.0,1-10,Private,,,,,,6,4,2020,60659,False,False
Parade,2021-01-01,https://tryparade.com,"New York, New York, United States","Commerce and Shopping, Internet Services","E-Commerce, Internet, Social Shopping",956011.0,"Parade focuses on helping brands in compelling online shopping experiences. Parade was founded in 2021 and was headquartered in New York, United States.",1-10,0.0,,,0.0,,0.0,1.0,1-10,Private,,,0.0,0.0,,6,3,2021,51270,False,False
Patient Square Capital,2020-01-01,https://patientsquarecapital.com,"Menlo Park, California, United States","Financial Services, Health Care","Finance, Financial Services, Health Care",128611.0,"Patient Square Capital focuses on a healthcare investment firm that partners with best-in-class management teams whose products, services, and technologies improve health. They use extensive industry expertise, a large network of relationships, and a partnership approach to help organizations develop and succeed.",1-10,0.0,,,0.0,,0.0,5.0,1-10,Private,,,,,,6,4,2020,16360,False,False
Woodley + Lowe,2019-12-01,https://www.woodleylowe.com/,"New York, New York, United States","Clothing and Apparel, Design","Apparel, Fashion",634073.0,"Woodley + Lowe is a digitally native lifestyle apparel brand hyper focussed on Gen Z girls. The brand fills a void in the market for teen apparel, with its everyday comfort driven essentials, a proprietary sizing system and sustainable fabrics. More than just offering apparel, Woodley + Lowe is a  platform for the Gen Z consumer that meets them how they shop and consume content today and is poised to be the forerunner of modern teen brands.",1-10,0.0,,,0.0,,0.0,2.0,1-10,Private,,,0.0,1.0,,6,4,2019,42517,False,False
Balata Data,2022-01-01,https://balatadata.com/,"Atlanta, Georgia, United States","Hardware, Information Technology, Professional Services","Consulting, Data Center, Information Technology",318559.0,"Balata Data is a company that specializes in data center solutions. Their services include system monitoring, AI-powered support systems, systems management, L4 engineering, OEM level troubleshooting, and an advanced ticketing platform. They also provide certified OEM parts. Balata Data offers support for multiple vendors, including HPE, Dell, Cisco, Lenovo, Sun/Oracle, and Supermicro. They also offer data erasure or destruction services for active failed parts under contract. Their erasure services ensure data from IT assets is erased safely, thoroughly, and in a certified manner that meets top industry standards.",11-50,0.0,,,0.0,,0.0,2.0,11-50,Private,,,,,,6,2,2022,29805,False,False
CityFront Innovations,2018-09-01,https://cityfront.ai/,"Southlake, Texas, United States","Government and Military, Information Technology, Software","GovTech, SaaS, Software",1223839.0,"A smart city SaaS platform that uses AI technology to integrate legacy city systems, making cities more efficient and service delivery cost effective",1-10,0.0,,,0.0,,0.0,1.0,1-10,Private,,,,,,6,5,2018,57148,False,False
MedCadre,2020-01-01,https://medcadre.com,"Boston, Massachusetts, United States","Health Care, Other","Health Care, Service Industry",751669.0,"The MedCadre ,Organizations are increasingly turning to locum tenens to solve their staffing needs, ensure patient access and continuity of care. The increased demand for healthcare services and the flexibility and benefits of practicing medicine as a locum tenens provider, more and more physicians, nurse practitioners, physician assistants, dentists are offering their specialized services as a locum tenens.",11-50,0.0,,,0.0,,0.0,,11-50,Private,,,,,,6,4,2020,45914,False,False
Jackfruit,2021-03-01,https://jackfruit.ai/,"Englewood, New Jersey, United States",Software,Software,795394.0,"Jackfruit is a job tracker that helps you seamlessly organize and track your job search progress. From auto-filling applications, tracking application progress, networking efforts, organizing documents to taking interview notes, writing to-do's and setting reminders - Jackfruit is your centralized platform for all things job search. Visualize your job hunt with this free tool now!",1-10,0.0,,,0.0,,0.0,,1-10,Private,,,,,,6,3,2021,47130,False,False
