website,text_len,source,text,type,closest_snapshot,closest_snapshot_time,snapshot_in_window
https://www.va.care/,36081,crunchbase,"Medical Virtual Receptionist Services | VAcare Skip to content Home Services Virtual Scribes Virtual Receptionist Virtual Administrative Assistant How it Works Pricing FAQ’s We are Hiring Menu Home Services Virtual Scribes Virtual Receptionist Virtual Administrative Assistant How it Works Pricing FAQ’s We are Hiring Get Started Our Services Virtual Medical Receptionist Foundational Training A Virtual Receptionist, whether in a medical, dental or veterinary office, handles the same tasks as a receptionist in any other Read More They perform routine tasks, such as answering incoming calls, taking messages, following up on reports, and any other tasks assigned to Our Virtual Receptionists are professionally trained and provide a high level of service on each and every Pick and Choose Who You Want to Work With Our clients get a dedicated VA to work with over the course of their time to maintain consistency of Read More It’s nice to hear a familiar voice every day and know that you can depend on the person you They will become accustomed to your workflow and will integrate seamlessly with your other office Trust and Safety (HIPAA Training) We take care of the tasks you would normally when you hire someone, like performing background checks and verifying HIPAA training Read More We check our prospective VA’s very rigorously before they become a member of our They are tested on technical computer skills and security We ensure they have no criminal record before they are featured in our As a client, you can check the information in their file before they are Security & Time Tracking All of our virtual receptionists are tested in technical skills as well as computer Read More We also handle all of the time tracking and security audits for Our virtual receptionists work in an office Let’s Get Started Virtual Receptionists The Facts on Virtual Receptionist Medical In a medical office, the first person a patient has contact with is your They expect to hear a friendly voice when they call to make an appointment or ask for your office A virtual receptionist medical is a remote worker who can answer your office calls during office hours or after hours . They can handle incoming calls, schedule and confirm appointments, answer patient inquiries, arrange referrals, and a dozen other Get Started Replace Your Existing Answering Service Ditch Your Current Answering Service Many practices rely on an medical answering service to respond to customer questions instead of an actual receptionist at the front While this ensures that patients can at least report issues, the reality is that many patients tend to hang up when they hear the cold, response message from the Our virtual receptionists can work during any office hours that you Get Started Reduce the Workload Lighten the Burden for Administrators A medical or dental practice is a busy place, and everyone has a job to There are patients to take care of, insurance billing, and tons of paperwork that accompanies them With so much paperwork to do, it often leaves less quality time for patients, and doctors feeling rushed to balance the Get Started Let s Start Discover What Can Do For Let us alleviate the stress of your day to day Get Started Contact Us Get in touch with Headquarters Park Floor New York, NY Call Us (833) Email Us Schedule Online Click on Get Started to schedule a call with our specialists to discuss your needs and choose your dedicated virtual Contact us via Live Chat Chat directly with our customer service team from this Call Call Us Call (833) to talk to our customer care Quick Links Home How it Works Pricing FAQ’s Blogs We are hiring Menu Home How it Works Pricing FAQ’s Blogs We are hiring What We Can Do Virtual Medical Receptionist Virtual Administrative Assistant Dental Virtual Assistants Veterinary Virtual Assistants Medical Transcription Legal Privacy Policy Terms of Service Menu Privacy Policy Terms of Service © All Rights Facebook Instagram   Wayback Machine We will keep fighting for all libraries - stand with us! Internet Archive logo A line drawing of the Internet Archive headquarters building faÃ§ade. Donate icon An illustration of a heart shape ""Donate to the archive"" Search icon An illustration of a magnifying Search icon An illustration of a magnifying Upload icon An illustration of a horizontal line over an up pointing Upload User icon An illustration of a person s head and Sign up | Log in Web icon An illustration of a computer application window Wayback Machine Texts icon An illustration of an open Books Video icon An illustration of two cells of a film Video Audio icon An illustration of an audio Audio Software icon An illustration of a "" floppy Software Images icon An illustration of two Images Donate icon An illustration of a heart shape Donate Ellipses icon An illustration of text More Hamburger icon An icon used to represent a menu that can be toggled by interacting with this Internet Archive Audio Live Music Archive Librivox Free Audio Feat",startup,"{'status': '200', 'available': True, 'url': 'http://web.archive.org/web/20211209054003/https://www.va.care/', 'timestamp': '20211209054003'}",20211209054003.0,1.0
https://dmtrend.com,10647,crunchbase,"Team - Digital Marketing Trend Home About Us Team Services Portfolios Contact Us Menu Home About Us Team Services Portfolios Contact Us Get Free Trial Team Home Team Expertise Awesome Team Billy Martin Founder Michael Desmon Samuel L Pritchard Social Media Expertise Arthur M Gains Web Developer Joseph L Harden SEO Expertise Steve Aoki Web Developer Samuel L Pritchard Photographer Gregory J Lindley Movie Editor Join Team Are You Expert On Creative Industry? Lorem ipsum dolor sit amet, consectetur adipiscing Ut elit tellus, luctus nec ullamcorper mattis, pulvinar dapibus Let s Talk Goovi is a template kit for digital marketing, creative agencies, and SEO Easy setup with Facebook Instagram Twitter Youtube Company Home About Us Team Services Portfolios Contact Us Menu Home About Us Team Services Portfolios Contact Us Services Home About Us Team Services Portfolios Contact Us Menu Home About Us Team Services Portfolios Contact Us Support Home About Us Team Services Portfolios Contact Us Menu Home About Us Team Services Portfolios Contact Us Copyright © Goovi, All rights Present by   Search Engine Optimization - Digital Marketing Trend Home About Us Team Services Web Development Web Design Search Engine Optimization Social Media Marketing Amazon Virtual Assistant Graphics Design Content Writing Web Hosting Portfolios Contact Us Menu Home About Us Team Services Web Development Web Design Search Engine Optimization Social Media Marketing Amazon Virtual Assistant Graphics Design Content Writing Web Hosting Portfolios Contact Us Get Free Trial Search Engine Optimization Search Engine Optimization Overview Search engine Optimization is a tool by which the website gets rank and increase the sales of SEO services are available for our prestigious clients to rank their website and carry their business in a competitive Our SEO experts use focus keywords to rank the website and use other tools like back links, On Off page SEO to create Our team promises to improve the quality and quantity of traffic in your The better visibility of your website only comes if it is SEO optimized and we make it What We Do We make sure that you get what you want from You just have to share your business information and we will quickly analyze it ad make a strategy We always do what we are committing with Just have trust and let us serve you with the Detail Service Our team provide all SEO services that you want from Optimization Optimization Technical Search Engine Optimization Website Analysis Keyword Research Search Engine Optimization Strategy Guest Posting Need Help? Don t hesitate to Contact Us We are always available to help Feel free to contact us Get an Appointment Need Custom Service? We are always available to help you Just contact us and we will provide you the best Contact Us Get Free Trial 7 Days We provide 7 days free trial for our services and if you like what we servie, then you can Get Details Digital Marketing Trend is your best friend for your business to grow more and more in the online Facebook Instagram Twitter Youtube Menu Home About Us Team Services Web Development Web Design Search Engine Optimization Social Media Marketing Amazon Virtual Assistant Graphics Design Content Writing Web Hosting Portfolios Contact Us Menu Home About Us Team Services Web Development Web Design Search Engine Optimization Social Media Marketing Amazon Virtual Assistant Graphics Design Content Writing Web Hosting Portfolios Contact Us Our Services Web Development Web Design Search Engine Optimization Social Media Marketing Amazon Virtual Assistant Graphics Design Content Writing Web Hosting Copyright © Goovi, All rights Present by   Web Design - Digital Marketing Trend Home About Us Team Services Web Development Web Design Search Engine Optimization Social Media Marketing Amazon Virtual Assistant Graphics Design Content Writing Web Hosting Portfolios Contact Us Menu Home About Us Team Services Web Development Web Design Search Engine Optimization Social Media Marketing Amazon Virtual Assistant Graphics Design Content Writing Web Hosting Portfolios Contact Us Get Free Trial Web Design Web Design Overview Web Designing is a vast field which covers graphic design, User Interface Design (UI) and many We will design your website that looks elegant and These tiny things are important for a website to make it stand out of You can choose the best template for your website and we will design the website according to Our team has web designing experts that will make your website alive and provide every solution to the What We Do We help you design your website in the way you We always want you to show attractive the digital Just prtch us your idea and we willmake it real for Detail Service We serve you in the following Web Design Site Designing Website Sections Designing Wbsite Redesigning Page Designing Need Help? Don t hesitate to Contact Us We are always available to help Feel free to contact us Get an Appointment Need Custom Service? We are always",startup,"{'status': '200', 'available': True, 'url': 'http://web.archive.org/web/20220111222728/https://dmtrend.com/', 'timestamp': '20220111222728'}",20220111222728.0,1.0
https://www.famometer.com,886,crunchbase," Skip to content Home About Services Contact Take Action Take Action Main Menu Home About Services Contact Take Action Take Action Template Create Your Website Lorem ipsum dolor sit amet, consectetur adipiscing Ut elit tellus, luctus nec ullamcorper mattis, pulvinar dapibus Services About Us Service 1 Service 2 Service 3 Amazing Things for You Always write benefits over Mention all the benefits or services with some real Focus on how you can help and benefit your Use simple words so that you don’t confuse Say as much in as few words as Speak directly to users using you not I or Our History Call to Action Lorem ipsum dolor sit amet, consectetur adipiscing Ut elit tellus, luctus nec ullamcorper mattis, pulvinar dapibus Contact Email about us Company Profile CSR Initiative Read Articles Media Kit connect Employee Portal Customer Portal Offices Know More Copyright © Powered by ",startup,"{'status': '200', 'available': True, 'url': 'http://web.archive.org/web/20220120220843/http://famometer.com/', 'timestamp': '20220120220843'}",20220120220843.0,1.0
https://www.vqvelocity.com,25719,crunchbase,"Instructors FAQs Instructors Day Free Trial Login FAQs Instructors Day Free Trial Login Our Instructors Robbie Ventura Head of Instruction From his pro cycling career and + years of leading an indoor cycling and triathlon training facility, Robbie brings a deep understanding of how to become a better cyclist and how to encourage people to find out what works best for Everyone is an individual and Robbie helps cyclists find their Steeped in a passion to understand the science and technique that drives faster cyclists, Robbie s the best at explaining the scientific and physiological factors that drive Read MORE Dave Noda Veteran Instructor Dave has been leading rides alongside Robbie for almost years and has learned how to bring out the best in a broad range of While he has a deep understanding of the science of cycling, he is geared more to the ""everyday rider"" that is on your local group ride or training for a Though Dave served in the Marine Corps his approach to a class is fun, engaging & educational along the Read MORE Adam Meredith Instructor Team Lead Adam has been a cycling and triathlon ride leader for over years and heads up our instructor Adam brings a strong British accent and a stronger dose of motivation to every ride he If you want to get in the saddle and hammer out a bloody good workout with a cheeky sense of humor, Adam is your He s competed in everything from Ironman to Xterra, so he knows his way around a Read MORE Heather Haviland Ride Instructor Heather has an incredibly accomplished professional triathlon career and understanding of what it takes to be a rockstar After amassing more than overall wins during her professional triathlon career, she opened the esteemed Milwaukee Cycling Center which she lead for over years before moving to the East Heather is a perfect mix of an incredibly likable personality and an pursuit of She brings her trademark tough love to every class and delivers outstanding Read MORE Jeremy Wilson Ride Instructor Jeremy is a general addict of everything Jeremy has always loved sports and He received an Exercise Physiology degree from Ball State University where he was also a high jumper for the Ball State track and field Jeremy was a personal trainer with over years of experience before helping to start VQ He quickly became a successful competitive cyclist amassing multiple podium finishes as well as becoming the Indiana state rode race champion in Read MORE Dan Herron Ride Instructor Dan has been a competitive cyclist and triathlete for many yearsâ even in the days when he had thick, flowing black In he began developing a love for IronMan (his wife calls it an obsession). In addition to his cycling background, Dan brings his academic training and yearsâ expertise in adult education to the Velocity His rides are heavy on encouragement, motivation, and connecting all the science and practical skills of cycling in ways that Outside of cycling and triathlon, Dan loves time with his wife and kids, epic adventuring with his friends, and building thingsâ from Lego spaceships to to businesses to Read MORE HARDWARE RECOMMENDS While we are striving to make Velocity as accessible as possible, there will naturally be some technological hurdles we havenât foreseen or canât retro fit to meet older standards of TECH SPECS Currently Velocity can communicate with Bluetooth devices via the Chrome platform on a An IOS solution is in development as we continue to strive to make Velocity accessible across all devices and operating LOREM IPSUM DOLOR LOREM IPSUM DOLOR LOREM IPSUM DOLOR LOREM IPSUM DOLOR LOREM IPSUM DOLOR ADVANCED SETUP We are establishing partnerships withâ¨third party partners and developing workout files to be downloadable in formats that are compatible with leading fitness Currently, your workouts can not automatically upload to Strava and Garmin Connect, but should be able to Â We will be adding new partners as LOREM IPSUM DOLOR LOREM IPSUM DOLOR LOREM IPSUM DOLOR LOREM IPSUM DOLOR LOREM IPSUM DOLOR LOREM IPSUM DOLOR LOREM IPSUM DOLOR BETTER STARTS BETTER STARTS Â Â© VQ Velocity Virtual Privacy Terms & Conditions Â© VQ Velocity Virtual Privacy Terms & Conditions FAQ Contact   Velocity Indoor Cycling App FAQs Instructors Day Free Trial Login FAQs Instructors Day Free Trial Login × BETTER STARTS At Velocity, we want to get you to fast, Getting stronger on the bike is only half of the equation with getting faster being where the magic Faster is a skill and we train Mastering body position, drag reduction, effective power transfer and gearing efficiency is where you find Velocity combines expert instruction with specific skill development to deliver engaging workouts that make you a better Â Science driven data delivers insights to develop power, skill and speed while competing with friends to push yourself to your Make your indoor training work harder for you to deliver better results View Short Intro LOG IN OR SIGN UP × Let sÂ Get OVERVIEW Â The future o",startup,"{'status': '200', 'available': True, 'url': 'http://web.archive.org/web/20220126043756/https://www.vqvelocity.com/', 'timestamp': '20220126043756'}",20220126043756.0,1.0
https://worklife.so,2307,crunchbase," Worklife Powerful feedback for modern teams Worklifeâs workplace feedback platform enables your people to create lasting behavioral change and unlock the true potential of your organization Invalid email Request demo Thank you for your interest! Someone from our team will be in touch in the next Give and get feedback, effortlessly The feedback process may feel a bit daunting at This is why we built Skills in Skills are the most intuitive way to document and organize the competencies that are important to you, your team, and your Once set up, you can ask for feedback on them from coworkers in just a few So, you never have to worry about what to say or write the next time you go looking for Build a feedback culture Sharing feedback about yourself is a great way to normalize feedback and create psychological safety across your team, especially if youâre in a leadership While Worklife is private by default, we have also built capabilities to seamlessly share your feedback with your manager, team, or the entire Your feedback, your way Every feedback is different so Worklife gives you a range of question types to choose From the delightful rating scale to the customizable multiple choice, we make it easy to ask for feedback the way you want Each question type has been meticulously crafted and refined to design the most beautiful experience for giving feedback ever With Worklife, feedback has never looked this Turn feedback into a conversation Good feedback is a This is why we made feedback on Worklife and never Use comments to have discussions around So, you can clarify assumptions and work on things that matter the Likes are a simple and fun way of showing appreciation to coworkers for engaging in the feedback Slack and Worklife, better together If your team is like the millions of others who use Slack, you already spend a huge amount of time With Worklife, you can stay where you are, and give and receive feedback without needing to leave Worklifeâs Slack app lets you exchange feedback, see recent activity across the company, and set up custom notifications like reminders, directly from your favorite messaging Ready to unlock the power of feedback? Invalid email Request demo Thank you for your interest! Someone from our team will be in touch in the next © Worklife ",startup,"{'status': '200', 'available': True, 'url': 'http://web.archive.org/web/20220524034543/https://worklife.so/', 'timestamp': '20220524034543'}",20220524034543.0,1.0
http://www.sensorisafety.com,18644,crunchbase,"Wayback Machine We will keep fighting for all libraries - stand with us! Internet Archive logo A line drawing of the Internet Archive headquarters building faÃ§ade. Donate icon An illustration of a heart shape ""Donate to the archive"" Search icon An illustration of a magnifying Search icon An illustration of a magnifying Upload icon An illustration of a horizontal line over an up pointing Upload User icon An illustration of a person s head and Sign up | Log in Web icon An illustration of a computer application window Wayback Machine Texts icon An illustration of an open Books Video icon An illustration of two cells of a film Video Audio icon An illustration of an audio Audio Software icon An illustration of a "" floppy Software Images icon An illustration of two Images Donate icon An illustration of a heart shape Donate Ellipses icon An illustration of text More Hamburger icon An icon used to represent a menu that can be toggled by interacting with this Internet Archive Audio Live Music Archive Librivox Free Audio Featured All Audio This Just In Grateful Dead Netlabels Old Time Radio RPMs and Cylinder Recordings Top Audio Books & Poetry Computers, Technology and Science Music, Arts & Culture News & Public Affairs Spirituality & Religion Podcasts Radio News Archive Images Metropolitan Museum Cleveland Museum of Art Featured All Images This Just In Flickr Commons Occupy Wall Street Flickr Cover Art USGS Maps Top NASA Images Solar System Collection Ames Research Center Software Internet Arcade Console Living Room Featured All Software This Just In Old School Emulation Games Historical Software Classic PC Games Software Library Top Kodi Archive and Support File Vintage Software APK Software Software Library Software Sites Tucows Software Library Shareware Software Capsules Compilation Images ZX Spectrum DOOM Level CD Books Books to Borrow Open Library Featured All Books All Texts This Just In Smithsonian Libraries FEDLINK (US) Genealogy Lincoln Collection Top American Libraries Canadian Libraries Universal Library Project Gutenberg Children s Library Biodiversity Heritage Library Books by Language Additional Collections Video TV News Understanding 9 11 Featured All Video This Just In Prelinger Archives Democracy Now! Occupy Wall Street TV NSA Clip Library Top Animation & Cartoons Arts & Music Computers & Technology Cultural & Academic Films Ephemeral Films Movies News & Public Affairs Spirituality & Religion Sports Videos Television Videogame Videos Vlogs Youth Media Search the history of over billion web pages on the Search the Wayback Machine Search icon An illustration of a magnifying Mobile Apps Wayback Machine (iOS) Wayback Machine (Android) Browser Extensions Chrome Firefox Safari Edge Subscription Explore the Collections Learn More Build Collections Save Page Now Capture a web page as it appears now for use as a trusted citation in the Please enter a valid web address About Blog Projects Help Donate Contact Jobs Volunteer People Sign up for free Log in Search metadata Search text contents Search TV news captions Search radio transcripts Search archived web sites Advanced Search About Blog Projects Help Donate Donate icon An illustration of a heart shape Contact Jobs Volunteer People DONATE Latest Show All The Wayback Machine has not archived that Click here to search for all archived pages under https: www.sensorisafety.com . The Wayback Machine requires your browser to support JavaScript, please email if you have any questions about The Wayback Machine is an initiative of the Internet Archive , a (c)(3) , building a digital library of Internet sites and other cultural artifacts in digital Other projects include Open Library & . Your use of the Wayback Machine is subject to the Internet Archive s Terms of Use .   Services | Sensori Safety - Risk Management Technology HOME ABOUT SERVICES LEARN NEWS ANALYTICS SAFETY FAILS CONTACT SERVICES About Sensori Safety Our Services We offer the world’s only human performance technology that determine if employees are Fit for Duty before the start of each work Our technology leverages Health and Safety data to assess employee readiness for duty and identify potential workplace Worker Awareness Testing Continue to test operators to ensure they possess the ability to accurately identify hazards, retain relevant information, and respond Worker Fatigue Monitoring Enhance your workplace safety program by pinpointing team members speed, accuracy, focus, and mental agility, thereby boosting your team s overall safety Worker Hydration Management Take your workplace Health and Wellness program to the next level by prioritizing adequate hydration for workers during hot and humid Mental Health Surveying Elevate the effectiveness of your new employee onboarding program by gauging the mental and emotional of workers prior to undertaking crucial or Post Google Review ABOUT US Since , Sensori Saf ety has been using data to enhance safety, efficiency, and productivity for all OUR SER",startup,"{'status': '200', 'available': True, 'url': 'http://web.archive.org/web/20211213162012/https://www.sensorisafety.com/', 'timestamp': '20211213162012'}",20211213162012.0,1.0
