website,text_len,source,text,type,closest_snapshot,closest_snapshot_time,snapshot_in_window
https://www.sixpackcoverage.com,13109,crunchbase,"Entertainment - Six Pack Coverage Skip to content Contact Us Home Sports Finance Food Travel Fitness Entertainment The Team Shop Home Sports Finance Food Travel Fitness Entertainment The Team Shop Main Menu Home Sports Finance Food Travel Fitness Entertainment The Team Shop Podcasts Shows Six Pack Interviews College Tours With Nicky Bet Right Podcast Six Pack Challenges Ride The Tide Podcast Rookie & The Vet Man to Man with Liam & Andy Bronx Bomber Ball Five For Fighting Running poles Paydirt Sports Philly Philly Podcast Broke & Boujee Roughing the Passer Send me an invite the Bald Eagle POdcast Pucking Flyers Philly Bro Cast Off The Tight Rope Hogs Call Podcast Smack Talk Show F in Sports Podcast Drew & Mal Show Sports Card Nation Latest Stories Kentucky Bahamas Trip Preview By Six Pack Coverage | August , Kentucky Basketball Preview! By: Mat We are now just hours away from our first looks at the Kentucky Basketball Following the historically disappointing loss to seeded Peter’s in the first round of the NCAA Tournament, the Cats will begin their redemption tour abroad in the Last time we … Kentucky Bahamas Trip Preview Read More » Read More → Ep: : Welcome TO The Bronx Benny By Six Pack Coverage | July , Luigi and Andrew discuss the Yankees’ post break struggles against the Astros, Orioles, and Mets, along with their recent trade acquisition of Andrew As always, the BBB podcast is brought to you by Six Pack Read More → Episode : Battle In Boston By Six Pack Coverage | July , Read More → Ep: Wrapping Up The First Half By Six Pack Coverage | July , Read More → It’s Football Time on Rocky Top By Six Pack Coverage | July , By: Ben C It’s Football Time on Rocky TopThe college football season will be underway in just a few weeks, meaning it’s time for the Vol Walk in Knoxville, The new renovations of Neyland stadium make it an even more intimidating place to play A sea of checkerboard from students, fans, and faculty … It’s Football Time on Rocky Top Read More » Read More → Home Sports Finance Food Travel Fitness Entertainment The Team Shop Copyright © Six Pack Coverage, all rights | Franklin, TN Scroll to Top   Food Travel - Six Pack Coverage Skip to content Contact Us Home Sports Finance Food Travel Fitness Entertainment The Team Shop Home Sports Finance Food Travel Fitness Entertainment The Team Shop Main Menu Home Sports Finance Food Travel Fitness Entertainment The Team Shop Breakfast Lunch Dinner Drinks Brunch Sedona Tap House By Summer | August 8, Lockeland table By Summer | July , Gray & Dudley By Summer | July , Geist Bar + Restaurant By Summer | July , Thistle Farms By Summer | July 5, Thistle Farms By Summer | June , Ellington’s Restaurant By Summer | June , Central Bar + Kitchen By Summer | June , Ready Teddy’s By Summer | June 6, Living Waters Brewing By Summer | May , 1 2 3 … 5 Next » Home Sports Finance Food Travel Fitness Entertainment The Team Shop Copyright © Six Pack Coverage, all rights | Franklin, TN Scroll to Top   Fitness - Six Pack Coverage Skip to content Contact Us Home Sports Finance Food Travel Fitness Entertainment The Team Shop Home Sports Finance Food Travel Fitness Entertainment The Team Shop Main Menu Home Sports Finance Food Travel Fitness Entertainment The Team Shop Chest Arms Cardio Back Legs Abs Yoga Why Low Calorie Diets Don’t Work By Six Pack Coverage | August , How to Stay Motivated By Six Pack Coverage | August , When to Drink Protein Shakes By Six Pack Coverage | August 3, Cardio Weight Lifting By Six Pack Coverage | July , Best Back Workouts for Putting on Size By Six Pack Coverage | July , How Fast Do You Actually Lose Strength By Six Pack Coverage | July , Best Bicep exercises By Six Pack Coverage | July 5, Can Yoga substitute a Cardio Workout? By Six Pack Coverage | June , Must Do Leg Exercises By Six Pack Coverage | June , 5 Tricks to Help you Start Working Out By Six Pack Coverage | June 7, 1 2 Next » Home Sports Finance Food Travel Fitness Entertainment The Team Shop Copyright © Six Pack Coverage, all rights | Franklin, TN Scroll to Top   Finance - Six Pack Coverage Skip to content Contact Us Home Sports Finance Food Travel Fitness Entertainment The Team Shop Home Sports Finance Food Travel Fitness Entertainment The Team Shop Main Menu Home Sports Finance Food Travel Fitness Entertainment The Team Shop Social Media The Week Ahead Stock Ideas Latest News The Week Ahead 08 2022 By Austin Hankwitz | August 8, The Week Ahead 01 2022 By Austin Hankwitz | August 1, Deep Dive: Cheap Real Estate Investing By Austin Hankwitz | April , The Week Ahead 18 2022 By Austin Hankwitz | April , The Week Ahead 11 2022 By Austin Hankwitz | April , The Week Ahead 04 2022 By Austin Hankwitz | April 4, Peters: An Underpaid Cinderella Story By Austin Hankwitz | April 1, The Week Ahead 28 2022 By Austin Hankwitz | March , The Week Ahead 21 2022 By Austin Hankwitz | March , The Week Ahead 14 2022 By Austin Hankwitz | March , 1 2 3 4 Next » Home Sports Finance Food Travel Fitness Entertai",startup,"{'status': '200', 'available': True, 'url': 'http://web.archive.org/web/20220102225522/https://www.sixpackcoverage.com/', 'timestamp': '20220102225522'}",20220102225522.0,1.0
https://www.propelauth.com/,10201,crunchbase,"Flexible Auth API - PropelAuth Use Cases B2C B2B Â SaaS API Docs Pricing Blog Product Blog Auth Guides TechÂ Blog Sign Up Flexible Auth API Our hosted pages and frontend backend libraries are all you need to get started - but as you grow you may want a little more control over your auth Our APIs work alongside our hosted pages so you can get the custom features you want without having to start from â Works with PropelAuth hosted pages Password or passwordless options Social login support for your end users Organizations support for B2B Machine to Machine authentication No extra cost And We re currently testing our API with a limited number of beta Enter your email below to be added to the waitlist for Thank you! We ll reach out shortly Oops! Something went wrong Blog 5 reasons why you should use PropelAuth Use Case:Â B2B UseÂ Case: B2C Docs Auth Guides Pricing Support Security Custom Login Account Pages Product Blog Tech Blog About API PrivacyÂ Policy TOS Cookie Policy Â© PROPELAUTH   PropelAuth for B2B Products Use Cases B2C B2B Â SaaS API Docs Pricing Blog Product Blog Auth Guides TechÂ Blog Sign Up Easy User Management for B2B Businesses PropelAuth provides everything you need to allow your users to register, invite their coworkers and manage their Sign Up View Docs Customizable UIs Invites and Permissions Secure Account Changes Ready in Minutes User Management Hosted Pages Get sign up done quickly with our hosted registration Customize them with your colors & Social Login If you re building a B2B product, you probably want your users to invite their With PropelAuth s invitation and permissioning features, no extra work is Secure Account Changes PropelAuth includes everything your users might need after signup to manage their accounts, like Forgot Password and Update Email Get Up and Running in Minutes Our prebuilt frontend and accompanying APIs already handle most of the auth All you have to do is take it the last mile with our frontend and backend support Your users can enable support by No additional coding User Management No need to build any custom internal tools for user PropelAuthâs prebuilt dashboards make it possible for you to be in full Blog 5 reasons why you should use PropelAuth Use Case:Â B2B UseÂ Case: B2C Docs Auth Guides Pricing Support Security Custom Login Account Pages Product Blog Tech Blog About API PrivacyÂ Policy TOS Cookie Policy Â© PROPELAUTH   Pricing - PropelAuth Use Cases B2C B2B Â SaaS API Docs Pricing Blog Product Blog Auth Guides TechÂ Blog Sign Up Pricing Working on a startup? We offer up to $5,000 in credits for your first year - enough to power your business to over users per Reach out at Free Free Everything you need to get Auth up and running quickly, including: â Start Now Up to monthly active users Customizable UI and emails Hosted on a custom domain Organization (B2B) features User invitations Secure best practices by default for your end users Audit logs Internal admin UIs Responsive support via email And Growth $0.02 per monthly active user, min $20 Everything included in Free plus: Start Now Unlimited monthly active users Remove ""Powered by PropelAuth"" Enterprise Contact Us Design a custom package for your business Contact Us Frequently Asked Questions What is a monthly active user? We only count users with login activity during the month . This is equivalent to the number of users that use your application throughout the When am I charged? Once you go live, you will be charged on that day every month (starting the following month). Your billing page contains exact dates and how many monthly active users you have so What happens if I want to switch auth providers in the future? No We can provide an export of your user data upon What if I go over active users on the Free plan? Congrats! We ll email you to ask you to We will not prevent your users from logging Have Questions? We d love to chat, learn more about your product, and answer any questions you Thank you! We ll reach out shortly Oops! Something went wrong Blog 5 reasons why you should use PropelAuth Use Case:Â B2B UseÂ Case: B2C Docs Auth Guides Pricing Support Security Custom Login Account Pages Product Blog Tech Blog About API PrivacyÂ Policy TOS Cookie Policy Â© PROPELAUTH   PropelAuth for B2C Products Use Cases B2C B2B Â SaaS API Docs Pricing Blog Product Blog Auth Guides TechÂ Blog Sign Up Easy Registration Flow for B2C Businesses Setting up sign up and account management will take minutes , so you can get back to working on the fun part of your Sign Up View Docs Customizable UIs Social Login Secure Account Changes Ready in Minutes User Management Hosted Pages Get sign up done quickly with our hosted registration Customize them with your colors & Social Login PropelAuth supports social login from Google, GitHub and Enable with one click and let your users sign up in the easiest way Secure Account Changes PropelAuth includes everything your users might need after signup to manage their accounts",startup,"{'status': '200', 'available': True, 'url': 'http://web.archive.org/web/20220124224325/https://www.propelauth.com/', 'timestamp': '20220124224325'}",20220124224325.0,1.0
https://www.bookmypnr.com,29895,crunchbase,": Cheap flights tickets & best hotel booking deals USD AFN ALL AMD ANG AOA ARS AUD AWG AZN BAM BBD BDT BGN BHD BIF BMD BND BOB BRL BSD BTC BTN BWP BYN BYR BZD CAD CDF CHF CLF CLP CNY COP CRC CUC CUP CVE CZK DJF DKK DOP DZD EGP ERN ETB EUR FJD FKP GBP GEL GGP GHS GIP GMD GNF GTQ GYD HKD HNL HRK HTG HUF IDR ILS IMP INR IQD IRR ISK JEP JMD JOD JPY KES KGS KHR KMF KPW KRW KWD KYD KZT LAK LBP LKR LRD LSL LTL LVL LYD MAD MDL MGA MKD MMK MNT MOP MRO MUR MVR MWK MXN MYR MZN NAD NGN NIO NOK NPR NZD OMR PAB PEN PGK PHP PKR PLN PYG QAR RON RSD RUB RWF SAR SBD SCR SDG SEK SGD SHP SLL SOS SRD STD SVC SYP SZL THB TJS TMT TND TOP TRY TTD TWD TZS UAH UGX USD UYU UZS VEF VND VUV WST XAF XAG XAU XCD XDR XOF XPF YER ZAR ZMK ZMW ZWL AED EUR GBP INR USD ARS AUD BDT BGN BND BRL BWP CAD CHF CLP CNY CRC CZK DKK EGP FJD GEL GGP GHS HKD HRK HUF IDR ILS IMP JEP JPY KES KRW LAK LKR LSL MAD MXN MYR NGN NOK NPR NZD PAB PEN PHP PKR PLN RON RUB SEK SGD THB TMT TRY TZS UAH UGX VND XOF ZAR CHOOSE COLOR Hotels Activities Trip Insurance Cars USD Manage Booking MY TRIPS ✆ : Cheap flights tickets & best hotel booking deals Compare and book cheap flights and hotels Discover your next dream destination with Book My PNR Flights Hotels Activities Cars One way Return Stops : Direct One Stop Any From Suggestions San Francisco International Airport( SFO ) San Francisco, United States Goa International Airport( GOI ) Goa, india Chhatrapati Shivaji Maharaj International Airport( BOM ) Mumbai, india Los Angeles International Airport( LAX ) Los Angeles, United States indira gandhi international airport( DEL ) delhi, india dubai international airport( DXB ) dubai, uae heathrow airport( LHR ) london, united kingdom To Suggestions Harry Reid International Airport( LAS ) Las Vegas, United States Los Angeles International Airport( LAX ) Los Angeles, United States Chhatrapati Shivaji Maharaj International Airport( BOM ) Mumbai, india Goa International Airport( GOI ) Goa, india heathrow airport( LHR ) london, united kingdom dubai international airport( DXB ) dubai, uae male international airport( MLE ) male, maldives Departure Return Travellers & Class 1 Traveler, Economy Travelers & Class Adult (12+) - 1 + Children (2-11) - 0 + Infant (0-1) - 0 + Class Economy Business First Premium Economy Ok Non stop flight View More Airline Include : Airline Include : Search Flights Lorem Ipsum is simply dummy text of the printing and typesetting Lorem Ipsum has been the industry s standard dummy text ever since the , when an unknown printer took a galley of type and scrambled it to make a type specimen It has survived not only five centuries, but also the leap into electronic typesetting, remaining essentially It was popularised in the with the release of Letraset sheets containing Lorem Ipsum passages, and more recently with desktop publishing software like Aldus PageMaker including versions of Lorem Lorem Ipsum is simply dummy text of the printing and typesetting Lorem Ipsum has been the industry s standard dummy text ever since the , when an unknown printer took a galley of type and scrambled it to make a type specimen It has survived not only five centuries, Lorem Ipsum passages, and more recently with desktop publishing software like Aldus PageMaker including versions of Lorem Amazing Travel Offers Your top daily deals! Featured destinations from Cheap Flighs Tickets and Hotel Booking, Affordable Travel Best travel deals See where you can travel to right Find the best travel deals across thousands of flights and Plan your perfect trip Plan your trip with Book my Find the best deals available from + Airlines & thousands of Easy Bookings We offer easy and convenient flight bookings with attractive exciting deals on flights and hotels LOWEST PRICE We ensure low rates on hotel reservation, holiday packages and on flight Get 7 Members save on Private Deals Sign up for access to personalised recommendations and Private Let s do this BOOK CHEAP FLIGHTS AND HOTELS Book My PNR offer Cheapest flight tickets Best deals on Hotel booking and flight booking Check travel restrictions before you go Entry requirements in some countries may be less strict if you’re fully vaccinated against Not all vaccines are accepted everywhere, Learn about entry requirements such as the border status, testing requirements and quarantine Many countries are reopening their borders for international so please check local government advice before Check Travel Restrictions travel restrication visa requirements Customs Information Find best deals on Flight booking and hotel To Your Favorite BookMyPNR is an online travel booking website helping users from all over the world find that perfect place to How to easily book flights and hotels? Nowadays most travelers prefer booking travel products They also like to get various offers and discounts on their travel Bookmypnr helps travelers to enjoy the big best deals on international flight booking, domestic flight bookings, International and national accommodat",startup,"{'status': '200', 'available': True, 'url': 'http://web.archive.org/web/20220223081937/https://www.bookmypnr.com/', 'timestamp': '20220223081937'}",20220223081937.0,1.0
https://ziwick.com/,55,crunchbase," Classified CDL,truck,van and any driving job | Ziwick ",startup,"{'status': '200', 'available': True, 'url': 'http://web.archive.org/web/20220627184454/https://ziwick.com/', 'timestamp': '20220627184454'}",20220627184454.0,1.0
https://lakestreet.xyz,759,crunchbase," Contact | Lake Street Software, Home Company Careers Contact Contact Headquarters Lake Street Software, W State #140 Boise, Idaho Email Phone +1 ©2022 Lake Street Software, · Boise, Idaho ·   Company | Lake Street Software, Home Company Careers Contact Company Nick Hough Founder & CEO Phil Bradley Board Member Raja Kapadia Board Member Nik Hawks Advisor Channing Chen Advisor Tige Fiedor Advisor Trajche Nakov Engineer Alen Ankajcan Engineer ©2022 Lake Street Software, · Boise, Idaho ·   Lake Street Software, Home Company Careers Contact Lake Street is an IoT software We believe the Internet of Things has the ability to change the world for the Our mission is to build the tools to support that #IoTforGood ©2022 Lake Street Software, · Boise, Idaho · ",startup,"{'status': '200', 'available': True, 'url': 'http://web.archive.org/web/20220914000320/https://lakestreet.xyz/', 'timestamp': '20220914000320'}",20220914000320.0,1.0
https://www.ionio.io,5135,crunchbase,"Ionio - Custom Software Development Services for FinTech | MERN, Python & Docker Home Technologies Contact We offer custom software development services to FinTech companies We specialize in Python, NodeJS Express, React & AWS Get a Quote You have an app idea? We can help you bring your vision to life - whether it s a mobile app or a code quality & containerization Weekly updates, documentation & training support, to continue iterating on the product We build Saas with the MERN Stack - NodeJS Express, React, MongoDB on Docker & deploy on Testimonials Here s what they said I approached Rohan for his suggestion regarding an issue I was trying to He has responded pretty soon and suggested few changes in the code which worked out in resolving the He has good knowledge of various aspects of Web frameworks in Thank you for your response and Naren Vema Lead Developer at National Collateral Management Services Rohan has an extremely strong grasp over the intricacies, complexities, and challenges of working with Deep Learning, Machine Learning, and Software in I reached out to Rohan when I needed help with an OpenCV Python issue I was having trouble He was surprisingly excited to help me with it, Rohan was able to fix something less than an He even went on to answer my corresponding So that others could benefit from it as Rohan is technically strong, a real people person and someone whom I can see myself collaborating with for several projects to come in the near Sajjad Rostami AI PhD Student I had an issue with AWS Kinesis Video Stream SDK CPP library for compiling and building G Streamer plugin for kinesis video stream I found that Rohan was one of the contributor for the library and I hit him up for a With his great python knowledge and experience using docker, he suggested me the best solution that I could get for the He was really responsive and professional in his way of explaining on how to tackle the Harkirat Grewal Student Researcher at WIMTACH Not many people can be so efficient and helpful as Rohan He is knowledgeable and a pleasure to work When I was going through the hardships of my current project, he was somebody that I trusted and looked toward for guidance and His overall presence had a positive impact on my work along with my individual He helped me in understanding Azure infrastructure and many I m sure he ll be an asset to any organization he Chaitanya Lakshmi Indukuri AWS Certified Solutions Architect I have had the delight and pleasure to be acquainted with Rohan Sawant over the past few years… He has made valuable contributions to the online community that we are both members… The projects that I have seen him work on have been communicated in a fashion that provokes interest and further questions… There is also the willingness to ask for information from other areas, and incorporate important concepts into his projects… I look forward to the continuing progress of Rohan s work – this is one to Arlene Andrews Context Tester Writer The Process We have a standardized process to get MVPs This is what we love This is what we specialize We call this the Step 1 - Setting the Product Scope Our product designers work with you to create a vision for the product you are trying to We understand the problem, analyze the complexity, and establish a scope for a project & resoures Step 2 - Designing the Mockup Working together with our UI UX team we create a mockup of the app with all of its This is how the finished MVP product will look & Step 3 - Assign a Dedicated Team We assign a specialized dedicated team to work on your Typically this consists of a frontend React engineer, a backend NodeJS Python developer & a project Step 4 - The Development Development time is usually 8 to From week 2 3, we deliver weekly updates, as Looms videos and catchup We also try to keep the scope concentrated & defer drifting away from the original Step 5 - Ongoing Support & Maintenance After the MVP development is complete we move to a the scope, the new requirements, & create The same team continues to add additional features, support and maintain the Going from a rough idea to fully deployed Saas usually takes us about 8 to Technologies We only work with proven, & reliable tech stacks to reduce Time to NodeJS Express We use NodeJS Express to build our Support for SSO, Stripe Integration & unit tests are always React Figma UI mockups are implemented in We use TailwindCSS for React Redux for state for static site Python We build our microservices with Flask using Celery with RabbitMQ or Redis is used for task Django can be used if needed DevOps All our code is strictly containerized with Docker . We use Github Actions for CI CD, deploy with Docker Compose or Kubernetes on request on Book a free call Let s talk - during the call we will determine your project needs in terms of size & Next we will determine the feasiblity & the fit , we will submit a proposal for collaboration, and move Schedule a Call Contact Us Your Name Yo",startup,"{'status': '200', 'available': True, 'url': 'http://web.archive.org/web/20211209082639/https://ionio.io/', 'timestamp': '20211209082639'}",20211209082639.0,1.0
https://osdistilling.com,2797,crunchbase," CONTACT | O S Distilling Co HOME ABOUT US KEEPER S HEART CASK SOCIETY NEWS & UPDATES CONTACT More COMING SUMMER Follow us on social media for progress and O SHAUGHNESSY DISTILLING Malcolm Minneapolis, MN Career inquiries: Media inquiries: General inquiries: Keeper s Heart Cask Society inquiries: MAP ©2021 O’Shaughnessy Distilling Co, Minneapolis, MN PLEASE DRINK RESPONSIBLY   HOME | O S Distilling Co HOME ABOUT US KEEPER S HEART CASK SOCIETY NEWS & UPDATES CONTACT More KEEPER S HEART LAUNCH ©2021 O’Shaughnessy Distilling Co, Minneapolis, MN PLEASE DRINK RESPONSIBLY   ABOUT US | O S Distilling Co HOME ABOUT US KEEPER S HEART CASK SOCIETY NEWS & UPDATES CONTACT More CRAFT WHISKEY We founded the O Shaughnessy Distilling Company, and Keeper s Heart, with a belief that the spirit of family and friends, and our shared experiences together, provide us with deep connection and meaning in our At O Shaughnessy Distilling , we had a vision to create a line of both Irish, and American whiskeys, that pay tribute to our We also wanted to create a Distillery home that serves as a vehicle to bring people At our distillery, the magic of whiskey making begins with our three triple copper pots, where we make American Whiskey, in the traditional Irish triple distillation As a family, we aim to create a lasting legacy for future generations of whiskey We set about building a distillery in our family hometown of Minneapolis, which will produce whiskey and serve as a source of pride for the We are immensely proud of our whole team, including renowned Master Distiller Brian Nation, who brings the highest level of quality, craft and innovation to our collection of We invite everyone to join us on our journey, and welcome you to our ​ Cheers, The O Shaughnessys Behind The Scenes Jay Christensen visited our Minneapolis, Minnesota distillery to give you a sneak peek of what we re working Plan a visit in the summer of ! Visit our website to learn more: ©2021 O’Shaughnessy Distilling Co, Minneapolis, MN PLEASE DRINK RESPONSIBLY   NEWS & UPDATES | O S Distilling Co HOME ABOUT US KEEPER S HEART CASK SOCIETY NEWS & UPDATES CONTACT More All Posts Search Log in Sign up O Shaughnessy Distilling May Introducing David Perkins as O Shaughnessy Distilling s newest collaborator O Shaughnessy Distilling May Keeper’s Heart Marries The Best Of Irish And American Whiskey Traditions O Shaughnessy Distilling May David Perkins Joins O’Shaughnessy Distilling Company As Liquid Collaborator And Advisor 1 2 3 4 5 ©2021 O’Shaughnessy Distilling Co, Minneapolis, MN PLEASE DRINK RESPONSIBLY   ARE YOU | O S Distilling Co HOME ABOUT US KEEPER S HEART CASK SOCIETY NEWS & UPDATES CONTACT More Use tab to navigate through the menu ©2021 O’Shaughnessy Distilling Co, Minneapolis, MN PLEASE DRINK RESPONSIBLY ",startup,"{'status': '200', 'available': True, 'url': 'http://web.archive.org/web/20210804185206/https://www.osdistilling.com/', 'timestamp': '20210804185206'}",20210804185206.0,1.0
