website,text_len,source,text,type,closest_snapshot,closest_snapshot_time,snapshot_in_window
https://gulfortho.com/,28167,crunchbase,"Orthopaedic Trauma Specialist Mobile AL | Russell Goode, MD Springhill Ave, Floor, Mobile, AL Schedule An Appointment: Contact Us Follow Home About Us Russell Goode, MD Michael Granberry, MD Clayton Lane, MD Grant Shell, MD Grant Zarzour, MD Services Ankle Fractures Anterior Total Hip Replacement Arm and Wrist Fractures Hip Fractures Partial Knee Replacement Shoulder Replacement Sports Injuries Total Ankle Replacement Total Knee Replacement Testimonials Gallery Contact Us Locations Book Appointment Home About Us Russell Goode, MD Michael Granberry, MD Clayton Lane, MD Grant Shell, MD Grant Zarzour, MD Services Ankle Fractures Anterior Total Hip Replacement Arm and Wrist Fractures Hip Fractures Partial Knee Replacement Shoulder Replacement Sports Injuries Total Ankle Replacement Total Knee Replacement Testimonials Gallery Contact Us Locations Book Appointment Russell Goode, MD Conveniently located in Mobile, AL to serve both sides of the bay Home 5 About Us 5 Russell Goode, MD Russell Goode is the only fellowship trained Orthopaedic Trauma specialist in the Mobile area community hospital He completed his undergraduate degree in chemistry at the University of South Alabama as well his medical school and residency training with the University of South Alabama health Upon graduation, he spent a year at the University of Missouri under the training of 8 Orthopaedic Trauma specialists before coming back to the Mobile Goode is still active with the University serving on the Medical Alumni Association Executive board and overseeing the Frederick N Meyer nonprofit organization which provides educational support and grants for the USA Orthopaedic He also oversees the only truly comprehensive Orthopaedic osteoporosis clinic run by his wife, Sarah Goode, It is his ultimate goal to elevate and standardize the level of care orthopaedic patients receive irregardless of the hospital system to ensure the best possible outcomes for all Get Directions Springhill Ave, Floor, Mobile, AL Phone: Referral Fax: Contact Us Please provide the requested information and our Scheduling Coordinator will contact you as soon as possible to confirm your appointment time and Name First Last Phone Email Untitled Consent I agree to the Terms of Service . Email This field is for validation purposes and should be left Δ Home About Us Services Testimonials Contact Us Follow Sitemap | Privacy Policy | Terms & Conditions | HIPAA Privacy Policy Copyright © Gulf All Rights Website Design & SEO by NKP Medical We use cookies on our website to give you the most relevant experience by remembering your preferences and repeat By clicking “Accept All”, you consent to the use of ALL the However, you may visit ""Cookie Settings"" to provide a controlled Cookie Settings Accept All Manage consent Close Privacy Overview This website uses cookies to improve your experience while you navigate through the Out of these, the cookies that are categorized as necessary are stored on your browser as they are essential for the working of basic functionalities of the We also use cookies that help us analyze and understand how you use this These cookies will be stored in your browser only with your You also have the option to of these But opting out of some of these cookies may affect your browsing Necessary Necessary Always Enabled Necessary cookies are absolutely essential for the website to function This category only includes cookies that ensures basic functionalities and security features of the These cookies do not store any personal Any cookies that may not be particularly necessary for the website to function and is used specifically to collect user personal data via analytics, ads, other embedded contents are termed as It is mandatory to procure user consent prior to running these cookies on your SAVE & ACCEPT   About Orthopaedics Surgeon Office Mobile AL Springhill Ave, Floor, Mobile, AL Schedule An Appointment: Contact Us Follow Home About Us Russell Goode, MD Michael Granberry, MD Clayton Lane, MD Grant Shell, MD Grant Zarzour, MD Services Ankle Fractures Anterior Total Hip Replacement Arm and Wrist Fractures Hip Fractures Partial Knee Replacement Shoulder Replacement Sports Injuries Total Ankle Replacement Total Knee Replacement Testimonials Gallery Contact Us Locations Book Appointment Home About Us Russell Goode, MD Michael Granberry, MD Clayton Lane, MD Grant Shell, MD Grant Zarzour, MD Services Ankle Fractures Anterior Total Hip Replacement Arm and Wrist Fractures Hip Fractures Partial Knee Replacement Shoulder Replacement Sports Injuries Total Ankle Replacement Total Knee Replacement Testimonials Gallery Contact Us Locations Book Appointment About Us Conveniently located in Mobile, AL to serve both sides of the bay Home 5 About Us Grant Zarzour, MD Learn More Russell Goode, MD Learn More Michael Granberry, MD Learn More Clayton Lane, MD Learn More Grant Shell, MD Learn More Get Directions Springhill Ave, Floor, Mobile, AL Phone: Referral Fax: Contact Us Ple",startup,"{'status': '200', 'available': True, 'url': 'http://web.archive.org/web/20220111125639/https://www.gulfortho.com/', 'timestamp': '20220111125639'}",20220111125639.0,1.0
https://level1.tv,988,crunchbase," Email Protection | Cloudflare Please enable Email Protection You are unable to access this email address The website from which you got to this page is protected by Email addresses on that page have been hidden in order to keep them from being accessed by malicious You must enable Javascript in your browser in order to decode the address . If you have a website and are interested in protecting it in a similar way, you can sign up for Cloudflare . How does Cloudflare protect email addresses on website from spammers? Can I sign up for Cloudflare? Cloudflare Ray ID: • Your IP: Click to reveal • Performance & security by Cloudflare   Level1 TV Skip to content Level1 Menu Close Home News Ready Level1 A new kind of event hosting, broadcasting, and Fighting for the Meet Level1: people dedicated to Smash and FGC events from the Puget Sound to Big Sky Have an event idea? Let s Talk Need to see more first? View Replays Next Event Warlock Punch 5 – Bracket Copyright - Level 1 TV LLC ",startup,"{'status': '200', 'available': True, 'url': 'http://web.archive.org/web/20220105215703/https://level1.tv/', 'timestamp': '20220105215703'}",20220105215703.0,1.0
http://infinite.fashion,1293,crunchbase," Moohan: Faster design with AI Infinite Fashion Request Access Moohan makes design faster with the help of Creating a model is hard and marketplace doesn t always have an exact model that you are looking Moohan speeds up design by providing a semantic control over mesh and texture —that makes modeling and texturing significantly Unlike Blender or Maya, you can create a set of shape with just a single It also let you transfer styles from a model to another to make a coherent art style through out your existing When you have many tabs open, it will help you quickly find a Built for speed, it s like putting a rocket booster on your web Moohan helps you create & build without Single click Chrome can take up to GB of memory if you have 5+ tabs Moohan uses less than MB of memory so your other applications can run smoothly including Say goodbye to UV When Chrome uses a lot of CPU resources it can be hard to use other Moohan lets you stream Chrome from the cloud moving its busy processing to a computer in a Lightning fast style Moohan loads websites This works because Moohan has a faster Internet connection and is closer to the resources that web pages Moohan makes design faster with the help of We re hiring engineers! Check out our job description . Request Access Privacy policy ",startup,"{'status': '200', 'available': True, 'url': 'http://web.archive.org/web/20220119224530/https://www.infinite.fashion/', 'timestamp': '20220119224530'}",20220119224530.0,1.0
https://www.thesummitgroup.biz,2403,crunchbase," CFO Services | The Summit Group - Salt Lake City CFO Advisory Call Now Home Services About Testimonials Clients Contact More Use tab to navigate through the menu The Power of Expert CFO Advice Accelerate your growth with expert CFO support — from accurate budgets to financial Learn More SERVICES Taking Your Business to the Next Level CFO Services Reach your growth objectives with strategic finance support including forecasting, fundraising, and Business Intelligence using critical financial metrics, KPIs, OKRs that Benchmarking across industry, market and Board reporting and Investor Decks Accounting Services Accurate monthly reporting with clear business financials, budgets and Cash flow and burn rate analysis Payroll, AP & AR Generally Accepted Accounting Principles (GAAP) Audit & Compliance ​ Finance Optimization Tax Strategies, Equity Plans, , R&D Credit Full Finance Tech Stack that grows with Financial Process Improvements with key financial systems that scale Cap Table Management & We’re Good with Numbers Years of Experience Qualified Experts Clients Every Year 9 Partners ABOUT Our Experts Are the Finest We are a boutique CFO Advisory based in Salt Lake City, Utah who pride ourselves on understanding your unique business needs and the importance of the financial levers that power your ​ We have over years of executive financial leadership experience where we have overseen the finance and accounting functions of companies from to + in We have experience in the venture capital and private equity markets and have done considerable work building businesses from ideation to successful ​ In addition, our areas of expertise include a wide degree of financial knowledge from Capital Fundraising, M&A A dvisory, Business Intelligence, Opportunity & Risk Analysis, Executive & S ales C ompensation P lans, and Business Equity ​ We offer a highly engaged, proactive, partnership meant to benefit all of your business s ​ We are confident we will be able to improve your business s growth, profitability, and enterprise value with our comprehensive, actionable financial We scale with you! TESTIMONIALS “Rock Bulletproof financials ” Josh Phillips Whitman & OUR HAPPY CLIENTS CONTACT Let’s Work Together S Main St Fl, Salt Lake City, UT Tel: Request Free Financial Assessment First Name Last Name Email Leave us a Submit Thanks for submitting! We will be in touch © by The Summit ",startup,"{'status': '200', 'available': True, 'url': 'http://web.archive.org/web/20220425155022/https://www.thesummitgroup.biz/', 'timestamp': '20220425155022'}",20220425155022.0,1.0
https://www.theinsounds.com,27833,crunchbase,"Submit Your Music | Mysite Home About Featured Tracks Artists Submit Your Music Newsletter Internships Blog More Use tab to navigate through the menu THE IN SOUNDS AURAL PLEASURE THE IN SOUNDS PASS THE AUX A curated playlist of music from the freshest In Sounds from around the New music daily to discover and ​ Send us your music to be considered for this collection of SUBMIT MUSIC A playlist designed by the community, for the ​ Pass The Aux is to help artists receive the recognition they If you d like to showcase your work to a community of authentic music lovers, submit your music SUBMIT MUSIC THE IN SOUNDS INTERNATIONAL If you like discovering emerging international artists and music from other countries in their native tongue, this playlist is for you! ​ The In Sounds International is a way to get your country s new artist s music We profile new artists once a SUBMIT MUSIC © by Site Proudly created with   The In Servin it Home About Clients Artists Submit Your Music Newsletter Internships Blog More Use tab to navigate through the menu We re Looking For Interns We love our Our interns love See below for past intern If you are passionate about music and want to learn more about the industry, digital, lifestyle, grassroots marketing and entrepreneurship, please read Job Description We re looking for personable, outgoing, driven ambitious, resourceful, social media savvy interns team members to help expand artists Having a true passion and interest in music is a must! You are constantly seeking new music and artists on your own via researching music channels (Spotify, TikTok, YouTube, Soundcloud), music blogs, social media, and other outlets - is a This internship exposes you to planning, managing, strategic thinking, and digital marketing of developing artists through online You will very quickly become responsible for various projects in a , environment while being surrounded and working with Your voice ​ Overview The In Sounds is a music lovers marketing network made up of passionate music fans who want to learn about how to market new and developing artists through marketing (digital and offline) We are accepting applications all Start date: Immediately :) Location: Remote Weekly Hours: Task and project You manage your own Requirements: A good Freshmen, Sophomores, Junior, Seniors, Recent Grads, with experience in the Music industry Response Criteria: Cover letter and Resume sent to ​ ​ Roles & Responsibilities Attend weekly mandatory team calls Communicate with the rest of the team on projects you are working on Be up to date with current music industry trends such as new music releases, upcoming shows, Organize marketing information pertaining to projects the team is working on Create content to promote The In Sounds and priority artists Become an integral part of our national team and help drive success Currently, this internship is for resume value and work There is a per project compensatory ​ If interested, please send cover letter and resume at ​ ​ Here s what our past interns had to say! “My time here at The In Sounds has been such an incredible From the countless hours spent streaming the playlists, campaign tracks, the amount of skills and techniques I learned are things I will continue to use for the rest of my Ko is such an incredible person and genuinely cares about you and what you want to do in this Ko helped me dip my toe into something I had never heard of or even thought of doing in my I highly recommend anyone looking to get into the business consider becoming an intern with this amazing company!” ​ - Andrew Johnston, Oklahoma State University A better learning experience than any classroom would have taught me… I am a firm believer that experiential learning heavily outweighs the efficiency to learn compared to lecturing learning as memory is created with information and After being introduced to a welcoming, and sociable team, I received clear instructions on the basics, and my mentors, as well as the team, were there to guide me along every step of my internship I was assigned my own social media platform to manage and was got to interact with everything on my From making the content to researching analytics, I extracted a great deal of knowledge and valuable experience from my ​ - Yuuta Aoki, Rutgers University “I am so content with how my internship at RUTH PLUS The In Sounds I learned a lot about digital marketing and what the music industry The CEO, Ko, is a She is knowledgable and is always there to help her interns learn and I ve gotten to work on really fun projects such as working with up and coming artist, JORDI UP LATE and doing digital marketing for Desert X I m forever grateful for the skills I learned while interning ” ​ - Rosmary Alarco Villalva (University of Central Florida ""Working with Ko at RUTH PLUS The In Sounds has given me the opportunity to get an inside look at the music marketing Here I’ve learned about artist release schedules, gained industry contacts, p",startup,"{'status': '200', 'available': True, 'url': 'http://web.archive.org/web/20220203160634/https://www.theinsounds.com/', 'timestamp': '20220203160634'}",20220203160634.0,1.0
https://glawly.com,22820,crunchbase,"Wayback Machine We will keep fighting for all libraries - stand with us! Internet Archive logo A line drawing of the Internet Archive headquarters building faÃ§ade. Donate icon An illustration of a heart shape ""Donate to the archive"" Search icon An illustration of a magnifying Search icon An illustration of a magnifying Upload icon An illustration of a horizontal line over an up pointing Upload User icon An illustration of a person s head and Sign up | Log in Web icon An illustration of a computer application window Wayback Machine Texts icon An illustration of an open Books Video icon An illustration of two cells of a film Video Audio icon An illustration of an audio Audio Software icon An illustration of a "" floppy Software Images icon An illustration of two Images Donate icon An illustration of a heart shape Donate Ellipses icon An illustration of text More Hamburger icon An icon used to represent a menu that can be toggled by interacting with this Internet Archive Audio Live Music Archive Librivox Free Audio Featured All Audio This Just In Grateful Dead Netlabels Old Time Radio RPMs and Cylinder Recordings Top Audio Books & Poetry Computers, Technology and Science Music, Arts & Culture News & Public Affairs Spirituality & Religion Podcasts Radio News Archive Images Metropolitan Museum Cleveland Museum of Art Featured All Images This Just In Flickr Commons Occupy Wall Street Flickr Cover Art USGS Maps Top NASA Images Solar System Collection Ames Research Center Software Internet Arcade Console Living Room Featured All Software This Just In Old School Emulation Games Historical Software Classic PC Games Software Library Top Kodi Archive and Support File Vintage Software APK Software Software Library Software Sites Tucows Software Library Shareware Software Capsules Compilation Images ZX Spectrum DOOM Level CD Books Books to Borrow Open Library Featured All Books All Texts This Just In Smithsonian Libraries FEDLINK (US) Genealogy Lincoln Collection Top American Libraries Canadian Libraries Universal Library Project Gutenberg Children s Library Biodiversity Heritage Library Books by Language Additional Collections Video TV News Understanding 9 11 Featured All Video This Just In Prelinger Archives Democracy Now! Occupy Wall Street TV NSA Clip Library Top Animation & Cartoons Arts & Music Computers & Technology Cultural & Academic Films Ephemeral Films Movies News & Public Affairs Spirituality & Religion Sports Videos Television Videogame Videos Vlogs Youth Media Search the history of over billion web pages on the Search the Wayback Machine Search icon An illustration of a magnifying Mobile Apps Wayback Machine (iOS) Wayback Machine (Android) Browser Extensions Chrome Firefox Safari Edge Subscription Explore the Collections Learn More Build Collections Save Page Now Capture a web page as it appears now for use as a trusted citation in the Please enter a valid web address About Blog Projects Help Donate Contact Jobs Volunteer People Sign up for free Log in Search metadata Search text contents Search TV news captions Search radio transcripts Search archived web sites Advanced Search About Blog Projects Help Donate Donate icon An illustration of a heart shape Contact Jobs Volunteer People DONATE Latest Show All The Wayback Machine has not archived that Click here to search for all archived pages under https: glawly.com why-glawly . The Wayback Machine requires your browser to support JavaScript, please email if you have any questions about The Wayback Machine is an initiative of the Internet Archive , a (c)(3) , building a digital library of Internet sites and other cultural artifacts in digital Other projects include Open Library & . Your use of the Wayback Machine is subject to the Internet Archive s Terms of Use .   Wayback Machine We will keep fighting for all libraries - stand with us! Internet Archive logo A line drawing of the Internet Archive headquarters building faÃ§ade. Donate icon An illustration of a heart shape ""Donate to the archive"" Search icon An illustration of a magnifying Search icon An illustration of a magnifying Upload icon An illustration of a horizontal line over an up pointing Upload User icon An illustration of a person s head and Sign up | Log in Web icon An illustration of a computer application window Wayback Machine Texts icon An illustration of an open Books Video icon An illustration of two cells of a film Video Audio icon An illustration of an audio Audio Software icon An illustration of a "" floppy Software Images icon An illustration of two Images Donate icon An illustration of a heart shape Donate Ellipses icon An illustration of text More Hamburger icon An icon used to represent a menu that can be toggled by interacting with this Internet Archive Audio Live Music Archive Librivox Free Audio Featured All Audio This Just In Grateful Dead Netlabels Old Time Radio RPMs and Cylinder Recordings Top Audio Books & Poetry Computers, Technology and Science Music, Arts & Culture News &",startup,"{'status': '200', 'available': True, 'url': 'http://web.archive.org/web/20220102161216/https://glawly.com/', 'timestamp': '20220102161216'}",20220102161216.0,1.0
