website,text_len,source,text,type,closest_snapshot,closest_snapshot_time,snapshot_in_window
https://volt-technologies.com/,10279,crunchbase,"Office – Volt Technologies Consulting Services Solutions Business Central Azure Office Power BI Power Apps Type Implementation Upgrade Migration Training Support Industry Retail Apparel Furniture Footwear Pricing About Us Contact Menu Consulting Services Solutions Business Central Azure Office Power BI Power Apps Type Implementation Upgrade Migration Training Support Industry Retail Apparel Furniture Footwear Pricing About Us Contact Linkedin Instagram Office Productivity tools for all of your business Apps That Help You Stay Connected to What Matters Most in Your Business Productivity At Your Fingertips Microsoft Office connects all of your business operations with a full suite of applications that drive Office applications like Word, Excel, PowerPoint, Teams, and so many more integrate directly into all of your other systems to save you time and Ready to Get Moving on Office ? Learn More Copyright Â© Facebook Twitter Linkedin Home Services About Us Blog Contact Menu Home Services About Us Blog Contact Home Services About Us Blog Contact Menu Home Services About Us Blog Contact   Power BI – Volt Technologies Consulting Services Solutions Business Central Azure Office Power BI Power Apps Type Implementation Upgrade Migration Training Support Industry Retail Apparel Furniture Footwear Pricing About Us Contact Menu Consulting Services Solutions Business Central Azure Office Power BI Power Apps Type Implementation Upgrade Migration Training Support Industry Retail Apparel Furniture Footwear Pricing About Us Contact Linkedin Instagram POWER BI Built for all of your data visualization Find Clarity on Your Business Data Data Driven Business Intelligence Reduce the added cost, complexity and security overhead of your analytics platform with a solution that scales with your While also keeping all of your business data secure with security standards built in Power Learn More on How Your Organization Can Leverage PowerBI Get Started Today Copyright Â© Facebook Twitter Linkedin Home Services About Us Blog Contact Menu Home Services About Us Blog Contact Home Services About Us Blog Contact Menu Home Services About Us Blog Contact   Azure – Volt Technologies Consulting Services Solutions Business Central Azure Office Power BI Power Apps Type Implementation Upgrade Migration Training Support Industry Retail Apparel Furniture Footwear Pricing About Us Contact Menu Consulting Services Solutions Business Central Azure Office Power BI Power Apps Type Implementation Upgrade Migration Training Support Industry Retail Apparel Furniture Footwear Pricing About Us Contact Linkedin Instagram Secure, Save and Innovate with azure Don t get left behind the % of Fortune companies leverage the Microsoft Azure Consumer brands and retailers trust Microsoft to secure and host their IT If your company is still leveraging servers, then there is no better time than right now to make the switch to the We will walk you through every step of the Â Save Time Save Money Interoperability Ge Started Today With A Free Assessment Copyright Â© Facebook Twitter Linkedin Home Services About Us Blog Contact Menu Home Services About Us Blog Contact Home Services About Us Blog Contact Menu Home Services About Us Blog Contact   Power Apps – Volt Technologies Consulting Services Solutions Business Central Azure Office Power BI Power Apps Type Implementation Upgrade Migration Training Support Industry Retail Apparel Furniture Footwear Pricing About Us Contact Menu Consulting Services Solutions Business Central Azure Office Power BI Power Apps Type Implementation Upgrade Migration Training Support Industry Retail Apparel Furniture Footwear Pricing About Us Contact Linkedin Instagram Power Apps Powerful business applications built just for Power Apps Drive Business Transformation Adapt Quickly to Drive Results Leveraging Microsoft Power Apps gives your business the flexible it needs to survive and thrive in this technological Power Apps take days to put together as opposed to This enabling you to immediately react to changing industry standards and Want to Learn More? Let s Get in Touch Copyright Â© Facebook Twitter Linkedin Home Services About Us Blog Contact Menu Home Services About Us Blog Contact Home Services About Us Blog Contact Menu Home Services About Us Blog Contact   Business Central – Volt Technologies Consulting Services Solutions Business Central Azure Office Power BI Power Apps Type Implementation Upgrade Migration Training Support Industry Retail Apparel Furniture Footwear Pricing About Us Contact Menu Consulting Services Solutions Business Central Azure Office Power BI Power Apps Type Implementation Upgrade Migration Training Support Industry Retail Apparel Furniture Footwear Pricing About Us Contact Linkedin Instagram Dynamics Business Central Microsoft Dynamics Business Central is a modern Enterprise Resource Planning application that has been released by Microsoft to address the small to business Microsoft Dynamics Business Central provides ",startup,"{'status': '200', 'available': True, 'url': 'http://web.archive.org/web/20220125130448/https://volt-technologies.com/', 'timestamp': '20220125130448'}",20220125130448.0,1.0
https://www.1440.io/,39524,crunchbase,"Commerce Studio: Support, Logistics & Order Management | Skip to content Products Commerce Studio Reputation Studio Translation Studio Messaging Studio Salesforce Company About Us Partners Contact Us Our Reviews Careers Customers Resources Resources Hub Events Case Studies Blog Notice: JavaScript is required for this ° Support, Order and Logistics Management Where retailers go to build the best customer Notice: JavaScript is required for this TODAY S CONSUMER CENTRIC BRANDS SAVE TIME WITH COMMERCE STUDIO Order Management for Today s World Manage orders and returns from many channels in a single Streamlined Order Processing Using customizable workflow rules, automate your entire order fulfillment process based on location, warehouse and stock Data Sync Orders are imported to give you a unified management view, while shipping and status updates are automatically pushed out to each Logistics Automation Maintain higher margins when inventory, accounting and orders are centralized in one Avoid overselling with reorder Backorders & When an out of stock item is ordered, there’s no need to orders can be split and the item will automatically be allocated once Handle Returns, Exchanges & Damages Allow agents to process order changes from multiple channels in one place with workflows that automate messaging and warehouse Process Payments Create manual orders and process payments right from Commerce Studio, regardless of where a customer’s order Multiple Channels, One CRM Empower Customer Service and Support Teams with data and tools at their Better Personalization With contact information, cases and orders synced from all channels, agents can show they know and care about each Faster Communication Response templates are a customizable starting point for common inquiries, and can reduce agent errors and typos while keeping messaging Case Management Create a complete view of a customer’s issue and work to resolve it, maintaining high customer satisfaction even when problems Enhanced Database Customize your database to your unique needs with custom objects and integrations to achieve a view of a customer’s lifetime value (CLV). CTI Automation Access information instantly using Customer Telephony Integration (CTI) to bring up a customer’s record as they call Painless Returns for All Provide a returns portal for customers and allow agents to process returns, exchanges and damages from multiple channels in one Inventory & Supplier Management Made Easy Efficiency happens when every channel and fulfillment location has the same inventory Single Data Source Get an accurate picture of inventory levels across warehouses with real time updates based on multiple channels and Automatic Channel Updates Integrate seamlessly with dozens of marketplaces and channels like Amazon, Walmart and Shopify to sync inventory levels Supplier Management Optimize demand planning without adding manual tasks by automatically sending purchase orders to the right supplier, warehouse, dropshipper, FBA or Accurate Control Track bin locations, manage kits and product bundles, generate barcodes for warehouse staff, manage consignment, dropshippers, returns and Manage Vendor Returns When items are returned, manage the process of receiving and inspecting the stock as well as adjusting inventory and accounting Fulfilled by Amazon Reconcile what Amazon has on hand with sync with Amazon This lets you maintain optimal stock regardless of activities like Demand Planning Dropship & Case Management OVER PARTNERSHIPS (AND GROWING) Pricing That Scales with Your Business Essentials $249 Month Customer Management 1 User Sync Customer Information Customer Messaging Customer Cases Templated Responses Customer Database CTI Call Center Essentials Plus $999 Month Add Order Management 5 Users Sync Orders Modify & Create Orders Returns & Exchanges Payment Processing Order History Sales History Professional $2,499 Month Add Inventory & Purchasing Users Sync Inventory Product Information Management Vendor Management Purchase Order Management Fulfillment Dropship & Automation Enterprise Custom Quote Required Add Analytics & Automation Users Sync Product Listings Serial Lot Tracking Automated Vendor Comparison Automated Warehouse Replenishments Demand Planning & Forecasting Competitive Analytics Pricing That Scales with Your Business Essentials $249 Month Customer Management 1 User Sync Customer Information Customer Messaging Customer Cases Templated Responses Customer Database CTI Call Center Essentials Plus $999 Month Add Order Management 5 Users Sync Orders Modify & Create Orders Returns & Exchanges Payment Processing Order History Sales History Professional $2,499 Month Add Inventory & Purchasing Users Sync Inventory Product Information Management Vendor Management Purchase Order Management Fulfillment Dropship & Automation Enterprise Custom Quote Required Add Analytics & Automation Users Sync Product Listings Serial Lot Tracking Automated Vendor Comparison Automated Wareho",startup,"{'status': '200', 'available': True, 'url': 'http://web.archive.org/web/20220121205853/https://www.1440.io/', 'timestamp': '20220121205853'}",20220121205853.0,1.0
https://firstsignal.us,7414,crunchbase,"Account – FirstSignal Skip to content Home Blog The Science Contact Us Buy Now Home Blog The Science Contact Us Buy Now Search Cart Item added to your cart Check out Continue shopping Reset your password We will send you an email to reset your password Email Submit Cancel Login Email Password Forgot your password? Sign in Create account © First Person Solutions LLC dba FirstSignal All worldwide rights No words, images, audio recordings, or videos on this site may be used for any purpose without prior written permission from First Person Solutions West Baltimore Pike, Suite Media, PA +1 (800) Quick links Contact Us Directions For Use FAQs Feedback Influencer Program Policies Search Subscribe to our emails Email Payment methods American Express Diners Club Discover Mastercard Visa © , FirstSignal Powered by Shopify Choosing a selection results in a full page   FORM Contact Us – FirstSignal Skip to content Home Blog The Science Contact Us Buy Now Home Blog The Science Contact Us Buy Now Search Cart Item added to your cart Check out Continue shopping FORM Contact Us formbuilder:NjI3Mzc= © First Person Solutions LLC dba FirstSignal All worldwide rights No words, images, audio recordings, or videos on this site may be used for any purpose without prior written permission from First Person Solutions West Baltimore Pike, Suite Media, PA +1 (800) Quick links Contact Us Directions For Use FAQs Feedback Influencer Program Policies Search Subscribe to our emails Email Payment methods American Express Diners Club Discover Mastercard Visa © , FirstSignal Powered by Shopify Choosing a selection results in a full page   FirstSignal Skip to content Home Blog The Science Contact Us Buy Now Home Blog The Science Contact Us Buy Now Search Cart Item added to your cart Check out Continue shopping Skip to product information Open media 1 in gallery view FirstSignal opens full screen video in same Open media 2 in gallery view Play video 1 of 2 Cold sore remedy Regular price $19.95 Regular price $29.95 Sale price $19.95 Unit price per Sale Sold out Add to cart Helps reduce or eliminate cold sore symptoms overnight Convenient oral spray 1 fluid ounce milliliters Fresh minty taste Safe natural ingredients Purified water Natural mint flavoring Ascorbic acid (vitamin C) Stevia Potassium sorbate Zinc gluconate HPUS The letters HPUS indicates that the active ingredient is in the official Homeopathic Pharmacopoeia of the United Free standard shipping in the USA % Money Back Guarantee Made in the USA 🇺🇸 These statements have not been evaluated by the Food and Drug This product is not intended to diagnose, treat, cure or prevent any The Science Give Us Feedback Directions For Use Customer Testimonials Worked extremely well Helped reduce my symptoms Sarah Eliminates soreness within two or three days I have had cold sores around my mouth most of my adult I probably get them a half dozen times per year and the onset is usually associated with a cold or The best treatment that I have found is If I really rub in Abreva early enough at the onset of a sore, I can avoid having it break out into a It does seem though that it is still “sore” for about ten This year I started using FirstSignal and Abreva when I have a cold For the last three incidents, I have found that I can eliminate even the soreness within two or three days by using both treatments Joel, Media PA Next morning, the cold sores were completely gone About a year and a half ago, I started getting cold sores on my lips every three The first two times, my doctor prescribed Acyclovir (200mg) and Those didn t seem to work and my symptoms went away after about The next time, my doctor gave me a stronger dose of Valacyclovir (1g) and Valtrex (2000 mg) with However, it didn t appear to work either and my cold sores went away after about 9 The fourth time (about 3 months later) I got another cold sore, I applied the docosanol and sprayed FirstSignal under my tongue The next morning, I woke up and the cold sores were completely I haven t had a cold sore in the past 5 or 6 Rob J, Mill Valley CA These statements have not been evaluated by the Food and Drug This product is not intended to diagnose, treat, cure or prevent any © First Person Solutions LLC dba FirstSignal All worldwide rights No words, images, audio recordings, or videos on this site may be used for any purpose without prior written permission from First Person Solutions West Baltimore Pike, Suite Media, PA +1 (800) Quick links Contact Us Directions For Use FAQs Feedback Influencer Program Policies Search Subscribe to our emails Email Payment methods American Express Diners Club Discover Mastercard Visa © , FirstSignal Powered by Shopify Choosing a selection results in a full page   Home – FirstSignal Skip to content 🚚 Free expedited shipping in the USA 🚚 Home The Science Contact Us Buy Now Log in Home The Science Contact Us Buy Now Search Log in Cart Item added to your cart Check out Continue shopping We resonate health Buy Now The",startup,"{'status': '200', 'available': True, 'url': 'http://web.archive.org/web/20220111221859/https://firstsignal.us/', 'timestamp': '20220111221859'}",20220111221859.0,1.0
https://limedigitalmedia.com,42820,crunchbase,"Social Media Marketing - Lime Digital Media Instagram Youtube Yelp Home About Services Website Development Brand Development Search Engine Optimization Social Media Marketing Copywriting Video Production Lime Premium Package Our Work Lead Automation FAQ Blog Opportunities Funding Program Become a Partner Website % Savings Menu Home About Services Website Development Brand Development Search Engine Optimization Social Media Marketing Copywriting Video Production Lime Premium Package Our Work Lead Automation FAQ Blog Opportunities Funding Program Become a Partner Website % Savings Contact Search Close OPTIMIZE YOUR SOCIAL MEDIA PRESENCE From account creation to optimization – increase your brand awareness and connect to the right people that are interested in your product or Get A FREE QUOTE Target Hit Points We listen and we learn what your crowd Aside from adhering to your brand guidelines, we curate your social media content so that it resonates personally to your target These are some of the instruments we employ to earn their loyalty: Follow Target Audience Craft Original Content Create Appropriate Copy Design Engaging Graphics Captivating Animate Videos Enlightening Infographics Analytical Approach As much as we want to listen to the audience, we also look into what the numbers tell We have our Key Performance Indicators (KPIs) to let us know the efficacy of each Numbers don’t lie, and that is why we always plan analytically with data from: Monthly Analytics Reports A B testing Social Media Strategies Campaign Performance Monitoring Daily Engagement in Social Media Platforms Best Practices To be on the top, we are always curious about the latest trends in social media We also employ different effective techniques for different channels, such as being hip for Facebook or formal We operate on all social media platforms: Facebook Instagram LinkedIn Pinterest YouTube Twitter Google MyBusiness Partner with a Social Media Powerhouse Lime Digital social media marketing company in Huntington Beach, Orange County, If you avail of our SMM packages you get to collaborate with the following service specialists: Prolific Content Curators Content is Nothing beats engaging your audience with content that is relevant to their Our content creators will curate the ideal original content just for your Graphics Designers The design of your visuals matters how you connect your target market, such as generating the perfect reaction from After all, you do not want to be sending mixed We can help you create these types of Multimedia Creators If you are not a fan of static posts, then our animated videos will surely excite You will certainly impress them with this type of content from start to Our created videos are not just appealing, but they are also informative and Effective Copywriting Specialists There is only so much information we can fit in That is why we put efforts into devising a suitable social media copy that increases your brand awareness, trust, and loyalty, which will help all the social media campaigns Proficient Brand Strategists Our brand strategist will help you establish your growth according to your brand’s They will ensure that your social media presence is consistent with this and will also review that all materials, such as graphics and captions, are in tune with how your consumer perceives your Adept Data Analysts We always aim to give you the best, and we do not just implement content without data and numbers to back it We will figure out what social media posts will increase your Additionally, you are entitled to a monthly analytics report for the social media performance Competent Social Media Ads Specialists We do not have dirty tricks on our sleeves, and we will guarantee you organic growth not just from the stream of posts but also in They are responsible for generating the right people to follow your page and devise a plan to continue their patronage and eventually maximize your reach in the social media Reliable Dedicated Account Managers You do not need to constantly be on top of all your social media engagements because a dedicated media manager will manage all the engagements (comments, likes, follow target audience) on all social Lime Digital Social Media Marketing Packages Get all the support you need with Lime Digital Agency for all your social media marketing In addition, each of these packages will include a varying degree of customization and For recommended social media accounts platforms consistent with branding guidelines which includes main colors, about us descriptions, and main branded images ClickFunnel landing page design only,copywriting, and email setup not included Minimum of 6 months to avail Features Setup and Optimization Social Media Platform of Choice Graphic Post per Week Set up Pixel on the Website Content Curation Posts per week Animated Videos per Month Infographic Style Post per Month Landing page setup a month for funnels Social Media Channel Postings and Manage",startup,"{'status': '200', 'available': True, 'url': 'http://web.archive.org/web/20211211210428/https://limedigitalmedia.com/', 'timestamp': '20211211210428'}",20211211210428.0,1.0
https://caringcovehospice.com,83,crunchbase, Caring Cove Hospice Our website is under construction and will be live very soon! ,startup,"{'status': '200', 'available': True, 'url': 'http://web.archive.org/web/20211128052504/http://caringcovehospice.com/', 'timestamp': '20211128052504'}",20211128052504.0,1.0
