website,text_len,source,text,type,closest_snapshot,closest_snapshot_time,snapshot_in_window
http://tomarket.farm,1811,crunchbase," To Market Toggle navigation Sign In Sign in Email Password Forgot your password? Didn t receive confirmation instructions? Need an Account? Chefs Sign Up Purveyors Request an Invite Consumers Sign Up ©2020 Find Better Food, Terms and Conditions   To Market Toggle navigation Sign In Purveyors Request an Invite Your name Your email address Your phone number Comments Nickname Leave this field blank! ©2020 Find Better Food, Terms and Conditions   Domain has been assigned Domain has been Please go to the site settings and put the domain name in the Domain   To Market Toggle navigation Sign In Who s In? FILTERS: Clear Filters Go Filter by Category ©2020 Find Better Food, Terms and Conditions   To Market Toggle navigation Sign In Find Better Food Bringing Chefs to Farmers, and the Farmers to Market What Is To Market ? To Market is a platform that connects purveyors of local edible goods directly to restaurants and chefs that need them the To Market is a simple online marketplace for sourcing and selling the highest quality local Farmers Simply track your inventory online and it automatically becomes available to local Chefs for easy online Just set your prices and availability and your business is open for online ordering! Request an Invite Chefs Take the guesswork out of ordering your Stop losing track of orders and cut your ordering time so you can spend more time in the kitchen! The finest local farms are just a click away with easy online ordering and Request an Invite Our Participating Growers & Buyers View List The Team The best of both worlds: FOOD + TECH David “Moose” Moosman Founder and CEO Ken Boggs CFO Bryan Wachs Market Leader Alex Mathieu Market Leader Stirling Olson Product Developer Contact Us | Billing and Shipping To Market W Arvada, CO © To Market Terms and Conditions ",startup,"{'status': '200', 'available': True, 'url': 'http://web.archive.org/web/20190102050404/https://www.tomarket.farm/', 'timestamp': '20190102050404'}",20190102050404.0,1.0
https://www.filejet.com,5272,crunchbase,"Plans | Filejet Pioneer Blvd Suite 8, Santa Fe Springs, CA Call Us: +1 (949) Toggle navigation Plans Blog About Us Contact Us Login plans Base Platform The Base Platform is powerful and lets users have access to sharable Entity Profile and Compliance Notifications in addition to all the features noted It also gives users the ability to perform “A La Carte” formation and compliance tasks only as $25 per entity annually Fully Automated Platform FileJet’s Fully Automated platform leverages expanded platform access and deeply discounted services like automated Registered Agent, Custom Reporting tools, all Entity Formation and Compliance Training and bulk along with live customer support are $100 per entity annually Fully Managed What else can we say?! FileJet handles everything! A designated customer service account representative is assigned to you and will contact you directly when compliance items are All you have to do is answer a few questions when we FileJet takes it from Let your team focus on what they do best and forget worrying about staying in Quoted per entity annually Schedule Demo All the above plans include: Unlimited User Seats and at No Additional Costs Centralized Digital Platforms with Individual Portals Truly Digital Entity Profile & Repository - Upload & Share Between Stakeholders Capabilities – all States Integrable Calendaring with Actionable Notifications Customizable Compliance Reminders – Perfect for Licenses, Trademarks, Ask us about White Labeling and Reseller Contact Us Privacy Notice Terms and Conditions ACA Info Security Features © Copyright Filejet   About Us | Filejet Pioneer Blvd Suite 8, Santa Fe Springs, CA Call Us: +1 (949) Toggle navigation Plans Blog About Us Contact Us Login About Us “FileJet is the place for legal and accounting professionals to gather, process, file, and maintain legal entity ” Complete Entity Lifecycle Automation We are the only fully automated tech platform for entity formation and compliance in the that will keep you organized in our secure environment - making compliance easy, transparent, and What’s sets us apart? We bring a lot to the table for our FileJet was born out of our customer’s Over the last 4 decades, we’ve watched the legal service industry evolve (or not evolve in most cases!) and heard our customer’s desires for a solution where they can form and manage their business entities in all The solution was clear…. one single fully automated software platform where customers can manage the complete entity lifecycle, without needing to know the nuances and intricacies of each Customers could also access and securely share their entities with anyone FileJet’s team is made up of over + unique, amazing, and talented individuals spread across the globe who bring decades of legal service and technical By combining those attributes, and listening to our customers, the team has created an , yet powerful tool for our customers that we call FileJet’s unique combination of domain expertise and proprietary technology has unlocked what’s Privacy Notice Terms and Conditions ACA Info Security Features © Copyright Filejet   Contact Us | Filejet Pioneer Blvd Suite 8, Santa Fe Springs, CA Call Us: +1 (949) Toggle navigation Plans Blog About Us Contact Us Login Contact Us Pioneer Blvd Suite 8 Santa Fe Springs, CA Phone: +1 (949) Privacy Notice Terms and Conditions ACA Info Security Features © Copyright Filejet   Filejet | Entity Formation & Maintenance Simplified® Pioneer Blvd Suite 8, Santa Fe Springs, CA Call Us: +1 (949) Toggle navigation Plans Blog About Us Contact Us Login The world’s easiest platform to form and manage business Filejet will help you take the pain out of corporate filing and Schedule Demo OVER % of all business entities are out of Are yours? what filejet can do for you Take the hassle out of corporate filing and We get Maintenance and filing is the least exciting – and sometimes the most time consuming and – part of the business entity life cycle for legal and finance Eliminate Hassle An intuitive platform that takes the legwork out of starting and maintaining businesses on behalf of your clients, ensuring that you never miss a compliance deadline Save Time FileJet speeds up what slows you down, fueling your service to your clients while reducing your Increase Profits Put more money in your pocket by stop racking up compliance penalties and leverage FileJet’s bundled service FEATURe Feature FileJet creates a data and audit trail, ensuring client accountability for the information they’ve It’s Your clients visit their personal portals, input their information for filing, and submit it directly to Handle the simple filing process without turning clients away to another service provider or paying outsourcing Our intuitive, simple interface empowers you to create a custom branded experience tailored to your clients’ FileJet has emerged as a nationwide platform and solution serving all FileJet creates a data and audit trail, ensuring client a",startup,"{'status': '200', 'available': True, 'url': 'http://web.archive.org/web/20210408000754/https://www.filejet.com/', 'timestamp': '20210408000754'}",20210408000754.0,0.0
https://loyaltybrands.com,33937,crunchbase,"Loyalty Brands Blog | Loyalty Brands | Loyalty Brands About Our Brands Blog Request info Referral Program Call us chevron_left chevron_right search Searching LOYALTY BRANDS BLOG Everything You Need to Know About Franchises Owning a franchise is an excellent way of learning the ropes of running a Read on to find out whether owning a franchise the right move for Read More Apr , 7 minutes Get more info The Top Habits of Successful People Read More Many people seek success but only some achieve With this in mind, what daily habits can anyone learn so that they can also become successful? Apr 9, minutes The Top Habits of Successful People Many people seek success but only some achieve With this in mind, what daily habits can anyone learn so that they can also become successful? Read More Apr 9, minutes 9 Tips To Help With Your Business Owner Stress Management Managing the stress that comes with a business can be We ve explored business stress management techniques to help keep your stress Read More Mar 2, 7 minutes Most Successful Morning Routines of Successful Entrepreneurs What kinds of morning routines do you engage in each day? Are they actually helping you move the needle forward or are they just keeping you afloat? With the morning routines of successful people, you can start moving ahead, in the direction you want to Read More Feb 7, OTHER ARTICLES Owning a franchise is an excellent way of learning the ropes of running a Read on to find out whether owning a franchise the right move for Everything You Need to Know About Franchises Apr , 7 minutes Many people seek success but only some achieve With this in mind, what daily habits can anyone learn so that they can also become successful? The Top Habits of Successful People Apr 9, minutes Managing the stress that comes with a business can be We ve explored business stress management techniques to help keep your stress 9 Tips To Help With Your Business Owner Stress Management Mar 2, 7 minutes What kinds of morning routines do you engage in each day? Are they actually helping you move the needle forward or are they just keeping you afloat? With the morning routines of successful people, you can start moving ahead, in the direction you want to Most Successful Morning Routines of Successful Entrepreneurs Feb 7, More articles About Leadership Blog Contact Us © Loyalty Brands All Rights Reserved Press Referral Program DISCLAIMER : This franchising information is not intended as an offer to sell, or the solicitation of an offer to buy, a It is for information purposes The following states regulate the offer and sale of These states are California, Hawaii, Illinois, Indiana, Maryland, Michigan, Minnesota, New York, North Dakota, Oregon, Rhode Island, South Dakota, Virginia, Washington and If you are a resident of one of these states or intend to operate a franchise in any of these states, we will not offer or sell you a franchise unless and until we have complied with any applicable registration and or disclosure requirements in your This offering of a In New York can only be made by a prospectus that has been previously filed and registered with the Department of Law of the State of New The application for registration of an offering prospectus or the acceptance and filing by the Department of Law as required by the State of New York law does not constitute NY approval of the offering or the sale of such franchise by the Department of Law or the attorney general of New The California Department of Corporations has not reviewed or approved our Any complaints regarding the website or its contents may be made to gov . Powered by Synergy Explore Content Manager Cancel Close close Close close Close close Cancel Cancel Save Cancel   Loyalty Brands About Our Brands Blog Request info Referral Program Call us chevron_left chevron_right About Leadership Blog Contact Us © Loyalty Brands All Rights Reserved Press Referral Program DISCLAIMER : This franchising information is not intended as an offer to sell, or the solicitation of an offer to buy, a It is for information purposes The following states regulate the offer and sale of These states are California, Hawaii, Illinois, Indiana, Maryland, Michigan, Minnesota, New York, North Dakota, Oregon, Rhode Island, South Dakota, Virginia, Washington and If you are a resident of one of these states or intend to operate a franchise in any of these states, we will not offer or sell you a franchise unless and until we have complied with any applicable registration and or disclosure requirements in your This offering of a In New York can only be made by a prospectus that has been previously filed and registered with the Department of Law of the State of New The application for registration of an offering prospectus or the acceptance and filing by the Department of Law as required by the State of New York law does not constitute NY approval of the offering or the sale of such franchise by the Department of Law or the attorney general of ",startup,"{'status': '200', 'available': True, 'url': 'http://web.archive.org/web/20200423153602/https://loyaltybrands.com/', 'timestamp': '20200423153602'}",20200423153602.0,1.0
https://lussorealty.com,19889,crunchbase,"Neighborhoods Archive - Lusso Realty Find A Real Estate Agent Popular Areas of WNC Inspiration Toggle navigation Get to Know Lusso Realty Search Homes for Sale Sell Your Home Find A Real Estate Agent Popular Areas of WNC Inspiration Sell Your Home Popular Areas Home Neighborhoods Downtown Asheville Downtown Asheville is the urban, refined heart of the wild Asheville features the South’s finest dining, breweries, arts and entertainment within walking distance of elegant condos and chic Slightly south, neighborhoods like South French Broad are marked by cozy Californias and Claxton and Charlotte Street, just north of town, offer sustainable, green new construction and community Asheville has rightly been called the Paris of the South, and with Lusso Realty, it’s all within your Properties in Downtown Asheville South Asheville Bustling South Asheville brings a little big city balance to Asheville’s hip and funky With stylish planned communities like Biltmore Park, you can enjoy elegant dining and shopping within walking distance, then drive ten minutes to the Nantahala National Forest for a hike or picnic! Rapidly growing locales like Arden provide accessible options for homebuyers, while upscale Biltmore Forest offers luxurious living in a classic Lusso Realty’s intimate knowledge of South Asheville can help you find your first home – or your Properties in South Asheville Mills River Mills River offers rural living in a picturesque mountain valley, with easy access to the rich culture of both Asheville to the north and Hendersonville to the For constant travelers, the Asheville Regional Airport is minutes away, while the Nantahala National Forest along the western edge of Mills River provides outdoor wonders for those who prefer their adventures closer to Mills River means variety – farm houses with acreage, ranch homes in quiet neighborhoods, or cozy cottages nestled in the shadow of a Let Lusso Realty find your perfect fit in Mills River Properties in Mills River Arden Nestled between South Asheville and Fletcher, Arden provides quick access to artsy Asheville, the glories of the Nantahala National Forest, and Whether it’s enjoying a summer picnic at Lake Julian, shopping at Biltmore Park, or chowing down on ribs at Bones, Arden has attractions closer to home as Affordable, comfortable, and close to highly rated schools, Arden is perfect for Let Lusso Realty light your way in Arden today! Properties in Arden Woodfin Bordering the picturesque French Broad River, Woodfin’s small town charm lies mere minutes away from downtown You can shop at Reynolds Mountain, stroll through the Botanical Gardens, attend a lecture at the University of North Carolina at Asheville, and be back home in no time at Woodfin offers affordability and value a stone’s throw from – perfect for everyone from homebuyers to those looking for a mountaintop dream Lusso Realty’s local expertise can be the ultimate boon in your home search – get in touch today to find out how! Properties in Woodfin Beaver Lake Sed tempus ac tortor blandit Integer pulvinar, enim interdum porta imperdiet, ex leo aliquet risus, at tincidunt odio sem quis Curabitur magna ligula, scelerisque nec metus eget, sodales facilisis Etiam sollicitudin nunc at turpis iaculis, tempus feugiat dui Fusce in facilisis Aliquam venenatis vel orci ac Fusce non diam at tortor gravida lacinia at et Nulla Properties in Beaver Lake Canton Straddling the Pigeon River, Canton is the epitome of a winsome mountain Bordering the Nantahala National Forest, Canton offers affordable and quiet living with quick driving times to any outdoor adventure your heart could It’s not just mountain charm, however – Asheville’s hip influence is still felt in Refuel with a great craft IPA at BearWaters Brewing or a bowl of shrimp and grits at Southern Porch after that hike in the National Don’t sleep on Canton – let Lusso Realty help you settle into an appealing new home Properties in Canton North Asheville Sed tempus ac tortor blandit Integer pulvinar, enim interdum porta imperdiet, ex leo aliquet risus, at tincidunt odio sem quis Curabitur magna ligula, scelerisque nec metus eget, sodales facilisis Etiam sollicitudin nunc at turpis iaculis, tempus feugiat dui Fusce in facilisis Aliquam venenatis vel orci ac Fusce non diam at tortor gravida lacinia at et Nulla Properties in North Asheville Waynesville Waynesville is a little mountain town on the The Gateway to the Smokies features hip breweries, great smokehouses, funky art galleries and old school dining favorites like Clyde’s. Unique neighborhoods like Hazelwood, Allens Creek, and Ninevah offer affordable options for homebuyers seeking distinctive Nearby Cherokee, Cullowhee, Sylva, and Maggie Valley provide day trip diversions for those seeking to explore mountain Lusso Realty’s expert team knows every nook and holler in Waynesville – let us show you around! Properties in Waynesville Candler Candler might be Western North Carolina’s best kept Bordering",startup,"{'status': '200', 'available': True, 'url': 'http://web.archive.org/web/20180818221938/https://lussorealty.com/', 'timestamp': '20180818221938'}",20180818221938.0,1.0
https://www.weavemarkets.com/,821,crunchbase," Email Protection | Cloudflare Please enable Email Protection You are unable to access this email address The website from which you got to this page is protected by Email addresses on that page have been hidden in order to keep them from being accessed by malicious You must enable Javascript in your browser in order to decode the address . If you have a website and are interested in protecting it in a similar way, you can sign up for Cloudflare . How does Cloudflare protect email addresses on website from spammers? Can I sign up for Cloudflare? Cloudflare Ray ID: • Your IP: Click to reveal • Performance & security by Cloudflare   Weave Markets Weave Markets is a next generation, investment firm, focusing on providing scalable and secure infrastructure for trading across digital Email LinkedIn © Weave Markets ",startup,"{'status': '200', 'available': True, 'url': 'http://web.archive.org/web/20201215195047/https://www.weavemarkets.com/', 'timestamp': '20201215195047'}",20201215195047.0,1.0
https://www.valleyridgeapts.com,54683,crunchbase,"Wayback Machine We will keep fighting for all libraries - stand with us! Internet Archive logo A line drawing of the Internet Archive headquarters building faÃ§ade. Donate icon An illustration of a heart shape ""Donate to the archive"" Search icon An illustration of a magnifying Search icon An illustration of a magnifying Upload icon An illustration of a horizontal line over an up pointing Upload User icon An illustration of a person s head and Sign up | Log in Web icon An illustration of a computer application window Wayback Machine Texts icon An illustration of an open Books Video icon An illustration of two cells of a film Video Audio icon An illustration of an audio Audio Software icon An illustration of a "" floppy Software Images icon An illustration of two Images Donate icon An illustration of a heart shape Donate Ellipses icon An illustration of text More Hamburger icon An icon used to represent a menu that can be toggled by interacting with this Internet Archive Audio Live Music Archive Librivox Free Audio Featured All Audio This Just In Grateful Dead Netlabels Old Time Radio RPMs and Cylinder Recordings Top Audio Books & Poetry Computers, Technology and Science Music, Arts & Culture News & Public Affairs Spirituality & Religion Podcasts Radio News Archive Images Metropolitan Museum Cleveland Museum of Art Featured All Images This Just In Flickr Commons Occupy Wall Street Flickr Cover Art USGS Maps Top NASA Images Solar System Collection Ames Research Center Software Internet Arcade Console Living Room Featured All Software This Just In Old School Emulation Games Historical Software Classic PC Games Software Library Top Kodi Archive and Support File Vintage Software APK Software Software Library Software Sites Tucows Software Library Shareware Software Capsules Compilation Images ZX Spectrum DOOM Level CD Books Books to Borrow Open Library Featured All Books All Texts This Just In Smithsonian Libraries FEDLINK (US) Genealogy Lincoln Collection Top American Libraries Canadian Libraries Universal Library Project Gutenberg Children s Library Biodiversity Heritage Library Books by Language Additional Collections Video TV News Understanding 9 11 Featured All Video This Just In Prelinger Archives Democracy Now! Occupy Wall Street TV NSA Clip Library Top Animation & Cartoons Arts & Music Computers & Technology Cultural & Academic Films Ephemeral Films Movies News & Public Affairs Spirituality & Religion Sports Videos Television Videogame Videos Vlogs Youth Media Search the history of over billion web pages on the Search the Wayback Machine Search icon An illustration of a magnifying Mobile Apps Wayback Machine (iOS) Wayback Machine (Android) Browser Extensions Chrome Firefox Safari Edge Subscription Explore the Collections Learn More Build Collections Save Page Now Capture a web page as it appears now for use as a trusted citation in the Please enter a valid web address About Blog Projects Help Donate Contact Jobs Volunteer People Sign up for free Log in Search metadata Search text contents Search TV news captions Search radio transcripts Search archived web sites Advanced Search About Blog Projects Help Donate Donate icon An illustration of a heart shape Contact Jobs Volunteer People DONATE Latest Show All The Wayback Machine has not archived that Click here to search for all archived pages under https: www.valleyridgeapts.com el-paso valley-ridge floorplans . The Wayback Machine requires your browser to support JavaScript, please email if you have any questions about The Wayback Machine is an initiative of the Internet Archive , a (c)(3) , building a digital library of Internet sites and other cultural artifacts in digital Other projects include Open Library & . Your use of the Wayback Machine is subject to the Internet Archive s Terms of Use .   Apply To Live At Valley Ridge Javascript has been disabled on your browser, so some functionality on the site may be Enable javascript in your browser to ensure full Chat Now Schedule a Tour Text Us (877) Home Floor Plans Photos & Tour Directions Residents Pay Rent Maintenance Contact Apply Contact Apply Online Create Account Login Have a quote id? Enter a quote id to view your available quotes and start an Quote Id View Quotes Already have an account? If you have already started an application, please login to Email Quote Id Password Login Forgot Generate password? Create an Account to Begin - In order to start an application for this group booking reservation, you need to first select a Search Floor Plans To start your application, create an We will be able to save your progress and enable you to come back anytime to check on the status of your For any questions, please call (877) . Or, use our Live Chat option at any point in the Occupant Type Primary Legal First Name Last Name Primary Phone Home Office Mobile Secondary Phone Home Office Mobile Email Password Confirm Password How did you hear about us? Select One AHRN Craigslist Drive By Facebook Facebook Grou",startup,"{'status': '200', 'available': True, 'url': 'http://web.archive.org/web/20190123055931/https://www.valleyridgeapts.com/', 'timestamp': '20190123055931'}",20190123055931.0,1.0
