website,text_len,source,text,type,closest_snapshot,closest_snapshot_time,snapshot_in_window
https://moddermatology.com/,5705,crunchbase,"Call Location Forms Menu Search Search Medical & Pediatric Dermatology Rosacea Acne Skin Examinations Psoriasis Eczema & Atopic Dermatitis Dermatitis & Rashes Alopecia & Hair Loss Vitiligo Nail Diseases Warts & Molluscum Surgical Dermatology Skin Cancer Benign Growths Cosmetic Dermatology Botox & Fillers Microneedling & PRP Injections Spider Veins Chemical Peels & More About Us Patient Center What to Expect Contact Us Career Opportunities Call today to schedule your appointment! call No Results Found The page you requested could not be Try refining your search, or use the navigation above to locate what you are looking Visit Our Patient Center S Street, Suite Omaha, NE Fax: Join Our Team Home Contact Privacy Policy Sitemap Terms of Service © MOD Designed by Sleight   About Us | MOD Dermatology Call Location Forms Menu Search Search Medical & Pediatric Dermatology Rosacea Acne Skin Examinations Psoriasis Eczema & Atopic Dermatitis Dermatitis & Rashes Alopecia & Hair Loss Vitiligo Nail Diseases Warts & Molluscum Surgical Dermatology Skin Cancer Benign Growths Cosmetic Dermatology Botox & Fillers Microneedling & PRP Injections Spider Veins Chemical Peels & More About Us Patient Center What to Expect Contact Us Career Opportunities Call today to schedule your appointment! call About Us Melanie Ortleb is a Nebraska She trained on full scholarship at the University of Nebraska at Omaha, graduating summa cum laude with a degree in She then trained for her medical degree on full scholarship at the University of Nebraska Medical Center and graduated with highest distinction in as the Salutatorian in her She moved to Nashville, Tennessee to complete her dermatology training at Vanderbilt University, where she served as chief Her love for Nebraska and family brought her back to Omaha after Ortleb is board certified by the American Board of Dermatology and a member of the American Academy of Dermatology, the American Society for Dermatologic Surgery and Nebraska Dermatology Outside of work Ortleb enjoys spending time with her husband and 3 Call to make an appointment! Visit Our Patient Center S Street, Suite Omaha, NE Fax: Join Our Team Home Contact Privacy Policy Sitemap Terms of Service © MOD Designed by Sleight   Call Location Forms Menu Search Search Medical & Pediatric Dermatology Rosacea Acne Skin Examinations Psoriasis Eczema & Atopic Dermatitis Dermatitis & Rashes Alopecia & Hair Loss Vitiligo Nail Diseases Warts & Molluscum Surgical Dermatology Skin Cancer Benign Growths Cosmetic Dermatology Botox & Fillers Microneedling & PRP Injections Spider Veins Chemical Peels & More About Us Patient Center What to Expect Contact Us Career Opportunities Call today to schedule your appointment! call No Results Found The page you requested could not be Try refining your search, or use the navigation above to locate what you are looking Visit Our Patient Center S Street, Suite Omaha, NE Fax: Join Our Team Home Contact Privacy Policy Sitemap Terms of Service © MOD Designed by Sleight   Contact Us | MOD Dermatology Call Location Forms Menu Search Search Medical & Pediatric Dermatology Rosacea Acne Skin Examinations Psoriasis Eczema & Atopic Dermatitis Dermatitis & Rashes Alopecia & Hair Loss Vitiligo Nail Diseases Warts & Molluscum Surgical Dermatology Skin Cancer Benign Growths Cosmetic Dermatology Botox & Fillers Microneedling & PRP Injections Spider Veins Chemical Peels & More About Us Patient Center What to Expect Contact Us Career Opportunities Call today to schedule your appointment! call Contact Us Thank you for your interest in MOD Please use this form to contact Your submission will be returned by phone Please do not send any medical questions or concerns via this form, but rather call us at S Street, Suite Omaha, Nebraska Phone: Fax: Name First Last Phone What would you like to be contacted about? Please check all that apply: I would like to schedule a medical appointment with Ortleb I would like to schedule a cosmetic consultation with Ortleb I would like to speak with the billing department I would like to speak with the practice manager Other Other CAPTCHA Visit Our Patient Center S Street, Suite Omaha, NE Fax: Join Our Team Home Contact Privacy Policy Sitemap Terms of Service © MOD Designed by Sleight   MOD Dermatology | Contact Us (402) Home Services About Us Careers Contact Us Select Page Giving You The Personal Care You Deserve Learn more Improving Your Quality of Life Through Specialized Skin Care Schedule An Appointment Welcome! Our goal at MOD Dermatology is to provide a modern approach to your dermatologic This means placing the patient’s needs first while practicing We focus on involving the patient in the process and developing a treatment plan that will not only be effective but also align with what is important to the We specialize in all diseases related to skin, hair and Focus on prevention of skin disease is emphasized as We hope you will join us in our team approach to restoring your skin to its n",startup,"{'status': '200', 'available': True, 'url': 'http://web.archive.org/web/20180823032842/https://moddermatology.com/', 'timestamp': '20180823032842'}",20180823032842.0,1.0
https://marathonls.com,12150,crunchbase,"Equipment We Service – MarathonLS Skip to content Call Us Today! | LinkedIn Home About Us Our Approach Capabilities Equipment We Service Value of PM Services Service Plans COVID – Products Contact Equipment We Service Sarah Hawkins :32:43+00:00 MarathonLS provides expert maintenance, repair, and calibration services for a wide range of scientific We are always expanding our capabilities so be sure to contact us if you have a specific equipment Equipment Equipment Description Manufacturers Centrifuge Refrigerated, Benchtop All Floor Centrifuge Floor Model, Highspeed Beckman Coulter UltraCentrifuges Beckman Coulter Vaccufuge All Incubator Shaker Refrigerated, Floor Model All Incubator CO2, , Benchtop, Stackable All Open Air Shaker Benchtop, Floor All PCR Thermocycler Regular All PCR Thermocycler Real Time Eppendorf Roto Evaporators All Liquid Handler EP Motion Series Eppendorf ThermoMixer All Heat Block All Liquid Nitrogen Freezer All Lyophilizer Freeze Dryer Labconco Lab Water System DI Ultrapure water systems All Vacuum Pump All Environmental Chamber All At MarathonLS, we are always expanding our technical Are you seeking a new partner to maintain, repair or calibrate a particular instrument? At MarathonLS, we seek to go above and beyond for our That’s why we are constantly expanding our technical In addition, we are committed to getting professional service training to accommodate your instrument Contact us to learn our full capabilities and discuss your lab’s unique NIST Traceable – ISO IEC Calibrated The MarathonLS quality system is a program documenting and recording all details of calibration All tools are NIST traceable and calibrated to ISO IEC All verifications and calibrations performed have detailed documentation traceable to these MarathonLS utilizes only recognized brands of testing equipment to ensure consistent results of the highest CONTACT INFO | Phone: | Email: Copyright © - MarathonLS | ALL RIGHTS RESERVED | Privacy LinkedIn   Capabilities – MarathonLS Skip to content Call Us Today! | LinkedIn Home About Us Our Approach Capabilities Equipment We Service Value of PM Services Service Plans COVID – Products Contact Capabilities Sarah Hawkins :59:52+00:00 A partner focused on maximizing uptime and instrument performance MarathonLS is dedicated to delivering a superior customer experience in the maintenance, repair, and calibration of life sciences laboratory We offer deep technical expertise, seek to maximize uptime and instrument performance, and provide a range of comprehensive and flexible service We understand the urgency of maintenance and repairs, and the value of detailed documentation MarathonLS understands the urgency to scientific laboratory experimentation and That’s why we offer expert technicians who seek to maximize uptime with your scientific Our , brand technicians have years of industry We guarantee a or emergency response and house an extensive spare parts inventory – all with the goal of getting your scientific equipment back up and running as quickly as MarathonLS also provides detailed documentation and service reporting so that you don’t have to chase it down when you need Equipment Serviced Centrifuges Floor Centrifuges Incubators Incubator Shakers Open Air Shakers PCRs Thermocyclers Liquid Handlers ThermoMixers Heat Blocks Liquid Nitrogen Freezers Lyophilizers Freeze Dryers View Full Equipment List Proactive Partner for Preventative Maintenance Preventative maintenance gives you peace of mind that your equipment will work correctly when it’s THE VALUE OF PREVENTATIVE MAINTENANCE Partner with Flexible Plans Comprehensive services and flexible contract options tailored to your needs — all to keep your laboratory equipment running at is OUR SERVICE PLAN OPTIONS NIST Traceable – ISO IEC Calibrated The MarathonLS quality system is a program documenting and recording all details of calibration All tools are NIST traceable and calibrated to ISO IEC All verifications and calibrations performed have detailed documentation traceable to these MarathonLS utilizes only recognized brands of testing equipment to ensure consistent results of the highest CONTACT INFO | Phone: | Email: Copyright © - MarathonLS | ALL RIGHTS RESERVED | Privacy LinkedIn   Our Approach – MarathonLS Skip to content Call Us Today! | LinkedIn Home About Us Our Approach Capabilities Equipment We Service Value of PM Services Service Plans COVID – Products Contact Our Approach Sarah Hawkins :51:36+00:00 Delivering a superior customer experience in service, repair, and maintenance of scientific laboratory equipment At MarathonLS, we’re inspired by the relentless efforts of the Life Sciences industry to create better That’s why we believe those who manage life sciences laboratory equipment performance need a better choice in service Some service vendors make you wait too long for Smaller organizations don’t have an extensive spare parts inventory or strong Neither choice provides detailed documentation about equipm",startup,"{'status': '200', 'available': True, 'url': 'http://web.archive.org/web/20200808055828/https://marathonls.com/', 'timestamp': '20200808055828'}",20200808055828.0,1.0
https://www.mytide.io,4631,crunchbase," Mytide Order News Technology About Contact Log In Order News Technology About Contact Log In Solving molecular scarcity See more Contact Us D Street, Suite Boston, MA copyright Â© mytide therapeutics   Mytide Therapeutics Order News Technology About Contact Log In Order News Technology About Contact Log In Scroll changing paradigms in the rapidly growing peptide therapeutics market Mytide is opening its groundbreaking manufacturing platform to partners accelerating their R&D beta program Mytide is committed to providing peptides to serve a diverse array of During our beta phase, we intend to work closely with partners to overcome challenges in synthesizing and purifying particular classes of peptides of interest, identify useful peptide modifications, and design and construct peptide We provide initial partners access to our cloud platform for immediate ordering, properties calculator, order tracking, and interactive data display with guaranteed purities of 90%, 3 mg quantities, and turnaround of peptides up to length Beta User Sign up cloud platform Our cloud based platform provides our partners with immediate quoting, property calculator, order tracking, and interactive data analysis We provide an interactive UV chromatogram displaying purity along with the mass spectrum identifying the ordered higher purity Our proprietary peptide solid phase slug flow (SPSF) and disaggregation technology leveraging integrated manufacturing artificial intelligence enables a higher level of purity while operating faster than standard synthesizing faster delivery Our intelligent platform produces desalted peptides at a purity of 90% within hours, compared to the industry standard that takes a minimum hours and normally spans We are a team of engineers, biochemists and computer scientists who have created the first company to take a technologically advanced approach to solving challenges in both peptide synthesis and Mytide’s fully automated peptide manufacturing technology, coupled with predictive analytics and machine learning, is challenging paradigms to enable research and development, therapeutic manufacturing, and Our aim is to accelerate the discovery and development of peptide therapeutics for serious illnesses ranging from metabolic conditions to cancer to inflammatory disorders to infectious Making custom peptides faster and at a higher quality for researchers – and ultimately increasing accessibility to peptide treatments for generations to Mytide’s fully automated peptide manufacturing platform removes the and purity bottlenecks that presently limit researchers accessibility to the biologically active Current peptide manufacturing techniques are ill suited to producing peptides necessary for custom peptide Mytide’s proprietary platform is specifically geared to custom peptide manufacturing for personalized care and treatments, bringing costs down for the patient and Our RAC 4 E platform creates peptides for screening to build computational models of complex biological Mytide is focused on overcoming longstanding problems preventing widespread utilization of peptides as To overcome these challenges, we have developed an innovative peptide manufacturing process called RAC 4 E standing for Rapid Automated Computation, Coupling, Cleavage, and Chromatography Execution Yes, it’s a mouthful, but this unique and unparalleled technology for peptide manufacturing allows us to address a range of industry pain points by producing custom peptides Our MIT educated team built RAC 4 E around our proprietary solid phase slug flow (SPSF) coupling methodology which combines advanced microfluidic techniques and machine learning to introduce reagent “slugs” capable of fast coupling within the growing Our platform not only enables fast library generation for in vivo studies but the ability to scale target molecule for in vitro studies as The RAC 4 E platform coupled with computational biology enables lead molecule identification and selection at unprecedented Our unequaled speed and precision opens the door to screening and library generation, required for active iterative computational biology Mytide in the News robotics enable automation of complex synthetic biological molecules Overcomes bottlenecks of , manufacturing processes Massachusetts Life Sciences Center Awards Funding to Support Growth Across Major Sectors MLSC’s Milestone Achievement Program awards more than $1.9 million to companies representing all major life sciences sectors Hero Banner Dashboard Secondary Banner Location + Social News Contact Us D Street, Suite Boston, MA copyright © mytide therapeutics ",startup,"{'status': '200', 'available': True, 'url': 'http://web.archive.org/web/20201031234240/https://www.mytide.io/', 'timestamp': '20201031234240'}",20201031234240.0,1.0
https://opnsesame.com,40052,crunchbase,"Opn Sesame | Peer to Peer Texting: Politics, Nonprofits, Commercial Contact Privacy Policy Last Updated: January , This privacy policy sets out how Opn Sesame, LLC (“we”, “us” or “our”) collects, uses and protects any information that you give us when you use our websites, mobile apps, software, subscriptions, SMS text messaging platform (the “SMS Platform”), and or any other products or services offered by us (“Services”). We are committed to ensuring that your privacy is If we ask you to provide certain information by which you can be identified when using this website, then you can be assured that it will be used only in accordance with this privacy statement, as updated from time to You must also comply with our Terms of Use (available here http: opnsesame.com terms) and Acceptable Use Policy (available here http: opnsesame.com terms) and other posted Links to Other Websites, Apps and Services Our websites and other Services may contain links to other websites, apps and services of However, once you have used these links to leave our site, you should note that we have no control over such Therefore, we cannot be responsible for the protection and privacy of any information that you provide while visiting such sites and services, and they are not governed by this privacy You should exercise caution and should review the privacy statement(s) applicable to the sites and services in Collection of Your Information We collect or receive information about your interactions with Depending on how you use our Services, your information may include, without limitation: information (such as name, addresses, email addresses, telephone numbers, occupation and information imported from social log in permissions granted to us) information about the Services that you use, how often you use them, and your responses to the offerings and advertisements presented or made available by us metadata we collect from or about any message(s) sent via our SMS Platform, including without limitation phone numbers each message was sent to and sent from information about the searches you perform on our websites or in our other Services and how you use the results of those searches information (such as credit card or other preferred means of payment, billing information, credit card number, expiration date, billing address and or a history of purchases through our Services) customer service information about you as a user of our Services location data information about any devices, connections and methods used to access and interact with us other information specifically related to your use of Services, including information that you publicly post using tools made available by us information based on your usage of our Services (“Usage Data”), which may be collected automatically by us or the services (or services within our Services), which can include the IP addresses or domain names of the computers utilized by the users who use the Services, the URI addresses (Uniform Resource Identifier), the time of the request, the method utilized to submit the request to the server, the size of the file received in response, the numerical code indicating the status of the server’s answer (such as successful outcome and error), the country of origin, the features of the browser and the operating system utilized by the user, the various time details per visit (such as the time spent on each page within the Services) and the details about the path followed within the Services with special reference to the sequence of pages visited, other parameters about the device operating system and or the user’s IT environment, and data, conversion rates, marketing and conversion data and statistics, reports, analytics data, reviews and Usage Data may sometimes be essentially anonymous when collected, but could be used indirectly to identify a person We collect personal information from all communications with Service end users including, without limitation, text messages, faxes, telephone calls, and regular “snail mail,” as well as from outside sources including database We may collect your phone number in the following ways: When you text a keyword to a Short Code (if applicable) managed by us or one of our customers, or call or text message a Long Code managed by one of our customers, we collect your phone number when the message or call is routed through our If you have previously provided your contact information to one of our customers, we collect your phone number when our customer connects their database with Your information may be supplemented with additional information from other companies such as publicly available information, information about households and other information that we may append or match to your For example, we may augment certain data with: Data submitted by you via our Short Code Service (if applicable). For instance, after texting one of our customer’s keywords on our Short Code, the Short Code may respond automatically asking ",startup,"{'status': '200', 'available': True, 'url': 'http://web.archive.org/web/20190203010422/https://opnsesame.com/', 'timestamp': '20190203010422'}",20190203010422.0,1.0
https://toledoarearentals.com,14034,crunchbase,"Wayback Machine We will keep fighting for all libraries - stand with us! Internet Archive logo A line drawing of the Internet Archive headquarters building faÃ§ade. Donate icon An illustration of a heart shape ""Donate to the archive"" Search icon An illustration of a magnifying Search icon An illustration of a magnifying Upload icon An illustration of a horizontal line over an up pointing Upload User icon An illustration of a person s head and Sign up | Log in Web icon An illustration of a computer application window Wayback Machine Texts icon An illustration of an open Books Video icon An illustration of two cells of a film Video Audio icon An illustration of an audio Audio Software icon An illustration of a "" floppy Software Images icon An illustration of two Images Donate icon An illustration of a heart shape Donate Ellipses icon An illustration of text More Hamburger icon An icon used to represent a menu that can be toggled by interacting with this Internet Archive Audio Live Music Archive Librivox Free Audio Featured All Audio This Just In Grateful Dead Netlabels Old Time Radio RPMs and Cylinder Recordings Top Audio Books & Poetry Computers, Technology and Science Music, Arts & Culture News & Public Affairs Spirituality & Religion Podcasts Radio News Archive Images Metropolitan Museum Cleveland Museum of Art Featured All Images This Just In Flickr Commons Occupy Wall Street Flickr Cover Art USGS Maps Top NASA Images Solar System Collection Ames Research Center Software Internet Arcade Console Living Room Featured All Software This Just In Old School Emulation Games Historical Software Classic PC Games Software Library Top Kodi Archive and Support File Vintage Software APK Software Software Library Software Sites Tucows Software Library Shareware Software Capsules Compilation Images ZX Spectrum DOOM Level CD Books Books to Borrow Open Library Featured All Books All Texts This Just In Smithsonian Libraries FEDLINK (US) Genealogy Lincoln Collection Top American Libraries Canadian Libraries Universal Library Project Gutenberg Children s Library Biodiversity Heritage Library Books by Language Additional Collections Video TV News Understanding 9 11 Featured All Video This Just In Prelinger Archives Democracy Now! Occupy Wall Street TV NSA Clip Library Top Animation & Cartoons Arts & Music Computers & Technology Cultural & Academic Films Ephemeral Films Movies News & Public Affairs Spirituality & Religion Sports Videos Television Videogame Videos Vlogs Youth Media Search the history of over billion web pages on the Search the Wayback Machine Search icon An illustration of a magnifying Mobile Apps Wayback Machine (iOS) Wayback Machine (Android) Browser Extensions Chrome Firefox Safari Edge Subscription Explore the Collections Learn More Build Collections Save Page Now Capture a web page as it appears now for use as a trusted citation in the Please enter a valid web address About Blog Projects Help Donate Contact Jobs Volunteer People Sign up for free Log in Search metadata Search text contents Search TV news captions Search radio transcripts Search archived web sites Advanced Search About Blog Projects Help Donate Donate icon An illustration of a heart shape Contact Jobs Volunteer People DONATE Latest Show All The Wayback Machine has not archived that Click here to search for all archived pages under https: toledoarearentals.com teamwork-makes-the-dream-work . The Wayback Machine requires your browser to support JavaScript, please email if you have any questions about The Wayback Machine is an initiative of the Internet Archive , a (c)(3) , building a digital library of Internet sites and other cultural artifacts in digital Other projects include Open Library & . Your use of the Wayback Machine is subject to the Internet Archive s Terms of Use .   Wayback Machine We will keep fighting for all libraries - stand with us! Internet Archive logo A line drawing of the Internet Archive headquarters building faÃ§ade. Donate icon An illustration of a heart shape ""Donate to the archive"" Search icon An illustration of a magnifying Search icon An illustration of a magnifying Upload icon An illustration of a horizontal line over an up pointing Upload User icon An illustration of a person s head and Sign up | Log in Web icon An illustration of a computer application window Wayback Machine Texts icon An illustration of an open Books Video icon An illustration of two cells of a film Video Audio icon An illustration of an audio Audio Software icon An illustration of a "" floppy Software Images icon An illustration of two Images Donate icon An illustration of a heart shape Donate Ellipses icon An illustration of text More Hamburger icon An icon used to represent a menu that can be toggled by interacting with this Internet Archive Audio Live Music Archive Librivox Free Audio Featured All Audio This Just In Grateful Dead Netlabels Old Time Radio RPMs and Cylinder Recordings Top Audio Books & Poetry Computers, Technology and Scienc",startup,"{'status': '200', 'available': True, 'url': 'http://web.archive.org/web/20220612161114/https://toledoarearentals.com/', 'timestamp': '20220612161114'}",20220612161114.0,0.0
