website,text_len,source,text,type,closest_snapshot,closest_snapshot_time,snapshot_in_window
https://galileoxp.com,14754,crunchbase,"Galileo Tuition | Galileo This app works best with JavaScript Galileo How It Works Tuition Newsletter Apply Now Tuition and Scholarship The most effective education at unbeatable Now available $US mo Month to Cancel at any Tuition includes unlimited access to all of our clubs, classes and online resources: Weekday Daily Weekly Office Hours Weekly Book Club Meetings Weekly Nanodegree Program Weekly Conversational Language Sessions 7 access via Basecamp to colleagues and teachers Weekly Conversational Language Sessions $US year month contract (save $880 year) Tuition includes unlimited access to all of our clubs, classes and online resources: Weekday Daily Weekly Office Hours Weekly Book Club Meetings Weekly Nanodegree Program Weekly Conversational Language Sessions 7 access via Basecamp to colleagues and teachers Filling out applications for several children? Consult with our We offer % sibling If you still have questions about Galileo prior to starting the application process, please join our weekly Q&A session to get them answered by someone from our team! Scholarship Would you like your child to join Galileo but the tuition is well beyond your budget? If your family really wants to join us but you can t fully cover the tuition fees, please fill out an application and let us know about your specific case in the Partial or full scholarship will be granted to families that bring diversity and new learning opportunities to our online global Apply to Join Galileo Today Galileo Stay in touch with Subscribe to our newsletter or follow us on social Our Newsletter About Us About Us Our Team Careers Invite Friends FAQ Our Program How it works Experience Galileo Admission Process Accreditation Tuition & Scholarship Our Activities Nanodegrees Book Club Office Hours Meet Your Heroes Offline Events © Galileo XP Ltd UK: Kemp House, - City Road, EC1V US: Fillmore St, San Francisco, CA   How it works - Galileo | Galileo This app works best with JavaScript Galileo How It Works Tuition Newsletter Apply Now How it Works We combine learning, project based learning, a community of global classmates and lots of guidance and inspiration from our encouraging teachers to create the best kind of education out Meet Michael Michael is an enthusiastic year old who lives in He has been homeschooled for the past years and joined Galileo in June He’s passionate about computer science, math, English and especially captivated by He is also motivated to improve his language fluency in Spanish and He’s exploring several different future career opportunities in business and Take a look at his weekly He is focusing his learning plan to complete a similar curriculum of a US & Canadian tenth grade year as he is planning to apply to Universities in North Meet Brianne Brianne is an year old student from German is her mother tongue and she speaks English as a second She is an extroverted and eloquent learner and passionate about art, dancing and Her parents started homeschooling her a year Since then, they ve been using Galileo to help Brianne her learning She has a weekly schedule that fits well with her regular Screen Time With Meaning Daily online fun and engaging learning experiences facilitated by our The Daily help students to keep themselves accountable for their They get the opportunity to share their learning discoveries and inspire their peers from all over the Inspired by daily scrum meetings, a process used by high performing tech companies to maintain accountability and motivate progress among are held in small groups of students who meet daily, Monday to Math and Coding Office Hours In Galileo’s office hours, students regularly attend math club and coding club and have the opportunity to ask questions and discuss challenges specific to their learning progress throughout the Meet Galileo s STEM tutor Sammy Nyakabau sharing more details about these clubs activities The Book Club During the weekly Book Club meetings, students meet with teachers to dive deeper into the book of the With the help of our teachers, students gain a broader perspective and are guided through complex questions and engaging activities in response to their The Nanodegrees Galileo nanodegrees are learning experiences, designed for students to have a real world engaging experience and create a meaningful Coding is one of the skills across In our recent Introduction to Programming with SCRATCH, students had the chance to collaborate, communicate, solve problems and use critical thinking skills to complete different Take a sneak peek at one of our Nothing is mandatory and everything is inspirational Every week we organize office hours for students that need extra We also offer many optional classes and workshops to introduce them to new and interesting Office Hours Book Club Nanodegrees Clubs Meet your heroes Offline Events Join our weekly Q&A session and get all your questions answered Register for Q&A The Best Learning Platforms We are constantly searching for and ",startup,"{'status': '200', 'available': True, 'url': 'http://web.archive.org/web/20200421050225/https://galileoxp.com/', 'timestamp': '20200421050225'}",20200421050225.0,1.0
https://usilcapital.com/,12794,crunchbase,"Wayback Machine We will keep fighting for all libraries - stand with us! Internet Archive logo A line drawing of the Internet Archive headquarters building faÃ§ade. Donate icon An illustration of a heart shape ""Donate to the archive"" Search icon An illustration of a magnifying Search icon An illustration of a magnifying Upload icon An illustration of a horizontal line over an up pointing Upload User icon An illustration of a person s head and Sign up | Log in Web icon An illustration of a computer application window Wayback Machine Texts icon An illustration of an open Books Video icon An illustration of two cells of a film Video Audio icon An illustration of an audio Audio Software icon An illustration of a "" floppy Software Images icon An illustration of two Images Donate icon An illustration of a heart shape Donate Ellipses icon An illustration of text More Hamburger icon An icon used to represent a menu that can be toggled by interacting with this Internet Archive Audio Live Music Archive Librivox Free Audio Featured All Audio This Just In Grateful Dead Netlabels Old Time Radio RPMs and Cylinder Recordings Top Audio Books & Poetry Computers, Technology and Science Music, Arts & Culture News & Public Affairs Spirituality & Religion Podcasts Radio News Archive Images Metropolitan Museum Cleveland Museum of Art Featured All Images This Just In Flickr Commons Occupy Wall Street Flickr Cover Art USGS Maps Top NASA Images Solar System Collection Ames Research Center Software Internet Arcade Console Living Room Featured All Software This Just In Old School Emulation Games Historical Software Classic PC Games Software Library Top Kodi Archive and Support File Vintage Software APK Software Software Library Software Sites Tucows Software Library Shareware Software Capsules Compilation Images ZX Spectrum DOOM Level CD Books Books to Borrow Open Library Featured All Books All Texts This Just In Smithsonian Libraries FEDLINK (US) Genealogy Lincoln Collection Top American Libraries Canadian Libraries Universal Library Project Gutenberg Children s Library Biodiversity Heritage Library Books by Language Additional Collections Video TV News Understanding 9 11 Featured All Video This Just In Prelinger Archives Democracy Now! Occupy Wall Street TV NSA Clip Library Top Animation & Cartoons Arts & Music Computers & Technology Cultural & Academic Films Ephemeral Films Movies News & Public Affairs Spirituality & Religion Sports Videos Television Videogame Videos Vlogs Youth Media Search the history of over billion web pages on the Search the Wayback Machine Search icon An illustration of a magnifying Mobile Apps Wayback Machine (iOS) Wayback Machine (Android) Browser Extensions Chrome Firefox Safari Edge Subscription Explore the Collections Learn More Build Collections Save Page Now Capture a web page as it appears now for use as a trusted citation in the Please enter a valid web address About Blog Projects Help Donate Contact Jobs Volunteer People Sign up for free Log in Search metadata Search text contents Search TV news captions Search radio transcripts Search archived web sites Advanced Search About Blog Projects Help Donate Donate icon An illustration of a heart shape Contact Jobs Volunteer People DONATE Latest Show All The Wayback Machine has not archived that Click here to search for all archived pages under https: usilcapital.com . The Wayback Machine requires your browser to support JavaScript, please email if you have any questions about The Wayback Machine is an initiative of the Internet Archive , a (c)(3) , building a digital library of Internet sites and other cultural artifacts in digital Other projects include Open Library & . Your use of the Wayback Machine is subject to the Internet Archive s Terms of Use .   Wayback Machine We will keep fighting for all libraries - stand with us! Internet Archive logo A line drawing of the Internet Archive headquarters building faÃ§ade. Donate icon An illustration of a heart shape ""Donate to the archive"" Search icon An illustration of a magnifying Search icon An illustration of a magnifying Upload icon An illustration of a horizontal line over an up pointing Upload User icon An illustration of a person s head and Sign up | Log in Web icon An illustration of a computer application window Wayback Machine Texts icon An illustration of an open Books Video icon An illustration of two cells of a film Video Audio icon An illustration of an audio Audio Software icon An illustration of a "" floppy Software Images icon An illustration of two Images Donate icon An illustration of a heart shape Donate Ellipses icon An illustration of text More Hamburger icon An icon used to represent a menu that can be toggled by interacting with this Internet Archive Audio Live Music Archive Librivox Free Audio Featured All Audio This Just In Grateful Dead Netlabels Old Time Radio RPMs and Cylinder Recordings Top Audio Books & Poetry Computers, Technology and Science Music, Arts & Culture News & Publi",startup,None,nan,0.0
https://xuppay.com/,8044,crunchbase,"XUP Payments | About Us Solutions About Us Insights Solutions About Us Insights Get Started We live and breathe payments Our focus is to create an innovative payment experience for our clients and have fun while doing The story behind XUP XUP, a division of Midtown Consulting Group, was born in We noticed a common challenge within the payment industry—lack of customer connections and most importantly, missed revenue And that’s why XUP was formed with one primary focus: driving transactions We built software from the ground up that makes it easy to identify, consider, buy and service merchant and payment We pride ourselves on being the first to integrate with two of the largest processors in the We focus on providing payment experiences that are simple, innovative, and perfectly aligned to customer Our Solutions % Average returns in the last years Mission Get started swiftly & easily by importing a demo of your choice in a single Over high quality professionally designed website concepts to choose Vision Exponent WordPress theme is insanely flexible and amazingly easy to This alone would be enough for a 5 star On top of a great tool is even better customer CAREERS Join the XUPPY team We believe in passionate people, no matter background, or years of We always strive to provide an environment that fosters creativity and career We are a diverse and social team who works hard but encourages time to relax, chat and engage with other We look for team members that will be dedicated to servicing our clients while learning how to build from the ground up…and have fun while doing Think you’ve got what it takes to join our team? let s chat GET IN TOUCH Convinced ? Well Let’s have a talk Contact Us FEATURED INSIGHTS Merchant Industry Orientation is a Winning Strategy for Banks September 4, Bill Pay The Future of Bank Bill Pay August , Merchant How the Right Merchant Acquirer Can Drive Revenue for Your Bank August , Get in Touch Ready to get started? Give us a call or send us a message to schedule your personalized VISIT US S Tryon Street, Charlotte, NC CALL US EMAIL US SUBSCRIBE FOR XUP INSIGHTS © XUP, Subscribe to the XUP Newsletter! Headquarters: S Tryon Street Charlotte, NC Contact: © XUP, Privacy Settings We use cookies to enhance your experience while using our If you are using our Services via a browser you can restrict, block or remove cookies through your web browser We also use content and scripts from third parties that may use tracking You can selectively provide your consent below to allow such third party For complete information about the cookies we use, data we collect and how we process them, please check our Privacy Policy Youtube Consent to display content from Youtube Vimeo Consent to display content from Vimeo Google Maps Consent to display content from Google Spotify Consent to display content from Spotify Sound Cloud Consent to display content from Sound Save This website uses cookies to improve your We ll assume you re ok with this, but you can if you Cookie settings ACCEPT Privacy & Cookies Policy Close Privacy Overview This website uses cookies to improve your experience while you navigate through the Out of these cookies, the cookies that are categorized as necessary are stored on your browser as they are essential for the working of basic functionalities of the We also use cookies that help us analyze and understand how you use this These cookies will be stored in your browser only with your You also have the option to of these But opting out of some of these cookies may have an effect on your browsing Necessary Necessary Always Enabled Necessary cookies are absolutely essential for the website to function This category only includes cookies that ensures basic functionalities and security features of the These cookies do not store any personal Any cookies that may not be particularly necessary for the website to function and is used specifically to collect user personal data via analytics, ads, other embedded contents are termed as It is mandatory to procure user consent prior to running these cookies on your Solutions About Us Insights CONTACT US   XUP Payments | Drive Transactions Up Solutions Industries About Us Solutions Industries About Us Get Started Elevate the power of your payments XUP’s vertically focused payment platform provides a seamless connection between financial services, merchants, and Get Started BENEFITS Drive value by building payments into your company DNA Enhance Your Customer Experience Provide an exceptional customer journey and drive loyalty by owning your Increase Your Transaction Volume Adopt new ways of expanding and monetizing your relationships with full payment Improve Your Merchant Relationships Drive efficiency in speed and cost by removing barriers that make managing payments XUP ‘zup To provide payment experiences that are simple and innovative, yet perfectly aligned with industry, business, and customer To deeply integrate payment and transaction (X) ser",startup,"{'status': '200', 'available': True, 'url': 'http://web.archive.org/web/20200805184200/https://xuppay.com/', 'timestamp': '20200805184200'}",20200805184200.0,1.0
https://3pthealthcare.com,11860,crunchbase,"Physical Therapists, Mokena IL | Three Point Healthcare Who We Are Physical Therapists Physical Therapist Assistants Athletic Trainers Licensed Clinical Social Workers Registered Dietitian Nutritionists Patient Care Advocates Services Physical Therapy Weight Loss Workers Compensation Work Conditioning FCEs Behavioral Medicine Nutrition Counseling For Physicians Schedule an Appointment Physical Therapists Physical Therapists at are highly trained and educated healthcare professionals that specialize in how the body works and They are trained to evaluate the individual and identify deficits that can lead to pain and decreased Our primary goal is to improve your overall health by making you stronger, increasing your endurance, improving your range of motion, increasing your energy and just feeling better! Together we can help! Contact Us Physical Therapy Techniques and Modalities Therapeutic Exercise – to strengthen muscles, improve overall endurance coordination, and balance Resistance training Cardiovascular training Manual Therapy and Stretching – aimed at reducing muscle tightness and pain, improving range of motion, and restoring function Graston Technique® Instrument assisted soft tissue mobilization Education Postural Neuromuscular program instruction Injury prevention Pain management Other Modalities – Ultrasound, Electrical Stimulation, Traction, heat and or cold therapy Together we can help! Contact Us © Copyright Three Point Designed by Mojo Who We Are Who We Are Physical Therapists Physical Therapist Assistants Athletic Trainers Licensed Clinical Social Workers Registered Dietitian Nutritionists Patient Care Advocates Services Services Physical Therapy Weight Loss Workers Compensation Work Conditioning FCEs Behavioral Medicine Nutrition Counseling For Physicians Schedule an Appointment Costs Career Blog FAQ © Copyright Three Point Designed by Mojo Locations Blog Career Costs FAQ   Licensed Clinical Social Workers | Three Point Healthcare Who We Are Physical Therapists Physical Therapist Assistants Athletic Trainers Licensed Clinical Social Workers Registered Dietitian Nutritionists Patient Care Advocates Services Physical Therapy Weight Loss Workers Compensation Work Conditioning FCEs Behavioral Medicine Nutrition Counseling For Physicians Schedule an Appointment Licensed Clinical Social Workers The Behavioral Medicine function of is led by Licensed Clinical Social We focus on a patient’s emotional and psychological In doing this, we consider the societal and environmental factors that impact the overall health and behaviors of the This process begins with an We evaluate strengths, challenges and develop a strategy for long term Most importantly, we gauge the patient’s readiness to adopt our plan of care and determine the patient’s likelihood of long term Although all of our treatment plans are unique to each patient, there are a series of steps that yield tangible short and long term results in our patient’s Together we can help! Contact Us Behavioral Medicine Techniques and Modalities CBT – Cognitive Behavioral Therapy ACT – Acceptance Commitment Therapy Relaxation Techniques Mindfulness strategies Strategies to avoid stress eating Relapse prevention Together we can help! Contact Us © Copyright Three Point Designed by Mojo Who We Are Who We Are Physical Therapists Physical Therapist Assistants Athletic Trainers Licensed Clinical Social Workers Registered Dietitian Nutritionists Patient Care Advocates Services Services Physical Therapy Weight Loss Workers Compensation Work Conditioning FCEs Behavioral Medicine Nutrition Counseling For Physicians Schedule an Appointment Costs Career Blog FAQ © Copyright Three Point Designed by Mojo Locations Blog Career Costs FAQ   Meet The Team Here At | Three Point Healthcare Who We Are Physical Therapists Physical Therapist Assistants Athletic Trainers Licensed Clinical Social Workers Registered Dietitian Nutritionists Patient Care Advocates Services Physical Therapy Weight Loss Workers Compensation Work Conditioning FCEs Behavioral Medicine Nutrition Counseling For Physicians Schedule an Appointment Physical Therapists Physical Therapists at are highly trained and educated healthcare professionals that specialize in how the body works and They are trained to evaluate the individual and identify deficits that can lead to pain and decreased Our primary goal is to improve your overall health by making you stronger, increasing your endurance, improving your range of motion, increasing your energy and just feeling better! Together we can help! Contact Us Physical Therapy Techniques and Modalities Therapeutic Exercise – to strengthen muscles, improve overall endurance coordination, and balance Resistance training Cardiovascular training Manual Therapy and Stretching – aimed at reducing muscle tightness and pain, improving range of motion, and restoring function Graston Technique® Instrument assisted soft tissue mobilization Education Postural Neuromuscular program i",startup,"{'status': '200', 'available': True, 'url': 'http://web.archive.org/web/20180825081823/http://3pthealthcare.com/', 'timestamp': '20180825081823'}",20180825081823.0,1.0
