website,text_len,source,text,type,closest_snapshot,closest_snapshot_time,snapshot_in_window
https://www.crispnow.com/,1068,crunchbase," | CRISP Hardware Terms & Conditions General Terms & Conditions Privacy Policy Customer Support Site   | CRISP Hardware Terms & Conditions General Terms & Conditions Privacy Policy Customer Support Site   | CRISP Hardware Terms & Conditions General Terms & Conditions Privacy Policy Customer Support Site   Crisp – restaurant software New Website Under Construction The world s most complete solution for growing restaurants Restaurant systems have become too Any restaurant looking at expansion faces a dizzying array of software Most of these standalone solutions may work well for one location, but they cause serious data and consistency issues when you want to grow We took the most recent advancements in technology and built Crisp to simplify your life as you By consolidating dozens of systems into one solution we are able to give you better data faster than ever Crisp is now live! Our new site is under If you have any questions you can reach us at . Copyright © Crisp General Terms and Conditions Hardware Terms and Conditions Privacy Terms and Conditions ",startup,"{'status': '200', 'available': True, 'url': 'http://web.archive.org/web/20181003024235/https://crispnow.com/', 'timestamp': '20181003024235'}",20181003024235.0,1.0
https://www.continuumenv.com,4569,crunchbase," Our Mission | Continuum top of page About Us Safety Our Mission Our People Project Photos Landfill Gas Pipeline Construction Landfill Gas Well Drilling Landfill Gas Operations & Maintenance Contact Us Apply Today! More Use tab to navigate through the menu Our Mission We will perform our work with an unwavering focus on safety, quality, and our client’s We will challenge ourselves to always exceed the expectations of our We will continually strive to provide superior We will create a healthy and exciting work environment which recognizes that our field people are paramount to our We will always recognize that our value is solely based on our relationships with our employees, clients, and business We will conduct business ethically and respectfully at all © Continuum Environmental Services, All Rights bottom of page   Project Photos | Continuum top of page About Us Safety Our Mission Our People Project Photos Landfill Gas Pipeline Construction Landfill Gas Well Drilling Landfill Gas Operations & Maintenance Contact Us Apply Today! More Use tab to navigate through the menu © Continuum Environmental Services, All Rights bottom of page   Landfill Gas Pipeline Construction | Continuum top of page About Us Safety Our Mission Our People Project Photos Landfill Gas Pipeline Construction Landfill Gas Well Drilling Landfill Gas Operations & Maintenance Contact Us Apply Today! More Use tab to navigate through the menu Landfill Gas Pipeline Construction The strength of CES’s LFG Pipeline Construction Division is that it employs the most experienced personnel in the CES’s personnel have installed millions of feet of HDPE pipe on project sites across the Services include: Design support and constructability reviews Landfill gas and leachate collection system installation LFG flare installation LFG compression and transmission system installation LFG well drilling and installation Leachate pump and control system installation System and well field balancing © Continuum Environmental Services, All Rights bottom of page   Landfill Gas Well Drilling | Continuum top of page About Us Safety Our Mission Our People Project Photos Landfill Gas Pipeline Construction Landfill Gas Well Drilling Landfill Gas Operations & Maintenance Contact Us Apply Today! More Use tab to navigate through the menu Landfill Gas Well Drilling CES owns and operates , track mounted drilling equipment that can facilitate difficult side slope well completion and minimizes landfill surface This equipment is operated by some of the best and most experienced LFG drilling personnel in the CES is fully equipped to complete landfill gas leachate drilling projects in difficult environments including high liquids and H2S or other harmful CES drilling services include: Drilling and installation of landfill gas and leachate collection wells ” diameter bore holes 4 drill rigs to well depths up to ’ Challenging conditions with high underground temperatures handled safely Specialty wells with high levels of leachate liquids handled effectively © Continuum Environmental Services, All Rights bottom of page   Environmental Construction | Continuum Environmental | Ohio About Us Safety Our Mission Our People Project Photos Landfill Gas Pipeline Construction Landfill Gas Well Drilling Contact Us Apply Today! More Use tab to navigate through the menu Founded in and headquartered in Richfield Ohio, Continuum Environmental Services, (CES) is an Ohio Limited Liability Led by an ownership team which is recognized throughout the industry as leaders in landfill gas construction, CES’s goal is to become the national leader providing services to the landfill gas The Continuum Advantage © Continuum Environmental Services, All Rights   Our People | Continuum top of page About Us Safety Our Mission Our People Project Photos Landfill Gas Pipeline Construction Landfill Gas Well Drilling Landfill Gas Operations & Maintenance Contact Us Apply Today! More Use tab to navigate through the menu Our People Carl Apicella President ​ Read Full Bio Here ​ Corey Schreck O&M Operations Manager ​ Read Full Bio Here ​ Mark Apicella, BSN, RN Director, Health and Safety Read Full Bio Here ​ Seth Mothersbaugh O&M Supervisor ​ Read Full Bio He re Michael Rogozinski, Director, Landfill Gas Construction R ead Full Bio Here ​ Dennis Begeman O&M Supervisor ​ Read Full Bio Her e Brenda Kocur Data Manager ​ Read Full Bio Here ​ Todd Roberson VP of Operations Read Full Bio Here ​ ​ Read Full Bio Here Jason Carter Project Manager © Continuum Environmental Services, All Rights bottom of page ",startup,"{'status': '200', 'available': True, 'url': 'http://web.archive.org/web/20211223164846/https://www.continuumenv.com/', 'timestamp': '20211223164846'}",20211223164846.0,0.0
https://www.hxrbenefits.com,6670,crunchbase,"Home Evolutionary benefits programs, products and Home Services Programs Providers Stories Name How did you find us? Found on google Followed link from LinkedIn Clicked on an article Referred by a friend Message Submit Address: Lewisville Vista Point North State Highway Bypass Suite A250 Lewisville, Texas Phone: +1 : Our purpose is to provide the underserved access to health and lifestyle programs designed to improve quality of In every community, both rural and city, there are many people living on the margins because of their limited Our programs directly serve those that need We re changing the way our providers market and deliver their We wish to allign our Palsgo benefits are for everyone whether you are traveling, working, or staying at BRIDGING THE QUALITY OF LIFE GAP HXR was founded as a minority veteran owned business enterprise by a group of experienced human relations and benefit Our mission is to improve the quality of life for individuals and families by providing them access to health and lifestyle programs, products, and services that are otherwise unavailable or financially AMERICA S UNDERSERVED - WHO ARE THEY? PROGRAMS THAT TARGET THE GREAT GREAT Unprecedented times are forcing companies to look at new ways to retain their , , contract worker Community development and outreach We work with our partners to foster diversity, inclusion, and access to resources for We help build new methods for engaging consumers that move beyond traditional outreach Benefits for HXR is in a stream of its We re bridging the quality of life gap between people who have medical and lifestyle services coverage and those who are without Our purpose is to provide access to programs designed to improve quality of life especially for people who have been displaced or lost their jobs due to the current Contact us to learn how to become a Referral Introducing © Humanx Resources, All international rights HXR is a registered trademark of Humanx Resources,   America s Underserved–Who Are They? Evolutionary benefits programs, products and Home Services Programs Providers Stories Name How did you find us? Found on google Followed link from LinkedIn Clicked on an article Referred by a friend Message Submit Address: Lewisville Vista Point North State Highway Bypass Suite A250 Lewisville, Texas Phone: +1 : OUR STORIES MAKE US RELEVANT We re all experiencing unprecidented changes in the way we conduct our lives, do business, and even interact with each Our stories are more relevant than And by sharing them, we learn from each HXR s story started with it s goal to become established as a Public Benefits This allowed us to share our knowledge with companies, organizations, and individuals in a way that supports commerce while affecting social Contact us to learn more about < Back America s Underserved—Who Are They? By LaRue Foster, Managing Partner, Humanx Resources, LLC What once characterized a socialeconomic group as underserved no longer Ethnicity, income, nor demographic classifications are by no means the only metrics that identify underserved Access to health care, although health care is a major category, is no longer also a complete So who are they? The reasons for being underserved range from easy accessibility to goods and services to the unaffordable cost of everything from rent to medical care to child care to education, among There is a tendency to define those being underserved as people who are unemployed for various reasons, either because their employers have been forced to lay off employees due to the current pandemic, business failure or because the businesses where they worked are now in For these people, being underserved means quite simply that they have no access to a stable income, benefits, or the ability to pay for basic necessities such as food, clothing, rent, and transportation as well as health Quite often, they simply can t afford to see a physician when they are ill or face eviction for inability to pay rent, or they can t afford to buy clothes, food, transportation and other A large number of minorities are underserved because they often can t find jobs even in an economic This group includes migrent workers who often live with day labor jobs that pay very little and often find access to basic health services difficult because they are not Students who are not covered by their parents medical plan find themselves searching for Resources exist but often times the pathway to access them is perilous and costly adding additional stress to an already stressful personnel who return from service but lack job experience outside military service qualify for job training programs after their service, but often those with families to support can t afford the luxury of time to devote to training when they must focus on a living wage for their A number of former soldiers also suffer from psychological problems due to the traumas they have seen while in service and are unable to work but have very limited optio",startup,"{'status': '200', 'available': True, 'url': 'http://web.archive.org/web/20210120182620/https://www.hxrbenefits.com/', 'timestamp': '20210120182620'}",20210120182620.0,0.0
https://www.daytonaapparel.com/#company,459,crunchbase," Daytona Apparel Group brands about contact daytona brands about contact D A Y T O N A A P P A R E L G R O U P Scroll Scroll APPAREL DISTRIBUTION GloballyÂ Recognized Brands Our brands Robeez ro+me Trumpette Trumpette Ro + Me Robeez We are Daytona Daytona Apparel Group designs, manufacturers , and distributes infant and baby products through Robeez, Ro+Me, and Trumpette headquarters Madison Ave New York, New York Contact Terms & Conditions Privacy Policy ",startup,"{'status': '200', 'available': True, 'url': 'http://web.archive.org/web/20230325150803/https://www.daytonaapparel.com/', 'timestamp': '20230325150803'}",20230325150803.0,0.0
https://thehempmine.com,8808,crunchbase,"Account – The Hemp Mine ""Close Cart"" Shopping Cart Shop now Login Search for products on our site Search See more NEW pricing on most items! FREE SHIPPING on all orders over $30! Search Home Shop Blog Genetics HPM Field Days Contact Us COAs Wholesale for Retailers Account Log in Create account The Hemp Mine Home Shop Blog Genetics HPM Field Days Contact Us COAs Wholesale for Retailers Menu The Hemp Mine Cart We ve sent you an email with a link to update your Login Email Password Return to Store Create account Forgot your password? Reset your password We will send you an email to reset your Email Cancel Links Our Products Terms of Service Shipping Policy Search Get Connected These statements have not been evaluated by the Food and Drug This product is not intended to diagnose, treat, prevent or cure any © , The Hemp Mine Powered by Shopify American Express ASK Discover Mastercard NetBanking Visa   Products – The Hemp Mine ""Close Cart"" Shopping Cart Shop now Login Search for products on our site Search See more We have a new look & new products! FREE SHIPPING for orders over $30! Search Home FIELD DAYS Shop Blog Genetics Contact Us COAs Bulk Wholesale Wholesale for Retailers Account Log in Create account The Hemp Mine Home FIELD DAYS Shop Blog Genetics Contact Us COAs Bulk Wholesale Wholesale for Retailers Menu The Hemp Mine Cart Products Filter All products Beeswax Beijing Grass blunt Broad spectrum Canine Cannabinoids Cannabis Cat Catnip CBD CBG Cedarwood chameleon plant cotton Dog dream herb Feline fish mint Full Spectrum Ginger Hemp Hemp Flower herb Indoor Grown Joint kief Lavender Limited Release live plant medicinal Melatonin Menthol Moisturizing Moon Rocks Motion Sickness perennial Pet Pineapple Preroll Relax rescue herb Rick Simpson Oil RSO Salve Sauce Sleep Sleep Eazzzy Smoke swag Terpenes Tincture Topical trichome Vape Vape Cartridge Wax tag "" Sort by Featured Price, low to high Price, high to low Alphabetically, Alphabetically, Date, old to new Date, new to old Best Selling Beijing Grass (Murdannia loriformis) Angel Grass $18.00 Broad Spectrum Hemp Extract Oil mg $60.00 Broad Spectrum Hemp Extract Oil mg $75.00 Broad Spectrum Hemp Extract Oil mg $120.00 Broad Spectrum Hemp Extract Oil mg $35.00 Catnip Prerolls for your Feline $1.50 CBD Relax Massage Oil mg 8 ounces $55.00 CBD Sleep Eazzzy Full Spectrum Oil with Melatonin $40.00 CBG Premium Hemp Flower grams Bag $30.00 Dream Herb (Calea zacatechichi) $18.00 Sold Out Fish Mint Plant (Houttuynia cordata Chameleon ) $15.00 Full Spectrum CBD $14.00 Full Spectrum Hemp Extract Oil mg $60.00 Full Spectrum Hemp Extract Oil mg $75.00 Full Spectrum Hemp Extract Oil mg $120.00 Full Spectrum Hemp Extract Oil mg $35.00 « 1 2 3 Links Our Products Terms of Service Shipping Policy Search Get Connected These statements have not been evaluated by the Food and Drug This product is not intended to diagnose, treat, prevent or cure any © , The Hemp Mine Powered by Shopify American Express Discover Mastercard Visa   Contact Us – The Hemp Mine ""Close Cart"" Shopping Cart Shop now Login Search for products on our site Search See more We have a new look & new products! FREE SHIPPING for orders over $30! Search Home FIELD DAYS Shop Blog Genetics Contact Us COAs Bulk Wholesale Wholesale for Retailers Account Log in Create account The Hemp Mine Home FIELD DAYS Shop Blog Genetics Contact Us COAs Bulk Wholesale Wholesale for Retailers Menu The Hemp Mine Cart Contact Us Customer satisfaction is extremely important to us! Please reach out to us with questions or comments at The Hemp Mine PO Box Fair Play, SC Name Email Phone Number Message Links Our Products Terms of Service Shipping Policy Search Get Connected These statements have not been evaluated by the Food and Drug This product is not intended to diagnose, treat, prevent or cure any © , The Hemp Mine Powered by Shopify American Express Discover Mastercard Visa   The Hemp Farm Mined and Refined CBD Hemp Products ""Close Cart"" Shopping Cart Shop now Login Search for products on our site Search See more % off entire order extended! FREE SHIPPING for orders over $30! Search Home Shop Blog Genetics Contact Us Bulk Wholesale Wholesale for Retailers Account Log in Create account The Hemp Mine Home Shop Blog Genetics Contact Us Bulk Wholesale Wholesale for Retailers Menu The Hemp Mine Cart South Carolina Farm Mined and Refined Premium hemp products for living your best Welcome to the Mine: Premium Hemp is our family s We know our start to finish, seed to And that kind of care is what makes our products We start with quality high CBD hemp These are grown naturally without pesticides on our family land where crops have been farmed for 3 We carefully harvest our plants and hang them to air dry in optimal conditions ensuring terpenes and cannabinoids are well Then we extract full spectrum hemp oil at our state of the art, super critical CO2 extraction This extraction method preserves all of the compounds from the whole plant that contrib",startup,"{'status': '200', 'available': True, 'url': 'http://web.archive.org/web/20200329134615/https://thehempmine.com/', 'timestamp': '20200329134615'}",20200329134615.0,1.0
https://newhavencommunitysolar.com/,6750,crunchbase,"New Haven Community Solar Home Contact Home Contact See more FAQ Annual Report   New Haven Community Solar Home Home Scroll Invest in a sustainable Invest Now Community Impact New Haven Community Solar is a kW community solar project located on Button Street in New Haven, The lot on Button Street is the site of this year s annual Jim Vlock First Year Building Project – a partnership between the Yale School of Architecture and Columbus Columbus House is a nonprofit organization based in New Haven that serves people who are homeless or at risk of becoming homeless by providing shelter and housing and by fostering their personal growth and This project will structure a predictable set of future cash flows for investors and provide Columbus House access to electricity to further their Responsible Design Unique among architecture schools, the Jim Vlock First Year Building Project, which began in , gives Yale students an opportunity to design and build a house in an economically challenged neighborhood in New The program is mandatory for all graduate students in YSoA, many who arrive at Yale with a special interest in socially responsible design Once complete, the Button Street House will contain two units, and provide recently homeless people with a brand new New Haven Community Solar is a special purpose vehicle that will finance a solar array on the roof, providing its residents with cheap renewable energy in a state with one of the highest electricity This project aims to improve the livelihoods of the residents and minimize environmental impacts, while allowing investors to A New Opportunity in Community Solar Freeing up income In Connecticut, a state that typically has some of the highest energy costs, this project will greatly reduce the electricity bills of its In a country where income is the largest social determinant of health, freeing up income through decreasing electricity bills becomes a health How it Works Individuals that choose to invest in NHCS will become owners of the project, participating in a collective effort to provide cheaper, cleaner power to low income tenants in Connecticut where residential utility prices are double the national average . Investors begin by going to and choosing to invest in New Haven Community Investors can go here to learn details of the The year power purchase agreement signed between Columbus House and New Haven Community Solar will ensure that the Columbus House can further its mission by having access to electricity well into the Change starts here As recent graduates of the Yale School of Forestry and Environmental Studies, we feel a deep connection to the New Haven We are relentlessly passionate about democratizing the ownership of renewable energy and empowering communities to drive solutions to climate Together we can build and own the future we want and For more information click here Franz - CEO Matt - COO Kwasi - CMO Welcome About New Page The Project Ingredients Once Complete new opportunity freeing up income New Page The Founders Founder Portraits FAQ   Wayback Machine We will keep fighting for all libraries - stand with us! Internet Archive logo A line drawing of the Internet Archive headquarters building faÃ§ade. Donate icon An illustration of a heart shape ""Donate to the archive"" Search icon An illustration of a magnifying Search icon An illustration of a magnifying Upload icon An illustration of a horizontal line over an up pointing Upload User icon An illustration of a person s head and Sign up | Log in Web icon An illustration of a computer application window Wayback Machine Texts icon An illustration of an open Books Video icon An illustration of two cells of a film Video Audio icon An illustration of an audio Audio Software icon An illustration of a "" floppy Software Images icon An illustration of two Images Donate icon An illustration of a heart shape Donate Ellipses icon An illustration of text More Hamburger icon An icon used to represent a menu that can be toggled by interacting with this Internet Archive Audio Live Music Archive Librivox Free Audio Featured All Audio This Just In Grateful Dead Netlabels Old Time Radio RPMs and Cylinder Recordings Top Audio Books & Poetry Computers, Technology and Science Music, Arts & Culture News & Public Affairs Spirituality & Religion Podcasts Radio News Archive Images Metropolitan Museum Cleveland Museum of Art Featured All Images This Just In Flickr Commons Occupy Wall Street Flickr Cover Art USGS Maps Top NASA Images Solar System Collection Ames Research Center Software Internet Arcade Console Living Room Featured All Software This Just In Old School Emulation Games Historical Software Classic PC Games Software Library Top Kodi Archive and Support File Vintage Software APK Software Software Library Software Sites Tucows Software Library Shareware Software Capsules Compilation Images ZX Spectrum DOOM Level CD Books Books to Borrow Open Library Featured All Books All Texts This Just In Smithsonian Li",startup,"{'status': '200', 'available': True, 'url': 'http://web.archive.org/web/20190226003244/https://newhavencommunitysolar.com/', 'timestamp': '20190226003244'}",20190226003244.0,1.0
