website,text_len,source,text,type,closest_snapshot,closest_snapshot_time,snapshot_in_window
https://iconiclean.co,27440,crunchbase,"Services - ICONICLEAN Your local friendly cleaning crew Home about Services Commercial Cleaning Athletic Facility Cleaning General Office Cleaning Apartment Complexes Garbage Chutes Contact Home about Services Commercial Cleaning Athletic Facility Cleaning General Office Cleaning Apartment Complexes Garbage Chutes Contact Services Denver, CO, commercial cleaning & disinfection specialists Denver, CO, commercial cleaning & disinfection specialists Iconiclean provides a complete range of commercial cleaning and disinfection services that can be to your specific We will work closely with you to establish a baseline that meets ours and your expectations, then our team will work hard to deliver on that cleaning Our crew is known for its accountability and We strive to at every point of service, helping you protect your assets, boost employee morale, and keep your customers coming back for IconiClean Services include: Commercial Cleaning Iconiclean offers a complete range of commercial cleaning services to suit your specific Learn More Athletic facility cleaning Your members understand Not only can you build up their bodies, but you can provide a fresh, safe space for them to We will clean and disinfect your gym from top to bottom, ensuring the safety and comfort of your Learn More General Office cleaning Dirty workspaces only cause problems in the A clean workplace is the foundation of any successful We clean on your schedule and to your Learn More Apartment Buildings The cleanliness of your building can provide you with a competitive advantage over other We focus on the common areas and amenities of your residential buildings to ensure your tenants’ complete Learn More Garbage Chutes Avoid malodors and disease, reduce the risk of fire and ensure chute efficiency by keeping your garbage chute clean and in good working Learn More See how your business can sparkle with Iconiclean Contact Services Commercial Cleaning Athletic Facilities General Office Cleaning Apartment Buildings Garbage Chutes Cannabis Grow Operations © AWR Services | Small Business Digital Marketing managed by GoEdison Contact Us We re not around right But you can send us an email and we ll get back to you, Not readable? Change I consent to AWR Services Colorado collecting my details through this Send Start typing and press Enter to search   Services: General Office Cleaning - ICONICLEAN Your local friendly cleaning crew Home about Services Commercial Cleaning Athletic Facility Cleaning General Office Cleaning Apartment Complexes Garbage Chutes Contact Home about Services Commercial Cleaning Athletic Facility Cleaning General Office Cleaning Apartment Complexes Garbage Chutes Contact Services: General Office Cleaning Professional, reliable commercial office cleaning in Denver, CO Professional, reliable commercial office cleaning in Denver, CO We aim to take the unnecessary stress out of your workday by keeping your office and work areas clean, safe, and It’s more challenging to get things done when you’re trying to work in a dirty or untidy A clean office provides many benefits, including: Boosts productivity Improves employee morale Creates a desirable place to work May help you retain employees Improves workplace safety Reduces employee sick days Saves you time and aggravation Frees up your employees’ time for tasks Gives you peace of mind To enjoy a healthier, happier work environment, get started with Iconiclean Get started with commercial office cleaning Regular office cleaning in Denver is a But every company is different, with different work schedules to consider and different cleaning We do not take a approach to our commercial office cleaning Instead, we will sit down with you to talk about what you do and how you do it, helping to establish an ongoing cleaning schedule that makes sense for you and your Simply put, when we are done, all of your surfaces will A clean office will help you present a professional appearance to your customers and It will contribute to your stellar reputation and make you feel good about your workplace, helping you get more done throughout the Office cleaning services: Some of the office cleaning services we offer include: Office and workstation clean and tidy Remove waste and recycling Sweep, mop, and vacuum Floors and baseboards High dusting Carpet cleaning and carpet care Draperies and blinds Walls and interior windows Scrub, disinfect, and deodorize bathrooms Clean and disinfect kitchens and break rooms Clean and dust all surfaces Electrostatic application of disinfectant to reduce employee sickness Why choose Iconiclean? There are plenty of commercial cleaning services in the Denver metro area, but none that have the heart and determination of We work hard to gain your trust and will always go the extra mile to ensure we on our Our employees are trained in the highest standards of safety, ensuring a result that is as healthy as it is beautiful to Call today to learn more about how to get started with com",startup,"{'status': '200', 'available': True, 'url': 'http://web.archive.org/web/20211129031620/http://iconiclean.co/', 'timestamp': '20211129031620'}",20211129031620.0,0.0
https://deluryenterprise.com/,3538,crunchbase," DeLury Enterprise we want to hear your story We want you to Live the life you deserve LevelUp Meds for Caregivers LevelUp Meds for Caregivers LevelUp Meds for Caregivers LevelUp Meds for Caregivers Soon we will need Beta testers! Be first to add your name to our Become a Beta Tester LevelUp Meds for Caregivers Individuals Organize your life - improve your health Individuals Caregivers Be Reassured Reduce Relieve Stress Caregivers LevelUp Meds for Caregivers Avoid extreme consequences Medications can t do their job if they are not taken This leads to poorer health, avoidable healthcare costs even premature We want to prevent extreme While we are perfecting our product to meet your needs we would like to hear how you manage you medications and or the medications of your loved Become a Beta Tester You deserve to live your best DeLury Enterprise is committed to improving lives through better medication Working with you means we can understand your story better and perfect our You deserve to live your best Become a Beta Tester LevelUp Meds for Caregivers Be Reassured According to estimates from the National Alliance for Caregiving million Americans serve as family caregivers for an ill or disabled This is nearly 1 3 of the population and almost 1 3 of households! The DeLury Enterprise medication management system is being designed with your worries in Tell us what worries We don t want to miss anyone s concerns! Become a Beta Tester Reduce or Eliminate Miscommunication Family members need to know their loved one is taking their medications while someone else is providing essential This is also true if more than one family member or person is helping take care of a loved Our medication management system reassures your clients their loved one gets maximum benefits from medications that have been Tell us how you keep track of who has given medication to your loved Become a Beta Tester Caught In Between The National Alliance for Caregiving (NAC) in partnership with Caring Across Generations report over million Americans are caring for an adult family member while caring for children at The DeLury Enterprise Medication Management System can relieve the confusion and stress from managing Tell us how you do an ever more complicated life Become a Beta Tester LevelUp Meds for Caregivers Stay Up To Date Patients don t always know their As people good health is a greater Stay up to date on patient s medications prescribed by out of network How do you know for sure We are very excited to be on this journey! So Much More to The journey from an idea to a finished product is a path that isn t easy or We appreciate your interest and invite you to tell us why you visited our While we are navigating the many paths ahead we want to know If you have a story or concern and we want you to be a part of our Become a Beta Tester LevelUp Meds for Caregivers OUR MISSION LevelUp Meds is committed to improving lives through better medication management and providing assurance medications have been taken correctly so everyone can live the quality of life they Contact Us Add your name here (or just drop us a line!) Name Email Send This site is protected by reCAPTCHA and the Google Privacy Policy and Terms of Service We will need Beta Testers soon Fill out the form above and be the first in line to be a beta tester! LevelUp Meds DeLury Enterprise, Syracuse, IN US Our Partners DeLury Enterprise DeLury Enterprise Syracuse IN US (765) Copyright © DeLury Enterprise - All Rights Powered by GoDaddy Website Builder ",startup,"{'status': '200', 'available': True, 'url': 'http://web.archive.org/web/20220106012140/https://deluryenterprise.com/', 'timestamp': '20220106012140'}",20220106012140.0,0.0
https://www.rockthescore.com,12917,crunchbase,"Wayback Machine We will keep fighting for all libraries - stand with us! Internet Archive logo A line drawing of the Internet Archive headquarters building faÃ§ade. Donate icon An illustration of a heart shape ""Donate to the archive"" Search icon An illustration of a magnifying Search icon An illustration of a magnifying Upload icon An illustration of a horizontal line over an up pointing Upload User icon An illustration of a person s head and Sign up | Log in Web icon An illustration of a computer application window Wayback Machine Texts icon An illustration of an open Books Video icon An illustration of two cells of a film Video Audio icon An illustration of an audio Audio Software icon An illustration of a "" floppy Software Images icon An illustration of two Images Donate icon An illustration of a heart shape Donate Ellipses icon An illustration of text More Hamburger icon An icon used to represent a menu that can be toggled by interacting with this Internet Archive Audio Live Music Archive Librivox Free Audio Featured All Audio This Just In Grateful Dead Netlabels Old Time Radio RPMs and Cylinder Recordings Top Audio Books & Poetry Computers, Technology and Science Music, Arts & Culture News & Public Affairs Spirituality & Religion Podcasts Radio News Archive Images Metropolitan Museum Cleveland Museum of Art Featured All Images This Just In Flickr Commons Occupy Wall Street Flickr Cover Art USGS Maps Top NASA Images Solar System Collection Ames Research Center Software Internet Arcade Console Living Room Featured All Software This Just In Old School Emulation Games Historical Software Classic PC Games Software Library Top Kodi Archive and Support File Vintage Software APK Software Software Library Software Sites Tucows Software Library Shareware Software Capsules Compilation Images ZX Spectrum DOOM Level CD Books Books to Borrow Open Library Featured All Books All Texts This Just In Smithsonian Libraries FEDLINK (US) Genealogy Lincoln Collection Top American Libraries Canadian Libraries Universal Library Project Gutenberg Children s Library Biodiversity Heritage Library Books by Language Additional Collections Video TV News Understanding 9 11 Featured All Video This Just In Prelinger Archives Democracy Now! Occupy Wall Street TV NSA Clip Library Top Animation & Cartoons Arts & Music Computers & Technology Cultural & Academic Films Ephemeral Films Movies News & Public Affairs Spirituality & Religion Sports Videos Television Videogame Videos Vlogs Youth Media Search the history of over billion web pages on the Search the Wayback Machine Search icon An illustration of a magnifying Mobile Apps Wayback Machine (iOS) Wayback Machine (Android) Browser Extensions Chrome Firefox Safari Edge Subscription Explore the Collections Learn More Build Collections Save Page Now Capture a web page as it appears now for use as a trusted citation in the Please enter a valid web address About Blog Projects Help Donate Contact Jobs Volunteer People Sign up for free Log in Search metadata Search text contents Search TV news captions Search radio transcripts Search archived web sites Advanced Search About Blog Projects Help Donate Donate icon An illustration of a heart shape Contact Jobs Volunteer People DONATE Latest Show All The Wayback Machine has not archived that Click here to search for all archived pages under https: rockthescore.com e-book . The Wayback Machine requires your browser to support JavaScript, please email if you have any questions about The Wayback Machine is an initiative of the Internet Archive , a (c)(3) , building a digital library of Internet sites and other cultural artifacts in digital Other projects include Open Library & . Your use of the Wayback Machine is subject to the Internet Archive s Terms of Use .   Credit Tips & Resources – Rock The Score Home How It Works Resources In The News Education Enroll Credit Tools Free TipSheet 5 Quick Ways to Rock Your Credit Score Download For Free Human Support Email: Important Links FAQs Terms and Conditions Refund Policy Member Log In © Rock The Score, All Rights Reserved Home How It Works Resources In The News Education Enroll Credit Tools Member Login © Rock The All rights Designed Beautifully By RaisingSails .   In The News – Rock The Score Home How It Works Resources In The News Education Enroll Credit Tools In The News American Dream TV March | Featured: Peter Wright, CEO Rock The Score & Brian Sohn REALTOR Louis Real Producers Magazine March David Lykken – Lykken on Lending (Audio Podcast) February | Featured Guests: Peter Wright & Tom Beck of Rock The Score Your browser does not support the audio Human Support Email: Important Links FAQs Terms and Conditions Refund Policy Member Log In © Rock The Score, All Rights Reserved Home How It Works Resources In The News Education Enroll Credit Tools Member Login © Rock The All rights Designed Beautifully By RaisingSails .   Rock The Score: Improve Your Credit Score Home How It Works Resources In The News Enr",startup,"{'status': '200', 'available': True, 'url': 'http://web.archive.org/web/20190129195747/https://rockthescore.com/', 'timestamp': '20190129195747'}",20190129195747.0,1.0
https://www.whiskeydowndiner.com/,4779,crunchbase," Live Shows | Whiskey Down Diner HOME ABOUT US MENUS CONTACT US More Upcoming Events Sun Feb John Buckley Register Now Sat May Alexa Hill Register Now Sat Aug Eddie Baker Register Now Join the Club & Get Updates and News ​ BUSINESS HOURS (temporary and delivery hours) MONDAY TUESDAY WEDNESDAY THURSDAY FRIDAY SATURDAY SUNDAY ​ P:(516)927-8264 © by WHISKEY DOWN DINER site by Isobel Media, We are committed to providing a website that is accessible to the widest possible audience, regardless of circumstance and We aim to adhere as closely as possible to the Web Content Accessibility Guidelines (WCAG , Level AA), published by the World Wide Web Consortium (W3C). These guidelines explain how to make Web content more accessible for people with Conformance with these guidelines will help make the web more user friendly to Whilst we strive to adhere to the guidelines and standards for accessibility, it is not always possible to do so in all areas of the website and we are currently working to achieve Be aware that due to the dynamic nature of the website, minor issues may occasionally occur as it is updated We are continually seeking out solutions that will bring all areas of the site up to the same level of overall web If you have any comments and or suggestions relating to improving the accessibility of our site, please don t hesitate to contact ​   MENUS | Whiskey Down Diner HOME ABOUT US MENUS CONTACT US More FULL MENU Click Here LATE NIGHT Click Here DRINKS Click Here Join the Club & Get Updates and News ​ BUSINESS HOURS (temporary and delivery hours) MONDAY TUESDAY WEDNESDAY THURSDAY FRIDAY SATURDAY SUNDAY ​ P:(516)927-8264 © by WHISKEY DOWN DINER site by Isobel Media, We are committed to providing a website that is accessible to the widest possible audience, regardless of circumstance and We aim to adhere as closely as possible to the Web Content Accessibility Guidelines (WCAG , Level AA), published by the World Wide Web Consortium (W3C). These guidelines explain how to make Web content more accessible for people with Conformance with these guidelines will help make the web more user friendly to Whilst we strive to adhere to the guidelines and standards for accessibility, it is not always possible to do so in all areas of the website and we are currently working to achieve Be aware that due to the dynamic nature of the website, minor issues may occasionally occur as it is updated We are continually seeking out solutions that will bring all areas of the site up to the same level of overall web If you have any comments and or suggestions relating to improving the accessibility of our site, please don t hesitate to contact ​   HOME | Whiskey Down Diner HOME ABOUT US MENUS CONTACT US More GRUB HUB UBER EATS NOW OPEN! MAIN STREET FARMINGDALE, NY first come, first ​ DOOR DASH ABOUT US YOUR NEIGHBORHOOD DINER, WITH A TWIST (LITERALLY) THE CLASSIC AMERICAN, NEIGHBORHOOD IT S OUR FAMILY BUSINESS, AND THERE S SO MUCH WE LOVE ABOUT IT: THE WARM ATMOSPHERE, THE COMMUNITY, THE NOSTALGIA, AND OF THE 1 11 WHISKEY DOWN AN CONCEPT WE RE SKIPPING THE ENCYCLOPEDIC MENU FOR A MORE MODERN APPROACH, WITH THE HIGH QUALITY AND CHARACTER OF A SMALL OUR FAMILY CAN REMEMBER WHEN SHOUTING RYE TOAST IN THE KITCHEN COULD GET CONFUSED FOR THE WRONG WHISKEY DOWN BECAME THE WAY TO GET IT RIGHT DECADES AGO, AND IT S A BIT OF HISTORY WE PAY HOMAGE THE NAME GAME WHAT S WHISKEY DOWN MEAN? SOCIAL MEDIA IS THE BEST WAY TO SEE WHAT S HAPPENING AT WHISKEY FOLLOW US SEE WHAT S COOKIN FOR QUESTIONS FEEL FREE TO CONTACT US USING THE FORM Submit Join the Club & Get Updates and News ​ BUSINESS HOURS (subject to change for holidays manager s discretion) MONDAY TUESDAY WEDNESDAY THURSDAY FRIDAY :30PM SATURDAY :30PM SUNDAY ​ P:(516)927-8264 © by WHISKEY DOWN DINER site by Isobel Media, We are committed to providing a website that is accessible to the widest possible audience, regardless of circumstance and We aim to adhere as closely as possible to the Web Content Accessibility Guidelines (WCAG , Level AA), published by the World Wide Web Consortium (W3C). These guidelines explain how to make Web content more accessible for people with Conformance with these guidelines will help make the web more user friendly to Whilst we strive to adhere to the guidelines and standards for accessibility, it is not always possible to do so in all areas of the website and we are currently working to achieve Be aware that due to the dynamic nature of the website, minor issues may occasionally occur as it is updated We are continually seeking out solutions that will bring all areas of the site up to the same level of overall web If you have any comments and or suggestions relating to improving the accessibility of our site, please don t hesitate to contact ​ ",startup,None,nan,0.0
http://paradigmlabs.io,4942,crunchbase," Wayback Machine We will keep fighting for all libraries - stand with us! Internet Archive logo A line drawing of the Internet Archive headquarters building faÃ§ade. Donate icon An illustration of a heart shape ""Donate to the archive"" Search icon An illustration of a magnifying Search icon An illustration of a magnifying Upload icon An illustration of a horizontal line over an up pointing Upload User icon An illustration of a person s head and Sign up | Log in Web icon An illustration of a computer application window Wayback Machine Texts icon An illustration of an open Books Video icon An illustration of two cells of a film Video Audio icon An illustration of an audio Audio Software icon An illustration of a "" floppy Software Images icon An illustration of two Images Donate icon An illustration of a heart shape Donate Ellipses icon An illustration of text More Hamburger icon An icon used to represent a menu that can be toggled by interacting with this Internet Archive Audio Live Music Archive Librivox Free Audio Featured All Audio This Just In Grateful Dead Netlabels Old Time Radio RPMs and Cylinder Recordings Top Audio Books & Poetry Computers, Technology and Science Music, Arts & Culture News & Public Affairs Spirituality & Religion Podcasts Radio News Archive Images Metropolitan Museum Cleveland Museum of Art Featured All Images This Just In Flickr Commons Occupy Wall Street Flickr Cover Art USGS Maps Top NASA Images Solar System Collection Ames Research Center Software Internet Arcade Console Living Room Featured All Software This Just In Old School Emulation Games Historical Software Classic PC Games Software Library Top Kodi Archive and Support File Vintage Software APK Software Software Library Software Sites Tucows Software Library Shareware Software Capsules Compilation Images ZX Spectrum DOOM Level CD Books Books to Borrow Open Library Featured All Books All Texts This Just In Smithsonian Libraries FEDLINK (US) Genealogy Lincoln Collection Top American Libraries Canadian Libraries Universal Library Project Gutenberg Children s Library Biodiversity Heritage Library Books by Language Additional Collections Video TV News Understanding 9 11 Featured All Video This Just In Prelinger Archives Democracy Now! Occupy Wall Street TV NSA Clip Library Top Animation & Cartoons Arts & Music Computers & Technology Cultural & Academic Films Ephemeral Films Movies News & Public Affairs Spirituality & Religion Sports Videos Television Videogame Videos Vlogs Youth Media Search the history of over billion web pages on the Search the Wayback Machine Search icon An illustration of a magnifying Mobile Apps Wayback Machine (iOS) Wayback Machine (Android) Browser Extensions Chrome Firefox Safari Edge Subscription Explore the Collections Learn More Build Collections Save Page Now Capture a web page as it appears now for use as a trusted citation in the Please enter a valid web address About Blog Projects Help Donate Contact Jobs Volunteer People Sign up for free Log in Search metadata Search text contents Search TV news captions Search radio transcripts Search archived web sites Advanced Search About Blog Projects Help Donate Donate icon An illustration of a heart shape Contact Jobs Volunteer People DONATE Latest Show All The Wayback Machine has not archived that Click here to search for all archived pages under https: www.paradigmlabs.io . The Wayback Machine requires your browser to support JavaScript, please email if you have any questions about The Wayback Machine is an initiative of the Internet Archive , a (c)(3) , building a digital library of Internet sites and other cultural artifacts in digital Other projects include Open Library & . Your use of the Wayback Machine is subject to the Internet Archive s Terms of Use .   The ultimate resource for startup Announcing RISE Studio Get personalized guidance! Paradigm BETA The ultimate resource for startup Weâve spent 8,000+ hours analyzing trends alongside veterans from the top + organizations to bring you comprehensive guides on the most effective marketing strategies to Constantly All You re all set! We ll send you an email as we go live! Oops! Something went wrong while submitting the What we ll be covering Focus on the specific actions that will lead to growth using our tailored marketing knowledge from some of the worldâs top Guides Articles Use your blog and industry expertise to attract, engage & support current and potential Guides Articles Put your products & compelling content in front of the customers that are most likely to value Guides Articles Build company websites & landing pages to convert target audiences into loyal Guides Articles Engage your community, provide helpful resources, and increase customer Guides Articles Use engaging content to raise brand awareness, guide customer consideration, onboard & Guides Articles Leverage social networks to engage your audience and reach new potential ",startup,"{'status': '200', 'available': True, 'url': 'http://web.archive.org/web/20180902080450/https://www.paradigmlabs.io/', 'timestamp': '20180902080450'}",20180902080450.0,1.0
