website,text_len,source,text,type,closest_snapshot,closest_snapshot_time,snapshot_in_window
https://www.texasdonornetwork.org,4023,crunchbase," Texas Donor Network | Services Home About Us About Donation Become a Donor FAQ Proudly Serving the Rio Grande Valley About Donation Approximately ,00 Americans needed a tissue transplant in Bone ​ Bones from the arms and the legs are used for various types of transplantation such as vertebral discs, grafts, bone reconstruction and dental Tendons Tendons are most commonly used in sports related injuries such as ACL They are also used to attach bones and muscles and repair damaged Skin ​ Donated skin is used to treat burn victims and aid in breast reconstruction after Over ,000 skin grafts were performed in Cardiac Tissue Cardiac tissues are used for vein, artery and valve Texas Donor Network Tyler Suite 9 Harlingen, Tx Tel:(855)496 - Fax:(956)496-2107   Texas Donor Network | About Us Home About Us About Donation Become a Donor FAQ Proudly Serving the Rio Grande Valley Our Vision Improving people s lives by providing tissue donations for transplantation, research and education, while providing compassionate support to families through outreach and About Us ​ Established in , Texas Donor Network is the first FDA registered organization of its kind based in the Rio Grande ​ Partnered with hospitals throughout the Rio Grande Valley, Texas Donor Network is dedicated to improving the people s lives by providing donated tissues for transplantation, research, therapy and Our Family Service Coordinators work closely with families through compassionate support and education about tissue donation and the impact it has on the lives of Family Service Coordinators guide them through the donation requirements through consultation and ​ Our highly skilled Recovery Team recover the donated gifts with professionalism and respect ensuring the donor and their family are given the greatest consideration for honoring final Texas Donor Network Tyler Suite 9 Harlingen, Tx Tel:(855)496 - Fax:(956)496-2107   Texas Donor Network Home About Us About Donation Become a Donor FAQ Proudly Serving the Rio Grande Valley Texas Donor Network Due to all events are postponed until further notice Wall of Heroes 4 3 2020 Valley Baptist Medical Center - Harlingen will be hosting a commemorative dedication to honor all the organ, tissue and eye donor families in the Woodward Conference Donate Life Texas Walk 4 4 2020 Donate Life Texas Walk will be held from 8:00 - :00 at Southern Pacific Linear and Ringgold in Donate Life Month Donate Life Month features an entire month of local, regional and national activities to help encourage Americans to register as an organ, eye and tissue donor and to celebrate those hat have saved lives through the gift of 1 3 Partnered with There are over ,000 people patiently awaiting a life changing ​ The gift of tissue is a gift of life, health and Talk to your family about becoming a registered organ and tissue donor and register online at Donate Life Give Us Your Feedback If this is regarding a previous case please include TDN number Send Feedback Thank you! Texas Donor Network Tyler Suite 9 Harlingen, Tx Tel:(855)496 - Fax:(956)496-2107   Texas Donor Network | FAQ Home About Us About Donation Become a Donor FAQ Proudly Serving the Rio Grande Valley Frequently Asked Questions If I am in an accident will the hospital staff try to safe my life if I am a registered donor? The hospital staff will do everything they can to save your life whether you are a registered donor or ​ ​ Does my history of medical illnesses prevent me form becoming a donor? Very few medical conditions automatically disqualify you from becoming a ​ Will donation delay or alter funeral arrangements? The donation process is quick and should not interfere with funeral arrangements nor affect viewing ​ Will my family will be charged for the donation process? The cost directly related to the evaluation, recovery, preservation and placement of the donated gifts will not be charged to the family or the estate of the ​ Texas Donor Network Tyler Suite 9 Harlingen, Tx Tel:(855)496 - Fax:(956)496-2107 ",startup,"{'status': '200', 'available': True, 'url': 'http://web.archive.org/web/20200922150812/https://www.texasdonornetwork.org/', 'timestamp': '20200922150812'}",20200922150812.0,1.0
https://gamma.ai,12407,crunchbase,"AI Powered Cloud DLP for Gmail Problem Solution Integrations Blog Request a Demo Problem Solution Integrations Blog Request a Demo AI Powered Cloud DLP for Gmail Proactively prevent employees against malicious, insider or negligent threats on Gmail Request a Demo Request a Demo Thank You! Our team has received your We will get back to you soon Your browser does not support the video Why Secure Gmail? Bank account details in Gmail Using financial data in emails is a violation of various banking regulations like PCI, NACHA among Accidental sharing Emailing documents with sensitive data to the wrong email address is the most common data Forwarding confidential documents to personal email Forwarding confidential documents to personal email is an insider threat that keeps CISO’s up at CEO Impersonation (Spear phishing and BEC) Users responding to CXO impersonation leads to financial loss and loss of How Gamma Helps! Visibility Gamma uses AI & ML to identify bank account data, sensitive data in emails and sensitive files in email Compliance with regulations Gamma helps you put automated technology controls to ensure continuous compliance with Continuous Training Train or coach employees when they make a Build a culture of Proactive Policy Enforcement Proactively enforce organization s security policies on Schedule Demo Please give us your details & we will get back to you shortly! Thank You! Our team has received your We will get back to you soon Collaboration platforms Slack | Gmail | Outlook | Mattermost | Microsoft Teams Storage platforms Gdrive | Box | Dropbox | Onedrive Business applications Salesforce | Jira | Github | Workday Request a Demo Request a Demo Thank You! Our team has received your We will get back to you soon © - Gamma All Rights Blog · Security · Terms of Use · Privacy Policy Blog · Security Terms of Use · Privacy Policy   AI Powered Cloud DLP for Mattermost Problem Solution Integrations Blog Request a Demo Problem Solution Integrations Blog Request a Demo AI Powered Cloud DLP for Mattermost Proactively prevent employees against malicious, insider or negligent threats on Mattermost Request a Demo Request a Demo Thank You! Our team has received your We will get back to you soon Your browser does not support the video Why Secure Mattermost? Sharing Credentials Sharing credentials on Mattermost is as convenient as an attacker being able to harvest all of them in one Mattermost = Business Your business runs on Thus there lives most of your company s secret Bots & Apps Anyone can easily install bots on And any bot can harvest all the data inside that Share on Mattermost Integrations Every application including Github, Dropbox, Box easily allow sharing code or data on No security checks or measures in How Gamma Helps! Visibility Gamma uses AI & ML to identify credentials, sensitive data and sensitive files in Mattermost Compliance with regulations Gamma helps you put automated technology controls to ensure continuous compliance with Continuous Training Train or coach employees when they make a Build a culture of Proactive Policy Enforcement Proactively enforce organization s security policies on Schedule Demo Please give us your details & we will get back to you shortly! Thank You! Our team has received your We will get back to you soon Collaboration platforms Slack | Gmail | Outlook | Mattermost | Microsoft Teams Storage platforms Gdrive | Box | Dropbox | Onedrive Business applications Salesforce | Jira | Github | Workday Request a Demo Request a Demo Thank You! Our team has received your We will get back to you soon © - Gamma All Rights Blog · Security · Terms of Use · Privacy Policy Blog · Security Terms of Use · Privacy Policy   AI Powered Cloud DLP for Outlook Problem Solution Integrations Blog Request a Demo Problem Solution Integrations Blog Request a Demo AI Powered Cloud DLP for Outlook Proactively prevent employees against malicious, insider or negligent threats on Outlook Request a Demo Request a Demo Thank You! Our team has received your We will get back to you soon Your browser does not support the video Why Secure Outlook? Phishing Attacks Phishing emails intentionally try and fool users into entering their information or credentials into a fraudulent site Sharing sensitive data Accessing sensitive data such as your account numbers and IDs (passport) on email from anywhere is convenient for you and also the hackers Email = Business All your business is done on emails - Your invoices, payments, trade secrets are all on email Human error Accidentally sending emails to the wrong user is one of the most common causes of breaches How Gamma Helps! Continuous Monitoring Gamma uses AI & ML to identify credentials, sensitive data and files in outlook Compliance with regulations Automate technology controls to ensure continuous compliance within Outlook Continuous Training Build a culture of Train or coach employees when they commit a mistake on Outlook Proactive Policy Enforcement Enforce orga",startup,"{'status': '200', 'available': True, 'url': 'http://web.archive.org/web/20200930134405/https://gamma.ai/', 'timestamp': '20200930134405'}",20200930134405.0,1.0
http://festionline.com,12879,crunchbase,"Blog | Festi Home About us press Book Post Blog FAQ More Home About us press Book Post Blog FAQ Home About us press Book Post Blog FAQ SIGN OUT Blog Copyright © Festi - All Rights Contact us Terms and Policies   Festi Home About us press Book Post Blog FAQ More Home About us press Book Post Blog FAQ A new way of getting together A social reservation network ✕ Home About us press Book Post Blog FAQ SIGN OUT Use technology to connect, so you can Book or host any event, with an option to add From parties, work lunches, performances, to exercise, share with the right If you want to get together, we ll make it happen in a couple of minutes or How it works Book to go See activities posted by friends and others around If you can see it, you can book Once your request is accepted, just Post an event Create any event (private or public). Control who Share costs if you Finally, a tactful way of collecting money, without having to ask! Follow friends Follow friends to see their private Create your own network of close friends, new friends and everyone in download to see all events We are in Only the app is available Full web version coming be social and stay private No more group chats, scheduling conflicts, exchanging contacts, awkward invitations, waiting for responses, or asking people to getting together just got easier Whether it s a bike ride or a special event, we ll help you get the word out, handle bookings, notifications, payments, cancellations, directions and all in one Here s what people are saying about Festi I posted dinner and charged for I posted a private Unlike an invitation, I got to choose who gets to come and closed the party after The charge was great because I rather have $ to buy groceries, set my own menu than deal with people bringing It was nice to know exactly how many people to cook Lisa Cool way to find out who is I made dinner reservations for 6 at a new I posted it on My friends who were free Once I accepted everyone I wanted, I closed the event as It s kind of a genius way of getting all 6 spots filled with I didn t get any booking requests from any strangers but I would have entertained the I don t have to ask for money Even with Venmo, I still have to ask for people to pay me and that s a I ""ordering pizza for dinner who s in"". It s nice to know who s committed so I know how much to The app handled the I just had to accept people s booking That part was kind of To schedule without I was meaning to get together with my friend for a long time but never got around to texting I saw her posting for lunch and I happen to be free that day so I just It was so much easier than trying to I like anything that saves me Change of I love the I posted a bike ride and then, the next day got an invitation to go to a game at the same time (friend had an extra tix). Since no one booked my bike ride yet, I just changed the It was so A posting is so much less commitment than an Can t believe no one thought of this Great for a I booked a great cooking class and we never had to discuss Just like Uber, payment is handled through the I just showed The automatic calendaring and directions came in You don t get directions until after your booking is Gather for goodness When you post an event, we donate $1 to Charity of the month is Little Lights after school program for children in public Contact us to vote for the next charity or organization you would like us to Copyright © Festi - All Rights Contact us Terms and Policies   Festi FAQ Festi User Tips | Festi Home About us press Book Post Blog FAQ More Home About us press Book Post Blog FAQ Home About us press Book Post Blog FAQ SIGN OUT To access and manage your account, log in to the Frequently Asked Questions Can I see all events? You only see what your friends allow you to see, under ""Events Posted by Friends"". The more friends you follow the more events you can For ""Events around you"" you see public postings from other Please allow location access from your phone to see postings around What happens after I make a booking request? Once you make a booking request, the host has hours to accept your booking and then the request expires and you are free to request again or move on to next How do I share an event with friends? There are 2 ways to share: 1) If you have followers, you can post on Festi for selected followers to see (that is the best way) or 2) If your friend is not on Festi, after you post, a link is created for you to send to friends to To share, click on the share icon under your posted events and send the link by text, email, facebook, whats app Can I see who else is attending the event? Only after your booking is Once your booking is confirmed, it will appear under “Your Reservation” and ""Your Upcoming Events"" page where you can access all details including name of all attending However, before booking you get to see the size of the gathering , 5+ or + so you have an idea if it s going to be a small or large How do I discover people? You ca",startup,"{'status': '200', 'available': True, 'url': 'http://web.archive.org/web/20190129225029/https://festionline.com/', 'timestamp': '20190129225029'}",20190129225029.0,1.0
https://www.attain.fund/,8563,crunchbase,"How Investing Works – ATTAIN Fund | Leading AI Fund for US Mortgage Investing Texas Drive, Suite , Sugar Land, Texas, Investor Login » Home How Investing Works Get Started Contact Us Search Site How Investing Works Home How Investing Works We make US property investing smarter, simpler and more Invest in secured property loans and earn from % net annual Invest in US banks of all sizes have approximately $248 billion in and late mortgage loans that ATTAIN has relationship access These mortgage notes offer 7 times the inventory of traditional REO (real estate owned) investments and are secured against actual real estate Unlike individual real estate projects such as development, rehab, land lording and wholesaling, with ATTAIN – investors have the freedom to not be locked into a certain geographical region as well as being free of dealing with a myriad number of potential pitfalls that comes with land development, market timing, location scouting, obtaining permits with various local government agencies, construction overruns, finding the right tenants, realtor commissions and management These are just a few of the issues that investors can avoid by including ATTAIN in their GET STARTED Debt investment is safer than investing in SECURE Unlike equity or eREITs (Electronic Real Estate Investment Trusts) where investors become shareholders in a particular project, our investors invest in loans secured against SAFE Debt is the safest type of property It’s senior to the borrower’s equity and acts like a cushion that protects your There are three distinct advantages to ATTAIN’s platform over traditional investments: Risk – With traditional investment vehicles such as individual stocks and mutual funds, investors are exposed to risk without any Even with various funds, investors have the potential for risky returns but with an inevitable Asset managers utilizing modern portfolio theory (MPT) by including ATTAIN, can construct an efficient frontier to offset market ATTAIN deals only with real estate note investing where the property is the investors Return – Another difference between traditional investments and ATTAIN is the net average rate of Most vehicles return between % per ATTAIN offers consistent and steady net returns of % per Technology & Team – With ATTAIN, our management team of data scientists and real estate professionals, along with our proprietary machine learning algorithm, analyzes the most profitable notes to Why Risk Mitigation is ATTAIN utilizes embedded securitization and risk mitigation We only invest in first lien positions meaning that our funds are the first to get paid if there is a downtrend ATTAIN’s engineers set parameters: exposure caps, tax liens, the credit of the borrower, run exit models, Compliance and risk management rules are ingrained into our system’s These constraints set up the borders within which the machine does its The system then seeks out patterns, making connections among the data that humans can’t Machine learning is a broad, term for a wide range of computer algorithms designed to identify repeatable structures and relationships in data without needing explicit instructions about what to look ATTAIN’s platform is always evolving to meet market These are some examples of US property mortgage notes that ATTAIN has worked $125,900 The Woodlands, Texas 3 bedroom 2 bath single family LTV: % $75,900 Missouri City, Texas 3 bedroom 2 1 2 bath single family LTV: % $148,800 Miami, Florida 4 bedroom 3 bath single family LTV: % $155,870 Circle Palm City, Florida 2 bedroom 2 1 2 bath LTV: % $54,450 South Beloi, Illinois 2 bedroom 2 bath single family LTV: % $143,750 Cape Coral, Florida 1 st lien UPB of $143,750 + 3 year of Purchase Price of $55 $110,000 FMV Secure We invest only in first lien % Get % net average annual returns while investing in ATTAIN’s Get in touch to explore our investment Why ATTAIN ATTAIN, the leading quantitative fund for US Mortgage Note We make investing in US mortgage notes and the underlying properties smarter, simpler and more secure and Quick Links Home How Investing Works Get Started Disclaimer Contact Us Search Copyright ATTAIN Fund, Top   Contact Us – ATTAIN Fund | Leading AI Fund for US Mortgage Investing Texas Drive, Suite , Sugar Land, Texas, Investor Login » Home How Investing Works Get Started Contact Us Search Site Contact Us Home Contact Us GET IN TOUCH At ATTAIN – our fund’s focus is growing our investors’ portfolio yield by investing in US real estate secured Get in touch to receive a fund brochure and investment Corporate Address: Texas Suite Sugar Land, Texas USA E: Your Name (required) Your Email (required) Subject Your Message Prove you are not a robot, which is bigger, 3 or 8? Why ATTAIN ATTAIN, the leading quantitative fund for US Mortgage Note We make investing in US mortgage notes and the underlying properties smarter, simpler and more secure and Quick Links Home How Investing Works Get Started Disclaimer Contact Us Search Copyrig",startup,"{'status': '200', 'available': True, 'url': 'http://web.archive.org/web/20181107065934/http://attain.fund/', 'timestamp': '20181107065934'}",20181107065934.0,1.0
https://www.api2pdf.com/,10901,crunchbase,"Pricing - Api2Pdf Docs Pricing Enterprise FAQ Contact Us Sign In Get my API Key Get started for free Create an account and receive one month of free credit to try out the Have more pricing questions? See our FAQ . $ 1 Month + Bandwidth and Usage Pay for What You Use Instant PDF Generation No Queuing or Request Limits Large File Support (Generate GB sized PDFs) Privacy Compliant (we delete all files after hours or on command) Reporting and Analytics Cancel at SIGN UP Estimate your cost Average Size per PDF Receipts Invoices are typically MB # of PDFs per month Monthly Cost: $ $.001 per mb bandwidth and $0.000055011 per second of Documentation Pricing Enterprise FAQ Portal Contact Us Blog Twitter News Status Alternatives Terms of Service Privacy Policy Multilingual Guides API2PDF Fairfax Drive STE Arlington VA © — api2pdf ™   Build, Collaborate & Integrate APIs | SwaggerHub   FAQ - Api2Pdf Docs Pricing Enterprise FAQ Contact Us Sign In Get my API Key FAQ Do you offer free accounts? Create an account to get one month of free credit to try out the How do you bill? $1 will be deducted from your balance every This charge begins days after your first sign up for the In addition, we charge $.001 per mb bandwidth and $0.000055011 per second of How do I refill my balance? You can configure your payment settings to automatically charge your credit card if your balance falls below a certain threshold, or you can make a payment at any Why are you so much cheaper than competitors? Our theory is that we run on AWS Lambda while other services maintain clusters of expensive Cancellation and refunds We do not have any long term You can leave us at anytime with no further As our minimum cost is $1.00, we do not provide Which payment methods are supported? We take all the major credit cards through Stripe for We also consider taking other forms of payment (including cryptocurrency). Contact us for Are there any limits? Api2Pdf does not set any specific limits on PDF file size, however each AWS Lambda request is provided 3 GB of RAM to work with and seconds to generate the Do you support languages with special characters? Definitely, click here to learn how to generate PDFs with all sorts of What PDF rendering engine do you use? For HTML and URLs to PDFs, you have the choice between wkhtmltopdf and Headless For converting from Office Documents and Images, we offer How long are PDFs stored on ? Your privacy and security is important to After generating a PDF via the API, you are provided with a link to the This link will hold the PDF for only If you wish to keep your PDF long term, download the file to your local If you want to delete your PDFs immediately, you can do so as See this post for details . Do you offer consulting services? Perhaps you want to run Api2Pdf on your own cloud account, or you have complicated PDF generation We are developers and are open to Feel free to contact us here . Documentation Pricing Enterprise FAQ Portal Contact Us Blog Twitter News Status Alternatives Terms of Service Privacy Policy Multilingual Guides API2PDF Fairfax Drive STE Arlington VA © — api2pdf ™   Contact Us - Api2Pdf Docs Pricing Enterprise FAQ Contact Us Sign In Get my API Key Contact Us Have questions about pricing, the API, or anything at all? Email: or complete the form Your Name Your Email Subject Your Message Documentation Pricing Enterprise FAQ Portal Contact Us Blog Twitter News Status Alternatives Terms of Service Privacy Policy Multilingual Guides API2PDF Fairfax Drive STE Arlington VA © — api2pdf ™   Api2Pdf: HTML to PDF API, Word to PDF, Merge PDFs on AWS Lambda Docs Pricing FAQ Contact Us Sign In Get my API Key PDF Generation, Powered by AWS Lambda HTML to PDF | URL to PDF | Office Doc to PDF | Merge PDFs DOCS TRY IT OUT What is Api2Pdf? Api2Pdf is a powerful PDF generation API with no rate limits or file size Generate PDFs from HTML, URLs, images, office documents, and Merge PDFs Api2Pdf runs on AWS Lambda, a serverless architecture powered by Amazon to scale to millions of requests while being up to % cheaper than The REST API provides endpoints for WKHTMLTOPDF , Headless Chrome , LibreOffice , and Merge PDFs . Choose which endpoints you want to use that best suits your HTML to PDF API URL to PDF API Office Docs to PDF API Merge PDFs API Convert HTML to PDF Convert URL to PDF Convert Office documents to PDF (Word to PDF, Excel to PDF, PowerPoint to PDF) Convert Images to PDF (gif, jpg, png, bmp to PDF) Merge concatenate two or more PDFs together Generate Barcodes and QR Codes with ZXING (Zebra Crossing) ON DEMAND PDF GENERATION WITH NONE OF THE HASSLE WKHTMLTOPDF | HEADLESS CHROME | LIBREOFFICE | PDF MERGE HTML URL Office Document INPUT Getting Started with Quick Start Guide REST API | Python | | Nodejs | PHP What is ? is a REST API for instantly generating PDF documents from HTML, URLs, Microsoft Office Documents (Word, Excel, Powerpoint), and The API also supports merge concatenation of two or more Api2Pdf is a wrapp",startup,"{'status': '200', 'available': True, 'url': 'http://web.archive.org/web/20181104162206/https://www.api2pdf.com/', 'timestamp': '20181104162206'}",20181104162206.0,1.0
