website,text_len,source,text,type,closest_snapshot,closest_snapshot_time,snapshot_in_window
https://myclaritycommercial.com,43397,crunchbase,"Blog - Clarity Commercial Home About Us Contact Us Payments Blog Resales Office Excelsior Louis Park, MN Give us a Call (952) hr Emergency Send us an Email Hours Mon - Fri: 8:30AM - Blog March , By adam2665 0 Comments Commercial Properties Property Management Spring Cleanup and Maintenance for Commercial Properties The snow is melting rapidly and potholes are cropping up across the metro area—it’s early spring in Minneapolis, It may not quite be time to put up the ice melt and gas up the lawn mower, but it is time to put together your Commercial properties require seasonal maintenance just like homes Here are five of the items Clarity Commercial will be taking care of for our clients in the next Patching Up Parking Lot Potholes The snow is on the way out and leaving massive potholes in its It seems like new craters appear every For commercial property managers, March is the season of asphalt and power While your parking lot snow mountain may persist through May, March is when you need to fill potholes and sweep your parking lot to remove salt and We partner with reputable asphalt and paving companies to keep our clients’ parking lots clear and Inspecting Roofs for Damage Several roof collapses made the news this February after nearly inches fell across the All that snow strains the integrity of commercial If you were lucky enough to avoid a , it still pays to have your roof inspected now that the snow’s Clarity Commercial hires professional commercial roofing companies to perform roof inspections at the properties we If we uncover damage, we work with our clients to have it repaired to keep tenants Cleaning Out the Gutters Gutters on commercial buildings can become blocked with leaves and other debris over the A commercial roofer can inspect your gutters while they’re looking at your Or, you can hire a gutter specialist to give your gutters a thorough We have resources for Scheduling Window Cleaning for March The busy season for window cleaners runs April through We like to stay ahead of the curve and have the windows of our properties cleaned in March after most of the snow has That way, our buildings look their best while their neighbors are waiting for their spring Clean windows also let the warm spring sunlight to brighten offices and Maintaining HVAC Systems While the heat will be on in most commercial buildings for another month or so, it’s a good time to schedule your HVAC maintenance appointment to clean your ducts and get your air conditioning ready for the warmer Patio weather is right around the Get your commercial property ready for sunny days with a little spring Clarity Commercial is here to Contact us today for help with regular commercial property maintenance . February , By adam2665 0 Comments Commercial Properties , Vendors Should You Upgrade to a Security System? Everyone on the Clarity Commercial team hopes to become a trusted partner and resource for our We’ve helped property owners with all sorts of questions, from how to grow a profitable commercial real estate portfolio to how to supervise One question we’re often asked is how to best secure a commercial There are as many ways to secure a property as there are properties A warehouse in Burnsville, Minnesota, has very different security and safety needs from an apartment building in downtown This month, we wanted to focus on one of the newer technologies in commercial security: security Security Is a Hot Trend security systems have become very popular options for commercial systems can integrate several different layers of security, from alarm and access control systems to security cameras and It’s easy and affordable to add sensors and other security equipment to a system, which makes them a great option for a growing business or for landlords with average to high tenant In a system, property managers and owners manage who has access to their buildings through an online They can assign and revoke access to all or parts of their property and review who’s entered and exited the storage of video makes it easy and affordable to keep and review footage from security cameras anytime, Access Control for Tenants For a property with multiple tenants, a security system is a great Many newer systems are operated via a smartphone app, which means owners do not have to invest in hundreds of key cards that can get lost or Instead, tenants download the app, the property owner or manager authorizes them as users, and the app automatically unlocks doors for them via the phone’s Bluetooth Since it’s , access can be assigned or revoked instantly, and records of who is entering and leaving the building are immediately If you’re considering adding or upgrading a security system on your commercial property, Clarity Commercial is here to Our property managers have years of experience advising property owners on how to find the security system that keeps their property secure without breaking the Contact us today for help . January , By adam2665 0 Comments",startup,"{'status': '200', 'available': True, 'url': 'http://web.archive.org/web/20180822005718/https://myclaritycommercial.com/', 'timestamp': '20180822005718'}",20180822005718.0,1.0
https://www.thermal.co/,6893,crunchbase,"We Fuel Ambition - Thermal About Portfolio Focus Partners Team Connect Terms of Use Thermal About Portfolio Focus Partners Team Connect About Capital & Creativity At Thermal, we’re out to create thriving economies through the marriage of creativity and Economies where ideas are empowered to bring real change to the Creating these economies starts by giving founders the fuel they need to get out of the starting At Thermal, we understand the needs of today’s founders because we’re founders Where other firms fuel businesses, we fuel the people behind them, and the driving force that turns ideas into wildly successful At Thermal, we fuel Portfolio Projects We’ve Fueled We , built and scaled the largest online resource in the addiction treatment Led by , Recovery Brands (RB) helped millions of visitors change their lives while helping treatment operators grow their In , we led the successful transaction and acquisition of RB by a healthcare M+ Visits Created k+ Lives Changed M+ Visits Created k+ Lives Changed + Brands Scaled $ M+ Commerce Generated + Brands Scaled $ M+ Commerce Generated Digital and inbound marketing is in our For years, we ran a and successful digital marketing agency based in Santa Monica, The strategic leadership and digital marketing innovation born at RankLab are now integral to every Thermal In a rare transaction, we scaled and sold the agency to a public healthcare company in Leaflink The largest marketplace for wholesale cannabis MedMen A dominant cannabis enterprise in the emerging industry CreateTribe Empowering scalable brands with a positive social impact TetraScience A data platform driving the next generation of medicines Pixalate Enterprise security platform with fraud protection Pinger products that make texting and talking free Miso Robotics robots assisting restaurant chefs with food making Lyft A ridesharing app that matches drivers with passengers Where influencers share their best work HelloTech Changing tech support and the way people buy new technology Eversport Bringing live sports to fans worldwide via digital media Bridg Restaurant and retail marketing driven by buying behavior ClassPass A subscription marketplace to find and book fitness classes Amplify Digital media for the live entertainment & touring industry Grown Rogue A fully integrated cannabis brand Cloud Cover Music A leading provider of the music in retail and businesses Winc Revolutionizing the way people discover, buy and share wine FIGS The highest quality medical apparel in the world Fractl An agency helping brands with growth strategy Gyft An app for customers to buy, store, send & redeem gift cards Partner Funds PCCP Commercial real estate finance & investment management SEALY Commercial real estate investment & operating company MetaStable Managing Crypto Asset Hedge Funds M13 A diversified holding and branding development company Canyon Creek An venture fund focusing on series A investments FUTURE Investing in transformative businesses with innovative solutions Focus Venture Investing We provide venture investment at early and growth stages, when we can add an unfair advantage to projects that excite Whether through strategy, positioning or acquisition, we use our considerable experience in digital and growth to create value—lots of it—for customers, investors, and the ecosystem as a These are the most thrilling times for any company, and we love fueling that Incubator Helping founders grow their businesses by way of investment is But it’s not Ventures need operational expertise if they hope to achieve We provide that expertise via incubator services for projects whose needs match our unique skill Leveraging our partner network, we provide the right mix of guidance and autonomy to get businesses up to speed and onto bigger Consulting & Advising We’ve always believed that you do well by doing good for And we want to see our friends and partners So we lend our skills by way of consulting or advising, even when we don’t have a direct interest in the Much of the advising we do is for the companies we have an early role in, while the goal of our consulting work is simply to add value wherever we Partners Who We Work With Early Stage Brands Experienced operators with exciting new ventures we find uniquely Growth Brands Companies with traction & healthy unit economics that need to scale big and scale Marketing Rockstars savants in performance marketing, media planning, social, SEO, UX UI, CRO, Investment Firms Firms looking to collaborate and on projects where our skill set can add Private Investors Investors seeking unique ventures managed by industry pros and offering amazing Team Who’s Involved Abhilash Patel Founder & CEO Buck Jordan Venture Partner Garrett Stanwick Venture Partner Ryan Schaffer Finance Manager Abhilash Patel Founder & CEO Abhilash Patel is a serial entrepreneur, venture investor, speaker, author, and He works with companies he believes in, helping them to grow and Abhilash has advised ",startup,"{'status': '200', 'available': True, 'url': 'http://web.archive.org/web/20180827231007/http://www.thermal.co/', 'timestamp': '20180827231007'}",20180827231007.0,1.0
https://mymediport.com,19958,crunchbase,"faqs – mymediport Hit enter to search or ESC to close About Us Features Patient App Provider Portal FAQs Contact Patient Healthcare Systems Download Now Android iOS Frequently asked questions What is mymediport? The mymediport platform (patent pending) is a highly secure, integrated data repository and an analytics engine, designed to provide multiple useful and much needed services to many stakeholders in the Global Healthcare We have started our journey with focus on the USA healthcare industry first and will scale up globally as we Currently, for the USA market, mymediport provides a mobile patient app and a healthcare provider portal with the ability to securely integrate patient medical history data from across multiple disparate disconnected The mymediport platform presents integrated information along with insights to both patients and healthcare providers with easy access, sharing and analysis The mymediport patient app can securely get your patient medical history delivered to you in a snap! This means patients get better and faster quality Similarly, healthcare providers and health systems get better operational and financial metrics, significant improvement in quality of care, better reputation and a competitive The mymediport solution is made in consultation with healthcare experts & practitioners, uses researched patients’ and doctors’ , and has founders who are distinguished medical practitioners and global leaders in developing systems integration technology and This is why mymediport helps dramatically improves the patient experience, lowers their medical costs over lifetime, while ensuring healthcare providers and health systems lower their health management costs, and increase revenue opportunities through faster How does mymediport ensure my data is private? Privacy and Protection of Health Information is at the foundations of We strive to ensure that you are the only custodian of your Health mymediport stores all your data in a HIPAA and HITRUST compliant All data that we store on mymediport is always Even our team of engineers never know or can access your Protected Health We work with our partners to ensure that we follow and are always compliant with Health information standards and laws such as How can mymediport help me with my next doctor visit? If your healthcare providers are mymediport subscribers, each of them can use the mymediport Provider Portal to access your health record from all your doctors healthcare This ensures interoperability between multiple healthcare providers enabling a fast and efficient diagnosis and assist in providing you with the best If your healthcare provider is not a mymediport partner you can ask them to join our network, or use our premium features to create and share PDF documents which include your health record and also fill out doctor forms which can help you save time and the hassle at your next doctor Where can I find the app? mymediport is available to users for Apple iOS and Android Devices . I am outside the US, can I access my Health record? Currently, mymediport is available only for USA healthcare How can I access my health record? mymediport integrates and partners with EHR (Electronic Healthcare Record) providers across the US to allow users access to their personal health records medical If we have integrated with your EHR or your healthcare provider, they will be listed in the You can also click here to view the list of available Clinics Hospitals. You may need to request credentials (username password from your Healthcare provider) to securely connect and access your health These credentials will be the same that you use to individually log in to your healthcare providers How do I know my Clinic Hospital is integrated with mymediport? We are always working hard to connect to new EHR (Electronic Health Record) You can click here to check if your Healthcare Provider is connected with If not, please request your healthcare provider to contact us at [email protected] to get connected to us . Does mymediport share my Protected Health Information data with any ? mymediport never shares or discloses your Protected Health Information to any 3 rd Our Privacy and Security Policy is available Can I share my data with a relative? As a premium customer you can create and export PDF documents from your health You may then share this document with any concerned person that you Please review our End User License Agreement and Privacy and Security Policy before you How do I connect my Clinic Hospital with mymediport? Download the mymediport app for your device (available on iOS and Android ). Create an account and to Follow the guide to connect your Clinic Hospital Sync with your source hospital clinic to access your health Do you charge for every hospital I connect with the app? We do not charge for adding Hospital Clinics. So go ahead and make sure you connect with all your healthcare providers to fully benefit from the features of We do have some",startup,"{'status': '200', 'available': True, 'url': 'http://web.archive.org/web/20190830060144/http://mymediport.com/', 'timestamp': '20190830060144'}",20190830060144.0,1.0
https://chathaminsurance.com/#,15053,crunchbase,"Bed & Breakfast — Chatham Insurance Partners Contact Us Personal Insurance Business Insurance Hospitality Hotels Bed & Breakfast Restaurants Medical Offices Dentists Veterinarians Optometrists Hospice Home Health Care Funeral Homes Professional Liability Architects & Engineers Design Firms Real Estate Brokers Law Firms Technology Development Contractors Manufacturing International Property Condominium Associations Homeowners Associations Real Estate Portfolios Bonds Make a Claim Resources Make a Payment Contact Us Personal Insurance Business Insurance Hospitality Hotels Bed & Breakfast Restaurants Medical Offices Dentists Veterinarians Optometrists Hospice Home Health Care Funeral Homes Professional Liability Architects & Engineers Design Firms Real Estate Brokers Law Firms Technology Development Contractors Manufacturing International Property Condominium Associations Homeowners Associations Real Estate Portfolios Bonds Make a Claim Resources Make a Payment Bed & Breakfast Business Insurance Hospitality Hotels Bed & Breakfast Restaurants Medical Offices Dentists Veterinarians Optometrists Hospice Home Health Care Funeral Homes Professional Liability Architects & Engineers Design Firms Real Estate Brokers Law Firms Technology Development Contractors Manufacturing International Property Condominium Associations Homeowners Associations Real Estate Portfolios Chatham Insurance Partners is here to help you with all of your business insurance Please see a list of policies we offer below for our Bed & Breakfast clients: Property Property Equipment Breakdown Business Income Civil Authority Wind & Hail, Hurricane, Named Storm Equipment and Materials Flood Crime Employee Theft Fiduciary Monies and Securities ERISA Liability Surety Bonds Performance & Payment Administrative, Guardian and Conservator Lien Release Miscellaneous Caregiver General Liability Professional Liability Malpractice Errors and Omissions Regulatory Violation Violation Management Liability Employment Practices Liability Fiduciary Liability Directors and Officers HIPAA Compliance Cyber & Privacy Liability Business Auto Umbrella Workers Compensation For your Bed & Breakfast insurance needs, please contact: Eric Horton (912) Tim Blanco (912) back to hospitality We Can’t Wait To Get To Know You Back to Top Habersham Street, Savannah, GA, , United States Mailing Address PO Box Savannah, GA Physical Address Habersham Street Savannah, GA Phone | Fax |   Hospitality — Chatham Insurance Partners Contact Us Personal Insurance Business Insurance Hospitality Hotels Bed & Breakfast Restaurants Medical Offices Dentists Veterinarians Optometrists Hospice Home Health Care Funeral Homes Professional Liability Architects & Engineers Design Firms Real Estate Brokers Law Firms Technology Development Contractors Manufacturing International Property Condominium Associations Homeowners Associations Real Estate Portfolios Bonds Make a Claim Resources Make a Payment Contact Us Personal Insurance Business Insurance Hospitality Hotels Bed & Breakfast Restaurants Medical Offices Dentists Veterinarians Optometrists Hospice Home Health Care Funeral Homes Professional Liability Architects & Engineers Design Firms Real Estate Brokers Law Firms Technology Development Contractors Manufacturing International Property Condominium Associations Homeowners Associations Real Estate Portfolios Bonds Make a Claim Resources Make a Payment Hospitality Business Insurance Hospitality Hotels Bed & Breakfast Restaurants Medical Offices Dentists Veterinarians Optometrists Hospice Home Health Care Funeral Homes Professional Liability Architects & Engineers Design Firms Real Estate Brokers Law Firms Technology Development Contractors Manufacturing International Property Condominium Associations Homeowners Associations Real Estate Portfolios Hotels Bed and Breakfast Restaurants We Can’t Wait To Get To Know You Back to Top Habersham Street, Savannah, GA, , United States Mailing Address PO Box Savannah, GA Physical Address Habersham Street Savannah, GA Phone | Fax |   Restaurants — Chatham Insurance Partners Contact Us Personal Insurance Business Insurance Hospitality Hotels Bed & Breakfast Restaurants Medical Offices Dentists Veterinarians Optometrists Hospice Home Health Care Funeral Homes Professional Liability Architects & Engineers Design Firms Real Estate Brokers Law Firms Technology Development Contractors Manufacturing International Property Condominium Associations Homeowners Associations Real Estate Portfolios Bonds Make a Claim Resources Make a Payment Contact Us Personal Insurance Business Insurance Hospitality Hotels Bed & Breakfast Restaurants Medical Offices Dentists Veterinarians Optometrists Hospice Home Health Care Funeral Homes Professional Liability Architects & Engineers Design Firms Real Estate Brokers Law Firms Technology Development Contractors Manufacturing International Property Condominium Associations Homeowners Associations Real Estate Portfolios Bonds Make a Claim Resou",startup,"{'status': '200', 'available': True, 'url': 'http://web.archive.org/web/20230828083731/https://chathaminsurance.com/', 'timestamp': '20230828083731'}",20230828083731.0,0.0
https://wander-and-roam.com,2890,crunchbase," Account Skip to content Submit Close search home shop about us Submit Search Log in Cart Cart expand collapse home shop about us We ve sent you an email with a link to update your Login Email Password Forgot your password? Create account Reset your password We will send you an email to reset your Email Cancel search shop about our mats FAQs about us contact us babylist registry Join our mailing list Subscribe Facebook Pinterest Instagram © , wander & roam Powered by Shopify   Your Shopping Cart Skip to content Submit Close search home shop about us Submit Search Log in Cart Cart expand collapse home shop about us Your cart Your cart is currently Enable cookies to use the shopping cart Continue shopping search shop about our mats FAQs about us contact us babylist registry Join our mailing list Subscribe Facebook Pinterest Instagram © , wander & roam Powered by Shopify   wander mats Skip to content Submit Close search home shop about us Submit Search Log in Cart Cart expand collapse home shop about us wander mats wander mat - blue ikat Regular price $149.00 wander mat - grey ikat Regular price $149.00 search shop about our mats FAQs about us contact us babylist registry Join our mailing list Subscribe Facebook Pinterest Instagram © , wander & roam Powered by Shopify   wander & roam Skip to content Submit Close search home shop about us Submit Search Log in Cart Cart expand collapse home shop about us wander mats wander mat - grey ikat Regular price $165.00 out of stock wander mat - blue ikat Regular price $165.00 our reversible mats are made of one continuous piece of foam, large enough for your little ones to wander and roam on and thick enough to soften tumbles and Our mats are designed to live in any room of your home (not just the playroom) or roll up for easy storage when not in Wander Mats search shop about our mats about us baby registry Join our mailing list Subscribe Facebook Pinterest Instagram © , wander & roam Powered by Shopify   about us Skip to content Submit Close search home shop about us Submit Search Log in Cart Cart expand collapse home shop about us about us As a mom of three I realized pretty quickly that as babies start to crawl and walk they also start to tumble and fall… To soften the falls, we started out with foam tiles but I couldn’t seem to keep them in between the My kids also loved to pull them apart and the tiles would end up all over the We set out to find a foam surface for our babies to wander and roam that wouldn’t be an eyesore in our living room or the kids bedrooms…and when we searched and searched and couldn’t find what we are looking for, we went about creating Our mats are , hypoallergenic & easy to for play, yoga, and everything in search shop about our mats FAQs about us contact us babylist registry Join our mailing list Subscribe Facebook Pinterest Instagram © , wander & roam Powered by Shopify ",startup,"{'status': '200', 'available': True, 'url': 'http://web.archive.org/web/20180815204445/https://wander-and-roam.com/', 'timestamp': '20180815204445'}",20180815204445.0,1.0
