website,text_len,source,text,type,closest_snapshot,closest_snapshot_time,snapshot_in_window
https://www.novam.ai/,50,crunchbase, NOVAM – Innovative solutions start here February ,startup,"{'status': '200', 'available': True, 'url': 'http://web.archive.org/web/20200113124536/https://www.novam.ai/', 'timestamp': '20200113124536'}",20200113124536.0,1.0
http://smartpointsolutions.us,5715,crunchbase,"Cybersecurity – Smartpoint Solutions Home About Us Our Services Contact Us Cybersecurity Home Cybersecurity Cybersecurity Our team of cybersecurity experts has over years of experience in working with both government and private We are able to offer a wide array of services which include: Staffing with security clearances Vulnerability Assessment Intrusion detection and prevention Access control and identity management Network forensics Enterprise network firewalls Endpoint protection, malware and antivirus Remediation About Smartpoint Solutions SmartPoint Solutions is a trusted, provider of information We approach each contract with integrity and Contact Address Smartpoint Solutions LLC Belleville Richmond, VA © Copyright , Smartpoint Solutions, LLC   About Us – Smartpoint Solutions Home About Us Our Services Contact Us About Us Home About Us About Us SmartPoint Solutions believes in core American values such as service to country, integrity and We promise to be transparent, diligent, trustworthy, and We will provide service to our clients, colleagues and suppliers, and will go above and beyond the expectations of those we Caleb Kroll, MD President and Managing Partner Kroll is a former Air Force major and veteran, having served as a flight surgeon at Pope Air Force Base as well as flight medicine commander while deployed to Kuwait during Operation Iraqi He has extensive experience in military and civilian outpatient clinics and hospital settings with medical supply provision, logistics, staffing, and information He takes pride in his ability to provide exceptional value to clients in both commercial and government sectors by leveraging He is considered an authority in healthcare cybersecurity and data He holds an from the University of Virginia and completed both his residency and fellowship training at the Johns Hopkins Ricki Cole, MBA Administrator Ricki brings over years of professional experience in the private, and government sectors with an expertise in financial banking and investment, estate, and career She has worked with Fortune companies in developing standard operating procedures, policy regulation guidelines, training manuals, and partnered with corporate Ricki earned her MBA from the University of Nottingham, England, focusing in Corporate Social Responsibility and Business Aaron Kroll, JD, MBA Advisor Aaron is a seasoned business developer with experience in investment banking, mergers and acquisitions, strategy development, and He has helped launch hedge funds and has led over $10 million worth of commercial real estate He specializes in forming strategic partnerships with various business entities to bring service to clients in both commercial and government Aaron earned a from The University of Akron in addition to an MBA in He also received an executive leadership certificate from Cornell Frank Lee, MD Advisor Lee is an anesthesiologist and of Telesphora, a data analytics company specializing in big data analytics in He is passionate about delivering service in the IT industry and has been involved in projects with the Health and Human Services Department to make patient health data more accessible for research and innovation without compromising has experience working with local agencies such as the Connecticut Department of Public Health on developing novel ways to fight the opioid epidemic using healthcare In his spare time, he is an avid eSports He holds an from Vanderbilt University and completed both his residency and fellowship training at the Johns Hopkins About Smartpoint Solutions SmartPoint Solutions is a trusted, provider of information We approach each contract with integrity and Contact Address Smartpoint Solutions LLC Belleville Richmond, VA © Copyright , Smartpoint Solutions, LLC   Smartpoint Solutions Home About Us Our Services Contact Us WE EARN TRUST BY PROVIDING VALUE SmartPoint Solutions is a trusted, provider of information We approach each contract with integrity and Contact us to find out how we can provide value and a lasting Solutions CYBERSECURITY We leverage technology to cybersecurity services like enterprise visibility, situational awareness, and behavioral Read more IT STAFFING We provide contract, and permanent placement of IT professionals for a wide variety of industries and government Read more INVESTMENT RECOVERY We offer solutions that are to help you recoup the maximum value for your surplus assets and reduce environmental Read more MEDICAL DEVICES With medical experience in the military and civilian sectors, we can deliver in inpatient, outpatient, and operating room Read more PLACEMENT SERVICES Our experienced recruitment team helps clients reduce costs and keep up with production while alleviating the headaches of Read more OTHER SERVICES Can’t find what you’re looking for? See our list of other of Read more Ready to find out more? SmartPoint Solutions is a and Small Business . About Smartpoint Solutions SmartPoint Solutions is a trusted, provid",startup,"{'status': '200', 'available': True, 'url': 'http://web.archive.org/web/20200803112110/https://www.smartpointsolutions.us/', 'timestamp': '20200803112110'}",20200803112110.0,1.0
https://kkskinproducts.com/,7947,crunchbase,"Account – K&K Skin Products $ amount Get $25 OFF any purchase over $50! Use discount code: Your Message Goes Here learn More LogIn Register 0 $0.00 Search HOME SHOP BLOG ABOUT CONTACT WHOLESALE GIFTS LogIn Register 0 $0.00 Menu HOME SHOP BLOG ABOUT CONTACT WHOLESALE GIFTS Create Account Login Login We ve sent you an email with a link to update your Welcome back! Sign in to your Forgot your password? Create account Reset your password We will send you an email to reset your Cancel Free Shipping Ships in Business Days Made in the USA Manufactured in New Mexico, USA Free Returns Money Back Promise Dermatologist Endorsed and Recommended Science + Nature = Results Legal Home Terms Of Use Privacy Policy Contact Us Shipping and Returns © K&K Skin Products , All Rights Reserved choosing a selection results in a full page refresh Itens limited stock Continue shopping View Cart   Create Account – K&K Skin Products $ amount FREE Shipping on orders over $75 Your Message Goes Here learn More LogIn Register 0 $0.00 Search HOME SHOP BLOG ABOUT CONTACT WHOLESALE GIFTS LogIn Register 0 $0.00 Menu HOME SHOP BLOG ABOUT CONTACT WHOLESALE GIFTS Create Account Login Create Account Free Shipping Ships in Business Days Made in the USA Manufactured in New Mexico, USA Free Returns Money Back Promise Dermatologist Endorsed and Recommended Science + Nature = Results Legal Home Terms Of Use Privacy Policy Contact Us Shipping and Returns © K&K Skin Products , All Rights Reserved choosing a selection results in a full page refresh Itens limited stock Continue shopping View Cart   Your Shopping Cart – K&K Skin Products $ amount Get $25 OFF any purchase over $50! Use discount code: Your Message Goes Here learn More LogIn Register 0 $0.00 Search HOME SHOP BLOG ABOUT CONTACT WHOLESALE GIFTS LogIn Register 0 $0.00 Menu HOME SHOP BLOG ABOUT CONTACT WHOLESALE GIFTS Create Account Login Your cart is currently Enable cookies to use the shopping cart Continue shopping Free Shipping Ships in Business Days Made in the USA Manufactured in New Mexico, USA Free Returns Money Back Promise Dermatologist Endorsed and Recommended Science + Nature = Results Legal Home Terms Of Use Privacy Policy Contact Us Shipping and Returns © K&K Skin Products , All Rights Reserved choosing a selection results in a full page refresh Itens limited stock Continue shopping View Cart   Products – K&K Skin Products $ amount Questions? Email us at: OR call LogIn Register 0 $0.00 Search HOME SHOP OUR STORE ABOUT US CONTACT US BLOG WRITE A Choose the product from Shop our Store then choose the Reviews tab LogIn Register 0 $0.00 Menu HOME SHOP OUR STORE ABOUT US CONTACT US BLOG WRITE A Choose the product from Shop our Store then choose the Reviews tab Create Account Login Items 1 - of - Wrinkle Serum $195.00 add to cart Maintenance & Revitalizing Routine $74.00 add to cart All Natural Body Serum $32.00 add to cart Wrinkle Serum $120.00 add to cart Wrinkle Repair - 3 Step Routine $164.00 add to cart Jade Duo $42.00 add to cart K&K Gift Card $10.00 add to cart Wrinkle Serum $36.00 add to cart Premium Bamboo Washcloth $10.00 add to cart Refreshing Facial Cleanser (2 oz) $28.00 add to cart Revitalizing Moisturizer $22.00 add to cart Severe Stretch Mark Eraser Kit $225.00 add to cart Stretch Mark Eraser Kit $160.00 add to cart Free Shipping Enjoy Free Shipping to USA Personalized Support Via Email or Phone % Satisfaction Money Back Promise Dermatologist Recommended Endorsed by the Experts Science + Nature = Results Newsletter Subscribe to Our Newsletter and receive updates on new arrivals, exclusive information and amazing discount JOIN NOW! Legal HOME SHOP OUR STORE ABOUT US CONTACT US BLOG WRITE A Choose the product from Shop our Store then choose the Reviews tab © K&K Skin Products , All Rights Reserved choosing a selection results in a full page refresh Itens limited stock Continue shopping View Cart   K & K Skin Products – K&K Skin Products $ amount Questions? Email us at: OR call LogIn Register 0 $0.00 Search HOME SHOP OUR STORE ABOUT US CONTACT US BLOG WRITE A Choose the product from Shop our Store then choose the Reviews tab LogIn Register 0 $0.00 Menu HOME SHOP OUR STORE ABOUT US CONTACT US BLOG WRITE A Choose the product from Shop our Store then choose the Reviews tab Create Account Login Science + Nature = Results Combining Pure, Natural Oils With Breakthrough Science Serum Breakthrough Serum - Remarkable Results See Our Story The Unlikely Story of Starting A Company Pause slideshow Play slideshow Science + Nature = Results Combining Pure, Natural Oils With Breakthrough Science Learn More Serum Breakthrough Serum - Remarkable Results Learn More See Our Story The Unlikely Story of Starting A Company Learn More SHOP OUR STORE View All Wrinkle Serum $120.00 add to cart - Wrinkle Serum $195.00 add to cart Wrinkle Repair - 3 Step Routine $164.00 add to cart Refreshing Facial Cleanser (2 oz) $28.00 add to cart All Natural Body Serum $32.00 add to cart Maintenance & Revitalizing ",startup,"{'status': '200', 'available': True, 'url': 'http://web.archive.org/web/20200809020628/https://kkskinproducts.com/', 'timestamp': '20200809020628'}",20200809020628.0,1.0
https://www.strikelabs.io,5736,crunchbase,"Contact — Strike Labs About What We Do Portfolio Government Careers Team Charities Contact About What We Do Portfolio Government Careers Team Charities Contact Contact Contact You re not going to hit a ridiculously long phone menu when you call Your email isn t going to the inbox abyss, never to be seen or heard from At Strike Labs, we provide the exceptional service we d want to experience ourselves! Let s work Your Information How can we help you? We are interested in the bespoke software solutions for financial firms I have a business idea I am looking for a job I am interested in investing an underlying business I want to talk about something else Name First Name Last Name Email Address Message Thank you! ✆ ‪(929) ‬ ✉ Schedule Time to Connect National Medical Capabilities Group Strike Labs LLC DOWNLOAD: Identification Sheet | About | Capabilities Statement | W9 PROFILES: | GovShop | OneTeam | OpenGov CONTRACTOR TYPE: Defense Contractor SIZE: Small Business DUN & BRADSTREET ID : CAGE NUMBER : EMPLOYER IDENTIFICATION NUMBER : SBC CONTROL ID: SBC_001625363 PRIMARY NAICS CODE : (Custom Computer Programming Services) SECONDARY NAICS CODES: (Other Support Activities for Air Transportation), (Other Computer Related Services), (Computer Systems Design Services), (Search, Detection, Navigation, Guidance, Aeronautical, and Nautical System and Instrument Manufacturing) SIC CODES: (Computer Programming Services), (Computer Integrated Systems Design), (Computer Related Services, Not Elsewhere Classified) About the Strike Labs logo .   Charities — Strike Labs About What We Do Portfolio Government Careers Team Charities Contact About What We Do Portfolio Government Careers Team Charities Contact Charities Charities & Work Time for a Hero Defense Entrepreneurs Forum Tsai CITY Hole in the Wall Gang Camp Medi Teddy Strike Labs LLC DOWNLOAD: Identification Sheet | About | Capabilities Statement | W9 PROFILES: | GovShop | OneTeam | OpenGov CONTRACTOR TYPE: Defense Contractor SIZE: Small Business DUN & BRADSTREET ID : CAGE NUMBER : EMPLOYER IDENTIFICATION NUMBER : SBC CONTROL ID: SBC_001625363 PRIMARY NAICS CODE : (Custom Computer Programming Services) SECONDARY NAICS CODES: (Other Support Activities for Air Transportation), (Other Computer Related Services), (Computer Systems Design Services), (Search, Detection, Navigation, Guidance, Aeronautical, and Nautical System and Instrument Manufacturing) SIC CODES: (Computer Programming Services), (Computer Integrated Systems Design), (Computer Related Services, Not Elsewhere Classified) About the Strike Labs logo .   Team — Strike Labs About What We Do Portfolio Government Careers Team Charities Contact About What We Do Portfolio Government Careers Team Charities Contact Team Team The Future of Work is Purposefully Distributed We all help as navigators, part time employees, full time employees, board members, advisers, mentors, contract workers, and It’s our tribe, and we rely on ✆ ‪(929) ‬ ✉ Schedule Time to Connect John Casano Founder & CEO Connecticut, United States Josh Whitcraft Chief Operating Officer Nnew York, United States Chris Thorpe, PhD Mad Scientist California, United States Josh Jordan Chief Technology Officer New York, United States Alex Prokhorov User Experience (UX) & Flows Tomsk Region, Russian Federation Salar Ali Product & MVP Expert Toronto, Canada Jesse Levin Engagement Global, United States Based Kevin Allen Public Relations & Branding California, United States Clara Walsh Cyborg Assistant In Your Inbox, Everywhere Strike Labs LLC DOWNLOAD: Identification Sheet | About | Capabilities Statement | W9 PROFILES: | GovShop | OneTeam | OpenGov CONTRACTOR TYPE: Defense Contractor SIZE: Small Business DUN & BRADSTREET ID : CAGE NUMBER : EMPLOYER IDENTIFICATION NUMBER : SBC CONTROL ID: SBC_001625363 PRIMARY NAICS CODE : (Custom Computer Programming Services) SECONDARY NAICS CODES: (Other Support Activities for Air Transportation), (Other Computer Related Services), (Computer Systems Design Services), (Search, Detection, Navigation, Guidance, Aeronautical, and Nautical System and Instrument Manufacturing) SIC CODES: (Computer Programming Services), (Computer Integrated Systems Design), (Computer Related Services, Not Elsewhere Classified) About the Strike Labs logo .   Strike Labs About What We Do Careers Team Charities Contact About What We Do Careers Team Charities Contact Home Strike Labs consists of seasoned entrepreneurs and technology We are focused on solving very hard big data problems quickly, or building niche beyond cloud based web app solutions for the government by implementing published academic research yet to be The Strike Labs team implements practical solutions that would otherwise overwhelm larger, more bureaucratic organizations, and are specialists in predictive analytics, encryption, signal, and implementing unsupervised learning AI agents (AI ML). ✆ ‪(929) ‬ ✉ Schedule Time to Connect National Medical Capabilities Group Strike Labs LLC DOWNL",startup,"{'status': '200', 'available': True, 'url': 'http://web.archive.org/web/20200510154906/https://www.strikelabs.io/', 'timestamp': '20200510154906'}",20200510154906.0,1.0
https://www.globaltechcouncil.org/,35390,crunchbase,"Log In - Global Tech Council | Email Skype : [email protected] LOGIN MEMBER REGISTRATION × Individual Membership $ year % off on all % off on all training . Free access to premium Free access to selected Free access to premium Free access to email training Get your writings Get Global Tech Council member Get yourself featured on the member Free access to all the webinars and Register Now Corporate Membership $ year Free certification training % off on all % off on all Free access to premium Free access to email Free access to premium Get your company registered as the Get your writings Free access to all the webinars and Get your employees featured on member Register Now About Us Training Certified Cyber Security Professional™ (Live Training) Certifications Alexa Certified AI Skill Developer™ (Alexa) CyberSecurity Certified Cyber Security Professional™ Certified Wireless Security Auditor™ – (Exam) Artificial Intelligence Certified Artificial Intelligence (AI) Expert™ Certified Artificial Intelligence (AI) Developer™ Internet of Things Certified Internet of Things (IoT) Expert™ Certified Internet of Things (IoT) Developer™ Augmented Reality Certified Augmented Reality (AR) Expert™ Certified Augmented Reality Developer™ Chatbot Certified Chatbot Expert™ Certified Chatbot Developer™ Data Science Certified Data Science Developer™ Big Data Certified Big Data Expert™ Machine Learning Certified Machine Learning Expert™ Virtual Reality Certified Virtual Reality (VR) Expert™ Certified Virtual Reality Developer™ Blockchain Certified Blockchain Expert™ V2 Certified Hyperledger Expert™ (CHE) Courses Python Programming : Crash Course Resources infographics Artificial Intelligence Data Science Machine Learning Big Data Chatbot Cyber Security Internet of things virtual reality Augmented Reality Others Careers Jobs Browse Jobs Post Jobs Partner With Us Events Webinars Contact Us Member Login LOG IN HERE Username or Email Address Password Remember Me Register Lost your password? What People Say I have been working as a big data analyst for the past few I was keen for career growth and realised that getting certified as a big data analyst by a reputed organisation is the key to my career As a full time working professional, I required online certification on big data analytics to test my knowledge and gain After intensive research for the best certifications available online on big data analytics, I zeroed down to Global Tech Council’s Certified Big Data Expert After getting certified, I got the growth I was looking for in my I would recommend this certification to all the working professionals aiming to get career growth in the big data Steven Whelan It had been a while I was looking for a job as a data analyst, but all my efforts went in vain, as I struggled to gain recruiter’s To my understanding, my knowledge and expertise of data sciences were quite adequate to land me with a job as a data A friend of mine working as a data analyst suggested me to go for the Certified Data Scientist Certification offered by Global Tech I enrolled for the certification on the very same The Certified Data Scientist Certification gave me a competitive edge in the Finally, I landed with my dream job as a data analyst with a reputed I thank Global Tech Council for the incredible certification and the support they have I would recommend this certification to every person looking to showcase his skills in data Marco Denis Fascinated by the world of chatbots, I was looking for an expert level certification from a reputed source online to put my knowledge to A colleague from office suggested going for Certified Chatbot Expert Certification from Global Tech He assured me that Global Tech Council is the industry leader in providing certifications for chatbot technology that are recognised throughout the So I went on to enrol myself for chatbot expert I underwent this certification and must say learned a After completion of the certification, I am providing my services to many reputed clients as a chatbot Kudos to Global Tech Council for providing such Pavel Karyagin From Australia About Us Global Tech Council is a platform bringing techies from all around the globe to share their knowledge, passion, expertise and vision on various technologies, thereby imparting valuable credentials to individuals seeking career growth Globaltech Council is a platform bringing techies from all around the globe to share their knowledge, passion, expertise and vision on various technologies, thereby imparting valuable credentials to individuals seeking career growth Related Links Contact Us Certifications Careers Partner With Us Support & FAQs Terms and Conditions Support Policy Privacy Policy Refund Policy Jobs Address Constitution Drive, Menlo Park, CA Phone: +1-(323) Email: [email protected] Get In Touch With Us Copyright © Global Tech Council | All rights Global Tech Council | About Us Training Certified Cyber Security Professional™ (Live Training) Certificatio",startup,"{'status': '200', 'available': True, 'url': 'http://web.archive.org/web/20190125082744/https://www.globaltechcouncil.org/', 'timestamp': '20190125082744'}",20190125082744.0,1.0
