website,text_len,source,text,type,closest_snapshot,closest_snapshot_time,snapshot_in_window
https://www.zenfetch.com,8584,crunchbase,"Contact | Oasis - Webflow HTML Website Template About Pricing Integrations Blog Contact Login Login Login Get Started Get Started Get in touch Urna duis convallis convallis Id diam vel quam A pellentesque sit amet porttitor eget dolor morbi non First name Last name Email Phone Your message Thank you! Your submission has been received! Oops! Something went wrong while submitting the Get in touch Urna duis convallis convallis Id diam vel quam A pellentesque sit amet porttitor eget dolor morbi non Call us Urna duis convallis convallis Id diam vel quam (999) (999) Email us Urna duis convallis convallis Id diam vel quam Visit us Urna duis convallis convallis Id diam vel quam Thornridge Syracuse, Connecticut FAQ s Lorem ipsum dolor sit amet, consectetur adipiscing elit, sed do eiusmod tempor Do I have to pay for using the platforms? A diam sollicitudin tempor id Mauris in aliquam sem fringilla ut morbi tincidunt Mauris vitae ultricies leo Id aliquet lectus proin Can I customize my dashboard? A diam sollicitudin tempor id Mauris in aliquam sem fringilla ut morbi tincidunt Mauris vitae ultricies leo Id aliquet lectus proin What s the difference between free and starter plan? A diam sollicitudin tempor id Mauris in aliquam sem fringilla ut morbi tincidunt Mauris vitae ultricies leo Id aliquet lectus proin Can I cancel the payment anytime? A diam sollicitudin tempor id Mauris in aliquam sem fringilla ut morbi tincidunt Mauris vitae ultricies leo Id aliquet lectus proin Are there any student discounts available? A diam sollicitudin tempor id Mauris in aliquam sem fringilla ut morbi tincidunt Mauris vitae ultricies leo Id aliquet lectus proin email marketing platform Easily create, send, and track professional email campaigns that help you connect with your customers and grow your Get Started Get Started Prioritize accounts with health scores Thank you! Your submission has been received! Oops! Something went wrong while submitting the Â© All rights   Wayback Machine We will keep fighting for all libraries - stand with us! Close banner 9 Days Left: All donations will be matched through December ! Your Donation Will Be Matched ! Can You Chip In? Please don t scroll past thisâthe Wayback Machine is fighting for universal access to quality The Internet Archive, which runs this project, relies on donations averaging $30.38 to help us keep the record We d be deeply grateful if you d join the one in a thousand users that support us Right now, we have a matching gift campaign that will double the impact of every We understand that not everyone can donate right now, but if you can afford to contribute this Saturday, we promise it will be put to good Our resources are crucial for knowledge lovers everywhereâso if you find all these bits and bytes useful, please pitch Your Donation Will Be Matched! Can You Chip In? Please don t scroll past thisâthe Wayback Machine is fighting to keep the record Right now, we have a matching gift campaign that will double the impact of every We understand that not everyone can donate right now, but if you can afford to contribute this Saturday, we promise it will be put to good If you find all these bits and bytes useful, please pitch Continue Remind Me Send me an email reminder Email address (required) Please enter a valid email First name Last name Submit By submitting, you agree to receive emails from the Internet Your privacy is important to We do not sell or trade your information with Internet Archive logo A line drawing of the Internet Archive headquarters building faÃ§ade. Donate icon An illustration of a heart shape ""Donate to the archive"" Search icon An illustration of a magnifying Search icon An illustration of a magnifying Upload icon An illustration of a horizontal line over an up pointing Upload User icon An illustration of a person s head and Sign up | Log in Web icon An illustration of a computer application window Wayback Machine Texts icon An illustration of an open Books Video icon An illustration of two cells of a film Video Audio icon An illustration of an audio Audio Software icon An illustration of a "" floppy Software Images icon An illustration of two Images Donate icon An illustration of a heart shape Donate Ellipses icon An illustration of text More Hamburger icon An icon used to represent a menu that can be toggled by interacting with this Internet Archive Audio Live Music Archive Librivox Free Audio Featured All Audio This Just In Grateful Dead Netlabels Old Time Radio RPMs and Cylinder Recordings Top Audio Books & Poetry Computers, Technology and Science Music, Arts & Culture News & Public Affairs Spirituality & Religion Podcasts Radio News Archive Images Metropolitan Museum Cleveland Museum of Art Featured All Images This Just In Flickr Commons Occupy Wall Street Flickr Cover Art USGS Maps Top NASA Images Solar System Collection Ames Research Center Software Internet Arcade Console Living Room Featured All Software This Just In Old School Emulation Games Histor",startup,"{'status': '200', 'available': True, 'url': 'http://web.archive.org/web/20230404235007/https://www.zenfetch.com/', 'timestamp': '20230404235007'}",20230404235007.0,1.0
https://ethernallabs.com/,7379,crunchbase,"Wayback Machine We will keep fighting for all libraries - stand with us! Close banner 9 Days Left: All donations will be matched through December ! Your Donation Will Be Matched ! Can You Chip In? Please don t scroll past thisâthe Wayback Machine is fighting for universal access to quality The Internet Archive, which runs this project, relies on donations averaging $30.38 to help us keep the record We d be deeply grateful if you d join the one in a thousand users that support us Right now, we have a matching gift campaign that will double the impact of every We understand that not everyone can donate right now, but if you can afford to contribute this Saturday, we promise it will be put to good Our resources are crucial for knowledge lovers everywhereâso if you find all these bits and bytes useful, please pitch Your Donation Will Be Matched! Can You Chip In? Please don t scroll past thisâthe Wayback Machine is fighting to keep the record Right now, we have a matching gift campaign that will double the impact of every We understand that not everyone can donate right now, but if you can afford to contribute this Saturday, we promise it will be put to good If you find all these bits and bytes useful, please pitch Continue Remind Me Send me an email reminder Email address (required) Please enter a valid email First name Last name Submit By submitting, you agree to receive emails from the Internet Your privacy is important to We do not sell or trade your information with Internet Archive logo A line drawing of the Internet Archive headquarters building faÃ§ade. Donate icon An illustration of a heart shape ""Donate to the archive"" Search icon An illustration of a magnifying Search icon An illustration of a magnifying Upload icon An illustration of a horizontal line over an up pointing Upload User icon An illustration of a person s head and Sign up | Log in Web icon An illustration of a computer application window Wayback Machine Texts icon An illustration of an open Books Video icon An illustration of two cells of a film Video Audio icon An illustration of an audio Audio Software icon An illustration of a "" floppy Software Images icon An illustration of two Images Donate icon An illustration of a heart shape Donate Ellipses icon An illustration of text More Hamburger icon An icon used to represent a menu that can be toggled by interacting with this Internet Archive Audio Live Music Archive Librivox Free Audio Featured All Audio This Just In Grateful Dead Netlabels Old Time Radio RPMs and Cylinder Recordings Top Audio Books & Poetry Computers, Technology and Science Music, Arts & Culture News & Public Affairs Spirituality & Religion Podcasts Radio News Archive Images Metropolitan Museum Cleveland Museum of Art Featured All Images This Just In Flickr Commons Occupy Wall Street Flickr Cover Art USGS Maps Top NASA Images Solar System Collection Ames Research Center Software Internet Arcade Console Living Room Featured All Software This Just In Old School Emulation Games Historical Software Classic PC Games Software Library Top Kodi Archive and Support File Vintage Software APK Software Software Library Software Sites Tucows Software Library Shareware Software Capsules Compilation Images ZX Spectrum DOOM Level CD Books Books to Borrow Open Library Featured All Books All Texts This Just In Smithsonian Libraries FEDLINK (US) Genealogy Lincoln Collection Top American Libraries Canadian Libraries Universal Library Project Gutenberg Children s Library Biodiversity Heritage Library Books by Language Additional Collections Video TV News Understanding 9 11 Featured All Video This Just In Prelinger Archives Democracy Now! Occupy Wall Street TV NSA Clip Library Top Animation & Cartoons Arts & Music Computers & Technology Cultural & Academic Films Ephemeral Films Movies News & Public Affairs Spirituality & Religion Sports Videos Television Videogame Videos Vlogs Youth Media Search the history of over billion web pages on the Search the Wayback Machine Search icon An illustration of a magnifying Mobile Apps Wayback Machine (iOS) Wayback Machine (Android) Browser Extensions Chrome Firefox Safari Edge Subscription Explore the Collections Learn More Build Collections Save Page Now Capture a web page as it appears now for use as a trusted citation in the Please enter a valid web address About Blog Projects Help Donate Contact Jobs Volunteer People Sign up for free Log in Search metadata Search text contents Search TV news captions Search radio transcripts Search archived web sites Advanced Search About Blog Projects Help Donate Donate icon An illustration of a heart shape Contact Jobs Volunteer People DONATE Latest Show All The Wayback Machine has not archived that Click here to search for all archived pages under https: ethernallabs.com about-1 . The Wayback Machine requires your browser to support JavaScript, please email if you have any questions about The Wayback Machine is an initiative of the Internet Archive , a (c)(3) ,",startup,"{'status': '200', 'available': True, 'url': 'http://web.archive.org/web/20221207192309/https://ethernallabs.com/', 'timestamp': '20221207192309'}",20221207192309.0,1.0
https://www.getwats.com/,5753,crunchbase,"Contact — WATS 0 Skip to Content Home About Contact Log In Open Menu Close Menu Home About Contact Log In Open Menu Close Menu Home About Contact Log In Please fill out this form if you are interested in any of the below: Join our waitlist Request a demo Learn about investment opportunities Name First Name Last Name Email Check all that apply, if you d like to: Join our waitlist Request a demo Learn about investment opportunities Additional comments Thank you for your We will respond   About — WATS 0 Skip to Content Home About Contact Log In Open Menu Close Menu Home About Contact Log In Open Menu Close Menu Home About Contact Log In WATS is a SaaS product bringing business waste management operations into the Century Waste is what brought us together, and a desire for better, more efficient, and transparent digital tools is what motivated us to build We’re zero waste experts and data people, and our goal is to deliver a waste operations platform that makes it easier for businesses to recycle more, divert materials from landfills and incinerators, and reduce their impacts on our social and natural The Team Laura Rosenshine (she her) CEO Laura founded Common Ground Compost LLC (CGC) after a few years working in the commercial waste sector, including working with a technology company piloting organics processing in In , Laura Foodprint Group which was focused on bringing standardization and industry best practices to the waste management programs of hospitality and food In , Laura returned to CGC to focus on building a Laura is a TRUE Certified Waste Meredith (she her) Executive Director Meredith is the Executive Director of Common Ground Compost She sits on the US Composting Council board of directors and the steering committee of the Institute for Local Self Reliance’s Community Composting She believes that materials literacy and upstream downstream supply chain transparency are foundational building blocks to the circular Meredith is a TRUE Certified Waste William Klimpert (he him) Director of Analytics William Klimpert is the Director of Analytics at Common Ground As an avid nature enthusiast with a background in plant biophysics, he seeks to use data and technology to increase the accessibility of sustainability Since , William has been working with CGC to develop tools and reports that improve workflows and bring audit, composting, and diversion statistics to William is a TRUE Certified Waste Annabella Mineghino (she her) Product Manager A California native currently based in Prague, Annabella applies global learning to her Product Management She has supported over companies in the design, development, and launch of successful apps and websites, including Barnes and Noble and Bitcoin Annabella is a people person helping others create products that make a difference, and she has become obsessed with waste since joining the WATS Amir Gaouaou (he him) Lead Developer Amir is our enthusiastic and passionate lead software He has a keen interest in learning new technologies and is interested in IOT and Artificial Intelligence (ML, ANN, deep learning). An avid traveler, Amir leads our global WATS development   WATS 0 Skip to Content Home About Contact Log In Open Menu Close Menu Home About Contact Log In Open Menu Close Menu Home About Contact Log In WATS is the waste reduction platform for businesses WATS (Waste Administration + Tracking Software) quantifies the carbon footprint of waste, and automatically delivers action oriented steps to reduce WATS guides business operators, facilities managers, and sustainability teams in their new and ongoing engagement with waste reduction and the circular What is WATS? OPERATIONS All businesses generate Waste streams are the foundation of WATS organizes all stakeholders that handle, organize, and manage waste WATS: Centralizes information related to a company’s waste streams, and automatically creates a digital waste management plan and easily shareable standard operating Connects waste generators with vendors that can deliver services for maximum diversion from Delivers waste reduction ROI planning and analysis REPORTING Businesses need to report on the impacts of their WATS: Standardizes data from various vendors for ESG reports Automates carbon footprint reporting (EPA WARM model as a baseline) Builds specific waste metrics analysis Visualizes roll up comparisons for sites across portfolios Simplifies waste cost analysis and anomaly identification REGULATIONS Legislation is changing as a result of climate WATS: Flags non compliance with local waste policies Prepares businesses for evolving reporting standards Transform your standard waste streams from these - To include specialty waste streams like these (with variations based on entity type) - divert valuable materials from landfills and track your impact! How does WATS work? Businesses upload waste vendor invoices that WATS automatically analyzes, to build a baseline waste profile for each WATS delivers site speci",startup,"{'status': '200', 'available': True, 'url': 'http://web.archive.org/web/20230103041948/https://getwats.com/', 'timestamp': '20230103041948'}",20230103041948.0,1.0
https://www.syrup.io,3405,crunchbase," Syrup â Sweeter We re hiring! Join waitlist We re hiring! Join waitlist We re hiring! Join waitlist Sweeter Sweeter Sweeter The simplest, smartest email built for The simplest, smartest email built for Join waitlist Announcing our $3.3M Seed Round, led by High Alpha Capital! Read more Announcing our $3.3M Seed Round, led by High Alpha Capital! Read more A spoonful of A spoonful of As an email marketer for over years, Syrup emerged from our own struggles with complex email platforms that failed to meet modern SaaS Driven by a desire for meaningful customer engagement, we envisioned a Email (PLE) platform that would revolutionize customer communication through experiences . Our vision goes beyond email, with a commitment to providing product tools that maximize customer loyalty and ROI for SaaS . We believe in the power of individualized communication, and we re excited for you to experience the Brad Owen , Content AI Content AI Content AI Instantly generate campaigns that are uniquely tailored to your Instantly generate campaigns that are uniquely tailored to your Instantly generate campaigns that are uniquely tailored to your t Generating your Just a moment! Type t Generating your Just a moment! Type Create new Newsletter Welcome Waitlist Welcome Upsell Email Offer Sales Assist Referral Request Pricing Page Visit Welcome to Plan After 3 Days After 7 Days Onboarding Nudge Usage Celebration Renewal Reminder Engage Dormant Users Free Trial Invite Welcome Email Founder Celebration: Funding Round Engage Inactive Users Upgrade to Annual Billing Cancellation Feedback Create new Newsletter Welcome Waitlist Welcome Upsell Email Offer Sales Assist Referral Request Pricing Page Visit Welcome to Plan After 3 Days After 7 Days Onboarding Nudge Usage Celebration Renewal Reminder Engage Dormant Users Free Trial Invite Welcome Email Founder Celebration: Funding Round Engage Inactive Users Upgrade to Annual Billing Cancellation Feedback Usage Celebration +% increase in usage in last Send Immediately Bespoke Recipes Bespoke Recipes Bespoke Recipes Automate your communication at optimal moments with , Automate your communication at optimal moments with , Automate your communication at optimal moments with , Predictive Audiences Predictive Audiences Predictive Audiences With ready to deploy audiences, identify user activity levels, revenue opportunities and churn With ready to deploy audiences, identify user activity levels, revenue opportunities and churn With ready to deploy audiences, identify user activity levels, revenue opportunities and churn All Contacts â¢ - All Users â¢ - All Prospects â¢ - Company Owners â¢ - Paid Users â¢ - Trial Users â¢ - Free Users â¢ - Likely to Covert â¢ - Likely to Expand â¢ - High Churn Risk â¢ - Power Users â¢ - Subscribers â¢ - Dormant Users â¢ - Seat Abuse â¢ - Users â¢ - Likely to Expand Users from accounts predicted to expand their usage â¢ - Simplicity Simplicity Experience email anew, designed for unparalleled ease and Visibility Visibility Unlock the user journey through product usage insights and activity Personalization Personalization Treat each customer as an individual with Reserve Your Spot For a limited time, early adopters may be eligible for free platform usage! Join waitlist Â©2023 Concord Labs, All Rights Reserved Â©2023 Concord Labs, All Rights Reserved Blog Legal Who is Syrup? Blog Legal ",startup,"{'status': '200', 'available': True, 'url': 'http://web.archive.org/web/20230523175918/https://www.syrup.io/', 'timestamp': '20230523175918'}",20230523175918.0,1.0
https://www.goldenset.com,6922,crunchbase,"goldenset You need to enable JavaScript to run this   Wayback Machine We will keep fighting for all libraries - stand with us! Close banner 9 Days Left: All donations will be matched through December ! Your Donation Will Be Matched ! Can You Chip In? Please don t scroll past thisâthe Wayback Machine is fighting for universal access to quality The Internet Archive, which runs this project, relies on donations averaging $30.38 to help us keep the record We d be deeply grateful if you d join the one in a thousand users that support us Right now, we have a matching gift campaign that will double the impact of every We understand that not everyone can donate right now, but if you can afford to contribute this Saturday, we promise it will be put to good Our resources are crucial for knowledge lovers everywhereâso if you find all these bits and bytes useful, please pitch Your Donation Will Be Matched! Can You Chip In? Please don t scroll past thisâthe Wayback Machine is fighting to keep the record Right now, we have a matching gift campaign that will double the impact of every We understand that not everyone can donate right now, but if you can afford to contribute this Saturday, we promise it will be put to good If you find all these bits and bytes useful, please pitch Continue Remind Me Send me an email reminder Email address (required) Please enter a valid email First name Last name Submit By submitting, you agree to receive emails from the Internet Your privacy is important to We do not sell or trade your information with Internet Archive logo A line drawing of the Internet Archive headquarters building faÃ§ade. Donate icon An illustration of a heart shape ""Donate to the archive"" Search icon An illustration of a magnifying Search icon An illustration of a magnifying Upload icon An illustration of a horizontal line over an up pointing Upload User icon An illustration of a person s head and Sign up | Log in Web icon An illustration of a computer application window Wayback Machine Texts icon An illustration of an open Books Video icon An illustration of two cells of a film Video Audio icon An illustration of an audio Audio Software icon An illustration of a "" floppy Software Images icon An illustration of two Images Donate icon An illustration of a heart shape Donate Ellipses icon An illustration of text More Hamburger icon An icon used to represent a menu that can be toggled by interacting with this Internet Archive Audio Live Music Archive Librivox Free Audio Featured All Audio This Just In Grateful Dead Netlabels Old Time Radio RPMs and Cylinder Recordings Top Audio Books & Poetry Computers, Technology and Science Music, Arts & Culture News & Public Affairs Spirituality & Religion Podcasts Radio News Archive Images Metropolitan Museum Cleveland Museum of Art Featured All Images This Just In Flickr Commons Occupy Wall Street Flickr Cover Art USGS Maps Top NASA Images Solar System Collection Ames Research Center Software Internet Arcade Console Living Room Featured All Software This Just In Old School Emulation Games Historical Software Classic PC Games Software Library Top Kodi Archive and Support File Vintage Software APK Software Software Library Software Sites Tucows Software Library Shareware Software Capsules Compilation Images ZX Spectrum DOOM Level CD Books Books to Borrow Open Library Featured All Books All Texts This Just In Smithsonian Libraries FEDLINK (US) Genealogy Lincoln Collection Top American Libraries Canadian Libraries Universal Library Project Gutenberg Children s Library Biodiversity Heritage Library Books by Language Additional Collections Video TV News Understanding 9 11 Featured All Video This Just In Prelinger Archives Democracy Now! Occupy Wall Street TV NSA Clip Library Top Animation & Cartoons Arts & Music Computers & Technology Cultural & Academic Films Ephemeral Films Movies News & Public Affairs Spirituality & Religion Sports Videos Television Videogame Videos Vlogs Youth Media Search the history of over billion web pages on the Search the Wayback Machine Search icon An illustration of a magnifying Mobile Apps Wayback Machine (iOS) Wayback Machine (Android) Browser Extensions Chrome Firefox Safari Edge Subscription Explore the Collections Learn More Build Collections Save Page Now Capture a web page as it appears now for use as a trusted citation in the Please enter a valid web address About Blog Projects Help Donate Contact Jobs Volunteer People Sign up for free Log in Search metadata Search text contents Search TV news captions Search radio transcripts Search archived web sites Advanced Search About Blog Projects Help Donate Donate icon An illustration of a heart shape Contact Jobs Volunteer People DONATE Sorry You have already reached the limit of active Save Page Now Please wait for a minute and then try Return to Save Page Now The Wayback Machine requires your browser to support JavaScript, please email if you have any questions about The Wayback Machine is an initiati",startup,"{'status': '200', 'available': True, 'url': 'http://web.archive.org/web/20230118141144/https://www.goldenset.com/', 'timestamp': '20230118141144'}",20230118141144.0,1.0
