website,text_len,source,text,type,closest_snapshot,closest_snapshot_time,snapshot_in_window
http://altesabio.com/,18814,crunchbase,"Pipeline | Altesa BioSciences Home Leadership Opportunity Impact Pipeline News News Releases Media Coverage Contact Pipeline Altesa’s pipeline of drug candidates stops the viruses’ abilities to replicate in the human If viruses can’t replicate, their abilities to cause organ damage and death are Altesa’s goal is to stop the viruses before they seriously harm vulnerable Vapendavir , a capsid inhibitor (prevents the virus from entering human cells and also prevents the virus from reproducing) with potent activity across all rhinoviruses and other respiratory enteroviruses, is our most advanced pipeline Altesa has exclusive global rights to develop, manufacture, and commercialize This modern antiviral treatment, which is taken in pill form, is in Phase 2 clinical It has been with positive antiviral data in human trials in over Altesa also has exclusive rights to develop new treatments emerging from the laboratories of Emory University, working seamlessly with academic and Altesa’s first molecule from Emory is This exciting new drug is a nucleoside analog (prevents effective viral replication), active against most enteroviruses (including rhinoviruses causing the common cold, and other viruses leading to deadly infections in children), and flaviviruses (causing dengue, yellow fever, encephalitis, Zika, and other serious illnesses). We expect to enter clinical trials in the first half of Leadership Opportunity Impact Pipeline News Contact Expanded Access Policy Altesa BioSciences, Harvard Street, College Park, GA Altesa © Altesa BioSciences, All rights reserved   Impact | Altesa BioSciences Home Leadership Opportunity Impact Pipeline News News Releases Media Coverage Contact Impact All of us have experienced viral infections such as the common cold, the flu, and perhaps even Fortunately, most viruses cause no damage to our health, but many common viruses—even the “common cold” virus—can be deadly, or cause health consequences among vulnerable Tens of millions of Americans are at risk of health effects, and even death, from these These include people living with chronic lung diseases, cancer, bone marrow transplants, immature or compromised immune systems (e.g., neonates, those with HIV infections), or other health For these individuals, a simple case of the sniffles can turn into pneumonia, a blood stream or brain infection, or “polio-like” paralysis, in which infection can lead to critical organ damage or failure, and possibly even Globally, thousands of adults and children die each year from viral diseases like dengue, yellow and West Nile fevers, and Altesa will change this For millions of vulnerable people, a cold is never “just a ” Up to half of all upper respiratory tract infections (e.g., the “common cold”) are caused by rhinoviruses, a subset of the picornavirus These viruses can cause hepatitis, Ebola disease, mouth, SARS, influenza, polio, measles, AIDS, , and many other debilitating or deadly Collectively, these viruses are responsible for a large burden of disease around the Effective antivirals are needed to treat vulnerable infected or exposed individuals, because viruses are so In addition, they mutate so frequently that vaccinations are effective against only a small minority of these People at High Risk Include: The elderly, especially those in long term care Adults and children with lung diseases like Chronic Obstructive Pulmonary Disease (COPD) and asthma People with compromised immune systems (natural or acquired), including those undergoing solid organ or stem cell transplants or cancer treatments, neonates, and those with HIV AIDS People with other conditions who are on therapies that suppress or dampen the immune response, for example, to treat disorders like rheumatoid arthritis and Those with certain serious underlying health The Promise of Vapendavir Viral infections causing the common cold are difficult to Even people who work hard to avoid getting sick, like those with COPD, suffer, on average, more than one cold per year, which can lead to a dangerous loss of lung function, and even Altesa is developing a new treatment to prevent loss of lung function by directly stopping the virus from multiplying in the Today’s new generation of highly sensitive and easily accessible diagnostic tests can catch viral infections at their earliest In vulnerable people, early diagnosis and treatment provide an opportunity to stop viruses in their tracks—before they can damage lungs and many other This is the future of medicine: preventing downstream outcomes resulting from uncontrolled viral Leadership Opportunity Impact Pipeline News Contact Expanded Access Policy Altesa BioSciences, Harvard Street, College Park, GA Altesa © Altesa BioSciences, All rights reserved   Altesa BioSciences | Developing Treatments For Respiratory Viruses and Global Viral Threats Home Leadership Opportunity Impact Pipeline News News Releases Media Coverage Contact NEWS: FDA Green Lights Vapendavir Clinical Study Developing ",startup,"{'status': '200', 'available': True, 'url': 'http://web.archive.org/web/20230119042541/http://altesabio.com/', 'timestamp': '20230119042541'}",20230119042541.0,1.0
https://getthread.com,18428,crunchbase,"Messenger - Chatgenie Skip to content Death to the ticket Why service collaboration? Product Show submenu for Product Inbox Messenger Workflow Integrations Customers Pricing Open main navigation Close main navigation Death to the ticket Why service collaboration? Product Show submenu for Product Inbox Messenger Workflow Integrations Customers Pricing Log in Try for Free Log in Try for Free Service your customers will love With a live chat that keeps the conversation going, no matter where your customers Get Started → Support your customers everywhere they are ""Chatgenie has helped us solve major business issues by allowing our staff to interact with service tickets within Microsoft The ability to see the service ticket notes, assign the service ticket and interact with the ticket all within the Teams channel is a very powerful advantage for our "" Mike - DevSource Go to last slide Go to next slide ""Awesome Much faster for ticket management, delegation and assignment than opening up a full client (especially on mobile). With the combination of CW Workflows, some really interesting processes can be put We could not be nearly as efficient with CWManage as we are now with "" Bradly - RFA Go to previous slide Go to next slide ""ChatGenie has changed the way we work! Finally all our staff can see the responses that come in from client and go out from other staff members - this really helps the team stay on top of what is going There a ton of time saving functionality in ChatGenie and we can t imagine how we lived without it before! Plus the team at ChatGenie have been super helpful and t recommend it more!! 10"" Joel - Interconnekt Go to previous slide Go to next slide Go to slide 1 Go to slide 2 Go to slide 3 It’s an And a All in Whether your customers are on mobile or desktop, you can always be there for them with the Messenger Bot for Teams & Get Your Own Bot Support never looked so Customize the chat with your own logos, colors and even bot name, so customers can trust they are talking to their favorite service See All Integrations Integrate with your Build workflows to match the way your company Choose which Boards send notifications to which Have an incident See all integrations More solutions Your new Provide faster then a speeding bullet support with the workpace for providing better service, Learn more - Service your customers Provide faster then a speeding bullet support with the workpace for providing better service, Learn more - “Integrated chat is the future of providing the best possible service delivery – especially for MSPs looking to cut costs and increase profit ” Adam Bielanski, CEO - Sierra Pacific Group Get started with Thread Unlock an unfair advantage for your IT Get Started Request a Demo Get customer satisfaction, at lower costs and make managed IT service teams Our Mission Death to the ticket Why service collaboration Customer Stories Solutions Inbox Messenger Workflow Integrations Teams to Teams chat Slack to Slack chat Teams to Slack chat Resources Downloads Help Center Feedback Blog System Status Terms of service Privacy Policy Company Contact © Thread Magic (Hint press "" "" to chat with your cursor or press ""e"" to use emoji s!)   Customer Stories Skip to content Death to the ticket Why service collaboration? Product Show submenu for Product Inbox Messenger Workflow Integrations Customers Pricing Open main navigation Close main navigation Death to the ticket Why service collaboration? Product Show submenu for Product Inbox Messenger Workflow Integrations Customers Pricing Log in Try for Free Log in Try for Free Successful IT Providers use Thread enables people across businesses to deliver incredible service Request a Demo How Advantage Microsystems Cut Resolution Time by % After Implementing Thread Read More → The CloudRadial Playbook: How MSPs Can Gauge Operational Efficiency Read More → Why Blacktip Chose Thread: Seamless Customer Collaboration & Intelligent Issue Swarming Read More → How Three18 Streamlined Ticket Bottlenecks with Thread’s Service App Read More → The Sierra Pacific Playbook: How MSPs Can Unlock Service Efficiency with Modern Read More → How Thread Helped Three18 Improve Customer Satisfaction by Meeting Users Where They Are Read More → How Thread x CloudRadial Removes Friction and Reduces Resolution Times Read More → How Network Overdrive Improved Support Efficiency by % with Service Alignment Read More → % Increase in % Reduction in cost per interaction Increase in agent productivity What people love about Thread “Chatgenie could be a gateway to tons of organizational information — not just related to It’s revolutionary, and we want to be part of that journey with ” Greg Clarkson Managing Director “Integrated chat is the future of providing the best possible service delivery – especially for MSPs looking to cut costs and increase profit ” Adam Bielanski CEO With Thread, clients can easily reach out for There s virtually no client hesitation, which [happens] when someon",startup,"{'status': '200', 'available': True, 'url': 'http://web.archive.org/web/20221219132401/https://www.getthread.com/', 'timestamp': '20221219132401'}",20221219132401.0,1.0
https://winnersalliance.com/,113,crunchbase, Winners Alliance Coming Soon - Get Notified When We Launch Email (Required) Instagram Twitter Facebook Linkedin ,startup,"{'status': '200', 'available': True, 'url': 'http://web.archive.org/web/20230609212900/https://winnersalliance.com/', 'timestamp': '20230609212900'}",20230609212900.0,1.0
https://www.recosenselabs.com,78750,crunchbase,"Process Automation - RecoSense Platforms DocuSense Customer Data Platform Knowledge Graph Capabilities Solutions Enterprise Data Process Automation Digital Business SaaS AI Frameworks FinSense SearchSense MediaSense RetailSense CampaignSense Expertise AI Transformation Data Engineering Text Analytics BI and Analytics Cloud Management and Devops CMS led Solutions – Shopify, Magento, WordPress Industries Aviation Mobility and Manufacturing Media and Entertainment Sports Telecommunication Retail and eCommerce BFSI Resources Blogs Insights Company About Us Careers Contact Privacy Policy Platforms DocuSense Customer Data Platform Knowledge Graph Capabilities Solutions Enterprise Data Process Automation Digital Business SaaS AI Frameworks FinSense SearchSense MediaSense RetailSense CampaignSense Expertise AI Transformation Data Engineering Text Analytics BI and Analytics Cloud Management and Devops CMS led Solutions – Shopify, Magento, WordPress Industries Aviation Mobility and Manufacturing Media and Entertainment Sports Telecommunication Retail and eCommerce BFSI Resources Blogs Insights Company About Us Careers Contact Privacy Policy Process Automation Home Process Automation Automate Business Processes with RecoSense RecoSense is a leading provider of process automation solutions for the transportation and manufacturing Process automation is the need of the hour for businesses that want to grow at RecoSense supports this journey by using its proprietary technologies to streamline Increase your business processes speed, quality and accuracy with RecoSense s process automation We use technology to simplify complex business More than million monthly users use RecoSense to fuel their business Request a Demo Now! Request Demo Solutions Anomaly Detection MRO Automations Inventory Forecasting Anomaly detection is an essential business It can help identify areas of error and fix the issues quickly before they go further However, manually detecting, ranking and grouping anomalies is a tedious It s difficult and expensive to scale manual detection to many Additionally, the manpower requirement is enormous, and one cannot vouch for the accuracy of the Employing an automated anomaly detection solution can solve this RecoSense s process automation solution automates each step of the anomaly detection process: detection, ranking and This enables accurate analysis of large and complex data sets for anomaly detection and It further provides the indicators of what s anomalous so you can completely understand your MRO stands for maintenance, repair and These are the set of operations and activities associated with the upkeep of plants and MRO activities can lead to errors and high costs when not done as per Automation streamlines the MRO process by sending automated alerts whenever scheduled maintenance Hence, MRO automation improves efficiency, reduces cost and makes your business Besides, AI and robotic tools can replace skilled labour to increase the pace of MRO Not only will organisations save costs on manpower recruitment and training, but they will also be able to handle large volumes of maintenance and repair activities RecoSense will help you adopt process automation so you can leverage the power of technology to manage MRO activities efficiently and inexpensively, thus improving your Accurate inventory forecasting is priceless for businesses, especially when demand and supply change However, forecasting requires data analysis, industry experience and deep consumer Technology makes all this While analysing a large volume of data is complex for humans, automation technology can do it in Automated forecasting uses historical sales data to predict trends for the It also addresses the challenges of inventory forecasting, such as choosing the correct methods and the parameters for Automation in inventory will enable you to track it in , reduce errors and save time through efficient inventory RecoSense uses machine learning (ML) to generate , accurate It will also assist your business in streamlining inventory management operations, including stock count, order fulfilment, order purchase and Industries Transportation Automation continues to change the game in By leveraging technology, transportation organisations can optimise their resources and create greater Process automation in transportation takes care of shipment scheduling and tracking, rate lookups, load capture, inventory management, order processing and tracking, freight management and much For instance, extracting request data, retrieving load information and picking the best load and route happen automatically without Improve your customer experience, optimise operation metrics and achieve a sustainable competitive advantage with RecoSense s process automation solution for the transportation Manufacturing Heavy workflows characterise manufacturing Automating manufacturing processes can take a huge load off manufacturers and their employees by enabling production",startup,"{'status': '200', 'available': True, 'url': 'http://web.archive.org/web/20230116040834/https://recosenselabs.com/', 'timestamp': '20230116040834'}",20230116040834.0,1.0
https://antecapital.us,55278,crunchbase,"Terms of Use | Ante Capital top of page Home Newsletter About Careers Invest with us More Use tab to navigate through the menu ANTE CAPITAL WEBSITE TERMS AND CONDITIONS OF USE Terms and Conditions Agreement between User and Welcome to . The website (the ""Site"") is comprised of various web pages operated by Ante Capital Management LLC (""Ante Capital""). is offered to you conditioned on your acceptance without modification of the terms, conditions, and notices contained herein (the ""Terms""). Your use of constitutes your agreement to all such Please read these terms carefully, and keep a copy of them for your is a Hedge Fund _________________ Privacy Your use of is subject to Ante Capital s Privacy Please review our Privacy Policy, which also governs the Site and informs users of our data collection Electronic Communications Visiting or sending emails to Ante Capital constitutes electronic You consent to receive electronic communications and you agree that all agreements, notices, disclosures and other communications that we provide to you electronically, via email and on the Site, satisfy any legal requirement that such communications be in Children Under Thirteen Ante Capital does not knowingly collect, either online or offline, personal information from persons under the age of If you are under , you may use only with permission of a parent or Links to Third Party Sites Third Party Services may contain links to other websites (""Linked Sites""). The Linked Sites are not under the control of Ante Capital and Ante Capital is not responsible for the contents of any Linked Site, including without limitation any link contained in a Linked Site, or any changes or updates to a Linked Ante Capital is providing these links to you only as a convenience, and the inclusion of any link does not imply endorsement by Ante Capital of the site or any association with its Certain services made available via are delivered by third party sites and By using any product, service or functionality originating from the domain, you hereby acknowledge and consent that Ante Capital may share such information and data with any third party with whom Ante Capital has a contractual relationship to provide the requested product, service or functionality on behalf of users and No Unlawful or Prohibited Use Intellectual Property You are granted a , , revocable license to access and use strictly in accordance with these terms of As a condition of your use of the Site, you warrant to Ante Capital that you will not use the Site for any purpose that is unlawful or prohibited by these You may not use the Site in any manner which could damage, disable, overburden, or impair the Site or interfere with any other party s use and enjoyment of the You may not obtain or attempt to obtain any materials or information through any means not intentionally made available or provided for through the All content included as part of the Service, such as text, graphics, logos, images, as well as the compilation thereof, and any software used on the Site, is the property of Ante Capital or its suppliers and protected by copyright and other laws that protect intellectual property and proprietary You agree to observe and abide by all copyright and other proprietary notices, legends or other restrictions contained in any such content and will not make any changes You will not modify, publish, transmit, reverse engineer, participate in the transfer or sale, create derivative works, or in any way exploit any of the content, in whole or in part, found on the Ante Capital content is not for Your use of the Site does not entitle you to make any unauthorized use of any protected content, and in particular you will not delete or alter any proprietary rights or attribution notices in any You will use protected content solely for your personal use, and will make no other use of the content without the express written permission of Ante Capital and the copyright You agree that you do not acquire any ownership rights in any protected We do not grant you any licenses, express or implied, to the intellectual property of Ante Capital or our licensors except as expressly authorized by these International Users The Service is controlled, operated and administered by Ante Capital from our offices within the If you access the Service from a location outside the USA, you are responsible for compliance with all local You agree that you will not use the Ante Capital Content accessed through in any country or in any manner prohibited by any applicable laws, restrictions or Indemnification You agree to indemnify, defend and hold harmless Ante Capital, its officers, directors, employees, agents and third parties, for any losses, costs, liabilities and expenses (including reasonable attorney s fees) relating to or arising out of your use of or inability to use the Site or services, any user postings made by you, your violation of any terms of this Agreement or your violation of any rights of ",startup,"{'status': '200', 'available': True, 'url': 'http://web.archive.org/web/20221123233916/https://www.antecapital.us/', 'timestamp': '20221123233916'}",20221123233916.0,1.0
