website,text_len,source,text,type,closest_snapshot,closest_snapshot_time,snapshot_in_window
http://www.thehost.co,31800,crunchbase,"Wayback Machine We will keep fighting for all libraries - stand with us! Close banner 9 Days Left: All donations will be matched through December ! Your Donation Will Be Matched ! Can You Chip In? Please don t scroll past thisâthe Wayback Machine is fighting for universal access to quality The Internet Archive, which runs this project, relies on donations averaging $30.38 to help us keep the record We d be deeply grateful if you d join the one in a thousand users that support us Right now, we have a matching gift campaign that will double the impact of every We understand that not everyone can donate right now, but if you can afford to contribute this Saturday, we promise it will be put to good Our resources are crucial for knowledge lovers everywhereâso if you find all these bits and bytes useful, please pitch Your Donation Will Be Matched! Can You Chip In? Please don t scroll past thisâthe Wayback Machine is fighting to keep the record Right now, we have a matching gift campaign that will double the impact of every We understand that not everyone can donate right now, but if you can afford to contribute this Saturday, we promise it will be put to good If you find all these bits and bytes useful, please pitch Continue Remind Me Send me an email reminder Email address (required) Please enter a valid email First name Last name Submit By submitting, you agree to receive emails from the Internet Your privacy is important to We do not sell or trade your information with Internet Archive logo A line drawing of the Internet Archive headquarters building faÃ§ade. Donate icon An illustration of a heart shape ""Donate to the archive"" Search icon An illustration of a magnifying Search icon An illustration of a magnifying Upload icon An illustration of a horizontal line over an up pointing Upload User icon An illustration of a person s head and Sign up | Log in Web icon An illustration of a computer application window Wayback Machine Texts icon An illustration of an open Books Video icon An illustration of two cells of a film Video Audio icon An illustration of an audio Audio Software icon An illustration of a "" floppy Software Images icon An illustration of two Images Donate icon An illustration of a heart shape Donate Ellipses icon An illustration of text More Hamburger icon An icon used to represent a menu that can be toggled by interacting with this Internet Archive Audio Live Music Archive Librivox Free Audio Featured All Audio This Just In Grateful Dead Netlabels Old Time Radio RPMs and Cylinder Recordings Top Audio Books & Poetry Computers, Technology and Science Music, Arts & Culture News & Public Affairs Spirituality & Religion Podcasts Radio News Archive Images Metropolitan Museum Cleveland Museum of Art Featured All Images This Just In Flickr Commons Occupy Wall Street Flickr Cover Art USGS Maps Top NASA Images Solar System Collection Ames Research Center Software Internet Arcade Console Living Room Featured All Software This Just In Old School Emulation Games Historical Software Classic PC Games Software Library Top Kodi Archive and Support File Vintage Software APK Software Software Library Software Sites Tucows Software Library Shareware Software Capsules Compilation Images ZX Spectrum DOOM Level CD Books Books to Borrow Open Library Featured All Books All Texts This Just In Smithsonian Libraries FEDLINK (US) Genealogy Lincoln Collection Top American Libraries Canadian Libraries Universal Library Project Gutenberg Children s Library Biodiversity Heritage Library Books by Language Additional Collections Video TV News Understanding 9 11 Featured All Video This Just In Prelinger Archives Democracy Now! Occupy Wall Street TV NSA Clip Library Top Animation & Cartoons Arts & Music Computers & Technology Cultural & Academic Films Ephemeral Films Movies News & Public Affairs Spirituality & Religion Sports Videos Television Videogame Videos Vlogs Youth Media Search the history of over billion web pages on the Search the Wayback Machine Search icon An illustration of a magnifying Mobile Apps Wayback Machine (iOS) Wayback Machine (Android) Browser Extensions Chrome Firefox Safari Edge Subscription Explore the Collections Learn More Build Collections Save Page Now Capture a web page as it appears now for use as a trusted citation in the Please enter a valid web address About Blog Projects Help Donate Contact Jobs Volunteer People Sign up for free Log in Search metadata Search text contents Search TV news captions Search radio transcripts Search archived web sites Advanced Search About Blog Projects Help Donate Donate icon An illustration of a heart shape Contact Jobs Volunteer People DONATE Latest Show All The Wayback Machine has not archived that Click here to search for all archived pages under https: www.thehost.co . The Wayback Machine requires your browser to support JavaScript, please email if you have any questions about The Wayback Machine is an initiative of the Internet Archive , a (c)(3) , building ",startup,"{'status': '200', 'available': True, 'url': 'http://web.archive.org/web/20201203214828/https://www.thehost.co/', 'timestamp': '20201203214828'}",20201203214828.0,1.0
https://reach.sh,4631,crunchbase," Reach Home How it works Resources Blog Follow us on: Youtube Created with How It Works We believe that blockchains have not reached their full potential because no development environment provides these Therefore, developers must provide for them on their own, which is expensive and The Reach platform will enable tens of millions of developers to participate in the Blockchain community, rather than only the thousands that participate today, by drastically lowering the barrier to entry into blockchain and seriously raising the productivity of DApp Why 1 Traditional developers are not included in the blockchain movement Current blockchain development requires detailed knowledge of particular networks and cryptographic This knowledge is not pervasive among traditional Further, it is too expensive and risky to acquire because no blockchain platform is perceived as “safe” or 2 DApps involve many cooperating components to deploy successfully and The details of the smart contract, , and correctness proofs must all agree on every detail of the program from the protocol details (like data formats and method API) to the logical operations of the No existing DApp language allows all of these components to be specified at the same time or in a way that guarantees 3 DApps require a high standard of correctness because mistakes can automatically put great financial resources at risk (c.f. DAO hack). No existing DApp development environment incorporates formal verification of the distributed computation executed by the How The Reach platform provides these three services via a language (DSL) for specifying DApps and a specialized compiler that projects the specification into each of the output components while performing automatic verification of correctness Language We allow the developer to write and think at the level of business logic, rather than at the level of the intricate details of a blockchain Our DSL uses a subset of JavaScript to specify the entire DApp: the smart contract, the clients run on the , the servers run on the , and all communication between all the Since the entire specification is in a single language, we enable any developer to quickly create, reason about and deploy Blockchain Agnostic We output the DApp to a generalized backend language, and we then use “connectors” to translate the backend language to the correct byte code, while remaining faithful to the interfaces offered by actual This allows a developer to build on any blockchain platform that would best serve the Safety Guarantees We ensure that the DApp is free from errors without having to write tests of what the program should Instead, developers write down what their program must not do, and we ensure that these bad outcomes never The compiler uses , A transformation, security, and projection to derive each component correctly from the single The compiler is integrated with a (SMT) theorem prover (e.g. Z3) to automatically check the correctness of the application via predicates, as well as automatically generated properties appropriate for all Ready to make blockchain practical? Home Learn More Blog Follow us on: Youtube Created with © Copyright Reach   Reach Home How it works Resources Blog Follow us on: Youtube Created with DApps as Easy as Apps: Blockchain for Everyone Blockchain in Transition Today Blockchain is And in today’s world, developers are being asked to build complex solutions without the right But we are entering a new An era when blockchain becomes mainstream and all developers become blockchain Reach is here to enable real world development on blockchain with simple and fast enablement Our Solution Reach removes the difficulty, uncertainty, and risk of developing on the As the gateway for all blockchain development, no matter what protocol you choose, Reach provides the tools for a DApp to be built in a matter of days instead of When junior developers are comfortable building blockchain applications, decentralized applications will become Learn More Team Chris Swenor Chris has over years of experience managing technical teams around the world and over 2 years of experience in blockchain He has successfully “exited” from multiple He is currently a mentor at Harvard Business School, TechStars, and Jay McCarthy Jay received his PhD in Computer Science from Brown Since , he has been an assistant professor of computer science, first at Brigham Young University, and then at Vassar College, and now is an associate professor of computer science at UMass Ready to make blockchain practical? Home Learn More Blog Follow us on: Youtube Created with © Copyright Reach ",startup,"{'status': '200', 'available': True, 'url': 'http://web.archive.org/web/20200420143211/https://reach.sh/', 'timestamp': '20200420143211'}",20200420143211.0,1.0
https://www.awkwardessentials.com,19914,crunchbase,"Account – Awkward Essentials FAQS doc talk friends don t let friends drip 💧 click here to give $5 and get $5 LOGIN SHOP NOW HOW IT WORKS REVIEWS OUR STORY SHOP ALL HOW IT WORKS REVIEWS OUR STORY TRY A SAMPLE LOG IN REWARDS DOC TALK shop all 0 0 Liquid error: Could not find asset snippets search-overlay.liquid review your cart | formatMoney Pack size: Remove Subtotal: | formatMoney Checkout free shipping on all orders! discounts are applied at checkout Liquid error: Could not find asset snippets search-overlay.liquid Login Email Password Login register Forgot Password Reset Password We will send you an email to reset your Submit Cancel Shop shop all dripstick try a sample awkward swag bachelorette pack accessibility Support holiday shopping & shipping updates contact us get $5 faq careers international customers retail inquiries do not sell my info Awkward Essentials our story blog press affiliate rewards doc talk become an ambassador Shop shop all dripstick try a sample awkward swag bachelorette pack Support holiday shopping & shipping updates contact us get $5 faq careers international customers retail inquiries do not sell my info Awkward Essentials our story blog press affiliate rewards doc talk become an ambassador accessibility terms and conditions | privacy policy ©Awkward Essentials   THE INSIDER - an Awkward Essentials blog FAQS BLOG FREE SHIPPING ON ALL ORDERS! looking for come&gone ? LOGIN SHOP NOW HOW IT WORKS REVIEWS FAQ BLOG LOG IN shop now 0 0 Liquid error: Could not find asset snippets search-overlay.liquid SHOP NOW HOW IT WORKS REVIEWS FAQ BLOG LOG IN review your cart | formatMoney Pack size: Remove Subtotal: | formatMoney Checkout free shipping on all orders! discounts are applied at checkout Liquid error: Could not find asset snippets search-overlay.liquid welcome to THE INSIDER an Awkward Essentials blog news q+a all your weird questions: answered 2 Min Read Read More q+a welcome! 1 Min Read Read More news email us Shop dripstick® THE Support faq contact us international customers retail inquiries Awkward Essentials our story careers press what a load Shop dripstick® THE Support faq contact us international customers retail inquiries Awkward Essentials our story careers press what a load terms and conditions | privacy policy ©Awkward Essentials   Collection – Awkward Essentials FAQS BLOG FREE SHIPPING ON ALL ORDERS! looking for come&gone ? LOGIN SHOP NOW HOW IT WORKS REVIEWS FAQ BLOG LOG IN shop now 0 0 Liquid error: Could not find asset snippets search-overlay.liquid SHOP NOW HOW IT WORKS REVIEWS FAQ BLOG LOG IN review your cart | formatMoney Pack size: Remove Subtotal: | formatMoney Checkout free shipping on all orders! discounts are applied at checkout Liquid error: Could not find asset snippets search-overlay.liquid collections shop all products add to cart $25.00 dripstick® learn more! add to cart $69.00 THE learn more! say goodbye to sitting and waiting over the toilet drips and leaks wet sheets ruined underwear email us Shop dripstick® THE Support faq contact us international customers retail inquiries Awkward Essentials our story careers press what a load Shop dripstick® THE Support faq contact us international customers retail inquiries Awkward Essentials our story careers press what a load terms and conditions | privacy policy ©Awkward Essentials   Awkward Essentials FAQS BLOG FREE SHIPPING ON ALL ORDERS! looking for come&gone ? LOGIN SHOP NOW DRIPSTICK® HOW TO USE REVIEWS FAQ BLOG LOG IN shop all 0 0 Liquid error: Could not find asset snippets search-overlay.liquid SHOP NOW DRIPSTICK® HOW TO USE REVIEWS FAQ BLOG LOG IN review your cart | formatMoney Pack size: Remove Subtotal: | formatMoney Checkout free shipping on all orders! discounts are applied at checkout Liquid error: Could not find asset snippets search-overlay.liquid dripstick® original sponge dripstick® party pack (8 boxes) THE THE WORLD S FIRST after sex clean up sponge 🍆💦 he finished, and to go to the bathroom and clean dripstick® can help you with get dripstick® say goodbye sitting and waiting over the toilet drips and leaks wet sheets ruined underwear how it works how it works 1 get a grip (on the handle) 2 put it in (just make sure it s the right hole 😉) 3 twirl gently (now is not the time for rough) 4 pull it out (that clearly didn t happen the first time) 5 that s it! see ya never, drips! ✌️ directions for use dripstick®: the after sex clean up sponge pack $15.00 best seller! pack $25.00 no additives quick absorption soft, comfortable sponge medical grade material add to cart no additives quick absorption soft, comfortable sponge medical grade material ⭐⭐⭐⭐⭐ “What a million dollar idea!!! These are quick, easy, and discreet! You have a lifetime customer from me!!!!” - Sami ⭐⭐⭐⭐⭐ “This product is I wish it were invented No more uncomfortable “crab walking” or panty liners needed” - Meagan ⭐⭐⭐⭐⭐ ""I love this This is my second time purchasing and not my Perfectly takes care of everything so no "" - Trish as seen i",startup,"{'status': '200', 'available': True, 'url': 'http://web.archive.org/web/20201021151948/https://awkwardessentials.com/', 'timestamp': '20201021151948'}",20201021151948.0,1.0
https://newness.com,136,crunchbase, For full functionality of this site it is necessary to enable Here are the instructions how to enable JavaScript in your web browser . ,startup,"{'status': '200', 'available': True, 'url': 'http://web.archive.org/web/20190704073840/http://newness.com/', 'timestamp': '20190704073840'}",20190704073840.0,1.0
https://www.fleeting.us,24907,crunchbase,"Fleeting | Home Skip to content Home Truck Owners Drivers About Us Open main navigation Close main navigation Home Truck Owners Drivers About Us Get Started Get Started The Road Best Traveled Fleeting has brought trucking into the century with increased earning, more schedule control, and better asset Get started today! Truck Owner Driver The Fleeting Advantage Whether you’re a Truck Owner or Driver, Fleeting gives you the tools and freedom to grow your Truck Owners Drivers It’s Easy to Get Started with Fleeting Fast Simply fill out the quick form to get started Talk to a Fleeting Associate They’ll help you with our process Get on the Road We handle the details so you & your trucks are on the road earning Maintenance & Compliance We’ll keep your trucks compliant and Get Started With Fleeting Truck Owners & Drivers Love Fleeting: “The better wages alone is worth But what I really like is knowing that I’m going to be on the road making money ” Derek G, Truck Driver “I know my truck is in good They keep me informed, and every month I m happy when I see my ” James , Truck Owner “Since working with Fleeting, I’ve never missed my daughter’s Friday soccer ” Jenna , Truck Driver icon icon twitter icon instagram icon Driver? Come work with us Terms & Conditions Privacy Policy Contact Us Street Brooklyn, NY USA Copyright © , Fleeting   Wayback Machine We will keep fighting for all libraries - stand with us! Close banner 9 Days Left: All donations will be matched through December ! Your Donation Will Be Matched ! Can You Chip In? Please don t scroll past thisâthe Wayback Machine is fighting for universal access to quality The Internet Archive, which runs this project, relies on donations averaging $30.38 to help us keep the record We d be deeply grateful if you d join the one in a thousand users that support us Right now, we have a matching gift campaign that will double the impact of every We understand that not everyone can donate right now, but if you can afford to contribute this Saturday, we promise it will be put to good Our resources are crucial for knowledge lovers everywhereâso if you find all these bits and bytes useful, please pitch Your Donation Will Be Matched! Can You Chip In? Please don t scroll past thisâthe Wayback Machine is fighting to keep the record Right now, we have a matching gift campaign that will double the impact of every We understand that not everyone can donate right now, but if you can afford to contribute this Saturday, we promise it will be put to good If you find all these bits and bytes useful, please pitch Continue Remind Me Send me an email reminder Email address (required) Please enter a valid email First name Last name Submit By submitting, you agree to receive emails from the Internet Your privacy is important to We do not sell or trade your information with Internet Archive logo A line drawing of the Internet Archive headquarters building faÃ§ade. Donate icon An illustration of a heart shape ""Donate to the archive"" Search icon An illustration of a magnifying Search icon An illustration of a magnifying Upload icon An illustration of a horizontal line over an up pointing Upload User icon An illustration of a person s head and Sign up | Log in Web icon An illustration of a computer application window Wayback Machine Texts icon An illustration of an open Books Video icon An illustration of two cells of a film Video Audio icon An illustration of an audio Audio Software icon An illustration of a "" floppy Software Images icon An illustration of two Images Donate icon An illustration of a heart shape Donate Ellipses icon An illustration of text More Hamburger icon An icon used to represent a menu that can be toggled by interacting with this Internet Archive Audio Live Music Archive Librivox Free Audio Featured All Audio This Just In Grateful Dead Netlabels Old Time Radio RPMs and Cylinder Recordings Top Audio Books & Poetry Computers, Technology and Science Music, Arts & Culture News & Public Affairs Spirituality & Religion Podcasts Radio News Archive Images Metropolitan Museum Cleveland Museum of Art Featured All Images This Just In Flickr Commons Occupy Wall Street Flickr Cover Art USGS Maps Top NASA Images Solar System Collection Ames Research Center Software Internet Arcade Console Living Room Featured All Software This Just In Old School Emulation Games Historical Software Classic PC Games Software Library Top Kodi Archive and Support File Vintage Software APK Software Software Library Software Sites Tucows Software Library Shareware Software Capsules Compilation Images ZX Spectrum DOOM Level CD Books Books to Borrow Open Library Featured All Books All Texts This Just In Smithsonian Libraries FEDLINK (US) Genealogy Lincoln Collection Top American Libraries Canadian Libraries Universal Library Project Gutenberg Children s Library Biodiversity Heritage Library Books by Language Additional Collections Video TV News Understanding 9 11 Featured All Video This Just In Prelinger ",startup,"{'status': '200', 'available': True, 'url': 'http://web.archive.org/web/20200618153313/https://www.fleeting.us/', 'timestamp': '20200618153313'}",20200618153313.0,1.0
