website,text_len,source,text,type,closest_snapshot,closest_snapshot_time,snapshot_in_window
https://www.purestake.com,12104,crunchbase,"Secure, Reliable Polkadot Validator | PureStake INTRODUCING GOALSEEKER: A New Algorand Explorer by PureStake Try It Now Nominate on Kusama Networks Services Polkadot Validator Algorand API Algorand Services Algorand Explorer About News Contact Us Blog Customer Support Network Status API Login Menu Polkadot Validator Services Secure, Reliable Managed Infrastructure STAKE CONFIDENTLY With Resilient, Reliable, and Secure Validator Services From PureStake Nominate on Kusama PureStake’s Validator Address GhoRyTGK583sJec8aSiyyJCsP2PQXJ2RK7iPGUjLtuX8XCn Copy New to Nominating? View our guide that walks you through bonding and nominating your stake on Kusama (and eventually, Polkadot). View the Tutorial Subject to Terms of Service Nominate on Polkadot COMING SOON Sign up to be notified when it’s ready: Why Nominate PureStake? PureStake employs an automated approach to building and managing highly consistent dev, test, and production An experienced DevOps team manages the deployed infrastructure using a set of processes, including change and incident PureStake’s validator services have been optimized to mitigate the risk of larger slashing events (equivocation, etc), and are actively managed by personnel and monitored The team actively invests time into improving PureStake services, with an emphasis on the security and availability of all our Security Comes First Solid infrastructure that maximizes your rewards and reduces the risk of slashing Deep Subject Matter Expertise DevOps and Polkadot experts streamline infrastructure troubleshooting, management, and operation Consistent, Reliable, and Available Strong track record of uptime and network availability that you can depend on , PureStake employs a geographically dispersed infrastructure to support our validator We take a approach, deploying network, compute, and storage infrastructure across all three major cloud providers: AWS, Azure, and This , approach provides resiliency against single points of We employ a sentry node validator node design with multiple sentry nodes protecting access to our validator 1 2 3 4 5 6 1 Validator Layer Isolated, protected, and secure 2 Sentry Layer Provides network security and access 3 Security Infrastructure IDS, vulnerability scanning, patch management, log analysis, secrets management, auth infrastructure, and more 4 Full DevOps Automation Stack Build, change, testing, development, DR 5 Operational Processes Change, incident, and other management processes follow industry best practices 6 Monitoring and Alerting management of the platform Serious About Security Here are some of the many ways that we proactively secure our Validator Isolation Network segmentation, VPCs, VPNs to create validator isolation Perimeter Protection Load balancers, firewalls, acls for DDoS and perimeter protection Centralized Log Analysis IDS and centralized log analysis to identify and alert on security threats Host Hardening Host hardening according to NIST standards, fully automated patching Access Control access control and account separation supporting the principle of least privilege Authentication Controls Central directory MFA, auditing, tamperproof logging of all access Daily Scanning and Remediation Daily network and system vulnerability scanning and remediation Secrets Management Secrets management using secure key management systems COMPANY About Technology News Blog Support BLOCKCHAIN SERVICES Algorand Nodes Algorand API CONTACT District Avenue Burlington, MA, USA +1 (617) Subscribe to Our Blog Copyright © PureStake | Privacy Policy Twitter Linkedin Facebook Telegram Scroll to top This site uses By continuing to browse the site, you are agreeing to our use of OK Learn more   Blockchain Network Infrastructure Technology | PureStake INTRODUCING GOALSEEKER: A New Algorand Explorer by PureStake Try It Now Nominate on Kusama Networks Services Polkadot Validator Algorand API Algorand Services Algorand Explorer About News Contact Us Blog Customer Support Network Status API Login Menu The PureStake Global Network Proof of stake networks require low latency, high quality network connectivity for users located around the PureStake’s global network is specifically designed for networks with a global user It features over points of presence at strategic network locations across the We meet low latency and requirements by serving users from the in region point of presence closest to We are continuously expanding our network with additional points of presence as demand grows in different parts of the The PureStake Platform The PureStake platform is an automated foundation specifically designed for proof of stake blockchain It drives the setup and configuration of network, security, compute, storage and blockchain application infrastructure into the points of presence on our We employ a strategy across AWS, Azure, and Google Cloud with an ability to dynamically move workloads between these PureStake leverages the APIs of these cloud providers to provis",startup,"{'status': '200', 'available': True, 'url': 'http://web.archive.org/web/20200420143130/https://www.purestake.com/', 'timestamp': '20200420143130'}",20200420143130.0,1.0
https://www.turtlehealth.com,101,crunchbase, This site requires JavaScript and Cookies to be Please change your browser settings or upgrade your ,startup,"{'status': '200', 'available': True, 'url': 'http://web.archive.org/web/20190706231332/http://turtlehealth.com/', 'timestamp': '20190706231332'}",20190706231332.0,1.0
https://www.tradespace.io,15579,crunchbase,"redirect | tradespace Solutions About Resources More Sign In The easiest way to Buy, Sell & Manage Intellectual © Tradespace, All rights   About Us | Tradespace Solutions About Resources More Sign In Mission We are speeding innovation by making it easier, faster and less expensive to bring new technologies to ​ As a partner for organizations on the leading edge of innovation, we provide tools that connect innovators and lead to IP Leadership Alec Sorensen CEO A former management consultant, Alec led engagements focused on technology commercialization and M&A for Fortune companies in the US, Europe, and the Middle Alec has worked closely with the Canadian Government to reshape their IP Strategy, and has managed over $200M in commercialization Advisory Board Myron Kassaraba Technology Transactions Structured hundreds of deals including dollar sales of , technology & IP licenses and complex Bryan Coapstick Technology Platform Guided and delivered mobile strategies to digitally transform operations at Marriott, Deloitte, and Kapil Israni CTO Kapil is a serial entrepreneur with deep experience building and scaling complex technical ​ A repeat founder, Kapil spent nearly ten years building technical products for Fortune companies at IBM before founding Doorman to disrupt the logistics Stephen Kelly Strategic R&D Led $800M contract research P&L at Battelle managed IP generation and commercialization across 1,000+ patent Sam Dinte Team & Strategy executive search former management consultant supporting strategy & growth in The easiest way to Buy, Sell & Manage Intellectual © Tradespace, All rights   Technology Scouting | Tradespace Solutions About Resources More Sign In Cut through the With Tradespace you can instantly search and analyze millions of patents to find the right technology for your Get Started Request a Demo TRY FOR 7 FREE! Technology has Technology scouting should As companies increasingly look to , labs, and universities for technology, tech scouting has becomes a competitive However, most technology scouting is still done the way it was years Our IP Platform supplements traditional tech scouting approaches with We use millions of patents to identify emerging technologies and companies - before your We analyze how well a patent compliments your existing portfolio so you can spend more time evaluating high impact technologies and building effective commercialization CUSTOMER STORIES Maintaining an edge in the aircraft market with Printing Tradespace enabled a leading military aircraft company to: ​ Find and analyze ,000 additive manufacturing Shorten its screening process from one month to two days . Identify technologies it had previously ​ The Context ​ The Aerospace and Defense (A&D) industry has become increasingly competitive due to consolidation, new business models, and the increased pace of technology Companies need to supplement internal R&D by working with innovative partners like universities, labs, and startups to access emerging As more companies realize this, competition for access to cutting edge technology providers has become increasingly To be successful, companies need to find technologies before their competitors and identify partners outside of traditional hubs like Silicon In doing so they need ways to quickly analyze thousands of technologies and companies to focus their effort on a small number of relevant ​ The Problem ​ AirplaneCo is the leading provider of military aircraft to the US Although they have been the government’s supplier of choice for decades, their competitors have invested heavily in new technology to lower costs and increase production To keep pace, AirplaneCo decided to invest in additive manufacturing to build cheaper, stronger airplane However, AirplaneCo needed to figure out which additive manufacturing technologies aligned with their existing portfolio AND positioned them to grow in the Additionally, AirplaneCo needed visibility into which companies and labs were developing additive manufacturing While they already received thousands of deals per month, they had no way to cut through the noise and figure out which technologies actually met their Companies need to find technologies before their competitors and identify partners outside of traditional hubs like Silicon How Tradespace Helped ​ By using Tradespace to look at market trends and strategic fit, AirplaneCo improved their strategic upside by focusing on a subset of additive manufacturing technologies - machine ""AirplaneCo improved their strategic upside by focusing on a subset of additive manufacturing "" They also realized they could also use Tradespace to quickly develop a list of all companies, universities, and labs with the right types of additive manufacturing Once they had built a list of over 2,500 potential investment targets, they worked with the Tradespace team to develop a set of metrics to evaluate those targets and prioritize the Using metrics like company size, revenue, location, tec",startup,"{'status': '200', 'available': True, 'url': 'http://web.archive.org/web/20191228013852/https://www.tradespace.io/', 'timestamp': '20191228013852'}",20191228013852.0,1.0
http://www.aframebrands.com,434,crunchbase," | Made for real life FOR NEWS AND UPDATES SIGN UP HERE houses a collection of , sustainable Founded by Ari Bloom in partnership with Columbia Care, is a Los Angeles based holding company that develops innovative, consumer packaged Focused on utilizing federally legal hemp components & raw materials, is on a mission to launch scalable, , global brands made for real Follow and visit our first brand Follow and visit our first brand ",startup,"{'status': '200', 'available': True, 'url': 'http://web.archive.org/web/20201022203351/https://aframebrands.com/', 'timestamp': '20201022203351'}",20201022203351.0,1.0
https://www.textvolt.com,2142,crunchbase," Compliance | Volt Products How to Use SMS Compliance Sign In Schedule a Consultation What is ? Carriers developed regulations to help eliminate spam and clean up The newest standards for text messaging, these rules help turn texting into a commercially viable Schedule a Consultation Why is important? The benefits include higher SMS deliverability, higher message volume, cost savings on short code, and an extended longevity for the performance of SMS as a performance Although the benefits are great, brands risk discontinued service or fines of up to if they fail to register properly or abide by campaign The Guide: What you need to know How we help: We keep you From number registration to delivery, we help manage We help keep carriers Avoid fines and service disruptions from We track and stay on top of As you build campaigns, our product flags compliance Ready to get started? Schedule a Consultation Â© All rights   Volt | The Future of Compliant Texting Products How to Use SMS Compliance Sign In Schedule a Consultation The future of â compliant texting . The Volt texting platform empowers you to connect with customers . Shorten sales cycles, increase conversion rates, and build lifelong customer Schedule a Consultation Companies trust Built on compliance and transparency, Volt protects brands and delivers a positive, authentic % delivery rate % engagement rate Our products send and deliver No Code SMS Platform Accelerate performance with an SMS channel that drives With checks, you increase deliverability and avoid Learn More Learn about the future of clean text Find out how to implement SMS as a new channel and the importance of compliance to effectively deliver big Compliance SMS as a Growth Channel Ready to get started? Schedule a Consultation Â© All rights   Schedule a Consultation | Volt Products How to Use SMS Compliance Sign In Schedule a Consultation Get Started Thank you! Your submission has been Oops! Something went wrong while submitting the No Code SMS Platform Local numbers at scale Avoid fines Unparalleled support Transparent deliverability spend Sustaining revenue performance Â© All rights ",startup,"{'status': '200', 'available': True, 'url': 'http://web.archive.org/web/20211218182702/https://www.textvolt.com/', 'timestamp': '20211218182702'}",20211218182702.0,1.0
http://www.ringlogix.com,10937,crunchbase,"RingLogix | White Label VoIP Services For Resellers With YOUR Brand RESELLER PLATFORM SOLUTIONS MSPs Interconnects Agents & VARs SERVICES SIP Trunking Hosted PBX Hosted Call Center UCaaS BLOG Partner Login Request Demo RESELLER PLATFORM SOLUTIONS MSPs Interconnects Agents & VARs SERVICES PARTNER LOGIN REQUEST DEMO Sell the Services Your Customers Want With YOUR BRAND on it Schedule a Demo SIP Trunking Support any customer and enhance their service with features like Never Busy™ Call Bursting and Always On™ Inbound Compatible with all: ’s Legacy Phone Systems Analog Telephone Adapters (ATAs) FXS Gateways PRI Gateways Any SIP Device Learn More Hosted PBX Scalable, Flexible, Our white label Hosted PBX solution is packed with features and benefits that hosted PBX resellers need to The RingLogix Hosted PBX platform is truly and compatible with all major IP Phone Take a Test Drive Hosted Call Center Offer an excellent customer experience with intelligent call routing, multiple CRM integrations, advanced reporting, and no significant hardware Learn More Unified Communications as a Service Stand out from the crowd with a hosted UCaaS solution that includes voice, video, chat, presence, web apps, mobile apps, call control, webRTC and Learn More Mobile Applications Give your customers Android and IOS apps that let them make calls, listen to voicemail or read transcriptions, chat with and see their Schedule A Call IP Fax Provide your customers with a fax service that’s compatible with legacy fax machines and can include inbound Schedule A Call Audio Conferencing Support virtual conferences with local or access numbers, custom greetings, custom music on hold, name announcements and admin call Schedule A Call Subscribe to RingLogix via Email Email Mailing Address NW ST, Suite Miami Lakes, FL Company Info Blog About Us Contact Us Sitemap Partner Features Client Features Demo Privacy Policy © Copyright - RingLogix -   How White Label VoIP Works For MSPs | RingLogix RESELLER PLATFORM SOLUTIONS MSPs Interconnects Agents & VARs SERVICES SIP Trunking Hosted PBX Hosted Call Center UCaaS BLOG Partner Login Request Demo RESELLER PLATFORM SOLUTIONS MSPs Interconnects Agents & VARs SERVICES PARTNER LOGIN REQUEST DEMO Managed Service Providers Provide high value VoIP services to your customers, while earning recurring Built for partners Your customers depend on you for everything As phone solutions have transitioned to IP and the cloud, it’s only natural for most MSPs to begin offering and supporting systems and Take control of the situation and offer customers your own VoIP Gain control of the platform with a team built to support With white label VoIP solutions from RingLogix, you can sell your own branded VoIP services like Hosted PBX and SIP Everything from service creation, feature management, and service support is in your Benefits of white label VoIP from RingLogix: Collect the full revenue instead of waiting for small commissions Deliver services in minutes not weeks Work directly with our knowledgeable team for troubleshooting and support Enhance existing offerings with robust VoIP services like Hosted PBX and SIP Trunking Keep out competitive providers You Can Trust Here s What Our Partners Are John Lettieri President, TeleData Services, LLC ""Since signing up with RingLogix, I must say I am very happy and I have increased my net revenue to %. When I was signed up with third parties reselling their solution I was only generating %-18% If you are looking to brand your own solution, increase revenue streams and work with a top notch support team RingLogix is the company to "" Richard Bruce President, Dimensional Communications ""RingLogix really base their success on my We have never experienced anything like this with another vendor or With Ring Logix, I can enter my own port request and almost every request has been fulfilled within business days without any It has been This was the first product and vendor that we felt really "" John Pettus Business Development, CIU Networks ""Ring Logix is a great VoIP solution that we use for our clients in many different Setting up new accounts is a painless experience and we have more compatible hardware options versus our previous VoIP Support is always there for us when we need it and the Support team always follows Ring Logix is our preferred VoIP "" Brian Halbeisen CEO, RingGenius ""RingLogix really gives us everything we need to We looked at building our own network but but most of the VoIP switches and billing systems available just didn’t Plus they needed tons of integrations and customizations to meet our It was just too The fact that RingLogix just has EVERYTHING from service to features and quoting and It really helps us focus on sales vs building and maintaining all those "" Be your own provider Stop giving away , monthly recurring revenue With white label VoIP from RingLogix, offer your customers phone solutions under your own Our reseller platform gives you everything you need ",startup,"{'status': '200', 'available': True, 'url': 'http://web.archive.org/web/20191004040239/https://www.ringlogix.com/', 'timestamp': '20191004040239'}",20191004040239.0,1.0
https://www.bucha.bio,13803,crunchbase,"Wayback Machine We will keep fighting for all libraries - stand with us! Close banner 9 Days Left: All donations will be matched through December ! Your Donation Will Be Matched ! Can You Chip In? Please don t scroll past thisâthe Wayback Machine is fighting for universal access to quality The Internet Archive, which runs this project, relies on donations averaging $30.38 to help us keep the record We d be deeply grateful if you d join the one in a thousand users that support us Right now, we have a matching gift campaign that will double the impact of every We understand that not everyone can donate right now, but if you can afford to contribute this Saturday, we promise it will be put to good Our resources are crucial for knowledge lovers everywhereâso if you find all these bits and bytes useful, please pitch Your Donation Will Be Matched! Can You Chip In? Please don t scroll past thisâthe Wayback Machine is fighting to keep the record Right now, we have a matching gift campaign that will double the impact of every We understand that not everyone can donate right now, but if you can afford to contribute this Saturday, we promise it will be put to good If you find all these bits and bytes useful, please pitch Continue Remind Me Send me an email reminder Email address (required) Please enter a valid email First name Last name Submit By submitting, you agree to receive emails from the Internet Your privacy is important to We do not sell or trade your information with Internet Archive logo A line drawing of the Internet Archive headquarters building faÃ§ade. Donate icon An illustration of a heart shape ""Donate to the archive"" Search icon An illustration of a magnifying Search icon An illustration of a magnifying Upload icon An illustration of a horizontal line over an up pointing Upload User icon An illustration of a person s head and Sign up | Log in Web icon An illustration of a computer application window Wayback Machine Texts icon An illustration of an open Books Video icon An illustration of two cells of a film Video Audio icon An illustration of an audio Audio Software icon An illustration of a "" floppy Software Images icon An illustration of two Images Donate icon An illustration of a heart shape Donate Ellipses icon An illustration of text More Hamburger icon An icon used to represent a menu that can be toggled by interacting with this Internet Archive Audio Live Music Archive Librivox Free Audio Featured All Audio This Just In Grateful Dead Netlabels Old Time Radio RPMs and Cylinder Recordings Top Audio Books & Poetry Computers, Technology and Science Music, Arts & Culture News & Public Affairs Spirituality & Religion Podcasts Radio News Archive Images Metropolitan Museum Cleveland Museum of Art Featured All Images This Just In Flickr Commons Occupy Wall Street Flickr Cover Art USGS Maps Top NASA Images Solar System Collection Ames Research Center Software Internet Arcade Console Living Room Featured All Software This Just In Old School Emulation Games Historical Software Classic PC Games Software Library Top Kodi Archive and Support File Vintage Software APK Software Software Library Software Sites Tucows Software Library Shareware Software Capsules Compilation Images ZX Spectrum DOOM Level CD Books Books to Borrow Open Library Featured All Books All Texts This Just In Smithsonian Libraries FEDLINK (US) Genealogy Lincoln Collection Top American Libraries Canadian Libraries Universal Library Project Gutenberg Children s Library Biodiversity Heritage Library Books by Language Additional Collections Video TV News Understanding 9 11 Featured All Video This Just In Prelinger Archives Democracy Now! Occupy Wall Street TV NSA Clip Library Top Animation & Cartoons Arts & Music Computers & Technology Cultural & Academic Films Ephemeral Films Movies News & Public Affairs Spirituality & Religion Sports Videos Television Videogame Videos Vlogs Youth Media Search the history of over billion web pages on the Search the Wayback Machine Search icon An illustration of a magnifying Mobile Apps Wayback Machine (iOS) Wayback Machine (Android) Browser Extensions Chrome Firefox Safari Edge Subscription Explore the Collections Learn More Build Collections Save Page Now Capture a web page as it appears now for use as a trusted citation in the Please enter a valid web address About Blog Projects Help Donate Contact Jobs Volunteer People Sign up for free Log in Search metadata Search text contents Search TV news captions Search radio transcripts Search archived web sites Advanced Search About Blog Projects Help Donate Donate icon An illustration of a heart shape Contact Jobs Volunteer People DONATE Latest Show All The Wayback Machine has not archived that Click here to search for all archived pages under https: bucha.bio . The Wayback Machine requires your browser to support JavaScript, please email if you have any questions about The Wayback Machine is an initiative of the Internet Archive , a (c)(3) , building a dig",startup,"{'status': '200', 'available': True, 'url': 'http://web.archive.org/web/20211021012255/https://bucha.bio/', 'timestamp': '20211021012255'}",20211021012255.0,1.0
