website,text_len,source,text,type,closest_snapshot,closest_snapshot_time,snapshot_in_window
https://www.pureprairiepoultry.com,12955,crunchbase,"Media - Pure Prairie Poultry Media - Pure Prairie Poultry Home Our People News & Events News The Farmer Partner Appreciation Luncheon August July Parade, Media Blog Careers Media Future Building Expansion & Remodel Renderings CONTACT US If you have questions, or are in need of a Pure Prairie Poultry contact, please send an email to . © Pure Prairie Poultry All Rights Reserved   The Farmer Partner Appreciation Luncheon August - Pure Prairie Poultry The Farmer Partner Appreciation Luncheon August - Pure Prairie Poultry Home Our People News & Events News The Farmer Partner Appreciation Luncheon August July Parade, Media Blog Careers The Farmer Partner Appreciation Luncheon August Charles City, Iowa The team welcomed the Farmer Partner Families for a day of plant tours, business updates and breaking bread CONTACT US If you have questions, or are in need of a Pure Prairie Poultry contact, please send an email to . © Pure Prairie Poultry All Rights Reserved   Our Leadership Team - Pure Prairie Poultry Our Leadership Team - Pure Prairie Poultry Home Our People News & Events News The Farmer Partner Appreciation Luncheon August July Parade, Media Blog Careers Our Leadership Team BRIAN Roelofs President & Chief Executive Officer Brian is a highly experienced food executive with more than years of goods experience and more than years of poultry experience at the executive Brian specializes in building culture, strategy, and profitable growth Prior to joining the Pure Prairie Poultry team, Brian served as Vice President of Sales at GNP Company, where he had a track record of delivering results through During Brian’s tenure at GNP Company, he and his team grew sales from $225 million to $450 million dollars prior to its $350-million-dollar sale to Pilgrim’s Pride A collaborative leader with the ability to build, train, motivate and mentor highly successful, teams to outstanding performance, Brian has substantial experience in strategic planning, production planning, warehouse and distribution management, sales and marketing, and brand Brian received his Master of Business Administration from the University of Thomas, and his Bachelor of Science degree from the University of Wisconsin, GEORGE Peichel Chief Financial Officer A Minnesota native, George is an experienced professional with over years of financial experience in building businesses in the meat and agribusiness Prior to joining Pure Prairie Poultry, George served as Chief Executive Officer for Prairie’s Best Farms, where he produced results through his leadership and sound business In his years of overseeing poultry farming and live operations at Prairie’s Best Farms, he helped to create and manage a live network of barns and square feet through his In addition to agriculture, George had spent a significant amount of his career in banking, followed by a senior leadership role at Christensen Farms, where he led the company’s impactful expansion and advancement Through executing robust strategies within his role, George helped to increase revenue from $30 million to dollars within seven George is a graduate of the University of Minnesota, and he, along with his wife, Mary, operate a hog finishing ANITA Janssen Vice President of Strategic Initiatives Anita is a passionate, experienced entrepreneur, executive coach, and consultant, who has built and led numerous successful businesses in equine, real estate, and agribusiness over three This includes the and launching of a $100-million- dollar agribusiness in Through these experiences, Anita has successfully built brands, teams, and growth strategies while aligning key players and plans through facilitation of the Entrepreneurial Operating System (EOS). Prior to joining Pure Prairie Poultry, Anita Prairie’s Best Farms, whose mission was to produce unique, natural, proteins, strengthen family farms, promote humane livestock production, and produce innovative consumer A graduate of Cloud State University where she earned a Bachelor of Arts degree in public relations and marketing, Anita and her husband own and operate a ranch, where they breed high performing cutting American Quarter Horses and background cattle for further feedlot BOB Wolfe Chief Operations Officer native of International Falls, Minnesota, Bob brings more than years of senior executive chicken industry leadership and experience to his role with Pure Prairie After serving his country in the Marine Corps, Bob began his poultry career at the ground level, in live receiving for Zacky Farms, where he subsequently learned his way to the top through experience in nearly every aspect of poultry Since that time, Bob has held leadership positions with Draper Valley, AgriStats, Petaluma Poultry, Pitman Farms, and chicken integrator, Foster Bob is proud to have played an instrumental role in numerous poultry industry firsts, including the first organic chicken, free range and chicken, and recognition for sustainability efforts while at Petaluma Bob’s industry br",startup,"{'status': '200', 'available': True, 'url': 'http://web.archive.org/web/20230321085118/https://www.pureprairiepoultry.com/', 'timestamp': '20230321085118'}",20230321085118.0,1.0
https://www.prog.ai/,2261,crunchbase," â The World s Most Complete Database for Hiring Software Developers !--Start of The worldâs most complete database for hiring software developers The worldâs â most complete database for hiring software developers Data Platform for Sourcing and Hiring Tech Talent million active software developers in over countries Analysis of programming source code Automatically match your job description to candidates Get access Choose how far you want to go with us Candidate List Generation A list of up to 3,000 candidates with contact Candidates fit your job You can reach out to these candidates $ 1 Per candidate Outreach Service We reach out to candidates on your behalf, and bring you only those who are interested in an interview $ Per 1 lead, or % of annual compensation of the hired candidate candidates In addition to the outreach service, we run technical and behavior interviews for you, and send you the Reach out to learn more Get access Our process Complete the form below We will have a quick call with you to make sure we understand the requirements Select the solution that best suits your needs Get access What our customers are saying Davit Buniatyan CEO and founder of âWe were looking for candidates with a strong background in database systems design and internals, these are technical requirements most recruiters donât understand and cannot IMO, the quality of the candidates from ProgAI is definitely above average, maybe top 5%-10%, compared to other agenciesâ Leonid Lukyanov CEO Â and of âWeâve got super relevant candidates to interview within the first two weeks of working with ProgAI!â Artem Harutyunyan CTO Â and of âWe were looking for engineers who can program for browsers: built complex browser extensions ProgAI has a deep insight into candidatesâs technical skills by analyzing their open source Thanks to that, ProgAI has brought us excellent candidates I would never thought to reach out myself by looking at LinkedIn profilesâ Omar Shams CEO and founder of âI was looking to hire a founding engineer with ML background and ProgAI has generated a perfectly targeted list of 1,000  Ivan Shcheklein CTO Â and of âDefinitely much more targeted candidates for what we are looking forâ Contact us ",startup,"{'status': '200', 'available': True, 'url': 'http://web.archive.org/web/20221102190409/https://prog.ai/', 'timestamp': '20221102190409'}",20221102190409.0,1.0
https://camlanngames.com/,4406,crunchbase," Our Games - Camlann Games Camlann Games An Indie Game Publisher that Performs Home About How We’re Different Our Games Discord Ascent of Ashes Discord Birth of Cultures Discord Blog Contact Pitch Your Game Camlann Games An Indie Game Publisher that Performs Home About How We’re Different Our Games Discord Ascent of Ashes Discord Birth of Cultures Discord Blog Contact Pitch Your Game Our Games Birth of Cultures Ascent of Ashes 0 + Years Independent Game Publishing Experience 0 + Press Relationships 0 + Festival Relationships 0 + Content Creators Relationships Ready to Pitch to Us? Pitch Your Game Home How we re different Our Games Pitch to Us Contact Privacy Policy Terms of Use Twitter Youtube Tiktok Discord Web & Logo Design by wolfdesigns © Shopping Basket Home How We’re Different Our Games AoA Discord BoC Steam Blog Contact Pitch to Us Menu Home How We’re Different Our Games AoA Discord BoC Steam Blog Contact Pitch to Us   Blog - Camlann Games Camlann Games An Indie Game Publisher that Performs Home About How We’re Different Our Games Discord Ascent of Ashes Discord Birth of Cultures Discord Blog Contact Pitch Your Game Camlann Games An Indie Game Publisher that Performs Home About How We’re Different Our Games Discord Ascent of Ashes Discord Birth of Cultures Discord Blog Contact Pitch Your Game blog A Decline in China’s Gaming Industry July , Read More Best Upcoming Indie PC Games July , Read More Launching a Game in Early Access: Pros and Cons July , Read More Unity vs Unreal Engine – Which One is Right for Your Indie Game? July 5, Read More Upcoming Industry Events in Indie Gaming June , Read More Home How we re different Our Games Pitch to Us Contact Privacy Policy Terms of Use Twitter Youtube Tiktok Discord Web & Logo Design by wolfdesigns © Shopping Basket Home How We’re Different Our Games AoA Discord BoC Steam Blog Contact Pitch to Us Menu Home How We’re Different Our Games AoA Discord BoC Steam Blog Contact Pitch to Us   Home - Camlann Games Camlann Games An Indie Game Publisher that Performs Home About How We’re Different Our Games Discord Ascent of Ashes Discord Birth of Cultures Discord Blog Contact Pitch Your Game Camlann Games An Indie Game Publisher that Performs Home About How We’re Different Our Games Discord Ascent of Ashes Discord Birth of Cultures Discord Blog Contact Pitch Your Game We re Camlann Games An Indie Game Publisher That Performs We back passionate developers, vibrant worlds and the most unforgettable stories ever told in indie PC games Our G ames Birth of Cultures Ascent of Ashes Wishlist on Steam Wishlist on Steam Featured on PCGamer We re So Why Should You W ork With Us? Learn more 0 + Years Independent Game Publishing Experience 0 + Press Relationships 0 + Festival Relationships 0 + Content Creators Relationships Our P artners Previous Next Press Part ners Festival Part ners Content C reators Our Team Slava Heretz CEO & Executive Producer 7+ Years Marketing & PR Agency Exec Clients saw average ROAS and % YoY revenue growth Has played and completed more than PC Games in his lifetime Anna Walker Producer + Years AA Indie game producer Has overseen + game sales on Steam, GOG and publisher site Obsessed with everything RPG and games Ready to Pitch to Us? Pitch Your Game Home How we re different Our Games Pitch to Us Contact Privacy Policy Terms of Use Twitter Youtube Tiktok Discord Web & Logo Design by wolfdesigns © Shopping Basket Home How We’re Different Our Games AoA Discord BoC Steam Blog Contact Pitch to Us Menu Home How We’re Different Our Games AoA Discord BoC Steam Blog Contact Pitch to Us   Contact - Camlann Games Camlann Games An Indie Game Publisher that Performs Home About How We’re Different Our Games Discord Ascent of Ashes Discord Birth of Cultures Discord Blog Contact Pitch Your Game Camlann Games An Indie Game Publisher that Performs Home About How We’re Different Our Games Discord Ascent of Ashes Discord Birth of Cultures Discord Blog Contact Pitch Your Game Get in T ouch Join Our C ommunity Discord channel Ready to Pitch to Us? Pitch Your Game Home How we re different Our Games Pitch to Us Contact Privacy Policy Terms of Use Twitter Youtube Tiktok Discord Web & Logo Design by wolfdesigns © Shopping Basket Home How We’re Different Our Games AoA Discord BoC Steam Blog Contact Pitch to Us Menu Home How We’re Different Our Games AoA Discord BoC Steam Blog Contact Pitch to Us ",startup,"{'status': '200', 'available': True, 'url': 'http://web.archive.org/web/20221207201945/https://camlanngames.com/', 'timestamp': '20221207201945'}",20221207201945.0,1.0
https://www.joinbond.co/,8929,crunchbase,"BOND | Privacy Policy About About HOME Home Home Home Privacy Policy (U.S.) Last Updated: April , â Capitalized terms not defined in this Privacy Notice have the meanings given to them in the Terms of Service (the âTermsâ). Bond Shop, (âBOND,â âwe,â âus,â or âourâ) grants access to the BOND mobile application (the âBOND Appâ) and BOND Services subject to this Privacy The BOND App and Bond Services together are the âServices.â Â We may make changes to this Privacy Notice, and so be sure to check back from time to Each version of this Privacy Notice will be indicated by the last updated date at the By accessing the Services after we make any such changes to this Privacy Policy, you are deemed to have accepted such You must be at least years old to use the If you are under the age of majority in your state of residence (a minor), please do not give us any personal We encourage parents and legal guardians to monitor their childrenâs mobile and Internet usage and to help enforce our Privacy Notice by instructing their children to never provide personal information without their We may delete and terminate your account or block your access to the Services without warning if we believe that you are a If you have reason to believe that a minor has provided personal information to us, please contact us at , and we will endeavor to delete that information from our â INFORMATION WE COLLECT AND HOW WE USE IT While operating the Services, BOND collects or receives the following types of information: Your Contact Information When you create an account on the Services, we ask for your name, email address and a BOND We use such contact information to communicate with you in connection with your use of the Services, such as to help you retrieve your password, to provide customer support related to the Services, and on connection with similar transactional communications with We collect the referring URL from which you reached the Services (a âReferring URLâ), such as Instagram, Tik Tok, an advertisement for our Services or the BOND landing A Referring URL does not include personal data that identifies you or which could be used to identify Geolocational Information We may, with your consent, automatically collect geolocation information from your mobile This consent may be provided by you on the device level (e.g., you have consented to location services generally) or by accepting our request for geolocation access on the Please consult your mobile deviceâs documentation regarding how to turn off location services for the BOND Onward Transfer to Service We may share the information that we collect about you with third parties to help run our Services and to analyze your use of the Services, but only to the extent needed for them to provide such The types of companies that may receive personal information and their functions are hosting services, technical assistance, database management back-up services, use analytics, email marketing platforms, and customer We may also disclose personal information to our parent companies, subsidiaries, affiliates, joint ventures, or other companies under common control in order in connection with providing the Services to â BILLING INFORMATION . If you elect to purchase an Item from a Merchant, you will be required to provide certain billing information, such as your credit card number, expiration date, bank account information, billing address, activation code, and similar information (collectively, âBilling Informationâ) to a payment BOND does not collect, store, process, transmit or maintain Billing If you request a refund from a Merchant, the payment vendor will process the reversal of charges from the â BUSINESS TRANSFERS In the event of a merger, dissolution, reorganization or similar corporate event, or the sale of all or substantially all our assets, we expect that the information that we have collected, including personal information, would be transferred to the surviving entity in a merger or the acquiring All such transfers shall be subject to our commitments with respect to the privacy and confidentiality of such personal information as set forth in this Privacy â DISCLOSURE TO PUBLIC AUTHORITIES We are required to disclose personal information in response to lawful requests by public authorities, including for the purpose of meeting national security or law enforcement We may also disclose personal information to other third parties when compelled to do so by government authorities or required by law or regulation including, but not limited to, in response to court orders and â AGGREGATE DATA In an ongoing effort to better understand our users and the Services, we might analyze your information in aggregate form to operate, maintain, manage, and improve one or all of This aggregate information does not identify you We may share this aggregate data with our affiliates, agents, and business We may also disclose aggregated use",startup,"{'status': '200', 'available': True, 'url': 'http://web.archive.org/web/20230331095154/https://joinbond.co/', 'timestamp': '20230331095154'}",20230331095154.0,1.0
https://www.digitalex.io/,2217,crunchbase," DigitalEx - Real Time Hybrid and FinOps Control Plane Platform Features Solutions Customers Partners Pricing Contact Us Real Time Hybrid and FinOps Control Plane Move away from rear view mirror approach to managing enterprise infrastructure and cloud resources Get a unified picture of your Kubernetes and cloud resources from a hybrid control plane spanning AWS, Azure, Google and Within minutes, cut your AWS, Google and Azure bills by % or more with DigitalEx FinOps SaaS Continuously optimize your Kubernetes and cloud resource usage to % or more from a intelligent hybrid control plane spanning AWS, Azure, Google and Supported cloud and platforms Hereâs how DigitalEx hybrid control plane works Connect to AWS, Azure and Google in Use our templates to connect to VMWare ESX and Redhat OpenShift Use a choice of automation technologies to onboard cloud accounts and resources: AWS: manual, CloudFormation, Terraform GCP: manual, CloudShell script Azure: manual, CloudShell script Our MSP partners connect your environments to DigitalEx control plane in days weeks using our quick start automation Observe your cloud cost behavior Observe your cost trends and understand the root cause of why the costs are Correlate workload costs to internal behavior of your infrastructure Automatically understand cost allocation for ITOps, DevOps and application For each application, observe and control your Kubernetes resources and cost control across clouds and environments Single cloud to hybrid Kubernetes and applications have hundreds of resources, most of which are unallocated and lack They are not organized and itâs hard for human to structure and manage DigitalEx hybrid Kubernetes control plane provides a robust solution to continuously organize, view and comprehensively manage capacity spanning Kubernetes clusters, cloud infrastructure, cloud services and View All Features Simple access Custom dashboard API access Alert & reporting Optimize & save Rightsize resources Join other companies around the world Get visibility and Cut your AWS, Google and Azure bills by % or more within Copyright Â© DigitalEx, All rights About Us Contact Us Terms of Use Privacy Policy Cookie Policy Platform Guidelines ",startup,"{'status': '200', 'available': True, 'url': 'http://web.archive.org/web/20221201201146/https://www.digitalex.io/', 'timestamp': '20221201201146'}",20221201201146.0,1.0
https://www.bluestarenergycapital.com/,2221,crunchbase," Portfolio | Bluestar Energy Capital Home About Us Portfolio Media Careers Contact Us More Use tab to navigate through the menu Bluestar Energy Capital is actively developing projects in North America and Australia via our regional We are always interested to evaluate new projects and platform investment P lease contact us here . Nova Clean Energy Nova Clean Energy is our North America focused development Founded by Bluestar and institutional investment partners in , Nova is currently pursuing wind, solar, and storage development in a variety of US For more information click here . Bluestar Energy Australia Bluestar Energy Australia is focused on wind, solar, and storage in Victoria, New South Wales, and Follow Us Return to Top Privacy Policy © Bluestar Energy Capital Powered by Palm Canyon Digital Contact Us Bluestar Energy Capital, LLC West Wacker Drive, Suite Chicago, IL   Contact Us | Bluestar Energy Capital Home About Us Portfolio Media Careers Contact Us More Use tab to navigate through the menu Contact Us Bluestar Energy Capital, LLC West Wacker Drive, Suite Chicago, IL Send us a message and we’ll get back to you Email Subject Your message Send Thanks for submitting! Follow Us Return to Top Privacy Policy © Bluestar Energy Capital Powered by Palm Canyon Digital Contact Us Bluestar Energy Capital, LLC West Wacker Drive, Suite Chicago, IL   Media | Bluestar Energy Capital | Clean Energy Home About Us Portfolio Media Careers Contact Us More Use tab to navigate through the menu Media Press Release - September , Declan Flanagan, former Orsted Onshore CEO, Launches Global Renewable Energy Platform Bluestar Energy Capital with $100 Million in Initial Read more Follow Us Return to Top Privacy Policy © Bluestar Energy Capital Powered by Palm Canyon Digital Contact Us Bluestar Energy Capital, LLC West Wacker Drive, Suite Chicago, IL   Home | Bluestar Energy Capital | Energy Transition Home About Us Portfolio Media Careers Contact Us More Use tab to navigate through the menu Global Investors in the Energy Transition Follow Us Return to Top Privacy Policy © Bluestar Energy Capital Powered by Palm Canyon Digital Contact Us Bluestar Energy Capital, LLC West Wacker Drive, Suite Chicago, IL ",startup,"{'status': '200', 'available': True, 'url': 'http://web.archive.org/web/20221204111952/https://www.bluestarenergycapital.com/', 'timestamp': '20221204111952'}",20221204111952.0,1.0
