website,text_len,source,text,type,closest_snapshot,closest_snapshot_time,snapshot_in_window
https://capteriscapital.com,8065,crunchbase,"Doug Sylvia - capteris Skip to content Doug Sylvia Chief Risk Officer As Capteris Capital’s Chief Risk Officer, Doug is responsible for the leadership of risk strategy, underwriting, portfolio management and asset Doug brings over years of experience in the equipment finance industry across multiple industries and collateral Prior to joining the company, Doug was the Chief Risk Officer at Wingspire Equipment Finance, working with other functions to launch the equipment finance Before Wingspire, Doug spent years at GE Capital in risk roles of increasing responsibility at various business After GE Capital, Doug spent 5 years at Wells Fargo Equipment Finance as SVP, Lending Manager of the Food, Agriculture and Beverage Doug earned his BS degree in Justice and Law Administration from Western Connecticut State University and an MBA from Marist © All rights reserved Neve | Powered by WordPress   Lance Rhodes - capteris Skip to content Lance Rhodes Managing Director of Capital Markets As Managing Director of Capital Markets, Lance is responsible for developing and implementing the firm’s capital markets initiatives which include maintaining, developing and growing institutional investor relationships to foster new originations and portfolio Lance has over years of commercial finance experience with a diverse background that includes extensive experience leading capital markets, sales and structuring His deal experience covers a wide spectrum of asset classes, platforms and Before joining Capteris in , Lance was Head of Equipment Syndications for BMO Harris Equipment Finance Company, where he managed a national team of capital markets originators focused on the acquisition of indirect secured loans and In addition, he managed all initiatives of the firm through partnering with large corporate and middle market originators to source and close syndicated equipment finance Prior to his time at BMO Harris, Lance spent years with GE Capital, where he held a series of roles of increasing responsibility and was most recently a Senior Vice President within GE’s Capital Markets Lance earned his Bachelor of Science degree in Business Administration (Finance) from Villanova University and his Master of Business Administration (MBA) degree from Loyola College in © All rights reserved Neve | Powered by WordPress   Eric Dusch - capteris Skip to content Eric Dusch President As President of Capteris, Eric oversees all aspects of the equipment finance business with a passion for driving innovative growth and His responsibilities include sales, risk, capital markets, customer success, marketing, business development, sales enablement and digital Eric brings over years of experience in financial services with roles of increasing responsibilities at both PNC Financial Services and GE Capital, where he spent the majority of his professional Eric’s diverse professional experiences include successfully building and scaling several North American and global equipment finance In addition, Eric has held leadership positions across numerous business lines including corporate finance, lending, private equity, and treasury His various roles include Executive Vice President, Global Chief Revenue Officer, Chief Commercial Officer, Chief Marketing Officer, Head of Sales Enablement and Global Enterprise Managing Eric received a BS in Business Administration and Finance from Wake Forest University in North He completed GE’s Global Leadership Development program, Six Sigma certification, as well as the executive professional development series at GE’s Jack Welch Executive Leadership Eric is an active member of the Equipment Lease and Finance © All rights reserved Neve | Powered by WordPress   Brian Nethercott - capteris Skip to content Brian Nethercott Chief Operating Officer As the Chief Operating Officer for Capteris, Brian Nethercott oversees critical business functions including operations, finance, pricing and Brian has a proven track record as a trusted advisor in the with a demonstrated ability to lead complex organizations through transformative change while consistently delivering superior operating Before joining Capteris in , Brian was the Commercial Leader for MUFG’s Supply Chain Finance business, which was acquired from GE Capital in In that capacity, Brian led a team of program managers to build a dedicated bank platform focused on supply chain This team was focused on working with the CFOs and Treasurers of Fortune companies to drive working capital Prior to his time at MUFG, Brian had a + year career with GE Capital, where he held a series of roles of with increasing responsibility culminating in several GE Capital executive finance and commercial positions in the equipment and commercial lending Brian earned his BS and MBA degrees in Finance from Marist Additionally, he is a graduate of GE’s Experienced Financial Leadership Program (EFLP). © All rights reserved Neve | Powered by WordPress   Home - capteris Skip to content The Next ",startup,"{'status': '200', 'available': True, 'url': 'http://web.archive.org/web/20221208133311/https://capteriscapital.com/', 'timestamp': '20221208133311'}",20221208133311.0,1.0
https://www.precedent.com/,19320,crunchbase,"Litigation Optimization | Precedent Skip to content Home Products Monitor Automate Guide Reveal Benchmark Company About Leadership Careers Contact Menu Home Products Monitor Automate Guide Reveal Benchmark Company About Leadership Careers Contact Litigation Optimization Utilizing industry intelligence We find the optimal counsel match for your case particulars and provide you with a strategy to reach the best Through a blend of carrier and industry data, party data, and watchlists, Precedent provides recommendations on strategy and subsequent activities, including bill review, independent medical examination assignment, counsel selection, and Precedent Litigation Optimization provides highly accurate recommendations on: Defense counsel selection Settlement ranges based on historic behavior Escalation strategies Answering these questions can improve the negotiating process while reducing costs and minimizing indemnity in Precedent Litigation Optimization Improves Litigation Outcomes Adopting an objective, litigation strategy increases effectiveness while reducing unfavorable By combining Precedent Litigation Optimization with human judgment, insurers can reduce bodily injury exposure where it is most severe in litigated This highly informed approach builds a strong foundation to support the handling of Interested in Learning More about Precedent Litigation Optimization? Precedent is pleased to support insurers We are here to provide the help you need to automate injury claims processing with Contact us today by filling out our online form to see how we can help you drive better results with emerging data using our benchmarking With us, we’ll provide the fastest, most impactful, and most reliable results in the Impact You Can Measure 3% Injury Severity Reduction, % Demand and Time Limit Identification Accuracy Contact us Follow us Products Monitor Automate Guide Reveal Benchmark Monitor Automate Guide Reveal Benchmark Company About Leadership Careers About Leadership Careers Resources ©2023 PRECEDENT | All Rights First name: Last name: Title: Company: Email: Phone: Note: X   Correspondence Reveal | Precedent Skip to content Home Products Monitor Automate Guide Reveal Benchmark Company About Leadership Careers Contact Menu Home Products Monitor Automate Guide Reveal Benchmark Company About Leadership Careers Contact Reveal Correspondence Reveal Demand management is a critical business process of any insurance company, which starts with identifying demands and ends with settlement payment to an insured Precedent s Reveal streamlines manual workflow by decreasing the time required to search and review demands before handling a This, in turn, reduces labor costs via automation while ensuring fair and reasonable outcome Below is an example of Precedent’s demand correspondence Reveal: Provides management with demand oversight and analysis​ Tracks how many demands were received per day and their exposure Uses powerful search capabilities across both open and closed demands An comprehensive summary of a demand before you review it Precedent’s Reveal Dashboard Easily consolidate data and review demands with a flexible portal that helps you act in and operate more Searching and reviewing demands are often costly and With Precedent Reveal, human errors are reduced, and productivity is increased without adding This allows your company to reduce costs associated with routine, mundane work and refocus employees on more productive Our technology also provides oversight and analysis of information faster than humans, with significantly greater As a result, employees won’t have to spend hours searching for information across different Comprehensive Summaries If you currently rely on typical administration software, you know how frustrating and it can be to go through demand Demand letters are also hard to keep up with, limiting employee Precedent Reveal will help your employees complete various operations without having to do extensive navigation across multiple applications, saving considerable time in the We make this possible by automatically tracking demands and providing comprehensive summaries before it’s It also provides powerful search capabilities that allow you to search for things like injury type, attorney, industry outcomes, and This enables your team to make demand correspondence decisions quickly and Interested in Learning More about Precedent Reveal? Keep track of demands and the critical information they contain with Precedent Contact us today by filling out our online form to learn how to track and analyze claimant’s demand letters while improving claims Impact You Can Measure 3% Injury Severity Reduction, % Demand and Time Limit Identification Accuracy Contact us Follow us Products Monitor Automate Guide Reveal Benchmark Monitor Automate Guide Reveal Benchmark Company About Leadership Careers About Leadership Careers Resources ©2023 PRECEDENT | All Rights First name: Last name: Title: Company: Email: Phone",startup,"{'status': '200', 'available': True, 'url': 'http://web.archive.org/web/20230326023056/https://www.precedent.com/', 'timestamp': '20230326023056'}",20230326023056.0,1.0
https://www.shovels.ai,5359,crunchbase,"Shovels - For Builders Shovels Menu For Banks For Builders For Climate Blog About Us Dashboard We help you expand your contractor network Work with the best contractors no matter where you build Email address Subscribe Shovels analyzes permits and inspections so you can hire the best contractors for your jobs We re introducing new metrics to the construction industry Construction speed (noun) The difference in time between the permit issuance and final inspection, divided by the total square footage of a This is a metric computed by Shovels and is used by banks and builders to evaluate contractor Inspection pass rate (noun) The number of inspections passed divided by the sum of the number of inspections passed and the number of inspections The inspection pass rate can be calculated for one or all projects completed by a This metric is also computed by Shovels and is used by banks and builders to evaluate contractor Download our daily feed of new contractor data Browse contractors with our user interface Incorporate our API into your web application Get early access now Diablo Blvd Unit #51, Lafayette, CA (800) Terms of Use | Privacy Policy © Shovels, All rights   Shovels - For Climate Shovels Menu For Banks For Builders For Climate Blog About Us Dashboard We track the proliferation of green building We can tell you where it s happening and who s doing Email address Subscribe Shovels tracks every solar, EV charger, heat pump HVAC, and battery installation Download our daily feed of new contractor data Browse contractors with our user interface Incorporate our API into your web application Get early access now Diablo Blvd Unit #51, Lafayette, CA (800) Terms of Use | Privacy Policy © Shovels, All rights   Shovels - For Banks Shovels Menu For Banks For Builders For Climate Blog About Us Dashboard We help you your construction loans Avoid underwriting poor performers who build slow projects Email address Subscribe Shovels analyzes permits and inspections so you can predict loan performance We re introducing new metrics to the construction industry Construction speed (noun) The difference in time between the permit issuance and final inspection, divided by the total square footage of a This is a metric computed by Shovels and is used by banks and builders to evaluate contractor Inspection pass rate (noun) The number of inspections passed divided by the sum of the number of inspections passed and the number of inspections The inspection pass rate can be calculated for one or all projects completed by a This metric is also computed by Shovels and is used by banks and builders to evaluate contractor Download our daily feed of new contractor data Browse contractors with our user interface Incorporate our API into your web application Get early access now Diablo Blvd Unit #51, Lafayette, CA (800) Terms of Use | Privacy Policy © Shovels, All rights   Shovels Shovels Menu For Banks For Builders For Climate Blog About Us Dashboard The Shovels Blog We blog about permit data, inspection data, and contractor performance data and all things climate and green Tue December December Newsletter We have a better problem statement and understanding of our customers! Read full story Tue November Introduction to Shovels Shovels launched in November to bring more transparency into construction and building Read full story Get early access now Diablo Blvd Unit #51, Lafayette, CA (800) Terms of Use | Privacy Policy © Shovels, All rights   Shovels Shovels Menu For Banks For Builders For Climate Blog About Us Dashboard We use permit inspection data to evaluate contractors We harvest and analyze millions of permit and inspection records nationwide for builders and the banks who finance them Email address Subscribe The contractor discovery and evaluation process is still broken The contractor hiring experience is fraught with risk There s an agency problem in the trades contractors know more about their fit for a project than you do We know what good and bad contractors look like We re calculating new metrics like inspection pass rate and construction speed using public permit and inspection records We exist to contractor hiring and financing Millions of permit and inspection records inform our models and analyses Make Smarter Decisions With Shovels For Climate We track the proliferation of green building We can tell you where it s happening and who s doing Shovels for Climate For Builders We help you expand your contractor network Work with the best contractors no matter where you Shovels for Builders For Banks We help you your construction loans Avoid underwriting poor performers who build slow Shovels for Banks We are an DaaS that is built for data analysis Integrate with a single line of code Or ask us for daily CSV exports! $ curl "" API_KEY :X"" \ https: api.shovels.ai v1 contractors details.json?name= CONTRACTOR_ID ""name"": ""NEXTGEN EARTH INC"", ""street"": ""1326 WILSHIRE AVE"", ""city"": ""SANTA ANA"", ""zip"": ""92705"", ""state"": ""CA"", ""all_pro",startup,"{'status': '200', 'available': True, 'url': 'http://web.archive.org/web/20221201043852/https://www.shovels.ai/', 'timestamp': '20221201043852'}",20221201043852.0,1.0
https://www.graniteridge.com,2417,crunchbase," Portfolio - Granite Ridge Portfolio Leadership Investors Our Portfolio Permian 7,231 Acreage Production $933m Eagle Ford 6,582 Acreage MBoed Production $252m Bakken ,150 Acreage MBoed Production $163m Haynesville 2,298 Acreage MBoed Production $138m DJ Basin 1,475 Acreage MBoed Production $115m Contact McKinney Avenue, Suite Dallas, Texas T: Company Portfolio Leadership Investors Copyright Â© Granite Ridge Resources All Rights Terms of Use and Privacy Policy .   Leadership - Granite Ridge Portfolio Leadership Investors Leadership Our seasoned leadership team brings significant oil & gas experience across various Management Luke Brandenberg CEO Tyler Farquharson CFO Emily Fuquay Corporate Secretary Adam Griffin Eric Holley Ryan Riggelson Board of Directors Matt Miller Griffin Perry Thad Darden Director Kirk Lazarine Director Amanda Coussens Independent Director Michele Everard Independent Director John McCartney Independent Director Contact McKinney Avenue, Suite Dallas, Texas T: Company Portfolio Leadership Investors Copyright Â© Granite Ridge Resources All Rights Terms of Use and Privacy Policy .   Granite Ridge - Unlocking value in the oil & gas market Portfolio Leadership Investors Unlocking value in underserved areas of the oil & gas market Who We Are Granite Ridge is a premier, oil & gas exploration and production We invest in a diversified portfolio of production and acreage across the Permian and four other prolific US basins in partnership with proven We create value by generating sustainable risk adjusted returns for investors, offering a rewarding experience for our team, and delivering reliable energy solutions to all â safely and Strategic Priorities Return of Capital Sustainable free cash flow generation with commitment to return capital to Financial Strength Fortress balance sheet allows for a disciplined investment focus on full cycle Aggregation Target core basins with lowest costs and partner with experienced Processes Repeatable, business model leveraging data and Our Portfolio We invest acreage across the Permian and other prolific US basins in partnership with proven Learn More Our Leadership Our seasoned leadership team brings significant oil & gas experience across various Learn More Contact McKinney Avenue, Suite Dallas, Texas T: Company Portfolio Leadership Investors Copyright Â© Granite Ridge Resources All Rights Terms of Use and Privacy Policy . ",startup,"{'status': '200', 'available': True, 'url': 'http://web.archive.org/web/20221107234116/https://www.graniteridge.com/', 'timestamp': '20221107234116'}",20221107234116.0,1.0
http://www.leantime.io,15955,crunchbase,"Pricing - Leantime™ Features Pricing Blog Support Help Docs Community Chat Suggest a Feature Report a Bug Contact Features Pricing Blog Support Help Docs Community Chat Suggest a Feature Report a Bug Contact Sign Up Download Project management priced the way it should be Pay per Not per First project Get your free project Their Pricing Scenario: person team . Half the team uses their project management system part System costs user month = $100 month Our Pricing Scenario: person team . Half the team uses our project management system part 1 free project, 1 paid System costs $14.99 month Yearly Monthly Self Hosted Install Full control! Worry Free Hosting Unlimited Users and Clients User Role Management Custom Subdomain White Labeling Billed Never $ 0 Download Self Hosted Install Full control! Full data control Unlimited Everything Customize do your needs Dedicated domain White Labeling Keep the project alive, sponsor us Download One Project Wonder Your first project is Worry Free Hosting Unlimited Users and Clients User Role Management Custom Subdomain White Labeling Billed Never $ 0 Sign Up One Project Wonder We Your first project is Worry Free Hosting Unlimited Users and Clients User Role Management Custom Subdomain White Labeling Billed Never $ 0 Sign Up Business Your first project is free and then you pay per project Worry Free Hosting Unlimited Users and Clients User Role Management Custom Subdomain White Labeling Project Month (billed annually) $ Sign Up Business Your first project is free and then you pay per project Worry Free Hosting Unlimited Users and Clients User Role Management Custom Subdomain White Labeling Project Month (billed monthly) $ Sign Up Enterprise We help you get Leantime set up on your own Install LDAP SSO Integration Telemetry & Auditing Custom Onboarding & Migration Premium Support & SLAs Custom Billing Call Us Contact Us Enterprise We help you get Leantime set up on your own Install LDAP SSO Integration Telemetry & Auditing Custom Onboarding & Migration Premium Support & SLAs Custom Billing Call Us Contact Us Things you might be wondering (FAQ) How much does Leantime cost per user? It doesn t. Welcome to the land of project management with unlimited Other project management systems charge by Even open source Why aren t you? On average, a company spends $218 per month per employee on SaaS products and that number is only How big is your team? The value of a project management system lies in managing projects and not in managing Companies are quickly being pushed out of their ability to grow because the cost of growing is out pacing And for those wanting to start something new, business or otherwise? A checklist just doesn t cut The world gets more amazing when more people are creating and People shouldn t be penalized or prohibited to grow by the products they Do you require a credit card to get started? No credit card Once you set up your account and when you re ready for another project, you ll be able to update sign up under You can find the Billing setting under the drop down menu next to your person I m using a self hosted version of Can I move over to hosted? Yes, please contact us and we can arrange an import for a small What makes Leantime different from other project management systems? Besides our pricing structures, Leantime differs from other project management systems by focusing on the full project By combining idea management, strategy & research development and pairing it with the actual work -- staying focused becomes easier -- leading to better project What is open source software? Open source software is software code has been published to the public and shared in a way that encourages collaboration on development and is meant to democratize how we (the world) use Leantime Updates Thread – Versions – This is the most current thread of Leantime updates as of 01 2022. Leantime Update! – LDAP bug fixes too… Continue Reading → Open source project management is the future Chances are that you’re familiar with the concept of open source software in some capacity — many of our users… Continue Reading → Lean Business Solutions LEAN has become a fancy buzz word among health care, manufacturing (thanks, Toyota!), Startups, Construction, Supply Chain Management, and even… Continue Reading → Seattle Start Up Week Day 1 – Healthcare Industry We love We love So imagine our excitement when we found out about Seattle Start Up We’ve been… Continue Reading → Legal Terms & Conditions Cookie Policy Privacy Policy Disclaimer Responsible Disclosure Policy Trademark Policy Open Source Download Leantime Help Docs Community Chat Forum Submit a Feature Submit Bug About About Us Contact Us Follow Us Copyright Hyve5 Inc DBA Leantime   Features - Leantime™ Features Pricing Blog Support Help Docs Community Chat Suggest a Feature Report a Bug Contact Features Pricing Blog Support Help Docs Community Chat Suggest a Feature Report a Bug Contact Sign Up Download Features for when Done needs a ",startup,"{'status': '200', 'available': True, 'url': 'http://web.archive.org/web/20230116215336/https://leantime.io/', 'timestamp': '20230116215336'}",20230116215336.0,1.0
