website,text_len,source,text,type,closest_snapshot,closest_snapshot_time,snapshot_in_window
https://www.trewautomation.com/,12014,crunchbase,"Solution Development and Support Services for Material Handling | TREW PoweredbyTREW: Hilmot TKO +1-800-571-8739 Careers Support SOLUTIONS SOFTWARE SERVICES NEWS ABOUT More Solution Design Implementation Support HOME SERVICES We believe delivering uncommonly smart solutions takes a collaborative team to listen, understand, ideate, plan and That starts with listening to you, then sharing our , having open communications and working together to win Staffed by Supply Chain Executives and Operators from industry leading ""We ve walked many miles in your "" Data Collection and Information Gathering Business goal definition Data Analysis Technology selection and sizing Workflow and Process definition Staffing sizing by functional area ROI for solution(s) SOLUTION DEVELOPMENT Proven Team Proven Approach Proven Process Former Supply Chain Executives and Operators from major industry leading companies Data Analysts and Experts from the Supply Chain Industry Engineers and Designers with Integration and Software knowledge Experts in Shop Floor Operations and Lean principles Data Driven Collaborative and Explorative Iterative Process ROI and Business Case Focused Concept to Post Engagement Our solutions team uses a proven approach based on data and your business goals to drive concept ideation, sizing and selection to match your We focus on improving core metrics aimed at making your operation There is seldom a solution our team’s operational, software and technology guide us together down the path to find the best fit Finalize building needs and layout Software needs and gap analysis WCS Interface documents and messaging Full process flow maps with capacities Solution Simulation or modelling Detailed technology design Software Hardware Electrical Controls Creation of WCS WMS ERP test scripts Creation of detailed functional test scripts for technology and automation Development assistance of SOPs for client’s Operations teams “Train the Trainers” for best practices in maintenance and operations Coaching on shop floor at – get productive quickly go live support Installation Detailed Engineering Preparation & IMPLEMENTATION Electrical and Mechanical Installation “Installed the way it was designed” TREW associates lead all crews Onsite factory supervision Commitment to all aspects of schedule Fully licensed and insured You expect projects that deliver the promised We’ve learned a lot in years of project Having delivered for the who’s who in retail and ecommerce from conveyor solutions to flexible order fulfillment operations, we know your success is our Our team is staffed with project managers and site leaders that know collaboration, know how, structured methods, and open communications are how results get SUPPORT Great experiences are shared, which is why our Customer Experience Team is here to ensure your material handling investments are supported with best in class options for technical support, parts, training, assessments, and modifications or We are here to help you reach your operational Technical Support If your system happens to experience an outage, quick access to knowledgeable, trained support engineers to get your system back to full operations is ​ Our technical support team is just a phone call, email, online form submission, or a chat Support is available in two tiers: Basic for operations needing support Monday thru Friday Eastern or Total for With a technical support contract, you will have access to the CX Customer Portal, an incident management system that provides total transparency for incident resolution, documenting all steps taken to resolve issues, ticket escalation and auto email notifications for when your tickets change It also includes the TREWUp Knowledge Base with tips and tricks for our most frequently asked support Parts The easiest way to avoid unplanned downtime is to have parts on site to support your system should a failure Not sure how many parts or how much to stock? We can help you choose the appropriate stocking plan prior to system that fits your budget and maintenance Already have a system? If you know what you need, you can visit our online Not sure what you need? We have experienced parts specialists available to help, just give us a Training Learning how to safely operate, maintain and troubleshoot your material handling system is as important for your success as getting orders out the We provide a combination of classroom and hands on training prior to system turnover, as well as refresher courses to keep your staffs’ skills Each course is customized to your systems’ content and is taught by experienced material handling Assessments As systems age and experience normal wear and tear, its sometimes difficult to operate them reliably and with a predictable Regular assessments are valuable resource planning and downtime avoidance Our experienced assessors provide a thorough examination of all critical components in your system, delivering a preliminary finding report prior to",startup,"{'status': '200', 'available': True, 'url': 'http://web.archive.org/web/20200923052958/https://www.trewautomation.com/', 'timestamp': '20200923052958'}",20200923052958.0,1.0
https://thelivekindlyco.com/,5075,crunchbase,"Food for Thought | The LIVEKINDLY Skip to content The Collective About Team Partners Mission Brands Stories In the News Food for Thought Contact Menu The Collective About Team Partners Mission Brands Stories In the News Food for Thought Contact Food for Thought Check out the latest news and about the industry, the Collective, and why we’re making living the LIVEKINDLY Collective expands its Portfolio with the Acquisition of ‘No Meat’ Today, the collective of heritage and brands announced the acquisition of ‘No Meat’, Iceland Foods’ vegan meat Tammy Fry’s first book ‘Made with Love & Plants’ coming soon Our very own Tammy Fry is to launch a cookbook and lifestyle guide, packing recipes and gorgeous Why being a Force for Good is just Good Business The shift to more sustainable diets cannot be left just to individual It’s the private sector’s responsibility to do right by the planet—and the market is already Meat Consumption may be rising in the East, but so is Demand for Alternatives Learning from the mistakes of the West, Asian countries have an opportunity to change The shift is already How Blue Horizon Ventures is building a sustainable future of food Not only is a food system more resilient, it is also We can use business as a force for sustainable change, better for us and better for the Here’s Privacy Policy Terms of Use Press Contact Us © LIVEKINDLY Collective – All Rights Reserved   The Collective | The LIVEKINDLY Skip to content The Collective About Team Partners Mission Brands Stories In the News Food for Thought Contact Menu The Collective About Team Partners Mission Brands Stories In the News Food for Thought Contact Company Launch, March , New York City About LIVEKINDLY Collective was founded on the belief that alternatives have the power to make the global food system As a collective of business leaders and entrepreneurs from across the globe, we are uniquely positioned to create impact with speed, at scale – because of our unique capabilities and mission to effect change through sustainable, And through our brands and lifestyle media platform, we’re making eating the new Passionate, , and Team Meet the people behind LIVEKINDLY Jodi Monelle Founder CEO LIVEKINDLY Timo Recker Founder Likemeat Debbie Fry Founder Fry’s Family Food Wally Fry Founder Fry’s Family Food Lidell Founder Oumph! Roger Lienhard Founder Kees Kruythoff CEO Mick van Ettinger CMO David Knopf CFO Rogan Moore CIO Courtney Ozer CLO Aldo Uva COO Kristen Baldwin CHRO Tal Nadari Regional Director EU & ANZ Lindskog Chief of Staff & Sustainability Joanna Liuqiao Regional Director,Greater China Partners In order to achieve impact at scale and at speed, we are working with partners across the value chain, from seed to We are proud to partner with leading food producers, distributors and growers to make protein accessible to the Privacy Policy Terms of Use Press Contact Us © LIVEKINDLY Collective – All Rights Reserved   LIVEKINDLY Collective | Making Living the New Norm Skip to content The Collective About Team Partners Mission Brands Stories Food for Thought In the News Contact Menu The Collective About Team Partners Mission Brands Stories Food for Thought In the News Contact A collective of activists On a mission To make living the norm The Collective The LIVEKINDLY Collective was founded on the belief that alternatives have the power to make the global food system Through our brands and lifestyle media platform, we’re making eating the new Find Out More Our Mission The LIVEKINDLY Collective is on a mission to make plant based living the new norm, and shift the global food system to a sustainable Find Out More Our Brands Oumph!, The Fry Family Food , LikeMeat, and LIVEKINDLY are helping to drive major growth in the Each of these brands was created by a passionate and founder, who joined the LIVEKINDLY Collective to scale their businesses with Stories Want to learn more? Check out some of our latest coverage in the news here or content from the team here . Food for Thought Tammy Fry’s first book ‘Made with Love & Plants’ coming soon Our very own Tammy Fry is to launch a cookbook and lifestyle guide, packing recipes and gorgeous Why being a Force for Good is just Good Business The shift to more sustainable diets cannot be left just to individual It’s the private sector’s responsibility to do right by the planet—and the market is already Meat Consumption may be rising in the East, but so is Demand for Alternatives Learning from the mistakes of the West, Asian countries have an opportunity to change The shift is already Read More In the News “I think in two generations people will look back and say ‘Why were we at all eating animals?’” READ “There’s a new powerhouse on the ” READ CEO Kees Kruythoff on the company’s entry into the market backed by $200 million in WATCH READ READ WATCH Read More Get in Do you have a great idea to help make the world kinder? Drop us an email First Name Last Name Email Company Message Send Privacy Policy Terms",startup,"{'status': '200', 'available': True, 'url': 'http://web.archive.org/web/20201107111631/https://thelivekindlyco.com/', 'timestamp': '20201107111631'}",20201107111631.0,1.0
https://theroboburger.com/,2968,crunchbase," RoboBurger 0 Skip to Content RoboBurger Home About Us Team Press Locations Get In Touch Open Menu Close Menu RoboBurger Home About Us Team Press Locations Get In Touch Open Menu Close Menu Home About Us Team Press Locations Get In Touch Our Story Team Contact   About Us — RoboBurger 0 Skip to Content RoboBurger Home Current Page: About Us Team Locations Get In Touch Open Menu Close Menu RoboBurger Home Current Page: About Us Team Locations Get In Touch Open Menu Close Menu Home Current Page: About Us Team Locations Get In Touch Our Story:Creating Better Access to Better Food Meet the RoboBurger Founders RoboBurger was founded in by Audley, Dan and Andy, 3 people with passion for engineering, robotics and delicious burgers, made from exceptional quality They dreamt that students would have access to hot, fresh and affordable meals even at AM while they prepare for That travelers will never be forced into eating a cold overpriced sandwich in an airport, unless that’s what they choose to And that busy employees will never have to eat a vending machine candy bar as a meal replacement ever Together, they created the RoboBurger, the first burger chef in a box, that cooks a burger from scratch, at the press of the At RoboBurger we’re on a mission to change the way people get and eat burgers, A Minority Owned Business Audley, the CEO and the inventor of the RoboBurger, was born with a passion for electronics and robotics and has been building electrical boards ever since he was a While going to Carnegie Mellon on a scholarship, Audley started thinking about food robots that could automated the process of cooking, from start to His first burger robot prototype was the size of his dad’s Years later, he created the RoboBurger, the first burger robot the size of a vending machine that automates the process of cooking a burger from start to On a Mission to Bring Tech Jobs to Newark, NJ We are proud to be headquartered and ensemble all of our RoboBurger units in Newark, New We’re on a mission to bring investments and create local tech jobs to help the community grow from Our Story Team Contact   RoboBurger 0 Skip to Content RoboBurger Current Page: Home Our Story Team Contact Open Menu Close Menu RoboBurger Current Page: Home Our Story Team Contact Open Menu Close Menu Current Page: Home Our Story Team Contact Hi, we’re We’re bringing automation and delicious RoboBurgers to all RoboBurger is the world’s robotic kitchen, in a box, that transforms a frozen patty into a hot, freshly prepared burger in minutes, for only $5.99. It’s as easy as Tap screen, Get RoboBurger is a Chef in a The machine goes through five distinct operations while cooking the burger, mimicking the process chefs use in quickservice STEP 1: The robot dispenses the patty on the griddle and grills it on both STEP 2: It toasts the STEP 3: It dispenses the condiment STEP 4: The robot ensembles the STEP 5: RoboBurger delivers the burger to Our Story Team Contact ",startup,"{'status': '200', 'available': True, 'url': 'http://web.archive.org/web/20201101002122/https://theroboburger.com/', 'timestamp': '20201101002122'}",20201101002122.0,1.0
https://www.benchmarklabs.com/,67,crunchbase," BENCHMARK LABS Your farm, your field, your Coming soon Contact US ",startup,"{'status': '200', 'available': True, 'url': 'http://web.archive.org/web/20191115033225/https://www.benchmarklabs.com/', 'timestamp': '20191115033225'}",20191115033225.0,1.0
http://weatherflow.com/,9223,crunchbase,"Products – WeatherFlow Support Products Wind & Weather Meters Smart Weather Stations Inquiry Professional Services Observing Networks Data and Applications Analysis & Modeling Consulting Services Wind Energy Brands iKitesurf iWindsurf SailFlow WindAlert Fishweather DataScope Support Products WIND & WEATHER METERS Smart Weather Stations | Home Important Links Blog News About Us Support Contact Us Jobs Clients and Partners ©   Professional Services – WeatherFlow Support Products Wind & Weather Meters Smart Weather Stations Inquiry Professional Services Observing Networks Data and Applications Analysis & Modeling Consulting Services Wind Energy Brands iKitesurf iWindsurf SailFlow WindAlert Fishweather DataScope Support Professional Services Observing networks Data And Applications Analysis & Modeling Consulting Services Wind Energy Important Links Blog News About Us Support Contact Us Jobs Clients and Partners ©   Wind & Weather Meters – WeatherFlow Support Products Wind & Weather Meters Smart Weather Stations Inquiry Professional Services Observing Networks Data and Applications Analysis & Modeling Consulting Services Wind Energy Brands iKitesurf iWindsurf SailFlow WindAlert Fishweather DataScope Support Wind & Weather Meters Interested in selling WeatherFlow meters? Dealer Inquiry Important Links Blog News About Us Support Contact Us Jobs Clients and Partners ©   WeatherFlow – Better Better Support Products Wind & Weather Meters Smart Weather Stations Inquiry Professional Services Observing Networks Data and Applications Analysis & Modeling Consulting Services Wind Energy Brands iKitesurf iWindsurf SailFlow WindAlert Fishweather DataScope Support learn more learn more learn more learn more learn more SMART WEATHER Stations Weather geek Smart home Innovative weather stations for home and commercial Learn More WIND & WEATHER Meters devices capture highly accurate wind & weather measurements Learn More Professional SERVICES Private weather networks, unique weather data and applications, advanced forecast modeling, and meteorological consulting Learn More NEWS Latest at WeatherFlow From Sea to Shining Sea … and Lake! Featured WeatherFlow News WeatherFlow Adds to its Hurricane Network in Mexico Featured News Forecast Feedback FX WeatherFlow Attends AMS Annual Meeting Featured Important Links Blog News About Us Support Contact Us Jobs Clients and Partners ©   Smart Home Weather Stations – WeatherFlow Support Products Wind & Weather Meters Smart Weather Stations Inquiry Professional Services Observing Networks Data and Applications Analysis & Modeling Consulting Services Wind Energy Brands iKitesurf iWindsurf SailFlow WindAlert Fishweather DataScope Support Smart Home Weather Stations Weather Geek Worthy, Smart Home See pricing Watch the Video The most advanced home weather station ever created This is not your grandfather’s weather WeatherFlow Smart Weather Stations feature a revolutionary design with no moving parts to wear out, completely wireless operation, simple installation, instantly online, , flexible data The proprietary sonic anemometer out performs and out lasts traditional spinny Our haptic rain sensor can feel each rain drop allowing you to receive alerts the instant it begins raining, determine relative intensity of rain, and know the exact number of minutes of rain each The station also reports brightness, UV index, solar irradiance, temp, humidity, pressure, lightning up to miles away, and a slew of other nerdy weather Backed by the WeatherFlow network and proprietary Continuous Learning algorithms, these are the only stations in the world that daily and directly feed applied machine learning models to improve forecast accuracy at your exact Works with Amazon Alexa, Google Home, IFTTT and more Instant lightning strike and rain alerts Precision sonic anemometer and haptic rain sensor Continuous Learning system prevents sensor drift AI Machine learning improves forecasts over time REST API and local data access via UDP and BLE Free iOS and Android apps Free personal weather webpage Direct feed to WeatherUnderground Integrated with ISY, HomeAssistant, and many more See pricing WeatherFlow SKY Encased in SKY’s design, our revolutionary sensors detect rain drops in an instant, give accurate wind speed & direction, and measure sunlight (including UV Index) - all with no moving parts to wear out or Long range wireless Infinitely solar Wind Rain onset, intensity, duration, and ~accumulation Sunlight & UV Index Solar radiance up to + wireless range See pricing WeatherFlow AIR Protect your family when AIR detects lightning & warns you of approaching AIR also measures temperature, humidity, and atmospheric Long range wireless Extremely long battery Outdoor Temperature Relative Humidity Pressure Heat index, dew point, air density, ++ Lightning activity up to + wireless range Extremely long battery life See pricing Know your home environment - from anywhere View weather conditions in your backyard with our fre",startup,"{'status': '200', 'available': True, 'url': 'http://web.archive.org/web/20191024072330/https://weatherflow.com/', 'timestamp': '20191024072330'}",20191024072330.0,1.0
https://vicinitycapital.com,20332,crunchbase,"Local Stories - Vicinity Capital toggle nav About Local Stories Vicinity Views FAQs Learn More Business Stories in your Vicinity Learn what products and services are in your own backyard Listen on Spotify The following stories are part of our mission to support and promote local At the time of the recordings, none of these companies had an active, or a proposed offering under Regulation Crowdfunding through Vicinity Capital, or any other securities We are happy to host an interview with any local company with an important or interesting story to We are in no way making any recommendation regarding an investment in any of these companies, nor are we providing any sort of investment Should any of these companies make an offering of securities with Vicinity in the future, we will make the podcast available on the offering page as Episodes Resources Subscribe Educational Materials Vicinity Views About Us About FAQs Social Media LinkedIn Facebook Twitter Instagram This website, (“site”), is owned by Vicinity, LLC (“Vicinity”). Vicinity is a Funding Portal applicant that intends to offer investments under Regulation Crowdfunding (“Reg CF”) upon completion of FINRA registration as a Funding Securities offered on our site are not recommended or approved by any federal or state securities commission or regulatory Vicinity does not provide any investment advice or recommendation, and does not provide any legal or tax advice with respect to any All securities listed on this site are being offered by the applicable Each issuer is fully responsible for its offering and all information contained In making an investment decision, investors must rely on their own examination of the issuer and the terms of the offering, including the merits and risks Securities sold under Reg CF are speculative, illiquid, and investors can lose all of their By using our site, you are subject to the Terms and Conditions of Service and Privacy Thank you for using our If you have any questions, please contact us at ©. Privacy Policy and Terms of Service   FAQ - Vicinity Capital toggle nav About Local Stories Vicinity Views FAQs Learn More Get All Your Questions Answered! Don t see your question here? Feel free to email us at Investors Owners Resources Subscribe Educational Materials Vicinity Views About Us About FAQs Social Media LinkedIn Facebook Twitter Instagram This website, (“site”), is managed by Vicinity, LLC (“Vicinity”) and Vicinity Holdings, LLC (""Vicinity Holdings""). Vicinity is a Funding Portal (CRD# ) offering investments through this site under Regulation Crowdfunding (“Reg CF”). Securities offered on our site are not recommended or approved by any federal or state securities commission or regulatory Vicinity does not provide any investment advice or recommendation, and does not provide any legal or tax advice with respect to any All securities listed on this site are being offered by the applicable Each issuer is fully responsible for its offering and all information contained In making an investment decision, investors must rely on their own examination of the issuer and the terms of the offering, including the merits and risks Securities sold under Reg CF are speculative, illiquid, and investors can lose all of their By using our site, you are subject to the Terms and Conditions of Service and Privacy Thank you for using our If you have any questions, please contact us at ©. Privacy Policy and Terms of Service   About - Vicinity Capital toggle nav About Local Stories Vicinity Views FAQs Learn More We’re on a mission to support thriving local economies Gain Access as Stakeholders and Lenders to Businesses in Your We Believe Communities that invest internally, are healthier and more We want to empower local economies by connecting business with Vicinity is where financial capital meets social Strength is built by bearing Our communities strengthen as we lift each other We are asking that just 1 3 of business investments be to your own town or Local beats Distance promotes generic, dehumanized, transactional Vicinity cultivates unique, accountable, relational Trust outpaces Value is Financial returns are one part, but we are bringing real people and real businesses back to Transparency builds We support decisions on investments you can Why are we called Vicinity? Vicinity: Definition - the area near or surrounding a particular Proximity in space or Etymology: from Latin vicinitas, from vicinus ""neighbor"". We re rewriting the playbook on investing and business We think that sometimes the quest to “make our dent in the universe” passes by something much cooler and more making a real, immediate, and lasting impact right where we Using our dollars to help businesses make awesome products and serve up good experiences in our community seems to us like a fantastic way to improve our The foundation of our business is Where commerce is broken, we want to help bring things back Business should encourage solidarity, stability, resilience,",startup,"{'status': '200', 'available': True, 'url': 'http://web.archive.org/web/20200603054539/https://vicinitycapital.com/', 'timestamp': '20200603054539'}",20200603054539.0,1.0
