website,text_len,source,text,type,closest_snapshot,closest_snapshot_time,snapshot_in_window
https://www.ellyhealth.com,60801,crunchbase,"Privacy Policy - Elly Health Contact Privacy Policy Last Updated: April , â INTRODUCTION Elly Health , (âElly,â âwe,â âusâ) has created this privacy policy (âPrivacy Policyâ) in order to set out how we collect, use, and disclose personal information through our website located at (the âWebsiteâ) and our mobile app (the âAppâ) that is offered as part of the Elly Elly is a digital health solution which provides audio content to patients living with chronic This Privacy Policy applies to all of the products, services, and websites offered by Elly or our related, affiliated and or subsidiary companies (collectively the âServicesâ). The privacy of our customers is of great importance to By visiting our Website and or using the Services in any manner, you acknowledge that you accept the practices and policies outlined in this Privacy Policy and you hereby consent to the collection, use and disclosure of your Personal Information in accordance with this Privacy The information on this site is not intended or implied to be a substitute for professional medical advice, diagnosis or All content, including text, graphics, images and information, contained on or available through this web site is for general information purposes Elly makes no representation and assumes no responsibility for the accuracy of information contained on or available through this web site, and such information is subject to change without You are encouraged to confirm any information obtained from or through this web site with other sources, and review all information regarding any medical condition or treatment with your physician . NEVER DISREGARD PROFESSIONAL MEDICAL ADVICE OR DELAY SEEKING MEDICAL TREATMENT BECAUSE OF SOMETHING YOU HAVE READ ON OR ACCESSED THROUGH THIS WEBSITE OR MOBILE â WHAT DOES THIS PRIVACY POLICY COVER? This Privacy Policy covers our collection, use and disclosure of information about identifiable individuals and information which can be used to identify an individual (âPersonal Informationâ). Personal Information does not include âaggregateâ information which we aggregate from information (including Personal Information) you provide to Personal Information may be collected about our customers, prospective customers, visitors to the Website, and end users of the You can choose not to provide us with certain information, but by doing so, you may not be able to take advantage of many of the features and functionality of our This Privacy Policy does not apply to the practices of companies that we do not own or You understand and agree that Elly and its authorized business partners, affiliates, subsidiaries or agents (collectively, âEllyâ, âusâ or âweâ) may collect, maintain, and process information provided by you, on and through the You represent and warrant that you have permission to share any information you elect to provide Elly, you consent to such information being shared with third parties, including, if applicable, healthcare providers, and that such information is accurate, current, , and consistent and relevant for the purpose for which you are providing â COLLECTION AND USE OF PERSONAL INFORMATION AND OTHER DATA Account Information: Â In order to use the Services, users may be required to have a valid Elly account to log in to the Website (an âAccountâ). When you register for the Services, Elly collects your name and email address (âAccount Informationâ). Elly will also have access to information about your use of the Services such as which audio content you listen to, how often you listen to content and other information available that is combined with your Account Once you create an account with us and sign in to our services, you are not anonymous to Elly collects Personal Information in the following general ways: â Elly collects Personal Information you knowingly choose to submit to us through the Services, such as your name and email â When you access or use the Services, Elly may automatically receive and record information on our server logs from your browser, including your IP address, cookies, and the pages you IP addresses are automatically reported by your browser each time you view a web Your IP address is stored by Elly when you register with â [If you link your Account to Appleâs HealthKit, FitBit, Google Health, or other third party account, Elly may collect the information you have stored in those accounts that are related to the services we Generally, Elly uses the Account Information (including Personal Information) to deliver the Services to you, to improve the delivery of our Services and related products and services, to conduct our business, to develop analytics and aggregated data that allow us to improve our Services and related products and services, or to correspond with Specifically, Elly uses Personal Information to: â Authenticate access to the Account and provide access to the Services â Provide, operate",startup,"{'status': '200', 'available': True, 'url': 'http://web.archive.org/web/20200814042829/https://www.ellyhealth.com/', 'timestamp': '20200814042829'}",20200814042829.0,1.0
https://identomat.com/,4762,crunchbase," Identomat | Schedule Your Free Demo | KYC & ID Verification The Solution Industries About Us Blog Request Demo Get in touch SCHEDULE YOUR FREE DEMO SCHEDULE YOUR FREE DEMO company Our Solution Request Demo Industries About Contact Us LEGAL DOCUMENTS Privacy Policy Cookie Policy Terms and Conditions Resources Blog facebook twitter youtube instagram Copyright , Raizomat, All Rights Reserved We use cookies that are necessary operate this website We do not use marketing or Once you hit “Accept”, you agree with our Cookie Policy . Accept   Identomat | KYC & Identity Verification For Your Business The Solution Industries About Us Blog Request Demo Our Blog Join us for Latest Tech News & News Georgia’s Leading Insurance Company Aldagi, Fully Adopts Identomat’s AI Technology May , This year’s pandemic and subsequent lockdown, seem to have halted the global economy, resulting in dire projections for the year and Yet while things look uncertain in many areas, one thing remains true: life does not Routine tasks pile up, bills keep coming, and the dates on the calendar just keep […] continue reading Subscribe to our newsletter Be the first to receive the latest buzz on upcoming contests & more! Industry Insights 5 Easy Steps to Improve Your KYC Process Read more April , About Georgia Georgia on My Mind Read more April , News Identomat Has Been Featured by a Popular Georgian TV Channel Read more April , News Know Your Robot: Why KYC & RPA Were Made for Each Other Read more April , Our Solution Can You Simplify the KYC Process Without Compromising Security? Read more April 3, company Our Solution Request Demo Industries About Contact Us LEGAL DOCUMENTS Privacy Policy Cookie Policy Terms and Conditions Resources Blog facebook twitter youtube instagram Copyright , Raizomat, All Rights Reserved We use cookies that are necessary operate this website We do not use marketing or Once you hit “Accept”, you agree with our Cookie Policy . Accept   Identomat | KYC & Identity Verification For Your Business The Solution Industries About Us Blog Request Demo KYC & IDENTITY VERIFICATION SOLUTION What We do what we do Simplify the User Journey Eliminate Manual Verification Processes Accelerate Customer Onboarding Speed Up Transactions Catch Fake IDs & Prevent Fraud % Data Extraction Accuracy Omnichannel Verification Omnichannel V erification % Data Ext r a c tion Accu r acy C atch F a k e IDs & Pr ev ent Fr aud Speed Up T r ansa c tions Accele r ate C u s tomer Onboa r ding Eliminate Manual V erification Pr ocesses Simpli f y the User Journ e y the perfect fit for any industry the perfect fit We live in a world where industries are united by the same problems and Working fast and working smart are two of the most common problems faced by modern the solution? intelligent automation Online customer onboarding Fraud prevention Age verification KYC AML compliance Retail IT and telecom Banking, financial services, and insurance Government and defense Healthcare Online gambling Other travel and hospitality, education Online customer onboarding Banking, financial services, and insurance Healthcare Online gambling Fraud prevention Banking, financial services, and insurance Healthcare Online gambling Age verification Banking, financial services, and insurance Healthcare Online gambling KYC AML compliance Banking, financial services, and insurance Healthcare Online gambling Let us show you who we are who we are Raizomat is a leading service provider specializing in the areas of Robotic Process Automation, Artificial Intelligence, Data Mining and Analysis across a range of Our goal is to make intelligent automation accessible to businesses that want to avoid repetitive work and make the most out of the time and experts in experts in MACHINE LEARNING COMPUTER VISION DATA MINING DATA ANALYSIS ROBOTIC PROCESS AUTOMATION SOFTWARE ENGINEERING SYSTEMS ARCHITECTING WEB & MOBILE DEVELOPMENT PAYMENT SYSTEMS HARDWARE INTERFACES IOT & SERVICES TELCO SERVICES GOVERNMENT SOLUTIONS P A YMENT S Y S TEMS S Y S TEMS A R CHIT E C TING E E T P L A C E S & ON DEMAND SE R VIC E S HAR D W ARE INTER F A C E S D A T A ANA L Y SIS SO F T W ARE ENGINEERING WEB & MOBILE D E VE L OPMENT TE L C O SE R VIC E S M A CHINE L E ARNING C OMPUTER VISION R OB O TIC P R OC E SS A U T OM A TION G O VERNMENT SO L UTIONS I O T D A T A MINING LET US SHOW you how we can LET US SHOW request demo company Our Solution Request Demo Industries About Contact Us LEGAL DOCUMENTS Privacy Policy Cookie Policy Terms and Conditions Resources Blog facebook twitter youtube instagram Copyright , Raizomat, All Rights Reserved We use cookies that are necessary operate this website We do not use marketing or Once you hit “Accept”, you agree with our Cookie Policy . Accept ",startup,"{'status': '200', 'available': True, 'url': 'http://web.archive.org/web/20200508050803/https://identomat.com/', 'timestamp': '20200508050803'}",20200508050803.0,1.0
https://www.oceanwellwater.com,17015,crunchbase,"Wayback Machine We will keep fighting for all libraries - stand with us! Close banner 9 Days Left: All donations will be matched through December ! Your Donation Will Be Matched ! Can You Chip In? Please don t scroll past thisâthe Wayback Machine is fighting for universal access to quality The Internet Archive, which runs this project, relies on donations averaging $30.38 to help us keep the record We d be deeply grateful if you d join the one in a thousand users that support us Right now, we have a matching gift campaign that will double the impact of every We understand that not everyone can donate right now, but if you can afford to contribute this Saturday, we promise it will be put to good Our resources are crucial for knowledge lovers everywhereâso if you find all these bits and bytes useful, please pitch Your Donation Will Be Matched! Can You Chip In? Please don t scroll past thisâthe Wayback Machine is fighting to keep the record Right now, we have a matching gift campaign that will double the impact of every We understand that not everyone can donate right now, but if you can afford to contribute this Saturday, we promise it will be put to good If you find all these bits and bytes useful, please pitch Continue Remind Me Send me an email reminder Email address (required) Please enter a valid email First name Last name Submit By submitting, you agree to receive emails from the Internet Your privacy is important to We do not sell or trade your information with Internet Archive logo A line drawing of the Internet Archive headquarters building faÃ§ade. Donate icon An illustration of a heart shape ""Donate to the archive"" Search icon An illustration of a magnifying Search icon An illustration of a magnifying Upload icon An illustration of a horizontal line over an up pointing Upload User icon An illustration of a person s head and Sign up | Log in Web icon An illustration of a computer application window Wayback Machine Texts icon An illustration of an open Books Video icon An illustration of two cells of a film Video Audio icon An illustration of an audio Audio Software icon An illustration of a "" floppy Software Images icon An illustration of two Images Donate icon An illustration of a heart shape Donate Ellipses icon An illustration of text More Hamburger icon An icon used to represent a menu that can be toggled by interacting with this Internet Archive Audio Live Music Archive Librivox Free Audio Featured All Audio This Just In Grateful Dead Netlabels Old Time Radio RPMs and Cylinder Recordings Top Audio Books & Poetry Computers, Technology and Science Music, Arts & Culture News & Public Affairs Spirituality & Religion Podcasts Radio News Archive Images Metropolitan Museum Cleveland Museum of Art Featured All Images This Just In Flickr Commons Occupy Wall Street Flickr Cover Art USGS Maps Top NASA Images Solar System Collection Ames Research Center Software Internet Arcade Console Living Room Featured All Software This Just In Old School Emulation Games Historical Software Classic PC Games Software Library Top Kodi Archive and Support File Vintage Software APK Software Software Library Software Sites Tucows Software Library Shareware Software Capsules Compilation Images ZX Spectrum DOOM Level CD Books Books to Borrow Open Library Featured All Books All Texts This Just In Smithsonian Libraries FEDLINK (US) Genealogy Lincoln Collection Top American Libraries Canadian Libraries Universal Library Project Gutenberg Children s Library Biodiversity Heritage Library Books by Language Additional Collections Video TV News Understanding 9 11 Featured All Video This Just In Prelinger Archives Democracy Now! Occupy Wall Street TV NSA Clip Library Top Animation & Cartoons Arts & Music Computers & Technology Cultural & Academic Films Ephemeral Films Movies News & Public Affairs Spirituality & Religion Sports Videos Television Videogame Videos Vlogs Youth Media Search the history of over billion web pages on the Search the Wayback Machine Search icon An illustration of a magnifying Mobile Apps Wayback Machine (iOS) Wayback Machine (Android) Browser Extensions Chrome Firefox Safari Edge Subscription Explore the Collections Learn More Build Collections Save Page Now Capture a web page as it appears now for use as a trusted citation in the Please enter a valid web address About Blog Projects Help Donate Contact Jobs Volunteer People Sign up for free Log in Search metadata Search text contents Search TV news captions Search radio transcripts Search archived web sites Advanced Search About Blog Projects Help Donate Donate icon An illustration of a heart shape Contact Jobs Volunteer People DONATE Latest Show All The Wayback Machine has not archived that Click here to search for all archived pages under https: www.oceanwellwater.com . The Wayback Machine requires your browser to support JavaScript, please email if you have any questions about The Wayback Machine is an initiative of the Internet Archive , a (c)(3) , b",startup,"{'status': '200', 'available': True, 'url': 'http://web.archive.org/web/20221027130548/https://www.oceanwellwater.com/', 'timestamp': '20221027130548'}",20221027130548.0,0.0
https://getodie.com/,16353,crunchbase,"Blog | Affordable and customizable Pet Insurance Plans | Get Odie Affordable Pet Insurance Plans | Get Odie Get a Quote Open menu Our Plans Explore Our Plans Blog Login Get a Quote Our Plans Explore Our Plans Blog Login We don t just sell insurance We promote holistic care and wellness for your pets As well as a place to find pet insurance terms and definitions to help you understand your policy, this blog is a source of information to help you make good choices from the start to care for your pet and prevent many common health We believe that a happy pet is usually a healthier one, so we want to help our community to keep their pets happy and Archive By on Dogs 7 Dogs with the Least Health Problems When thinking about adding a new dog to your family, one of the things you’ve probably considered is the common health Pet Lifestyle 5 Reasons You Should Get Your Pets Chipped Nothing is more heartbreaking than realizing that your beloved furry friend has gone Even passing by a “missing dog” poster Pet Insurance What is Not Covered by Pet Insurance Pet insurance can help you afford emergency vet visits or treatments for unexpected However, there are a few exclusions to Pet Insurance Important Pet Insurance Terms and Definitions When it comes to health insurance for our pets, we sometimes take good health for granted and delay taking out a Home & Lifestyle 5 Tips for Managing a Job With a Dog Our furry friends bring us infinite amounts of But every dog owner will agree: raising a dog is a ton Nutrition Cat Food : Wet Dry To dry, or not to dry—that is the question! Nutrition is key to having a healthy and happy cat, but with Home & Lifestyle Benefits of Having a Pet National Pet Day is April So today, let’s honor all the families who have chosen to welcome furry friends into Home & Lifestyle Honoring the US Army K9 Corps for Veterans Day, March Our dogs would do anything for us, especially during times of But did you know that American dogs also have Cats Pros and Cons of Indoor Outdoor Cats If you’ve decided on owning a cat—congratulations! Bringing a cat into your life can be extremely rewarding, and finding a Posts navigation 1 2 Next Join Odie Because every pet deserves to receive appropriate treatment when facing a catastrophic health Get a Quote Footer Affordable Pet Insurance Plans | Get Odie Odie Pet Insurance policies do not cover Waiting periods, annual deductible, , benefit limits and exclusions may For full terms, visit Terms & Conditions . Products, discounts, and rates may vary and are subject to Odie Pet Insurance Marketing, Inc (Odie) is a pet health insurance program administered by Thorson Specialty Insurance Services, Inc and underwritten by PrimeOne Insurance Company, Clear Blue Insurance Company, and Clear Blue Specialty Insurance Odie is a subsidiary of Thorson Specialty Insurance Services, Inc, CA Insurance License Number Support FAQs Contact Us Legal Privacy Policy Terms and Conditions Notice to California Residents © Odie Pet Insurance Marketing, All rights   Login - Affordable Pet Insurance Plans | Get Odie Affordable Pet Insurance Plans | Get Odie Get a Quote Open menu Our Plans Explore Our Plans Plans for Dogs Plans for Cats Extra Coverage Routine Coverage Login Blog Get a Quote Our Plans Explore Our Plans Plans for Dogs Plans for Cats Extra Coverage Routine Coverage Login Blog Login Login Click here to load this Caspio Online Database . Footer Affordable Pet Insurance Plans | Get Odie Odie Pet Insurance policies do not cover Waiting periods, annual deductible, , benefit limits and exclusions may For full terms, visit Terms & Conditions . Products, discounts, and rates may vary and are subject to Odie Pet Insurance Marketing, Inc (Odie) – CA Insurance License Number – is a pet health insurance program underwritten by PrimeOne Insurance Company and Clear Blue Insurance Support FAQs Contact Us Legal Privacy Policy Terms and Conditions Notice to California Residents Odie Pet Insurance policies do not cover Waiting periods, annual deductible, , benefit limits and exclusions may For full terms, visit Terms & Conditions . Products, discounts, and rates may vary and are subject to Odie Pet Insurance Marketing, Inc (Odie) – CA Insurance License Number – is a pet health insurance program underwritten by PrimeOne Insurance Company and Clear Blue Insurance © Odie Pet Insurance Marketing, All rights   Home Page | Affordable and customizable Pet Insurance Plans | Get Odie Affordable Pet Insurance Plans | Get Odie Get a Quote Open menu Our Plans Explore Our Plans Blog Login Get a Quote Our Plans Explore Our Plans Blog Login Home Page Meet Odie, pet insurance for everyone who cares about pet Every pet deserves a happy and healthy life, and you deserve accessible options to provide We ve focused on creating flexible plans designed to fit your budget and your pet s Get a Quote Explore Our Plans Get a Quote Explore Our Plans Odie empowers you to make the right decisions when unexpected pet health events",startup,"{'status': '200', 'available': True, 'url': 'http://web.archive.org/web/20210420132514/https://getodie.com/', 'timestamp': '20210420132514'}",20210420132514.0,1.0
