website,text_len,source,text,type,closest_snapshot,closest_snapshot_time,snapshot_in_window
https://www.skyblue.com,26675,crunchbase,"Wayback Machine We will keep fighting for all libraries - stand with us! Internet Archive logo A line drawing of the Internet Archive headquarters building faÃ§ade. Donate icon An illustration of a heart shape ""Donate to the archive"" Search icon An illustration of a magnifying Search icon An illustration of a magnifying Upload icon An illustration of a horizontal line over an up pointing Upload User icon An illustration of a person s head and Sign up | Log in Web icon An illustration of a computer application window Wayback Machine Texts icon An illustration of an open Books Video icon An illustration of two cells of a film Video Audio icon An illustration of an audio Audio Software icon An illustration of a "" floppy Software Images icon An illustration of two Images Donate icon An illustration of a heart shape Donate Ellipses icon An illustration of text More Hamburger icon An icon used to represent a menu that can be toggled by interacting with this Internet Archive Audio Live Music Archive Librivox Free Audio Featured All Audio This Just In Grateful Dead Netlabels Old Time Radio RPMs and Cylinder Recordings Top Audio Books & Poetry Computers, Technology and Science Music, Arts & Culture News & Public Affairs Spirituality & Religion Podcasts Radio News Archive Images Metropolitan Museum Cleveland Museum of Art Featured All Images This Just In Flickr Commons Occupy Wall Street Flickr Cover Art USGS Maps Top NASA Images Solar System Collection Ames Research Center Software Internet Arcade Console Living Room Featured All Software This Just In Old School Emulation Games Historical Software Classic PC Games Software Library Top Kodi Archive and Support File Vintage Software APK Software Software Library Software Sites Tucows Software Library Shareware Software Capsules Compilation Images ZX Spectrum DOOM Level CD Books Books to Borrow Open Library Featured All Books All Texts This Just In Smithsonian Libraries FEDLINK (US) Genealogy Lincoln Collection Top American Libraries Canadian Libraries Universal Library Project Gutenberg Children s Library Biodiversity Heritage Library Books by Language Additional Collections Video TV News Understanding 9 11 Featured All Video This Just In Prelinger Archives Democracy Now! Occupy Wall Street TV NSA Clip Library Top Animation & Cartoons Arts & Music Computers & Technology Cultural & Academic Films Ephemeral Films Movies News & Public Affairs Spirituality & Religion Sports Videos Television Videogame Videos Vlogs Youth Media Search the history of over billion web pages on the Search the Wayback Machine Search icon An illustration of a magnifying Mobile Apps Wayback Machine (iOS) Wayback Machine (Android) Browser Extensions Chrome Firefox Safari Edge Subscription Explore the Collections Learn More Build Collections Save Page Now Capture a web page as it appears now for use as a trusted citation in the Please enter a valid web address About Blog Projects Help Donate Contact Jobs Volunteer People Sign up for free Log in Search metadata Search text contents Search TV news captions Search radio transcripts Search archived web sites Advanced Search About Blog Projects Help Donate Donate icon An illustration of a heart shape Contact Jobs Volunteer People DONATE Latest Show All The Wayback Machine has not archived that Click here to search for all archived pages under https: skyblue.com . The Wayback Machine requires your browser to support JavaScript, please email if you have any questions about The Wayback Machine is an initiative of the Internet Archive , a (c)(3) , building a digital library of Internet sites and other cultural artifacts in digital Other projects include Open Library & . Your use of the Wayback Machine is subject to the Internet Archive s Terms of Use .   Wayback Machine We will keep fighting for all libraries - stand with us! Internet Archive logo A line drawing of the Internet Archive headquarters building faÃ§ade. Donate icon An illustration of a heart shape ""Donate to the archive"" Search icon An illustration of a magnifying Search icon An illustration of a magnifying Upload icon An illustration of a horizontal line over an up pointing Upload User icon An illustration of a person s head and Sign up | Log in Web icon An illustration of a computer application window Wayback Machine Texts icon An illustration of an open Books Video icon An illustration of two cells of a film Video Audio icon An illustration of an audio Audio Software icon An illustration of a "" floppy Software Images icon An illustration of two Images Donate icon An illustration of a heart shape Donate Ellipses icon An illustration of text More Hamburger icon An icon used to represent a menu that can be toggled by interacting with this Internet Archive Audio Live Music Archive Librivox Free Audio Featured All Audio This Just In Grateful Dead Netlabels Old Time Radio RPMs and Cylinder Recordings Top Audio Books & Poetry Computers, Technology and Science Music, Arts & Culture News & Public Af",startup,,nan,0.0
http://hirohealth.com,57367,crunchbase,"Wayback Machine We will keep fighting for all libraries - stand with us! Internet Archive logo A line drawing of the Internet Archive headquarters building faÃ§ade. Donate icon An illustration of a heart shape ""Donate to the archive"" Search icon An illustration of a magnifying Search icon An illustration of a magnifying Upload icon An illustration of a horizontal line over an up pointing Upload User icon An illustration of a person s head and Sign up | Log in Web icon An illustration of a computer application window Wayback Machine Texts icon An illustration of an open Books Video icon An illustration of two cells of a film Video Audio icon An illustration of an audio Audio Software icon An illustration of a "" floppy Software Images icon An illustration of two Images Donate icon An illustration of a heart shape Donate Ellipses icon An illustration of text More Hamburger icon An icon used to represent a menu that can be toggled by interacting with this Internet Archive Audio Live Music Archive Librivox Free Audio Featured All Audio This Just In Grateful Dead Netlabels Old Time Radio RPMs and Cylinder Recordings Top Audio Books & Poetry Computers, Technology and Science Music, Arts & Culture News & Public Affairs Spirituality & Religion Podcasts Radio News Archive Images Metropolitan Museum Cleveland Museum of Art Featured All Images This Just In Flickr Commons Occupy Wall Street Flickr Cover Art USGS Maps Top NASA Images Solar System Collection Ames Research Center Software Internet Arcade Console Living Room Featured All Software This Just In Old School Emulation Games Historical Software Classic PC Games Software Library Top Kodi Archive and Support File Vintage Software APK Software Software Library Software Sites Tucows Software Library Shareware Software Capsules Compilation Images ZX Spectrum DOOM Level CD Books Books to Borrow Open Library Featured All Books All Texts This Just In Smithsonian Libraries FEDLINK (US) Genealogy Lincoln Collection Top American Libraries Canadian Libraries Universal Library Project Gutenberg Children s Library Biodiversity Heritage Library Books by Language Additional Collections Video TV News Understanding 9 11 Featured All Video This Just In Prelinger Archives Democracy Now! Occupy Wall Street TV NSA Clip Library Top Animation & Cartoons Arts & Music Computers & Technology Cultural & Academic Films Ephemeral Films Movies News & Public Affairs Spirituality & Religion Sports Videos Television Videogame Videos Vlogs Youth Media Search the history of over billion web pages on the Search the Wayback Machine Search icon An illustration of a magnifying Mobile Apps Wayback Machine (iOS) Wayback Machine (Android) Browser Extensions Chrome Firefox Safari Edge Subscription Explore the Collections Learn More Build Collections Save Page Now Capture a web page as it appears now for use as a trusted citation in the Please enter a valid web address About Blog Projects Help Donate Contact Jobs Volunteer People Sign up for free Log in Search metadata Search text contents Search TV news captions Search radio transcripts Search archived web sites Advanced Search About Blog Projects Help Donate Donate icon An illustration of a heart shape Contact Jobs Volunteer People DONATE Latest Show All The Wayback Machine has not archived that Click here to search for all archived pages under https: www.hirohealth.com sales-marketing . The Wayback Machine requires your browser to support JavaScript, please email if you have any questions about The Wayback Machine is an initiative of the Internet Archive , a (c)(3) , building a digital library of Internet sites and other cultural artifacts in digital Other projects include Open Library & . Your use of the Wayback Machine is subject to the Internet Archive s Terms of Use .   FAQs: Sleep Apnea & CPAP Questions | Hiro Health Search Menu Close Cart Home CPAP Machines CPAP Masks CPAP Supplies Resources Log In Create Account Privacy and Cookie Policies Order Policies Shipping and Returns Sleep Apnea Quiz Download RX Form Supplies Replacement Tips Terms of Service Refund policy Your cart Close Cart Your cart is currently Continue browsing Enable cookies to use the shopping cart Menu Log In Hiro Health Home CPAP Machines CPAP Masks CPAP Supplies Resources Log In Search Cart Hiro Health FAQs FAQs: Sleep Apnea & CPAP Questions On this page: Sleep apnea CPAP therapy CPAP machines Health insurance sleep apnea testing ResMed CPAP machines CPAP BuyBack Program AirSense AutoSet AirCurve VAuto & AirCurve CPAP masks Humidification water chamber SoClean 2 CPAP BuyBack Program Sleep apnea What is sleep apnea? Derived from the Greek word for ""lack of breath,"" sleep apnea is a serious, potentially breathing disorder that is often linked with loud, heavy The most common form of sleep apnea is obstructive sleep apnea (OSA). Individuals with OSA experience repetitive episodes of obstruction of the upper airway during sleep, lasting anywhere from seconds up to 2 With no air flo",startup,,nan,0.0
https://shapermint.com,19189,crunchbase,"Tanks and Camis | Shapermint Shapermint in available credit Go Back MENU My Account Search Shapewear Panties Shorts Tanks & camis Leggings Bodysuits Sale Purpose FREE SHIPPING OVER $50 & FREE EXCHANGES close Search Cart ( 0 ) 0 $0.00 No products in the Shapewear Panties Shorts Tanks & Camis Leggings Bodysuits SALE Purpose Home Shapewear Showing all 9 results Shop Shop by Style CAMI (7) Size S (8) M (7) L (8) XL (8) (4) (2) Shop by Color NUDE (7) BLACK (8) RED (1) WHITE (5) Compression MEDIUM (4) Control Area TUMMY (7) WAIST (3) BACK (1) TORSO (4) Tanks and camis Select options Select options Empetua™ All Day Every Day Scoop Neck Cami $43.00 $29.99 2 Select options Select options Empetua™ All Day Every Day Tank Cami $43.00 $29.99 Select options Select options Co’Coon Spaghetti Strap Shaping Cami $30.00 $27.00 Select options Select options Co’Coon Katia Shaping Cami $26.00 $20.80 Select options Select options Co’Coon Square Neck Shaping Cami $30.00 $27.00 Select options Select options Co’Coon Shaping Cami $32.00 $28.80 Select options Select options Miraclesuit® Sexy Sheer Shaping Camisole $60.00 1 Select options Select options Naomi & Nicole® No ""Side-Show"" Waist Shaping Tank $38.00 $30.40 Select options Select options Maidenform® Firm Control shapewear Camisole $43.00 Tanks and Camis Looking for a wingwoman? Try going for Shapermint’s tank tops and camis that secretly contour and keep everything under control from the waist Wear them to a night on the town or to a weekend getaway - you will feel your inner gorgeous instantly shine From tummy extra skin to love handles to muffin tops - we can’t see those already but convince yourself with these nifty little shaping accessories . Some of them can even be worn as outerwear, providing a hidden perk: something to wear on laundry day that will make you feel fabulous instead of drabulous -) Shop by Style CAMI (7) Size S (8) M (7) L (8) XL (8) (4) (2) Shop by Color NUDE (7) BLACK (8) RED (1) WHITE (5) Compression MEDIUM (4) Control Area TUMMY (7) WAIST (3) BACK (1) TORSO (4) Shop by Brand EMPETUA CO COON CHAMELA TC MIRACLESUIT NAOMI & NICOLE WACOAL BALI MAIDENFORM Shapermint Info Our Purpose Ambassador Blog Refer a Friend Customer Care Help Center Returns & Exchange Track your Order Shipping Contact Us Join Us & Get % OFF! I M IN FOLLOW US Instagram Facebook YouTube All rights Terms & Conditions Reviews Scroll To Top Scroll To Top   Leggings - & Shaping Leggings | Shapermint Shapermint in available credit Go Back MENU My Account Search Shapewear Panties Shorts Tanks & camis Leggings Bodysuits Sale Purpose FREE SHIPPING OVER $50 & FREE EXCHANGES close Search Cart ( 0 ) 0 $0.00 No products in the Shapewear Panties Shorts Tanks & Camis Leggings Bodysuits SALE Purpose Home Leggings Showing 1–20 of results Shop Shop by Style LEGGINGS (21) Size S (17) M (17) L (17) XL (17) (11) (7) Shop by Color NUDE (3) BLACK (12) Compression LIGHT (1) MEDIUM (5) Control Area TUMMY (8) WAIST (5) LEGS (2) THIGHS (4) BACK (1) BUTT (1) HIPS (2) Select options Select options Empetua™ High Waisted Shaping Leggings $60.00 $39.99 Select options Select options Empetua™ Loungewear Shaping Leggings $50.00 $34.99 1 Select options Select options Empetua™ Faux Leather Shaping Leggings $70.00 $49.99 1 Select options Select options Empetua™ Burgundy Shaping Leggings $60.00 $39.99 1 Select options Select options Empetua™ Velvet Shaping Leggings $70.00 $49.99 Select options Select options Empetua™ Camo Shaping Leggings $60.00 $41.99 1 Select options Select options Co’Coon Butt Lifter Layering Legging $25.00 $22.50 Select options Select options Co’Coon Seamless Shaping Capri Leggings $42.00 $37.80 Select options Select options Co’Coon Seamless Opaque Basic Leggings $25.00 $22.50 4 Select options Select options Co’Coon Seamless Shaping Leggings $33.00 $28.05 3 Load more products Leggings Why hide shapewear under your clothes all the time? Shaping and tummy control leggings are the epitome of LOUD and PROUD! Make these and leggings part of your favorite activewear outfit or doll them up for a sophisticated date night You’ll love how comfy they feel! Here at Shapermint we have the best in women’s leggings brands to suit your legging There’s nothing quite as sexy as feeling % comfortable in your own skin - and nothing more versatile than shapewear leggings ! Grab a pair and experience the magic of shaping activewear for Shop by Style LEGGINGS (21) (3) (2) Size S (17) M (17) L (17) XL (17) (11) (7) Shop by Color NUDE (3) BLACK (12) Compression LIGHT (1) MEDIUM (5) Control Area TUMMY (8) WAIST (5) LEGS (2) THIGHS (4) BACK (1) BUTT (1) HIPS (2) Shop by Brand EMPETUA CO COON CHAMELA TC MIRACLESUIT NAOMI & NICOLE WACOAL BALI MAIDENFORM Shapermint Info Our Purpose Ambassador Blog Refer a Friend Customer Care Help Center Returns & Exchange Track your Order Shipping Contact Us Join Us & Get % OFF! I M IN FOLLOW US Instagram Facebook YouTube All rights Terms & Conditions Reviews Scroll To Top Scroll To Top   Shaping ",startup,,nan,0.0
https://shortcode.tech/,2218,crunchbase," ShortCode Technologies | Making Technology Affordable Home About Contact Achivements Our Work Home About Team Services Work Clients Blog Contact We believe technology will save the world . We are Believers BUILDING SOLUTIONS, ONE < AT A WHAT WE DO abou WHAT WE DO WE’RE SOLVING PROBLEMS MAYBE NOT “MEANING OF LIFE” TYPES OF PROBLEMS, BUT WHEN YOUR BUSINESS NEEDS CUSTOM TECHNOLOGY THAT DOESN’T EXIST YET, WE MAKE NO MATTER THE SIZE OR YOUR BUSINESS, WE’RE HERE TO HELP YOU INCREASE PRODUCTIVITY AND EXPAND YOUR COMPANY WEB APP DEVELOPMENT We have our expertise in a range of technologies to build cutting edge Web Applications to boost your business WEB DESIGN Clean, Minimalistic and Effective UI UX Design is what we strive TECHNOLOGY CONSULTING Landed a gig and not sure if you can execute it all alone? We are here to BRAND & IDENTITY Looking for a Website and mark your presence on Social Media? This is MOBILE APP DEVELOPMENT Be it IOS or You choose, we DATA ANALYTICS Use Data to make the technology work for abou HOW WE DO You could say our code is shorter than Shorter than most where it REQUIREMENTS We look at your business from your eyes with our minds to gather MOCKUPS Design and Demo a rich experience HTML Mockup to visualize the end TIMELY PROJECT DEMOS Breakdown the Entire project into several phases and present them at timely TESTING Creating solutions and fixing bugs is our Bread & DEPLOY Cloud Servers or Local Your choice, our MAINTENANCE Forget the Technical 7 support, a phone call GET CONNECTED Get yourself ready for an amazing experience with ShortCode and be caught up with 3 amazing products coming out by January achivements OUR ACHIEVEMENTS Each completed project makes us even more Hungry for more designs, more code and at least some more As a result, we deliver a better web achivements ourwork OUR WORK We believe our work speaks for Browse our most recent projects below that are built with love for every ourwork READY TO DISCUSS A PROJECT? WE ll TAKE CARE OF THE 1 s and 0 s. OUR ADDRESS Boehm Drive, Lenexa, KS (913)231-8905 DROP US A LINE Your Name (required) Your Email (required) Subject Your Message Please type ""Yes"" to submit SHORTCODE TECHNOLOGIES All Rights Reserved ",startup,,nan,0.0
https://bballwriters.com/,27862,crunchbase,"Europe - The Basketball Writers Search Skip to content MENU MENU Home NBA Analysis Analytics Basketball Intelligence Profiles Opinion Hoops Universe Europe Podcast WNBA History Fantasy Authors Joel Cordes Ben Dull Nekias Duncan Ray LeBov Sara Peters Kelly Scaletta Jeff Siegel Adam Spinella Antonis Stroggylakis Bryan Toporek Login Join The Basketball Writers Elevate the Elevate the From Europe EuroLeague Playoffs: Key Performances from the Quarterfinal Series by Antonis Stroggylakis Rounds 1 and 2 of the EuroLeague playoffs are on the The first week of the quarterfinal series held a bunch of stunning, truly historic upsets that leave room for a potential surprise regarding the teams that will advance in the Final Heavy underdog Zalgiris Kaunas stunned mega powerhouse Fenerbahce Beko –… Want ALL our amazing content? Subscribe to The Basketball Writers: Join Today Keep reading Vasilije Micic Shows He’s Got Right Stuff for Philadelphia by Antonis Stroggylakis Philadelphia fans are currently busy watching their team bouncing back in the playoffs, taking a lead over the Brooklyn Nets following a stunning Game 1 Though the Sixers seemed to gain control of the series and show that they are indeed the favorite, this doesn’t mean certain issues regarding the team’s depth… Want ALL our amazing content? Subscribe to The Basketball Writers: Join Today Keep reading 5 Players NBA Fans Should Pay Attention to During EuroLeague Playoffs by Antonis Stroggylakis The EuroLeague playoffs begin Tuesday, April , with the game between CSKA Moscow and Baskonia in This is just one of the quarterfinal matches where there are players that may potentially attract NBA interest during the offseason or the further For fans that are looking to spice up their NBA playoffs meal… Want ALL our amazing content? Subscribe to The Basketball Writers: Join Today Keep reading Former Slam Dunk Champ Jeremy Evans Works Toward NBA Return by Antonis Stroggylakis There are two different angles to Jeremy Evans’ maiden EuroLeague campaign with Turkish club Darussafaka On one hand, he was the top performer for his team in two different competitions (EuroLeague and Turkish League) while showing some significant On the other, there was the fact that Darussafaka finished at the bottom of the… Want ALL our amazing content? Subscribe to The Basketball Writers: Join Today Keep reading Nick Calathes’ EuroLeague is the Stuff of Legends by Antonis Stroggylakis The night of April was one for the EuroLeague history With a bit more than six minutes remaining in the Round game between Rick Pitino’s Panathinaikos Athens and Buducnost Podgorica (the team featuring prospect Goga Bitadze), Greens’ guard Keith Langford made the drive and the jump stop from He missed,… Want ALL our amazing content? Subscribe to The Basketball Writers: Join Today Keep reading Euro Shooters for NBA Teams to Shop This Offseason by Antonis Stroggylakis Ryan Broekhoff and, most recently, Dairis Bertans are two players that cashed in on phenomenal shooting sprees in Europe by signing the first NBA contracts of their Two seasons ago, Darius Miller also saw a fine EuroLeague run pay off when the New Orleans Pelicans called him back to their The NBA will… Want ALL our amazing content? Subscribe to The Basketball Writers: Join Today Keep reading Stashed San Antonio Spurs Showing EuroLeague Game by Antonis Stroggylakis Let’s take a look at some of the performances by two (plus one) EuroLeague players in this round’s action and one lap before the end of the competition’s regular While two of them suffered a defeat that could bring their team’s campaign to an end, the other helped prevent his squad from falling… Want ALL our amazing content? Subscribe to The Basketball Writers: Join Today Keep reading Cory Higgins Can be Europe’s Top NBA Sleeper by Antonis Stroggylakis When the name CSKA Moscow is discussed, usually the first players that came to mind were Nando De Colo or Sergio Probably EuroLeague champion Kyle Hines, as Before the beginning of the season, few would consider Cory Higgins an equal variable in CSKA’s He has been flying mostly under the… Want ALL our amazing content? Subscribe to The Basketball Writers: Join Today Keep reading Marcus Eriksson Could Be Atlanta Hawks’ Next Shooter by Antonis Stroggylakis Atlanta Hawks stashed wing Marcus Eriksson led Gran Canaria to quite possibly the biggest triumph in the team’s maiden EuroLeague More importantly, his shooting virtues were on full It took just :24 minutes for Eriksson to score points in what was a blowout win against Olympiacos The Swedish swingman shot … Want ALL our amazing content? Subscribe to The Basketball Writers: Join Today Keep reading NBA Hopefuls Daryl Morey Likely Scouted in Istanbul by Antonis Stroggylakis Houston Rockets General Manager Daryl Morey attended the EuroLeague Round game between Fenerbahce Beko and Barcelona in Istanbul, Turkey—two squads with talent in abundance and several players potentially appealing to NBA A",startup,,nan,0.0
