website,text_len,source,text,type,closest_snapshot,closest_snapshot_time,snapshot_in_window
https://www.alwaysbringsunscreen.com,35331,crunchbase,"Dreams Punta Cana Resort: Our Review Home Beaches Turks & Caicos Dreams Punta Cana Eurodam Alaska About Us Always Bring Sunscreen Home Beaches Turks & Caicos Dreams Punta Cana Eurodam Alaska About Us Our Family May 8, Dreams Punta Cana Resort: Our Review Our Family May 8, Our trip to Dreams Punta Cana was mostly smiles despite a few hiccups early in the Dreams Punta Cana Resort & Spa is an family resort on Uvero Alto beach in the East Coast of the Dominican It s a spacious property that has a world class pool, fun activities and excellent Punta Cana is an expensive place despite some major shortcomings (e.g. the water is not safe to drink ). Nevertheless, Uvero Alto beach is home to many destination weddings and luxury resorts for families and Our family spent a week at Dreams Punta We had a great time despite a rocky start and what we feel is too high of a price (Our stay was more than $6,000 including Dreams Punta Cana isn t worth it for everyone .) We hope our experience will help you decide if a stay at Dreams is worth it for your Happy reading and safe travels, wherever you decide to go! Pros Pool - Dreams has the best pool we ve It s gigantic and snakes like a river down the center of the There are perfect spots for swimming, relaxing, watersports and family activities, plus, a bar and plenty of shady spots to hide away Activities - The activity leaders at the resort are personable and “pushy” in the right kind of way: They motivate people to attend the daily events and have fun with each Buffet - Dreams World Cafe has great service and a remarkable spread of international The baked goods and deserts are among the best we ve had (they re baked daily at 3 ). Childcare - Our daughter had a blast at the ""Explorer s Club,"" and begged to stay there each day from 9:30 to 9:30 She also enjoyed the resort’s food, drink and Facilities - The buildings at Dreams are capped at three stories and decorated with Taínos inspired There are coral fossils in the sidewalks and flamingos roaming the It s a spacious place that s romantic at Dreams Punta Cana has tasteful landscaping and lots of space, creating a relaxed Cons Water - With the exception of bars and restaurants, the water at Dreams (and most of Punta Cana) is not safe to Brushing our teeth with bottled water felt Spotty Service - Some of the staffers on the resort were unhelpful, unfriendly, or The end result was a trip with and Being able to communicate with the staff in Spanish was a Airport Transfers Not Included - Dreams is not a cheap resort and we were disappointed that we had to arrange our own transportation to and from Punta Cana International Airport (which cost around $200 extra). Aggressive Vendors - The resort allows vendors on its They sell cigars, artwork and We found them annoying, aggressive and unwilling to take ""no"" for an Advertisement: Our Verdict and Rating 4 out of 5 - Dreams Punta Cana gets many things wrong, but what it does well more than compensates for those This is a fun resort that we d be happy to visit Non-Spanish speakers should subtract half a point from this Additionally, we would have rated the resort a full point lower had we not booked a ""Preferred Club"" room (that unlocked certain benefits around the resort). Our trip could have been ""2.5 out of 5"" under a slightly different set of Dreams Punta Cana Reviews Trip Advisor - out of 5 - ,418 reviews Family Vacation Critic - 5 out of 5 Oyster - 4 out of 5 WeddingWire - out of 5 - reviews - out of 5 - reviews What s Included in the ""Unlimited Luxury"" (i.e. All Inclusive) Price? Food, including all meals and snacks Alcohol, including beer, wine and spirits Childcare for children ages 3 to Teen club with daily activities Daily classes, activities and sports Stage shows and entertainment watersports (e.g. kayaks, paddleboards) Cribs and rollaway beds room service Gym access Towels and Tips and What s Available, but Not Included in the Price? Premium wines Private dining Spa services Butler service Laundry service Private cabanas Bring your dog Golf Amstar tours and excursions Horseback riding Scuba diving Motorized watersports by SeaPro Casino Babysitting Hair braiding Weddings Late check out and Preferred Club amenities (see below). A Note About the ""Preferred Club"" The hors d oeuvres at Dreams’ Preferred Club Lounge are worthy of a standalone There is no difference between a Dreams ""Deluxe"" room and a ""Preferred Club"" room, as far as the room itself goes . A preferred room unlocks various privileges and amenities throughout the There are major advantages to booking a preferred room: Preferred guests are allowed to access the Preferred Club Lounge, which houses the best bar on the resort and a wonderful buffet of gourmet snacks (from 7 to ) The best seating on Uvero Alto beach (including cabanas with mattress beds) is reserved for preferred club members and Preferred guests can request a goose feather pillow to replace the foam pillow that all rooms have by default (the down pi",startup,,nan,0.0
https://ihuddl.com,15931,crunchbase,"Business - iHuddl [L]earn Videos Business About Us Sign Up [L]earn Videos Business About Us Sign Up The Most Dynamic Wealth Offering with open APIs We enable banks, financial institutions and companies to rapidly and seamlessly add the most innovative social investment platform to their existing Let s Talk The Most Dynamic Wealth and Investment Platform We enable banks, financial advisors and institutions to rapidly and seamlessly add the most innovative social investment platform to their existing software solutions . Let s Talk Upgrade Your Offering with a Turnkey Wealth Solution We enable enterprises to offer their customers a powerful wealth solution with no heavy Expand Your Offering We enable companies to rapidly expand their product lines into wealth iHuddl and our partners handle all of the heavy lifting, so you can deepen customer relationships and your value iHuddl truly provides a seamless wealth solution . Grow Your Business Our platform was designed to allow individuals or firms to grow their retail customer segments and expand product We handle the platform, software partnerships, and personalized customer interactions, while you focus on your core competencies and growing your Friction Eliminated Whether expanding your product set or enhancing your current business, new and existing customers demand a unified solution for banking and wealth Easily add the most innovative, engaging and powerful wealth management solution in the industry in a matter of Our Product – Consumer Benefits Our platform brings your customers a new era of wealth management at the touch of their Our unique aggregation technology allows your customers to invest like they have millions in This technology enables your customer to access: Hundreds of investment managers, strategies and products once only available to the Greatly reduced Our platform’s offer investment management fee reductions of up to %. social We’ve layered a full social capability on top of an investment The First Solution that Delivers the Next Generation of Wealth Management Why iHuddl? Scale with Confidence We’ve leading vendors to perform all necessary functions at Focus on expanding your services and attracting customers, not on Compliance Covered iHuddl leverages licensed banking partners and trusted investment advisors registered with the SEC to ensure full Integrate in Days not Months iHuddl is a fully scalable, wealth platform that can be integrated on your mobile application or website in a matter of Ready? Let’s start a Contact Us Company Home [L]earn Videos Business About Us Legal Privacy Policy Terms of Service Business iHuddl Thesis SMART CONTRACT (ERC20) Looking for an innovative wealth offering? We partner with banks, RIA’s and Asset Managers contact us Copyright © | iHuddl | All Rights Reserved | Designed By Sociolus Privacy Settings We use cookies to enhance your experience while using our If you are using our Services via a browser you can restrict, block or remove cookies through your web browser We also use content and scripts from third parties that may use tracking You can selectively provide your consent below to allow such third party For complete information about the cookies we use, data we collect and how we process them, please check our Privacy Policy Youtube Consent to display content from Youtube Vimeo Consent to display content from Vimeo Google Maps Consent to display content from Google Save X Huddl beta coming soon! Apply here to This site uses cookies to provide the best online By using this site, you agree that we may store and access cookies on your Close   [L]earn - iHuddl [L]earn Videos Business About Us Sign Up [L]earn Videos Business About Us Sign Up [L]earn The Best High Yield Savings Accounts in Radius Bank Partners with iHuddl Top Trends in ETFs Best Student Loan Options Best Checking Accounts for Students and Entrepreneurs Huddl News iHuddl, A Social Network For Investors Seasoned Financial Executive Stephen Corliss Serves as iHuddl CEO Radius and iHuddl Embark on Long Term Partnership Videos & Podcasts Founders’ Vision Access Granted! With Vishal Karir FinTech Unfiltered: Corliss on Move to iHuddl More iHuddl Financial Services Are Highly Exclusive – But They Shouldn’t Be The Value of Social Networks Huddl’s Powerful Financial Technology Partners Company Home [L]earn Videos Business About Us Legal Privacy Policy Terms of Service Business iHuddl Thesis SMART CONTRACT (ERC20) Looking for an innovative wealth offering? We partner with banks, RIA’s and Asset Managers contact us Copyright © | iHuddl | All Rights Reserved | Designed By Sociolus Privacy Settings We use cookies to enhance your experience while using our If you are using our Services via a browser you can restrict, block or remove cookies through your web browser We also use content and scripts from third parties that may use tracking You can selectively provide your consent below to allow such third party For complete information about the cookies",startup,,nan,0.0
http://coolcities.com,1336,crunchbase, CoolCities Download Home How It Works FAQ Terms Discover new places and share them with your friends and followers CoolCities is all about your lifeâs adventures and Bookmark all the places you like and wish to See where cool people have Share your experiences with others What can I do in CoolCities? Discover Bookmark Meet Browse the news feed and discover new Click on button wish to go or have been to add the place to your bookmarks Share a place with your friends and on your social media See who wants to go or has been there Discover where the cool people go We made it easier for you to keep record of all the beautiful places you have been and all the new places you wish to Keep a virtual diary of every place you have ever been Access your favorite places from any device and see them on the map Share your global footprint and showcase your travels Be the first to discover a place and earn points Connect with others who like the same places and message them to hang out Keep in touch with old friends Get to know someone new Build your community See where cool people go Available on iOS and Android Get your version of CoolCities from App Store or Google We are constantly improving and adding new and interesting Available on the App Store Available on Google Play CoolCities developed by Factory World Wide and Web ,startup,,nan,0.0
https://www.idahonotarysigningagent.com/,22990,crunchbase,"Remote Online Notary Idaho Call Today : (208) idaho notary signing agent Home Services Notary Process Boise Notary Remote Online Notary Blog About Jim Allen X schedule your appointment Remote Online Notary What Is Remote Online Notarization (RON)? Also known as virtual notarization, this is where the notary public uses online communication to administer oaths and witness the signing of important This allows participants from different locations to participate in the notarization Idaho’s Most Trusted Mobile Notary Public From taking care of your financial documents to refinancing a loan or a mortgage, you’ll certainly need the services of a notary in But physically notarizing documents can be and This is where our mobile notary service comes As your online notary public in Boise, ID, we use Authentication (KbA) technology to conduct your notarization sessions For the process to work, you must be a citizen and have a photo ID, and an email address since our KBA will ask you five security questions based on your ID, social security number, and credit We also recommend you use your computer or laptop to ensure a strong and dependable connection of at least How Does Remote Electronic Notarization Work? STEP 1: UPLOAD A DOCUMENT You will send us the document that needs notarization via email or cloud services, and we’ll upload it to the signing STEP 2: PROVE YOUR IDENTITY We’ll send you a link so you can verify your In this process, you’ll need to answer a series of Also, you should take a picture of your ID and upload it, and we’ll confirm your identity in STEP 3: CONNECT WITH OUR LIVE NOTARY AGENT Once we’ve verified your identity, you’ll receive another link to meet with our licensed notary public via You’ll then electronically sign your document, and we’ll add our notary The whole session will be STEP 4: RECEIVE YOUR NOTARIZED DOCUMENTS You’ll get an email with the notarized copy of your document straight Why Choose Idaho Notary Signing Agent? EXPERTISE We have knowledgeable and experienced notaries that are ready to walk you through the entire notarization SECURITY AND COMPLIANCE We understand how sensitive your documents This is why we ensure your documents are uploaded to secure cloud We only allow the notary access to your documents for a limited time Once the signing is complete, we’ll remove all access to your FULL ACCOUNTABILITY We track every action involved in the notarization process, giving us a complete record of every file that goes through our MOBILE NOTARY SERVICE Whether you need notarization of mortgage documents, wills, or power of attorney, we’ll get it done PRIVACY AND CONVENIENCE We notarize your documents from the comfort of your home or office without fear of sharing or misplacing your important How Does Remote Electronic Notarization Work? I am committed to making my RON (Remote Online Notary) or eNotaryservices as easy as possible for my Here is what you can expect: You will send me your document and I will upload it to the signing You will receive a link to verify your identity, where you will answer a series of questions and upload images of your state issued Once I have verified your identity, you will receive another link to meet with We will meet via webcam (this is a requirement) to electronically sign your document and I will add my notary The session will be You will receive an email with the notarized copy of your document Frequently Asked Questions About Notarizing Documents Remotely How will you verify my identity online? I use Knowledge Based Authentication (KbA) since a notary remote cannot physically inspect your The KBA will ask you five security questions based on your social security number, credit report, and state issued For this to work you must be a citizen and have an email address and have a state issued photo ID (can be a driver’s license or a passport). What equipment is needed for you to notarize documents online? I recommend a computer or laptop to ensure a strong, reliable connection of at least Your computer or laptop needs to have a webcam and working Phones are not recommended because the speed and reliability of data is not high If there is more than one person signing a document, a separate laptop or computer is needed for each Will I need to download any software for virtual notary services? No! As long as you have a webcam, microphone (built-in works great) and an updated operating system on your computer, you won’t need any special Use Chrome (recommended) Safari, or Firefox as your web Schedule an Appointment Click here Links Home Services Notary Process Boise Notary Remote Online Notary Blog About Jim Allen Menu Home Services Notary Process Boise Notary Remote Online Notary Blog About Jim Allen Contact Mailing Address: N Elmstone Ave, Meridian Idaho Phone: (208)-258-0285 © Idaho Notary Signing Agent, All Rights Privacy Policy Facebook   Notary Services in Boise, ID Call Today : (208) idaho notary signing agent Home Services Notary Process Boise N",startup,,nan,0.0
https://aidevelopmentservice.com/,10419,crunchbase,"Contact Us Menu Automation AI Product & Services NLP Chatbots AI Software AI App Web Predictive Analytics Computer Vision Hire AI Engineers Data Science Consulting Automation Anywhere Data Science Consultancy Infrastructure Consultancy AI Business Advice Technology Consulting Machine Learning Our Work Case Study Testimonial Research Papers Awards & Media About Us Contact Us Contact Us Get in touch with our experts for development services to have an edge over Let s Talk About For Your Business Location 3 Germay Dr, Unit 4 #2826 Wilmington, DE United States Make A Call +1 (302) Send An Email [email protected] × Better Software That Think: Making AI accessible to everyone, everywhere: Get Trust Worthy Artificial Intelligence (AI) Consulting Services & Solutions in Contact Phone: +1 (302) Email: [email protected] Address: 3 Germay Dr, Unit 4 #2826 Wilmington, DE United States Product Development AI Sofware Development AI Mobile App Development AI Web Application Chatbot Development Computer Vision Technologies NLP Predictive Analytics Machine Learning Automation Anywhere Blockchain Consultancy Data Science Consultancy Infrastructure Consultancy AI Business Advice Future Market Technology Consulting More About Us About Us Contact Us Disclaimer Refund Policy NDA Policy Our Work Case Study Testimonial Research Papers Awards & Media Blogs Social Links Copyright by AI Development All Rights   Artificial Intelligence AI Development Company & Services in California (CA) Menu Automation AI Product & Services NLP Chatbots AI Software AI App Web Predictive Analytics Computer Vision Hire AI Engineers Data Science Consulting Automation Anywhere Data Science Consultancy Infrastructure Consultancy AI Business Advice Technology Consulting Machine Learning Our Work Case Study Testimonial Research Papers Awards & Media About Us Contact Us AI Development Company & Services in California Empowering businesses worldwide to start their digital transformation journey and adopt solutions Leverage our best AI development services USA to implement solutions for improved productivity, efficiency, and Get Started Software That Think: Making AI accessible to everyone, everywhere AI Value Identification Create a user journey map and identify areas of improvement to unlock new opportunities with AI development services AI Value Validation Generate rapid insights and validate relevant AI use cases to move your business beyond technologies and automation AI Value Realization Realize the true potential of solutions with better data management, predictive analysis, and % of businesses are seeing an increase in the sales of new products & services by implementing sales % of organizations are investing in advanced business tools to enhance workforce capabilities and % of organizations are able to enhance their customer satisfaction by more than % using advanced AI chatbot % of businesses implement solutions for better data analysis, gain new insights, and enhance Benefits You can benefit from the advice of an AI development and consulting company as you consider their artificial intelligence development services California and your possible AI and machine learning The Artificial Intelligence market size was valued at $136.6 billion in and is expected to reach $1 billion by AI technologies offer tremendous value to software product firms and end users if used in the right Object Detection The Most Personalized Object Detection Build AI technology that fits perfectly for various With the help of personalized object detection, the user will get the power in hand to find any specific object online with more It will help the users for scanning objects like apparel, customized products, jewelry, suspicious objects, unusual objects, Get Started Pose Estimation Custom Face Recognition Pose Detection Facial recognition is broadening the platform and helping researchers and solution developers stick to the rules of virtual Deep learning algorithms and computer vision are used in facial recognition Large quantities of tagged image data are needed to train the deep learning algorithms utilized in facial recognition software to discover patterns and relationships among facial Get Started We Provide Advanced AI Application Development Services CA We cover the AI development and consulting services market, and here is the list of best AI development services USA to develop unique Generic AI Voice Get reliable and versatile AI based voices with no failure response by our AI development company & Self Learning Highly Audible Tone Multiple Languages Facial Recognition Software Build the platform with facial recognition software with the advanced technology used by the best AI development company in Highly accuracy Backup Faster Face Detection Machine Learning With our best AI development services California, you can efficiently automate the process while combining the machine learning requirements for your development Predictive Analytics Neural Network Developm",startup,,nan,0.0
https://academicly.io,58,crunchbase, Academicly - Find the best colleges | Talk to Admissions ,startup,,nan,0.0
