website,text_len,source,text,type,closest_snapshot,closest_snapshot_time,snapshot_in_window
https://www.pricepulse.app/,27009,crunchbase,"Contact Amazon Price Tracker | Pricepulse Hot deals Chrome Extension Amazon Price Tracker Download app Contact Pricepulse Contact us If you have questions, feedback, or just want to say hi, please send us reach out to us! Send Hot deals | Chrome Extension | Amazon Price Tracker | Nintendo Switch | Contact Welcome to Pricepulse! Track any Amazon product and start saving money now!   Amazon Best Deals | Pricepulse Home Hot deals Chrome Extension Amazon Price Tracker Download app Contact Pricepulse Categories Amazon Featured Deals Amazon Devices Baby Products Board Games Cell Phones Children s Books Computers Features Digital Cameras Dog Supplies Electronics Features Face Moisturizers Household Supplies Kitchen & Dining Features Kitchen Utensils & Gadgets LED Bulbs Laptops Leggings Nintendo Switch Snacks Sneakes for Men Sneakes for Women Surveillance Cameras Tablets Television Toys Xbox One Discover the best Amazon Deals Lowest price ever $74.73 % OFF Hampton Hill Brooks Desk Lamp, Bedside Nightstand Bedroom Light Modern Luxe Design, Metal Post with Adustable Neck Angle Stand, Tapered Shade, "" Tall, Black Gold $22.98 % OFF Sonic Mania Plus - Xbox One Lowest price ever $20.49 % OFF Nanoblock Deluxe Giraffe Building Kit, Orange Lowest price ever $20.44 % OFF Pack - Hyleys Days Cleanse Kit - Tea Bags (100% Natural, Sugar Free, Gluten Free and ), Fl Oz Lowest price ever $15.92 % OFF V8 +Energy, Healthy Energy Drink, Natural Energy from Tea, Pineapple Coconut, 8 Ounce Can (4 Packs of 6, Total of ) $40.02 % OFF Vans Unisex Adults Old Skool Classic Suede Canvas Sneakers, Yellow (Ochre True White), 5 UK (38 EU) $8.27 9% OFF Huggies Little Movers Baby Diapers, Size 6, Ct $45.97 % OFF Steve Madden Women s Caliber, Black Suede , 7 M US $45.01 % OFF adidas Women s Grand Court, White dust Pink White, M US Lowest price ever $653.90 % OFF GlassTek "" Smart TV Mirror Magic Mirror $14.99 % OFF Couch Defender for Cats | How to Stop Pets from Scratching Furniture | Anti Scratch Mattress Protector | Chair and Sofa Deterrent Guards | Corners Scratch Cover | Claw Proof Pads for Door and Wall $15.47 % OFF Green Toys Tug Boat & Submarine Combo Pack $28.98 % OFF Ocean Spray Craisins Dried Cranberries Original (24 Ounce, Pack of 8) Lowest price ever $115.99 % OFF MISC Resin Table Lamp Led Bulb Included "" White Nautical Coastal Lowest price ever $16.97 % OFF Diet Mountain Dew (12 cans, ) Lowest price ever $19.89 % OFF The Eiger Sanction (Special Edition) [Blu-ray] Lowest price ever $26.23 % OFF Breyer Traditional Lil Ricky Rocker Horse Toy Model Lowest price ever $29.97 % OFF Sperry Men s Striper II CVO Gingham sneaker, Blue, M $6.78 9% OFF Taylors of Harrogate Irish Breakfast, Teabags Lowest price ever $1.19 % OFF Cambro Camwear RFSCWC1135 Pack of 1 Round Covers for 1 qt Container 1 2 3 ... Next Browse site Home Hot deals Chrome Extension Amazon Price Tracker Download app Blog Contact Best deals Tops all time Tops last month Tops yesterday Lowest price ever Legal Terms and conditions Privacy Copyright Follow us Twitter Instagram Facebook Install app iOS Android Chrome extension   Amazon price Price history Amazon in Pricepulse Amazon Price Tracker | Pricepulse Home Hot deals Chrome Extension Amazon Price Tracker Download app Contact Pricepulse Amazon Price Tracker You’ve just run into one of the best discoveries and there is no turning back from this! We are all aware of how prices fluctuate on Amazon and how difficult it may be to find the best prices for any item you want to But no need to worry Pricepulse is here to make things a lot easier! Learn more about Pricepulse Watch this video and learn how Pricepulse works for you! Download Pricepulse app Install Pricepulse for free and get notifications of prices drop to know when is the perfect time to Popular products $169.00 Average Apple AirPods with Wireless Charging Case $99.99 Average Echo Show 8 -- HD smart display with Alexa – stay connected with video calling - Charcoal $25.98 Average Wyze Cam HD Indoor Wireless Smart Home Camera with Night Vision, Audio, Works with Alexa & the Google Assistant, One Pack, White - WYZEC2 $22.99 % OFF Smart Plug Compatible with Alexa Google Assistant for Voice Control, Teckin Mini Smart Outlet Wifi Socket with Timer Function, No Hub Required, White FCC ETL Certified $79.00 7% OFF Instant Pot Duo Electric Pressure Cooker, Sterilizer, Slow Cooker, Rice Cooker, Steamer, Saute, Yogurt Maker, and Warmer, 6 Quart, Programs $17.99 High The Pink Stuff - The Miracle Paste All Purpose Cleaner $18.93 High Lysol Disinfecting Wipes,80 Wipes Tub, Lemon Lime Blossom $234.00 Average Apple AirPods Pro $24.95 % OFF Clorox Disinfecting Wipes Disinfecting Fresh Scent, Lemon Canister Count $5.99 High Clorox Disinfecting Wipes - Canister $134.95 Average Apple AirPods with Wired Charging Case $49.99 High Fire TV Stick streaming device with Alexa built in, Dolby Vision, includes Alexa Voice Remote, latest release $49.99 Average Echo Dot (3rd Gen) - Smart speaker with Ale",startup,,nan,0.0
https://dresspass.co/,502,crunchbase," Expired - domain expired dresspass Domain Suspension This domain has expired and is now If you would like to restore it please contact the registrar used to register your You can check the registrar used for your domain at . Este dominio ha expirado y está ahora Si usted es el titular del dominio y quisera recuperarlo, por favor contacte el registrador que fue usado para registrar el Search for your ideal Web Address Get it now before it s gone! Copyright Internet All rights Terms Privacy Policy ",startup,,nan,0.0
https://www.travelodaddy.com/,91181,crunchbase," Best Flight Reservation Agency | Contact Us| TraveloDaddy Upto $50 off on Flight Tickets Flight (current) Register Login Contact Us state Suite New York City, NY Send Query for Assistance Send Query ﻿ Quick Links About Us Terms & Conditions Privacy & Cookies Refund Policy FAQ s Blog Contact Us Get in Touch : Get in Touch Disclaimer TraveloDaddy is a swiftly growing company carried out with the basic plan of action for more movement of an individual around the Our endeavor helps in fetching the flight at a rate with the reservation technique along with the in house experts of the travelers who assist you all time From providing the easy to undergo booking gadgets to the voyagers we are here to resolve the problems that fall in your way with the flight Together with the classified and extraordinary group of innovative actions we are here for Our team of experts is present with the round the clock help that can work wonder in determining the arrangements of Additionally from the aircraft, vehicles to the inn accomplices, we can book the best deal for Coming together with the involvement of all the inns we help in dealing across financial limits from each niche along with Here we are for you with all the joined forces with travel accomplices that can grow with global For gathering the support related to arrangers with the travel we get the best for Our relationship with clients can help in bringing a better change carried out with the recent offers along with With the togetherness of significant goals, we can weave with the customized arrangements related to your feelings of taste along with a © Copyrights Travelo Daddy deals All rights Sign in or register to unlock Member Only Deals and more savings Authorised Online Booking Site Customer Service Low Airfare Guaranteed % Safe Purchase Guaranteed One click with Google Enter Your details Already Registered Click Here Sign in or register to unlock Member Only Deals and more savings Authorised Online Booking Site Customer Service Low Airfare Guaranteed % Safe Purchase Guaranteed One click Log In with Google Enter Your details Forget Password For new registration Click Here × Sign in or register to unlock Member Only Deals and more savings Authorised Online Booking Site Customer Service Low Airfare Guaranteed % Safe Purchase Guaranteed Enter Email Id Submit  ﻿ Terms & Condition Upto $50 off on Flight Tickets Flight (current) Register Login Terms And Conditions Terms and conditions are important to look forward to more and essential detailing about our By accessing our TraveloDaddy portal, you can come up with all the rules that are needed to abide In case your will is not to follow these terms and conditions, kindly do not download any material or the necessary detail from the Terminal Scope The listed below terms and conditions apply to the services, material along with all the resources that are enlisted in the TraveloDaddy For all the services related to flight booking, graphics act as a tool on our The booking or the schedule is carried in the activity or the specific terms of the We list up the promo code along with the payment performance that needs to add up in the general content which can be Web portal Permit Our major and the lined up focus is to make the digital property available on the net to all the clients so that they can make the selection collectively from different domains may it be domestic or Booking on ways with the flight trip to the destination of your choice is what we focus all So, go through all the detailing carefully so as to make our work more clearly in all the visions Our lined up focus will be on to make you aware of the Privacy Policy that can help in protecting the The continued usage of our web portal will make you accept the terms and conditions without your Our reservation of the rights to make the best choice of the Terms with the prior notice is laid The Terms that are amended can be effective automatically and be updated in accordance to the Make sure to get back to our page so as to review the Terms & Conditions BY GETTING OVER THESE DETAILING YOU ARE AGREEING TO THE ESSENTIAL ARBITRATION AND WAIVER CARRIED RIGHT All the statements that are carried in the Terms & Conditions carry all our affiliates along with the parent organizations along with the General detailing TraveloDaddy does not offer you the flight service, but it makes sure that the client gets the best deal with their We make an apt arrangement to shield the interest at the lowest Our site helps in comparing the flight along with the services that one is going to avail From date, time to the availability of the flight we have the best for the The discount is offered at a great peak under our We can help in booking the reservations along with the contract to the site which can be chosen We help in managing the flight according to the total price, fees along with extra Safety with Shopping WE are here to exercise reasonable measures along with the viable measure",startup,,nan,0.0
https://www.degomglobalmarketing.com/,19402,crunchbase,"Social Media Marketing Agency | Social Media Marketing Digital Marketing & Management Agency Our Services Blog Why Us? Contact Us More Free Consultation Social Media Marketing ​ Increase Traffic to Your Business Using Social Full Name E M A I L P H O N E Social Media Username Get Started An Agent will contact you shortly Your Social Media Marketing Agency Social media related sites and pages reach 8 out of of all Internet And, % of Internet users are more inclined to make a purchase from a brand that they are following on social media platforms such as Instagram or Some Badges We re Proud Of Search Engines Love Social Media Search engines, like Google and Bing, are beginning to integrate social platform updates such as Tweets, social profiles, Facebook ratings, and comments into their results This is going to be a huge factor now and in the future, as people are searching for social proof before a purchase more and Recognizing the importance of social interaction will be a tremendous beneficiary to your As the social media community grows and evolves, the marketing campaigns and tactics have to stay ahead of the ​ DEGOM Marketing is a social media marketing company with vast experience with social media platforms such as Facebook and Finding the best tactics to lower , generate leads effectively and building a social presence that no one can Building Your Social Presence & Leads Every business around the world knows that social media has built a huge factor for growth and it is here to stay! That doesn’t mean you’ve yet had the chance to put in the time or effort necessary to cultivate a proper presence on the right social ​ Even if you haven t optimized your social media presence, there is still time, and the benefits will be well worth the Our social media marketing services can There are many advantages to growing a social presence of your brand on social media, including that it can help you improve your customer service, allow you to communicate with customers and prospects on a new level, help you engage your current audience and reach new audiences, help you build authority, and drive traffic to your ​ DEGOM Marketing customizes each campaign to target the designated audience(s) and makes sure they are driven to a built landing page or lead form generated to entice your prospect customer to buy your product or Hire Your Social Media Manager Today Our Social Media Marketing Process Starting Your Social Media Marketing ​ Using our transparent approach, we first start by targeting the ideal customer you would like to acquire for your We do this by researching your past and future customers and creating the perfect Then we start creating your custom ​ Your Social Media Ads ​ Creating unique ads that compel your audience to engage in the content is the solution to driving traffic and relevancy to your We do this by, creating custom ads, utilize email lists, targeting your audience and conducting A B ad ​ House Marketing Service ​ Everything we do for you on our Social Media Management and Marketing services is conducted by an assigned social media We will never outsource our work to another This is one of the few attributes that make us unique to our ​ Campaign Monitor and Reporting ​ Identical to our Instagram management service, we also conduct a thorough monitoring of all our advertising We check up on progress every day and make minor changes when You will receive a detailed report on how your ads delivered as soon as the promotion duration has ​ ​ Why Partner with us For Your Social Media Marketing Affordable Prices ​ We have one of the most pricing plans on the we strive to make our services available to all sized businesses when you succeed we do as no contracts ​ Most of our service packages do not require any we want your trust by providing exceptional Results Delivered ​ We pride ourselves on our 7 customer service and work We will do all we can to satisfy your Get to know your social media marketing agency What Our Clients Say ""The team of DEGOM Marketing helped us grow our Instagram page and helped us greatly with our Microsoft ad Their efforts allowed us to enter the US market of Intelligence & They targeted the right audience and in turn, gathered us a substantial amount of new clients!"" Marcelo, Founder & Owner Montax Intelligence ""Amazing company, they skyrocketed our engagement on our social media pages and helped drive traffic to our Anytime we needed advice or help they were very courteous and assisted without Thanks for all the help!"" Yvan, CEO & Owner Proximus medical One of our clients boosted their social media engagement by ,987% Using our social media marketing services will not only grow your account exponentially, but it will also build a community around your By engaging the right audience for your needs, we establish a strong presence in the social For this particular business, we increased their following count from to This helped them increase their engagement by ,987%. We ",startup,,nan,0.0
https://www.federalgovernmentexperts.com,12083,crunchbase,"Contact Us | Federal Gov Experts Call Us Today: (202) - | Home ApplyNOW Security The Process Services News Training Events Blog Contact Us Careers New Hire More Client Portal CONTACT US Questions? Let Us Principle Office: ​ Federal Government Experts Leesburg Pike Suite Falls Church, Virginia ​ Mailing Address: ​ BOX Arlington, VA USA Tel: (202) Fax: (703) ​ Email Us Here! SEND FGE PRIVACY POLICY GET IN TOUCH CONTACT US Principle Office: Leesburg Pike Suite Falls Church, Virginia | ​ Copyright Federal Government Experts | All Rights Reserved | Portland Website Design by Landing Paige   ApplyNOW | Federal Gov Experts Call Us Today: (202) - | Home ApplyNOW Security The Process Services News Training Events Blog Contact Us Careers New Hire More Client Portal Come Work With Us First Name Last Name Email Telephone Select Position FGE Applicant arrow&amp v Available Date Upload Resume & Certs Upload File Upload supported file (Max ) Address Birthday Your Signature Clear I agree to the terms & conditions View terms of use Submit Thanks for submitting! GET IN TOUCH CONTACT US Principle Office: Leesburg Pike Suite Falls Church, Virginia | ​ Copyright Federal Government Experts | All Rights Reserved | Portland Website Design by Landing Paige   The Process | Federal Gov Experts Call Us Today: (202) - | Home ApplyNOW Security The Process Services News Training Events Blog Contact Us Careers New Hire More Client Portal OUR PROCESS HOW WE HELP Business Problem With continued growth and increasing competition in the Federal sector, we have developed a dynamic business management consulting process, by collaborating with diverse business concerns, industry trade associations, academics institutions, and client executives that not only addresses the question of ​ ""What is the Industry standard of Best practices concerning the correct management consulting processes? ​ Our process has yielded unmatched results for our Below outlines Federal Government Expert s (FGE s) consulting process derived from our extensive research and experiences across the Federal Marketplace Current State The primary attribute cited is knowledge – subject matter expertise – typically in an Federal Contracting, Bid and Proposal Capture Management, or Emerging Military technologies, for example: An alternative primary attribute is a technical Strategy development, policy development, organizational design, process improvement, strategic alliance management, project management, change management, are several common ​ These two might intersect, describing ""Sue"" as ‘a strategy consultant in aerospace & ’ Then a series of secondary attributes common to ‘great management consultants’ are described interpersonal skills, project management skills, analytical skills, management consulting skills, intelligence, and The Gap Industry knowledge is mostly gathered through Technical expertise usually starts with Interpersonal skills are inborn and Intelligence and curiosity are mostly nature but (some believe) can be Project management and analytical skills are either trained and or learned on the ​ Then there are the core management consulting By core we mean those activities every management consultant conducts on every project, and whose level of performance directly impacts the client’s Our consultants are proven technical experts in their fields, each team member averages over plus years of experience in their respective fields of We also have honed our skills, methods, and techniques for which clients find necessary to achieve their desired Unlike many other firms, we ve noted that their consultants have prescribed approaches in which they are However, in leveraging our processes, skills and unique approach we ve developed comprehensive solution(s) that are Client specific and situationally dependent based on Your objectives not our bottom Supporting Evidence (other firms) Were you trained on how to perform stakeholder interviews? Some consultants are trained how to manage the interview and the interviewee, but from our research, no one has been trained how to determine which parts of the input to write down, how to write it down, then how to select from that content those statements which should become the raw material for the balance of the Instead, each management consultant has their own style of and their own process for discerning which content to take Conclusions – the management consultant’s opinions for which the client waits with great eagerness (to playfully plagiarize Sir John Gielgud in “Arthur”). Who was trained on DOCA – gather Data, make Observations, draw Conclusions, suggest Actions – in a way that the advice doesn’t just sound right but is right? The Case for Action - % of the consultants we speak to understand its necessity and can describe it, but only a few document it as an explicit step in their consulting process and can explain how they create ​ These are three of the core skills identified that cumulatively determine the quality a",startup,,nan,0.0
https://cloudperitus.com/,1405,crunchbase," Salesforce Consulting serrvices | Cloud peritus WHO WE ARE WHAT WE DO PARTNERS CAREERS CONTACT Who We Are What We Do We deliver, you prosper Leverage expert consulting and customized implementation to get real Get Started We Are The Kingmakers for Businesses We are a highly motivated team, committed to deliver outcomes and superior customer We take a approach, rather than a approach, for a new age consulting Know More We deliver Real and Measurable Cloud Solutions With a customer centric design approach and leveraging Artificial Intelligence, we enable you with solutions that help you drive value from your business Know More Advisory Implementation Health Checks Maintenance We Serve Businesses Across Industries Our experts come from diverse industry backgrounds with extensive experience and domain expertise to add value to the solutions we Manufacturing Enhanced production with increased agility Healthcare Improved precision for better results Insurance Improved analytics for data backed decisions Retail Improved distribution and supply Explore Get optimized workflows and improved processes today! Cloud Peritus is a technology consulting firm that specializes in implementation and optimization of business solutions for enhancing results and driving higher Home Who We Are What We Do Partners Careers Contact Us Camnio Ramon Suite San Ramon, CA - © Cloud Peritus | All rights reserved ",startup,,nan,0.0
https://www.dreamagain.com,66,crunchbase, Page cannot be Please contact your service provider for more (1) ,startup,,nan,0.0
https://wikips.com,359,crunchbase," The domain is registered by NetNames The domain name has been registered by Every domain name comes with free web and email To forward your domain name to another web page or site, log into your control panel at and change the web forwarding Online Brand Protection Domain Name Management Security Certificates New gTLD Services © Copyright NetNames Limited ",startup,,nan,0.0
