website,text_len,source,text,type,closest_snapshot,closest_snapshot_time,snapshot_in_window
https://selfempowerment.online,17582,crunchbase,"Wayback Machine We will keep fighting for all libraries - stand with us! Internet Archive logo A line drawing of the Internet Archive headquarters building faÃ§ade. Donate icon An illustration of a heart shape ""Donate to the archive"" Search icon An illustration of a magnifying Search icon An illustration of a magnifying Upload icon An illustration of a horizontal line over an up pointing Upload User icon An illustration of a person s head and Sign up | Log in Web icon An illustration of a computer application window Wayback Machine Texts icon An illustration of an open Books Video icon An illustration of two cells of a film Video Audio icon An illustration of an audio Audio Software icon An illustration of a "" floppy Software Images icon An illustration of two Images Donate icon An illustration of a heart shape Donate Ellipses icon An illustration of text More Hamburger icon An icon used to represent a menu that can be toggled by interacting with this Internet Archive Audio Live Music Archive Librivox Free Audio Featured All Audio This Just In Grateful Dead Netlabels Old Time Radio RPMs and Cylinder Recordings Top Audio Books & Poetry Computers, Technology and Science Music, Arts & Culture News & Public Affairs Spirituality & Religion Podcasts Radio News Archive Images Metropolitan Museum Cleveland Museum of Art Featured All Images This Just In Flickr Commons Occupy Wall Street Flickr Cover Art USGS Maps Top NASA Images Solar System Collection Ames Research Center Software Internet Arcade Console Living Room Featured All Software This Just In Old School Emulation Games Historical Software Classic PC Games Software Library Top Kodi Archive and Support File Vintage Software APK Software Software Library Software Sites Tucows Software Library Shareware Software Capsules Compilation Images ZX Spectrum DOOM Level CD Books Books to Borrow Open Library Featured All Books All Texts This Just In Smithsonian Libraries FEDLINK (US) Genealogy Lincoln Collection Top American Libraries Canadian Libraries Universal Library Project Gutenberg Children s Library Biodiversity Heritage Library Books by Language Additional Collections Video TV News Understanding 9 11 Featured All Video This Just In Prelinger Archives Democracy Now! Occupy Wall Street TV NSA Clip Library Top Animation & Cartoons Arts & Music Computers & Technology Cultural & Academic Films Ephemeral Films Movies News & Public Affairs Spirituality & Religion Sports Videos Television Videogame Videos Vlogs Youth Media Search the history of over billion web pages on the Search the Wayback Machine Search icon An illustration of a magnifying Mobile Apps Wayback Machine (iOS) Wayback Machine (Android) Browser Extensions Chrome Firefox Safari Edge Subscription Explore the Collections Learn More Build Collections Save Page Now Capture a web page as it appears now for use as a trusted citation in the Please enter a valid web address About Blog Projects Help Donate Contact Jobs Volunteer People Sign up for free Log in Search metadata Search text contents Search TV news captions Search radio transcripts Search archived web sites Advanced Search About Blog Projects Help Donate Donate icon An illustration of a heart shape Contact Jobs Volunteer People DONATE Sorry Job failed Return to Save Page Now The Wayback Machine requires your browser to support JavaScript, please email if you have any questions about The Wayback Machine is an initiative of the Internet Archive , a (c)(3) , building a digital library of Internet sites and other cultural artifacts in digital Other projects include Open Library & . Your use of the Wayback Machine is subject to the Internet Archive s Terms of Use .   Wayback Machine We will keep fighting for all libraries - stand with us! Internet Archive logo A line drawing of the Internet Archive headquarters building faÃ§ade. Donate icon An illustration of a heart shape ""Donate to the archive"" Search icon An illustration of a magnifying Search icon An illustration of a magnifying Upload icon An illustration of a horizontal line over an up pointing Upload User icon An illustration of a person s head and Sign up | Log in Web icon An illustration of a computer application window Wayback Machine Texts icon An illustration of an open Books Video icon An illustration of two cells of a film Video Audio icon An illustration of an audio Audio Software icon An illustration of a "" floppy Software Images icon An illustration of two Images Donate icon An illustration of a heart shape Donate Ellipses icon An illustration of text More Hamburger icon An icon used to represent a menu that can be toggled by interacting with this Internet Archive Audio Live Music Archive Librivox Free Audio Featured All Audio This Just In Grateful Dead Netlabels Old Time Radio RPMs and Cylinder Recordings Top Audio Books & Poetry Computers, Technology and Science Music, Arts & Culture News & Public Affairs Spirituality & Religion Podcasts Radio News Archive Images Metropolitan Museum Cle",startup,,nan,0.0
http://www.trywoof.com,1265,crunchbase," Page Not Found Page Not Found The page you requested was not   Page Not Found Page Not Found The page you requested was not   Page Not Found Page Not Found The page you requested was not   Woof Woof Patent Gamification Sample Contact Us Woof is a patent protected technology that publishers license to boost engagement with content inside their existing digital Available as an extension to a content publisherâs own app, the exclusive Woof heat map technology gives users a never before seen look at how shareable media spreads across the globe in real Users participate by amplifying content they Woof gamifies the content sharing experience by generating metrics and leaderboards about content based on aggregated feedback from the community of This crowd curated content experience does not exist on other Unlike other platforms that rely on algorithms to reveal trending content, Woof uses human vetting Users have the unique opportunity to promote shareable media which gives content a life of its This interactivity leads to more engagement within our partners apps and that means more opportunities to drive Woof creates an environment where new and existing users visit more often and stay   Page Not Found Page Not Found The page you requested was not ",startup,,nan,0.0
https://www.lyfepal.com/,15927,crunchbase,"LyfePal › Login Search Results See All Results Join Login Register Night Mode Login Remember me Forgotten password? Login Not registered? Create an account Register Select Sex: Male Female Other Birthdate Month Jan Feb Mar Apr May Jun Jul Aug Sep Oct Nov Dec Day 1 2 3 4 5 6 7 8 9 Year I expressly agree to receive the newsletter By creating your account, you agree to our Terms & Privacy Policy Sign Up Have an account? Login Now © LyfePal English About Terms Privacy Contact Us Directory   LyfePal - Terms Search Results See All Results Join Login Register Night Mode Terms We run this website and permits its use according to the following terms and conditions: Basic Terms: Using this website implies your acceptance of these If you do not fully accept them, your entry to this site will be considered unauthorized and you will have to stop using it immediately You must be years or older to use this You are responsible for any activity that occurs under your screen You are responsible for keeping your account You must not abuse, harass, threaten or intimidate other LyfePal You are solely responsible for your conduct and any data, text, information, screen names, graphics, photos, profiles, audio and video clips, links (""Content"") that you submit, post, and display on the LyfePal You must not modify, adapt or hack LyfePal or modify another website so as to falsely imply that it is associated with LyfePal You must not create or submit unwanted email to any LyfePal members (""Spam""). You must not transmit any worms or viruses or any code of a destructive You must not, in the use of LyfePal, violate any laws in your jurisdiction (including but not limited to copyright laws). Violation of any of these agreements will result in the termination of your LyfePal While LyfePal prohibits such conduct and content on its site, you understand and agree that LyfePal cannot be responsible for the Content posted on its web site and you nonetheless may be exposed to such materials and that you use the LyfePal service at your own General Conditions: We reserve the right to modify or terminate the LyfePal service for any reason, without notice at any We reserve the right to alter these Terms of Use at any If the alterations constitute a material change to the Terms of Use, we will notify you via internet mail according to the preference expressed on your What constitutes a ""material change"" will be determined at our sole discretion, in good faith and using common sense and reasonable We reserve the right to refuse service to anyone for any reason at any We may, but have no obligation to, remove Content and accounts containing Content that we determine in our sole discretion are unlawful, offensive, threatening, libelous, defamatory, obscene or otherwise objectionable or violates any party s intellectual property or these Terms of LyfePal service makes it possible to post images and text hosted on LyfePal to outside This use is accepted (and even encouraged!). However, pages on other websites which display data hosted on LyfePal must provide a link back to Copyright (What s Yours is Yours): We claim no intellectual property rights over the material you provide to the LyfePal Your profile and materials uploaded remain You can remove your profile at any time by deleting your This will also remove any text and images you have stored in the We encourage users to contribute their creations to the public domain or consider progressive licensing Last updated on: Jan , © LyfePal English About Terms Privacy Contact Us Directory   LyfePal - Search Search Results See All Results Join Login Register Night Mode Search Discover new people, create new connections and make new friends Search Posts Articles Users Pages Groups Events No results to show No results to show No results to show No results to show No results to show No results to show © LyfePal · English About · Terms · Privacy · Contact Us · Directory   LyfePal - Privacy Search Results See All Results Join Login Register Night Mode Privacy Our Services connect friends, families, friends of friends to music, videos, shopping and everything life All registered users of LyfePal can send messages, share videos and music that will be public by If you would like your feeds private please make the changes in your profile This Privacy Policy (“ Policy ”) describes how and when LyfePal collects, uses and shares your information when you use our LyfePal receives your information through our various websites, APIs, email notifications, applications, widgets, ads, commerce services (the “ Online Store ”), and so When using any of our Services you consent to the collection, transfer, storage, disclosure, and use of your information as described in this Privacy Irrespective of which country you live in, you authorize us to use your information in, and as a result to transfer it to and store it in our server, the United States, Australia, and any other country where we Privacy and data protection laws in s",startup,,nan,0.0
https://www.palatable.ai,6780,crunchbase,"Wayback Machine We will keep fighting for all libraries - stand with us! Internet Archive logo A line drawing of the Internet Archive headquarters building faÃ§ade. Donate icon An illustration of a heart shape ""Donate to the archive"" Search icon An illustration of a magnifying Search icon An illustration of a magnifying Upload icon An illustration of a horizontal line over an up pointing Upload User icon An illustration of a person s head and Sign up | Log in Web icon An illustration of a computer application window Wayback Machine Texts icon An illustration of an open Books Video icon An illustration of two cells of a film Video Audio icon An illustration of an audio Audio Software icon An illustration of a "" floppy Software Images icon An illustration of two Images Donate icon An illustration of a heart shape Donate Ellipses icon An illustration of text More Hamburger icon An icon used to represent a menu that can be toggled by interacting with this Internet Archive Audio Live Music Archive Librivox Free Audio Featured All Audio This Just In Grateful Dead Netlabels Old Time Radio RPMs and Cylinder Recordings Top Audio Books & Poetry Computers, Technology and Science Music, Arts & Culture News & Public Affairs Spirituality & Religion Podcasts Radio News Archive Images Metropolitan Museum Cleveland Museum of Art Featured All Images This Just In Flickr Commons Occupy Wall Street Flickr Cover Art USGS Maps Top NASA Images Solar System Collection Ames Research Center Software Internet Arcade Console Living Room Featured All Software This Just In Old School Emulation Games Historical Software Classic PC Games Software Library Top Kodi Archive and Support File Vintage Software APK Software Software Library Software Sites Tucows Software Library Shareware Software Capsules Compilation Images ZX Spectrum DOOM Level CD Books Books to Borrow Open Library Featured All Books All Texts This Just In Smithsonian Libraries FEDLINK (US) Genealogy Lincoln Collection Top American Libraries Canadian Libraries Universal Library Project Gutenberg Children s Library Biodiversity Heritage Library Books by Language Additional Collections Video TV News Understanding 9 11 Featured All Video This Just In Prelinger Archives Democracy Now! Occupy Wall Street TV NSA Clip Library Top Animation & Cartoons Arts & Music Computers & Technology Cultural & Academic Films Ephemeral Films Movies News & Public Affairs Spirituality & Religion Sports Videos Television Videogame Videos Vlogs Youth Media Search the history of over billion web pages on the Search the Wayback Machine Search icon An illustration of a magnifying Mobile Apps Wayback Machine (iOS) Wayback Machine (Android) Browser Extensions Chrome Firefox Safari Edge Subscription Explore the Collections Learn More Build Collections Save Page Now Capture a web page as it appears now for use as a trusted citation in the Please enter a valid web address About Blog Projects Help Donate Contact Jobs Volunteer People Sign up for free Log in Search metadata Search text contents Search TV news captions Search radio transcripts Search archived web sites Advanced Search About Blog Projects Help Donate Donate icon An illustration of a heart shape Contact Jobs Volunteer People DONATE Sorry Job failed Return to Save Page Now The Wayback Machine requires your browser to support JavaScript, please email if you have any questions about The Wayback Machine is an initiative of the Internet Archive , a (c)(3) , building a digital library of Internet sites and other cultural artifacts in digital Other projects include Open Library & . Your use of the Wayback Machine is subject to the Internet Archive s Terms of Use .   The domain name is for sale Excellent out of 5 Buyer Protection Program When you buy a domain name at , you’re automatically covered by our unique Buyer Protection Read more about how we keep you safe on our Trust and Security Next to our secure domain ownership transfer process, we strictly monitor all If anything looks weird, we take immediate And if the seller doesn t deliver on their part of the deal, we refund you within Fast & easy transfers % of all domain ownership transfers are completed within The seller first delivers the domain to us, then we send you your tailored transfer Need help? Our domain ownership transfer specialists will assist you at no additional Hassle free payments Pay by bank wire and get a 1% discount or use one of the most popular payment options available through our payment processor, Adyen is the payment platform of choice for many leading tech companies like Uber & Make an offer conditions ) Value Added Tax The Value Added Tax (VAT) is a consumption tax applied in the European Union (EU) to all goods and Who has to pay VAT? All consumers in the EU are charged VAT on the purchase of goods and Businesses in the EU buying from a business in the same country are also charged Businesses in the EU buying from a business in a different EU country are not charged Cons",startup,,nan,0.0
https://www.vef.gg,15346,crunchbase,"Funding — Videogames and Esports Foundation 0 Skip to Content About Us Funding Resources Online Certifications Curriculum Research Blog Get Involved Donate Fundraise for VEF Donate Open Menu Close Menu About Us Funding Resources Online Certifications Curriculum Research Blog Get Involved Donate Fundraise for VEF Donate Open Menu Close Menu About Us Funding Folder: Resources Back Online Certifications Curriculum Research Blog Folder: Get Involved Back Donate Fundraise for VEF Donate Grants and Scholarships Federal Funding - ESSER III The Elementary and Secondary School Emergency Relief Fund, also known as As schools began to close in response to the pandemic in the United States, lawmakers looked to provide funding to make sure students would return to classrooms quickly and Download ESSER 3 Guide Learn how esports scholarships are awarded from colleges Learn from a former player and former college esports coach about the best opportunities to earn a college Take FREE Course Earn scholarships in high school by playing video games Over $300,000 in scholarships have been distributed by the VEF to students who won through online esports competitions with the High School Esports Win scholarships here! VideoGames and Esports Foundation © VideoGames and Esports Foundation (VEF) S STE #155 Olathe, KS Policies | Terms of Service | Official Email us: The VEF strives to create an inclusive, safe, and aspirational network of gaming communities for We provide grants financial assistance to disenfranchised students and schools and scholarships to students through gaming and esports clubs in The VideoGames and Esports Foundation is recognized as exempt under section (c)(3) of the Internal Revenue Our EIN: Formerly the Varsity Esports Foundation founded in   Online Certifications — Videogames and Esports Foundation 0 Skip to Content About Us Funding Resources Online Certifications Curriculum Start a Club Research Tools and Guides Ted Talks Blog Get Involved Donate Fundraise for VEF $60K in Days Campaign Donate Open Menu Close Menu About Us Funding Resources Online Certifications Curriculum Start a Club Research Tools and Guides Ted Talks Blog Get Involved Donate Fundraise for VEF $60K in Days Campaign Donate Open Menu Close Menu About Us Funding Folder: Resources Back Online Certifications Curriculum Start a Club Research Tools and Guides Ted Talks Blog Folder: Get Involved Back Donate Fundraise for VEF $60K in Days Campaign Donate Esports Education Network Looking for online video courses to help you, your family, your school, or your administration understand esports? Take our course led by Coach Alne, a former player, college esports coach, esports mentor, and the CEO of Esports on TikTok . Esports Education Network Courses Featured Step 1 - ""What is Esports?"" Free Course Step 2 - Why School Esports Matter? - Free Course Step 3 - How to Start a School Esports Club - Free Course Step 4 - Certified Esports Club Sponsor - Course Costs Step 5 - How Esports Scholarships Work - Free Course EEN is an open network, that allows anyone to submit content and material for Accredited content will be featured on the network along with EEN’s own original We also work with TOs, organizations, corporations, and school districts on package deals where we can put custom packages together depending on the level of training or certification they would like out of their Testimonies Videogames and Esports Foundation © Videogames and Esports Foundation (VEF) S STE #155 Olathe, KS Policies | Terms of Service | Official Email us: The VEF strives to create an inclusive, safe, and aspirational network of gaming communities for We provide grants financial assistance to disenfranchised students and schools and scholarships to students through gaming and esports clubs in The Videogames and Esports Foundation is recognized as exempt under section (c)(3) of the Internal Revenue Our EIN: Formerly the Varsity Esports Foundation founded in   Research — Videogames and Esports Foundation 0 Skip to Content About Us Funding Resources Online Certifications Curriculum Start a Club Research Tools and Guides Ted Talks Blog Get Involved Donate Fundraise for VEF $60K in Days Campaign Donate Open Menu Close Menu About Us Funding Resources Online Certifications Curriculum Start a Club Research Tools and Guides Ted Talks Blog Get Involved Donate Fundraise for VEF $60K in Days Campaign Donate Open Menu Close Menu About Us Funding Folder: Resources Back Online Certifications Curriculum Start a Club Research Tools and Guides Ted Talks Blog Folder: Get Involved Back Donate Fundraise for VEF $60K in Days Campaign Donate GET ANSWERS, DATA, TOOLS, AND FACTS ABOUT GAMING AND ESPORTS? Videogames and Esports Foundation © Videogames and Esports Foundation (VEF) S STE #155 Olathe, KS Policies | Terms of Service | Official Email us: The VEF strives to create an inclusive, safe, and aspirational network of gaming communities for We provide grants financial assistance to disenfranc",startup,,nan,0.0
