website,text_len,source,text,type,closest_snapshot,closest_snapshot_time,snapshot_in_window
https://freeplay.ai,2507,crunchbase," Blog Careers Blog Careers Now in Private Beta A better way to build with LLMs Bridge the gap between domain experts & Prompt engineering, testing & evaluation tools for your whole Join Waitlist Now in Private Beta A better way to build with LLMs Bridge the gap between domain experts & Prompt engineering, testing & evaluation tools for your whole Join Waitlist Now in Private Beta A better way to build with LLMs Bridge the gap between domain experts & Prompt engineering, testing & evaluation tools for your whole Join Waitlist See what s happening See what s happening View results from prompts every time your code runs â from tests in a notebook to live results in View results from prompts every time your code runs â from tests in a notebook to live results in View results from prompts every time your code runs â from tests in a notebook to live results in Manage & version prompts Manage & version prompts Give PMs, designers & domain experts the power to update prompts without the need for a Give PMs, designers & domain experts the power to update prompts without the need for a Give PMs, designers & domain experts the power to update prompts without the need for a Automate testing & evaluation Automate testing & evaluation Ship with Manage test cases, replay them through your code, and use AI to analyze Ship with Manage test cases, replay them through your code, and use AI to analyze Ship with Manage test cases, replay them through your code, and use AI to analyze Do it at scale Do it at scale Get an , flexible & secure platform that works for production software Get an , flexible & secure platform that works for production software Get an , flexible & secure platform that works for production software What others are saying What others are saying Jonathan Widawski CEO & at Maze At Maze, we ve learned great customer experiences come through intentional testing & Freeplay is building the tools companies like ours need to nail the details with Jake Adams at Grain When we started using LLMs, we immediately realized testing is What Freeplay is doing will give teams the confidence they need to ship faster & improve over Koen Bok CEO at Framer We wanted to give our designers the freedom to experiment with prompts, but couldn t find good Freeplay will make it easier to get anyone involved in prompt Ready to get started? Ready to get started? Ready to get started? Join Waitlist Join Waitlist Â© Labs Blog Privacy LinkedIn Twitter Â© Labs Blog Privacy LinkedIn Twitter ",startup,"{'status': '200', 'available': True, 'url': 'http://web.archive.org/web/20230530190214/https://freeplay.ai/', 'timestamp': '20230530190214'}",20230530190214.0,1.0
https://theoperationscompany.com,25199,crunchbase,"Menu Interested in our services? Click The Operations Company The Operations Company The Operations Company The Operations Company The Operations Company The Operations Company The Operations Company The Operations Company Home About Services Menu Pricing Process Tools Swag Contact More Home About Services Menu Pricing Process Tools Swag Contact Home About Services Menu Pricing Process Tools Swag Contact OPS IS SERVED, BUFFET MENU BREAKDOWN Platform Implementations HubSpot Marketing Hub HubSpot Sales Hub HubSpot Service Hub HubSpot Operations Hub Adobe Marketo Salesforce Chili Piper PandaDoc Intercom Asana Slack And more! Data Migrations Any platform to HubSpot Any platform to Marketo Any platform to Salesforce Strategic Projects Revenue Attribution Strategic Roadmaps Instance Audits Foundational Architecture Lead Lifecycle Lead Scoring Lead Sourcing UTMs & Tracking Campaign Templates Workflow Automation Process Optimization Data Hygiene Domain Health Spam Control Tool Evaluation Quality Assurance Request Process Vendor Management Center of Excellence Business Intelligence Knowledge Governance Data Dictionary And more! System Administration User Management Troubleshooting Quality Assurance Sync Issues Automation Configuration Ongoing Support Native Integrations Data Normalization Slack Q&A And more! Campaign Management Campaign Execution Project Management Operating Model Center of Excellence Request Process Audience Definition Campaign Templates Segmentation & Targeting Nurture Strategy Stakeholder Enablement And more! Operations Education Exam Prep Power User Workshops Our Certifications Subscribe Email SIGN UP Stay Solid LLC dba The Operations Company | Copyright © | All Rights Reserved Privacy Policy | Terms of Service Home About Services Menu Pricing Process Tools Swag Contact This website uses We use cookies to analyze website traffic and optimize your website By accepting our use of cookies, your data will be aggregated with all other user Decline Accept   Pricing Interested in our services? Click The Operations Company The Operations Company The Operations Company The Operations Company The Operations Company The Operations Company The Operations Company The Operations Company Home About Services Menu Pricing Process Tools Swag Contact More Home About Services Menu Pricing Process Tools Swag Contact Home About Services Menu Pricing Process Tools Swag Contact FAIR PRICING, GREAT All prices below are estimates as we will need to chat through scope to build your BOOK A MEETING STARTER PACKS Ice Breaker Dollar Implementation Lunch & Learn total Around total hours of our time 1 month timeline 2 meetings weekly Audit, roadmap, strategic guidance, enablement These can only be purchased once Helps build business case Lunch & Learn Dollar Implementation Lunch & Learn bucks 1 hour long training and enablement session with our team We can create the agenda together Resources shared after Lunch on us! Limited to 4 of your team members Dollar Implementation Dollar Implementation Dollar Implementation One dollar 2 week timeline 6 meetings You must meet with us prior to purchase Basic implementation Availability based on our current bandwidth Limited to specific tools Our Starter Packs were created to help build trust before committing to longer SUBSCRIPTIONS Extra Small Extra Small Extra Small per month Around hours of our time per month Strategic guidance and enablement only 2 one hour long meetings weekly Small Extra Small Extra Small per month Around hours of our time per month System Administration for one tool only No meetings Medium Extra Small Medium per month Around hours of our time per month menu items Large Extra Large Medium per month Around hours of our time per month menu items Extra Large Extra Large Extra Large per month Around hours of our time per month 5 menu items Custom Extra Large Extra Large Price based on scope Number of monthly hours based on scope 6 menu items Our subscription plans are billed monthly with net terms with a minimum of 3 PLATFORM IMPLEMENTATIONS Small Medium Medium total Around total hours of our time 2 week timeline Medium Medium Medium total Around total hours of our time 4 week timeline Large Custom Custom total Around total hours of our time 6 week timeline Custom Custom Custom Price based on scope Number of monthly hours based on scope Timeline based on scope Tier depends on tool, specific plan you re on, and scope of DATA MIGRATIONS Small Medium Medium total Around hours of our time 1 month timeline Medium Medium Medium total Around total hours of our time 2 month timeline Large Custom Custom total Around total hours of our time 3 month timeline Custom Custom Custom Price based on scope Number of monthly hours based on scope Timeline based on scope Data Migrations are carefully scoped and tier depends on amount of data being WHAT YOU GET Team Delivery Delivery Core Team Operations Consultant Account Manager Customer Success Resource Extended Team Principal Consultan",startup,"{'status': '200', 'available': True, 'url': 'http://web.archive.org/web/20230325133128/https://theoperationscompany.com/', 'timestamp': '20230325133128'}",20230325133128.0,1.0
https://askarvo.com/,14703,crunchbase,"Features - Document differently with Arvo How it works Integrations Pricing Learn Login Try for free Features Integrations Pricing Learn Login Try for free Try for free Features Create exceptional resources for your team and clients using Arvo s simple Train on Everything Standard Operating Procedures (SOPs) Easily implement standards across teams by creating simple SOPs that anyone can Playbooks and Lessons Build lessons with pieces that are easy to Group lessons into Playbooks and Course Client Engagement and Implementation Help keep clients in the know with status updates and client portals that feature Drive adoption and client satisfaction with guides that help answer all common questions before they re Embed Anything Leverage all existing training assets and organize the chaos without having to recreate Images, Videos, and GIFs Audio and podcasts Diagrams and whiteboards Spreadsheets and docs Forms and assessments Share Everywhere Instant Sharable Links Get a shareable link for any training asset you create in Arvo with one Embeddable Anywhere Embed a single guide or an entire course library into where the knowledge is needed QR Codes Leverage QR Codes to instantly load training materials on any Manage on Mobile Arvo is % mobile friendly and provides full control over your company s knowledge on any phone or Dashboards Library management Playbook sharing and editing Team Q&A Account management Stop repeat questions and start sharing Smart Components Perfectly designed, responsive, and interactive components become the building blocks for rapid creation of training Course Libraries Training can be organized and added to any number of Libraries in Libraries can be easily shared or even embedded in other platforms as Design and Function Everything looks good right out of the Want it to be even better? Easily adjust Arvo s theme to match your company s brand Share &Â Embed We know what a pain ""yet another platform""Â can That s why we made it easy to get training into the hands of team members and Rapid Authoring Get your dilithium crystals and start practicing your best Captain Picard impression, because Arvo puts your training at warp Fully Responsive Training created in Arvo automatically work on all screen sizes, including desktop, tablets, and mobile Quick Templates Arvo comes with templates for popular use Create your own templates and save them in the Arvo Template Maximize Learning Arvo makes it easy to create interactive and engaging training materials that can be absorbed in Affordable Pricing Let s face it, learning management tools are expensive! Arvo is affordable for any business that is looking to Document Use The Arvo Platform Home Features Integrations Pricing Book a Demo Sign up Log In Support Center Quick Start Guide How to use Libraries Viewing and Editing Playbooks Managing Pages Arvo s Components Learn about Templates Company Careers Contact Us PartnerÂ Program Press Resources Blog Glossary Â© All rights BGBO Co . and | Privacy Policy |Â Terms of Use   Arvo Pricing How it works Integrations Pricing Learn Login Try for free Features Integrations Pricing Learn Login Try for free Try for free Get started for Upgrade to unlimited anytime Monthly Yearly Free Plan $ month For new startups Try Arvo with all the 5 Playbooks Pages Starter Templates Embed and Share Try for free Unlimited Plan $ month (billed monthly) For scaling businesses Unlimited $20 m per additional Unlimited Users Unlimited Libraries Unlimited Playbooks Unlimited Pages Template Library Custom Templates Embed assets in Playbooks Share Playbooks Allow Playbook Requests Playbook View Tracking Multiple Workspaces Try for free Free Plan $ month For new startups Try Arvo with all the 5 Playbooks Pages Starter Templates Embed and Share Try for free Unlimited Plan $ month (billed annually) For scaling businesses Unlimited $18 m per additional Unlimited Users Unlimited Libraries Unlimited Playbooks Unlimited Pages Template Library Custom Templates Embed assets in Playbooks Share Playbooks Allow Playbook Requests Playbook View Tracking Try for free Make it easy for your team to Get processes out of your head faster and build with components that drive adoption from your Book a demo Integrate with your favorite platforms Embed Arvo Playbooks in hundreds of Simultaneously embed assets from thousands of platforms in any Arvo View all integrations We are here to help! Ask us anything or schedule a demo Talk to a human How does the Free Plan work? You can create up to five Playbooks or a total of pages on our Free What happens after I hit my page or playbook limit? Once you hit your limit on the Free Plan, you can upgrade instantly to the Unlimited Plan to remove any restrictions on the Which means of payment do you accept? Paid subscriptions require a Visa, Mastercard, Amex, or We only accept online Are there discounts for yearly plans? Yes! If you pay for a year in advance, you save % compared to paying per Do you offer discounts for ",startup,"{'status': '200', 'available': True, 'url': 'http://web.archive.org/web/20221219062648/https://askarvo.com/', 'timestamp': '20221219062648'}",20221219062648.0,1.0
https://ditruexpress.com,14834,crunchbase,"Liên hệ | Di Trú Express Contact Us Nếu bạn có câu hỏi hay thắc mắc về công ty hay hồ sơ của bạn, xin điền thông tin vào mẫu đơn bên dưới và một trong những thành viên của chúng tôi sẽ liên lạc với Note: Để quy trình hỗ trợ nhanh và hiệu quả hơn, chúng tôi khuyến khích bạn nên đăng ký tài khoản với địa chỉ Không yêu cầu thẻ tín dụng ngay, bạn chỉ thanh toán khi nào bạn kích hoạt hồ Thanh toán giao dịch: Hiện tại nền tảng chỉ chấp nhận các thẻ Debit và Credit card của các ngân hàng tại Full name Email Message By clicking the button below, you are agreeing to our Privacy Policy . Comments This field is for validation purposes and should be left Privacy Terms of Use Contact Us Copyright © Di Tru Express All rights   Người Việt và Sự Ảnh Hưởng Tích Cực | Di Trú Express Người Việt - American Dream Vì Một Tương Lai Tươi Sáng Cho Con Bạn – Nước Mỹ Đang Chờ Bạn Nền Tảng Di Trú Mỹ Số #1 Cho Người Việt Mở tài khoản và kích hoạt hồ sơ của bạn hôm Xem Thêm Tình Trạng Hệ Thống: Cập nhật cuộc sống Mỹ mỗi Subscribe ngay! Email Name This field is for validation purposes and should be left 5 Công Ty Di Trú Đang Âm Thầm Giúp Người Việt Tại Mỹ 7 Thành Phố Đáng Sống Tại Hoa Kỳ Cho Người Việt Tạp Chí Người Việt - Thế Hệ Tương Lai Privacy Terms of Use Contact Us Copyright © Di Tru Express All rights   Privacy Policy | Di Trú Express Privacy Policy Di Tru Express is committed to Di Tru Express Incorporated acknowledges and honors the privacy of users of (the “Website Visitors”) and other services offered through this domain (the “Website”) and individual representatives of our customers, suppliers and business partners (the “Business Contacts”). This Privacy Policy (the “Policy”) applies to Website Visitors and Business This Policy describes how your personal information will be treated as you use our Website and By continuing to use the Website and our services you signify that you have read, understood, and agree to this Policy as amended from time to Types of Data Collected Through use of the Website You can visit this Website without telling Di Tru Express who you are or revealing any personal information about yourself except as set forth in this In viewing the Website, Di Tru Express will capture certain technical information from your device regarding: the domain name of the site providing you with Internet access your Internet protocol (IP) address used to connect your computer to the Internet your browser type your type of operating system the time you spend surfing the Website the specific pages that you view at this Website and other items that assist Di Tru Express in administering this Information you submit to Di Tru Express though the Website and Business Contacts You may choose to give Di Tru Express personal information about yourself through the Website as noted This is entirely optional – if you wish to contact Di Tru Express without revealing such personal information then the Di Tru Express postal address and telephone number is provided on the From Website Visitors, Di Tru Express may collect the following types of personal information: contact information company information photos, social media profile, areas of expertise and any other information visitors choose to provide resume and applicant information for those applying to job openings and other personal information provided by the Website From Business Contacts, Di Tru Express may collect the following types of personal information: contact information company information financial and billing information security authorization and authentication information and other personal information provided by the Business If you elect to subscribe to the Di Tru Express newsletter or blog, we will also ask you to provide your name and email You will have the option to unsubscribe through the unsubscribe mechanism at the bottom of each email, or through the unsubscribe option on the “Blog” section of the Purposes of Collection and Use Di Tru Express collects and uses personal information of Website Visitors and Business Contacts for the purposes of: providing information about our services personalizing visitors’ experience on our Website providing services and support to our customers communicating with corporate business partners about business matters conducting related tasks for legitimate business purposes aggregating data and other purposes disclosed at the time of Use and Disclosure When you provide Di Tru Express with personal information about yourself, Di Tru Express will act in a responsible manner, and will only use the information for the purpose for which it was Di Tru Express may provide your information to subsidiaries, affiliates, third party contractors and vendors, purely for the purposes of processing such data on behalf of Di Tru Express to provide the services Di Tru Express will only provide your information to third parties for other purposes when you, the user, specifically requests information from that third If a third party service ",startup,"{'status': '200', 'available': True, 'url': 'http://web.archive.org/web/20230925164742/https://ditruexpress.com/', 'timestamp': '20230925164742'}",20230925164742.0,1.0
https://www.downmass.com,179,crunchbase," Downmass | Connecting Space & Earth Connecting our existence in space to our lives on LinkedIn Twitter Crunchbase Contact Please contact for sales, partnership, and media Submit ",startup,"{'status': '200', 'available': True, 'url': 'http://web.archive.org/web/20230202135750/https://downmass.com/', 'timestamp': '20230202135750'}",20230202135750.0,1.0
https://www.westcoastface.com/,19463,crunchbase,"Contact - West Coast Face WestCoast Face Plastic Surgery Contact Shvidler Menu Treatment Philosophy Treatments TREATMENTS Ears EARS External Ear Surgery Earlobe Repair Eyes EYES Upper & Lower Eyelids Face FACE Facelift Forehead Lift & Brow Lift Facial Scars & Skin Cancer Neck NECK Neck Lift & Chin Augmentation Nose NOSE Nose Surgery - Rhinoplasty Nasal Valve Collapse Men MEN Ears, Eyes & Nose Face & Neck About Shvidler About Shvidler Biography & Education Conditions Treated & Procedures Performed Publications & Credentials Hospital & Insurance Affiliations Art & Photography Testimonials Contact Consultation Request Joe Knows Blog Joe Knows Blog Cancer Eyes Face Fillers & Fat Men Neck Nose Skin Contact Shvidler Seattle Location JOSEPH SHVIDLER MD – THE SEATTLE FACIAL PLASTIC SURGERY CENTER Madison St #1280 Seattle, WA, (206) Portland Location PORTLAND CENTER FOR FACIAL PLASTIC SURGERY NE Cornell Hillsboro, OR (503) JOSEPH SHVIDLER MD plastic surgeon portland, plastic surgery portland, rhinoplasty portland, nose surgery portland, nose job portland THE PORTLAND CENTER FOR FACIAL PLASTIC SURGERY Email: REQUEST A CONSULTATION Contact Shvidler Name Email Phone Are you a new patient? Yes No Message For privacy reasons, please do not include medical Joseph Shvidler looks forward to helping you look good and feel your best! JOSEPH SHVIDLER MD Madison St #1280 Seattle, WA, • • THE PORTLAND CENTER FOR FACIAL PLASTIC SURGERY NE Cornell Hillsboro, OR • • This is a Secure Disclaimer: Results may vary from person to Photos of actual patients are overlaid with a Other photos of people, including header images, blog post images and more, utilize stock photos of models, not actual Website © Joseph Shvidler MD, Seattle, WA - Portland OR - Tacoma, Gig Harbor • Rhinoplasty - Eyelid Surgery - Facelift Surgery - Chin Augmentation Web Design by Wilford Design   Treatment Philosophy - West Coast Face WestCoast Face Plastic Surgery Contact Shvidler Menu Treatment Philosophy Treatments TREATMENTS Ears EARS External Ear Surgery Earlobe Repair Eyes EYES Upper & Lower Eyelids Face FACE Facelift Forehead Lift & Brow Lift Facial Scars & Skin Cancer Neck NECK Neck Lift & Chin Augmentation Nose NOSE Nose Surgery - Rhinoplasty Nasal Valve Collapse Men MEN Ears, Eyes & Nose Face & Neck About Shvidler About Shvidler Biography & Education Conditions Treated & Procedures Performed Publications & Credentials Hospital & Insurance Affiliations Art & Photography Testimonials Contact Consultation Request Joe Knows Blog Joe Knows Blog Cancer Eyes Face Fillers & Fat Men Neck Nose Skin Click Diagram Text Treatment Philosophy My approach to care is comprehensive management of congenital, traumatic, and cosmetic concerns of the face, nose, and neck My unique training in ear, nose, throat, and facial plastic reconstructive surgery provides me the experience needed to care for the most complex I strive to provide compassionate and individualized care to help create or restore form and Listening to each patient’s unique needs is an integral part of my Treatment The process begins with a consultation after thoroughly reviewing your medical, surgical and cosmetic You will be given an opportunity to discuss your area of concern or topics of interest while he listens carefully to Then Shvidler will explain the range of treatment options most appropriate in your particular He will follow up with a treatment plan that addresses all of your Then when you are ready to move forward he will set an appointment that works best for your busy Joseph Shvidler’s mission is to enhance your life by his commitment to the highest quality patient satisfaction, excellent service and for a natural esthetic result you will be proud Relax Botulinum toxin, Botox ® is the product most used for the area between the brows, crow’s feet and forehead for delivering a naturally rested It is a member of the “ wrinkle relaxer ” class of injectable facial treatments and shares the spotlight with a couple of other They are all designed to reduce the lines and wrinkles and are all FDA Botox has been used safely for over If you are tired of brow heaviness, the appearance of tiredness or fatigue, or negative facial expressions that are inconsistent with your intent, then this wrinkle relaxer can smooth existing lines over time and restore a more youthful, fresh Fill Dermal fillers are an excellent choice for tackling the appearance of volume or fat loss in your They are effective for improving wrinkles which are visible at rest as opposed to those that appear with muscle action, as in Volume loss is due to facial aging which involves the natural loss of fat in the face as we age, making us look gaunt and more Characteristics of the filler material make some lighter weight fillers more favorable for the tear troughs and Other fillers are better for folds and or These fillers have more viscosity and particle Good candidates for fillers are those who do not want to correct with Shvidler has speciali",startup,"{'status': '200', 'available': True, 'url': 'http://web.archive.org/web/20221207100754/https://www.westcoastface.com/', 'timestamp': '20221207100754'}",20221207100754.0,1.0
