website,text_len,source,text,type,closest_snapshot,closest_snapshot_time,snapshot_in_window
https://elizabethtown.kruger.com,8787,crunchbase,"The Plant – Kruger Packaging – Elizabethtown Plant Elizabethtown Plant About Us The Plant Newsroom Construction Updates Latest News Our Products Careers Contact Us About Us The Plant Newsroom Construction Updates Latest News Our Products Careers Contact Us Box Plant Representing an investment of $114M, the project will bring significant direct and indirect economic benefits to Elizabethtown, with the creation of at least jobs as well as spending and employment tied to the construction of the new facility, not to mention future investments as we continue to grow our business well into the 0 investment 0 facility 0 jobs at full 1 highly automated corrugator 4 ultramodern converting lines Annual production billion The equivalent of over football fields per day of % recycled corrugated Milestones Winter Final site selection Spring Equipment and engineering selection Summer Building construction Summer Converting and corrugator equipment installation Summer Commissioning and ramp up! The Elizabethtown Project team is pleased to announce that the construction of the Kruger Packaging Plant has started Follow Construction Updates Copyright Kruger - Legal notice LinkedIn Facebook Instagram   About Us – Kruger Packaging – Elizabethtown Plant Elizabethtown Plant About Us The Plant Newsroom Construction Updates Latest News Our Products Careers Contact Us About Us The Plant Newsroom Construction Updates Latest News Our Products Careers Contact Us Kruger Packaging An industry leader Widely recognized for its exceptional products, Kruger Packaging manufactures % recycled containerboard and customized packaging With a focus on personalized customer service, and delivery, we take pride in providing innovative packaging products that exceed our customer’s Our parent company, Kruger , is a family company founded in Involved in industry sectors such as tissue products, newsprint and other publication papers, renewable energy, recycling and real estate, it operates manufacturing sites and close to renewable energy power plants across North Kruger is proud to bring more than a century of experience and to Elizabethtown, Our existing facilities Montreal, Québec Place Turcot Containerboard Mill Brampton, Ontario Brampton Packaging Plant LaSalle, Québec LaSalle Packaging Plant , Québec Linerboard Mill Our Philosophy Sustainability is key to our success and That’s why we make optimal resource management, environmental protection, energy conservation and waste reduction part of the equation every single Technology Implement the best available technologies Design Strive to minimize fibre content without compromising strength Knowledge Maintain expertise, including in the physical properties of packaging Manufacturing Techniques Optimally match linerboard grades with new types of flutes Changing Market Anticipate packaging industry trends EcoVadis Gold Level A score of %, up from % the previous year, in recognition of its commitment to sustainability Now among the top 5% of companies in terms of corporate social responsibility (CSR) performance compared to more than ,000 companies in over industries Kruger continues to intensify its sustainability efforts, not only to remain an industry leader, but to inspire other organizations to do the Copyright Kruger - Legal notice LinkedIn Facebook Instagram   Newsroom – Kruger Packaging – Elizabethtown Plant Elizabethtown Plant About Us The Plant Newsroom Construction Updates Latest News Our Products Careers Contact Us About Us The Plant Newsroom Construction Updates Latest News Our Products Careers Contact Us Newsroom Construction Updates Latest News Construction Updates August - September Site preparation and pouring concrete for foundation footings October Start pouring (concrete) walls Keep on visiting us to follow the progress of the work! Latest News December 7, Quicksie Toy Factory TUESDAY, DECEMBER 7, The Quicksie Cruiser will be there to pick up along with the big truck from Coleman Allied!! Read more https: elizabethtown.kruger.com wp-content uploads 2021 12 toy-drive-12.07.21.jpg Kruger Packaging - Elizabethtown Plant Kruger Packaging - Elizabethtown Plant https: elizabethtown.kruger.com wp-content uploads 2021 12 toy-drive-12.07.21.jpg December 7, December , December 6, Kruger Packaging Elizabethtown Marks Major Milestone $114 million packaging plant set to open in summer Elizabethtown (Kentucky), December 2, – Kruger Packaging team members, Elizabethtown Mayor Jeff Gregory and community leaders visited the… Read more https: elizabethtown.kruger.com wp-content uploads 2021 12 120221_Kruger_Site-Visit_09.jpg Kruger Packaging - Elizabethtown Plant Kruger Packaging - Elizabethtown Plant https: elizabethtown.kruger.com wp-content uploads 2021 12 120221_Kruger_Site-Visit_09.jpg December 6, December , November , Job fair rewind, hiring needs moving forward On November , we held our very first job fair for the brand new, packaging plant opening in Elizabethtown! We met A LOT of amazing can",startup,"{'status': '200', 'available': True, 'url': 'http://web.archive.org/web/20211205192107/https://elizabethtown.kruger.com/', 'timestamp': '20211205192107'}",20211205192107.0,1.0
https://drinkgingin.com,16354,crunchbase,"Wayback Machine We will keep fighting for all libraries - stand with us! Internet Archive logo A line drawing of the Internet Archive headquarters building faÃ§ade. Donate icon An illustration of a heart shape ""Donate to the archive"" Search icon An illustration of a magnifying Search icon An illustration of a magnifying Upload icon An illustration of a horizontal line over an up pointing Upload User icon An illustration of a person s head and Sign up | Log in Web icon An illustration of a computer application window Wayback Machine Texts icon An illustration of an open Books Video icon An illustration of two cells of a film Video Audio icon An illustration of an audio Audio Software icon An illustration of a "" floppy Software Images icon An illustration of two Images Donate icon An illustration of a heart shape Donate Ellipses icon An illustration of text More Hamburger icon An icon used to represent a menu that can be toggled by interacting with this Internet Archive Audio Live Music Archive Librivox Free Audio Featured All Audio This Just In Grateful Dead Netlabels Old Time Radio RPMs and Cylinder Recordings Top Audio Books & Poetry Computers, Technology and Science Music, Arts & Culture News & Public Affairs Spirituality & Religion Podcasts Radio News Archive Images Metropolitan Museum Cleveland Museum of Art Featured All Images This Just In Flickr Commons Occupy Wall Street Flickr Cover Art USGS Maps Top NASA Images Solar System Collection Ames Research Center Software Internet Arcade Console Living Room Featured All Software This Just In Old School Emulation Games Historical Software Classic PC Games Software Library Top Kodi Archive and Support File Vintage Software APK Software Software Library Software Sites Tucows Software Library Shareware Software Capsules Compilation Images ZX Spectrum DOOM Level CD Books Books to Borrow Open Library Featured All Books All Texts This Just In Smithsonian Libraries FEDLINK (US) Genealogy Lincoln Collection Top American Libraries Canadian Libraries Universal Library Project Gutenberg Children s Library Biodiversity Heritage Library Books by Language Additional Collections Video TV News Understanding 9 11 Featured All Video This Just In Prelinger Archives Democracy Now! Occupy Wall Street TV NSA Clip Library Top Animation & Cartoons Arts & Music Computers & Technology Cultural & Academic Films Ephemeral Films Movies News & Public Affairs Spirituality & Religion Sports Videos Television Videogame Videos Vlogs Youth Media Search the history of over billion web pages on the Search the Wayback Machine Search icon An illustration of a magnifying Mobile Apps Wayback Machine (iOS) Wayback Machine (Android) Browser Extensions Chrome Firefox Safari Edge Subscription Explore the Collections Learn More Build Collections Save Page Now Capture a web page as it appears now for use as a trusted citation in the Please enter a valid web address About Blog Projects Help Donate Contact Jobs Volunteer People Sign up for free Log in Search metadata Search text contents Search TV news captions Search radio transcripts Search archived web sites Advanced Search About Blog Projects Help Donate Donate icon An illustration of a heart shape Contact Jobs Volunteer People DONATE Latest Show All The Wayback Machine has not archived that Click here to search for all archived pages under https: drinkgingin.com . The Wayback Machine requires your browser to support JavaScript, please email if you have any questions about The Wayback Machine is an initiative of the Internet Archive , a (c)(3) , building a digital library of Internet sites and other cultural artifacts in digital Other projects include Open Library & . Your use of the Wayback Machine is subject to the Internet Archive s Terms of Use .   Wayback Machine We will keep fighting for all libraries - stand with us! Internet Archive logo A line drawing of the Internet Archive headquarters building faÃ§ade. Donate icon An illustration of a heart shape ""Donate to the archive"" Search icon An illustration of a magnifying Search icon An illustration of a magnifying Upload icon An illustration of a horizontal line over an up pointing Upload User icon An illustration of a person s head and Sign up | Log in Web icon An illustration of a computer application window Wayback Machine Texts icon An illustration of an open Books Video icon An illustration of two cells of a film Video Audio icon An illustration of an audio Audio Software icon An illustration of a "" floppy Software Images icon An illustration of two Images Donate icon An illustration of a heart shape Donate Ellipses icon An illustration of text More Hamburger icon An icon used to represent a menu that can be toggled by interacting with this Internet Archive Audio Live Music Archive Librivox Free Audio Featured All Audio This Just In Grateful Dead Netlabels Old Time Radio RPMs and Cylinder Recordings Top Audio Books & Poetry Computers, Technology and Science Music, Arts & Culture News & Publi",startup,"{'status': '200', 'available': True, 'url': 'http://web.archive.org/web/20211227130516/https://drinkgingin.com/', 'timestamp': '20211227130516'}",20211227130516.0,1.0
https://www.gqvet.com,32058,crunchbase,"Alternative Medicines & Therapies - Gilbert Queen Creek Emergency Veterinarian and Pet Urgent Care Open - Everyday Menu Call Text Us Directions Veterinary Services Alternative Medicine Become a Pet Blood Donor Meet Our Doctors Referring Veterinarians Pet Forms Call or Text (480) E Rittenhouse Rd Building B, Queen Creek, AZ Open , 7 days a week! Home Veterinary Services Emergency Veterinary Services Alternative Medicines & Therapies Save Lives! Become a Pet Blood Donor! Hyperbaric Oxygen Therapy Valley Fever Ultrasound Referrals Pet Oncology Services Surgery by Specialist Pricing About Us Meet Our Doctors Meet Our Team Find a Local GP Vet Resources Forms & Education Contact Us Alternative Medicines & Therapies Alternative Medicines & Therapies Alternative medicines have been around for thousands of They have been commonly applied in the human field, but it is still considered somewhat “taboo” in the veterinary At Gilbert Queen Creek Emergency Veterinarian & Pet Urgent Care, we believe in using a combination of Eastern and Western medicine when We believe the combination can assist in treating many of the common conditions we see, and our patients achieve the best healing processes when these combinations are We offer other alternative therapies such as: Hyperbaric Oxygen Therapy, also known as HBOT, has been shown to treat and prevent progression of many diseases, including: Wound Healing & Dog Bite Wounds Herniated Disks IVDD Trouble Walking Arthritis Pancreatitis Trauma Infection Valley Fever Smoke Inhalation Burns Carbon Monoxide Poisoning Ozone therapy in veterinary patient care is an alternative therapy offered here at GQ Vet that may help in healing of many Wherever we have inflammation, increasing the level of oxygen in that area with ozone therapy would benefit in healing of the Ozone is , and also has disinfectant properties using higher oxygen levels instead of harsh chemicals that kill most bacteria at low Ozone is an affordable , , , and , and we currently can use ozone therapy for the following treatments and more: Oral flush for managing bacteria in mouths or after dental cleanings Wound Management Cystitis: Recurrent Urinary Tract Infections, and Blocked Cats, Osteoarthritis CCL tears IVDD – Intervertebral Disc Disease Abdominal surgery Neoplasia Parvo Tick borne disease Chronic kidney disease Holistic Herbal medicines are known to support the body systems through disease processes or illness and can also help to reduce side effects from common Some of the medications we commonly use include: Yunnan Baiyao – Supports and assists in the stopping of bleeding and Hepatic Support – Supplements which help protect, support and improve liver function Renal Support – Supplement which helps support and improve kidney function Paxon – Supplement of concentrated cranberry extract which helps support and improve bladder health Open , 7 days a week! (480) E Rittenhouse Rd Building B, Queen Creek, AZ The Gilbert Queen Creek Emergency Veterinarian and Pet Urgent Care is an emergency veterinary clinic and pet hospital open everyday from We offer urgent care for your cat and dog emergency veterinary needs and have caring and trained staff available to help! © Gilbert Queen Creek Emergency Veterinarian and Pet Urgent Care Clinic All Rights Reserved X   Find a Local GP Veterinarian! - Gilbert Queen Creek Emergency Veterinarian and Pet Urgent Care Open - Everyday Menu Call Text Us Directions Veterinary Services Alternative Medicine Become a Pet Blood Donor Meet Our Doctors Referring Veterinarians Pet Forms Call or Text (480) E Rittenhouse Rd Building B, Queen Creek, AZ Open , 7 days a week! Home Veterinary Services Emergency Veterinary Services Alternative Medicines & Therapies Save Lives! Become a Pet Blood Donor! Hyperbaric Oxygen Therapy Valley Fever Ultrasound Referrals Pet Oncology Services Surgery by Specialist Pricing About Us Meet Our Doctors Meet Our Team Find a Local GP Vet Resources Forms & Education Contact Us Find a Local GP Veterinarian! Find a Local GP Veterinarian! We are available for all of your cat or dog emergency veterinary Please call us at Here is a map of General Practice Veterinarians in the area that refer their patients to us for emergency They may be contacted for care if you need to seek care with a regular veterinarian outside of your pet’s emergency needs with We are here to help with all of your pet’s emergency or urgent care needs when your regular vet is not Queen Creek Veterinary Clinic (480) E Ocotillo Rd, Queen Creek, AZ Warner Vista Animal Hospital (480) Val Vista #102, Gilbert, AZ Power Road Animal Hospital (480) S Power Rd, Mesa, AZ Augusta Ranch Animal Hospital (480) Ellsworth #101, Mesa, AZ Val Vista Animal Hospital (480) Val Vista , Gilbert, AZ Chandler Gilbert Animal Hospital (480) Gilbert #1, Chandler, AZ Banfield Pet Hospital – Ellsworth Loop (480) locations veterinarians az queen-creek qcr Ellsworth Loop , Queen Creek, AZ San Tan Animal Hospital (480) Ocotillo Suite",startup,"{'status': '200', 'available': True, 'url': 'http://web.archive.org/web/20220103012903/https://www.gqvet.com/', 'timestamp': '20220103012903'}",20220103012903.0,1.0
https://www.vibrantdigimarketing.com/,53,crunchbase," One moment, Please wait while your request is being ",startup,"{'status': '200', 'available': True, 'url': 'http://web.archive.org/web/20220818042325/http://vibrantdigimarketing.com/', 'timestamp': '20220818042325'}",20220818042325.0,1.0
https://sitetent.com,32972,crunchbase,"Pricing for web design & branding | SiteTent Menu SLAY THE ILLUSIVENESS Our clear and approachable pricing Getting quotes for digital marketing services can be At SiteTent we believe in providing a guide for the pricing of our Pricing that isn’t hidden behind a contact Each project we create is custom, so quoting cannot be completely At least this way there are no SERVICE PRICING See pricing guides for each of our core services: Web Design Branding For small businesses and individuals looking to launch their dreams, SiteTent creates digital marketing solutions that customers will rave From website design, branding, user experience, and strategy, we’re a small shop that can pump out big Navigation About Services Pricing Articles Contact Menu About Services Pricing Articles Contact About Services Pricing Articles Contact Menu About Services Pricing Articles Contact Check Us Out Dribbble Copyright SiteTent All Rights | Privacy Policy Menu Privacy Policy Cookies & Privacy We use cookies on our website to give you the most relevant experience by remembering your preferences and repeat By clicking “Accept All”, you consent to the use of ALL the However, you may visit ""Cookie Settings"" to provide a controlled Cookie Settings Accept All Manage consent Close Privacy Overview This website uses cookies to improve your experience while you navigate through the Out of these, the cookies that are categorized as necessary are stored on your browser as they are essential for the working of basic functionalities of the We also use cookies that help us analyze and understand how you use this These cookies will be stored in your browser only with your You also have the option to of these But opting out of some of these cookies may affect your browsing Necessary Necessary Always Enabled Necessary cookies are absolutely essential for the website to function These cookies ensure basic functionalities and security features of the website, Cookie Duration Description months This cookie is set by GDPR Cookie Consent The cookie is used to store the user consent for the cookies in the category ""Analytics"". months The cookie is set by GDPR cookie consent to record the user consent for the cookies in the category ""Functional"". months This cookie is set by GDPR Cookie Consent The cookies is used to store the user consent for the cookies in the category ""Necessary"". months This cookie is set by GDPR Cookie Consent The cookie is used to store the user consent for the cookies in the category ""Other. months This cookie is set by GDPR Cookie Consent The cookie is used to store the user consent for the cookies in the category ""Performance"". viewed_cookie_policy months The cookie is set by the GDPR Cookie Consent plugin and is used to store whether or not user has consented to the use of It does not store any personal Functional Functional Functional cookies help to perform certain functionalities like sharing the content of the website on social media platforms, collect feedbacks, and other Performance Performance Performance cookies are used to understand and analyze the key performance indexes of the website which helps in delivering a better user experience for the Analytics Analytics Analytical cookies are used to understand how visitors interact with the These cookies help provide information on metrics the number of visitors, bounce rate, traffic source, Advertisement Advertisement Advertisement cookies are used to provide visitors with relevant ads and marketing These cookies track visitors across websites and collect information to provide customized Others Others Other uncategorized cookies are those that are being analyzed and have not been classified into a category as SAVE & ACCEPT Check Us Out Dribbble About Services Pricing Articles Contact Menu About Services Pricing Articles Contact About Services Pricing Articles Contact Menu About Services Pricing Articles Contact   Marketing Services, Website Design, Branding | SiteTent Menu OUR SUITE OF MARKETING SERVICES Digital marketing for small businesses that need to We specialize in helping small businesses make a great impression on the web with our collaborative process and stellar Let’s make the climb together! QUICK NAVIGATION Web Design Branding WEB DESIGN Development and design that supercharges your We build websites using the WordPress content management system (CMS) and the Elementor page We follow our process to produce the best results for businesses like We’ve specialized our web design service to work well for that want to have a website that meets their business goals and their customers will Learn More BRANDING Create your visual story through We create more than just a logo for your Logos are cheap, and the wrong one may do more harm than A brand tells your story, engages your customers, and keeps things We can work with you from discovering what your brand could be, form ideas and visual concepts, to a guide and brand Learn More REACH OUT You ve got ideas, and we w",startup,"{'status': '200', 'available': True, 'url': 'http://web.archive.org/web/20220121133344/https://sitetent.com/', 'timestamp': '20220121133344'}",20220121133344.0,1.0
