website,text_len,source,text,type,closest_snapshot,closest_snapshot_time,snapshot_in_window
https://www.withicademy.com,5277,crunchbase,"Join | Icademy Home Blog Join About Contact Open Icademy Together More Use tab to navigate through the menu Take your idea to impact With Icademy, you get personalized mentorship from your guide weekly circle sessions with a group of your peers to give you the skills you need workshops to put theory into practice and access to a community of experts dedicated to solving climate ​ There s no application process, deadlines, or waiting months for a cohort to Schedule a meeting with us today to see if Icademy is the right fit for you! Pricing $1000 per quarter Cancel anytime % money back guarantee Home Blog Join About Contact Open Icademy Together More Use tab to navigate through the menu   Blog | Icademy Home Blog Join About Contact Open Icademy Together More Use tab to navigate through the menu All Posts Search Brett Schklar May 9 1 min Introducing Open Icademy Sessions It’s hard to describe the power of Icademy because of all the ways it helps set up entrepreneurs for It’s hard Chad McGimpsey Mar 2 min How we re learning as much as our fellows! We re half way through our initial pilot program 😲 and our learning so much! Eric Ries, author of The Lean Startup,... Chad McGimpsey Feb 4 min This is why your startup will fail Find out why problem discovery is the most important key to your startup s Brett Schklar Jan 2 min Now the world We re off to the races! We re beyond excited that we let the world know of our climate tech Pilot Program that begins January , See the Release Chad McGimpsey Jan 7 3 min Announcing Icademy s Pilot Program We are beyond excited to announce that Icademy s first program will start on January , ! If you ve been following our journey,... Brett Schklar Dec , 1 min Marshall Fire: Our Love and Support to our Boulder Denver families Living in the Boulder Denver community, we have many fans, friends and supporters who have experienced challenging times this Brett Schklar Dec , 1 min Icademy s Getting started Series: Testing - feedback on our MVT Now that you’ve taken your prototype to a MVT - it’s time to In this brief video, we talk about the feedback we’ve gotten, Brett Schklar Oct , 1 min Icademy s Getting Started Series: Incorporating Watch and listen as Chad & Brett talk about decisions we made to get started and to get There are a lot of choices Brett Schklar Oct , 1 min Welcome, We re Icademy Welcome to We re tired of the lip service about climate We re tired of politicians arguing whether it exists or ... Home Blog Join About Contact Open Icademy Together More Use tab to navigate through the menu   Take your ClimateTech idea to impact with Icademy Ideas to Impact Home Blog Join More Use tab to navigate through the menu Fighting climate change feels impossible Building your ClimateTech startup shouldn t be Climate change is the largest challenge humanity has ever faced, and you have an idea on how to fight Building a traditional startup is hard building an ClimateTech company is even You need guidance, mentorship, community, and support that adapts and grows with you along your entire ​ Icademy is a completely new type of program, designed to support you in creating a successful, impactful company through personalized, mentorship and Centered around you You have unique skills, dreams, and Your support network should be personalized to you as ​ Icademy supports you on your schedule and timeline with personalized mentorship and You have questions Icademy has the Virtual A program designed from the to be , live workshops, and an community so you can attend from anywhere, Flexible You determine your pace and there s no end date, so you receive support along your entire founder s Personal You ll receive personalized mentorship from your guide , a seasoned entrepreneur who will provide strategic advice and guidance when you need Shared An shared equity pool that your startup and provides shared upside on our communal Community You ll join a dedicated community of experts and startup founders all focused on solving climate change through Support You ll meet with a small circle of peers each week to receive the challenge, support, and accountability you need to be Impact focused You re determined to leave this world a better place and make a positive impact on the environment and your Icademy shares your ​ With Icademy, you ll learn best practices for building an , company from day With a human approach, you ll be uniquely positioned to build products that solve meaningful problems for your customers, make positive impacts in your community, create an engaged workforce, and make money while doing Make your impact Where are you in the journey? Learn You re finding a problem you re passionate about solving or have a solution in ​ With Icademy, you ll leverage your existing skillset to find a problem you love waking up to solve every Test You re on to something big and are looking for ​ With Icademy, you ll evaluate business models, validate customer intent, and quickly test your Build You ve ",startup,"{'status': '200', 'available': True, 'url': 'http://web.archive.org/web/20220204174127/https://www.withicademy.com/', 'timestamp': '20220204174127'}",20220204174127.0,1.0
https://futuraenergygroup.com/,10466,crunchbase,"Work With Futura – Futura Energy Group Skip to content Contact Futura Home About Sectors Services Values Current Opportunities Work With Futura Menu Home About Sectors Services Values Current Opportunities Work With Futura Work With Futura Looking for a New Opportunity? Looking for Technical Expertise? Contact Us Send us a message Help us understand what you need by filling out the form and we’ll be in Name Email Phone Number Select Service Select Service Supplemental Workforce Solutions Talent Acquisition SOW Execution Retained Search Message Send Message Working as a business enterprise (MBE), Futura Energy Group works closely with partners to help them overcome their human resource and talent challenges by providing best in class Quick Links Home About Sectors Services Values Current Opportunities Work With Futura Menu Home About Sectors Services Values Current Opportunities Work With Futura Contact us Austin, Texas Contact Us Newsletter Enter Subscribe Now © Copyright Futura Energy All Right Reserved Privacy Policy Terms & Conditions   Services – Futura Energy Group Skip to content Contact Futura Home About Sectors Services Values Current Opportunities Work With Futura Menu Home About Sectors Services Values Current Opportunities Work With Futura Services Supplemental Workforce Solutions There are many reasons why companies need to ramp up their internal resource needs, Futura Energy Group provides friendly solutions that help businesses add to their teams for both short and Talent Acquisition With the search for talent becoming increasingly more challenging for employers, companies can rest assured that they can work with Futura Energy Group as a strategic partner to help them meet their internal talent Program Management With a professional network spread out across the entire United States, Futura Energy Group works closely with SMEs in a variety of professions help deliver Program Management and Time and SOW solutions to help clients execute on complex projects, whether it is Engineering, Project Management or Construction Retained Search From strategic hiring for executives roles through to fixed ‘per hire’ retained agreements for repeat or volume hiring, Futura Energy Group can deliver a tailored solution that mirrors your company’s growth plans through a true strategic Working as a business enterprise (MBE), Futura Energy Group works closely with partners to help them overcome their human resource and talent challenges by providing best in class Quick Links Home About Sectors Services Values Current Opportunities Work With Futura Menu Home About Sectors Services Values Current Opportunities Work With Futura Contact us Austin, Texas Contact Us Newsletter Enter Subscribe Now © Copyright Futura Energy All Right Reserved Privacy Policy Terms & Conditions   Current Opportunities – Futura Energy Group Skip to content Contact Futura Home About Sectors Services Values Current Opportunities Work With Futura Menu Home About Sectors Services Values Current Opportunities Work With Futura Current Opportunities Working as a business enterprise (MBE), Futura Energy Group works closely with partners to help them overcome their human resource and talent challenges by providing best in class Quick Links Home About Sectors Services Values Current Opportunities Work With Futura Menu Home About Sectors Services Values Current Opportunities Work With Futura Contact us Austin, Texas Contact Us Newsletter Enter Subscribe Now © Copyright Futura Energy All Right Reserved Privacy Policy Terms & Conditions   Values – Futura Energy Group Skip to content Contact Futura Home About Sectors Services Values Current Opportunities Work With Futura Menu Home About Sectors Services Values Current Opportunities Work With Futura Our Values As a business, Futura Energy Group is at the forefront of not only helping to slow down but also reverse climate We choose not only to lead in this field but actively look to promote and petition for our clients to reach this goal Futura Energy Group is committed to supporting organizations in local communities around the world with diverse social We strive to ensure that whoever we partner with receives equal resource allocation to ensure that organizational goals can be Our Diversity and Inclusion message is clear, we know that as a minority enterprise we can not only lead from the front in this field, but to help our clients promote equity within their organizations, we know and understand that we have the opportunity and ability to directly influence change to ensure that our children grow up in a more equitable . Working as a business enterprise (MBE), Futura Energy Group works closely with partners to help them overcome their human resource and talent challenges by providing best in class Quick Links Home About Sectors Services Values Current Opportunities Work With Futura Menu Home About Sectors Services Values Current Opportunities Work With Futura Contact us Austin, Texas Contact Us Newslet",startup,"{'status': '200', 'available': True, 'url': 'http://web.archive.org/web/20220103020713/https://futuraenergygroup.com/', 'timestamp': '20220103020713'}",20220103020713.0,1.0
https://omniwell.org,10509,crunchbase,"Wishlist – Omni Well All categories Apparel Health & Wellness Heart Men Sexual Health Women Search input Search 0 0 0 $ 0 0 Shopping Cart Shopping cart (0) Subtotal: $ View cart Checkout Spend to get free shipping Congratulations! You ve got free ALL TESTS HEALTH & WELLNESS Health & Wellness Hemoglobin A1c Test Comprehensive Metabolic Test Panel (CMP Test) Iron Test (Iron, TIBC and Ferritin) Comprehensive Standard Health Profile Cholesterol Test Panel Blood Type Test (ABO, Rh) CRP Inflammation Marker Test Complete Blood Count (CBC Blood Test) Health & Wellness HEART DIGESTIVE WOMEN S MEN S SEXUAL HEALTH HEART Heart Hemoglobin A1c Test Comprehensive Metabolic Test Panel (CMP Test) Iron Test (Iron, TIBC and Ferritin) Comprehensive Standard Health Profile Cholesterol Test Panel Blood Type Test (ABO, Rh) CRP Inflammation Marker Test Complete Blood Count (CBC Blood Test) Health & Wellness HEART DIGESTIVE WOMEN S MEN S SEXUAL HEALTH DIGESTIVE Digestive Hemoglobin A1c Test Comprehensive Metabolic Test Panel (CMP Test) Iron Test (Iron, TIBC and Ferritin) Comprehensive Standard Health Profile Cholesterol Test Panel Blood Type Test (ABO, Rh) CRP Inflammation Marker Test Complete Blood Count (CBC Blood Test) Health & Wellness HEART DIGESTIVE WOMEN S MEN S SEXUAL HEALTH MEN’S Health & Wellness Hemoglobin A1c Test Comprehensive Metabolic Test Panel (CMP Test) Iron Test (Iron, TIBC and Ferritin) Comprehensive Standard Health Profile Cholesterol Test Panel Blood Type Test (ABO, Rh) CRP Inflammation Marker Test Complete Blood Count (CBC Blood Test) Health & Wellness HEART DIGESTIVE WOMEN S MEN S SEXUAL HEALTH WOMEN’S Women s Hemoglobin A1c Test Comprehensive Metabolic Test Panel (CMP Test) Iron Test (Iron, TIBC and Ferritin) Comprehensive Standard Health Profile Cholesterol Test Panel Blood Type Test (ABO, Rh) CRP Inflammation Marker Test Complete Blood Count (CBC Blood Test) Health & Wellness HEART DIGESTIVE WOMEN S MEN S SEXUAL HEALTH SEXUAL HEALTH Sexual Health Hemoglobin A1c Test Comprehensive Metabolic Test Panel (CMP Test) Iron Test (Iron, TIBC and Ferritin) Comprehensive Standard Health Profile Cholesterol Test Panel Blood Type Test (ABO, Rh) CRP Inflammation Marker Test Complete Blood Count (CBC Blood Test) Health & Wellness HEART DIGESTIVE WOMEN S MEN S SEXUAL HEALTH Show more Home Shop About Omni Blog FAQs Contact us Log in Sign up My Account Username or email Password Lost password ? Remember Me Log in Instagram LinkedIn Facebook HEALTH & WELLNESS HEART DIGESTIVE MEN’S WOMEN’S SEXUAL HEALTH SUPPORT 0 0 0 $ 0 0 Shopping Cart Shopping cart (0) Subtotal: $ View cart Checkout Spend to get free shipping Congratulations! You ve got free Menu Categories Home Shop About Omni Blog FAQs Contact us Heart Women Men Sexual Health Health & Wellness Apparel Log in Sign up Instagram LinkedIn Facebook Search input Search Home Wishlist My wishlist Product name Unit price Stock status No products added to the wishlist Information About Us Privacy Policy Terms & Conditions Questions Labs Expectations Test Results Omni Service Contact Us Return & Refund Policy Affiliate program How It Works Test Menu Health & Wellness Digestive Heart Men s Women s Sexual Health Resources HIPAA Information Media Kit My Account My Account Order History Wish List Newsletter Copyright © Omni Omni Tests Follow How To More More HEALTH & WELLNESS HEART DIGESTIVE MEN’S WOMEN’S SEXUAL HEALTH   Cart – Omni Well All categories Apparel Health & Wellness Heart Men Sexual Health Women Search input Search 0 0 0 My Wishlist No products in the View Wishlist 0 $ 0 ALL TESTS HEALTH & WELLNESS Health & Wellness Hemoglobin A1c Test Comprehensive Metabolic Test Panel (CMP Test) Iron Test (Iron, TIBC and Ferritin) Comprehensive Standard Health Profile Cholesterol Test Panel Blood Type Test (ABO, Rh) CRP Inflammation Marker Test Complete Blood Count (CBC Blood Test) Health & Wellness HEART DIGESTIVE WOMEN S MEN S SEXUAL HEALTH HEART Heart Hemoglobin A1c Test Comprehensive Metabolic Test Panel (CMP Test) Iron Test (Iron, TIBC and Ferritin) Comprehensive Standard Health Profile Cholesterol Test Panel Blood Type Test (ABO, Rh) CRP Inflammation Marker Test Complete Blood Count (CBC Blood Test) Health & Wellness HEART DIGESTIVE WOMEN S MEN S SEXUAL HEALTH DIGESTIVE Digestive Hemoglobin A1c Test Comprehensive Metabolic Test Panel (CMP Test) Iron Test (Iron, TIBC and Ferritin) Comprehensive Standard Health Profile Cholesterol Test Panel Blood Type Test (ABO, Rh) CRP Inflammation Marker Test Complete Blood Count (CBC Blood Test) Health & Wellness HEART DIGESTIVE WOMEN S MEN S SEXUAL HEALTH MEN’S Health & Wellness Hemoglobin A1c Test Comprehensive Metabolic Test Panel (CMP Test) Iron Test (Iron, TIBC and Ferritin) Comprehensive Standard Health Profile Cholesterol Test Panel Blood Type Test (ABO, Rh) CRP Inflammation Marker Test Complete Blood Count (CBC Blood Test) Health & Wellness HEART DIGESTIVE WOMEN S MEN S SEXUAL HEALTH WOMEN’S Women s Hemoglobin A1c Test Comprehensive Metab",startup,"{'status': '200', 'available': True, 'url': 'http://web.archive.org/web/20221127053027/https://omniwell.org/', 'timestamp': '20221127053027'}",20221127053027.0,1.0
https://www.pillarmarkets.com/,24619,crunchbase,"Capital Solutions for Real Estate Sponsors - Pillar Markets Sponsors About us Careers Get Started SOLUTIONS Solve Your Capital Needs By Accessing Interim Liquidity & Retaining Control The Pillar marketplace is designed to accommodate investor capital of varying time horizons and risk profiles, solving liquidity needs across the deal SCHEDULE A CALL As an Owner you have financial needs that should drive your capital decisions Portfolio Management Monetize a portion of gains to manage portfolio risk and or recycle Tax & Estate Planning Access partial liquidity without incurring the fees and taxes of a whole asset sale allow beneficiaries to manage individual liquidity Investor Relations Maintain strong LP relationships by offering liquidity independent of a Status Quo LP control rights over major decisions including sale refinancing Capital gains taxes, deal level transfer taxes other transaction costs Need to actively seek reinvestment options for sale proceeds Diverse LP base asking repetitive, distracting questions With Pillar You maintain control, just like a fund GP Avoid inopportune sales while still providing liquidity to LPs You maintain ownership, preserving asset management fees and deferring taxes costs of a whole asset sale Comprehensive reporting and LP forum enables investors to answer each others questions The Pillar Solution Facilitate Efficient Access to Capital Depth and breadth of capital pool allows for timely execution along risk profiles and across the capital Owner Always Maintains Control Including all major capital No forced sales, no meddling Investors benefit from streamlined reporting and analytical All With Lower Fees Solve your needs while managing Relative to competitors, we’re up to % cheaper - we focus on providing innovative solutions to real problems, without reinventing the How it Works Our process for owners of assets Pillar underwrites the GP to institutional standards GP does not pass due diligence Pillar works with GP to shore up shortfalls by introducing service providers and or instituting asset management oversight GP passes due diligence Sponsor and Asset are onboarded onto platform Pillar may close the asset on balance sheet and syndicate the risk or offer for best efforts execution ongoing asset reporting via automated ingestion of financial data Connect With Us Speak to a team member to learn more about the Pillar commercial real estate ​ First Name Last Name Company Email Message By submitting your information, you agree to the privacy policy and to learn more about offers and promotions from Digital Infrastructure Powering Private Real Estate Past performance in no guarantee of future Any historical returns, expected returns, or probability projections may not reflect actual future performance and are provided by the sponsor of the investment opportunity and subject to All securities involve risk and may result in partial or total Neither Pillar Markets nor any of its affiliates provide tax advice and do represent in any manner that the outcomes described herein will result in any particular tax Securities are offered through Finalis Securities LLC Member FINRA SIPC . Pillar Markets and Finalis Securities LLC are separate, unaffiliated (the ""Pillar Markets Website"") is a website operated by Pillar Markets , a privately held Delaware Pillar Markets provides software and technology Other services, such as transactions, are offered separately by Steven Coulis in his capacity as a registered representative of Finalis Securities LLC Member of FINRA SIPC . Pillar Markets is not a registered , and Finalis Securities LLC and Pillar Markets are separate, unaffiliated Finalis Privacy Policy | Finalis Business Continuity Plan | FINRA BrokerCheck Copyright © Pillar Markets Sponsors Careers Terms of Service Privacy and Cookies Confidentiality Agreement   Privacy Policy - Pillar Markets Sponsors About us Careers Get Started Privacy Policy Last Updated on December 8, PLEASE READ THIS PRIVACY POLICY BY ACCESSING AND USING THIS WEBSITE, YOU AGREE TO BE BOUND BY THIS PRIVACY POLICY IN ITS IF YOU DO NOT AGREE WITH THE TERMS OF THIS PRIVACY POLICY, PLEASE DO NOT USE OUR The website (the “Site”) is brought to you by Pillar Markets (“Pillar Markets,” “we,” “us,” or “our”), a Delaware This Privacy Policy provides information about our policies and procedures regarding the collection, use, and disclosure of personal information received through the Site from visitors and registered users of the Site (the “Privacy Policy”). This Privacy Policy is incorporated into, and is part of, our Terms of Use which govern your access to the Site and or your use of the Site and of the Content (as defined in the Terms of Use ) and the services made available on or through the Site (collectively, the “Services”). Unless otherwise defined herein, capitalized terms shall have the meaning assigned to such terms in the Terms of If you have comments, suggestions, questions, or concerns about our Privacy ",startup,"{'status': '200', 'available': True, 'url': 'http://web.archive.org/web/20220615124608/https://www.pillarmarkets.com/', 'timestamp': '20220615124608'}",20220615124608.0,1.0
https://staffdltc.com,976,crunchbase," Healthcare and Nursing Staffing Solutions - Staff d LTC Navigation Home Careers Contact Us Home Careers Contact Us Nursing and Healthcare Staffing Solutions Staff d connects the highest quality nursing and healthcare professionals with facilities and positions where they are most We offer opportunities for Certified Nursing Assistants (CNA), Registered Nurses (RN), and Licensed Practical Nurses (LPN) applicants in care and skilled nursing facilities throughout Illinois, Indiana, and Travel nursing jobs and local jobs to fill both per diem (day-to-day) and contract work are Join Our Network CNA Jobs LPN Jobs RN Jobs Contact "" "" indicates required fields Name First Last Would you like us to reach you by email or phone? Email Phone Email Phone Message Comments Email This field is for validation purposes and should be left Δ We invite you to reach out to us with your specific healthcare staffing (847) Home Careers Contact Us Copyright TEXT Staff d LTC - All Rights ",startup,"{'status': '200', 'available': True, 'url': 'http://web.archive.org/web/20230301140311/https://staffdltc.com/', 'timestamp': '20230301140311'}",20230301140311.0,1.0
