website,text_len,source,text,type,closest_snapshot,closest_snapshot_time,snapshot_in_window
https://codecrafters.io,13914,crunchbase,"CodeCrafters | Advanced programming challenges Login About Pricing Changelog About Pricing Changelog Login Try Now → CodeCrafters — an inside look Sarup Banskota, CodeCrafters CEO Hear it from our members Engineers at top teams love The CodeCrafters Way™ These guys ruined my weekend Djordje Lukic (@rumpl) Docker contributor There are few sites I like as much that have a step by step The feedback is so good, it s creepy! Ananthalakshmi Sankar Automation Engineer at Apple I spent a full day on your Docker building course and ended up building the whole thing As a SRE (and mostly a user of docker), digging into the internals blew me Raghav Dua SRE at Coinbase The Redis challenge was a great way to procrastinate sleeping for a week! A good change of pace from my regular work, and allowed me to explore some cool I ll be back for Rahul Tarak & ODX1 Fellow The Redis challenge was extremely I ended up having to read Redis protocol specification doc pretty carefully in its entirety! The result felt like independent study, if that makes (Which, again, was lots of fun) Charles Guo Scala Team at Stripe I m learning about how Redis works under the hood, system calls, socket programming in Python — something I ve never done before Akshata Mohan Senior Data Scientist at Cloudflare I ve started the Docker challenge, enjoying it a lot so Just the right level of guidance, helpful and still gives you a lot of freedom to explore and learn for Maya Farber Brodsky Recurse Center Participant My favorite way to master a Pranjal Paliwal $35k winner of HackAtom Found out from a It has you build your own version of things like Git and Docker from A cool way to build a stronger mental model of how those tools Beyang Liu CTO at SourceGraph The Docker challenge helped me dive into its internals, through actual Super Kang Ming Tay Software Engineer at Supabase I was really impressed that they support Haskell, and will probably usethis to learn Rust! The workflow is :chefkiss: Jonathan Lorimer Lead SWE at Mercury Bank The instant feedback right there in the git push is really Didn t even know that was possible! Patrick Burris Senior Software Developer at CenturyLink Try Now → Courses Build Your Own Redis Build Your Own Docker Build Your Own Git Build Your Own SQLite Resources Changelog Community Help Status Company Pricing For Investors Bulk Licenses Legal Terms Privacy Projects for Find out when we launch new Subscribe © CodeCrafters, All rights   Wayback Machine We will keep fighting for all libraries - stand with us! Internet Archive logo A line drawing of the Internet Archive headquarters building faÃ§ade. Donate icon An illustration of a heart shape ""Donate to the archive"" Search icon An illustration of a magnifying Search icon An illustration of a magnifying Upload icon An illustration of a horizontal line over an up pointing Upload User icon An illustration of a person s head and Sign up | Log in Web icon An illustration of a computer application window Wayback Machine Texts icon An illustration of an open Books Video icon An illustration of two cells of a film Video Audio icon An illustration of an audio Audio Software icon An illustration of a "" floppy Software Images icon An illustration of two Images Donate icon An illustration of a heart shape Donate Ellipses icon An illustration of text More Hamburger icon An icon used to represent a menu that can be toggled by interacting with this Internet Archive Audio Live Music Archive Librivox Free Audio Featured All Audio This Just In Grateful Dead Netlabels Old Time Radio RPMs and Cylinder Recordings Top Audio Books & Poetry Computers, Technology and Science Music, Arts & Culture News & Public Affairs Spirituality & Religion Podcasts Radio News Archive Images Metropolitan Museum Cleveland Museum of Art Featured All Images This Just In Flickr Commons Occupy Wall Street Flickr Cover Art USGS Maps Top NASA Images Solar System Collection Ames Research Center Software Internet Arcade Console Living Room Featured All Software This Just In Old School Emulation Games Historical Software Classic PC Games Software Library Top Kodi Archive and Support File Vintage Software APK Software Software Library Software Sites Tucows Software Library Shareware Software Capsules Compilation Images ZX Spectrum DOOM Level CD Books Books to Borrow Open Library Featured All Books All Texts This Just In Smithsonian Libraries FEDLINK (US) Genealogy Lincoln Collection Top American Libraries Canadian Libraries Universal Library Project Gutenberg Children s Library Biodiversity Heritage Library Books by Language Additional Collections Video TV News Understanding 9 11 Featured All Video This Just In Prelinger Archives Democracy Now! Occupy Wall Street TV NSA Clip Library Top Animation & Cartoons Arts & Music Computers & Technology Cultural & Academic Films Ephemeral Films Movies News & Public Affairs Spirituality & Religion Sports Videos Television Videogame Videos Vlogs Youth Media Search the history of over billi",startup,"{'status': '200', 'available': True, 'url': 'http://web.archive.org/web/20230105140027/https://codecrafters.io/', 'timestamp': '20230105140027'}",20230105140027.0,1.0
https://www.poolsmagnic.com/,55,crunchbase, PoolsMagnic You need to enable JavaScript to run this ,startup,"{'status': '200', 'available': True, 'url': 'http://web.archive.org/web/20230325104244/https://www.poolsmagnic.com/', 'timestamp': '20230325104244'}",20230325104244.0,1.0
https://www.integral.ai,2244,crunchbase," Integral AI integral Home Mission About Partners Join us Demo Use tab to navigate through the menu Top of Page PRODUCT ABOUT FEATURED CONTACT DEMO integrated AI for the our mission Accelerate AI for Human Centered We build AI & robotics solutions that are thoughtfully integrated with human life, steered by our intentions, mirroring our habits, and delivering real value to businesses and Common Sense We research & develop ML technologies, such as learning & learning from play, that build dynamical models of the world and how various tasks are done by Natural Interface Whether it s through visual demonstrations or natural language commands, our multimodal interface empowers people to express their Our AI becomes a tool to amplify human meet integral OUR FOUNDERS Our founders have been developing AI for over years, as leaders in research and engineering at Google AI, Amazon, and At Integral AI, we begin to scale our unique approach to building general We are excited to write the next chapter of AI together! OUR VISION Integrated intelligence focuses on automating habits, so that humans can pursue the creative process of exploring and defining those Our mission is to empower everyone to manifest what they imagine a true magic TECHNOLOGY We are unlocking challenging problems in unsupervised learning, giving us the ability to learn general & useful Our Common Sense AI enables learning a variety of complex tasks from very few Using our approach, user intent, style, and task objectives are inferred from our partners we are hiring! Join us to work with a team of AI researchers, robotics engineers, and hackers and build the future of robotics and AI . With offices in Tokyo and Silicon Valley , we offer benefits, growth opportunities, exciting challenges, and a rewarding environment for you to say hi: product demo We are excited to help your business through our AI platform , robust skills , and custom AI & robotics We offer safe and reliable automation technologies that effectively adapt to your business needs, lowering costs and saving you We are also looking for beta users for piloting our Common Sense AI contact us: integral San Francisco, CA Tokyo, Japan © Integral AI, Home Mission About Partners Join us Demo ",startup,"{'status': '200', 'available': True, 'url': 'http://web.archive.org/web/20221204051004/https://www.integral.ai/', 'timestamp': '20221204051004'}",20221204051004.0,1.0
http://www.partytrick.com,41654,crunchbase,"Contact â¢ Partytrick Skip to main content Don t miss this! Get 3 months free with code Ends 31 22. Partytrick Parties how it works Pricing blog Resources faqs about Contact LogÂ out LogÂ in Dashboard Get started Dashboard Get started LetÊ¼s Weâre here to help you host your best gatheringÂ Name last name email phone Comment Required Thank you for contacting us! We have received your submission and will with youÂ Oops! Something went wrong while submitting the Start the party For each party, our professional event planners have curated, styled, schemed, and planned so we can hand over everything you need to Â know to throw incredible Get started Lean into the joy of getting people togetherâ we ll do theÂ Parties How it Works Pricing Blog Log in Sign up Log out Dashboard Subscribe for updates + offers Email You are subscribed! Oops! Something went wrong while submitting the about faqs Careers contact Partnerships Request Support Tik Tok INSTAGRAM Facebook Linkedin Pinterest This website contains affiliate If you choose to purchase after clicking a link, Partytrick may receive a commission at no extra cost to you This % off discount for three (3) months is redeemable through December , , and only applies to the Partytrick standard Restrictions apply, please see Terms of Use for complete terms and Terms Privacy Â© Partytrick   Pricing â¢ Partytrick Skip to main content Partytrick Parties how it works Pricing blog Resources faqs about Contact LogÂ out LogÂ in Dashboard Get started Dashboard Get started Pricing Simplified planning at a minimal Party Preview Free Weekly party inspiration emails Search and favorite parties to your dashboard Start preview Your plan Switch to Preview Party Pro Annual Monthly $89 year Save % over monthly Unlimited, unique party plans Details for each party including menu, entertainment, and tips Custom timelines, reminders, and checklists Tips and tricks from our pros $9 mo Unlimited, unique party plans Details for each party including menu, entertainment, and tips Custom timelines, reminders, and checklists Tips and tricks from our pros Become a pro Become a pro Your plan Your very own magic wand to make your event sparkle . Our creatively planned parties cover casual to fancy, festive to , and minimal to maximal We ve gathered all the details for you to shop for the decor and tackle the nitty gritty that will make capable of throwing a party that, well, only the pros could pull Highly curated parties Created by a team of Vogue & Martha Stewart Living s favorite event planners, our collection of parties brings fabulous gatherings right to your Something for everyone We ve designed our parties to save time and make the process fun for anyone â whether you know what you re doing or have no idea where to Timed reminders Our thoughtful reminders are timed to text you leading up to event day so you remember to order the cake and empty the dishwasher before your guests Checklists Do you love checking off a box as much as we do? Our checklists are organized by timing, allowing you to accomplish tasks at the right time to keep things on Thorough timeline We give you a schedule for the day of your event so you can envision exactly how the day should unfold, allowing your event to go off without a Tips &Â tricks Weâve thought of where to put the gifts, how to tell people to leave (nicely), where the tiny fork goes, and even how to get the party started . Featured parties Left Right And the Award Goes Toâ¦ Feel like a winner with this glitz and glam filled awards show watch Everyday Cocktail Winter Casual View party Favorite Favorite Galentine s Brunch A special brunch to celebrate Valentine s Day with the lovely ladies in your Brunch Winter Casual Special Event View party Favorite Favorite Sushi Night Our take on an evening rolling your own sushi, sipping tea and sake, and basking in a serene setting inspired by Dinner Simple Formal Fall Winter View party Favorite Favorite Be Mine, Valentine Spread the love with your favorite kiddos at this crafty Winter Kids Holiday Casual Buffet View party Favorite Favorite Dinner for Two A romantic night in with your Valentines Dinner Date Night Anniversary Formal View party Favorite Favorite AprÃ¨s-Ski Throw on those argyle sweaters and ski bunny puffers to enjoy some cocktails that rival a black This is a late night cocktail party sure to Everyday Cocktail Party Late Night Party Date Night Casual View party Favorite Favorite Movie Night Embrace the funny, nostalgic, and romantic moments that come with a solid movie night with your Make this a cozy night in with yummy apps and classy Everyday Kids Cocktail Party Dinner Party Outdoor View party Favorite Favorite Talk of the town ""I ve never had such a beautifully themed party Partytrick really helped me by providing the best tablescape items that coordinate and tie everything Make sure you plan your next party with !"" Amy Columbus, OH Party type Fa La La La Festivities View party Give the gift o",startup,"{'status': '200', 'available': True, 'url': 'http://web.archive.org/web/20230116222132/https://www.partytrick.com/', 'timestamp': '20230116222132'}",20230116222132.0,1.0
https://intever.co/,4386,crunchbase," Careers Intever Open menu Products Severus A privacy focused contact management and communication Company About Us Careers Contact Us Blog Intever Close menu Severus About Us Contact Us Blog Careers We are currently focused on growth and building a team that supports If you have experience growing a B2B2C startup we d love to Contact us via Severus . We ll also be expanding our development If any of our technical blogs sound like something you d like to work on let s About Contact Blog Instagram LinkedIn Twitter GitHub Terms and Conditions Privacy Policy Cookie Policy © Intever   Contact Intever Open menu Products Severus A privacy focused contact management and communication Company About Us Careers Contact Us Blog Intever Close menu Severus About Us Contact Us Blog Contact For general inquiries, contact our support via Email , or Severus . About Contact Blog Instagram LinkedIn Twitter GitHub Terms and Conditions Privacy Policy Cookie Policy © Intever   About Us Intever Open menu Products Severus A privacy focused contact management and communication Company About Us Careers Contact Us Blog Intever Close menu Severus About Us Contact Us Blog About Us Intever is a Delaware incorporated Public Benefit Corporation, founded in by Eric Sullivan . Our mission: To improve the privacy and control that consumers have over their identity and digital assets, and to be responsible stewards of their Our flagship product is Severus , a privacy focused Contact Mangement and Communications About Contact Blog Instagram LinkedIn Twitter GitHub Terms and Conditions Privacy Policy Cookie Policy © Intever   The Intever Blog Intever Open menu Products Severus A privacy focused contact management and communication Company About Us Careers Contact Us Blog Intever Close menu Severus About Us Contact Us Blog The Intever Blog Writing to NFC tags on Android Chrome with LiveView Eric Sullivan How Severus uses Web NFC to create shareable Subdomain based SaaS with Phoenix - Part 1 Eric Sullivan Eric Sullivan documents some of the technical changes that were required to support subdomain based Severus: Announcing Support for Organizations and OAuth2 Clients Eric Sullivan Today s major release of Severus adds organizations and the ability for developers to create OAuth2 Using and to update Phoenix Liveview Eric Sullivan An overview of how Severus keeps its views up to Launch Day Eric Sullivan The Severus Beta Test is now open! A Plausible alternative to Google Analytics Eric Sullivan Hosting plausible on Public Benefit Corporation Formation Eric Sullivan An update on the PBC Announcing Severus Eric Sullivan Initial Severus About Contact Blog Instagram LinkedIn Twitter GitHub Terms and Conditions Privacy Policy Cookie Policy © Intever   Intever Co Intever Open menu Products Severus A privacy focused contact management and communication Company About Us Careers Contact Us Blog Intever Close menu Severus About Us Contact Us Blog What s new Severus now supports Organizations and OAuth2 The Contact Management System with Connections What happens after you ve shared your phone number? What happens when it changes? If you created the connection with Severus, you can see a list of everyone you ve shared your contact information with, and choose which people and businesses will automatically get your updated Start Connecting A mission to improve your privacy Intever is a public benefit corporation with a goal of improving your Our foundational product, Severus, uses a combination of technology and legal agreements to protect your When you share your email with a business, you re not only allowing them to communicate with you, but you re also sharing a unique global identifier with Those global identifiers make it even easier to share, sell, and aggregate your data across multiple With Severus, we re removing global identifiers and replacing them with Each connection is unique between two From a privacy perspective, that means you appear as a different person to every business you interact Combined with privacy protecting communications features, such as random email addresses and integrated chat, it means you ll be able to communicate with the business, but you will never be identified by a globally unique Learn more about Intever → About Contact Blog Instagram LinkedIn Twitter GitHub Terms and Conditions Privacy Policy Cookie Policy © Intever ",startup,"{'status': '200', 'available': True, 'url': 'http://web.archive.org/web/20230203233626/https://intever.co/', 'timestamp': '20230203233626'}",20230203233626.0,1.0
https://www.palatialxr.com/,23661,crunchbase,"Project Setup Features Product Using Palatial Features ProjectÂ Setup Consulting Case Study Our Services Company Resource Link 1 Resource Link 2 Resource Link 3 Contact Docs Get Started Setup Your Project How To Start Building An Immersive Experience FAQs and important pointers to keep in mind when transforming your model into an immersive experience with Join Discord Preparing your model Taking some extra time to prepare your model will lead to significant improvements in final quality, as well as a reduction in import Weâve laid out a systematic way to prepare your model For any questions, send us a message on Discord and weâll get back to you as soon as possible, normally within the Materials & Lights Making sure that materials and lights are compatible with and look right in a environment is key to ensuring both immersion for users, as well as stability and â Material Support Avoid using the following material types as they are not supported: GI override Displacements maps Lights Do not use more than 5 overlapping lights in close proximity as this will significantly degrade For best results: Use area lights instead of many small point lights Lights can be fine tuned after import if they are put on the correct layer (see layer organization section) Layer Organization To ensure that your model is properly prepared for high performance in a environment and faithful to its intended appearance, please ensure that objects are properly sorted into the following layers (or ). â Objects with Glass and Transparent Materials In order to reduce import times and optimize for performance, objects with transparency should be organized as following: Objects with simple transparency such as panes of glass on layer TranslucentSimple_[layer name] Complex objects (over triangles) with transparency such as a chandelier on layer TranslucentComplex_[layer name] Plants and Foliage Lights should be collected on a layer called Foliage_[layer name] Lights Plants and foliage should be collected on a layer called Lights_[layer name] Labeling Rooms Palatial can display the name of the room or area youâre in, as long as you define the For each area in your model, draw a box best approximating its boundaries (do not use any other shape), and name the object [Room name]. Alternatively, place each box on a separate layer and name the layer after the Objects Similar to setting up a model for rendering, making sure that objects have the correct geometry, normals, and state will go a long way in reducing unexpected Walls Do not use planes as wells, as they will not render Everything must have thickness - we recommend walls be at least thick at room scale, or light may still bleed Overlapping Duplicates If a surface is rapidly flickering when you pan in the model (z-fighting), there may be overlapping Ideally delete the duplicate, however a quick and dirty fix is to slightly move one mesh so theyâre no longer Unfreeze Unlock Objects Unfreeze unlock all objects that will be exported, or else they will not show up in the Palatial Scene Access Ensure that all parts of the scene can be accessed by individuals walking For example, if there are doors in the model, make sure that theyâre Setup Design Options Material Support If there are multiple design options or configurations in your model, Palatial allows you to toggle between options To use this feature, group or organize options per layer: Label the first option as Option_A_[RoomName], the second option as Option_B_[RoomName], There is no limit to the number of options you can include Keep in mind that the group or layer must include everything for the option, as only 1 options is visible at a Sign up for Alpha Want to test Palatial out with your project? Let us know how we can reach you and our team will be with you Thanks! Keep an eye out in your Oops! Something went wrong while submitting the Consulting Services Contact LinkedIn Discord Privacy Policy Thank you for signing up our news letters ! Oops! Something went wrong while submitting the   Features Features Product Using Palatial Features Consulting Our Services Case Study Company Contact Sign up for Alpha Features Product Using Palatial Features ProjectÂ Setup Consulting Case Study Our Services Company Resource Link 1 Resource Link 2 Resource Link 3 Contact Docs Get Started Features Build interactive content Easy to access and intuitive to use, Palatial gives you the tools to build and launch your Sign up for Alpha Sign up for Alpha Import and setup an experience With no complexity limits, setup your scene using tools built on top of Unreal Broad compatibility Support for most commonly used file formats Optimizations Automated reduction of draw calls, light and mesh complexity Guided refinements Save and name key views, set room boundaries and control viewing angles Add context Place and edit photorealistic context from Google Maps AI scene dressing Use natural language to add entourage and fix visual errors Asset libr",startup,None,nan,0.0
