website,text_len,source,text,type,closest_snapshot,closest_snapshot_time,snapshot_in_window
http://www.feed.fm,15813,crunchbase,"powers music for your fitness app <img height=""1"" width=""1"" style=""display:none"" src=""https: www.facebook.com tr?id=430413600832368&amp ev=PageView&amp noscript=1"" Product Overview Digital Fitness Music Resources Blog Customer Stories Music News Podcast Request a Demo Education Curation Fit Tech and Music ROI Digital Ecosystem Music Licensing ROI Calculator Login Get In Touch Menu Music API Digital Fitness Music Blog Customer Stories Login Let s Talk Powers Music for Your App Music Improves Retention and ROI Seamless workout music integration is one of the most effective techniques for achieving sustained fitness app Fitness app members that listen to integrated music outperform the listeners across all core engagement KPIs (4x more time spent in app, more likely to return the next month, more likely to return in a quarter). How much is a customer worth to you? is a retention and revenue driver, not a cost Let’s talk about churn and we’ll walk you through our ROI Read more in our Guide to Engagement, Retention and ROI for Mobile Apps , LTV Impact Analysis, Fitness Vertical, Let s Talk Why Does it Work? Most people know intuitively that music is a There is also an increasing body of research that shows music is performance enhancing when paired with Music distracts from fatigue sensations and athletes need less oxygen to do the same Even greater results are realized when movements are synchronized to the music’s The right soundtrack drives better performance, better results, and happier Most people know intuitively that music is a And, there is an increasing body of research that shows music is when paired with Music distracts from fatigue sensations, athletes need less oxygen to do the same And pairing music and workouts delivers even stronger results when movements are synchronized to the music’s The Right Music at the Right Time Expert curation (algorithms + humans) and music synched to coaching cues ensures a quality Comprehensive Library BPM, genre, or mixes based on access to all popular music - not just a single Seamless Integration Simple SDK embeds into your app and toolkit allows you to customize as little or as much as you Actionable Insights Music preference and impact on core KPIs are built into your Download the Guide to Fitness Technology and Music Download PDF Download PDF Want to see more? Customer Stories Music Licensing Fitness Music License Music Music API Developers Music in Action Login Company About Careers Privacy Policy Blog News Get in Touch Help & Support Sales Facebook Twitter As Seen On   powers music for your fitness app <img height=""1"" width=""1"" style=""display:none"" src=""https: www.facebook.com tr?id=430413600832368&amp ev=PageView&amp noscript=1"" Product Overview Digital Fitness Music Resources Blog Customer Stories Music News Podcast Request a Demo Education Curation Fit Tech and Music ROI Digital Ecosystem Music Licensing Login Get In Touch Menu Digital Fitness Music Blog Customer Stories News Login Let s Talk Product Overview s solution makes it easy (and legal) for brands to play great music in apps, connected fitness devices, and physical Learn More A complete solution for digital and physical Compare our solutions below for Fitness Apps, Connected Fitness, Boutiques & Gyms Digital Experiences Physical Spaces Native SDK - iOS, Android, Web Access to API for custom dev Custom Curation + Monthly Optimization Major Label Music Fitness Streaming (web video solution) Real time Dashboards Designated Customer Success Manager Background Music Licensing + App Group Fitness Licensing + Curation Providing a full suite of services designed to select, curate and deliver the most engaging and effective music to your Popular Music Unlimited Catalogue, AI and Human Curation, Brand consistency across Fully Legal Indemnification, Rights holders get paid, Never talk to a music Flexible Tech API, Native SDKs, UX in a box, No clunky Want to see more? Customer Stories Music Licensing Fitness Music License Music Music API Developers Music in Action Login Company About Careers Help & Support Privacy Policy Blog News Get in Touch Support Sales Facebook Twitter As Seen On   Music examples for apps <img height=""1"" width=""1"" style=""display:none"" src=""https: www.facebook.com tr?id=430413600832368&amp ev=PageView&amp noscript=1"" Product Music API Digital Fitness Music Sample Stations Customer Stories Request a Demo Resources Blog News Podcast ROI Calculator Music Licensing Free Guides Fitness Music Curation Fit Tech and Music App Engagement & ROI Digital Fitness Ecosystem Login Get In Touch Help & Support Sales Menu Music API Digital Fitness Music Blog Customer Stories Login Let s Talk Music in Action Recent Mixes on Today s Top Hits A pop mix that works well for fitness and companies Open Open Downtempo & Yoga Music Mix open Electronic & Dance Music Mix open Hip Hop Mix open Throwback Jams Mix open Want to see more? Customer Stories Sample Stations Music Licensing Fitness Music License Music Music A",startup,"{'status': '200', 'available': True, 'url': 'http://web.archive.org/web/20220108092841/https://www.feed.fm//', 'timestamp': '20220108092841'}",20220108092841.0,1.0
https://madewithblackculture.com,7052,crunchbase,"The Black Stamp We Are MWBC Our Why? Connect With Us Meet The Keepers The Black Stamp The Feed The Black Stamp participate with intention The BLACK STAMP is a national program to prohibit cultural The movement to establish an ethical trade policy to protect the intellectual property (IP) of Black Culture, begins with the BLACK The BLACK STAMP empowers Product Makers, Creatives and Retailers to acknowledge products that were created and or marketed using the image, likeness, labor or endorsement of Black Through a blockchain watermarking technology, Made with Black Culture provides the framework to authenticate digital and physical products with the BLACK Join the to protect the IP of Black Culture! get stARTED PBR&B beard master cleanse, you probably haven t heard of them semiotics occupy bespoke la croix man Irony coffee beard tousled waistcoat franzen sriracha af, DIY 3 wolf moon tote bag dreamcatcher kombucha banh mi, cronut tacos craft beer taiyaki put a bird on it chambray Cloud bread normcore williamsburg ramps fixie trust fund Synth dreamcatcher banjo chambray master cleanse, before they sold out enamel pin trust fund s readymade air plant fixie you probably haven t heard of RSVP for Access JOIN US PBR&B beard master cleanse, you probably haven t heard of them semiotics occupy bespoke la croix man Irony coffee beard tousled waistcoat franzen sriracha af, DIY 3 wolf moon tote bag dreamcatcher kombucha banh mi, cronut tacos craft beer taiyaki put a bird on it chambray Cloud bread normcore williamsburg ramps fixie trust fund Synth dreamcatcher banjo chambray master cleanse, before they sold out enamel pin trust fund s readymade air plant fixie you probably haven t heard of RSVP for Access JOIN US PBR&B beard master cleanse, you probably haven t heard of them semiotics occupy bespoke la croix man Irony coffee beard tousled waistcoat franzen sriracha af, DIY 3 wolf moon tote bag dreamcatcher kombucha banh mi, cronut tacos craft beer taiyaki put a bird on it chambray Cloud bread normcore williamsburg ramps fixie trust fund Synth dreamcatcher banjo chambray master cleanse, before they sold out enamel pin trust fund s readymade air plant fixie you probably haven t heard of RSVP for Access JOIN US Now We PBR&B beard master cleanse, you probably haven t heard of them semiotics occupy bespoke la croix man Irony coffee beard tousled waistcoat franzen sriracha af, DIY 3 wolf moon tote bag dreamcatcher kombucha banh mi, cronut tacos craft beer taiyaki put a bird on it chambray Cloud bread normcore williamsburg ramps fixie trust fund Synth dreamcatcher banjo chambray master cleanse, before they sold out enamel pin trust fund s readymade air plant fixie you probably haven t heard of   The Keepers We Are MWBC Our Why? Connect With Us Meet The Keepers The Black Stamp The Feed Meet The Keepers If the and Black Panther films had a sibling, then her name is MWBC We are undercover innovators that care deeply about ending oppressive As Keepers of the vision for MWBC, we apply our depth of leadership experience across the banking, creative design, insurance and nonprofit sectors to manifest the model for ethical consumption of Tommy Johnson You can find X facilitating community dialogue activations that identify solutions to overcoming systemic Born in December, the Saggitarian lives for executing lofty projects and advancing the economic interest of Black One word to describe X is Professor X STAGE NAME Community Organizer Sales Executive Maegan Lillis In Teddy s Jam is a fast friend to most people with an uncanny deep knowledge of Ty Dollar$ entire music Childhood experiences between New England and Japan shaped her zone of genius in organizational infrastructures to be vessels for social One word to describe Teddy’s Jam is Teddy s Jam STAGE NAME Social Impact Strategist & Chief of Staff Fennie Wang, ESQ When you integrate a Chinese activist into prestigious American law programs with a finance concentration, then a circular economy mastermind nicknamed Cochran emerges on the other High level business development centered in blockchain technology is her happy One word to describe Cochran is Cockran STAGE NAME FinTech Counsel Blockchain Advisor Jenell Gilyard If you ever spot Jaekwon in public, consider it an honorable privilege because magician’s don’t come outside Translating ethos into creative designs on both digital and physical mediums is her super One word to describe Jaekwon the Chef is Jaekwon, The Chef STAGE NAME Creative Director Product Designer Experience The MWBC Coalition COMING SOON   Blog | Made with Black Culture We Are MWBC Our Why? Connect With Us Meet The Keepers The Black Stamp The Feed Stay in The Know Pull up for an look into the philosophy behind the future of + READ MORE Culture Makes Profits + READ MORE For Commercial Use + READ MORE Black Culture Assets   Home We Are MWBC Our Why? Connect With Us Meet The Keepers The Black Stamp The Feed We are Made with Black Culture A blockchain minting agenc",startup,"{'status': '200', 'available': True, 'url': 'http://web.archive.org/web/20220113202636/https://madewithblackculture.com/', 'timestamp': '20220113202636'}",20220113202636.0,1.0
https://insurenimble.com/,3567,crunchbase," Home | Nimble REDUX blog try nimble? Nimble is powering the new way forward for A future built on the power of A future where all members of the process can earn investment income and participate in the what is nimble? Nimble is powering the new way forward for A future built on the power of A future where all members of the process can earn investment income and participate in the the challenge Insurance companies are inefficient and spend lots of As comes on the scene and people are deservedly demanding more value for services, the traditional insurance industry is to keep up and meet these This creates a system where insurance rates aren t equitable and there is no incentive to improve the current processes or come up with new On top of that, the concept of valuing property and equipment causes so much friction - and the outcome is reactive and We ve seen many shifts in the past few years and looking ahead, there are more to Who is going to handle the new risks and needs of a digital Insurance buyers are left unsatisfied and with limited [if any] Until the solution Create a new What we call a DRIP - Democratized Insurance Risk ​ Build tools and rails so that people can build communities and participate in all aspect of the insurance From insureds to underwriters to actuaries to claims adjuster to capital All participate to create profitable and productive Leverage the Nimble AI and tech to drive real results - earn yield, earn income, and drive down insurance roadmap We d love you to join us on this road trip to democratization of Here s a little itinerary of where we are nimble app & snappraisal launch 1 DIGITAL ASSETS & MUSIC Launching the Nimble app and allowing users to get a value of their asset or music gear, join the community, and get a digital record [NFT] for proof of ownership and And more fun 2 Bermuda incorporation Nimble Insurance, LTD will be formed in Bermuda to give our members the security of a strong regulatory and capital Community & Partner Incentive Program We are stronger So, we will be launching an incentive program to grow our community and partners to build the most profitable and beneficial community for Nimble 3 4 Testnet launch Dip your toes in and test all the amazing benefits of a decentralized Not just better data for And data that you Test the yield you can earn, the investment returns of the risk pools, and all the other benefits of a decentralized system 1 VIP Mainnet Launch 6 Public Token Sale Tokens drive our community They provide liquidity, capital, security, governances, and Public Mainnet Launch OK - Tokens have been spoken Public mainnet has been tested and we are ready for Time to open the doors and welcome you 7 8 Governance Platform An evolving practice, we will continue to build the tools and protocol to allow individual ""pools"" of members to govern as they see They are the experts of their risk cover 5 Time to make it all Launching the mainnet to a select group of dedicated Nimblers [yeah, just coined , pun intended] will allow us to be sure we are ready to give everyone the keys to the future of contact us Thanks for checking out Nimble: We are so excited to launch Nimble and usher in a new way forward for A decentralized system that helps you experience the yield, investment return, and upsides of No more victim based buying - you will be given the tools you The tools you ve been asking ​ Feel free to subscribe here or reach out to us through the contact ​ So ​ Hofmann, Founder First Name Last Name Email Write a message Submit Thanks for submitting! ",startup,"{'status': '200', 'available': True, 'url': 'http://web.archive.org/web/20220110161316/https://www.insurenimble.com/', 'timestamp': '20220110161316'}",20220110161316.0,1.0
https://www.dploysolutions.com/,50098,crunchbase,"Strategy Execution Management and Deployment Software Capabilities Strategy Deployment KPI Management Factory Floor Connectivity IIoT Analytics Project Management Advanced Analytics Data Integration Pricing Resources About Us News Contact Us Customer Login Request a Live Demo Menu Capabilities Strategy Deployment KPI Management Factory Floor Connectivity IIoT Analytics Project Management Advanced Analytics Data Integration Pricing Resources About Us News Contact Us Strategy Execution Management & Deployment Software Achieve breakthrough objectives faster with strategy execution management Connecting people at all levels to the company’s mission is the fastest way to strategic With Dploy Solutions Strategy Deployment (also known as Policy Deployment ) software, every person and every action, across multiple sites and teams, is aligned with business Everyone sees progress toward your most critical organizational and departmental And your manufacturing organization is empowered to achieve profitability and growth faster than the If the people doing the work don’t understand the big picture, it can hinder Your likely knows exactly where your organization is heading and pushes to get there faster than your But, actually getting the work done with desired outcomes means everyone needs to be on Strategy Deployment (Policy Deployment) Matrix Accelerate strategy execution management with digital With Dploy Solutions strategy execution management software, you can cascade goals down to the departmental Help every member of the team to focus on annual objectives, process improvement priorities, and measurable targets to Progress becomes transparent, enabling the team to know when and where it’s falling And employees can access online capabilities to remove roadblocks, reallocate resources, and get back on Executives can view performance trends and shift strategic planning as KPIs tracking aligned to Strategic Goals Strategy Deployment (Policy Deployment) Dashboard Make continuous improvement your way of doing Designed to work with the TBM Management System , Dploy Solutions software automates process rigor to support and streamline continuous improvement efforts from strategy deployment efforts down to daily management Put it to work in your And see how quickly business improvement happens when everyone contributes to the breakthrough performance you Download the Strategy Deployment Datasheet Capabilities Strategy Deployment KPI Management KPI Management Factory Floor Connectivity IIoT Analytics Project Management Advanced Analytics Data Integration See How Strategy Deployment Works Download the Strategy Deployment Data Sheet Management System eBook: Sustaining Your Operations Powerhouse Use strategy deployment techniques to sustain gains and drive operational performance improvements of % or Download the Strategy Deployment Data Sheet Do Strategy Deployment Right See how to create an ambitious strategy and a viable execution Read The Best Practices White Paper Request A Live Demo See how Dploy Solutions can promote better decision making, faster execution, and improved operational excellence in your unique business Please fill out the form to request your live demo Country United States United Kingdom Germany Mexico Brazil Afghanistan Albania Algeria Andorra Angola Antigua and Barbuda Argentina Armenia Australia Austria Azerbaijan Bahamas Bahrain Bangladesh Barbados Belarus Belgium Belize Benin Bhutan Bolivia Bosnia and Herzegovina Botswana Brunei Bulgaria Burkina Faso Burundi Cabo Verde Cambodia Cameroon Canada Central African Republic (CAR) Chad Chile China Colombia Comoros Democratic Republic of the Congo Republic of the Congo Costa Rica Cote d Ivoire Croatia Cuba Cyprus Czech Republic Denmark Djibouti Dominica Dominican Republic Ecuador Egypt El Salvador Equatorial Guinea Eritrea Estonia Eswatini (formerly Swaziland) Ethiopia Fiji Finland France Gabon Gambia Georgia Ghana Greece Grenada Guatemala Guinea Guyana Haiti Honduras Hungary Iceland India Indonesia Iran Iraq Ireland Israel Italy Jamaica Japan Jordan Kazakhstan Kenya Kiribati Kosovo Kuwait Kyrgyzstan Laos Latvia Lebanon Lesotho Liberia Libya Liechtenstein Lithuania Luxembourg Macedonia (FYROM) Madagascar Malawi Malaysia Maldives Mali Malta Marshall Islands Mauritania Mauritius Micronesia Moldova Monaco Mongolia Montenegro Morocco Mozambique Myanmar (formerly Burma) Namibia Nauru Nepal Netherlands New Zealand Nicaragua Niger Nigeria North Korea Norway Oman Pakistan Palau Palestine Panama Papua New Guinea Paraguay Peru Philippines Poland Portugal Qatar Romania Russia Rwanda Saint Kitts and Nevis Saint Lucia Saint Vincent and the Grenadines Samoa San Marino Sao Tome and Principe Saudi Arabia Senegal Serbia Seychelles Sierra Leone Singapore Slovakia Slovenia Solomon Islands Somalia South Africa South Korea South Sudan Spain Sri Lanka Sudan Suriname Eswatini Sweden Switzerland Syria Taiwan Tajikistan Tanzania Thailand Togo Tonga Trinidad and Tobago Tunisia Tur",startup,"{'status': '200', 'available': True, 'url': 'http://web.archive.org/web/20211221150650/https://www.dploysolutions.com/', 'timestamp': '20211221150650'}",20211221150650.0,1.0
https://www.babyfi.com/,15362,crunchbase,"Gestation Tank – Babyfi Skip to content Black Friday Sale % Off! Use coupon code BABYFI50NL at check Home Babyfi TM Hollow Headrest Our Story Gestation Tank You’re Not Alone Blog X $ 0 Cart Home Babyfi TM Hollow Headrest Our Story Gestation Tank You’re Not Alone Blog X Gestation Tank Since I’ve had kids, so many mothers have shared ideas with me about baby products: ideas for new products, ideas for safer products, more effective products, more practical products, more aesthetically the list goes Here’s what usually happens though: a mom gets a great idea, but doesn’t know how to implement the She is swamped with the responsibilities of motherhood and likely has a So she lets the idea I want to make those ideas a reality! That’s why we developed the Gestation Tank . Babyfi TM will fund this think tank where parents may submit their ideas for We will review the ideas and move forward with the ones that are not already on the market, can be implemented well, and promote a baby product revolution! The process works like this: Step 1 You, as a parent, get an The idea can be for a brand new product or an improvement for an existing Step 2 You go to Babyfi TM ’s website and submit your idea here ! Step 3 Babyfi TM reviews the Step 4 If we think the idea is feasible, we contact you, the inventor, and draw up a Step 5 We take your idea from design through production, all the way to Step 6 You, the inventor, receive a portion of the profits from each sale for the duration of the product’s So what are you waiting for?! Submit your idea to the Gestation Tank ! &nbspContact Us &nbspTerms of Service &nbspReturns and Exchanges Instagram Tiktok Linkedin © Babyfi TM . All rights   You’re Not Alone – Babyfi Skip to content Black Friday Sale % Off! Use coupon code BABYFI50NL at check Home Babyfi TM Hollow Headrest Our Story Gestation Tank You’re Not Alone Blog X $ 0 Cart Home Babyfi TM Hollow Headrest Our Story Gestation Tank You’re Not Alone Blog X Helping Single Parents You’re Not Alone I knew single parents had it hard, but I didn’t realize how hard until I had my own When I first became a parent I felt like I was drowning in As time progressed, I was able to cope, but only with the support of my amazing husband, my mom, my sister, and a ton of reliable and caring I have a whole network of people to help me, and it’s still difficult to balance childcare, a job, time for my spouse, a household, and all the other obligations of So how in the world are all the moms who don’t have anyone making it work? How are they surviving? I started looking into some statistics and discovered that 1 in 4 moms in the are single and of those single moms 3 out of live in That’s almost a third of single moms! How do single parents do it? No, let’s make this personal, how do you do it? How do you take care of a home, provide for your child, work, pay the bills, and ever have a moment to breathe? I am in awe and admiration and anyone going through this has my deepest But I don’t want to stand at a distance and watch the I want to be a practical help in people’s That’s why the partners of Babyfi TM are donating a percentage of profits to Organizations (NPO’s) that support single We are currently partnered with the following NPO’s that made stellar impressions on our team: Helping Hands for Single Moms’ mission is assisting low income single mom families as the mother attains a education, financial independence, and positive family Since , HHSM has provided over $6 million in scholarships and supportive Mommies Matter (founded by a mother) – is a charitable organization that provides group and mentoring support, as well as housing, educational, employment, and financial assistance to brave, single, pregnant Their mission is to empower single, pregnant women by “Doing Life Together”. &nbspContact Us &nbspTerms of Service &nbspReturns and Exchanges Instagram Tiktok Linkedin © Babyfi TM . All rights   Babyfi TM Hollow Headrest – Babyfi Skip to content Home Babyfi TM Hollow Headrest Our Story Gestation Tank You’re Not Alone X Home Babyfi TM Hollow Headrest Our Story Gestation Tank You’re Not Alone X Babyfi TM Products Revealed Hollow Headrest What makes the Babyfi TM Hollow Headrest unique? It’s a safe, breathable product that allows maximum air flow and carries no risk of Patent Pending! The mesh inner shell of the hollow framework ensures a fully breathable The casing is made from % organic, muslin cotton, woven to increase air circulation and prevent The ergonomic design provides a gradually declining opening in the middle of the Headrest which gently cradles the baby’s head and This design ensures an even weight distribution and reduced pressure on any one side of the Unlike many products on the market, the Babyfi TM headrest has a very slight incline of less than degrees which complies with federal regulations . Home Babyfi TM Hollow Headrest Babyfi TM Hollow Headrest + Headrest Cover $ The headrest comes in 2 colors: Will be available on Amazo",startup,"{'status': '200', 'available': True, 'url': 'http://web.archive.org/web/20230115224723/https://babyfi.com/', 'timestamp': '20230115224723'}",20230115224723.0,1.0
