website,text_len,source,text,type,closest_snapshot,closest_snapshot_time,snapshot_in_window
https://www.rfrd.io,8765,crunchbase,"Marketing Marketing Sales Success Studio Pricing Book a Demo Log In Testimonials & Case Studies Authentic customer videos in two weeks that cost % less than an agency Book a Demo Works with your marketing automation and team calendar tools Generate more qualified leads Promote Storytelling - turn your best customers into your top converting leverage videos across the customer journey and your entire tech stack Content Attribution - measure what’s what videos drive the most engagement? which answers convert the best prospects? who did your champion share videos with? Generate Referrals - Create referral programs that automatically track success and reward those who send qualified Videos Tell us about yourself and what you re building at Olive How did you produce customer content before rfrd? How has rfrd improved your process to get customer testimonials and case studies? Why is it important for Olive to connect your customers with your prospects? Why do you recommend rfrd? What would you do if rfrd disappeared tomorrow? Success stories that keep up with your growing business “It s not just getting the case study done in a more efficient way, it s freeing up my time to be more strategic"" Aine McDonnell Marketing and Brand Manager Get Started Email Address Messsage Thank you! Your submission has been received! Oops! Something went wrong while submitting the Information Home Solutions Marketing Sales Success Company About   Sales Marketing Sales Success Studio Pricing Book a Demo Log In Close more deals, faster Provide client references as soon as they’re requested to keep your opportunities and Book a Demo leverage HD sales videos across your entire pipeline References that you can depend on 7 On Demand - connect your buyer with the references that move your deal forward without having to ask for permission, make introductions, or coordinate calendars Accurate Forecasting - monitor video playback or messages between your client and prospects to gain more confidence in your opportunities and improve Buyer Alignment - create a custom playlist of videos to build value, share recordings, and immortalize demos while mapping stakeholders and measuring engagement Videos Tell us about yourself, your role, and the exciting things you re driving at TiLT! What was your reference process before rfrd? How has rfrd improved your sales process? Why is it important for Olive to connect your customers with your prospects? Why is it important for TiLT to connect your customers with your prospects? improve % by connecting your your best opportunities with your happiest customers “...faster sales cycle, shorter time to deliver "" Jessi Johanson Vice President of Sales Get Started Email Address Messsage Thank you! Your submission has been received! Oops! Something went wrong while submitting the Information Home Solutions Marketing Sales Success Company About   Pricing Marketing Sales Success Studio Pricing Book a Demo Log In Pricing stop losing opportunities due to a lack of needlessly expensive, resource intensive, and just plain bland customer content DIY $199 mo. up to videos Studio Marketplace Access Get Started Pro $749 mo. Live Customer Interview month Unlimited videos % off Studio Marketplace + Video Downloading Community Messaging Calendar Integrations Custom Recording Incentives Book a Demo most popular Custom Let s Chat perfect for large teams Contact Sales How do I get customer videos You’re welcome to set up your own account and upload your own videos into the platform through our DIY As part of our Pro package, our experts interview your clients to highlight the best of your Step 1: We collaborate with your team to uncover what makes you unique, common objections to your buying process, and which proof points will improve Step 2: Then, we coordinate virtual interviews with your best clients, asking them the questions that will help you convert more prospects and close more Step 3: We edit the recordings, set up your account, and train your team on how to use the videos to drive success across their Does this take a while to get set up? Most of our users are launched and seeing success in business It only takes us a day or two to collaborate with your team to come up with the best questions and prompts for your Depending on your clients’ calendars, we can complete their interview in the first Closed captioning and editing takes us a few days, but setting up your account is Once your videos are uploaded, we’ll schedule a time to train your team on the platform and how they should use the content to drive How’s the video quality? We get HD (1080p) video, but it actually depends on your client’s We send them a light and camera mount (that they get to keep!), coach them on how to set it up, and direct the interview We’ve found that it’s best to have a “genuine feel” to the Otherwise, they can feel sterile, manufactured, or even worse… fake! What does my client need to do? Very Once you introduce us, we will send them a l",startup,"{'status': '200', 'available': True, 'url': 'http://web.archive.org/web/20220122184010/https://www.rfrd.io/', 'timestamp': '20220122184010'}",20220122184010.0,1.0
https://www.dropspace.art,53,crunchbase, Dropspace You need to enable JavaScript to run this ,startup,"{'status': '200', 'available': True, 'url': 'http://web.archive.org/web/20211220001940/https://www.dropspace.art/', 'timestamp': '20211220001940'}",20211220001940.0,1.0
https://www.pro-tax-services.net,31008,crunchbase,"Bulletin Board | Wantagh, NY Accounting Firm | Professional Tax Services of Long Island, LLC Professional Tax Services of Long Island, LLC (516)498-7533 Login Menu Home About Hurricane Sandy Casualty Loss Update Hurricane Sandy Casualty Loss Income Tax Problems IRS Audit Representation Tax Returns Back Taxes Owed IRS Liens IRS Levies IRS Wage Garnishment IRS Seizures Offer In Compromise IRS Payment Plan Bankruptcy Innocent Spouse Relief Get Your IRS File Services Income Tax Preparation Personal Income Tax Problems Income Tax Planning Personal Financial Planning Estate Planning FBAR filing Newsletter This Month s Newsletter Previous Newsletters Today s News and Weather Tax Center Free Tax Organizer Track Your Amended Return Track Your Refund Record Retention Guide Tax Due Dates Tax Rates IRS Tax Forms and Publications State Tax Forms Tax Calculator Marginal and Effective Tax Rates Calculator Guides Life Events Tax Strategies for Individuals Investment Strategies Business Strategies Tax Strategies for Business Owners Financial Calculators Frequently Asked Questions Resources Client Reviews Clients Rate Us Bulletin Board SecureSend Client Portal Choose a Tax Pro NYS Star Exemption Identity Theft NY Times Editorial Internet Links News and Weather Valuing Non cash contributions Contact Locations AMITYVILLE TAX PREPARATION TAX RETURNS BELLMORE TAX PREPARATION TAX RETURNS EAST MEADOW TAX PREPARATION TAX RETURNS LEVITTOWN TAX PREPARATION TAX RETURNS MASSAPEQUA PARK TAX PREPARATION TAX RETURNS MERRICK TAX PREPARATION TAX RETURNS NORTH BELLMORE TAX PREPARATION TAX RETURNS WANTAGH TAX PREPARATION TAX RETURNS SEAFORD TAX PREPARATION TAX RETURNS Client Satisfaction Survey Bulletin Board Contact Us free consultation Bulletin Board Professional Tax Services of Long Island, LLC Oakfield Avenue Wantagh, NY Phone: (516)498-7533 Fax: (516)232-9545 Our Mission is to file your tax return, and strive to reduce your taxes to the fullest extent of the Information posted on this website is not intended as personal tax Consult a tax advisor familiar with your situation before applying information found Subscribe to Our Newsletter Days until April Latest News Professional Tax Services of Long Island, LLC Oakfield Avenue, Wantagh, NY T: (516)498-7533 F: (516)232-9545 E: Professional Tax Services of Long Island, LLC PO BOX , Seaford, NY T: (516)498-7533 F: (516)232-9545 E: Back to top © Professional Tax Services of Long Island, LLC Search Site Map Privacy Policy Disclaimer   Locations | Wantagh, NY Accounting Firm | Professional Tax Services of Long Island, LLC Professional Tax Services of Long Island, LLC (516)498-7533 Login Menu Home About Hurricane Sandy Casualty Loss Update Hurricane Sandy Casualty Loss Income Tax Problems IRS Audit Representation Tax Returns Back Taxes Owed IRS Liens IRS Levies IRS Wage Garnishment IRS Seizures Offer In Compromise IRS Payment Plan Bankruptcy Innocent Spouse Relief Get Your IRS File Services Income Tax Preparation Personal Income Tax Problems Income Tax Planning Personal Financial Planning Estate Planning FBAR filing Newsletter This Month s Newsletter Previous Newsletters Today s News and Weather Tax Center Free Tax Organizer Track Your Amended Return Track Your Refund Record Retention Guide Tax Due Dates Tax Rates IRS Tax Forms and Publications State Tax Forms Tax Calculator Marginal and Effective Tax Rates Calculator Guides Life Events Tax Strategies for Individuals Investment Strategies Business Strategies Tax Strategies for Business Owners Financial Calculators Frequently Asked Questions Resources Client Reviews Clients Rate Us Bulletin Board SecureSend Client Portal Choose a Tax Pro NYS Star Exemption Identity Theft NY Times Editorial Internet Links News and Weather Valuing Non cash contributions Contact Locations AMITYVILLE TAX PREPARATION TAX RETURNS BELLMORE TAX PREPARATION TAX RETURNS EAST MEADOW TAX PREPARATION TAX RETURNS LEVITTOWN TAX PREPARATION TAX RETURNS MASSAPEQUA PARK TAX PREPARATION TAX RETURNS MERRICK TAX PREPARATION TAX RETURNS NORTH BELLMORE TAX PREPARATION TAX RETURNS WANTAGH TAX PREPARATION TAX RETURNS SEAFORD TAX PREPARATION TAX RETURNS Client Satisfaction Survey Locations Contact Us free consultation Locations AMITYVILLE TAX PREPARATION TAX RETURNS A mere form New York, clients in Amityville have come to know Professional Tax Services of Long Island for providing the best personal income tax services available on Long BELLMORE TAX PREPARATION TAX RETURNS A mere form New York, clients in Bellmore have come to know Professional Tax Services of Long Island for providing the best personal income tax services available on Long EAST MEADOW TAX PREPARATION TAX RETURNS A mere form New York, clients in EAST MEADOW have come to know Professional Tax Services of Long Island for providing the best personal income tax services available on Long LEVITTOWN TAX PREPARATION TAX RETURNS A mere form New York, clients in Levittown have come to know Professional Tax Services of Long Island fo",startup,"{'status': '200', 'available': True, 'url': 'http://web.archive.org/web/20190103004510/http://pro-tax-services.net/', 'timestamp': '20190103004510'}",20190103004510.0,1.0
https://www.modularity.ai,3800,crunchbase," Modularity - Contact You need to enable JavaScript to view this Solutions About Us Log in Sign Up Contact We believe that every manager, department leader, and decision maker should be empowered to understand their budget, spend, and financial impact on the We are The Collaborative Finance Sign Up for Early Access ​ Get Started By entering your email address you agree to receive communications from us regarding our products and Responsible Disclosure Policy · Terms & Conditions · Privacy Policy © Modularity Software All rights   Modularity Home SolutionsÂ Â î  Manager Reporting Set objectives, request resources, track spend, and review Headcount Planning Manage budget IDs, split reqs, backfill, convert contractors, and push changes to the applicant tracking One platform to procure everything: people, spend, reports, and Careers Get started Sign In Sign Up Empower your managers to grow the Modularity gives throughout your company insights on where to invest their budget and Get Started Our advisors led finance, product and operations teams at: Modularity is your FP&AÂ Manager Reporting Give managers access to everything they need to manage their View plans, commitments and spend Generate monthly reviews and budget actual reports Automatically link spend to business outcomes Headcount Planning Efficiently staff your teams, build headcount plans, see span of control, and automate job Approve headcount requests Visualize your organization and span of control Synchronize hiring requests with your ATS One platform to procure everything: people, spend, reports, and Create purchase requisitions and purchase orders Approve requests (budget, finance, security, legal, ) Pay vendor bills with AP automation Everything you ll need for FP&A Get started Contact Us Unlimited Seats Our view on finance is that everyone should have controlled access to their Maximize alignment, not Automated Reporting reporting and automated budget variance As soon as your spend hits the books, it s in your Â Consolidated Reporting View spend for a single department, multiple departments, or the organization as a For all of your Bring conversation to the data Tag individuals on transactions, budget items, or When conversations live in the tool, they create a wealth of context and save you the frustration of hunting down Spend Approvals Create a system of record around approvals and automate your spend request Committed Spend Help teams allocate their budget and understand how they re pacing even before data is entered into the accounting Headcount Management Manage budget IDs, split reqs, backfill, convert contractors, and push changes to the applicant tracking Push Fixes to Accounting System Flag, tag, and fix incorrectly coded transactions using our proprietary bilateral sync integration with NetSuite and QuickBooks Accrual Capture Capture accruals directly from your team to ease your close Integrated Procurement System One platform to procure everything â from spend to people and from budgets to Manage and Sync Budgets Import budgets from excel or other tools, and plan at any level â departments, spend categories, accounts, or Structured Data Exports Consolidate data from multiple systems (including Modularity) into structured data exports for use in your corporate consolidation Project Tracking and Reporting Set objectives, request resources, track spend, and review Scales with your ERP Supports multiple QuickBooks Online accounts and Oracle Fusion Cloud ERP, Oracle Suite, and SAP coming Coming Soon! Stay tuned for new features! Thanks for signing We ll be in touch Oops! Something went Book a demo and go live in Get Started Contact Us Â© Modularity Software All rights Solutions Contact Careers Privacy Policy Responsible Disclosure Policy Terms & Conditions ",startup,"{'status': '200', 'available': True, 'url': 'http://web.archive.org/web/20220327071311/https://www.modularity.ai/', 'timestamp': '20220327071311'}",20220327071311.0,1.0
https://www.shoppablespace.com,31278,crunchbase,"Wayback Machine We will keep fighting for all libraries - stand with us! Internet Archive logo A line drawing of the Internet Archive headquarters building faÃ§ade. Donate icon An illustration of a heart shape ""Donate to the archive"" Search icon An illustration of a magnifying Search icon An illustration of a magnifying Upload icon An illustration of a horizontal line over an up pointing Upload User icon An illustration of a person s head and Sign up | Log in Web icon An illustration of a computer application window Wayback Machine Texts icon An illustration of an open Books Video icon An illustration of two cells of a film Video Audio icon An illustration of an audio Audio Software icon An illustration of a "" floppy Software Images icon An illustration of two Images Donate icon An illustration of a heart shape Donate Ellipses icon An illustration of text More Hamburger icon An icon used to represent a menu that can be toggled by interacting with this Internet Archive Audio Live Music Archive Librivox Free Audio Featured All Audio This Just In Grateful Dead Netlabels Old Time Radio RPMs and Cylinder Recordings Top Audio Books & Poetry Computers, Technology and Science Music, Arts & Culture News & Public Affairs Spirituality & Religion Podcasts Radio News Archive Images Metropolitan Museum Cleveland Museum of Art Featured All Images This Just In Flickr Commons Occupy Wall Street Flickr Cover Art USGS Maps Top NASA Images Solar System Collection Ames Research Center Software Internet Arcade Console Living Room Featured All Software This Just In Old School Emulation Games Historical Software Classic PC Games Software Library Top Kodi Archive and Support File Vintage Software APK Software Software Library Software Sites Tucows Software Library Shareware Software Capsules Compilation Images ZX Spectrum DOOM Level CD Books Books to Borrow Open Library Featured All Books All Texts This Just In Smithsonian Libraries FEDLINK (US) Genealogy Lincoln Collection Top American Libraries Canadian Libraries Universal Library Project Gutenberg Children s Library Biodiversity Heritage Library Books by Language Additional Collections Video TV News Understanding 9 11 Featured All Video This Just In Prelinger Archives Democracy Now! Occupy Wall Street TV NSA Clip Library Top Animation & Cartoons Arts & Music Computers & Technology Cultural & Academic Films Ephemeral Films Movies News & Public Affairs Spirituality & Religion Sports Videos Television Videogame Videos Vlogs Youth Media Search the history of over billion web pages on the Search the Wayback Machine Search icon An illustration of a magnifying Mobile Apps Wayback Machine (iOS) Wayback Machine (Android) Browser Extensions Chrome Firefox Safari Edge Subscription Explore the Collections Learn More Build Collections Save Page Now Capture a web page as it appears now for use as a trusted citation in the Please enter a valid web address About Blog Projects Help Donate Contact Jobs Volunteer People Sign up for free Log in Search metadata Search text contents Search TV news captions Search radio transcripts Search archived web sites Advanced Search About Blog Projects Help Donate Donate icon An illustration of a heart shape Contact Jobs Volunteer People DONATE Latest Show All The Wayback Machine has not archived that Click here to search for all archived pages under https: shoppablespace.com pages . The Wayback Machine requires your browser to support JavaScript, please email if you have any questions about The Wayback Machine is an initiative of the Internet Archive , a (c)(3) , building a digital library of Internet sites and other cultural artifacts in digital Other projects include Open Library & . Your use of the Wayback Machine is subject to the Internet Archive s Terms of Use .   Wayback Machine We will keep fighting for all libraries - stand with us! Internet Archive logo A line drawing of the Internet Archive headquarters building faÃ§ade. Donate icon An illustration of a heart shape ""Donate to the archive"" Search icon An illustration of a magnifying Search icon An illustration of a magnifying Upload icon An illustration of a horizontal line over an up pointing Upload User icon An illustration of a person s head and Sign up | Log in Web icon An illustration of a computer application window Wayback Machine Texts icon An illustration of an open Books Video icon An illustration of two cells of a film Video Audio icon An illustration of an audio Audio Software icon An illustration of a "" floppy Software Images icon An illustration of two Images Donate icon An illustration of a heart shape Donate Ellipses icon An illustration of text More Hamburger icon An icon used to represent a menu that can be toggled by interacting with this Internet Archive Audio Live Music Archive Librivox Free Audio Featured All Audio This Just In Grateful Dead Netlabels Old Time Radio RPMs and Cylinder Recordings Top Audio Books & Poetry Computers, Technology and Science Music, Arts & Culture New",startup,None,nan,0.0
https://ulustory.com/,12668,crunchbase,"Webinar Registration | ULUstory Home Webinar Registration General About Our Team Founder s Page ROI Employer Pilots Free Trial Cool Stuff Media Story Resources some great stories Contact FAQS Use tab to navigate through the menu 0 The Case for Employee Storytelling A Free Webinar on How to Generate Empathy, Inclusion and Engagement by Embedding Storytelling in Your ​ To be rescheduled Save My Spot Presented by Deb Pagnotta, Founder & CEO at Storytelling has been a vital component in each of Deb s careers: employment lawyer, VP HR, workplace conduct training consultant, college communication instructor, and now, app Her perspective is unparalleled, from the strategic multiple utilities of storytelling to its science, its architecture, and its She has been teaching & coaching storytelling skills for over years, has run and participated in story events, and collects stories the way some people collect stamps, coins, cars or recipes - with passion and Save My Spot In this webinar we will cover What is a and why you should care Not every story creates But neurosciences has identified a particular, format generaates a sense of trust, familiarity and belonging - across barriers, with strangers and even people we don t These can transform human Learn the basic HR strategies Yeah, but other than branding, when would a company use them? Really? Here s just a few: conflict management, mentoring, identity and inclusion, , Find out how to weave storytelling into your culture: it s not a , it s a lifestyle! Learn the gamut and how to maximize The ROI of storytelling The evidence is Storytelling, woven into a company s operational fabric, can improve inclusion, engagement, morale and Results? Decreased costs and increased How do we assess it? Learn how to qualitatively and quantitatively assess storytelling I want to join the webinar, Sign me up! First Name Last Name Email Company Message Submit Thanks for submitting! You will receive sign in information by The storytelling app that helps employees generate empathy, engagement and ​ Tell YOUR LINKS Home Webinar Registration General About Our Team Founder s Page ROI Employer Pilots Free Trial Cool Stuff Media Story Resources some great stories Contact FAQS CONTACT ULUSTORY SOCIAL tel: (707) Click to read a great HR strategies for app use © by Interfacet, Inc   Founder s Page | ULUstory Home Webinar Registration General About Our Team Founder s Page ROI Employer Pilots Free Trial Cool Stuff Media Story Resources some great stories Contact FAQS Use tab to navigate through the menu 0 FOUNDER S PAGE It only takes one story to conquer a lifelong fear of sharing your voice one story to touch the life of a stranger in a capacity beyond what you can imagine one story to make a drop that can ripple outward and impact our entire ​ ~ Elephant Academy mindfullife Read More The Yellow Dress Composing a Life Getting to here from there The storytelling app that helps employees generate empathy, engagement and ​ Tell YOUR LINKS Home Webinar Registration General About Our Team Founder s Page ROI Employer Pilots Free Trial Cool Stuff Media Story Resources some great stories Contact FAQS CONTACT ULUSTORY SOCIAL tel: (707) Click to read a great HR strategies for app use © by Interfacet, Inc   Employer Pilots | ULUstory Home Webinar Registration General About Our Team Founder s Page ROI Employer Pilots Free Trial Cool Stuff Media Story Resources some great stories Contact FAQS Use tab to navigate through the menu 0 For Early Adopters Present Availability EMPLOYER ULUstory has completed its MVP, that is, a app which provides our core service: helping users create that create empathy, inclusion and We are introducing here our core app for employers to innovative early adopters as a ​ Organizational are designed to introduce client employers to a specific use of ULUstory over 2 The 2 options presently available are: team building | identity & inclusion ​ The client employer will have access to both user and manager will provide HR strategical support, full onboarding, workshops, individual coaching, and ample support We will also introduce clients to our precision outcome measurement, to provide insight into We want to work and grow with early adopters and companies which recognize the power of These Experiences help employers explore how the ULUstory process and strategies actually ​ So, we offer here, through December , , this for our discounted rate of $2500. What s not to like? ​ For more information, schedule time to talk with founder Deb ​ WHAT HAPPENS AFTER THE PILOT? ​ Using feedback and data acquired through these projects, we will iterate the app to ensure we have the functionalities most useful to YOU, our clients and It s not about what WE want, it s about which aspects best serve you, your employees, clients, and Contact us to ask about pilot program Submit Thanks for submitting! The storytelling app that helps employees generate empathy, engagement and ​ Tell YOUR LINKS Home Webina",startup,"{'status': '200', 'available': True, 'url': 'http://web.archive.org/web/20220121200453/https://www.ulustory.com/', 'timestamp': '20220121200453'}",20220121200453.0,1.0
