website,text_len,source,text,type,closest_snapshot,closest_snapshot_time,snapshot_in_window
https://www.alpinetaxfiling.com/,38021,crunchbase,"Wayback Machine We will keep fighting for all libraries - stand with us! Internet Archive logo A line drawing of the Internet Archive headquarters building faÃ§ade. Donate icon An illustration of a heart shape ""Donate to the archive"" Search icon An illustration of a magnifying Search icon An illustration of a magnifying Upload icon An illustration of a horizontal line over an up pointing Upload User icon An illustration of a person s head and Sign up | Log in Web icon An illustration of a computer application window Wayback Machine Texts icon An illustration of an open Books Video icon An illustration of two cells of a film Video Audio icon An illustration of an audio Audio Software icon An illustration of a "" floppy Software Images icon An illustration of two Images Donate icon An illustration of a heart shape Donate Ellipses icon An illustration of text More Hamburger icon An icon used to represent a menu that can be toggled by interacting with this Internet Archive Audio Live Music Archive Librivox Free Audio Featured All Audio This Just In Grateful Dead Netlabels Old Time Radio RPMs and Cylinder Recordings Top Audio Books & Poetry Computers, Technology and Science Music, Arts & Culture News & Public Affairs Spirituality & Religion Podcasts Radio News Archive Images Metropolitan Museum Cleveland Museum of Art Featured All Images This Just In Flickr Commons Occupy Wall Street Flickr Cover Art USGS Maps Top NASA Images Solar System Collection Ames Research Center Software Internet Arcade Console Living Room Featured All Software This Just In Old School Emulation Games Historical Software Classic PC Games Software Library Top Kodi Archive and Support File Vintage Software APK Software Software Library Software Sites Tucows Software Library Shareware Software Capsules Compilation Images ZX Spectrum DOOM Level CD Books Books to Borrow Open Library Featured All Books All Texts This Just In Smithsonian Libraries FEDLINK (US) Genealogy Lincoln Collection Top American Libraries Canadian Libraries Universal Library Project Gutenberg Children s Library Biodiversity Heritage Library Books by Language Additional Collections Video TV News Understanding 9 11 Featured All Video This Just In Prelinger Archives Democracy Now! Occupy Wall Street TV NSA Clip Library Top Animation & Cartoons Arts & Music Computers & Technology Cultural & Academic Films Ephemeral Films Movies News & Public Affairs Spirituality & Religion Sports Videos Television Videogame Videos Vlogs Youth Media Search the history of over billion web pages on the Search the Wayback Machine Search icon An illustration of a magnifying Mobile Apps Wayback Machine (iOS) Wayback Machine (Android) Browser Extensions Chrome Firefox Safari Edge Subscription Explore the Collections Learn More Build Collections Save Page Now Capture a web page as it appears now for use as a trusted citation in the Please enter a valid web address About Blog Projects Help Donate Contact Jobs Volunteer People Sign up for free Log in Search metadata Search text contents Search TV news captions Search radio transcripts Search archived web sites Advanced Search About Blog Projects Help Donate Donate icon An illustration of a heart shape Contact Jobs Volunteer People DONATE Latest Show All The Wayback Machine has not archived that Click here to search for all archived pages under https: www.alpinetaxfiling.com services extension-filing . The Wayback Machine requires your browser to support JavaScript, please email if you have any questions about The Wayback Machine is an initiative of the Internet Archive , a (c)(3) , building a digital library of Internet sites and other cultural artifacts in digital Other projects include Open Library & . Your use of the Wayback Machine is subject to the Internet Archive s Terms of Use .   About Tax Planning | Alpine Tax Filing Skip to main content +1 Home About us Services Extension Filing FBAR FATCA Process Tax Planning Tax Return Evaluation IRS AUDIT Representation ITIN Application Process Contact us Sign In Sign Up Home » Services » Tax Planning take a moment Tax Planning To make your site as secure as possible, take a moment to optimize the Wordfence Web Application Contact us Flexible Tax Solutions for today s Digital Workspace Accelerate you business growth About Tax Solutions Tax planning is the analysis of a financial situation or plan to ensure that all elements work together to allow you to pay the lowest taxes Act offers many tax planning investment schemes that can significantly reduce your tax To plan events: It helps us to decide when to realize capital gain and when to withdraw money from different planning covers several Considerations include timing of income, size, and timing of purchases, and planning for other Also, the selection of investments and types of retirement plans must complement the tax filing status and deductions to create the best possible planning is a legal approach to lowering the tax burden through tax benefits, ded",startup,"{'status': '200', 'available': True, 'url': 'http://web.archive.org/web/20230117182549/https://www.alpinetaxfiling.com/', 'timestamp': '20230117182549'}",20230117182549.0,1.0
https://www.blockpack.io,53,crunchbase, BlockPack You need to enable JavaScript to run this ,startup,"{'status': '200', 'available': True, 'url': 'http://web.archive.org/web/20221004025739/https://www.blockpack.io/', 'timestamp': '20221004025739'}",20221004025739.0,1.0
https://friendstart.app/,136,crunchbase, FriendStart Our App is Almost on Product Hunt Make friends with common interests Days Hours Minutes Seconds Make Friends Made on Tilda ,startup,"{'status': '200', 'available': True, 'url': 'http://web.archive.org/web/20221001074418/https://friendstart.app/', 'timestamp': '20221001074418'}",20221001074418.0,1.0
https://artistverified.com,1944,crunchbase," Artist Verified | Portal Request Access Portal bridging Web2,Web3 and All Partner Revenue Â Request Access For Artists Take full control of your fan Authenticate your rights and IP partnerships on the Blockchain across all iterations of the Security Secure your brand and intellectual property Storage Execute and store deals securely and accessible on the blockchain Marketing Centralize your marketing across revenue streams Messaging Free noiseless messaging directly to your fans Authenticity Give your fans the give of trust and insight into new engagement streams Insights Acquire new metrics on revenue streams across Web2, Web3, Web5, and For Fans Find ALL of your favorite artistsâ authentic and verified offers, new engagement experiences and live messaging in one portal direct from the Authentic Engagement Safely engage with your favorite artists from one platform where every offer is identifiable as and Invest in Your Favorites Discover new and compelling ways to engage with and invest in your favorite artists across Web2, Web3, and Noiseless Messaging Receive Direct Messages and updates in a noiseless environment where you wonât miss out on the latest No No other artist messages that you didnât ask For Platforms Validate and Authenticate your platform as an official Partner and give fans the highest level of Trust Establish trust with new fans exploring new engagement channels across Web2 and Web3 Authenticity Embed authenticity into all platform offers through neutral smart contracts on the blockchain and QR code authenticity Opportunity Discover new artist client opportunities Data Source new and data Status Establish status with artists, labels, and companies Want to learn more? Request Access Thank you! Your submission has been received! Oops! Something went wrong while submitting the Request Beta Access Thank you! Your submission has been received! Oops! Something went wrong while submitting the ",startup,"{'status': '200', 'available': True, 'url': 'http://web.archive.org/web/20221208215406/https://www.artistverified.com/', 'timestamp': '20221208215406'}",20221208215406.0,1.0
https://www.researchable.info,49777,crunchbase,"Submit a research summary We re building an evidence base for Posts are written by experts and synthesize the best available research on each posts topics About us Submit a Post SUBSCRIBE Get the best research in your inbox via our Privacy policy Posts are licensed under a Creative Commons International Privacy policy Posts are licensed under a Creative Commons International   Topics We re building an evidence base for Posts are written by experts and synthesize the best available research on each posts topics About us Submit a Post SUBSCRIBE Get the best research in your inbox via our Privacy policy Posts are licensed under a Creative Commons International Privacy policy Posts are licensed under a Creative Commons International Topics Academia Child care City planning Consumption Crime DEI Economic policy Education Elections Environment Family Gender bias Gun violence Happiness Healthcare Housing Immigration policy Labor market Leisure Management Money News media Parenting Photos Polarization Policing Public policy Racial bias Running Social media Social movements Technology Transportation US Politics UX Design WFH Wellness Work World politics   Privacy policy We re building an evidence base for Posts are written by experts and synthesize the best available research on each posts topics About us Submit a Post SUBSCRIBE Get the best research in your inbox via our Privacy policy Posts are licensed under a Creative Commons International Privacy policy Posts are licensed under a Creative Commons International Privacy Notice Last updated June , This privacy notice for Researchable, ("" Company ,"" "" we ,"" "" us ,"" or "" our ""), describes how and why we might collect, store, use, and or share ("" process "") your information when you use our services ("" Services ""), such as when you: Visit our website at https: www.researchable.info , or any website of ours that links to this privacy notice Engage with us in other related ways, including any sales, marketing, or events Questions or concerns? Reading this privacy notice will help you understand your privacy rights and If you do not agree with our policies and practices, please do not use our If you still have any questions or concerns, please contact us at SUMMARY OF KEY POINTS This summary provides key points from our privacy notice, but you can find out more details about any of these topics by clicking the link following each key point or by using our table of contents below to find the section you are looking You can also click here to go directly to our table of What personal information do we process? When you visit, use, or navigate our Services, we may process personal information depending on how you interact with Researchable, and the Services, the choices you make, and the products and features you Click here to learn Do we process any sensitive personal information? We do not process sensitive personal Do we receive any information from third parties? We do not receive any information from third How do we process your information? We process your information to provide, improve, and administer our Services, communicate with you, for security and fraud prevention, and to comply with We may also process your information for other purposes with your We process your information only when we have a valid legal reason to do Click here to learn In what situations and with which parties do we share personal information? We may share information in specific situations and with specific third Click here to learn How do we keep your information safe? We have organizational and technical processes and procedures in place to protect your personal However, no electronic transmission over the internet or information storage technology can be guaranteed to be % secure, so we cannot promise or guarantee that hackers, cybercriminals, or other unauthorized third parties will not be able to defeat our security and improperly collect, access, steal, or modify your Click here to learn What are your rights? Depending on where you are located geographically, the applicable privacy law may mean you have certain rights regarding your personal Click here to learn How do I exercise my rights? The easiest way to exercise your rights is by filling out our data subject request form available here , or by contacting We will consider and act upon any request in accordance with applicable data protection Want to learn more about what Researchable, does with any information we collect? Click here to review the notice in TABLE OF CONTENTS WHAT INFORMATION DO WE COLLECT? HOW DO WE PROCESS YOUR INFORMATION? WHAT LEGAL BASES DO WE RELY ON TO PROCESS YOUR PERSONAL INFORMATION? WHEN AND WITH WHOM DO WE SHARE YOUR PERSONAL INFORMATION? DO WE USE COOKIES AND OTHER TRACKING TECHNOLOGIES? HOW DO WE HANDLE YOUR SOCIAL LOGINS? IS YOUR INFORMATION TRANSFERRED INTERNATIONALLY? HOW LONG DO WE KEEP YOUR INFORMATION? HOW DO WE KEEP YOUR INFORMATION SAFE? DO WE COLLECT INFORMATION FROM MINORS? WHAT ARE YOUR ",startup,"{'status': '200', 'available': True, 'url': 'http://web.archive.org/web/20230110213356/https://www.researchable.info/', 'timestamp': '20230110213356'}",20230110213356.0,1.0
https://www.windmill.dev/,7492,crunchbase,"Pricing | Windmill Windmill Open menu Pricing Documentation Hub OpenAPI More Book a demo Windmill Cloud Pricing Operator vs Author An author can write scripts flows apps variables resources. An operator can only run view What is a computation? The single is called a ""computation"". An computation corresponds to a single job whose duration is less than For any additional seconds of computation, an additional computation is accounted Jobs are executed on one powerful virtual CPU with of Most jobs will take less than to Cloud Free 1 free global executions per month Community support on Discord Team $10 mo , includes 1 user author + computations at no cost + $8 mo per extra user author in the workspace + $4 mo per extra operators in the + $0.001 per extra computation Google Github Microsoft Gitlab SSO Unlimited variables resources scripts apps flows Support 7 with response time Limited to seats Estimate Cost # of authors: # of operators: # of computations: $ mo Sign in and upgrade your workspace Enterprise $200 mo , includes 1 user author + computations at no cost + $32 mo per extra user author in the workspace + $16 mo per extra operators in the + $0.004 per extra computation Dedicated isolated workers and database available for + $400 mo (available in US EU Asia) Dedicated entire kubernetes cluster + $4000 mo (available in US EU Asia) SAML support SLA Priority Support 7 with response time and automation engineer assistance Design partners for Roadmap Estimate Cost # of authors: # of operators: # of computations: Dedicated isolated workers and database Dedicated cluster $ mo Interested? [email protected] Footer Support Pricing Documentation Github OpenAPI Discord Company About Blog Legal Privacy Policy Terms of Service License Terms Made with passion in San Francisco and © Windmill Labs, All rights S Governors Ave, Dover, DE , USA Windmill Labs is SOC 2 Type I compliant   Windmill Windmill Open menu Pricing Documentation Hub OpenAPI More Book a demo Windmill Cloud Turn scripts into workflows and UIs in minutes Easily create internal apps and invincible workflows with code only where it Fully and worker infrastructure : scalable, reliable, Try Windmill Cloud yourself → Read the docs Backed by Give your scripts Superpowers Make your scripts production grade automatically, and build all of your internal tools with standard Python Typescript Go Bash Sql. Compose your scripts as advanced workflows using our builder and share an autogenerated UI or build one using Run it reliably at scale on your infra or ours, with permissioning and monitoring Fully and easy to deploy on small and large Any dependency and hardware acceleration with Scripts Flows Apps Scripts No overhead, scalable, FaaS Develop and maintain scripts from our web editor or use your own IDE and deploy from Upskill your less technical It s easier to learn writing useful scripts with Select a tab Polyglot Autogenerated UI Web IDE Github Secrets & State Multiple Triggers Typescript Python Go Bash PostgreSQL MySQL Loading Deno as the typescript Polyglot Autogenerated UI Web IDE Github Secrets & State Multiple Triggers Typescript Python Go Bash PostgreSQL MySQL Loading Deno as the typescript Examples Slack messaging Send message to a specific channel on Slack See example - Generate image using OpenAI Given a prompt, generate an image using OpenAI See example - Search documents in MongoDB Selects documents in a MongoDB collection or view and returns a cursor to the selected documents See example - Explore more scripts on the Hub Try building scripts Flows Workflow engine with Airflow Temporal Build complex Flows from atomic scripts, either from your workspace or the Hub . Select a tab Flow editor Suspend Approval Step Retries Multiple Triggers Sequence Build complex Flows from atomic Branching branching logic to create complex For Loops Create for loops to iterate over a list of Error Handler Easily recover from errors and continue your flow or log the error on Slack, Discord, Loading Write scripts in Typescript, Python, Go and Bash or use scripts from the hub Flow editor Suspend Approval Step Retries Multiple Triggers Sequence Build complex Flows from atomic Branching branching logic to create complex For Loops Create for loops to iterate over a list of Error Handler Easily recover from errors and continue your flow or log the error on Slack, Discord, Loading Write scripts in Typescript, Python, Go and Bash or use scripts from the hub Examples Hacker News mentions Whenever an Hacker News message contains a mention, publish it to Slack with NLTK sentiment See example - Expense report internal workflow When new expenses are uploaded to Google Drive , extract text using Tesseract and notify on Slack . See example - Sign up a user in the database Upon new user signup, check for existence in Postgres , hash password, add record to Google Drive and Airtable , send an Email to new See example - Explore more flows on the Hub Try building flows Apps Easy to use WYSI",startup,"{'status': '200', 'available': True, 'url': 'http://web.archive.org/web/20230213153445/https://www.windmill.dev/', 'timestamp': '20230213153445'}",20230213153445.0,1.0
https://votix.com,17421,crunchbase,"VOTIX – Drone Management Software Home Products Platform Manage Stream Fly About Resources Videos Whitepapers Podcasts Blog Contact Us Cloud Portal Select Page Drone Management VOTIX MANAGE is a complete drone management software for your drone operations: mission planning, fleet management and drone VOTIX MANAGE simplifies your drone operations and automate you drone workflows, including Low Altitude Authorization and Notification Capability (LAANC), saving you time while enhancing safety and With VOTIX MANAGE you can import and centralize your flight logs and provide immediate visibility into your flights, fleet and VOTIX MANAGE creates a mission request and approval workflow, helps you to control the pilot and drone productivity and keep track of all your VOTIX MANAGE organizes all your data correlating missions, zones, logs, media, pilots, drones, sensor sand (DIB) stations automatically creating powerful insights and intelligence of your drone With dashboards and reports, VOTIX provides access to all of the information you need to improve business governance and Main features Plan​ • Mission Creation • Zone Creation • Polygonal Geo Fencing • Customizable Automated Grids • Zone KML KMZ Importing • Mission KML KMZ Importing • Mission Approval Workflow • FAA LAANC Approval • Mission Map Paths • Map Annotations • Operations Calendar • Weather Information • Corporate Systems Integration • Airspace Intelligence Control​ • User and Organization Management • Pilot Management • Fleet Management • Sensor Management • DIB Management • Zone Management • Mission Management • Media Management Data • Flight Log Importing • Mission Data Captured Importing • Automatic Data Captured Importing • Analytics Dashboards • Media Metadata Analysis • Reports • Reports Request a Free Trial (no credit card required) Go beyond with the full suite of VOTIX products! Website Terms of Use Copyright © VOTIX   VOTIX – Drone Orchestration Home Products Platform Manage Stream Fly About Resources Videos Whitepapers Podcasts Blog Contact Us Cloud Portal Select Page “Without orchestration there is no automation” Ed Boucas CEO of VOTIX Drone Orchestration VOTIX is disrupting the drone industry by creating the concept of drone Our vision is to be the platform for automated drone operations by connecting all the moving parts through drone VOTIX makes it easy to operate and feasible to We believe in the power of creating synergies within the ecosystem that reduces process time and generates great VOTIX developed the first platform capable of truly delivering drone orchestration, remote operation and automation while being drone To better adapt to market timing and market needs, VOTIX has divided the platform into 3 independent, but fully integrated, products: MANAGE, STREAM, Separately these 3 products can meet all your needs while respecting your priorities by implementing them at different When combined, VOTIX provides the most powerful platform to support your drone Product Suite VOTIX is a complete platform composed of a suite of 3 SaaS (software as a service) products – MANAGE, STREAM, FLY – enhanced by VOTIX gateway (VXG) and VOTIX mobile apps (VXS, VXC). The VOTIX platform is a powerful, solution that automates drone operations so you can MANAGE your missions, resources and data, STREAM your flight videos in and FLY your drones remotely integrated with your drone Main features by product: MANAGE (Cloud, VXS) Plan​ • Mission Creation • Zone Creation • Polygonal Geo Fencing • Customizable Automated Grids • Zone KML KMZ Importing • Mission KML KMZ Importing • Mission Approval Workflow • FAA LAANC Approval • Mission Map Paths • Map Annotations • Operations Calendar • Weather Information • Corporate Systems Integration • Airspace Intelligence Control​ • User and Organization Management • Pilot Management • Fleet Management • Sensor Management • DIB Management • Zone Management • Mission Management • Media Management Data • Flight Log Importing • Mission Data Captured Importing • Automatic Data Captured Importing • Analytics Dashboards • Media Metadata Analysis • Reports • Reports More Info STREAM (Cloud, VXS) • HD Latency • Encrypted Communication • Video Quality Configuration • Video Recording Locally • Authenticated Streaming ​ • HD Latency • Encrypted Communication • Video Quality Configuration • Video Recording Locally • Cloud Video Recording • Store and Organize Video Recordings in the Cloud • Authenticated Streaming • Open and PIN Based Streaming • Simultaneously Stream Multiple Drones to Different Groups • Video Broadcasting: RTMP servers, YouTube, Facebook, Twitter, Vimeo ​ • Console for Drones and Other Sources: IP cameras, CCTV, phones, body cameras, dash cameras • Floating Windows for Drones and Other Sources More Info FLY (Cloud, VXG, VXC) Operation​ • Remote Operation • Onsite Operation • Payload Control • Control Segregation: drone, sensors • Custom Conflict Zones • Multiple Safe Landing Points • Airdrop Mission • Go To Locatio",startup,"{'status': '200', 'available': True, 'url': 'http://web.archive.org/web/20230109182736/https://votix.com/', 'timestamp': '20230109182736'}",20230109182736.0,1.0
https://www.joinperspective.com,220,crunchbase," The Intelligent Journal The journal you ll actually Reflect on your life, improve your mood, and build healthy habits with the world s most intelligent Join the waitlist © Perspective Technologies All rights Thank You! ",startup,"{'status': '200', 'available': True, 'url': 'http://web.archive.org/web/20221204024533/https://www.joinperspective.com', 'timestamp': '20221204024533'}",20221204024533.0,1.0
