website,text_len,source,text,type,closest_snapshot,closest_snapshot_time,snapshot_in_window
https://raircapital.com,11051,crunchbase,"Affiliate Companies | Rair Capital | Florida | Michigan Skip to content Home Services Commercial Real Estate Lending Cannabis Real Estate Lending & Business Working Capital Corporate and Business Working Capital About Us Affiliated Companies Philanthropy Careers Contact Menu Home Services Commercial Real Estate Lending Cannabis Real Estate Lending & Business Working Capital Corporate and Business Working Capital About Us Affiliated Companies Philanthropy Careers Contact Apply Now Apply Home » Affiliated Companies The Strategic Affiliation of Rair Capital: Delivering Comprehensive Real Estate Solutions Rair Capital has established strategic affiliations with some of the leading players in the commercial real estate The company is associated with C3 CRE, LLC and Corbco Ventures, These affiliations allow Rair Capital to offer a comprehensive range of commercial real estate services that can help clients achieve their goals in commercial real estate brokerage, and commercial development and Corbco Ventures, LLC: Commercial Development and Investments Rair Capital’s affiliation with Corbco Ventures, LLC enables the company to offer commercial development and investment services in Michigan and Corbco Ventures, LLC has a proven track record of success in developing commercial properties and With their expertise, Rair Capital can help clients identify profitable investment opportunities and guide them through the process of acquiring and developing commercial Corbco Ventures Corbco Ventures, LLC is a commercial real estate development company that invests in commercial real estate, cannabis & CBD, retail & restaurants, technology, and many other As a investment company, Corbco Ventures has built a positive reputation with clients and partners because of its impressive expertise, morals, and This revolutionary company always has its clients’ best interests in mind and puts them first by finding properties clients desire while supplying the market with new Led by a fierce entrepreneurial spirit, Corbco Ventures is set to have a prominent influence in the commercial real estate industries throughout Michigan, nationally, and C3 CRE, LLC: Commercial Real Estate Services The strategic affiliation between Rair Capital and C3 CRE, LLC allows the company to provide comprehensive commercial real estate services to its With the expertise of C3 CRE, LLC, Rair Capital can offer brokerage services that are tailored to meet the specific needs of each Whether you are looking to buy, sell, or lease a commercial property, Rair Capital has the knowledge and experience to guide you through the C3 CRE C3 CRE, LLC is a professional brokerage company specializing in numerous fields, including retail, cannabis, industrial, and other commercial C3 CRE was founded with scaling in mind, which is why it is vertically integrated with its affiliated leading brands – Corbco Ventures, LLC and Rair With this network of companies, C3 CRE can focus on outcomes for the company’s development and the future success of its By offering selling and buying opportunities, C3 CRE is able to continue developing to help clients reach their real estate and or business Utilize the services of one of the commercial lending platforms for your Instagram Facebook Linkedin Services Commercial Real Estate Lending Cannabis Real Estate Lending & Business Working Capital Corporate & Business Working Capital About Us Affiliated Companies Philanthropy Contact Us [email protected] (813) SunTrust Financial Centre E Jackson Street, Suite Tampa, Florida © Rair Capital All rights reserved Privacy Policy Terms & Conditions Disclaimers Site Map Privacy Policy Terms & Conditions Disclaimers Site Map © Rair Capital All rights reserved Privacy Policy Terms & Conditions Disclaimers Site Map Privacy Policy Terms & Conditions Disclaimers Site Map   Commercial Real Estate, Business and Cannabis Lending | Rair Skip to content Home Services Commercial Real Estate Lending Cannabis Real Estate Lending & Business Working Capital Business Working Capital About Us Affiliated Companies Philanthropy Contact Menu Home Services Commercial Real Estate Lending Cannabis Real Estate Lending & Business Working Capital Business Working Capital About Us Affiliated Companies Philanthropy Contact Apply Now Home Services Commercial Real Estate Lending Cannabis Real Estate Lending & Business Working Capital Business Working Capital About Us Affiliated Companies Philanthropy Contact Apply Now Menu Home Services Commercial Real Estate Lending Cannabis Real Estate Lending & Business Working Capital Business Working Capital About Us Affiliated Companies Philanthropy Contact Apply Now Home WELCOME TO RAIR CAPITAL A Lending Platform for Commercial Borrowers Our commercial lending platform gives owners of Commercial Real Estate and Businesses immediate access to ,000+ lenders that are actively looking to fund new Apply Now Commercial Real Estate Lending Explore financing options for property acquisitions, refina",startup,"{'status': '200', 'available': True, 'url': 'http://web.archive.org/web/20230406221300/https://raircapital.com/', 'timestamp': '20230406221300'}",20230406221300.0,1.0
https://www.cerberustx.com/,1733,crunchbase," Home | Cerberus Therapeutics top of page About Us Contact Us More Use tab to navigate through the menu Join Us Cerberus Therapeutics is engineering the immune system Utilizing the small, but mighty, nanobodies as versatile drug targeting agents Initial programs focus on developing therapies for autoimmune and infectious diseases Home: Welcome About Us ABOUT US Cerberus Therapeutics utilizes platform to create novel therapeuties for modulating the immune The pandemic highlights the need for safe and accessible therapies to engineer our immune We have developed strategies that allows for precise turning on off the immune system in response to Our pilot programs focus on autoimmune disorders and infectious diseases based on novel biological discoveries originating from decades of work by our three founders: Novalia Pishesha, Hidde Ploegh, and Harvey Join Us JOIN US As a growing biotech startup, we are always looking for new team Whether you’re interested in the science, business development, or have something unique to bring to the team, we’d love to chat with you! We value team players who are driven by challenges and Reach out to us and send your CV to Research Scientist Establishing and executing protocols in immunology, performing ex vivo, and in vivo assays with the goal of investigating the efficacy of Cerberus’ novel therapeutic leads as treatment for autoimmune ​ download PDF Research Associate Working together in team with the goal of advancing Cerberus’ novel therapeutic leads as treatment for autoimmune ​ download PDF CONTACT US ​ Main St, Cambridge, MA Name Email Phone Address Subject Message Submit Contact Us Address Main Cambridge, MA, Contact Copyright © Cerberus Therapeutics bottom of page ",startup,"{'status': '200', 'available': True, 'url': 'http://web.archive.org/web/20230320180202/https://www.cerberustx.com/', 'timestamp': '20230320180202'}",20230320180202.0,1.0
https://shellrocksoyprocessing.com/,9517,crunchbase,"Shell Rock Soy Processing Plant Home Bids Offers Soybean Bids Meal Hulls About Us News Contact Us Careers More Home Bids Offers Soybean Bids Meal Hulls About Us News Contact Us Careers Home Bids Offers Soybean Bids Meal Hulls About Us News Contact Us Careers Contact us Drop us a line Name Email Send This site is protected by reCAPTCHA and the Google Privacy Policy and Terms of Service Shell Rock Soybean Processing Plant If you have any questions about SRSP or would like more information about investing in the plant, contact We look forward to hearing from For any inquiries, contact the mainline at For merchandising inquiries, contact a merchandiser at Street, Shell Rock, Iowa , United States Get directions Shell Rock Soy Processing LLC St, Shell Rock, Iowa , United States Copyright © Shell Rock Soy Processing Plant - All Rights Powered by GoDaddy Website Builder   About Us Home Bids Offers Soybean Bids Meal Hulls About Us News Contact Us Careers More Home Bids Offers Soybean Bids Meal Hulls About Us News Contact Us Careers Home Bids Offers Soybean Bids Meal Hulls About Us News Contact Us Careers About Us Shell Rock Soy Processing (SRSP) is a growing company with a new soybean crush plant currently under construction in the Butler Logistics Park in Shell Rock, The plant will be complete in late We are actively bidding for soybeans and expect to slowly begin receiving mid to late fall! SRSP will help propel agriculture forward in With the renewable fuels sector driving the need for additional soybean crush, and with impressive growth in protein demand, SRSP is an answer to the call of the larger macro Most importantly, we are confident in our ability to leverage our team’s collective + years of industry experience to provide competitive bids an excellent, efficient experience for trucks timely payments and accounting for soybean suppliers and partners you can We are very excited about our opportunity to bring new value and a great experience to the agriculture community around us! Our Vision SRSP will boldly maximize value for our stakeholders and We will seek excellence in all we do, while upholding the highest standards of integrity and Our Values We Will Be Safe - We believe that every incident is preventable and safe work drives We believe is We Put Integrity First - We do the right thing even when others are not We maintain trust and are We Will Be Bold - We reach higher, we do more, with appropriate thought and We Embrace Collaboration - We work together as an inclusive team to create good outcomes for We Seek Excellence - We are committed to clear success, to our craft, and we strive to be best in Photos Shell Rock Soy Processing LLC St, Shell Rock, Iowa , United States Copyright © Shell Rock Soy Processing Plant - All Rights Powered by GoDaddy Website Builder   Home Home Bids Offers Soybean Bids Meal Hulls About Us News Contact Us Careers More Home Bids Offers Soybean Bids Meal Hulls About Us News Contact Us Careers Home Bids Offers Soybean Bids Meal Hulls About Us News Contact Us Careers Welcome to Shell Rock Soy Processing Learn More About Us Shell Rock Soy Processing (SRSP) is a growing company with a new soybean crush plant currently under construction in the Butler Logistics Park in Shell Rock, We are actively bidding for soybeans ! SRSP will help propel agriculture forward in With the renewable fuels sector driving the need for additional soybean crush, and with impressive growth in protein demand, SRSP is an answer to the call of the larger macro We are very excited about our opportunity to bring new value and a great experience to the agriculture community around us! Soybeans Soybean Meal Soybean Meal Soybean Bids Soybean Meal Soybean Meal Soybean Meal Meal Offers Soy Hulls Soybean Meal Soybean Oil Hull offers Soybean Oil Soybean Meal Soybean Oil Soybean Oil Contact Us Have Questions? Name Email Send This site is protected by reCAPTCHA and the Google Privacy Policy and Terms of Service Get In Touch With Us If you have any questions about Shell Rock Soy Processing or would like more information about our products, please fill out the form or call us at the number listed We look forward to hearing from Shell Rock Soy Processing Plant Address St, Shell Rock, Iowa , United States Main Office Line: Merchandising: Get directions Shell Rock Soy Processing LLC St, Shell Rock, Iowa , United States Copyright © Shell Rock Soy Processing Plant - All Rights Powered by GoDaddy Website Builder   Careers Home Bids Offers Soybean Bids Meal Hulls About Us News Contact Us Careers More Home Bids Offers Soybean Bids Meal Hulls About Us News Contact Us Careers Home Bids Offers Soybean Bids Meal Hulls About Us News Contact Us Careers Work with us! Culture Benefits Open Positions Contact Us culture At Shell Rock Soy Processing, HOW we do what we do is equally as important as WHAT we As we strive to maximize value for our stakeholders and communities, we aim for excellence while upholding the highest standards of int",startup,None,nan,0.0
https://privio.co/,16011,crunchbase,"Product Center - Privio Skip links Skip to primary navigation Skip to content Home About Products Privio Tracker Concise reports tracking Privio HR Enhance HR Efficiencies Privio Center Effective project control Pricing Privio Tracker Plans to suit your needs Privio HR Select a Pricing Plan Privio Center Best productivity plans Career Contact Free Signup Privio Tracker Create your free account Privio HR Start with a trail account Privio Center Register for a free account Login Privio Tracker Login to Tracker account Privio HR Login to start using HR Privio Center Login to access the Center Request Demo scroll Toggle navigation Home About Products Privio Tracker Concise reports tracking Privio HR Enhance HR Efficiencies Privio Center Effective project control Pricing Privio Tracker Plans to suit your needs Privio HR Select a Pricing Plan Privio Center Best productivity plans Career Contact Privio Center We help teams plan, manage and optimize projects across Document Sharing Message Feature Navigate a Centralized System For Seamless Work Process Privio Center’s Document Sharing feature is a tool that gives you the opportunity to share digital documents in an organized You can determine who gets access to the files within a project or Try it out! Communicate and Collaborate With Your Team in One Place Effortless messaging support for deeper collaboration – Privio Center’s messaging feature is the best way to bring responsive, dynamic connectivity to your users and improve collaboration while working in Try it now! Track your Projects and Tasks to Meet Specified Project Constraints Projects are made up of tasks and task management with Privio Center is how the workflow is efficiently It’s , , and part of the larger scheduling of a Delegate Work Assign projects or tasks to an individual or a team Set Priorities Make lists according to priority to manage project Task Recurrence Set up recurring tasks once and for all to cut down Use for easy completion of more complex Set Deadlines Meet deadlines to prevent project bottlenecks and deliver Track Status Stay informed on when the tasks are ready, assigned, started, or Turn Complex Data into Actionable Reports to Scale your Business Measure metrics for simpler and smarter project Get Privio and access our exclusive Center Sign up for free! 🍪 This website uses cookies to improve your web Privacy Policy Terms and Conditions Cookie Policy This website uses cookies to improve your web Accept ×   Product Tracker - Privio Skip links Skip to primary navigation Skip to content Home About Products Privio Tracker Concise reports tracking Privio HR Enhance HR Efficiencies Privio Center Effective project control Pricing Privio Tracker Plans to suit your needs Privio HR Select a Pricing Plan Privio Center Best productivity plans Career Contact Free Signup Privio Tracker Create your free account Privio HR Start with a trail account Privio Center Register for a free account Login Privio Tracker Login to Tracker account Privio HR Login to start using HR Privio Center Login to access the Center Request Demo scroll Toggle navigation Home About Products Privio Tracker Concise reports tracking Privio HR Enhance HR Efficiencies Privio Center Effective project control Pricing Privio Tracker Plans to suit your needs Privio HR Select a Pricing Plan Privio Center Best productivity plans Career Contact Privio Tracker We provide crucial reports and insights into your business Leaves Expenses Keep a Track of All Employees’ Related Data from One System Privio Tracker Leave feature reduces the time and effort organizations put into the It centralizes leaves and keeps the entire process transparent to enhance the overall productivity of an Try it now! Outline the Expected Income, Expenses, and Profits of your Projects Privio Tracker Expense tracking allows you to continuously monitor your budget throughout the It is essential to ensure that project costs do not spiral out of control – and potentially threaten project Try it now! Accurate Timecards and Employee Database Tracking for Better Transparency One of the core practices of maintaining a business is tracking attendance and Keep a record of your employee database with the Employee, Contractors, and Clients features, while the Timecard feature allows you to track work hours, overtime, and Web Clock Capture log hours in to record billable Timesheets Check on all submitted timesheets from one platform, for Track Employees Have complete control over your employee Contractors Have a detailed directory of your Clients Gain greater visibility on your active and inactive Track Contracts You can stay on top of your contract lifecycles and their budgeted Tracker Mobile App Capture Data for Accurate Employee Attendance Tracker Mobile’s Geo Tracking allows you to know the location of your employees every time they Clock in or Clock Out using Privio This app also lets your employees send leave requests for approval to the helps set your employee’s locat",startup,"{'status': '200', 'available': True, 'url': 'http://web.archive.org/web/20230411172145/https://privio.co/', 'timestamp': '20230411172145'}",20230411172145.0,1.0
https://www.refactortalent.com/,2177,crunchbase," home | Refactortalent top of page home about us contact us More Use tab to navigate through the menu Outcome obsessed people, finding you the best We are an elite talent agency obsessed with delivering the right talent to enable you to achieve your desired Using a mixture of science, persistence, and compassion - we deliver top talent, when you need Heading 1 refactor [ rēˈfaktər ] verb r estructure (the source code of an application or piece of software) so as to improve operation without altering All teams, even the best ones, need to be refactored and augmented at times to improve The team at Refactor Talent has over years of combined experience helping companies of all sizes, from all industries hire the best talent to grow, refine, and enhance their Let us help you do the Contact us to help with your next talent search about us Testimonials My first day went well The team is excited to have me join, and I m excited to join them! Thank you for believing in me, providing constant support, and being patient with me during my job It means a lot to I needed a change of pace after a disappointing , and my new role is an exciting change to say the - C++ Developer I cannot say enough great things about my experience working with As a previous agency recruiter and current corporate recruiter myself, I have high expectations about what the recruiting process should look feel like and boy did this team deliver tenfold! From my initial conversation with Jen, to my interview process with Kasey, I thoroughly enjoyed every step of this seamless and transparent ​ Although I didn t end up taking the opportunity, I can say without a doubt that Jen and her Refactor team are the ones I will be reaching out to when I m back in the Thank you all and keep up the fantastic Can t recommend this team enough! - Sales Recruiter Candidate CONTACT US Contact us over the phone, online, or send us a message here and someone from our team will reach Enter Your Name Enter Your Email Enter Your Phone Enter Your Message Submit Thanks for submitting! Someone from our team will reach out within hours if not the same business Contact © Refactor Talent, LLC bottom of page ",startup,"{'status': '200', 'available': True, 'url': 'http://web.archive.org/web/20230122105955/https://www.refactortalent.com/', 'timestamp': '20230122105955'}",20230122105955.0,1.0
https://altreports.com,14181,crunchbase,"Income from Mortgage Note Investing for Everyone #AltReports Subscribe Sign in Share this post Income from Mortgage Note Investing for Everyone Copy link Twitter Facebook Email Dec • Income from Mortgage Note Investing for Everyone Most mortgage note investments are restricted to accredited investors - Investments changes all hr ago 1 Share this post Income from Mortgage Note Investing for Everyone Copy link Twitter Facebook Email 1× 0:00 :16 Open in player Listen on ) Substack App Download MP3 Get a private RSS link for listening Subscribe to #AltReports Radio • Alternative Investments to get a private link for listening in your favorite podcast Learn about Subscribe Audio playback is not supported on your Please Appears in this episode Brecht Palombo Curated alternative investment ideas each week plus contrarian market news and analysis for independent investors Subscribe Episode details Comments Chris Seveney isn’t afraid of When he first found mortgage investing he jumped right in and began to lear by doing, by Now, with a track record of success, he wants to make an investment that has been out of reach for most available to Chris is the first fund manager I’ve spoken with to bring the alternative asset class of private mortgage notes to the I like investments in mortgage notes because 1) they offer regular monthly income 2) they are secured by real estate as collateral 3) people tend to pay their mortgage if at all possible 4) when a deal does go bad and a borrower stops paying whomever is the lowest in the capital stack has the safest This is not financial Share this post Income from Mortgage Note Investing for Everyone Copy link Twitter Facebook Email Top New Community No posts Ready for more? Subscribe © Independent Media LLC Privacy ∙ Terms ∙ Collection notice Publish on Substack Get the app Substack is the home for great writing Our use of cookies We use necessary cookies to make our site We also set performance and functionality cookies that help us make improvements by measuring traffic on our For more detailed information about the cookies we use, please see our privacy policy . ✖ This site requires JavaScript to run Please turn on JavaScript or unblock scripts   #AltReports Radio • Alternative Investments | Substack #AltReports Subscribe Sign in Home Podcast Sponsor Archive About Share this publication #AltReports Copy link Twitter Facebook Email #AltReports Curated alternative investment ideas each week plus contrarian market news and analysis for independent investors By Brecht Palombo · Over ,000 subscribers Subscribe No thanks By registering you agree to Substack s Terms of Service , our Privacy Policy , and our Information Collection Notice © Independent Media LLC Privacy ∙ Terms ∙ Collection notice Start Writing Get the app Substack is the home for great writing This site requires JavaScript to run Please turn on JavaScript or unblock scripts   About - #AltReports #AltReports Subscribe Sign in Home Podcast Sponsor Archive About The 40 Stocks and Bonds Portfolio Narrative Officially Died in Its not coming The world has changed and change is Start early and dollar cost average into the But what about when that fails like it did in … for Or what if you had a “life event” 💰 sold a business sold real estate got a divorce Or maybe you just worked hard and saved and you’re not up for losing it in rigged public markets built for insiders and the If, for whatever reason, you find yourself today with investible funds, a healthy distrust of traditional finance and you want to learn more about what the options really are and how the wealthy actually invest - then you’re in the right I’m doing the for You don’t have time to read all the market news and sit down with fund managers each Right? But… Did you know that % of UHNW (Ultra High Net Worth) individuals are invested in alternatives? Did you know that private equity, private investments , is the ONLY investment category that’s consistently outperformed the market? Why are retail investors continually shut out or unaware of the highest performing investment options? Why would you be fully exposed to wild volatility in the public markets when there are thousands of alternative options? Probably because you don’t know about I’m here to find out and to open those 1️⃣ That’s why I sit down with investors, GPs (General Partners), fund managers, founders and CEOs of alternative investment platforms and funds each 2️⃣ That’s why I report on the financial news that Jim Cramer, CNBC, and the roster of big media talking heads, the soundbiters, don’t talk 3️⃣ I’ll help you connect the dots, with data, observation, references and reason to better understand what’s happening, what might happen, and 🚫 I’m not your financial advisor or a money 🗺 I’m an explorer and I’ve got a mission, time, and money on my hands and I’ve got absolutely no Subscribe to get full access to the newsletter and website . Never miss an Stay You won’t have to worry about missing Every",startup,"{'status': '200', 'available': True, 'url': 'http://web.archive.org/web/20230110185124/https://www.altreports.com/', 'timestamp': '20230110185124'}",20230110185124.0,1.0
