DaOptimus,https://www.crunchbase.com/organization/daoptimus,2019-01-01,year,,"Los Angeles, California, United States",We will make it happen!,"2,382,931",,Active,,,,,For Profit,https://daoptimus.com,,https://www.linkedin.com/company/daoptimus,"As a unique IT service provider in the industry, we look to engage with our clients beyond the conventional design and development agency relationship, becoming a partner to the people and companies we work with.",,"Greater Los Angeles Area, West Coast, Western US",,,,,,,,,,,,,,,,,,,,11-50,,,,,,,,,,,,,,,,,,,,,,,,,,,Private,,,,,,,,,,,,,,,11,,,,,,,,,,
TaxTC,https://www.crunchbase.com/organization/taxtc,2019-01-01,year,"Accounting, Financial Services, Software","Washington, District of Columbia, United States",TaxTC is a software development company that specializes in tax preparation and payroll software and data transmission.,"2,382,905",Less than $1M,Active,,,,,For Profit,https://www.taxtc.com,https://twitter.com/taxtcirs,https://www.linkedin.com/company/taxtc/,,https://www.facebook.com/taxtc2irs,"Washington DC Metro Area, Southern US",,,,,,,,,,,,,,,,,"Financial Services, Professional Services, Software",,,11-50,,,,,,,,,,,,,,,,,,,,,,,,,,,Private,,,,,,,,,,,,,,,14,,,,,,,,,,
Natural Light Solar,https://www.crunchbase.com/organization/natural-light-solar,2021-01-01,year,"Energy, Renewable Energy, Solar","Hot Springs Village, Arkansas, United States",Natural Light Solar provides residential and commercial solar panel installation services.,"2,382,897",,Active,,,,,For Profit,https://naturallightsolar.net,,https://www.linkedin.com/company/natural-light-solar/,"Natural Light Solar offers solar panel installations, roofing, battery storage, LED lighting, advanced security systems, upgraded EV chargers, flooring, and window siding. Their sustainable energy solutions include analysis, engineering, operation, and maintenance.",https://www.facebook.com/NaturalLightSolarr,Southern US,,,,,,,,,,,,,,,,,"Energy, Natural Resources, Sustainability",1,Skylar Keller,11-50,,,,,,,,,,,,,,,,,,,,,,,,,,,Private,,,,,,,,,,,,,,,3,,,,,,,,,,
Blue Peak Exterior Cleaning,https://www.crunchbase.com/organization/blue-peak-exterior-cleaning,2022-01-01,year,"Commercial, Facilities Support Services, Janitorial Service","Brighton, Colorado, United States",Blue Peak Exterior Cleaning provides commercial exterior building and concrete cleaning services.,"2,382,845",,Active,,,,,For Profit,https://www.bluepeakexteriorcleaning.com,,https://www.linkedin.com/company/blue-peak-exterior-cleaning,"Blue Peak Exterior Cleaning provides exterior building cleaning, exterior concrete cleaning, dumpster pads, graffiti removal, wood, deck, and fence cleaning, house washing, concrete and paver cleaning, fence and deck cleaning, and roof cleaning services. Their customers contact them through address, phone, mail, and online applications.",https://www.facebook.com/bluepeakec,"Greater Denver Area, Western US",,,,,,,,,,,,,,,,,"Administrative Services, Other, Real Estate",1,Cody Fisher,1-10,,,,,,,,,,,,,,,,,,,,,,,,,,,Private,,,,,,,,,,,,,,,1,,,,,,,,,,
PellePay,https://www.crunchbase.com/organization/pellepay,2020-01-01,year,"Financial Services, Mobile Payments, Payments","San Mateo, California, United States","PellePay is a digital wallet that allows users to send and receive money, as well as borrow and lend money.","2,382,822",,Active,,,,,For Profit,https://pellepay.com,https://twitter.com/pellepay,https://www.linkedin.com/company/pellepay,,https://www.facebook.com/pellepayusa,"San Francisco Bay Area, Silicon Valley, West Coast",,,,,,,,,,,,,,,,,"Financial Services, Mobile, Payments, Software",,,1-10,,,,,,,,,,,,,,,,,,,,,,,,,,,Private,,,,,,,,,,,,,,,,,,,,,,,,,
Maple Branch Craft Brewery,https://www.crunchbase.com/organization/maple-branch-craft-brewery,2020-01-01,year,"Craft Beer, Food and Beverage, Reservations","Fort Worth, Texas, United States","Maple Branch Craft Brewery is a craft brewery and biergarten that offers food, wine, and non-alcoholic beverages.","2,382,794",$1M to $10M,Active,,,,,For Profit,https://www.maplebranchbrew.com,,https://www.linkedin.com/company/maple-branch-craft-brewery,"Maple Branch Craft Brewery sells craft beer, food, wine, and non-alcoholic beverages. They reserve a couple tables, a section, or the entire brewery for parties. Their mug club members receive a personal 20-ounce mug, which is cleaned and stored at the brewery.",https://www.facebook.com/maplebranchbrew,"Dallas/Fort Worth Metroplex, Southern US",,,,,,,,,,,,,,,,,"Events, Food and Beverage, Media and Entertainment",1,Allyssa (O’Brien) Maples,11-50,,,,,,,,,,,,,,,,,,,,,,,,,,,Private,,,,,,,,,,,,,,,3,,,,,,,,,,
la vie après l'amour,https://www.crunchbase.com/organization/la-vie-après-l-amour,2020-01-01,year,"Apparel, E-Commerce, Fashion, Retail","Red Hook, New York, United States",la vie après l'amour is an eCommerce site that sells women’s apparel.,"2,382,739",,Active,,,,,For Profit,https://apreslamour.com,,https://www.linkedin.com/company/la-vie-apr%C3%A8s-l-amour,,https://www.facebook.com/la.vie.apres.lamour,"Greater New York Area, East Coast, Northeastern US",,,,,,,,,,,,,,,,,"Clothing and Apparel, Commerce and Shopping, Design",,,1-10,,,,,,,,,,,,,,,,,,,,,,,,,,,Private,,,,,,,,,,,,,,,2,,,,,,,,,,
Researchers For Change,https://www.crunchbase.com/organization/researchers-for-change,2020-01-01,year,"Communities, Medical, Non Profit","Lubbock, Texas, United States",Researchers For Change is a non-profit organization that creates a network of students to spread awareness through research.,"2,382,721",,Active,,,,,Non-profit,https://www.researchersforchange.org,https://twitter.com/rfc_change,https://www.linkedin.com/company/researchers-for-change,,https://www.facebook.com/researchersforchange,Southern US,,,,,,,,,,,,,,,,,"Community and Lifestyle, Health Care, Other, Social Impact",,,101-250,,,,,,,,,,,,,,,,,,,,,,,,,,,Private,,,,,,,,,,,,,,,5,,,,,,,,,,
Alcatraz Ventures,https://www.crunchbase.com/organization/alcatraz-ventures,2021-05-18,day,"Asset Management, Finance, Small and Medium Businesses","Miami, Florida, United States",Alcatraz Ventures is a private asset holding corporation specialising in the security sector.,"2,382,671",Less than $1M,Active,,,,,For Profit,https://alcatrazventures.com/index.html,,https://www.linkedin.com/company/alcatraz-ventures,,,"Greater Miami Area, East Coast, Southern US",,,,,,,,,,,,,,,,,"Financial Services, Other",,,1-10,,,,,,,,,,,,,,,,,,,,,,,,,,,Private,,,,,,,,,,,,,,,5,,,,,,,,,,
WFH IT Services,https://www.crunchbase.com/organization/wfh-it-services,2020-01-01,year,"Consulting, IT Management, Software, Technical Support","Sherman Oaks, California, United States","WFH IT Services provide IT solution, work from home setup, repair and data recovery services.","2,382,635",,Active,,,,,For Profit,https://www.wfhitservices.com,https://twitter.com/wfhitservices,https://www.linkedin.com/company/wfhitservices,"WFH IT Services provides IT support and repair services. They provide work from home setup, printers and networking, smart home support, repair and data recovery, support and consulting, managed IT solutions, virtual CIO services for individuals, work from home, or businesses large and small. They address inquiries through phone, and email.",https://www.facebook.com/WFHITServ,"Greater Los Angeles Area, West Coast, Western US",,,,,,,,,,,,,,,,,"Information Technology, Other, Professional Services, Software",,,1-10,,,,,,,,,,,,,,,,,,,,,,,,,,,Private,,,,,,,,,,,,,,,2,,,,,,,,,,
Honey Badger Fabrication,https://www.crunchbase.com/organization/honey-badger-fabrication,2022-01-01,year,"Machinery Manufacturing, Retail, Textiles","Gardena, California, United States","Honey Badger Fabrication is a fabrication shop that connects ideas, design, and technology.","2,382,621",,Active,,,,,For Profit,https://honeybadgerfabrication.com,,https://www.linkedin.com/company/honeybadgerfabrication,,,"Greater Los Angeles Area, West Coast, Western US",,,,,,,,,,,,,,,,,"Commerce and Shopping, Manufacturing",,,11-50,,,,,,,,,,,,,,,,,,,,,,,,,,,Private,,,,,,,,,,,,,,,3,,,,,,,,,,
BPA,https://www.crunchbase.com/organization/bpa-132d,2018-01-01,year,"Advertising, Financial Services, Legal","Troy, Michigan, United States","BPA provides brand creation, crisis management, personal issue consulting, tax preparation, and international placement services.","2,382,618",$1M to $10M,Active,,,,,For Profit,https://ballplayersagency.com ,https://twitter.com/BPA_Agency,https://www.linkedin.com/company/ballplayerstrust ,,,"Greater Detroit Area, Great Lakes, Midwestern US",,,,,,,,,,,,,,,,,"Advertising, Financial Services, Professional Services, Sales and Marketing",,,11-50,,,,,,,,,,,,,,,,,,,,,,,,,,,Private,,,,,,,,,,,,,,,,,,,,,,,,,
Colossal Systems,https://www.crunchbase.com/organization/colossal-systems,2019-01-01,year,"Consulting, Information Technology, Recruiting, Staffing Agency","Sammamish, Washington, United States",Colossal Systems is an IT staff augmentation and software development company.,"2,382,560",$1M to $10M,Active,,,,,For Profit,https://www.colossalsystems.com,,https://www.linkedin.com/company/colossal-systems-inc,"Colossal Systems is an IT consulting company. They provide consulting and technical service support to various clients. They provide services on strategic initiatives and optimal technology solutions. They offer interim and permanent recruitment for managed services and consulting. Their services include contract staffing, the right to hire for short-term and long-term projects, and permanent hire within a justified period.",,"Greater Seattle Area, West Coast, Western US",,,,,,,,,,,,,,,,,"Administrative Services, Information Technology, Professional Services",,,11-50,,,,,,,,,,,,,,,,,,,,,,,,,,,Private,,,,,,,,,,,,,,,24,,,,,,,,,,
Cadre Industries,https://www.crunchbase.com/organization/cadre-industries,2021-01-01,year,"E-Commerce, Industrial, Telecommunications","Montgomeryville, Pennsylvania, United States",Cadre Industries is an online and retail supplier of wireless infrastructure products.,"2,382,556",,Active,,,,,For Profit,https://www.cadreindustries.com,,https://www.linkedin.com/company/cadre-industries,,,"Greater Philadelphia Area, Great Lakes, Northeastern US",,,,,,,,,,,,,,,,,"Commerce and Shopping, Hardware, Manufacturing",,,11-50,,,,,,,,,,,,,,,,,,,,,,,,,,,Private,,,,,,,,,,,,,,,1,,,,,,,,,,
FBRK Impact House,https://www.crunchbase.com/organization/fbrk-impact-house,2020-01-01,year,,"Chicago, Illinois, United States",FBRK Impact House is a philanthropic working hub designed to gather foundations.,"2,382,434",,Active,,,,,,https://www.thefbrk.com/,,https://www.linkedin.com/company/fbrk-impact-house/,FBRK Impact House is a philanthropic working hub designed to gather foundations.,,"Greater Chicago Area, Great Lakes, Midwestern US",,,,,,,,,,,,,,,,,,1,Israel Idonije,,,,,,,,,,,,,,,,,,,,,,,,,,,,Private,,,,,,,,,,,,,,,18,,,,,,,,,,
Arroyo Plastic Surgery at West Houston,https://www.crunchbase.com/organization/arroyo-plastic-surgery-at-west-houston,2020-01-01,year,Health Care,"Houston, Texas, United States",Houston plastic surgery,"2,382,303",,Active,,,,,For Profit,https://www.arroyoplasticsurgeryhouston.com,,,"Arroyo Plastic Surgery at West Houston was founded by Dr. Christian Arroyo. Dr. Arroyo practices plastic, reconstructive and cosmetic surgery of the breast, face, and body. The office offers a wide range of procedures to help the men and women of Houston, Katy, the Woodlands, Sugar Land, West Houston, River Oaks, Memorial City, Bellaire, Pearland, Spring, Kingwood, Jacinto City, Galena Park, Pasadena, Cloverleaf, Aldine, Willowbrook Texas look and feel their best with procedures such as breast augmentation, breast lift, breast reduction, breast revision, breast reconstruction, asymmetry correction, implant capsule removal, en bloc capsulectomy, gynecomastia, mommy makeover, tummy tuck, Brazilian butt lift, BBL, labiaplasty, body lift, arm lift, liposuction (lipo), thigh lift, hair restoration, and no mesh hernia repair. Houston Plastic Surgeon - Dr. Christian Arroyo also provides excellent results for facial plastic surgery as well, such as neck lift, facelift (rhytidectomy), Eyelid surgery (blepharoplasty), or eye bag surgery for hooded eyelids, rhinoplasty, fat grafting, ear shaping (otoplasty surgery), cheek augmentation, Botox, Fillers, and Non-surgical nose job.",https://www.facebook.com/Arroyo-Plastic-Surgery-at-West-Houston-100163765103623,"Greater Houston Area, Southern US",,,,,,,,,,,,,,,,,Health Care,1,Christian Arroyo,1-10,,,,,,,,,,,,,,,,,,,,,,,,,,,Private,,,,,,,,,,,,,,,39,,,,,,,,,,
Community Health Care,https://www.crunchbase.com/organization/community-health-care-8bcb,2019-01-01,year,"Health Care, Medical Device, Transportation","Brunswick, Tennessee, United States",Community Health Care offers emergency and non-emergency ambulance services and non- medical transport services.,"2,382,292",,Active,,,,,For Profit,https://www.chc901.com,https://twitter.com/chc901,https://www.linkedin.com/company/chc901llc-community-health-care/,,https://www.facebook.com/CHC901/,Southern US,,,,,,,,,,,,,,,,,"Health Care, Transportation",1,Michael Nolen,251-500,,,,,,,,,,,,,,,,,,,,,,,,,,,Private,,,,,,,,,,,,,,,1,,,,,,,,,,
Stevenson Law Office,https://www.crunchbase.com/organization/stevenson-law-office,2019-01-01,year,"Advice, Law Enforcement, Legal, Professional Services","Sherman Oaks, California, United States","Stevenson Law Office provides legal services for estate administration, litigation, individual beneficiaries, heirs, and executors matters.","2,382,265",Less than $1M,Active,,,,,For Profit,https://stevensonlawoffice.com/,https://twitter.com/StevensonLaw1,https://www.linkedin.com/company/stevenson-law-office-sherman-oaks/,,https://www.facebook.com/stevensonlawoffice/,"Greater Los Angeles Area, West Coast, Western US",,,,,,,,,,,,,,,,,"Government and Military, Media and Entertainment, Other, Privacy and Security, Professional Services",,,1-10,,,,,,,,,,,,,,,,,,,,,,,,,,,Private,,,,,,,,,,,,,,,27,,,,,,,,,,
Jaiyou,https://www.crunchbase.com/organization/jaiyou,2019-01-01,year,"Health Care, Medical Device, Wellness","New York, New York, United States","Jaiyou is a medical device company that emerge to design, develop, and manufacture medical products.","2,382,225",,Active,,,,,For Profit,https://www.jaiyou.com,https://twitter.com/jaiyou_us,https://www.linkedin.com/company/jaiyou-us,"Jaiyou is a medical device company that emerge to design, develop, and manufacture medical products. Jaiyou provides body braces and body supports that are approved by medical doctors and healthcare professionals. Jaiyou was founded in 2019 and was headquartered in New York, United States.",https://www.facebook.com/Jaiyou.US,"Greater New York Area, East Coast, Northeastern US",,,,,,,,,,,,,,,,,Health Care,,,1-10,1,,2019-07-29,,,,Non-equity Assistance,,,,,,,,,USD,,VentureOut,,1,,,,,,,Private,,,,,,,,,,,,,,,5,,,,,,,,,,
Camber Systems,https://www.crunchbase.com/organization/camber-systems,2018-01-01,year,,"Washington, District of Columbia, United States","Empowering federal, state, and local governments with the power of commercial data and technology to solve their hardest problems.","2,382,197",,Active,,,,,For Profit,https://cambersystems.com/,,https://www.linkedin.com/company/camber-systems,,,"Washington DC Metro Area, Southern US",,,,,,,,,,,,,,,,,,,,,,,,,,,,,,,,,,,,,,,,,,,,,,,Private,,,,,,,,,,,,,,,4,,,,,,,,,,
Delicious Digital Marketing,https://www.crunchbase.com/organization/delicious-digital-marketing,2020-01-01,year,"Advertising, Digital Marketing, Graphic Design, Video, Web Design","Austin, Texas, United States","Delicious Digital Marketing is a digital marketing agency that provides tourism, lifestyle, and leisure marketing.","2,382,122",,Active,,,,,For Profit,https://www.deliciousdigitalmarketing.com/,,https://www.linkedin.com/company/delicious-digital-marketing,"Delicious Digital Marketing is a group of digital strategists with taste and industry in digital and traditional marketing. They partner with clients to either supplement their in-house marketing department or serve as their service outsourced marketing department. Their female-founded marketing agency develops exceptional branding, memorable content, compelling storytelling, conversion, and transformative.",https://www.facebook.com/deliciousdigitalmktg,Southern US,,,,,,,,,,,,,,,,,"Advertising, Design, Media and Entertainment, Sales and Marketing, Video",,,11-50,,,,,,,,,,,,,,,,,,,,,,,,,,,Private,,,,,,,,,,,,,,,8,,,,,,,,,,
Point 'N Save,https://www.crunchbase.com/organization/point-n-save,2018-01-01,year,"Business Development, Mobile Apps, Software","Tustin, California, United States",Point 'N Save is a software firm that helps nonprofit firms and chambers by creating mobile apps for connecting with the next generations.,"2,382,114",$1M to $10M,Active,,,,,For Profit,https://www.pointnsave.com,,https://www.linkedin.com/company/point-n-save/,,https://www.facebook.com/pointnsave/,"Greater Los Angeles Area, West Coast, Western US",,,,,,,,,,,,,,,,,"Apps, Mobile, Professional Services, Software",1,John Barton,1-10,,,,,,,,,,,,,,,,,,,,,,,,,,,Private,,,,,,,,,,,,,,,4,,,,,,,,,,
GSD Factor,https://www.crunchbase.com/organization/gsd-factor,2022-01-01,year,"Audio, Personal Development, Podcast, Training","Nashville, Tennessee, United States","GSD Factor is a podcast media that offers workshops, live speaking, and corporate coaching services for personal empowerment.","2,382,082",,Active,,,,,For Profit,https://www.gsdfactor.com,,https://www.linkedin.com/company/gsdfactor,"GSD Factor is a platform that focuses on personal and professional empowerment. It offers a variety of products and services, including a podcast, training programs, and personal development resources. The company also sells merchandise such as stickers, greeting cards, and mouse pads. The founder, Misha Bleymaier-Farrish, is an author and entrepreneur who shares her life motto of 'Get sh*t done' through her podcast and coaching sessions. The GSD Factor blog is a resource for those seeking to ignite their confidence and empowerment.",,Southern US,,,,,,,,,,,,,,,,,"Education, Media and Entertainment, Music and Audio",1,Misha Bleymaier-Farrish,1-10,,,,,,,,,,,,,,,,,,,,,,,,,,,Private,,,,,,,,,,,,,,,5,,,,,,,,,,
Simple Life Product,https://www.crunchbase.com/organization/simple-life-product,2020-01-01,year,"Medical, SaaS, Software","Wilmington, Delaware, United States",Simple Life Products is a community-based company that creates sustainable solutions for medical industries.,"2,382,059",,Active,,,,,For Profit,https://asimplelifeproduct.com,,https://www.linkedin.com/company/simplelifeproducts,,https://www.facebook.com/simplelifeproducts,"Greater Philadelphia Area, East Coast, Southern US",,,,,,,,,,,,,,,,,"Health Care, Software",,,11-50,,,,,,,,,,,,,,,,,,,,,,,,,,,Private,,,,,,,,,,,,,,,2,,,11,,,,,,,
Cupboard,https://www.crunchbase.com/organization/cupboard,2020-01-01,year,"Product Design, Product Management","Charleston, South Carolina, United States",Cupboard uses data to develop and build products that customers want.,"2,381,892",,Active,,,,,For Profit,https://www.shopcupboard.com/,,https://www.linkedin.com/company/shopcupboard,"Cupboard uses data to develop and build products that customers want. The company was founded in 2020 and is based in Charleston, South Carolina.",,"East Coast, Southern US",,,,,,,,,,,,,,,,,"Design, Other",1,Elizabeth Kane,,,,,,,,,,,,,,,,,,,,,,,,,,,,Private,,,,,,,,,,,,,,,,,,,,,,,,,
Area87,https://www.crunchbase.com/organization/area87,2019-01-01,year,"Creative Agency, Product Design, Software","Ann Arbor, Michigan, United States",Area87 specializes in simplifying complex software and creating digital products.,"2,381,807",,Active,,,,,For Profit,https://area87.io,https://twitter.com/area87_io,https://www.linkedin.com/company/area87,,,"Great Lakes, Midwestern US",,,,,,,,,,,,,,,,,"Content and Publishing, Design, Media and Entertainment, Software",,,11-50,,,,,,,,,,,,,,,,,,,,,,,,,,,Private,,,,,,,,,,,,,,,2,,,,,,,,,,
Novabasis LLC,https://www.crunchbase.com/organization/novabasis-llc,2022-08-10,day,"App Marketing, Desktop Apps, Digital Marketing, Mobile Apps, Web Design, Web Development","Albuquerque, New Mexico, United States","A recognized American digital marketing company, specializing in creating online marketing solutions","2,381,710",,Active,,,,,For Profit,https://novabasis.com,,,"We are a recognized digital marketing company, specializing in creating online marketing solutions. We have helped hundreds of businesses across the USA grow their brand presence and expand their network reach through innovative digital marketing campaigns.",,Western US,,,,,,,,,,,,,,,,,"Apps, Design, Mobile, Other, Sales and Marketing, Software",,,1-10,,,,,,,,,,,,,,,,,,,,,,,,,,,Private,,,,,,,,,,,,,,,2,,,,,,,,,,
MSC Re,https://www.crunchbase.com/organization/msc-re,2018-01-01,year,"Finance, Financial Services, Insurance","Miami, Florida, United States",MSC Re is a reinsurance broker specializing in effective and innovative risk placement for its clients.,"2,381,667",$1M to $10M,Active,,,,,For Profit,https://msc-re.com,,https://www.linkedin.com/company/msc-re,,,"Greater Miami Area, East Coast, Southern US",,,,,,,,,,,,,,,,,Financial Services,1,Alejandro Pedroza,1-10,,,,,,,,,,,,,,,,,,,,,,,,,,,Private,,,,,,,,,,,,,,,,,,,,,,,,,
Dues,https://www.crunchbase.com/organization/dues,2022-01-01,month,"Consulting, Debt Collections, Financial Services","Los Angeles, California, United States",Dues is a debt collections company that provides credit recovery and people management solutions for the cannabis industries.,"2,381,646",,Active,,,,,For Profit,https://dues.pro,https://twitter.com/dues_pro,https://www.linkedin.com/company/duespro/,,https://www.facebook.com/dues.pro,"Greater Los Angeles Area, West Coast, Western US",,,,,,,,,,,,,,,,,"Administrative Services, Financial Services, Professional Services",,,1-10,,,,,,,,,,,,,,,,,,,,,,,,,,,Private,,,,,,,,,,,,,,,1,,,,,,,,,,
Sym Entertainment,https://www.crunchbase.com/organization/sym-entertainment,2021-01-01,year,"Marketing, Media and Entertainment, Sports","Miami, Florida, United States",Sym Entertainment is a sports and entertainment marketing agency.,"2,381,627",,Active,,,,,For Profit,https://sym-ent.com,,https://www.linkedin.com/company/sym-entertainment/,"Sym Entertainment is a marketing firm specializing in sports and entertainment. They capitalize and monetize with an emphasis on e-commerce. They provide economic return, amazon alliance, new markets, and brand development services.",,"Greater Miami Area, East Coast, Southern US",,,,,,,,,,,,,,,,,"Media and Entertainment, Sales and Marketing, Sports",,,,,,,,,,,,,,,,,,,,,,,,,,,,,,Private,,,,,,,,,,,,,,,3,,,,,,,,,,
OLEA conseil TPE,https://www.crunchbase.com/organization/olea-conseil-tpe,2018-01-01,year,"Business Development, Consulting, Professional Services","France, Idaho, United States","OLEA conseil TPE offers business development, management, steering, consulting, solutions and services.","2,381,446",,Active,,,,,For Profit,https://www.oleaconseiltpe.fr/,,https://www.linkedin.com/company/olea-conseil-tpe/,,https://www.facebook.com/Lefebure.Tanguy/,Western US,,,,,,,,,,,,,,,,,"Other, Professional Services",,,1-10,,,,,,,,,,,,,,,,,,,,,,,,,,,Private,,,,,,,,,,,,,,,2,,,,,,,,,,
Reclaim Coalition,https://www.crunchbase.com/organization/reclaim-coalition,2020-01-01,year,"Communities, Non Profit, Social","Sylvania, Ohio, United States",Reclaim Coalition is an organization empowering people of color to live in their communities by dismantling oppressive systems.,"2,381,357",,Active,,,,,Non-profit,https://www.reclaimcoalition.com,,https://www.linkedin.com/company/reclaim-coalition,,,"Great Lakes, Midwestern US",,,,,,,,,,,,,,,,,"Community and Lifestyle, Other, Social Impact",,,11-50,,,,,,,,,,,,,,,,,,,,,,,,,,,Private,,,,,,,,,,,,,,,3,,,,,,,,,,
MindMatch,https://www.crunchbase.com/organization/mindmatch-8f89,2020-01-01,year,EdTech,"Houston, Texas, United States",MindMatch is a teaching and learning platform that matches teachers with students to provide tutoring sessions online.,"2,381,330",,Active,,,,,For Profit,http://www.mindmatch.com,,https://www.linkedin.com/company/mindmatchedu/about/,,https://www.facebook.com/mindmatchedu/,"Greater Houston Area, Southern US",,,,,,,,,,,,,,,,,"Education, Software",,,,,,,,,,,,,,,,,,,,,,,,,,,,,,Private,,,,,,,,,,,,,,14.3%,7,,,,,,,,,,
Northfield Development,https://www.crunchbase.com/organization/northfield-development,2018-01-01,year,"Consulting, Project Management, Real Estate","Dallas, Texas, United States","Northfield Development provides financial, consulting, investment, real estate, and project management services.","2,381,316",$1M to $10M,Active,,,,,For Profit,https://northfielddevelopment.com/,,,,https://www.facebook.com/NorthfieldDevelopment/,"Dallas/Fort Worth Metroplex, Southern US",,,,,,,,,,,,,,,,,"Administrative Services, Other, Professional Services, Real Estate",,,1-10,,,,,,,,,,,,,,,,,,,,,,,,,,,Private,,,,,,,,,,,,,,,8,,,,,,,,,,
ChainHome,https://www.crunchbase.com/organization/tourmato,2019-10-01,month,"Computer Vision, Software, Virtual Reality","Santa Clara, California, United States",DIY home buying as TurboTax did for tax filing,"2,381,295",,Active,,,,,For Profit,https://www.chainhome.us,,https://www.linkedin.com/company/chainhome,ChainHome is a software that lets families buy homes do-it-yourself. ChainHome is to Home Buying as TurboTax is to Tax Filing.,,"San Francisco Bay Area, Silicon Valley, West Coast",,,,,,,,,,,,,,,,,"Hardware, Software",2,"Luke Lu, Lynna Lin",1-10,,,,,,,,,,,,,,,,,,,,,,,,,,,Private,,,,,,,,,,,,,3,,15,,,,,,,,,,
