LogisticsFlow,https://www.crunchbase.com/organization/logisticsflow,2021-01-01,year,"Enterprise Resource Planning (ERP), Software, Software Engineering","Denver, Colorado, United States",LogisticsFlow is a software company.,"350,939",,Active,,,,,For Profit,https://logisticsflow.com,,https://www.linkedin.com/company/logisticsflow,LogisticsFlow offers an enterprise resource planning solution with integrated eCommerce for electronic component distribution companies providing an integrated solution with streamlined logistics. Designed from the ground up to support the unique requirements of distributors.,,"Greater Denver Area, Western US",,,,,,,,,,,,,,,,,"Science and Engineering, Software",,,11-50,,,,,,,,,,,,,,,,,,,,,,,,,,,Private,,,,,,,,,,,,,,,33,,,,,,,,,,
LJG Sales and Marketing,https://www.crunchbase.com/organization/ljg-sales-and-marketing,2022-01-01,year,,"Atlanta, Georgia, United States",LJG Sales and Marketing is a marketing & sales firm based in Atlanta. We focus on our team and client's growth!,"350,965",,Active,,,,,For Profit,https://www.ljgsalesandmarketing.com,https://twitter.com/LJGSalesandmktg,https://www.linkedin.com/company/ljg-sales-and-marketing/,"LJG Sales and Marketing is a privately owned and operated retail sales firm in Atlanta, GA. Notably, our distinguished portfolio includes a Fortune 100 company, reflecting our growth and expansion trajectory that extends to asserting our presence throughout Georgia. In a time saturated with media clutter and screens, LJG Sales and Marketing is committed to crafting a distinctive customer experience. Our unique business model revolves around establishing personal one-on-one connections with each of our client's customers, underpinned by a firm belief in relationship-building marketing, setting us apart from the competition. If you've arrived at our Crunchbase page and are interested in a new career or have a passion for marketing and sales, you're in luck! We are hiring for entry-level sales positions and seeking fresh talent to join our dynamic team. To explore current job opportunities, email us at contact@ljgsalesandmarketing.com!",https://facebook.com/ljgsalesandmarketing,"Greater Atlanta Area, East Coast, Southern US",,,,,,,,,,,,,,,,,,1,Jamie Glore,11-50,,,,,,,,,,,,,,,,,,,,,,,,,,,Private,,,,,,,,,,,,,,,,,,,,,,,,,
Scholarus,https://www.crunchbase.com/organization/scholarus,2022-01-01,year,"EdTech, Education","Livonia, Michigan, United States",Scholarus Learning is a portfolio of companies serving the K-12 and Higher Education markets.,"350,998",,Active,,,,,For Profit,https://www.scholarus.com,,,"Scholarus provides educators with an industry-leading range of products and services like edinstructional design and implementation, organizational strategy, leadership strategy, data collection and surveys, and curriculum customization and publishing.",,"Greater Detroit Area, Great Lakes, Midwestern US",,,,,,,,,,,,,,,,,"Education, Software",,,,,,,,,,,,,,,,,,,,,,,,1,Made Acquisitions,,,,,Private,,,,,,,,,,,,,,,1,,,,,,,,,,
Thumbscore,https://www.crunchbase.com/organization/thumbscore,2018-01-01,year,"Artificial Intelligence (AI), Financial Services, Mobile Apps","Wichita, Kansas, United States",Thumbscore is an artificial intelligence-driven financial ecosystem that offers finance through an application.,"351,003",,Active,,,,,For Profit,https://www.thumbscore.app,,https://www.linkedin.com/company/thumbscore,,,Midwestern US,,,,,,,,,,,,,,,,,"Apps, Artificial Intelligence (AI), Data and Analytics, Financial Services, Mobile, Science and Engineering, Software",,,1-10,,,,,,,,,,,,,,,,,,,,,,,,,,,Private,,,,,,,,,,,,,,,9,,,,,,,,,,
PlayKey,https://www.crunchbase.com/organization/noisecreep,2021-03-01,day,"News, Publishing, Video","Purchase, New York, United States",Playkey’s powerful servers run modern games with advanced graphics. The app streams video,"351,018",,Active,,,,,For Profit,http://playkey.net/,,https://www.linkedin.com/in/carlos-santos-375193240/,Playkey’s powerful servers run modern games with advanced graphics. The app streams video,,"Greater New York Area, East Coast, Northeastern US",,,,,,,,,,,,,,,,,"Content and Publishing, Media and Entertainment, Video",,,1-10,,,,,,,,,,,,,,,,,,,,,,,,,,,Private,,,,,,,,,,,,,,-37.7%,41,,,,,,,,,,
Better Blend,https://www.crunchbase.com/organization/better-blend,2018-03-01,month,"E-Commerce, Nutrition, Restaurants","Florence, Kentucky, United States","Better Blend Nutrition believes in making people happier and healthier by providing nutrient-rich smoothies, removing unnecessary sugars.","351,024",,Active,,,,,For Profit,https://www.betterblend.com,https://twitter.com/betterblend_,https://www.linkedin.com/company/better-blend,"Better Blend Nutrition believes in making people happier and healthier by providing nutrient-rich smoothies, removing unnecessary sugars, and creating products that benefit your nutrition and tastebuds. Its one-of-a-kind combination of elegantly simple products enables communities to get more out of life.",https://www.facebook.com/betterblendofficial,Southern US,,,,,,,,,,,,,,,,,"Commerce and Shopping, Food and Beverage, Health Care",1,Isaac Hamlin,11-50,1,,2023-03-21,,,,Grant,,,,,,,,,USD,,Main Street Ventures,1,1,,,,,,,Private,,,,,,,,,,,,,,,4,,,,,,,,,,
Front Burner Society,https://www.crunchbase.com/organization/front-burner-society,2020-01-01,year,"Leisure, Restaurants","Dallas, Texas, United States",Front Burner Society is a privately held company that innovates restaurant concepts in the Southwest area.,"351,033",,Active,,,,,For Profit,https://www.fb-society.com,,https://www.linkedin.com/company/frontburnersociety,"Front Burner Society is a privately held company that innovates restaurant concepts in the Southwest area. It was founded in 2020 and its headquarters is located in Dallas, Texas.",,"Dallas/Fort Worth Metroplex, Southern US",,,,,,,,,,,,,,,,,"Community and Lifestyle, Food and Beverage",0,,1001-5000,,,,,,,,,,,,,,,,,,,,,,,,,,,Private,,,,,,,,,,,,,,,3,,,,,,,,,,
Skylab Media,https://www.crunchbase.com/organization/skylab-media,2018-01-01,year,"Advertising, Creative Agency, Email Marketing, Web3","West Hollywood, California, United States","Skylab Media is an advertising agency that manages lifecycle marketing, paid social, and creative editing services.","351,037",,Active,,,,,For Profit,https://www.skylabx.com,https://twitter.com/skylabxagency,https://www.linkedin.com/company/skylab-x,"Skylab Media is an advertising agency that provides affiliate marketing, cryptocurrency, custom, email marketing, NFT marketing, paid search, paid social, podcast marketing, skylab studios+, SMS marketing, spotify ads, and strategy. They also provide creative advertising agency, influencer marketing agency, lifecycle marketing agency, paid advertising agency, and web3 advertising agency services.",https://www.facebook.com/skylabxagency,"Greater Los Angeles Area, West Coast, Western US",,,,,,,,,,,,,,,,,"Advertising, Blockchain and Cryptocurrency, Content and Publishing, Internet Services, Media and Entertainment, Sales and Marketing",1,Casey Roeder,11-50,,,,,,,,,,,,,,,,,,,,,,,,,,,Private,,,,,,,,,,,,,,,15,,,,,,,,,,
Indigo Industries,https://www.crunchbase.com/organization/indigo-industries-78de,2023-05-01,day,"Management Consulting, Marketing, Sales","Philadelphia, Pennsylvania, United States",We provide opportunities for generational wealth.,"351,080",,Active,,,,,For Profit,https://indigoindustriesinc.com/,https://twitter.com/IndigoInPhilly,https://www.linkedin.com/company/indigoindustriesphilly/,"Our company can be described in five words: community, truth, love, freedom, and growth. We are committed to fostering a culture of transparency, growth, and community, where individuals can feel supported and empowered to reach their full potential. Our purpose at Indigo Industries Inc. is to break the stigma of corporate America by offering merit-based positions and empowering individuals to be free from the system. We want to help people achieve their dreams and create a more fulfilling and prosperous future for themselves and their families",https://www.facebook.com/indigoindustriesphilly,"Greater Philadelphia Area, Great Lakes, Northeastern US",,,,,,,,,,,,,,,,,"Professional Services, Sales and Marketing",,,1-10,,,,,,,,,,,,,,,,,,,,,,,,,,,Private,,,,,,,,,,,,,,,,,,,,,,,,,
Banter,https://www.crunchbase.com/organization/banter-6088,2022-01-01,year,"E-Commerce, Internet, Shopping, Software","New York, New York, United States",Banter is an e-commerce platform that enables multiplayer shopping and social shopping via social storefronts.,"351,085",,Active,,,,,For Profit,https://www.banter.shopping/,,https://www.linkedin.com/company/bantercommunity/,,,"Greater New York Area, East Coast, Northeastern US",,,,,,,,,,,,,,,,,"Commerce and Shopping, Internet Services, Software",,,1-10,1,Seed,2023-02-01,,,,Seed,,,,Seed,,USD,,,USD,,Unpopular Ventures,,1,,,,,,,Private,,,,,,,,,,,,,,,8,,,,,,,,,,
Takeoff | Social Mobile Ordering,https://www.crunchbase.com/organization/takeoff-social-mobile-ordering,2020-01-01,year,"E-Commerce, Information Technology, Software","Seattle, Washington, United States","Takeoff is a food marketplace app that makes ordering more convenient, affordable and social.","351,089",,Active,,,,,For Profit,,,https://www.linkedin.com/company/takeoffapp,,,"Greater Seattle Area, West Coast, Western US",,,,,,,,,,,,,,,,,"Commerce and Shopping, Information Technology, Software",3,"Dan Constantinescu, Ginsu Eddy, Ryan Sorensson",1-10,1,Seed,2020-03-01,10000,USD,10000,Pre-Seed,10000,USD,10000,Pre-Seed,10000,USD,10000,10000,USD,10000,,,,,,,,,,Private,,,,,,,,,,,,,,,,,,,,,,,,,
Weshare,https://www.crunchbase.com/organization/weshare-2,2021-03-09,day,"B2B, Enterprise Software, Internet, Recruiting, Sales Automation, Software","Middletown, Delaware, United States","An online appointment scheduling software that manages your appointments, sales calls, support calls, interviews, reservations and more.","351,100",$1M to $10M,Active,,,,,For Profit,https://www.weshare.net,https://www.twitter.com/weshare_net,https://www.linkedin.com/company/wesharene/,"Weshare is a platform that automates appointment scheduling for sales teams, support teams, and hiring teams in making appointments with prospects automatically. After completing a form on your website, you can use our scheduling platform to give prospects an easy way to book a meeting or begin a phone call right away.  What separates Weshare from other scheduling software is our intelligent criteria system, which qualifies and distributes leads in real time. This allows teams to always be able to connect with the people who matter most.  If you are looking for a solution that will make it easy for your company to connect with its leads and customers, then you need Weshare. Our scheduling platform automates appointment scheduling, so you can focus on your business goals.",https://www.facebook.com/weshare.net,"Greater Philadelphia Area, East Coast, Southern US",,,,,,,,,,,,,,,,,"Information Technology, Internet Services, Other, Professional Services, Sales and Marketing, Software",,,1-10,,,,,,,,,,,,,,,,,,,,,,,,,,,Private,,,,,,,,,,,,,,519.31%,34,,,47,,,,,,,
Charging Zoo,https://www.crunchbase.com/organization/charging-zoo,2023-01-01,year,"Charging Infrastructure, Electric Vehicle, Electronics, Manufacturing, Renewable Energy","San Diego, California, United States",Charging Zoo provides electric vehicle charging solutions for drivers who want to switch to clean and sustainable transportation.,"351,106",,Active,,,,,For Profit,https://www.chargingzoo.com,,https://www.linkedin.com/company/charging-zoo,"Charging Zoo provides electric vehicle charging solutions for drivers who want to switch to clean and sustainable transportation. The company's offered services are a proprietary system that allows residents of high-rise apartments and condo complexes to acquire, have installed, and have maintained a charging unit at their individual assigned parking space at no cost. Charging Zoo was founded in 2023 and is based in San Diego, California.",,"Greater San Diego Area, West Coast, Western US",,,,,,,,,,,,,,,,,"Consumer Electronics, Energy, Hardware, Manufacturing, Sustainability, Transportation",,,1-10,,,,,,,,,,,,,,,,,,,,,,,,,,,Private,,,,,,,,,,,,,,,,,,,,,,,,,
BoldHue,https://www.crunchbase.com/organization/boldhue,2019-01-01,year,"Artificial Intelligence (AI), Beauty, Information Technology","Aurora, Colorado, United States",BoldHue is a beauty tech company that develops a Bluetooth-enabled handheld device to cutomize beauty needs.,"351,113",,Active,,,,,For Profit,https://www.boldhue.com,,,"BoldHue is a beauty tech company that develops a Bluetooth-enabled handheld device to customize beauty needs. Its platform uses AI technology to scan faces, display color, and match the color of the face to dispense pigmentation into the base foundation. BoldHue was founded in 2019 and is headquartered in Aurora, Colorado.",,"Greater Denver Area, Western US",,,,,,,,,,,,,,,,,"Artificial Intelligence (AI), Consumer Goods, Data and Analytics, Information Technology, Science and Engineering, Software",,,,,,,,,,,,,,,,,,,,,,,,,,,,,,Private,,,,,,,,,,,,,,420.62%,2,,,,1,0,Physical Or Chemical Processes Or Apparatus In General,Scientific and electric apparatus and instruments,,,
Pareto Frontier Capital Holdings LLC,https://www.crunchbase.com/organization/pareto-frontier-capital,2020-01-01,year,"Artificial Intelligence (AI), Cryptocurrency, Financial Services, FinTech, Machine Learning","Miami, Florida, United States",Pareto Frontier develops quantitative trading technology for the cryptocurrency asset class.,"351,115",,Active,,,,,For Profit,,,https://www.linkedin.com/company/pareto-frontier-capital/,"Pareto Frontier develops quantitative trading technology for the cryptocurrency asset class. Our team has 15 years of combined and in-depth experience managing cryptoasset investments, as well as with machine learning, signal processing, and various learning methods on real-time systems.",,"Greater Miami Area, East Coast, Southern US",,,,,,,,,,,,,,,,,"Artificial Intelligence (AI), Blockchain and Cryptocurrency, Data and Analytics, Financial Services, Payments, Science and Engineering, Software",3,"Alan Waldman, Ilya Mikhelson, Rodrigo Benzaquen",1-10,1,Seed,2020-08-01,,,,Pre-Seed,,,,Pre-Seed,,USD,,,USD,,,,,,,,,,,Private,,,,,,,,,,,,,,,,,,,,,,,,,
Load Guru,https://www.crunchbase.com/organization/load-guru,2019-01-01,year,"Delivery Service, Logistics, Transportation","Glen Allen, Alabama, United States",Load Guru is a transport company that provides delivery and asset recovery services.,"351,120",$1M to $10M,Active,,,,,For Profit,http://www.myloadguru.com,,https://www.linkedin.com/company/loadguruinc,"Load Guru Management thrives on finding the right solutions for the most complex transportation problems. They answers all your logistic challenges, from “just-in-time” warehousing and routing to freight-payment auditing.",https://www.facebook.com/myloadguru,Southern US,,,,,,,,,,,,,,,,,Transportation,,,11-50,,,,,,,,,,,,,,,,,,,,,,,,,,,Private,,,,,,,,,,,,,,,,,,,,,,,,,
Galen Mental Health,https://www.crunchbase.com/organization/galen-mental-health,2021-01-01,year,"Health Care, Health Diagnostics, Hospital, Mental Health","Coral Gables, Florida, United States",Galen Mental Health is a mental health treatment center that focuses on eating disorders and dual diagnoses.,"351,120",,Active,,,,,For Profit,https://galenmentalhealth.com,,https://www.linkedin.com/company/galen-mental-health,"Galen Mental Health develops residential, partial hospitalization, outpatient mental health programs, mental health conditions, health conditions, eating disorders, or dual diagnoses, profound healing, and personal satisfaction.",,"Greater Miami Area, East Coast, Southern US",,,,,,,,,,,,,,,,,Health Care,,,251-500,,,,,,,,,,,,,,,,,,,,,,,,,,,Private,,,,,,,,,,,,,,,,2,,,,,,,,,
The Culture Dao,https://www.crunchbase.com/organization/the-culture-dao,2021-01-01,year,Artificial Intelligence (AI),"Middletown, Delaware, United States",A guild of AI Game and AI Movie makers powered by Gepetto AI,"351,121",,Active,,,,,For Profit,https://www.theculturedao.com/,,https://www.linkedin.com/company/the-culture-dao/,"The Culture Dao is a guild that includes AI engineers, AR/VR creators, storytellers, animators, and game designers. They focus on creating AI Games and AI Movies, powered by Gepetto AI. One of their current projects is GLITXH, an upcoming AI experience set in the Glitxh characters universe. Another project is an animated AI movie titled 'Lady Into Fox'. The Culture Dao operates as a DAO, a decentralized autonomous organization, where ownership is distributed among the members.",,"Greater Philadelphia Area, East Coast, Southern US",,,,,,,,,,,,,,,,,"Artificial Intelligence (AI), Data and Analytics, Science and Engineering, Software",,,,,,,,,,,,,,,,,,,,,,,,,,,,,,Private,,,,,,,,,,,,,,-1.88%,10,,,,,,,,,,
Intrics,https://www.crunchbase.com/organization/intrics,2021-01-01,year,,"Glen Allen, Virginia, United States",Intrics was formed to solve problems related to the massive influx of data in recent years.,"351,128",,Active,,,,,For Profit,https://intrics.io/,,https://www.linkedin.com/company/intrics,,,"East Coast, Southern US",,,,,,,,,,,,,,,,,,,,,,,,,,,,,,,,,,,,,,,,,,,,,,,Private,,,,,,,,,,,,,,30.54%,7,,,,,,,,,,
Xion,https://www.crunchbase.com/organization/xion-22ef,2018-02-01,day,Artificial Intelligence (AI),"New Orleans, Louisiana, United States","AI / ML focused subsidiary of GuardX in APAC region, based in Singapore.","351,131",,Active,,,,,For Profit,http://www.xion.ai,,,,,Southern US,,,,,,,,,,,,,,,,,"Artificial Intelligence (AI), Data and Analytics, Science and Engineering, Software",1,Anand Chavan,1-10,,,,,,,,,,,,,,,,,,,,,,,,,,,Private,,,,,,,,,,,,,,,32,,,,,,,,,,
Alpha Trend,https://www.crunchbase.com/organization/alpha-trend,2021-01-01,year,"Analytics, Artificial Intelligence (AI), Financial Services, Information Technology","Chicago, Illinois, United States",Alpha Trend is an analytics platform that helps investors increase investing conviction through AI-powered tools.,"351,143",,Active,,,,,For Profit,https://alphatrend.ai,,https://www.linkedin.com/company/alphatrend,,,"Greater Chicago Area, Great Lakes, Midwestern US",,,,,,,,,,,,,,,,,"Artificial Intelligence (AI), Data and Analytics, Financial Services, Information Technology, Science and Engineering, Software",,,1-10,,,,,,,,,,,,,,,,,,,,,,,,,,,Private,,,,,,,,,,,,,,,8,,,,,,,,,,
Ensley Reign Cosmetics,https://www.crunchbase.com/organization/ensley-reign-cosmetics,2020-01-04,day,Beauty,"Grants Pass, Oregon, United States",Here at Ensley Reign Cosmetics we recognize the power of beauty and self-care.,"351,146",,Active,,,,,For Profit,https://ensleyreign.com/,,,"Here at Ensley Reign Cosmetics we recognize the power of beauty and self-care. We aspire to awaken each individual's inherent beauty, bringing happiness to every customer. We are a grassroots, woman powered business motivated to create the best CBD infused & non-infused beauty products on the market. We offer the best selection of unique multichromatic cosmetics with the majority of our products being hand-crafted by us at our in-house facility in Oregon. Our products are cruelty-free, with an emphasis on vegan beauty. We use high quality, high performing ingredients like hemp derived CBD and CBG. Both our CBD and CBG are grown and tested in our home state of Oregon to ensure healthy skin and a healthy body, while keeping our customers looking fresh and beautiful.",,"West Coast, Western US",,,,,,,,,,,,,,,,,Consumer Goods,,,101-250,,,,,,,,,,,,,,,,,,,,,,,,,,,Private,,,,,,,,,,,,,,4.28%,5,,,,,,,,,,
Athletiverse,https://www.crunchbase.com/organization/athletiverse,2022-01-01,year,"Advertising, Internet, Marketing","San Diego, California, United States","Athletiverse is committed to helping student-athletes maximize the monetary worth of their name, image, and likeness (NIL).","351,194",,Active,,,,,For Profit,https://www.athletiverse.io,https://twitter.com/Athletiverse,https://www.linkedin.com/company/athletiverse,"Athletiverse is committed to helping student-athletes maximize the monetary worth of their name, image, and likeness (NIL).",https://www.facebook.com/profile.php?id=100083670905996,"Greater San Diego Area, West Coast, Western US",,,,,,,,,,,,,,,,,"Advertising, Internet Services, Sales and Marketing",,,1-10,,,,,,,,,,,,,,,,,,,,,,,,,,,Private,,,,,,,,,,,,,,-5.69%,16,,,,,,,,,,
Transposed AI,https://www.crunchbase.com/organization/transposed-ai,2023-05-01,day,"Audio Recording and Production, Generative AI, Music","Lewes, Delaware, United States",Best-in-class GenAI blended with legal licensing automation. Leverage AI models of artist voices for hassle-free commercial vocal production,"351,204",,Active,,,,,For Profit,https://www.transposed.ai,https://twitter.com/TransposedAI,https://www.linkedin.com/company/transposedai,"Make music, Faster. Meet best-in-class GenAI blended with legal licensing automation. Enabling hassle-free commercial AI vocal sampling and production, all while allowing creators to find the perfect sound for their song, fast. Transposed AI creates new revenue streams for artists, unleashing their unique vocal style to a community of professional creators.",,"East Coast, Southern US",,,,,,,,,,,,,,,,,"Artificial Intelligence (AI), Media and Entertainment, Music and Audio",1,Daniel Campbell,1-10,,,,,,,,,,,,,,,,,,,,,,,,,,,Private,,,,,,,,,,,,,,,,,,,,,,,,,
B. Riley Venture Capital,https://www.crunchbase.com/organization/b-riley-venture-capital,2020-11-01,month,,"Los Angeles, California, United States",B. Riley Venture Capital invests in late-stage private growth companies with a path towards public markets.,"351,243",,Active,,,,,For Profit,https://brileyfin.com/capabilities/venture-capital,,https://www.linkedin.com/company/brileyfinancial/?viewAsMember=true,B. Riley Venture Capital invests in late-stage private growth companies with a path towards public markets.,,"Greater Los Angeles Area, West Coast, Western US",Late Stage Venture,Venture Capital,2,2,,,,,,,,,,,,,,,,,,,,,,,,,,,,,,,,,,,,,,,,,,,Private,,,,,,,,,,,,,,,,,,,,,,,885314,USD,885314
Search Advisors,https://www.crunchbase.com/organization/search-advisors,2024-01-22,day,Reputation,"Hartford, Connecticut, United States",Search Advisors offers online reputation management services to businesses and professionals.,"351,246",,Active,,,,,For Profit,https://searchadvisors.net,,https://www.linkedin.com/company/searchadvisors,"Search Advisors specializes in advanced online crisis management and reputation protection in the face of digital scrutiny from entities like the FTC, SEC, and various regulatory bodies. Understanding the significant risks these issues pose to both corporate and personal reputations, we leverage precise crisis management tactics to ensure our clients' reputations remain unblemished, allowing their businesses to thrive even amidst adversity. Dissatisfied with the industry's clutter of unmet promises by major reputation management firms, we offer clear, targeted strategies for support and remediation. Our approach goes beyond temporary fixes; we aim for lasting solutions that remove negative regulatory remarks and transform our clients' digital narratives. We collaborate closely with our clients to not just avert crises but to fundamentally reshape their company's story, turning challenges into past memories and redefining their digital presence from unnoticed to exemplary. Our mission is to guide businesses through the journey towards an impeccable online reputation, highlighting our commitment to excellence and enduring results.",https://www.facebook.com/SearchAdvisors,"East Coast, New England, Northeastern US",,,,,,,,,,,,,,,,,Information Technology,1,Luke Kist,1-10,,,,,,,,,,,,,,,,,,,,,,,,,,,Private,,,,,,,,,,,,,,-8.24%,,,,,,,,,,,
ROK LANES,https://www.crunchbase.com/organization/rok-lanes,2020-08-11,day,"Enterprise Software, Logistics, Shipping, Supply Chain Management, Transportation","Wilmington, Delaware, United States","As a key player in the trucking industry, ROK LANES utilizes tech to offer seamless, predictable, and transparent warehouse deliveries.","351,252",,Active,,,,,For Profit,https://www.roklanes.com/,https://twitter.com/ROKLANES,https://www.linkedin.com/company/rok-lanes,"ROK LANES is reshaping the expansive drayage trucking sector using a sophisticated technology platform that simplifies the delivery process to warehouses. Our platform enhances predictability and transparency, thus removing any impediments along the way. We effectively establish real-time connections between shippers, carriers, and truckers, marking a new era in logistics and supply chain management.",https://www.facebook.com/ROKLANES,"Greater Philadelphia Area, East Coast, Southern US",,,,,,,,,,,,,,,,,"Software, Transportation",,,11-50,,,,,,,,,,,,,,,,,,,,,,,,,,,Private,,,,,,,,,,,,,,-19.84%,101,,,,,,,,,,
Veris Health,https://www.crunchbase.com/organization/veris-health,2021-01-01,year,Health Care,"New York, New York, United States","Veris Health Inc., is a digital health company.","351,297",,Active,,,,,For Profit,https://www.verishealth.com/,,https://www.linkedin.com/company/verishealth/,"Veris Health Inc., is a digital health company developing the first intelligent implantable vascular access port with biologic sensors and wireless communication to improve personalized cancer care through remote patient monitoring. A subsidiary of PAVmed, Inc.",,"Greater New York Area, East Coast, Northeastern US",,,,,,,,,,,,,,,,,Health Care,,,,,,,,,,,,,,,,,,,,,,,,,,,,,,Private,,,,,,,,,,,,,,,3,1,,,2,0,Medical Or Veterinary Science; Hygiene,,,,
