Organization Name,Organization Name URL,Founded Date,Founded Date Precision,Industries,Headquarters Location,Description,CB Rank (Company),Estimated Revenue Range,Operating Status,Exit Date,Exit Date Precision,Closed Date,Closed Date Precision,Company Type,Website,Twitter,LinkedIn,Full Description,Facebook,Headquarters Regions,Investment Stage,Investor Type,Number of Portfolio Organizations,Number of Investments,Number of Lead Investments,Number of Diversity Investments,Number of Exits,Number of Exits (IPO),Accelerator Program Type,Accelerator Application Deadline,Accelerator Duration (in weeks),School Type,School Program,Number of Enrollments,School Method,Number of Founders (Alumni),Industry Groups,Number of Founders,Founders,Number of Employees,Number of Funding Rounds,Funding Status,Last Funding Date,Last Funding Amount,Last Funding Amount Currency,Last Funding Amount Currency (in USD),Last Funding Type,Last Equity Funding Amount,Last Equity Funding Amount Currency,Last Equity Funding Amount Currency (in USD),Last Equity Funding Type,Total Equity Funding Amount,Total Equity Funding Amount Currency,Total Equity Funding Amount Currency (in USD),Total Funding Amount,Total Funding Amount Currency,Total Funding Amount Currency (in USD),Top 5 Investors,Number of Lead Investors,Number of Investors,Number of Acquisitions,Acquisition Status,Announced Date,Announced Date Precision,Acquisition Type,Acquisition Terms,IPO Status,IPO Date,Money Raised at IPO,Money Raised at IPO Currency,Money Raised at IPO Currency (in USD),Valuation at IPO,Valuation at IPO Currency,Valuation at IPO Currency (in USD),Stock Symbol,Stock Symbol URL,Stock Exchange,Last Leadership Hiring Date,Last Layoff Mention Date,Number of Events,SEMrush - Monthly Rank Growth,BuiltWith - Active Tech Count,Apptopia - Number of Apps,Apptopia - Downloads Last 30 Days,G2 Stack - Total Products Active,IPqwery - Patents Granted,IPqwery - Trademarks Registered,IPqwery - Most Popular Patent Class,IPqwery - Most Popular Trademark Class,Aberdeen - IT Spend,Aberdeen - IT Spend Currency,Aberdeen - IT Spend Currency (in USD)
VOLTOUT,https://www.crunchbase.com/organization/voltout,2020-02-19,day,"Fitness, SaaS, Sports","Claymont, Delaware, United States",The mobile app connecting sport trainers with people who want to do sport or start with  full-stack saas for trainers to manage clients.,"3,258,278",Less than $1M,Active,,,,,For Profit,http://voltout.app,,,"Unemployed trainers will get a job again. We allow trainers to earn money from their classes and provide them with the full stack of necessary technologies. In the future, we are a marketplace for sports training where anyone can find a trainer for any sport in a convenient place. We build a full stack of tools for personal trainers so they could manage their business on their own. We make it easy to create a business account, add detailed training descriptions and media, manage schedules, finances and control taxes.",,"Greater Philadelphia Area, East Coast, Southern US",,,,,,,,,,,,,,,,,"Software, Sports",,,1-10,,,,,,,,,,,,,,,,,,,,,,,,,,,Private,,,,,,,,,,,,,,,3,,,,,,,,,,
Alltracon,https://www.crunchbase.com/organization/alltracon,2022-04-08,day,Transportation,"Medina, Ohio, United States","Alltracon is a specialized rigging and heavy machinery moving company focused on plant relocations, shutdowns, and production line upgrades.","3,258,205",,Active,,,,,For Profit,https://alltracon.com/,,https://www.linkedin.com/company/alltracon-industrial-construction-services/,"Alltracon performs expert heavy machinery moving and millwright services.  We focus on plant relocations, shutdowns, and production line upgrades.   What does one extra day of downtime or lost production cost you? This is why our team’s single most important goal is meeting YOUR deadlines.  Our experienced millwrights and ironworkers, and our full turn-key services cover everything including custom fabrication, storage, and trucking.   So whether you need Alltracon for moving delicate tooling and electronics, installing new conveyor systems, or moving a 500 ton press, we safely deliver both results and speed to keep your production running smoothly. Call (855) RIG-HAUL for your free quote.",https://www.facebook.com/alltraconllc,"Great Lakes, Midwestern US",,,,,,,,,,,,,,,,,Transportation,,,1-10,,,,,,,,,,,,,,,,,,,,,,,,,,,Private,,,,,,,,,,,,,,,,,,,,,,,,,
California Storyboards,https://www.crunchbase.com/organization/california-storyboards,2018-01-01,year,,"Dana Point, California, United States","California Storyboards is businesses get more business by telling their stories through presentations, web, apps and video.","3,258,182",,Active,,,,,,https://www.californiastoryboards.com,,https://www.linkedin.com/company/californiastoryboards,,,"Greater Los Angeles Area, West Coast, Western US",,,,,,,,,,,,,,,,,,,,1-10,,,,,,,,,,,,,,,,,,,,,,,,,,,Private,,,,,,,,,,,,,,-3.43%,,,,,,,,,,,
PubZone,https://www.crunchbase.com/organization/pubzone,2020-01-01,year,Advertising,"Santa Monica, California, United States",PubZone is the digital publisher destination to share and discover publisher solutions.,"3,258,030",,Active,,,,,For Profit,https://pub.zone/,https://twitter.com/pubzone_,https://www.linkedin.com/company/pubzone,"It can be difficult for publishers to find trustworthy vendors, often relying on fragmented information spread across forums, social groups, and tech review sites that were not built with publishers in mind. PubZone solves this by providing a platform specifically for publishers to share and discover new tools, resulting in a central database of solutions supported by information directly from the experts who have first hand experience with them.",https://www.facebook.com/PubZone-107948800848292,"Greater Los Angeles Area, West Coast, Western US",,,,,,,,,,,,,,,,,"Advertising, Sales and Marketing",1,Chris Wargo,,,,,,,,,,,,,,,,,,,,,,,,,,,,Private,,,,,,,,,,,,,,,5,,,,,,,,,,
Art of Staging and Decor,https://www.crunchbase.com/organization/art-of-staging-and-decor,2019-01-01,year,Home Decor,"Zionsville, Indiana, United States","Home Staging in Zionsville, IN","3,257,831",,Active,,,,,For Profit,http://artofstaginganddecor.com,,https://www.linkedin.com/company/art-of-staging-and-decor,"Address: 95 E Poplar St, Zionsville, IN 46077, USA",,"Great Lakes, Midwestern US",,,,,,,,,,,,,,,,,Real Estate,,,,,,,,,,,,,,,,,,,,,,,,,,,,,,Private,,,,,,,,,,,,,,,4,,,,,,,,,,
Masterplan,https://www.crunchbase.com/organization/masterplan-450d,2020-01-01,year,,"San Diego, California, United States","Masterplan is a 360º management tool for builders, architects and designers.","3,257,805",,Active,,,,,For Profit,https://www.mplan.io,,https://www.linkedin.com/company/masterplan%C2%AE,,https://www.facebook.com/Masterplan-143320621207929,"Greater San Diego Area, West Coast, Western US",,,,,,,,,,,,,,,,,,1,Nicolas Bazbaz Esses,,,,,,,,,,,,,,,,,,,,,,,,,,,,Private,,,,,,,,,,,,,,,13,,,,,,,,,,
One on One,https://www.crunchbase.com/organization/one-on-one-84c8,2020-05-01,day,,"Los Angeles, California, United States",One on One conversations on topics of the day and other interesting news and storytelling.,"3,257,752",,Active,,,,,For Profit,https://www.oneononeconversation.com,https://twitter.com/oneononeconvo,,,,"Greater Los Angeles Area, West Coast, Western US",,,,,,,,,,,,,,,,,,,,1-10,,,,,,,,,,,,,,,,,,,,,,,,,,,Private,,,,,,,,,,,,,,,,,,,,,,,,,
Make Truth Matter Again,https://www.crunchbase.com/organization/make-truth-matter-again,2019-12-19,day,Information Services,"Seattle, Washington, United States","Education, pro-Honesty, antii-disinfo","3,257,541",,Closed,,,,none,Non-profit,https://www.maketruthmateragain.org,https://twitter.com/maketruthgr8r,,MTMA creates self-sustaining products that make disinformation less likely to propigate.,https://www.facebook.com/groups/maketruthmatteragain,"Greater Seattle Area, West Coast, Western US",,,,,,,,,,,,,,,,,Information Technology,,,1-10,,,,,,,,,,,,,,,,,,,,,,,,,,,Private,,,,,,,,,,,,,,,,,,,,,,,,,
The Vetrepreneure Collective,https://www.crunchbase.com/organization/the-vetrepreneure-collective,2023-10-01,day,,"San Diego, California, United States",The Vetrepreneur Collective turns veterans into entrepreneurs.,"3,257,536",,Active,,,,,,https://www.vetrepreneurcollective.com/,,https://www.linkedin.com/company/vetrepreneur-collective/,"The Vetrepreneur Collective turns veterans into entrepreneurs. Entrepreneurship requires grit, discipline, drive, and innovation. These are all skills veterans possess. What they often don't have is a road map to building a business and a community to support them as they grow.  That's where the Vetrepreneur Collective comes in. I take those coveted soft skills that the military so diligently honed and teach you the step-by-step processes necessary to start your own company - regardless of industry. We then offer you the support that only a community of like-minded veterans can offer. Mentorship, coaching, guidance, and advice all brought together under a single roof. No one ever created anything great on their own, so why would you try to start a business by yourself? Through this platform, veterans like yourself will be able to take your idea from concept through execution and growth, giving you the best possible chance of success in creating a lasting business that will give you purpose and meaning in life after service.",,"Greater San Diego Area, West Coast, Western US",,,,,,,,,,,,,,,,,,2,"Greg VanDyne, Kevin Sieff",1-10,,,,,,,,,,,,,,,,,,,,,,,,,,,Private,,,,,,,,,,,,,,,0,,,,,,,,,,
Pro Detectorist,https://www.crunchbase.com/organization/pro-detectorist,2019-12-01,month,Blogging Platforms,"Chicago, Illinois, United States",Pro Detectorist is a devoted blog for antique metal and relic hunters.,"3,257,277",,Active,,,,,For Profit,https://prodetectorist.com/,https://twitter.com/prodetectorist,,"Welcome to Pro Detectorist. Pro Detectorist is a devoted blog for antique metal and relic hunters. Metal detecting is an excellent hobby worldwide that requires a lot of patience, dedication and enthusiasm. We, the Pro Detectorist family is here to share inspirational and motivational content to keep hobbyist metal and relic hunters focused. This blog is full of resource, opinions, tutorial and researched product reviews by professionals that should be quite helpful for beginners and hobbyists. All of our contents are written after hours of research and discussion with experts so that anyone can learn basic to advanced about metal detecting and can purchase the right product for the right purpose. We love our readers and want to hear from them. Please knock us to the contact page if you have any good wishes, questions or suggestions.",,"Greater Chicago Area, Great Lakes, Midwestern US",,,,,,,,,,,,,,,,,"Content and Publishing, Media and Entertainment",,,1-10,,,,,,,,,,,,,,,,,,,,,,,,,,,Private,,,,,,,,,,,,,,,4,,,,,,,,,,
PORT Mobile Inc.,https://www.crunchbase.com/organization/port-mobile-inc,2019-03-18,day,"Apps, Marketplace, Music","Los Angeles, California, United States",All-in-one platform for artists to monetize and grow their fanbase,"3,257,269",,Closed,,,,none,For Profit,https://www.port.events,,,"Music Tech, Music App, Creator Monetization Platform, Creator Services, Consumer App, Content Based Marketplace",,"Greater Los Angeles Area, West Coast, Western US",,,,,,,,,,,,,,,,,"Apps, Commerce and Shopping, Media and Entertainment, Music and Audio, Software",,,1-10,,,,,,,,,,,,,,,,,,,,,,,,,,,Private,,,,,,,,,,,,,,,2,,,,,,,,,,
Texas Corporate Capital Advisors,https://www.crunchbase.com/organization/texas-corporate-capital-advisors,2018-01-01,day,"Financial Services, Venture Capital","Dallas, Texas, United States","TXCCA is a boutique capital markets firm providing financial advisory services, in specific mergers, acquisitions & capital raising advice.","3,257,265",$1M to $10M,Active,,,,,For Profit,https://www.txcca.com/,,,,,"Dallas/Fort Worth Metroplex, Southern US",,,,,,,,,,,,,,,,,"Financial Services, Lending and Investments",,,11-50,,,,,,,,,,,,,,,,,,,,,,,,,,,Private,,,,,,,,,,,,,,,,,,,,,,,,,
Boardwalkk,https://www.crunchbase.com/organization/boardwalkk,2020-01-01,year,,"Spearfish, South Dakota, United States",Real Estate Technology,"3,257,248",,Active,,,,,For Profit,,,,,,Midwestern US,,,,,,,,,,,,,,,,,,1,Kristen Smith,1-10,,,,,,,,,,,,,,,,,,,,,,,,,,,Private,,,,,,,,,,,,,,,,,,,,,,,,,
Shahrestani Law,https://www.crunchbase.com/organization/shahrestani-law,2018-01-01,year,Legal,"Austin, Texas, United States",Law practice offering automated solutions.,"3,257,172",,Active,,,,,For Profit,http://www.shahrestanilaw.com,https://twitter.com/alexshandle,https://linkedin.com/ealexanders,"Shahrestani Law is committed to providing excellent service. If you're a founder of the 21st century, you're somewhere in between the range of running a website to drive sales, or selling software products and services. There's no escaping it: your business is tied to technology. It can be hard to know where you hold risk and how to overcome it. Alex prides himself on walking the lines between law, business, and technology. As a startup founder with a background in computer science, Alex takes the difficult concepts, breaks them down into bite size pieces, and delivers you with your options to make things happen. There's a list of potential services you'll need help with below, but businesses can be as complicated and nuanced as people can be, so it's hard to know what your specific needs are without getting to know you first! That's why Shahrestani Law makes it easy for you to get help: Free 15-minute consultations *Affordable* subscription services Quick turnaround times Transparent pricing Discounts for veterans and students ​ Contact Shahrestani Law now for help with your legal needs, or to find out more about potential pitfalls your business might face!",https://facebook.com/alexlaw512,Southern US,,,,,,,,,,,,,,,,,Professional Services,,,,,,,,,,,,,,,,,,,,,,,,,,,,,,Private,,,,,,,,,,,,,,,9,,,,,,,,,,
Spoco,https://www.crunchbase.com/organization/spoco,2020-01-09,day,Education,"Los Angeles, California, United States",SEO packages for all websites.,"3,257,129",,Active,,,,,For Profit,https://www.myspoco.com,,,Spoco is an SEO tool that helps websites succeed on search engines.,,"Greater Los Angeles Area, West Coast, Western US",,,,,,,,,,,,,,,,,Education,,,,,,,,,,,,,,,,,,,,,,,,,,,,,,Private,,,,,,,,,,,,,,,2,,,,,,,,,,
NORTIER LOGISTICS LLC,https://www.crunchbase.com/organization/nortier-logistics-llc,2018-08-31,day,Logistics,"Riverside, California, United States","NORTIER LOGISTICS LLC is a one of the best logistics companies in CA, USA. It provides best cargo services in CA, USA.","3,257,085",,Active,,,,,For Profit,,,,,,"Greater Los Angeles Area, Inland Empire, West Coast",,,,,,,,,,,,,,,,,Transportation,,,,,,,,,,,,,,,,,,,,,,,,,,,,,,Private,,,,,,,,,,,,,,,,,,,,,,,,,
Spencer and York,https://www.crunchbase.com/organization/spencer-and-york,2018-03-09,day,"Children, Gift, Retail","Chicago, Illinois, United States","Retail: Children's clothing, personalized gifts and accessories","3,256,960",,Closed,,,,none,For Profit,https://www.spencerandyork.com,,,"Spencer and York is a top online children's store offering personalized, classic styles with a modern flair. Affordable and unique without sacrificing quality, our children's clothing, gifts and accessories are made just for you! ",https://www.facebook.com/spencerandyork,"Greater Chicago Area, Great Lakes, Midwestern US",,,,,,,,,,,,,,,,,"Commerce and Shopping, Community and Lifestyle",1,Emily Avent,1-10,,,,,,,,,,,,,,,,,,,,,,,,,,,Private,,,,,,,,,,,,,,,1,,,,,,,,,,
LEXICON Vegas,https://www.crunchbase.com/organization/lexicon-vegas,2018-01-01,year,Advertising,"Las Vegas, Nevada, United States","LEXICON Vegas is a social media, digital marketing and business development conference","3,256,883",,Active,,,,,For Profit,https://lexiconvegas.com,https://www.twitter.com/lexiconvegas,https://www.linkedin.com/company/lexicon-vegas,"LEXICON Vegas is a Social Media, Digital Marketing, and Business Development Conference that provides businesses and brands the tools they need for successful marketing that is in such high demand in the digital marketing world. LEXICON is a two-day conference that will offer top keynote speakers from various areas of marketing to educate, inform and inspire the public on how to properly market their business on a digital scale.",https://www.facebook.com/lexiconvegas,Western US,,,,,,,,,,,,,,,,,"Advertising, Sales and Marketing",1,Brian Kip,,,,,,,,,,,,,,,,,,,,,,,,,,,,Private,,,,,,,,,,,,,,,,,,,,,,,,,
Mills & Park™,https://www.crunchbase.com/organization/mills-park,2020-01-01,year,,"Buffalo, New York, United States",Mills & Park helps build brands by utilizing modern technologies.,"3,256,835",,Closed,,,,none,For Profit,,,,"Mills & Park helps build brands by utilizing modern technologies. It designs and develops responsive digital experiences for forward-thinking brands and runs effective ad campaigns on social media platforms. The Buffalo, New York-headquartered company was founded in 2020 by Patrick Gallagher.",,"Great Lakes, East Coast, Northeastern US",,,,,,,,,,,,,,,,,,1,Patrick Gallagher,1-10,,,,,,,,,,,,,,,,,,,,,,,,,,,Private,,,,,,,,,,,,,,,,,,,,,,,,,
JC Scholarly,https://www.crunchbase.com/organization/jc-scholarly,2018-01-01,year,"Event Management, Events, Music","Phoenix, Arizona, United States",JC Scholarly is an organization established for music and science performance.,"3,256,721",,Active,,,,,Non-profit,http://jcscholarly.org,,https://www.linkedin.com/company/jc-scholarly,"JC Scholarly company provides organization services established for music and science performance. They provide musical performance, science performance, work and play in harmony as their events. Their contact is done through phone and email.",https://www.facebook.com/profile.php?id=100064942541298,"Greater Phoenix Area, Western US",,,,,,,,,,,,,,,,,"Events, Media and Entertainment, Music and Audio",,,1-10,,,,,,,,,,,,,,,,,,,,,,,,,,,Private,,,,,,,,,,,,,,,,,,,,,,,,,
Computer Dudes of Wakulla,https://www.crunchbase.com/organization/computer-dudes-of-wakulla,2019-02-01,month,Information Technology,"Tallahassee, Florida, United States",Computer and Phone Repair/Service,"3,256,625",,Closed,,,,none,For Profit,https://mycomputerdudes.com,,,,https://www.facebook.com/mycomputerdudes/,"East Coast, Southern US",,,,,,,,,,,,,,,,,Information Technology,,,1-10,,,,,,,,,,,,,,,,,,,,,,,,,,,Private,,,,,,,,,,,,,,,9,,,,,,,,,,
Goggles Guide,https://www.crunchbase.com/organization/goggles-guide,2020-01-03,day,,"Detroit, Michigan, United States",Goggles Guide is a journal that mainly focuses on OTG Goggles.,"3,256,425",,Active,,,,,For Profit,https://gogglesguide.com/,,,Goggles Guide is a journal that mainly focuses on OTG Goggles. It has a team of highly qualified writers who know the subject inside out and they churn on articles related to OTG Goggles so that people can make better buying decisions.,,"Greater Detroit Area, Great Lakes, Midwestern US",,,,,,,,,,,,,,,,,,,,11-50,,,,,,,,,,,,,,,,,,,,,,,,,,,Private,,,,,,,,,,,,,,,3,,,,,,,,,,
Sussex Select,https://www.crunchbase.com/organization/sussex-select,2018-01-01,year,Commercial,"New York, New York, United States",Sussex Select,"3,256,016",,Active,,,,,For Profit,,,,,,"Greater New York Area, East Coast, Northeastern US",,,,,,,,,,,,,,,,,Other,,,,,,,,,,,,,,,,,,,,,,,,,,,,,,Private,,,,,,,,,,,,,,,,,,,,,,,,,
Money Follow You,https://www.crunchbase.com/organization/money-follow-you,2019-11-25,day,"Finance, Financial Services","New York, New York, United States",Learn how to make more money online from home Using Money Follow You Blog.,"3,256,014",,Active,,,,,For Profit,https://www.moneyfollowyou.com/,https://twitter.com/moneyfollowyou,,"Learn how to make more money online from home Using Money Follow You Blog. Find side hustles, fast ways, online methods and apps to put cash in your pocket.",https://www.facebook.com/moneyfollowyou/,"Greater New York Area, East Coast, Northeastern US",,,,,,,,,,,,,,,,,Financial Services,1,Deep Bhalla,1-10,,,,,,,,,,,,,,,,,,,,,,,,,,,Private,,,,,,,,,,,,,,,2,,,,,,,,,,
Fierle Strategic Communications,https://www.crunchbase.com/organization/fierle-strategic-communications,2019-01-01,year,,"Chicago, Illinois, United States",Fierle Strategic Communications create and align a flow of effective and high-quality communications that empowers organizations.,"3,256,013",,Active,,,,,For Profit,https://www.fierlecomms.com,,https://www.linkedin.com/company/fierle-strategic-communications,,,"Greater Chicago Area, Great Lakes, Midwestern US",,,,,,,,,,,,,,,,,,,,1-10,,,,,,,,,,,,,,,,,,,,,,,,,,,Private,,,,,,,,,,,,,,,17,,,,,,,,,,
Risk Integration,https://www.crunchbase.com/organization/risk-integration,2018-01-01,year,"Analytics, Cloud Computing, Information Services","San Francisco, California, United States","Risk Integration, builds and manages industry-specific cloud-based analytics platforms.","3,255,749",$1M to $10M,Active,,,,,For Profit,http://riskintegration.com/,,,"Risk Integration is an industry-specific cloud-based analytics platform. Designing the industry’s most widely-used house price indices (HPI) while at FHFA (formerly OFHEO), and building the industry’s most accurate HPI while at LPS.",,"San Francisco Bay Area, West Coast, Western US",,,,,,,,,,,,,,,,,"Data and Analytics, Information Technology, Internet Services, Software",,,1-10,,,,,,,,,,,,,,,,,,,,,,,,,,,Private,,,,,,,,,,,,,,,11,,,,,,,,,,
Track & Field Exchange,https://www.crunchbase.com/organization/track-field-exchange-0fe5,2019-03-19,day,Financial Services,"New York, New York, United States",Track & Field Exchange is an alternative asset investment platform for better short-term returns than Wall Street.,"3,255,518",,Closed,,,,none,For Profit,https://trackstocks.app,https://twitter.com/TrackStocksApp,https://linkedin.com/company/track-field-exchange,"Track & Field Exchange is an alternative asset investment platform for better short-term returns than Wall Street. The platform enables its users to track, buy and hold shares in world-class track and field athlete performance, build a portfolio, earn dividends and bragging rights. Whether a first time investor or a season veteran, our platform serves as an innovative way for our clients to incorporate non-traditional investments in their portfolio.",https://facebook.com/trackandfieldexchange,"Greater New York Area, East Coast, Northeastern US",,,,,,,,,,,,,,,,,Financial Services,,,1-10,,,,,,,,,,,,,,,,,,,,,,,,,,,Private,,,,,,,,,,,,,,,,,,,,,,,,,
Topwater Advisory Group,https://www.crunchbase.com/organization/topwater-advisory-group,2019-01-01,year,Marketing,"New York, New York, United States",Topwater Advisory Group is hyper-focused on leveraging data and technology to drive better outcomes for its clients.,"3,255,510",,Active,,,,,For Profit,https://www.topwateradvisors.com/,,https://www.linkedin.com/company/topwater-advisory-group/,,,"Greater New York Area, East Coast, Northeastern US",,,,,,,,,,,,,,,,,Sales and Marketing,1,Michael Strober,11-50,,,,,,,,,,,,,,,,,,,,,,,,,,,Private,,,,,,,,,,,,,,,2,,,,,,,,,,
Top Form Design LLC,https://www.crunchbase.com/organization/top-form-design-llc,2019-01-01,year,Fitness,"Yakima, Washington, United States",Top Form Design LLC focus on products that make working out easier without reducing calorie burn.,"3,255,290",,Active,,,,,,http://www.topformdesign.com,,https://www.linkedin.com/company/top-form-design-llc/,,https://www.facebook.com/people/Top-Form-Design/100063672097100/,"West Coast, Western US",,,,,,,,,,,,,,,,,Sports,,,1-10,,,,,,,,,,,,,,,,,,,,,,,,,,,Private,,,,,,,,,,,,,,-9.99%,1,,,,,,,,,,
Wisconsin Dental Solutions,https://www.crunchbase.com/organization/wisconsin-dental-solutions,2020-01-01,year,"Cosmetic Surgery, Dental, Health Care, Personal Health","Sun Prairie, Wisconsin, United States","Wisconsin Dental Solutions provides dental implants, sedation, prosthodontics, oral cancer, and cosmetic dentistry services.","3,255,221",$1M to $10M,Active,,,,,For Profit,https://www.dentalsolutions4you.com,,https://www.linkedin.com/company/dr.-james-amstadt-&-associates,Wisconsin Dental Solutions sets itself apart from its competitors is the individual attention and compassion our entire team extends toward their patients. They have seen and treated many patients who were afraid to go to the dentist because they felt embarrassed by their teeth and wanted to avoid any criticism. They provide dental implants consisting of a titanium post and a single crown or a multiple-tooth prosthetic. They provide minor surgery is necessary to prepare the area for the implant and place the implant in the mouth.,https://www.facebook.com/madisonimplantdentist,"Great Lakes, Midwestern US",,,,,,,,,,,,,,,,,Health Care,,,51-100,,,,,,,,,,,,,,,,,,,,,,,,,,,Private,,,,,,,,,,,,,,,,,,,,,,,,,
ROAI Mastermind,https://www.crunchbase.com/organization/roai-mastermind,2023-01-01,year,"Artificial Intelligence (AI), Higher Education","Miami, Florida, United States",ROAI Mastermind is a higher educational platform.,"3,255,100",,Active,,,,,,https://roaimastermind.com/freetrial,,https://www.linkedin.com/company/roai-mastermind,,,"Greater Miami Area, East Coast, Southern US",,,,,,,,,,,,,,,,,"Artificial Intelligence (AI), Data and Analytics, Education, Science and Engineering, Software",,,1-10,,,,,,,,,,,,,,,,,,,,,,,,,,,Private,,,,,,,,,,,,,,-28.98%,,,,,,,,,,,
