Coalition Network,https://www.crunchbase.com/organization/coalition-network,2020-01-01,year,,"San Francisco, California, United States","Coalition is a global, privacy-first contact tracing app to help stop the spread of COVID-19.","3,233,826",,Active,,,,,For Profit,https://www.coalitionnetwork.org/,https://twitter.com/coalition_app,https://www.linkedin.com/company/coalitionapp/,,https://www.facebook.com/coalitionapp/,"San Francisco Bay Area, West Coast, Western US",,,,,,,,,,,,,,,,,,,,,,,,,,,,,,,,,,,,,,,,,,,,,,,Private,,,,,,,,,,,,,,,17,,,,,,,,9761,USD,9761
"Delaware County, Treasurer's Office",https://www.crunchbase.com/organization/delaware-county-treasurer-s-office,2020-01-01,year,"Finance, Financial Services, Real Estate","Delaware, Ohio, United States","Delaware County, Treasurer's Office provides financial assistance to homeowners for qualified mortgage and housing-related expenses.","3,233,232",,Active,,,,,For Profit,,,,,,"Great Lakes, Midwestern US",,,,,,,,,,,,,,,,,"Financial Services, Real Estate",,,,,,,,,,,,,,,,,,,,,,,,,,,,,,Private,,,,,,,,,,,,,,,,,,,,,,,,,
Quarkscal,https://www.crunchbase.com/organization/quarkscal,2021-10-01,day,,"San Francisco, California, United States",Quarkscal provides creative designing services to aspiring companies.,"3,233,099",,Active,,,,,For Profit,https://quarkscal.com,,,"Quarkscal provides creative designing services to aspiring companies. It was founded in 2021 and is based in California, USA.",,"San Francisco Bay Area, West Coast, Western US",,,,,,,,,,,,,,,,,,,,1-10,,,,,,,,,,,,,,,,,,,,,,,,,,,Private,,,,,,,,,,,,,,,1,,,,,,,,,,
GrassrootsGov,https://www.crunchbase.com/organization/grassrootsgov,2020-01-01,year,"Communities, Digital Media, Non Profit","Dallas, Texas, United States",GrassrootsGov is an organization for rethinking digital activism.,"3,232,895",,Active,,,,,Non-profit,https://grassrootsgov.org,https://twitter.com/GrassrootsGovv,https://www.linkedin.com/company/grassrootsgov ,,,"Dallas/Fort Worth Metroplex, Southern US",,,,,,,,,,,,,,,,,"Community and Lifestyle, Media and Entertainment, Other, Social Impact",,,11-50,,,,,,,,,,,,,,,,,,,,,,,,,,,Private,,,,,,,,,,,,,,,1,,,,,,,,,,
The Free Valuation,https://www.crunchbase.com/organization/the-free-valuation,2018-06-01,day,,"Colorado Springs, Colorado, United States",Free Business Valuation Service!,"3,232,811",,Active,,,,,For Profit,https://www.thefreevaluation.com,,,"By Appointment Only! We help Colorado business owners of any size learn the true value of their entity. There is no cost or obligation for this service or report. We offer a free written ""Big Data"" report delivered in person when you take the time to fill out short questions at our website.  More details at our website.",,Western US,,,,,,,,,,,,,,,,,,1,Carl C Lavery III,1-10,,,,,,,,,,,,,,,,,,,,,,,,,,,Private,,,,,,,,,,,,,,,2,,,,,,,,,,
Video Madness,https://www.crunchbase.com/organization/video-madness,2019-01-01,year,"Event Management, Professional Services","Campbell, California, United States",Video Madness has been designing custom album designs since 2001.,"3,232,756",$1M to $10M,Active,,,,,For Profit,https://www.videomadness.com/,,https://www.linkedin.com/company/video-madness,,https://www.facebook.com/VMCinema/,"San Francisco Bay Area, Silicon Valley, West Coast",,,,,,,,,,,,,,,,,"Events, Media and Entertainment, Other",,,11-50,,,,,,,,,,,,,,,,,,,,,,,,,,,Private,,,,,,,,,,,,,,,1,,,,,,,,,,
Local Enterprises WNY,https://www.crunchbase.com/organization/local-enterprises-wny,2021-01-01,year,Real Estate,"Buffalo, New York, United States",Local Enterprises WNY is a provider of property management services.,"3,232,540",,Active,2022-11-01,day,,,For Profit,,,,Local Enterprises WNY is a provider of property management services.,,"Great Lakes, East Coast, Northeastern US",,,,,,,,,,,,,,,,,Real Estate,,,,,M&A,,,,,,,,,,,,,,,,,,,,Was Acquired,2022-11-01,day,Acquisition,,Private,,,,,,,,,,,,,,,,,,,,,,,,,
Rafikee,https://www.crunchbase.com/organization/rafikee,2020-01-01,year,Internet,"Placentia, California, United States",Job Board for Data Scientists,"3,232,478",,Closed,,,,none,For Profit,https://www.rafikee.io,,,We are a job board exclusively for data scientists!,https://www.facebook.com/pg/rafikeeio/,"Greater Los Angeles Area, West Coast, Western US",,,,,,,,,,,,,,,,,Internet Services,1,Ajay Mistry,1-10,,,,,,,,,,,,,,,,,,,,,,,,,,,Private,,,,,,,,,,,,,,,,,,,,,,,,,
Mika,https://www.crunchbase.com/organization/mika-538b,2019-02-01,day,,"Newbury Park, California, United States",Intelligent Security Lock Company,"3,232,391",,Active,,,,,For Profit,https://mikatech.group/index.html,,,,,"Greater Los Angeles Area, West Coast, Western US",,,,,,,,,,,,,,,,,,,,11-50,,,,,,,,,,,,,,,,,,,,,,,,,,,Private,,,,,,,,,,,,,,,1,,,,,,,,,,
Advanced Consumer Analytics ACA,https://www.crunchbase.com/organization/advanced-consumer-analytics-aca,2019-01-01,year,"Consulting, Information Technology, Software","Seattle, Washington, United States","Discover meaningful and actionable value from data to support transparent, accountable and effective decision making.","3,232,312",,Active,,,,,For Profit,https://advanced-consumer-analytics.com,,https://www.linkedin.com/company/advanced-consumer-analytics-aca,,,"Greater Seattle Area, West Coast, Western US",,,,,,,,,,,,,,,,,"Information Technology, Professional Services, Software",,,1-10,,,,,,,,,,,,,,,,,,,,,,,,,,,Private,,,,,,,,,,,,,,,1,,,,,,,,,,
Market News France,https://www.crunchbase.com/organization/market-news-france,2020-01-01,year,"Business Intelligence, Information Services, Market Research","Asia, Tennessee, United States",We offer contemporary enterprise & marketplace information from the globe that lets you stay updated with distinct information.,"3,232,268",,Active,,,,,For Profit,https://marketnews.fr/,,,,,Southern US,,,,,,,,,,,,,,,,,"Data and Analytics, Design, Information Technology",,,,,,,,,,,,,,,,,,,,,,,,,,,,,,Private,,,,,,,,,,,,,,,3,,,,,,,,,,
Los Angeles Performance Therapy,https://www.crunchbase.com/organization/los-angeles-performance-therapy,2018-01-01,year,"Health Care, Hospital, Medical, Therapeutics","Los Angeles, California, United States",Los Angeles Performance Therapy provides stress management and career counseling services.,"3,232,263",Less than $1M,Active,,,,,For Profit,https://laperformancetherapy.com,https://twitter.com/laptherapy,,"Los Angeles Performance Therapy currently it can feel tough to keep a positive attitude. A lot of the information that come across is designed to amplify present regrets or future fears. A bridge to the present is mindfulness training. It can aid in clearing away the thoughts of fear and regret so that can concentrate on what is truly taking place. It can aid us in coping with the matters over which that actually do have some control and in making important choices for the own well being. They work with clients to manage stress, produce a healthy mood, and improve their self care, relationship, and labor practices using a caring, mindfulness based approach.",,"Greater Los Angeles Area, West Coast, Western US",,,,,,,,,,,,,,,,,Health Care,,,1-10,,,,,,,,,,,,,,,,,,,,,,,,,,,Private,,,,,,,,,,,,,,,,,,,,,,,,,
Zoek US,https://www.crunchbase.com/organization/zoek-us,2020-01-01,year,"Employment, Recruiting","Sheridan, Wyoming, United States",The US' fastest growing online job board,"3,232,220",,Active,,,,,For Profit,https://zoek.us/,https://twitter.com/Zoek_US,https://www.linkedin.com/company/69988680,,https://www.facebook.com/ZoekUSA/,Western US,,,,,,,,,,,,,,,,,Professional Services,,,1-10,,,,,,,,,,,,,,,,,,,,,,,,,,,Private,,,,,,,,,,,,,,,7,,,,,,,,,,
Create Place Inc,https://www.crunchbase.com/organization/create-place-inc,2020-01-07,day,,"Portland, Oregon, United States",CREATE PLACE INC is a full-service digital agency that is dedicated to growing your business online through website design and development,"3,231,992",,Active,,,,,For Profit,https://createplaceinc.com,https://twitter.com/createplaceinc,https://www.linkedin.com/in/createplace-inc-29479a1a8/,CREATE PLACE INC is a full-service digital agency that is dedicated to growing your business online through website design and development,,"West Coast, Western US",,,,,,,,,,,,,,,,,,,,1-10,,,,,,,,,,,,,,,,,,,,,,,,,,,Private,,,,,,,,,,,,,,,1,,,,,,,,,,
ProWomen's Choice Directory Yellow Pages,https://www.crunchbase.com/organization/prowomen-s-choice-directory-yellow-pages,2019-01-01,year,"Advertising, Media and Entertainment, Online Portals","Sacramento, California, United States","PWCD blends the yellow pages' accessibility with online networking, offering all the tools needed for effective and targeted advertising.","3,231,818",,Active,,,,,For Profit,https://www.prowomenschoicedirectory.com,https://www.twitter.com/fromPWCD,https://www.linkedin.com/company/prowomenschoicedirectory/,,,"West Coast, Western US",,,,,,,,,,,,,,,,,"Advertising, Internet Services, Media and Entertainment, Sales and Marketing",,,1-10,,,,,,,,,,,,,,,,,,,,,,,,,,,Private,,,,,,,,,,,,,,,2,,,,,,,,,,
Qwerno,https://www.crunchbase.com/organization/qwerno,2018-01-01,year,"Professional Services, Software","Henderson, Nevada, United States",Qwerno specializes in creating software for a variety of tasks.,"3,231,769",Less than $1M,Active,,,,,For Profit,https://www.qwerno.com,,https://www.linkedin.com/company/qwerno/,,,Western US,,,,,,,,,,,,,,,,,"Other, Software",,,1-10,,,,,,,,,,,,,,,,,,,,,,,,,,,Private,,,,,,,,,,,,,,,1,,,,,,,,77158,USD,77158
ICE South,https://www.crunchbase.com/organization/ice-south,2018-03-01,month,"Advertising, Consulting, Marketing","Macon, Georgia, United States","ICE South is a Macon, GA based marketing and sales firm focused on developing and building the leadership of tomorrow.","3,231,721",,Closed,,,,none,For Profit,http://www.icesouthmacon.com/,https://twitter.com/ICESouthMacon,https://www.linkedin.com/company/icesouth/,"ICE South is a Macon, GA based marketing and sales firm focused on developing and building the leadership of tomorrow. Every person has the ability to create their own future and it’s our goal to help each person we come into contact with on developing their best opportunities. Stay tuned to learn more about ICE South as we grow and become more part of the Macon community.",https://www.facebook.com/ICEsouth/,"East Coast, Southern US",,,,,,,,,,,,,,,,,"Advertising, Professional Services, Sales and Marketing",,,11-50,,,,,,,,,,,,,,,,,,,,,,,,,,,Private,,,,,,,,,,,,,,,6,,,,,,,,,,
New World Synergy,https://www.crunchbase.com/organization/new-world-synergy,2018-01-01,year,"Advertising, Marketing, Retail","Raleigh, North Carolina, United States","New World Synergy is a retail agency that works with brands to position, promote, then grow their businesses.","3,231,459",,Active,,,,,For Profit,https://www.newworldsynergy.us/,,https://www.linkedin.com/company/new-world-synergy-llc,"New World Synergy is a retail agency that works with brands to position, promote, then grow their businesses.",,"Research Triangle, East Coast, Southern US",,,,,,,,,,,,,,,,,"Advertising, Commerce and Shopping, Sales and Marketing",1,Malik McCray,1-10,,,,,,,,,,,,,,,,,,,,,,,,,,,Private,,,,,,,,,,,,,,,1,,,,,,,,,,
Digital Alchemy Mediaworks,https://www.crunchbase.com/organization/digital-alchemy-mediaworks,2020-01-01,year,"Brand Marketing, Broadcasting, Digital Marketing, Internet, Social Media","Middletown, Pennsylvania, United States","Digital Alchemy Mediaworks helps small businesses in online marketing, branding, virtual courses, and live broadcast media.","3,231,438",,Active,,,,,For Profit,https://www.digitalalchemymedia.com,,,,,"Great Lakes, Northeastern US",,,,,,,,,,,,,,,,,"Internet Services, Media and Entertainment, Sales and Marketing, Video",,,,,,,,,,,,,,,,,,,,,,,,,,,,,,Private,,,,,,,,,,,,,,,4,,,,,,,,,,
English Leather Jackets,https://www.crunchbase.com/organization/english-leather-jackets,2018-11-15,day,"E-Commerce, Fashion, Lifestyle","New York, New York, United States",English Leather Jackets makes premium real leather jackets starting from 169$. If you are looking for real leather jackets and you feel comf,"3,231,406",,Closed,,,,none,For Profit,https://www.englishleatherjackets.com/,https://twitter.com/EnglishJackets?lang=en,,English Leather Jackets makes premium real leather jackets starting from 169$. If you are looking for real leather jackets and you feel comfortable wearing leather jackets English Leather Jackets is for you. English Leather Jackets is a best place to buy genuine leather jackets and coats.,,"Greater New York Area, East Coast, Northeastern US",,,,,,,,,,,,,,,,,"Clothing and Apparel, Commerce and Shopping, Community and Lifestyle, Design",,,1-10,,,,,,,,,,,,,,,,,,,,,,,,,,,Private,,,,,,,,,,,,,,,1,,,,,,,,,,
Awakened Innovations,https://www.crunchbase.com/organization/awakened-innovations,2018-03-01,month,Internet,"Cincinnati, Ohio, United States","We help nonprofits pursue their mission by connecting them with the high-quality, vetted, service-providers they need.","3,231,399",,Active,,,,,For Profit,https://www.awakenedinnovations.com,,https://www.linkedin.com/company/awakened-innovations/,,,"Great Lakes, Midwestern US",,,,,,,,,,,,,,,,,Internet Services,,,1-10,,,,,,,,,,,,,,,,,,,,,,,,,,,Private,,,,,,,,,,,,,,,10,,,,,,,,,,
Helix Gateway,https://www.crunchbase.com/organization/helix-gateway,2020-10-20,day,,"Atlanta, Georgia, United States",A gateway to enable mass personalization using DNA Behavior's 'behavioral chip' technology,"3,231,379",,Active,,,,,For Profit,,,,,,"Greater Atlanta Area, East Coast, Southern US",,,,,,,,,,,,,,,,,,,,11-50,,,,,,,,,,,,,,,,,,,,,,,,,,,Private,,,,,,,,,,,,,,,,,,,,,,,,,
CBD Association,https://www.crunchbase.com/organization/cbd-association,2019-01-01,year,"Advice, Business Development, Education, Non Profit","Washington, District of Columbia, United States",CBD Association is an association that serves for CBD and cannabinoid industries.,"3,231,377",$1M to $10M,Active,,,,,Non-profit,https://www.cbdassoc.org ,,https://www.linkedin.com/company/gocbda/ ,"CBD Association is an association that educates the government and private sector to generate an environment for the cannabinoid industries. They serve for CBD and cannabinoid industries. They support and represent the growers, processors, suppliers, manufacturers, and retailers of CBD and cannabinoid products.",https://www.facebook.com/GoCBDA/,"Washington DC Metro Area, Southern US",,,,,,,,,,,,,,,,,"Education, Media and Entertainment, Other, Professional Services, Social Impact",,,11-50,,,,,,,,,,,,,,,,,,,,,,,,,,,Private,,,,,,,,,,,,,,,,,,,,,,,,,
Opinari Compliance Solutions,https://www.crunchbase.com/organization/opinari-compliance-solutions,2018-01-01,year,,"Chester, New Jersey, United States","Opinari Compliance Solutions provides global governance, compliance, ethics, privacy, and information management consulting solutions.","3,231,334",,Active,,,,,For Profit,https://opinaricompliance.com/,,https://www.linkedin.com/company/opinaricompliance/,,,"Greater New York Area, East Coast, Northeastern US",,,,,,,,,,,,,,,,,,,,,,,,,,,,,,,,,,,,,,,,,,,,,,,Private,,,,,,,,,,,,,,,,,,,,,,,,,
Marzia Khanum,https://www.crunchbase.com/organization/marzia-khanum,2022-04-20,day,,"Chicago, Illinois, United States","I'm a blogger and having knowledge of SEO techniques, Article writing and many more. So I will post related to digital marketing ideas.","3,231,137",,Active,,,,,Non-profit,https://digital-marketing-21.blogspot.com/,,https://www.linkedin.com/in/marzia-khanum-a92807254/,Article writer Blogger SEO Expert Advertising,https://web.facebook.com/profile.php?id=100087113169433,"Greater Chicago Area, Great Lakes, Midwestern US",,,,,,,,,,,,,,,,,,,,1-10,,,,,,,,,,,,,,,,,,,,,,,,,,,Private,,,,,,,,,,,,,,,23,,,,,,,,,,
CpaForMoney,https://www.crunchbase.com/organization/cpaformoney,2019-01-01,year,"Advertising, Marketing, Small and Medium Businesses","Longview, Texas, United States",CpaForMoney is an affiliate marketing network that specializes in CPA/CPL/CPC models.,"3,230,776",$1M to $10M,Active,,,,,For Profit,http://cpaformoney.com,https://www.twitter.com/cpaformoney,https://www.linkedin.com/company/cpaformoney2,,https://www.facebook.com/cpaformoney,Southern US,,,,,,,,,,,,,,,,,"Advertising, Other, Sales and Marketing",,,11-50,,,,,,,,,,,,,,,,,,,,,,,,,,,Private,,,,,,,,,,,,,,,4,,,,,,,,,,
Makespace,https://www.crunchbase.com/organization/makespace-29f4,2018-01-01,year,,"Chicago, Illinois, United States",Makespace offers full-service storage as well as pickup and delivery.,"3,230,509",,Closed,,,,none,For Profit,http://makespacechi.org/,,https://www.linkedin.com/company/makespacechi/,,,"Greater Chicago Area, Great Lakes, Midwestern US",,,,,,,,,,,,,,,,,,,,,,,,,,,,,,,,,,,,,,,,,,,,,,,Private,,,,,,,,,,,,,,,,,,,,,,,,,
Xchange Post,https://www.crunchbase.com/organization/xchange-post,2019-01-02,day,"Communities, E-Commerce, Internet","Charlotte, North Carolina, United States",Community Rental Platform,"3,230,392",Less than $1M,Active,,,,,For Profit,https://xchangepost.com,https://twitter.com/xchangepost,https://www.linkedin.com/company/xchange-post,Xchange Post is a technology based platform that allows users to rent tools and equipment and have their items delivered to their doorstep.,https://www.facebook.com/pg/xchangepost/,"East Coast, Southern US",,,,,,,,,,,,,,,,,"Commerce and Shopping, Community and Lifestyle, Internet Services",,,1-10,,,,,,,,,,,,,,,,,,,,,,,,,,,Private,,,,,,,,,,,,,1,,5,,,,,,,,,,
Pacific Coast Market,https://www.crunchbase.com/organization/pacific-coast-market,2018-01-04,day,Fitness,"Oxnard, California, United States",Direct Marketing Sports and Fitness ,"3,230,248",,Active,,,,,For Profit,,,,PCM a company founded on the premise that even senior citizens need to be active. Create a lifestyle to be fit and active everyday with a personal trainer by your side 24/7.,,"Greater Los Angeles Area, West Coast, Western US",,,,,,,,,,,,,,,,,Sports,,,1-10,,,,,,,,,,,,,,,,,,,,,,,,,,,Private,,,,,,,,,,,,,,,,,,,,,,,,,
GiveRoll,https://www.crunchbase.com/organization/giveroll,2019-05-15,day,Financial Services,"San Francisco, California, United States",A Better Way to Give Back,"3,229,876",,Active,,,,,Non-profit,https://www.giveroll.org,,,"We created GiveRoll to make it easier for everyday donors to have an impact on the issues they care about most. By identifying the highest impact charities for each cause, we are removing the doubt of whether your money is truly making a difference. By combining individual portfolios into a focused fund, we are able to provide one-time monthly donations charities can rely on. This reduces their administrative costs, meaning your donation dollars go further.",,"San Francisco Bay Area, West Coast, Western US",,,,,,,,,,,,,,,,,Financial Services,1,Nikos Sarilakis,1-10,,,,,,,,,,,,,,,,,,,,,,,,,,,Private,,,,,,,,,,,,,,,7,,,,,,,,,,
Whole House Generators,https://www.crunchbase.com/organization/whole-house-generators,2018-07-10,day,,"New York, New York, United States",Standby generators technicians,"3,229,696",,Active,,,,,For Profit,https://www.wholehousegenerator.reviews/,https://twitter.com/GeneratorsWhole,,,https://www.facebook.com/pg/Whole-House-Generators-285377945618170/about/,"Greater New York Area, East Coast, Northeastern US",,,,,,,,,,,,,,,,,,,,1-10,,,,,,,,,,,,,,,,,,,,,,,,,,,Private,,,,,,,,,,,,,,,1,,,,,,,,,,
Jetsyt,https://www.crunchbase.com/organization/jetsyt,2020-01-01,year,"Financial Services, Internet, Travel","Brooklyn, New York, United States",Jetsyt provides technology to overcome the financial obstacles that prevent people from travelling and engaging with the rest of the world.,"3,229,662",,Active,,,,,For Profit,https://www.jetsyt.com/,,https://www.linkedin.com/company/jetsyt/,,https://www.facebook.com/jetsytaway/,"Greater New York Area, East Coast, Northeastern US",,,,,,,,,,,,,,,,,"Financial Services, Internet Services, Travel and Tourism",,,1-10,,,,,,,,,,,,,,,,,,,,,,,,,,,Private,,,,,,,,,,,,,,,,,,,,,,,,,
OurCorner,https://www.crunchbase.com/organization/ourcorner,2020-08-01,month,,"Philadelphia, Pennsylvania, United States",We are a Sass company that provide associations a simple and easy to use platform to help run their corner of the world.,"3,229,630",,Active,,,,,For Profit,https://ourcorner.io,,,,,"Greater Philadelphia Area, Great Lakes, Northeastern US",,,,,,,,,,,,,,,,,,,,1-10,,,,,,,,,,,,,,,,,,,,,,,,,,,Private,,,,,,,,,,,,,,,7,,,,,,,,,,
The Goodness Collaborative,https://www.crunchbase.com/organization/the-goodness-collaborative,2019-01-01,year,"Communities, Consulting, Management Consulting","Portland, Oregon, United States",The Goodness Collaborative is a strategic management agency that specializes in helping individuals and businesses navigate transitions.,"3,229,139",,Active,,,,,For Profit,https://www.thegoodnesscollaborative.com,,https://www.linkedin.com/company/the-goodness-collaborative,,https://www.facebook.com/thegoodnesscollaborative,"West Coast, Western US",,,,,,,,,,,,,,,,,"Community and Lifestyle, Professional Services",,,1-10,,,,,,,,,,,,,,,,,,,,,,,,,,,Private,,,,,,,,,,,,,,,5,,,,,,,,,,
Powell Butte Custom Homes,https://www.crunchbase.com/organization/powell-butte-custom-homes,2021-09-01,day,,"Powell Butte, Oregon, United States",Custom home builder | DEQ Certified septic system installer,"3,228,973",,Active,,,,,For Profit,https://powellbuttecustomhomes.com,,,Custom home builder | DEQ certified septic installer in Central Oregon,https://www.facebook.com/powellbuttecustomhomes/,"West Coast, Western US",,,,,,,,,,,,,,,,,,,,1-10,,,,,,,,,,,,,,,,,,,,,,,,,,,Private,,,,,,,,,,,,,,,,,,,,,,,,,
BeyoutyTech,https://www.crunchbase.com/organization/organoglam,2019-01-01,month,"Beauty, Cosmetics, E-Commerce","Brooklyn, New York, United States",Personalization As A Service,"3,228,949",,Closed,,,2020-03-01,month,For Profit,https://www.beyoutytech.com,https://twitter.com/beyouty_tech,https://www.linkedin.com/company/beyoutytech/,"An omnichannel hardware and software personalization platform, seamlessly integrated to enhance beauty retail experience.",https://www.facebook.com/beyoutytech/,"Greater New York Area, East Coast, Northeastern US",,,,,,,,,,,,,,,,,"Commerce and Shopping, Consumer Goods",1,Nicole Faraji,1-10,,,,,,,,,,,,,,,,,,,,,,,,,,,Private,,,,,,,,,,,,,,,13,,,,,,,,,,
Bloqdrop,https://www.crunchbase.com/organization/bloqdrop,2019-01-01,year,"Internet, QR Codes","Chicago, Illinois, United States",Bloqdrop sharing socials profiles by using dynamic QR-Codes should be easy by opening mobile cameras.,"3,228,500",,Active,,,,,For Profit,https://bloqdrop.com/,https://twitter.com/bloqdrop/,https://www.linkedin.com/company/bloqdrop/,Bloqdrop is a provider of QR code-based digital business cards. Easily link and share any and all of your social accounts via dynamic QR code or link.,https://www.facebook.com/bloqdrop/,"Greater Chicago Area, Great Lakes, Midwestern US",,,,,,,,,,,,,,,,,"Internet Services, Software",1,Evan Luza,1-10,,,,,,,,,,,,,,,,,,,,,,,,,,,Private,,,,,,,,,,,,,,,4,,,,,,,,,,
IAVWTR,https://www.crunchbase.com/organization/iavwtr,2018-01-01,year,,"Washington, District of Columbia, United States",IAVWTR verifies traders' prior trade and financial records for transparency in new international trade relationships.,"3,228,484",,Active,,,,,For Profit,https://iavwtr.org/,https://twitter.com/iavwtr,http://linkedin.com/company/iavwtr,,https://facebook.com/iavwtr,"Washington DC Metro Area, Southern US",,,,,,,,,,,,,,,,,,,,101-250,,,,,,,,,,,,,,,,,,,,,,,,,,,Private,,,,,,,,,,,,,,,1,,,,,,,,,,
Juug Bottles,https://www.crunchbase.com/organization/juug-bottles,2020-03-01,month,,"Atlanta, Georgia, United States",We design bottles for the everyday hustle of goal setters and go-getters.,"3,228,402",,Active,,,,,For Profit,http://www.juugbottles.com,https://twitter.com/JuugBottles,https://www.linkedin.com/company/juugbottles/,We design bottles for the everyday hustle of goal setters and go-getters.,https://www.facebook.com/JuugBottles/,"Greater Atlanta Area, East Coast, Southern US",,,,,,,,,,,,,,,,,,,,1-10,,,,,,,,,,,,,,,,,,,,,,,,,,,Private,,,,,,,,,,,,,,,,,,,,,,,,,
CollegePoosh,https://www.crunchbase.com/organization/collegepoosh,2018-01-01,day,,"Scottsdale, Arizona, United States",You Search. We Poosh.,"3,228,394",,Closed,,,,none,For Profit,http://www.collegepoosh.com,,,"Using technology to connect learners with educational institutions, regardless of social or economic disadvantages.",,"Greater Phoenix Area, Western US",,,,,,,,,,,,,,,,,,,,1-10,,,,,,,,,,,,,,,,,,,,,,,,,,,Private,,,,,,,,,,,,,,,3,,,,,,,,,,
Sound Private Wealth,https://www.crunchbase.com/organization/sound-private-wealth,2020-01-01,month,"Advice, Finance, Financial Services, Wealth Management","Massapequa, New York, United States",Sound Private Wealth is a finance firm that offers wealth management strategies for both individuals and businesses.,"3,228,367",$1M to $10M,Active,,,,,For Profit,https://www.soundprivatewealth.com,,https://www.linkedin.com/company/sound-private-wealth,,,"Greater New York Area, East Coast, Northeastern US",,,,,,,,,,,,,,,,,"Financial Services, Media and Entertainment",,,11-50,,,,,,,,,,,,,,,,,,,,,,,,,,,Private,,,,,,,,,,,,,,,2,,,,,,,,,,
Treasure Coast Surgical Services,https://www.crunchbase.com/organization/treasure-coast-surgical-services,2018-01-01,year,"Health Care, Medical","Tucson, Arizona, United States",Treasure Coast Surgical Services is provides health care services.,"3,228,069",,Active,,,,,For Profit,,,,Treasure Coast Surgical Services is provides health care services.,,Western US,,,,,,,,,,,,,,,,,Health Care,,,,1,Seed,2018-10-30,,,,Seed,,,,Seed,,USD,,,USD,,,,,,,,,,,Private,,,,,,,,,,,,,,,,,,,,,,,,,
