BlueHuki,https://www.crunchbase.com/organization/bluehuki,2022-07-08,day,Marketing,"Falls Church, Virginia, United States",Digital marketing firm based in the Washington DC area,"2,392,659",,Active,,,,,For Profit,https://bluehuki.com,,,,https://www.facebook.com/bluehuki,"Washington DC Metro Area, East Coast, Southern US",,,,,,,,,,,,,,,,,Sales and Marketing,1,Heather Pressler,1-10,,,,,,,,,,,,,,,,,,,,,,,,,,,Private,,,,,,,,,,,,,,,,,,,,,,,,,
Henderson Wealth Management,https://www.crunchbase.com/organization/henderson-179d,2018-01-01,year,"Advice, Consulting, Financial Services, Retirement, Wealth Management","El Segundo, California, United States","Henderson Wealth Management specializes in wealth management, investment advisory, retirement and asset allocation services.","2,392,577",,Active,,,,,For Profit,https://hwm90.com/,,https://www.linkedin.com/company/hendersonwealthmanagement/,,https://www.facebook.com/HendersonWealthManagement/,"Greater Los Angeles Area, West Coast, Western US",,,,,,,,,,,,,,,,,"Community and Lifestyle, Financial Services, Media and Entertainment, Other, Professional Services",,,1-10,,,,,,,,,,,,,,,,,,,,,,,,,,,Private,,,,,,,,,,,,,,,7,,,,,,,,,,
HDQ Wealth,https://www.crunchbase.com/organization/hdq-wealth,2019-01-01,year,"Advice, Financial Services, Insurance, Retirement, Wealth Management","Kansas City, Missouri, United States","HDQ Wealth provides investment management, business consultation, cash flow, insurance, and financial planning services.","2,392,416",,Active,,,,,For Profit,https://hdqwealth.com,https://twitter.com/hdqwealth,https://www.linkedin.com/company/hdq-wealth,,https://www.facebook.com/hdqwealth,Midwestern US,,,,,,,,,,,,,,,,,"Community and Lifestyle, Financial Services, Media and Entertainment, Other",,,1-10,,,,,,,,,,,,,,,,,,,,,,,,,,,Private,,,,,,,,,,,,,,,,,,,,,,,,,
Mom Needs A Break Cleaning,https://www.crunchbase.com/organization/mom-needs-a-break-cleaning,2019-01-01,year,"Commercial, Janitorial Service, Residential","San Antonio, Texas, United States",Mom Needs A Break Cleaning is a cleaning company that offers residential and commercial services.,"2,392,375",,Active,,,,,For Profit,https://momneedsabreakcleaning.com,,https://www.linkedin.com/company/mom-needs-a-break-cleaning/,"Mom Needs A Break Cleaning is a home- or business-cleaning company. They provide office cleaning, residential cleaning, commercial cleaning, property management cleaning, real estate cleaning, office building cleaning, apartment cleaning, and dealership cleaning.",,Southern US,,,,,,,,,,,,,,,,,"Other, Real Estate",,,11-50,,,,,,,,,,,,,,,,,,,,,,,,,,,Private,,,,,,,,,,,,,,,,,,,,,,,,,
WeKonnect.cloud,https://www.crunchbase.com/organization/wekonnect-cloud,2020-12-20,day,"Real Estate, SaaS","Miami, Florida, United States","WeKonnect is an online real estate SAAS platform and is intended for making every step of a real estate transaction, a bit more effortless.","2,392,299",,Active,,,,,For Profit,http://wekonnect.cloud,,https://www.linkedin.com/company/wekonnectcloud/?viewAsMember=true,"To align with our client’s goals, our purpose is to help real estate professionals develop and grow sustainable businesses. Our mission – or the way we will accomplish our purpose – is to provide real estate agents with the ultimate managerial platform. Every step we take is intended to help our clients move closer to achieving their highest goals and ambitions.",,"Greater Miami Area, East Coast, Southern US",,,,,,,,,,,,,,,,,"Real Estate, Software",1,Avraham Ilyayev,1-10,,,,,,,,,,,,,,,,,,,,,,,,,,,Private,,,,,,,,,,,,,,,10,,,,,,,,,,
ALLOW Wellness,https://www.crunchbase.com/organization/allow-wellness,2019-01-01,year,"Health Care, Medical, Wellness","Chicago, Illinois, United States",ALLOW Wellness is a healthcare organization that provides psychotherapy services.,"2,392,297",$1M to $10M,Active,,,,,For Profit,https://www.allow-wellness.com,,https://www.linkedin.com/company/allow-wellness,,https://www.facebook.com/allowwellness,"Greater Chicago Area, Great Lakes, Midwestern US",,,,,,,,,,,,,,,,,Health Care,1,Sarah E. Sanders,11-50,,,,,,,,,,,,,,,,,,,,,,,,,,,Private,,,,,,,,,,,,,,,3,,,,,,,,,,
Citizens for America,https://www.crunchbase.com/organization/citizens-for-america,2021-01-01,year,"Events, Non Profit, Training","Memphis, Tennessee, United States",Citizens for America is an organization that serves as an advocate for christian conservative principles.,"2,392,154",,Active,,,,,Non-profit,https://www.citizensforamericafoundation.com,https://twitter.com/Citizensfor_USA,https://www.linkedin.com/company/citizens-for-america,,https://www.facebook.com/citizensforamericafoundation,Southern US,,,,,,,,,,,,,,,,,"Education, Events, Media and Entertainment, Other, Social Impact",1,Chris Hughes,11-50,,,,,,,,,,,,,,,,,,,,,,,,,,,Private,,,,,,,,,,,,,,,3,,,,,,,,,,
Skyline & Co.,https://www.crunchbase.com/organization/skyline-co,2019-01-01,year,"Catering, Event Management, Events","Kansas City, Missouri, United States","Skyline & Co. offers venues, party planning, event planning, and catering services for weddings, parties, and corporate events.","2,392,065",,Active,,,,,For Profit,https://skylineandco.com,,https://www.linkedin.com/company/skylineandco,,https://www.facebook.com/SkylineandCompany,Midwestern US,,,,,,,,,,,,,,,,,"Events, Food and Beverage, Media and Entertainment",,,11-50,,,,,,,,,,,,,,,,,,,,,,,,,,,Private,,,,,,,,,,,,,,,25,,,,,,,,,,
Voice Meetup Switzerland,https://www.crunchbase.com/organization/voice-meetup-switzerland,2018-01-01,year,"Developer APIs, Online Portals, Software","Little Switzerland, North Carolina, United States",Voice Meetup Switzerland is a software development company that offers a platform to exchange voice user interfaces for corporates.,"2,391,896",$1M to $10M,Active,,,,,For Profit,https://voicemeetup.ch/,https://twitter.com/voicemeetupCH,https://www.linkedin.com/company/voicemeetupswitzerland/,,,"East Coast, Southern US",,,,,,,,,,,,,,,,,"Internet Services, Software",,,1-10,,,,,,,,,,,,,,,,,,,,,,,,,,,Private,,,,,,,,,,,,,,,2,,,,,,,,,,
EM Corporate Solutions,https://www.crunchbase.com/organization/em-corporate-solutions-llc,2018-06-22,day,Accounting,"West Columbia, South Carolina, United States","EM Corporate Solutions offers tax reduction strategies, bookkeeping, and payroll services for small businesses and high-net individuals.","2,391,851",,Active,,,,,For Profit,https://EMCorporateSolutions.com,,https://www.linkedin.com/in/timothyhillian/,"EM Corporate Solutions offers tax reduction strategies, bookkeeping, and payroll services for small businesses and high-net individuals.",https://www.facebook.com/EMCorporateSolutionsLLC,"East Coast, Southern US",,,,,,,,,,,,,,,,,"Financial Services, Professional Services",,,1-10,,,,,,,,,,,,,,,,,,,,,,,,,,,Private,,,,,,,,,,,,,,,2,,,,,,,,,,
OpenedOrNot by 500apps,https://www.crunchbase.com/organization/openedornot-by-500apps,2018-05-01,day,Software,"New York, New York, United States",OpenedOrNot by 500apps is an email tracking extension that allows you to track emails you have sent.,"2,391,844",,Active,,,,,Non-profit,https://openedornot.com/,,,"OpenedOrNot  by 500apps is an email tracking extension for Chrome web browser that allows users to track the status of their sent emails. The extension adds an icon to the Gmail interface that indicates when an email has been sent, received, and read. It also provides a notification when the email is opened. Features: Email tracking- Get notified as soon as your email is read by the recipient. The subject of the email, the recipient's information, and the time are all included in your notification. Read Receipt- Receive read receipts when recipients open an email on their desktop. When an email is sent, you'll see a single green checkmark, and when it is opened, you'll see a double green checkmark. Link-click Tracking- Link-click displays which emails were opened and which links were clicked. It shows how many times each link was clicked. Daily Reports- Access detailed reports on your tracked emails. Tracked emails, read emails, overall read count, and unread emails can all be viewed.",,"Greater New York Area, East Coast, Northeastern US",,,,,,,,,,,,,,,,,Software,,,251-500,,,,,,,,,,,,,,,,,,,,,,,,,,,Private,,,,,,,,,,,,,,-32.56%,3,,,,,,,,,,
Unicorn Vodka,https://www.crunchbase.com/organization/unicorn-vodka,2020-01-01,year,"Brewing, Food and Beverage, Wine And Spirits","Seattle, Washington, United States",Unicorn Vodka expertise in producing organic and color-changing cocktails.,"2,391,825",,Active,,,,,For Profit,https://unicorn.vodka/,https://twitter.com/unicornvodkausa,https://www.linkedin.com/company/unicornvodka/,,,"Greater Seattle Area, West Coast, Western US",,,,,,,,,,,,,,,,,Food and Beverage,,,1-10,,,,,,,,,,,,,,,,,,,,,,,,,,,Private,,,,,,,,,,,,,,,23,,,,,,,,,,
CannaVentures of West Virginia,https://www.crunchbase.com/organization/cannaventures-of-west-virginia,2018-01-01,year,"Industrial, Oil and Gas, Product Design","Bridgeport, Connecticut, United States",CVWV is an integrated seed-to-sale operation and established by local third-generation farmers.,"2,391,818",$1M to $10M,Active,,,,,For Profit,https://cannaventuresofwv.com/,,,,https://www.facebook.com/CVWVLAB/,"East Coast, New England, Northeastern US",,,,,,,,,,,,,,,,,"Design, Energy, Manufacturing, Natural Resources",,,11-50,,,,,,,,,,,,,,,,,,,,,,,,,,,Private,,,,,,,,,,,,,,,7,,,,,,,,,,
Stables,https://www.crunchbase.com/organization/stables,2020-01-01,year,FinTech,"Fort Worth, Texas, United States",KYC and AML compliant digital cash management utilizing stablecoin only liquidity pools,"2,391,816",,Active,,,,,For Profit,https://thestables.io,https://twitter.com/thestablesio,,Earn More % APY On Stablecoin Only Liquidity Pools. Not everyone needs to go to moon or wants to experience the wild volatile crypto markets. The Stables.io focus is to safely earn the most for you and or your client’s short-term cash. Utilizing ONLY digital stablecoin on stablecoin liquidity pools.,,"Dallas/Fort Worth Metroplex, Southern US",,,,,,,,,,,,,,,,,Financial Services,,,1-10,,,,,,,,,,,,,,,,,,,,,,,,,,,Private,,,,,,,,,,,,,,,2,,,,,,,,,,
Eide Chrysler Zumbrota,https://www.crunchbase.com/organization/eide-chrysler-zumbrota,2020-01-01,year,"Automotive, Finance, Sales","Zumbrota, Minnesota, United States",Eide Chrysler Zumbrota is a motor vehicle dealer that sells new and preowned cars.,"2,391,807",$1M to $10M,Active,,,,,For Profit,https://zumbrotacdjr.com,,https://www.linkedin.com/company/eide-chrysler-zumbrota,"Eide Chrysler Zumbrota is a dealer for cars, SUVs, sedans, hybrids, and trucks. The company is a retail automotive parts dealer, and provides car repair and maintenance services. Their services include automotive financing, automotive service, automotive parts, and automotive accessories.",https://www.facebook.com/EideZumbrota/,"Great Lakes, Midwestern US",,,,,,,,,,,,,,,,,"Financial Services, Sales and Marketing, Transportation",,,11-50,,,,,,,,,,,,,,,,,,,,,,,,,,,Private,,,,,,,,,,,,,,-1.73%,9,,,,,,,,,,
CredTALENT,https://www.crunchbase.com/organization/credtalent,2022-01-01,year,"Health Care, Human Resources, Management Consulting, Recruiting, Staffing Agency","Fort Thomas, Kentucky, United States","From searching, and screening, to hiring and retaining, CredTALENT will empower you to focus on what matters the most.","2,391,745",,Active,,,,,For Profit,https://www.credtalent.com/,,https://www.linkedin.com/company/credtalent,"Great Talent is scarce. Hiring top Talent can propel you forward; they will take highly complex jobs and deliver greater value. Also, they will draw the line between good success and great success. CredTALENT makes that happen. Our proven recruiting, hiring, and staffing processes ensure that top Talent delivers greater results than B+ Talent. From searching, and screening, to hiring and retaining, CredTALENT will empower you to focus on what matters the most - Increasing access to comprehensive, high-quality healthcare services.",,Southern US,,,,,,,,,,,,,,,,,"Administrative Services, Health Care, Professional Services",,,11-50,,,,,,,,,,,,,,,,,,,,,,,,,,,Private,,,,,,,,,,,,,,,5,,,,,,,,,,
AIM Recovery Center,https://www.crunchbase.com/organization/aim-recovery-center,2020-01-01,year,"Addiction Treatment, Health Care, Therapeutics, Wellness","Dickinson, Texas, United States","Aim Recovery Center provides addiction recovery programs and treatments, group therapy, counseling sessions, recreation, and exercises.","2,391,727",Less than $1M,Closed,,,,none,For Profit,https://aimrecoverycenter.com/,https://twitter.com/aim_recovery,https://www.linkedin.com/company/aim-recovery-center/,,https://www.facebook.com/Aim.Recovery.Center,"Greater Houston Area, Southern US",,,,,,,,,,,,,,,,,Health Care,,,11-50,,,,,,,,,,,,,,,,,,,,,,,,,,,Private,,,,,,,,,,,,,,,6,,,,,,,,,,
Oceans Filmworks,https://www.crunchbase.com/organization/oceans-filmworks,2018-01-01,year,"Film, Film Production, Media and Entertainment, TV Production","New York, New York, United States",Oceans Filmworks is a media production company that offers feature film production services with stories.,"2,391,709",$1M to $10M,Active,,,,,For Profit,https://www.oceansfilmworks.com/,,https://www.linkedin.com/company/oceans-filmworks/,,,"Greater New York Area, East Coast, Northeastern US",,,,,,,,,,,,,,,,,"Media and Entertainment, Video",,,11-50,,,,,,,,,,,,,,,,,,,,,,,,,,,Private,,,,,,,,,,,,,,,2,,,,,,,,,,
PlayShare,https://www.crunchbase.com/organization/playshare,2018-08-13,day,"Developer APIs, File Sharing, Messaging, Software, Unified Communications, Video Chat, Web Apps","Atlanta, Georgia, United States",Webapp and software library that connects people and then allows them to communicate directly without requiring a server as an intermediary,"2,391,613",$10M to $50M,Active,,,,,For Profit,https://webcameron-playshare.appspot.com/,,https://www.linkedin.com/company/playshare/,,,"Greater Atlanta Area, East Coast, Southern US",,,,,,,,,,,,,,,,,"Apps, Information Technology, Internet Services, Messaging and Telecommunications, Software",,,1-10,,,,,,,,,,,,,,,,,,,,,,,,,,,Private,,,,,,,,,,,,,,,6,,,,,,,,,,
Just Maps,https://www.crunchbase.com/organization/just-maps,2019-01-01,year,"Art, Consumer Goods, Professional Services","San Francisco, California, United States","Just Maps is a 3D laser-cut wooden maps manufacturer with renewable bamboo, oak, and cherry.","2,391,610",,Active,,,,,For Profit,https://prints.justmaps.com,https://twitter.com/justmapsdotcom,https://www.linkedin.com/company/justmapsdotcom/about/,"The Just Maps line is a collection of museum-quality poster prints and 3D laser-cut wooden maps that feature unique details crafted from bamboo, oak, and cherry. They provide posters that are museum-quality and printed on thick, long-lasting matte paper. These posters can brighten any area and make an excellent addition to your room or office. They also have framed map prints available that are ready to hang in any room. Cutting wood in three dimensions Industrial-grade laser cutting machines are used to create the maps. The exposed screw heads and simplistic design with a built-in frame give them a lovely appearance. The natural grain of the wood gives them a gorgeous appearance. They are the perfect accent to any area, whether you are trying for a rustic or modern style. The oceans, lakes, and rivers have a cherry layer with exquisite natural wood patterns and meticulous laser engraving of even the tiniest island. The land area of a white oak layer has been laser carved to perfection. For the frame, bamboo is used, and each road, highway, pier, bridge, and other structure is detailed laser cut. A sturdy acrylic glass coating is applied to the top to safeguard your gorgeous wall art for a lifetime.",https://www.facebook.com/justmapsdotcom,"San Francisco Bay Area, West Coast, Western US",,,,,,,,,,,,,,,,,"Consumer Goods, Media and Entertainment, Other",,,1-10,,,,,,,,,,,,,,,,,,,,,,,,,,,Private,,,,,,,,,,,,,,,21,,,,,,,,,,
14Nine,https://www.crunchbase.com/organization/14nine,2018-01-01,year,"Consulting, Network Security, Training","Pleasanton, California, United States","14nine is a cyber security consulting firm that offers professional, managed control centre management, and training services.","2,391,511",$1M to $10M,Active,,,,,For Profit,http://www.14nine.com,https://twitter.com/14nineUS,https://www.linkedin.com/company/14nine/,,https://www.facebook.com/14nine/,"San Francisco Bay Area, West Coast, Western US",,,,,,,,,,,,,,,,,"Education, Information Technology, Privacy and Security, Professional Services",1,Peter de Groot,11-50,,,,,,,,,,,,,,,,,,,,,,,,,,,Private,,,,,,,,,,,,,,,,,,,,,,,,,
Suzie's Brewery Company,https://www.crunchbase.com/organization/suzie-s-brewery-company,2020-01-25,day,Brewing,"Pendleton, Oregon, United States",Suzie's Brewery Company is rooted in the off-the-trail outdoor culture that focuses on organic hard seltzers.,"2,391,429",,Active,,,,,For Profit,http://www.suzieshardseltzer.com/,https://twitter.com/suzieshard,https://www.linkedin.com/company/42821244,Suzie's Brewery Company is rooted in the off-the-trail outdoor culture that focuses on organic hard seltzers.,https://www.facebook.com/suzieshardseltzer,"West Coast, Western US",,,,,,,,,,,,,,,,,Food and Beverage,,,1-10,,,,,,,,,,,,,,,,,,,,,,,,,,,Private,,,,,,,,,,,,,,,3,,,,,,,,,,
Brand Rated,https://www.crunchbase.com/organization/brand-rated,2021-01-01,month,E-Commerce,"Los Angeles, California, United States",Brandrated.com is a discovery platform showcasing detailed reviews of the world's best brands and their products,"2,391,211",,Active,,,,,For Profit,https://www.brandrated.com,https://twitter.com/brand_rated,,,https://www.facebook.com/Brand-Rated-105817214845892,"Greater Los Angeles Area, West Coast, Western US",,,,,,,,,,,,,,,,,Commerce and Shopping,,,1-10,,,,,,,,,,,,,,,,,,,,,,,,,,,Private,,,,,,,,,,,,,,-2.46%,8,,,,,,,,,,
Point Apogee,https://www.crunchbase.com/organization/point-apogee,2020-01-01,year,"Consulting, Human Resources, Staffing Agency","Woodinville, Washington, United States","Point Apogee specializes in staffing, process engineering, consulting, and managed services.","2,391,127",,Active,,,,,For Profit,https://pointapogee.com ,,https://www.linkedin.com/company/point-apogee ,,,"Greater Seattle Area, West Coast, Western US",,,,,,,,,,,,,,,,,"Administrative Services, Professional Services",,,11-50,,,,,,,,,,,,,,,,,,,,,,,,,,,Private,,,,,,,,,,,,,,,,,,,,,,,,,
"Cooper Anderson Agency, LLC",https://www.crunchbase.com/organization/cooper-anderson-agency-llc,2022-11-03,day,Life Insurance,"Albuquerque, New Mexico, United States",Independant Life Insurance Agency,"2,391,103",,Active,,,,,For Profit,https://cooperanderson.agency,https://twitter.com/C_A_Agency_LLC,https://www.linkedin.com/company/cooper-anderson-agency-llc/,"At our agency, we understand life insurance can be confusing, which is why we are here to provide you with the unbiased advice and quality service you deserve. We make it easy to find life insurance, long-term care insurance, disability insurance, and annuities that fit your unique needs. Enjoy the peace of mind that comes with knowing you have access to life protection tailored just for you.",https://www.facebook.com/profile.php?id=100090024859673,Western US,,,,,,,,,,,,,,,,,Financial Services,,,1-10,,,,,,,,,,,,,,,,,,,,,,,,,,,Private,,,,,,,,,,,,,,,4,,,,,,,,,,
Attentive Cognitive Mental Health,https://www.crunchbase.com/organization/attentive-cognitive-mental-health,2020-01-01,year,"Health Care, Medical, Mental Health, Nursing and Residential Care, Psychology","San Ramon, California, United States","Attentive Cognitive Mental Health is a neuropsychology clinic that specialises in ageing, chronic diseases, function loss, and life changes.","2,391,039",,Active,,,,,For Profit,https://www.acmentalhealth.com/,,https://www.linkedin.com/company/attentive-cognitive-mental-health,,,"San Francisco Bay Area, West Coast, Western US",,,,,,,,,,,,,,,,,Health Care,,,1-10,,,,,,,,,,,,,,,,,,,,,,,,,,,Private,,,,,,,,,,,,,,,2,,,,,,,,,,
QRate,https://www.crunchbase.com/organization/qrate-251f,2021-10-01,day,"Consumer Reviews, Machine Learning, Restaurants","Seattle, Washington, United States",QRate is an ML-driven recommendation engine that lets you find a perfect place to go out in under 5 seconds,"2,391,013",,Active,,,,,For Profit,https://qrate.site/,,https://www.linkedin.com/company/getqrate/,"QRate is an ML-driven recommendation tool for restaurants. We help people find a great place to go out for their specific occasion in under 5 seconds, saving time and brain fuel for reading reviews.",,"Greater Seattle Area, West Coast, Western US",,,,,,,,,,,,,,,,,"Artificial Intelligence (AI), Commerce and Shopping, Data and Analytics, Food and Beverage, Software",1,Liudmila Kisialiova,1-10,,,,,,,,,,,,,,,,,,,,,,,,,,,Private,,,,,,,,,,,,,,,11,,,,,,,,,,
Recreo Coffee & Roasterie,https://www.crunchbase.com/organization/recreo-coffee-roasterie,2019-01-01,year,"Coffee, E-Commerce, Food and Beverage","West Roxbury, Massachusetts, United States",Recreo Coffee & Roasterie is a coffee shop.,"2,390,967",$1M to $10M,Active,,,,,For Profit,https://www.recreocoffee.com,https://twitter.com/elrecreocoffee,https://www.linkedin.com/company/recreo-coffee-roasterie,"Recreo Coffee & Roasterie is a seller of coffee. Their products are recreo sample box, swp decaf, la finca microlot, don carlos microlot, marsellesa microlot, catuai microlot, honey hybrid micro lot, honey parainema micro-lot, and more.",https://www.facebook.com/Elrecreocoffee,"Greater Boston Area, East Coast, New England",,,,,,,,,,,,,,,,,"Commerce and Shopping, Food and Beverage",,,11-50,,,,,,,,,,,,,,,,,,,,,,,,,,,Private,,,,,,,,,,,,,,,,,,,,,,,,,
Tavern Craft,https://www.crunchbase.com/organization/tavern-craft,2018-01-01,year,"Brewing, Food and Beverage, Supply Chain Management, Wine And Spirits","Sparks, Nevada, United States","Tavern Craft is a brewing company that produces a wide variety of wines, beers, and spirits.","2,390,835",$1M to $10M,Active,,,,,For Profit,http://www.taverncraft.com,,https://www.linkedin.com/company/taverncraft/,,https://www.facebook.com/taverncraftreno/,Western US,,,,,,,,,,,,,,,,,"Food and Beverage, Transportation",,,11-50,,,,,,,,,,,,,,,,,,,,,,,,,,,Private,,,,,,,,,,,,,,,,,,,,,,,,,
Vitalia Montrose,https://www.crunchbase.com/organization/vitalia-montrose,2019-01-01,year,"Assisted Living, Real Estate, Retirement","Ohio City, Ohio, United States","Vitalia Montrose offer independent living, villa living, assisted living, memory care, and respite care to the seniors.","2,390,820",,Active,,,,,For Profit,https://vitaliamontrose.com,,https://www.linkedin.com/company/vitalia-senior-residences-at-copley-montrose/,"Vitalia Montrose provide residents with exceptional care, amenities that are second to none, and activities and events which facilitate social, psychological, and physical well-being.",https://www.facebook.com/VITALIAMontrose/,"Great Lakes, Midwestern US",,,,,,,,,,,,,,,,,"Community and Lifestyle, Health Care, Other, Real Estate",,,51-100,,,,,,,,,,,,,,,,,,,,,,,,,,,Private,,,,,,,,,,,,,,,,,,,,,,,,,
Mebane Vision Center,https://www.crunchbase.com/organization/mebane-vision-center,2018-01-01,month,"Eyewear, Health Care, Hospital, Medical","Mebane, North Carolina, United States",Mebane Vision Center provides eye care services and eyewear products.,"2,390,811",Less than $1M,Active,,,,,For Profit,https://mebanevisioncenter.com,,,"Mebane Vision Center provides eye care services and eyewear products. Their eye care services include eye exams, diabetic eye examinations, pediatric examinations, optical services, contact lens examination, glaucoma, and so on. Their optical services include frames and contact lenses.",https://www.facebook.com/mebanevisioncenter/,"Research Triangle, East Coast, Southern US",,,,,,,,,,,,,,,,,"Consumer Goods, Health Care",,,1-10,,,,,,,,,,,,,,,,,,,,,,,,,,,Private,,,,,,,,,,,,,,,3,,,,,,,,,,
Austin City Insights,https://www.crunchbase.com/organization/austin-city-insights,2018-01-01,year,Consulting,"Austin, Texas, United States","Austin City Insights is committed to becoming the largest consulting firm in the world giving you insights you need, & growth you desire.","2,390,770",,Active,,,,,For Profit,http://austincityinsights.com/,https://twitter.com/austin_insights,https://www.linkedin.com/company/austin-city-insights/,,https://facebook.com/Austin-City-Insights-452197721941136/,Southern US,,,,,,,,,,,,,,,,,Professional Services,,,11-50,,,,,,,,,,,,,,,,,,,,,,,,,,,Private,,,,,,,,,,,,,,,4,,,,,,,,,,
Energy Wellness Center,https://www.crunchbase.com/organization/energy-wellness-center,2019-01-01,year,"Alternative Medicine, Health Care, Nutrition, Wellness","Flushing, New York, United States","Energy Wellness Center provides a balance of the physical, mental, and emotional body.","2,390,754",Less than $1M,Active,,,,,For Profit,https://myenergywellness.com,https://twitter.com/MyEnergyWellnes,https://www.linkedin.com/company/the-energy-wellness-center/,"The Energy Wellness Center provides services for nutrigenomic DNA testing; mud packing; cation; packs; pelotherapy; emotional repolarization; frequency-specific microcurrent therapy; health bio scans; energy and chakra balancing; Vastu; and earth science analysis. They also provide wellness for mood imbalances, energy imbalances, neurological imbalances, immune imbalances, pain, muscle spasms, digestive issues, hormone imbalances, and memory issues.",https://www.facebook.com/MyEnergyWellness/,"Greater New York Area, East Coast, Northeastern US",,,,,,,,,,,,,,,,,"Food and Beverage, Health Care",,,1-10,,,,,,,,,,,,,,,,,,,,,,,,,,,Private,,,,,,,,,,,,,,,14,,,,,,,,,,
