Organization Name,Organization Name URL,Founded Date,Founded Date Precision,Industries,Headquarters Location,Description,CB Rank (Company),Estimated Revenue Range,Operating Status,Exit Date,Exit Date Precision,Closed Date,Closed Date Precision,Company Type,Website,Twitter,LinkedIn,Full Description,Facebook,Headquarters Regions,Investment Stage,Investor Type,Number of Portfolio Organizations,Number of Investments,Number of Lead Investments,Number of Diversity Investments,Number of Exits,Number of Exits (IPO),Accelerator Program Type,Accelerator Application Deadline,Accelerator Duration (in weeks),School Type,School Program,Number of Enrollments,School Method,Number of Founders (Alumni),Industry Groups,Number of Founders,Founders,Number of Employees,Number of Funding Rounds,Funding Status,Last Funding Date,Last Funding Amount,Last Funding Amount Currency,Last Funding Amount Currency (in USD),Last Funding Type,Last Equity Funding Amount,Last Equity Funding Amount Currency,Last Equity Funding Amount Currency (in USD),Last Equity Funding Type,Total Equity Funding Amount,Total Equity Funding Amount Currency,Total Equity Funding Amount Currency (in USD),Total Funding Amount,Total Funding Amount Currency,Total Funding Amount Currency (in USD),Top 5 Investors,Number of Lead Investors,Number of Investors,Number of Acquisitions,Acquisition Status,Announced Date,Announced Date Precision,Acquisition Type,Acquisition Terms,IPO Status,IPO Date,Money Raised at IPO,Money Raised at IPO Currency,Money Raised at IPO Currency (in USD),Valuation at IPO,Valuation at IPO Currency,Valuation at IPO Currency (in USD),Stock Symbol,Stock Symbol URL,Stock Exchange,Last Leadership Hiring Date,Last Layoff Mention Date,Number of Events,SEMrush - Monthly Rank Growth,BuiltWith - Active Tech Count,Apptopia - Number of Apps,Apptopia - Downloads Last 30 Days,G2 Stack - Total Products Active,IPqwery - Patents Granted,IPqwery - Trademarks Registered,IPqwery - Most Popular Patent Class,IPqwery - Most Popular Trademark Class,Aberdeen - IT Spend,Aberdeen - IT Spend Currency,Aberdeen - IT Spend Currency (in USD)
SQLPad,https://www.crunchbase.com/organization/sqlpad,2021-01-01,month,"EdTech, Software","Sunnyvale, California, United States",Online SQL Interview Preparation Service,"347,409",,Active,,,,,For Profit,https://sqlpad.io,,https://www.linkedin.com/company/sqlpad,"Jump-start your SQL interview preparation with a 4-week course and 80 online SQL interview coding questions Say goodbye to the stress of wondering which SQL operations to focus on, and know how to efficiently spend your time Practice and solve 80 SQL exercises to strengthen your learning and get a taste on real SQL interview questions Master essential SQL concepts and operations for a data analytics professional Learn tips and techniques to avoid common mistakes in a data scientist SQL interview Become a confident data scientist candidate entering a SQL interview Develop a great SQL coding style that impresses the interviewer Significantly shorten the path to land your dream job Understand common SQL technical interview processes, tips, and techniques",,"San Francisco Bay Area, Silicon Valley, West Coast",,,,,,,,,,,,,,,,,"Education, Software",1,Leon Wei,1-10,,,,,,,,,,,,,,,,,,,,,,,,,,,Private,,,,,,,,,,,,,,-5.98%,29,,,,,,,,,,
Cutting Edge AI,https://www.crunchbase.com/organization/cutting-edge-ai,2020-01-01,year,"Information Technology, Internet","Washington, District of Columbia, United States",Cutting Edge AI is a video analysis software that instantly makes full motion video.,"347,439",,Active,,,,,For Profit,http://cuttingedgeai.com,,https://www.linkedin.com/company/cutting-edge-ai,,,"Washington DC Metro Area, Southern US",,,,,,,,,,,,,,,,,"Information Technology, Internet Services",1,Martin Kelly,1-10,,,,,,,,,,,,,,,,,,,,,,,,,,,Private,,,,,,,,,,,,,,,15,,,,,,,,,,
humhum,https://www.crunchbase.com/organization/humhum,2020-10-05,day,"Dating, Mental Health, Wellness","New York, New York, United States",Bridging mental wellness and dating.,"347,442",,Active,,,,,For Profit,https://www.humhum.space/,https://twitter.com/humhumspace,https://www.linkedin.com/company/humhum,"After returning from a long period of silent retreat, I stepped back into the NYC dating scene; it felt transactional, and tiring. I saw I was not alone. 78% of people experience emotional fatigue or burnout from dating, and studies show that people using dating apps are more likely to be distressed, anxious, or depressed, yet people continue to turn to the apps over and over. I saw an opportunity to bridge the gap between mental wellness and dating. humhum approaches dating holistically. Through our virtual guided blind dates, group dates, and coaching, we focus on the journey over the outcome, authentic connection, and skill-building so that time spent dating feels nourishing, wherever you are in your process.",https://www.facebook.com/humhumspace,"Greater New York Area, East Coast, Northeastern US",,,,,,,,,,,,,,,,,"Community and Lifestyle, Health Care",1,Alexandra Ballensweig,1-10,1,Seed,2020-09-20,,,,Pre-Seed,,,,Pre-Seed,,USD,,,USD,,,,,,,,,,,Private,,,,,,,,,,,,,,,20,,,,,,,,,,
GetAssist.net,https://www.crunchbase.com/organization/getassist,2018-01-01,day,"Internet, Internet of Things, Social Network","Houston, Texas, United States",GetAssist.net is a technology company that helps in correcting errors and removing glitches while using technical services.,"347,468",,Active,,,,,For Profit,https://getassist.net/,https://twitter.com/GetAssistNet,https://www.linkedin.com/company/getassistance,"Get assistance is a technical hub where you can search your all problems on our website. So, if you have to face any trouble, you can read the blog and fix all issues.",https://www.facebook.com/GetAssist.net,"Greater Houston Area, Southern US",,,,,,,,,,,,,,,,,Internet Services,,,11-50,,,,,,,,,,,,,,,,,,,,,,,,,,,Private,,,,,,,,,,,,,,197.3%,28,,,,0,12,,Advertising; business,,,
Impactful,https://www.crunchbase.com/organization/impactful-ac99,2020-01-01,year,"Business Development, Consulting, Software","Los Angeles, California, United States","Impactful develops impact modeling and consulting for products, programs, and organizations.","347,482",,Active,,,,,,https://impctfl.io,https://twitter.com/ImpactfulHQ,https://www.linkedin.com/company/impctfl,"Impactful develops impact modeling and consulting for products, programs, and organizations. It also helps companies to identify their core values and communicate them to teams, partners, customers, and the public through transparent data about their real impact. Impactful was founded in 2020.",,"Greater Los Angeles Area, West Coast, Western US",,,,,,,,,,,,,,,,,"Professional Services, Software",1,Slav Dunaev,1-10,2,Seed,2023-05-10,,,,Pre-Seed,,,,Pre-Seed,,USD,,,USD,,"Libermans Co, Vladislav Solodkiy, John Reese, Daniel Liberman",,4,,,,,,,Private,,,,,,,,,,,,,,,14,,,,,,,,,,
Reframe Systems,https://www.crunchbase.com/organization/reframe-systems,2022-08-31,day,"Construction, Energy Efficiency, Manufacturing, Robotics","Andover, Massachusetts, United States","Robotic microfactories for building net-zero homes 2x faster, 2x cheaper with 10x lower carbon","347,486",,Active,,,,,For Profit,https://www.reframe.systems,,https://www.linkedin.com/company/reframe-systems/,,,"Greater Boston Area, East Coast, New England",,,,,,,,,,,,,,,,,"Energy, Hardware, Manufacturing, Real Estate, Science and Engineering, Software, Sustainability",,,11-50,,,,,,,,,,,,,,,,,,,,,,,,,,,Private,,,,,,,,,,,,,,,,,,,,,,,,,
Provallo,https://www.crunchbase.com/organization/provallo,2021-01-01,year,"Cloud Infrastructure, Cloud Security, Communications Infrastructure, Cyber Security, Real Time, Software","San Francisco, California, United States",AI managed cloud infrastructure. A new service type category.,"347,489",,Active,,,,,For Profit,https://www.provallo.com,,https://www.linkedin.com/company/provallo,"Provallo helps SaaS vendors by dramatically saving their cloud cost, while keeping all other metrics. With our unique ML engine we are able to bring real-time insights and apply policy to reduce expensive work.",,"San Francisco Bay Area, West Coast, Western US",,,,,,,,,,,,,,,,,"Hardware, Information Technology, Internet Services, Other, Privacy and Security, Software",2,"Moshe Vered, Yaniv Karta",1-10,,,,,,,,,,,,,,,,,,,,,,,,,,,Private,,,,,,,,,,,,,,,4,,,,1,0,,,,,
ThoughtMetric,https://www.crunchbase.com/organization/thoughtmetric,2018-08-13,day,"Digital Marketing, E-Commerce, Social Media Marketing","Boston, Massachusetts, United States",ThoughtMetric is a Marketing Attribution tool for eCommerce.,"347,503",,Active,,,,,For Profit,https://thoughtmetric.io/,https://twitter.com/thoughtmetric,https://www.linkedin.com/company/thoughtmetric/,ThoughtMetric is a Marketing Attribution tool for eCommerce. We empower eCommerce brands and their agency partners to make data-driven marketing decisions.,https://www.facebook.com/ThoughtMetricio/,"Greater Boston Area, East Coast, New England",,,,,,,,,,,,,,,,,"Commerce and Shopping, Sales and Marketing",2,"Giovanni Thermot, Michael Signorella",1-10,,,,,,,,,,,,,,,,,,,,,,,,,,,Private,,,,,,,,,,,,,,3.12%,4,,,,0,1,,Scientific and technological services,,,
EmeritusDX,https://www.crunchbase.com/organization/emeritusdx,2020-01-01,year,"Biotechnology, Health Care, Test and Measurement","Irvine, California, United States",EmeritusDX is a cancer diagnostic and information company.,"347,513",,Active,,,,,For Profit,https://emeritusdx.com,https://twitter.com/EmeritusDX,https://www.linkedin.com/company/emeritusdx,EmeritusDX performs testing that guides the diagnosis and treatment of cancer patients. They offer diagnostic laboratory services as well as effectively supporting the custom research and clinical trial markets.,https://www.facebook.com/EmeritusDX,"Greater Los Angeles Area, West Coast, Western US",,,,,,,,,,,,,,,,,"Biotechnology, Data and Analytics, Health Care, Science and Engineering",2,"Jason Allchin, Robert Embree",11-50,,,,,,,,,,,,,,,,,,,,,,,,,,,Private,,,,,,,,,,,2023-10-30,,,,,,,,,,,,,,
Bramalea Partners,https://www.crunchbase.com/organization/bramalea-partners,2021-01-01,year,"Business Development, Finance, Venture Capital","Boston, Massachusetts, United States",Bramalea Partners seeks opportunities to invest in tech-enabled businesses.,"347,527",Less than $1M,Active,,,,,For Profit,https://www.bramaleapartners.com/,,https://www.linkedin.com/company/bramalea-partners/,"Bramalea Partners seeks for large, growing, well-established industries that are ripe for disruption via technology. Bramalea Partners provides expansion capital to help scale and grow a business that has a very large total addressable market that is easy to understand.",,"Greater Boston Area, East Coast, New England",,Venture Capital,3,3,,3,,,,,,,,,,,"Financial Services, Lending and Investments, Professional Services",1,Andrew Boyd,1-10,,,,,,,,,,,,,,,,,,,,,,,,,,,Private,,,,,,,,,,,,,,,14,,,,,,,,,,
Zigr,https://www.crunchbase.com/organization/zigr,2018-11-01,month,"Aerospace, Business Intelligence, Consulting, Corporate Training, Government, Industrial Manufacturing, Law Enforcement, Machinery Manufacturing, Military, Robotics","Smyrna, Delaware, United States",Zigr is a full-service M&A advisory firm focusing on acquiring lower to mid-market companies.,"347,532",,Active,,,,,For Profit,https://zigr.co,,https://www.linkedin.com/company/zigr/,"Zigr is a full-service M&A advisory firm that has a network of owner-operators, investors, and joint venture partners looking to buy smaller to mid-sized companies. Zigr offers a done-with-you M&A package that finds a deal, finds the partners, facilitates financing, negotiation, positioning, and closing.",https://www.facebook.com/Zigr.io,"East Coast, Southern US",,,,,,,,,,,,,,,,,"Data and Analytics, Education, Government and Military, Hardware, Information Technology, Manufacturing, Privacy and Security, Professional Services, Science and Engineering, Software",1,Jesse Mauck,1-10,,,,,,,,,,,,,,,,,,,,,1,Made Acquisitions,,,,,Private,,,,,,,,,,,,,,,2,,,,,,,,,,
Unicorn Venture Partners,https://www.crunchbase.com/organization/unicorn-ventures,2018-08-11,day,Venture Capital,"Los Angeles, California, United States","We invest in early stage companies, strategically tests new business models and offer hands on consulting for aspiring startup founders.","347,573",$1M to $10M,Active,,,,,For Profit,https://www.unicornvp.com/,,https://www.linkedin.com/company/unicorn-venture-partners/,"We invest in early stage companies, strategically tests new business models and offer hands on consulting for aspiring startup founders.",,"Greater Los Angeles Area, West Coast, Western US","Early Stage Venture, Seed",Venture Capital,3,5,,,,,,,,,,,,,"Financial Services, Lending and Investments",2,"Dave Lin, Jonathan Hung",1-10,,,,,,,,,,,,,,,,,,,,,,,,,,,Private,,,,,,,,,,,,,,-7.38%,2,,,,,,,,,,
Tilt,https://www.crunchbase.com/organization/tilt-ef75,2021-01-01,year,"Digital Entertainment, Digital Media, Media and Entertainment, Video Streaming","New York, New York, United States",Tilt is a mobile live-streaming platform that offers different shows.,"347,584",,Active,,,,,For Profit,https://watchtilt.com,,https://www.linkedin.com/company/watchtilt,Tilt is a mobile live-streaming platform that offers different shows.,,"Greater New York Area, East Coast, Northeastern US",,,,,,,,,,,,,,,,,"Content and Publishing, Media and Entertainment, Video",,,1-10,1,Seed,2023-08-18,,,,Seed,,,,Seed,,USD,,,USD,,FJ Labs,,1,,,,,,,Private,,,,,,,,,,,,,,,4,,,,,,,,,,
Recomm,https://www.crunchbase.com/organization/renett,2020-01-01,year,"Artificial Intelligence (AI), Consumer Reviews, Content Marketing, Customer Service, E-Commerce, Information Technology, Lead Generation, Sales, Software, Video Chat","San Francisco, California, United States",AI-powered selling videos and reviews,"347,653",,Active,,,,,For Profit,https://www.recomm.app/,https://twitter.com/ReCommPlugin,https://www.linkedin.com/company/recomm-app/mycompany,Boost online store sales with shoppable videos on the product page.,https://www.facebook.com/ReComm-Plugin-100945346015955,"San Francisco Bay Area, West Coast, Western US",,,,,,,,,,,,,,,,,"Artificial Intelligence (AI), Commerce and Shopping, Data and Analytics, Information Technology, Internet Services, Messaging and Telecommunications, Other, Professional Services, Sales and Marketing, Science and Engineering, Software",1,Paul Volk,1-10,,,,,,,,,,,,,,,,,,,,,,,,,,,Private,,,,,,,,,,,,,,,1,,,,0,1,,Scientific and electric apparatus and instruments,3385525,USD,3385525
VirtuE,https://www.crunchbase.com/organization/virtue-afbb,2018-01-01,year,"Artificial Intelligence (AI), Consulting, Management Consulting, Psychology, Risk Management","Brooklyn, New York, United States",VirtuE is specialized in the development of AI applications for psychology.,"347,659",,Active,,,,,For Profit,https://www.virtueconsultants.com/,,https://www.linkedin.com/company/virtue-consultants,VirtuE is specialized in the development of AI applications for psychology.,,"Greater New York Area, East Coast, Northeastern US",,,,,,,,,,,,,,,,,"Artificial Intelligence (AI), Data and Analytics, Health Care, Professional Services, Science and Engineering, Software",1,Reid Blackman,11-50,1,Seed,2021-01-19,,,,Seed,,,,Seed,,USD,,,USD,,Sharjah Angel Investors Network,1,1,,,,,,,Private,,,,,,,,,,,,,,,,,,,,,,,,,
Brightr Travel,https://www.crunchbase.com/organization/brightr-travel,2019-07-01,day,"Events, Location Based Services, Social Media, Tourism, Travel","Bala Cynwyd, Pennsylvania, United States",Brightr is a web and mobile platform for destination marketing and management.,"347,675",Less than $1M,Active,,,,,For Profit,http://www.brightrtravel.com,https://www.twitter.com/brightrtravel,https://www.linkedin.com/company/brightr-travel,Brightr is a web and mobile platform for destination marketing and management. It is designed to inspire destination discovery and encourage experiential exploration through a platform focused on maximizing the visual side of travel.,http://www.facebook.com/Brightrtravel,"Greater Philadelphia Area, Great Lakes, Northeastern US",,,,,,,,,,,,,,,,,"Data and Analytics, Events, Internet Services, Media and Entertainment, Navigation and Mapping, Travel and Tourism",3,"Igor Dyakov, Igor Zhylenko, Matt Mason",1-10,,,,,,,,,,,,,,,,,,,,,,,,,,,Private,,,,,,,,,,,,,,,19,18,,9,,,,,,,
HealthAI,https://www.crunchbase.com/organization/healthai,2020-01-01,year,"Health Care, Hospital","Murrieta, California, United States",HealthAI is a hospital & health Care company.,"347,696",,Active,,,,,For Profit,https://www.healthai.team/,,https://www.linkedin.com/company/healthai-team/,,,"Greater Los Angeles Area, Inland Empire, West Coast",,,,,,,,,,,,,,,,,Health Care,,,1-10,,,,,,,,,,,,,,,,,,,,,,,,,,,Private,,,,,,,,,,,,,,,3,,,,,,,,,,
Liquify Analytics,https://www.crunchbase.com/organization/liquify-collaborative-analytics,2022-08-30,day,"Analytics, Business Intelligence, Data Governance, Data Integration, Data Management, Software","Manchester, New Hampshire, United States",Manage your Snowflake data lake with LiquifyReservoir™ so you can empower everyone to be data-driven with Liquify AnalyticsLab™,"347,703",,Active,,,,,For Profit,,https://twitter.com/liquifyanalytic,https://www.linkedin.com/company/liquify-analytics/,"LiquifyReservoir™ will soon revolutionize the managed data lake, providing an always up-to-date foundation for analytics and data science, where all a customer's data is available, discoverable, governable and up-to-date.  No more pipelines, no more long waits, and no more low ROI for analytics projects.  Most importantly, however, Liquify AnalyticsLab™ will stand on this revolutionary foundation to make daily data-driven business simple, fun and understandable for everyone.  Let's empower every team member to put data to work!",https://www.facebook.com/liquifyanalytics/,"East Coast, New England, Northeastern US",,,,,,,,,,,,,,,,,"Data and Analytics, Information Technology, Software",4,"Dhara Kapoor, Kyle Rasku, Thomas Rasku, Tyler Bergerson",1-10,,,,,,,,,,,,,,,,,,,,,,,,,,,Private,,,,,,,,,,,,,,,,,,,,,,,,,
BluByrd,https://www.crunchbase.com/organization/blubyrd,2021-01-01,year,"Health Care, SaaS, Software","Northville, Michigan, United States",BluByrd is a software that streamlines workflows and data exchange between clinical practices and surgical facilities.,"347,708",,Active,,,,,For Profit,https://www.blubyrd.com,,https://www.linkedin.com/company/blubyrd,,,"Greater Detroit Area, Great Lakes, Midwestern US",,,,,,,,,,,,,,,,,"Health Care, Software",,,1-10,,,,,,,,,,,,,,,,,,,,,,,,,,,Private,,,,,,,,,,,,,,,16,,,,,,,,,,
DevBird,https://www.crunchbase.com/organization/devbird,2023-01-03,day,,"Laguna Beach, California, United States",Revolutionizing Project Collaboration with a Global Talent Network,"347,721",,Active,,,,,For Profit,https://devbird.co,https://twitter.com/DevBirdLLC,https://www.linkedin.com/company/devbird,"""Global Talent Collaboration, Project Execution Excellence, Tech Industry Innovation"" DevBird LLC specializes in bridging the gap between innovative project ideas and their execution by leveraging a global network of professional talent. Our focus areas include: - Tech Industry Innovation: Pioneering solutions across various sectors, including web development, mobile app creation, cybersecurity, IoT, AI, and machine learning. - Global Talent Collaboration: Connecting clients with an extensive network of professionals from over 22 countries, ensuring diverse, innovative, and efficient project completion. - Project Execution Excellence: Implementing a structured process from discovery and consultation to resource engagement and ongoing support, tailored to meet the unique needs of both startups and tech giants.",,"Greater Los Angeles Area, West Coast, Western US",,,,,,,,,,,,,,,,,,,,501-1000,,,,,,,,,,,,,,,,,,,,,,,,,,,Private,,,,,,,,,,,,,,,12,,,,,,,,,,
Validin,https://www.crunchbase.com/organization/validin,2021-06-02,day,"Cyber Security, Information Technology","Atlanta, Georgia, United States",Historic DNS and Threat Intelligence Platform,"347,757",,Active,,,,,For Profit,https://www.validin.com,https://twitter.com/ValidinLLC,https://www.linkedin.com/company/validin-llc,"Validin empowers researchers and analysts with comprehensive historical and real-time DNS data, aiding in cyber threat detection and investigation.",,"Greater Atlanta Area, East Coast, Southern US",,,,,,,,,,,,,,,,,"Information Technology, Privacy and Security",1,Kenneth Kinion,1-10,,,,,,,,,,,,,,,,,,,,,,,,,,,Private,,,,,,,,,,,,,,,9,,,,,,,,,,
Apex Innovative Sciences,https://www.crunchbase.com/organization/apex-innovative-sciences,2019-01-01,year,"Clinical Trials, Health Care, Product Research","Garden Grove, California, United States",Apex Innovative Sciences focuses on clinical trial studies for central nervous system indications.,"347,783",,Active,2022-06-16,day,,,For Profit,https://www.apexsci.com,,https://www.linkedin.com/company/apex-innovative-sciences,"Apex Innovative Sciences is an independent clinical trial site operator focusing on clinical trial studies for central nervous system indications and other therapeutic areas, including neurology, psychiatry, addiction, and others. Apex delivers the highest scientific and clinical quality for its client partners and participants.",https://www.facebook.com/Apex-Innovative-Sciences-109257444209580,"Greater Los Angeles Area, West Coast, Western US",,,,,,,,,,,,,,,,,"Data and Analytics, Design, Health Care",,,11-50,1,M&A,2019-10-02,,,,Private Equity,,,,Private Equity,,USD,,,USD,,Bison Capital Asset Management,,1,,Was Acquired,2022-06-16,day,Acquisition,,Private,,,,,,,,,,,,,,,2,,,,,,,,12369076,USD,12369076
Skyline Renewables,https://www.crunchbase.com/organization/skyline-renewables,2018-01-01,year,"Energy, Renewable Energy","Portland, Oregon, United States",Skyline Renewables will focus on acquiring operating and development projects in the onshore wind sector.,"347,787",$1M to $10M,Active,,,,,For Profit,http://www.skylinerenewables.com/,,https://www.linkedin.com/company/skyline-renewables,"Skyline Renewables is a newly established independent renewable energy company dedicated to creating long-term value through acquiring, developing and optimizing renewable power assets.",,"West Coast, Western US",,,,,,,,,,,,,,,,,"Energy, Sustainability",,,1-10,,,,,,,,,,,,,,,,,,,,,,,,,,,Private,,,,,,,,,,,,,,-58.96%,13,,,,,,,,82838,USD,82838
LashBox LA,https://www.crunchbase.com/organization/lashbox-la,2018-01-01,year,"Beauty, Consumer Goods, Cosmetics, E-Commerce, Retail","Torrance, California, United States","LashBox LA offers professional lash extension solutions as well as supplies tweezers, adhesives, application, and aftercare accessories.","347,806",Less than $1M,Active,,,,,For Profit,https://www.lashboxla.com/,https://mobile.twitter.com/lbla_trainers,https://www.linkedin.com/company/lashboxla/,,https://www.facebook.com/LashBoxla/,"Greater Los Angeles Area, West Coast, Western US",,,,,,,,,,,,,,,,,"Commerce and Shopping, Consumer Goods",,,11-50,,,,,,,,,,,,,,,,,,,,,,,,,,,Private,,,,,,,,,,,,,,-50.33%,11,2,48,,,,,,,,
