Tournament Kings,https://www.crunchbase.com/organization/tournament-kings,2019-05-31,day,"eSports, Gaming, Software, Video Games","Denver, Colorado, United States",Software company changing the competitive gaming space.,"358,081",$1M to $10M,Active,,,,,For Profit,https://www.tournamentkings.com,https://www.twitter.com/tkpays,https://www.linkedin.com/company/tournament-kings,,https://www.facebook.com/tkpays,"Greater Denver Area, Western US",,,,,,,,,,,,,,,,,"Gaming, Software, Sports",4,"Brett Phillips, Evan Steitz, Jacob Dahlman, John Cianci",1-10,,,,,,,,,,,,,,,,,,,,,,,,,,,Private,,,,,,,,,,,,,,,12,,,,,,,,,,
Deal Box Ventures,https://www.crunchbase.com/organization/deal-box-ventures,2022-01-01,year,,"Carlsbad, California, United States",Deal Box Ventures operates as a venture capital arm of Deal Box.,"358,138",,Active,,,,,For Profit,https://dealboxventures.io/,,,Deal Box Ventures operates as a venture capital arm of Deal Box. Deal Box Ventures focus on strategic investments that unlock the full potential of technology in which blockchain products will impact and reshape people's everyday lives.,,"Greater San Diego Area, West Coast, Western US",Early Stage Venture,Corporate Venture Capital,3,3,3,1,,,,,,,,,,,,,,,,,,,,,,,,,,,,,,,,,,,,,,,,,Private,,,,,,,,,,,,,,,8,,,,,,,,,,
OvaryIt,https://www.crunchbase.com/organization/ovaryit,2020-01-01,year,"Health Care, Medical, Telehealth, Women's","Tallahassee, Florida, United States",OvaryIt is a telehealth platform that offers contraceptive solutions.,"358,150",Less than $1M,Active,,,,,For Profit,https://ovaryit.com/,https://twitter.com/Ovaryit_?s=09,https://www.linkedin.com/company/ovaryit/,"OvaryIt is a telehealth service provider for women. Through the use of science and technology, their physicians work with users to create a personalized plan to fit their hormonal and non-hormonal contraceptive needs.",https://www.facebook.com/OvaryItPeriod,"East Coast, Southern US",,,,,,,,,,,,,,,,,"Community and Lifestyle, Health Care",,,1-10,1,,2022-10-13,,,,Grant,,,,,,,,,USD,,National Institutes of Health,1,1,,,,,,,Private,,,,,,,,,,,,,,7.67%,26,,,,0,1,,Scientific and technological services,,,
zLink,https://www.crunchbase.com/organization/zlink,2018-01-01,year,Software,"Maynard, Massachusetts, United States","zLink has provided Integrated Facility Management Software solutions to Corporations, Universities, federal and State Government Agencies.","358,168",$1M to $10M,Active,,,,,For Profit,http://www.zlinkcorp.com,,https://www.linkedin.com/company/zlink-inc/,,https://www.facebook.com/zLinkCorp/,"Greater Boston Area, East Coast, New England",,,,,,,,,,,,,,,,,Software,,,11-50,,,,,,,,,,,,,,,,,,,,,,,,,,,Private,,,,,,,,,,,,,,132.29%,33,13,,,,,,,,,
The Kelsey,https://www.crunchbase.com/organization/the-kelsey,2018-01-01,year,"Association, Communities, Home Services, Infrastructure, Non Profit, Real Estate, Social","San Francisco, California, United States",The Kelsey offers housing solutions that lead to more affordable housing and opportunities for all.,"358,196",,Active,,,,,Non-profit,https://thekelsey.org/,https://twitter.com/TheKelseyMore,https://www.linkedin.com/company/thekelseymore,The Kelsey offers housing solutions that lead to more affordable housing and opportunities for all. The organization was founded in 2016 by Micaela Connery.,https://www.facebook.com/thekelseymore,"San Francisco Bay Area, West Coast, Western US",,,,,,,,,,,,,,,,,"Community and Lifestyle, Other, Real Estate, Social Impact",1,Micaela Connery,1-10,1,,2019-01-01,,,,Venture - Series Unknown,,,,Venture - Series Unknown,,USD,,,USD,,The Draper Richards Kaplan Foundation,,1,,,,,,,Private,,,,,,,,,,,,,,-1.87%,22,,,,,,,,,,
Pop-Up Talent,https://www.crunchbase.com/organization/pop-up-talent,2018-01-01,year,"Human Resources, Recruiting, Staffing Agency","Redwood City, California, United States",Pop-up Talent provides companies with solutions for recruiting.,"358,230",,Active,,,,,For Profit,https://www.popuptalent.com,,https://www.linkedin.com/company/pop-uptalent,Pop-Up Talent provides top talent that enables tremendous savings and flexibility to their clients. If you want any information please contact them through email or phone call.,https://www.facebook.com/CoretechsDirect,"San Francisco Bay Area, Silicon Valley, West Coast",,,,,,,,,,,,,,,,,"Administrative Services, Professional Services",,,11-50,,,,,,,,,,,,,,,,,,,,,,,,,,,Private,,,,,,,,,,,,,,-1.37%,6,,,,,,,,,,
Colorfull,https://www.crunchbase.com/organization/colorfull,2023-08-04,day,Software,"Austin, Texas, United States","Nourishing Tomorrow’s Workplace, Today.","358,245",,Active,,,,,For Profit,https://www.colorfull.ai/,https://twitter.com/colorfullAI,https://www.linkedin.com/company/colorfull/,"At Colorfull, we're reimagining workplace nourishment by merging culinary finesse with a touch of technology. Handpicked dishes from local restaurants cater to individual tastes, offering a fresh take on the daily dining ritual. With sustainability at our core, we guide users toward eco-conscious choices. Collaborating with renowned establishments, we enrich the local dining landscape. Embrace the future with us, where health, sustainability, and innovation converge on your plate.",,Southern US,,,,,,,,,,,,,,,,,Software,,,1-10,,,,,,,,,,,,,,,,,,,,,,,,,,,Private,,,,,,,,,,,,,,,15,,,,,,,,,,
magipop,https://www.crunchbase.com/organization/magipop,2022-05-01,month,"Blockchain, Information Technology, Web3","San Francisco, California, United States",Magipop builts Atlantis together via co-creation in the web3 world.,"358,248",,Active,,,,,For Profit,https://magipop.xyz/,https://twitter.com/magipop_dao,https://www.linkedin.com/company/magipop/,Magipop builts Atlantis together via co-creation in the web3 world.,,"San Francisco Bay Area, West Coast, Western US",Early Stage Venture,,,,,,,,,,,,,,,,"Blockchain and Cryptocurrency, Information Technology, Internet Services, Other",1,Annie Huang,1-10,,,,,,,,,,,,,,,,,,,,,,,,,,,Private,,,,,,,,,,,,,,-28.9%,,,,,,,,,,,
Iron Prairie Ventures,https://www.crunchbase.com/organization/iron-prairie-ventures,2022-01-01,year,,"Leawood, Kansas, United States",Iron Prairie Ventures operates as a venture capital firm.,"358,269",,Active,,,,,For Profit,http://ironprairie.vc/,,https://www.linkedin.com/company/ironprairievc/about/,Iron Prairie Ventures operates as a venture capital firm.,,Midwestern US,Early Stage Venture,Venture Capital,1,1,,,,,,,,,,,,,,,,,,,,,,,,,,,,,,,,,,,,,,,,,,,Private,,,,,,,,,,,,,,,3,,,,,,,,,,
virgin music,https://www.crunchbase.com/organization/virgin-music,2021-01-01,year,"Digital Marketing, Media and Entertainment, Music","Santa Monica, California, United States",Virgin Music is a full-service label and distribution company that focuses on artist development.,"358,278",,Active,,,,,For Profit,https://www.virginmusic.com,https://twitter.com/virginmusic,https://www.linkedin.com/company/virginmusiclas,"Virgin Music is a full-service label and distribution company focused on artist development, offering commercial, radio promotion, marketing, synch/branding/licensing, and digital marketing services.",https://www.facebook.com/virginmusic,"Greater Los Angeles Area, West Coast, Western US",,,,,,,,,,,,,,,,,"Media and Entertainment, Music and Audio, Sales and Marketing",,,251-500,,,,,,,,,,,,,,,,,,,,,2,Made Acquisitions,,,,,Private,,,,,,,,,,,,,,5.21%,43,,,9,,,,,,,
CommSell,https://www.crunchbase.com/organization/commsell,2018-10-01,day,"Consumer Electronics, E-Commerce, Telecommunications","Saint Louis, Missouri, United States","CommSell is a smart distribution company that focuses on high-end smartphones, low-end smartphones, and accessories.","358,304",,Closed,,,,none,For Profit,https://commsell.com,,https://www.linkedin.com/company/18953558/,"We test, clean, and provide Retail Ready High-End and Low-End Devices.",,Midwestern US,,,,,,,,,,,,,,,,,"Commerce and Shopping, Consumer Electronics, Hardware",,,11-50,,,,,,,,,,,,,,,,,,,,,,,,,,,Private,,,,,,,,,,,,,,,3,2,"29,269",,,,,,,,
Savviest,https://www.crunchbase.com/organization/savviest,2018-01-01,year,"Artificial Intelligence (AI), Career Planning, Higher Education, Human Resources, Recruiting, Software","Glenwood Springs, Colorado, United States",Savviest is an AI platform that transforms the way people navigate and succeed in their careers.,"358,314",,Active,2023-03-15,day,,,For Profit,https://savviest.com/,https://twitter.com/SavviestHQ,https://www.linkedin.com/company/savviest/,Savviest is an AI platform that transforms the way people navigate and succeed in their careers.,https://www.facebook.com/SavviestHQ,Western US,,,,,,,,,,,,,,,,,"Administrative Services, Artificial Intelligence (AI), Data and Analytics, Education, Professional Services, Science and Engineering, Software",2,"Devin Owen, Jared Carlson",1-10,,M&A,,,,,,,,,,,,,,,,,,,,Was Acquired,2023-03-15,day,Acquisition,,Private,,,,,,,,,,,,,,,20,,,,,,,,,,
Vyper Industrial,https://www.crunchbase.com/organization/vyper-industrial,2019-01-01,year,"Industrial Manufacturing, Manufacturing, Retail","Green Bay, Wisconsin, United States","Vyper Industrial manufactures industrial products, including chairs designed to improve posture and reduce back and knee pain.","358,322",,Active,,,,,For Profit,https://www.vyperindustrial.com,,https://www.linkedin.com/company/vyper-industrial,"Vyper Industrial is a manufacturing company that specializes in the production of industrial products. The company's offerings are designed to assist organizations in risk mitigation and enhance human performance, thereby boosting productivity. One of their notable products is the Vyper Chair, which is strategically designed to improve posture and provide relief for back and knee pain. This chair is particularly popular among auto mechanics for its comfort and support. Vyper Industrial also offers customization options, allowing customers to add their own logos to the products.",,"Great Lakes, Midwestern US",,,,,,,,,,,,,,,,,"Commerce and Shopping, Manufacturing",1,Dayne Rusch,11-50,,,,,,,,,,,,,,,,,,,,,,,,,,,Private,,,,,,,,,,,,,,12.41%,55,,,,,,,,,,
Evergreen Natural Resources,https://www.crunchbase.com/organization/evergreen-natural-resources,2018-01-01,year,"Energy, Natural Resources, Oil and Gas, Renewable Energy","Denver, Colorado, United States",ENR is a natural gas company that focuses on green coalbed methane gas.,"358,370",,Active,,,,,For Profit,https://www.enrllc.com,,https://www.linkedin.com/company/evergreen-natural-resources,ENR provides natural gas and the extraction of green coalbed greenhouse gases in order to comply with environmental regulations and to help property owners establish connections. They provide renewable energy services. They provide their communication details on the website and offer environmental regulations and assistance services.,,"Greater Denver Area, Western US",,,,,,,,,,,,,,,,,"Energy, Natural Resources, Sustainability",,,51-100,,,,,,,,,,,,,,,,,,,,,,,,,,,Private,,,,,,,,,,,,,,,2,,,,,,,,1296019,USD,1296019
Big Daddy Unlimited,https://www.crunchbase.com/organization/big-daddy-unlimited,2018-01-01,year,"Manufacturing, Retail, Sporting Goods","Gainesville, Florida, United States",Big Daddy Unlimited is a sporting goods manufacturing company.,"358,375",$1M to $10M,Active,,,,,For Profit,https://www.bigdaddyunlimited.com,https://twitter.com/BigdaddyUNLTD,https://www.linkedin.com/company/bigdaddyunlimited,,https://www.facebook.com/BigDaddyUnlimited,"East Coast, Southern US",,,,,,,,,,,,,,,,,"Commerce and Shopping, Manufacturing, Sports",,,51-100,,,,,,,,,,,,,,,,,,,,,,,,,,,Private,,,,,,,,,,,,,,-57.75%,75,1,9,,,,,,,,
Automation Ventures,https://www.crunchbase.com/organization/79-ventures,2019-01-01,year,,"San Francisco, California, United States",Invests in Startups that Automate Human Labor,"358,428",,Active,,,,,For Profit,https://www.automation.vc,,https://www.linkedin.com/company-beta/7973108/,,,"San Francisco Bay Area, West Coast, Western US",,"Micro VC, Venture Capital",0,0,,,,,,,,,,,,,,1,Vishal Harpalani,,,,,,,,,,,,,,,,,,,,,,,,,,,,Private,,,,,,,,,,,,,,,4,,,3,,,,,,,
Aramis Biosciences,https://www.crunchbase.com/organization/aramis-biosciences,2018-01-01,year,"Biotechnology, Health Care, Health Diagnostics, Therapeutics","Boston, Massachusetts, United States",Aramis Biosciences is an immuno-ophthalmology biopharmaceutical company.,"358,431",,Active,,,,,For Profit,https://aramisbio.com/,,https://www.linkedin.com/company/aramis-biosciences/,"Aramis Biosciences provides disease-modifying therapy for ocular surface disease and is an immuno-ophthalmology biopharmaceutical company. For inquiries, email, telephone numbers, and physical addresses are available on their website.",,"Greater Boston Area, East Coast, New England",,,,,,,,,,,,,,,,,"Biotechnology, Health Care, Science and Engineering",2,"Reza Dana, Sunil Chauhan",1-10,1,Seed,2020-01-01,,,,Seed,,,,Seed,,USD,,,USD,,Safar Partners,,1,,,,,,,Private,,,,,,,,,,,,,,,1,,,,,,,,,,
Hoppn,https://www.crunchbase.com/organization/hoppn,2020-03-12,day,"E-Commerce Platforms, Fashion, Information Technology, Social Network","Hermosa Beach, California, United States",Hoppn is the one-stop shop for emerging brands. Creators of Infinite Color Search technology through Hoppn Labs. labs.hoppn.com,"358,432",,Active,,,,,For Profit,https://hoppn.com/,https://twitter.com/Hoppn_App,https://www.linkedin.com/company/34737738/admin/,"Hoppn is the social marketplace for discovering sustainable, innovative, and authentic fashion pieces. Known for its infinite color search feature that lets you search thousands of products by any color in existence. Hoppn also has unique filters that highlight recycled, vegan, charitable, Made in USA, and BIPOC-owned products. The brands featured on Hoppn control their profiles, allowing them to maintain their own voice and personality. It's an authentic way to discover new brands. You can also follow your friends on Hoppn and discover curated products through the people you trust. Available in the App Store and at hoppn.com",https://www.facebook.com/HoppnApp,"Greater Los Angeles Area, West Coast, Western US",,,,,,,,,,,,,,,,,"Clothing and Apparel, Commerce and Shopping, Design, Information Technology, Internet Services",3,"Bridger Hart, Carson Hart, Humberto Morales",1-10,,,,,,,,,,,,,,,,,,,,,,,,,,,Private,,,,,,,,,,,,,,,,1,740,,,,,,,,
Diligent Health Solutions,https://www.crunchbase.com/organization/diligent-health-solutions,2019-01-01,year,"Health Care, Medical, Telecommunications","Feasterville Trevose, Pennsylvania, United States","Diligent Health Solutions provides medical information, pharmaceutical sales and communication services to healthcare organizations.","358,443",$1M to $10M,Active,,,,,For Profit,https://www.diligenthealthsolutions.com/,https://twitter.com/HealthDiligent,https://www.linkedin.com/company/diligent-health-solutions/,,https://www.facebook.com/DiligentHealthSolutions,"Greater Philadelphia Area, Great Lakes, Northeastern US",,,,,,,,,,,,,,,,,"Hardware, Health Care",,,101-250,,,,,,,,,,,,,,,,,,,,,,,,,,,Private,,,,,,,,,,,,,,,10,,,19,,,,,741177,USD,741177
Clear Talent,https://www.crunchbase.com/organization/clear-talent,2018-01-01,year,"Career Planning, Information Technology, Recruiting, Staffing Agency","New York, New York, United States","Clear Talent rapidly scale its talent acquisition efforts and build a best-in-class engineering, product, and design team.","358,444",,Active,2021-08-31,day,,,For Profit,https://www.cleartalent.co/,,https://www.linkedin.com/company/clear-talent/,"Clear Talent focuses on helping startups succeed as they grow. Startups entering and navigating through growth-stage are in an exciting time in their history. At the same time, the challenges of scaling culture and getting hiring right are never more difficult than when companies need to grow quickly.",,"Greater New York Area, East Coast, Northeastern US",,,,,,,,,,,,,,,,,"Administrative Services, Information Technology, Professional Services",1,Rockman Ha,1-10,,M&A,,,,,,,,,,,,,,,,,,,,Was Acquired,2021-08-31,day,Acquisition,,Private,,,,,,,,,,,,,,,6,,,7,,,,,,,
Transitive Robotics,https://www.crunchbase.com/organization/transitive-robotics,2021-01-01,month,Robotics,"Menlo Park, California, United States","Full-stack robotic capabilities as a service, e.g., webrtc-video streaming and configuration management.","358,459",,Active,,,,,For Profit,https://transitiverobotics.com/,https://twitter.com/transitiverob,https://www.linkedin.com/company/transitive-robotics,,,"San Francisco Bay Area, Silicon Valley, West Coast",,,,,,,,,,,,,,,,,"Hardware, Science and Engineering, Software",1,Christian Fritz,1-10,,,,,,,,,,,,,,,,,,,,,,,,,,,Private,,,,,,,,,,,,,,22.13%,9,,,,,,,,,,
SecureIQLab,https://www.crunchbase.com/organization/secureiqlab,2019-01-01,year,"Cloud Security, Cyber Security, Information Technology","Austin, Texas, United States","SecureIQLab offers third-party cloud security solutions, validation and advisory services.","358,482",,Active,,,,,For Profit,https://secureiqlab.com,https://twitter.com/SecureIQlab,https://www.linkedin.com/company/secureiqlab,,https://www.facebook.com/SecureIQLab,Southern US,,,,,,,,,,,,,,,,,"Information Technology, Privacy and Security",,,1-10,,,,,,,,,,,,,,,,,,,,,,,,,,,Private,,,,,,,,,,,,,,,37,,,,0,4,,Scientific and technological services,,,
Core Clinical Partners,https://www.crunchbase.com/organization/core-clinical-partners,2018-01-01,year,"Emergency Medicine, Health Care, Medical","Atlanta, Georgia, United States",Core Clinical Partners is a physician services company that offers emergency medicine and hospital medicine.,"358,491",,Active,,,,,For Profit,https://www.coreclinicalpartners.com,,https://www.linkedin.com/company/core-clinical-partners,"Core Clinical Partners provides compassionate medical care, patient care, clinic, emergency medicine, and hospital medicine services. They offer health care services for men and women. An online inquiry form is available on the company's website.",,"Greater Atlanta Area, East Coast, Southern US",,,,,,,,,,,,,,,,,Health Care,1,Boykin Robinson,11-50,,,,,,,,,,,,,,,,,,,,,,,,,,,Private,,,,,,,,,,,,,,,22,,,,0,2,,Advertising; business,,,
Vibrosculpt,https://www.crunchbase.com/organization/vibro-sculpt,2019-01-01,year,"Beauty, Health Care","Doral, Florida, United States",Brand,"358,491",,Active,,,,,For Profit,https://vibrosculpt.com/,,,Vibro Sculpt massager offers a natural and highly effective beauty solution from the comfort of your own home.,https://www.facebook.com/vibrosculptshop/,"Greater Miami Area, East Coast, Southern US",,,,,,,,,,,,,,,,,"Consumer Goods, Health Care",1,Diego Rivero,,,,,,,,,,,,,,,,,,,,,,,,,,,,Private,,,,,,,,,,,,,,-22.36%,69,,,,,,,,,,
ZeroSix,https://www.crunchbase.com/organization/zerosix,2018-01-01,day,"Artificial Intelligence (AI), Cloud Computing, Internet, Machine Learning","Santa Barbara, California, United States",ZeroSix is a cloud computing platform for machine learning and artificial intelligence.,"358,518",,Active,,,,,For Profit,https://www.zerosix.ai/,https://twitter.com/ZeroSixAI,https://www.linkedin.com/company/zerosix-ai,,https://www.facebook.com/zerosixai/,"West Coast, Western US",,,,,,,,,,,,,,,,,"Artificial Intelligence (AI), Data and Analytics, Internet Services, Science and Engineering, Software",1,Alex Lavrentev,1-10,,,,,,,,,,,,,,,,,,,,,,,,,,,Private,,,,,,,,,,,,,,,7,3,,,,,,,,,
Humantel,https://www.crunchbase.com/organization/humantel,2020-01-01,year,"Consumer Reviews, Market Research, Marketing","New York, New York, United States",Humantel is a consumer insight collective that permits associates to access unique data and insights to accelerate decision-making.,"358,524",,Active,,,,,For Profit,https://www.humantel.com/,https://twitter.com/humantelinc,https://www.linkedin.com/company/humantel/,,,"Greater New York Area, East Coast, Northeastern US",,,,,,,,,,,,,,,,,"Commerce and Shopping, Data and Analytics, Design, Sales and Marketing",,,1-10,,,,,,,,,,,,,,,,,,,,,,,,,,,Private,,,,,,,,,,,,,,,27,,,13,,,,,,,
GTWERX.ai,https://www.crunchbase.com/organization/gtwerx-ai,2023-01-22,day,"Artificial Intelligence (AI), Automotive, Generative AI, Machine Learning, Software","Ann Arbor, Michigan, United States",Generative AI technology revolutionizing maintenance and repair.,"358,525",,Active,,,,,For Profit,https://gtwerx.ai,,https://www.linkedin.com/company/gt-werx/,,,"Great Lakes, Midwestern US",,,,,,,,,,,,,,,,,"Artificial Intelligence (AI), Data and Analytics, Science and Engineering, Software, Transportation",,,1-10,,,,,,,,,,,,,,,,,,,,,,,,,,,Private,,,,,,,,,,,,,,,,,,,,,,,,,
Waggon,https://www.crunchbase.com/organization/waggon,2023-01-01,year,"Consulting, Freight Service, Supply Chain Management","New York, New York, United States","Waggon provides solutions for freight shippers, including supply chain management and consulting services.","358,539",$1M to $10M,Active,,,,,For Profit,https://waggon.io,,https://www.linkedin.com/company/waggon-io/,"Waggon is a company that offers solutions for modern freight shippers. The company's services are designed to streamline the shipping process, making it easier for businesses to manage their freight needs. Waggon's team of experts work closely with clients to provide tailored solutions that meet their specific requirements. The company's services include supply chain management, which involves coordinating and overseeing the movement of goods from the point of origin to the point of consumption. Waggon also offers consulting services, providing advice and guidance on how to improve shipping operations and increase efficiency.",,"Greater New York Area, East Coast, Northeastern US",,,,,,,,,,,,,,,,,"Professional Services, Transportation",,,11-50,,,,,,,,,,,,,,,,,,,,,,,,,,,Private,,,,,,,,,,,,,,6.95%,2,,,,,,,,,,
HUMAN,https://www.crunchbase.com/organization/humanrides,2021-02-01,day,"Artificial Intelligence (AI), Mobile Apps, Ride Sharing, Software, Transportation","Los Angeles, California, United States","Ride with drivers, not robots!","358,545",,Active,,,,,For Profit,https://norobocars.com/,https://twitter.com/NoRobocars,,"The HUMAN App Platform was founded on the belief that robocars are taking over jobs, places, humans, everyone and everything. Our team is passionate about empowering humans through accessible technology to take control. We believe that the will of humans and communities has enormous power to shape our world into a place without robocars. Ride with humans, not robots!",,"Greater Los Angeles Area, West Coast, Western US",,,,,,,,,,,,,,,,,"Apps, Artificial Intelligence (AI), Data and Analytics, Mobile, Science and Engineering, Software, Transportation",,,11-50,,,,,,,,,,,,,,,,,,,,,,,,,,,Private,,,,,,,,,,,,,,,29,,,,,,,,7813,USD,7813
FAQx,https://www.crunchbase.com/organization/faqx,2021-01-01,year,,"Claymont, Delaware, United States",FAQx helps people find the right answer faster by providing accurate and accessible essential information.,"358,551",,Active,,,,,For Profit,https://faqx.com/,,https://www.linkedin.com/company/faqx/,,,"Greater Philadelphia Area, East Coast, Southern US",,,,,,,,,,,,,,,,,,,,,,,,,,,,,,,,,,,,,,,,,,,,,,,Private,,,,,,,,,,,,,,,34,2,4,,,,,,,,
Basilica,https://www.crunchbase.com/organization/basilica,2018-12-15,day,Developer APIs,"San Francisco, California, United States",Basilica is an API that embeds high-dimensional data like images and text.,"358,569",$1M to $10M,Closed,,,,none,For Profit,https://www.basilica.ai/,https://twitter.com/basilica_ai,,,,"San Francisco Bay Area, West Coast, Western US",,,,,,,,,,,,,,,,,Software,3,"Eric Fung, Jorge Silva, Michael Lucy",1-10,1,Seed,2019-03-18,,,,Pre-Seed,,,,Pre-Seed,,USD,,,USD,,Y Combinator,1,1,,,,,,,Private,,,,,,,,,,,,,,,2,,,,,,,,,,
KIPP Texas Public Schools,https://www.crunchbase.com/organization/kipp-texas-public-schools,2018-01-01,year,"Education, Primary Education, Secondary Education","Houston, Texas, United States","KIPP Texas is an open-enrollment, public, tuition-free charter school network of 55 schools with more than 29,000 preK-12 students.","358,571",,Active,,,,,For Profit,https://kipptexas.org/,https://www.twitter.com/@kipptexas,https://www.linkedin.com/company/kipp-texas/,,https://www.facebook.com/KIPPTexas/,"Greater Houston Area, Southern US",,,,,,,,,,,,,,,,,Education,,,1001-5000,,,,,,,,,,,,,,,,,,,,,,,,,,,Private,,,,,,,,,,,,,,-45.81%,62,,,27,,,,,79365,USD,79365
Vector0,https://www.crunchbase.com/organization/vector0,2021-01-01,year,"Cyber Security, Information Technology, Network Security","Sachse, Texas, United States",Vector0 provides an attack surface management platform that discovers and identifies assets and unifies vulnerability and security data.,"358,576",,Active,2023-09-25,day,,,For Profit,https://vector0.com/,,https://www.linkedin.com/company/vector0,"Vector0 provides an attack surface management platform that discovers and identifies assets and unifies vulnerability and security data. The company was founded in 2021 and is headquartered in Sachse, Texas, United States.",,"Dallas/Fort Worth Metroplex, Southern US",,,,,,,,,,,,,,,,,"Information Technology, Privacy and Security",,,1-10,,M&A,,,,,,,,,,,,,,,,,,,,Was Acquired,2023-09-25,day,Acquisition,,Private,,,,,,,,,,,,,,,4,,,,,,,,,,
Astira Capital Partners,https://www.crunchbase.com/organization/astira-capital-partners,2023-01-01,year,"Service Industry, Wealth Management","Boston, Massachusetts, United States",Astira Capital Partners leverages a thesis-driven investing approach to drive catalytic growth and enhance value.,"358,638",,Active,,,,,For Profit,https://www.astiracp.com/,,https://www.linkedin.com/company/astiracp/,,,"Greater Boston Area, East Coast, New England",,,,,,,,,,,,,,,,,"Financial Services, Other",,,1-10,,,,,,,,,,,,,,,,,,,,,,,,,,,Private,,,,,,,,,,,,,,,19,,,,,,,,,,
