Uni Cleaning Crew,https://www.crunchbase.com/organization/uni-cleaning-crew,2021-01-01,year,"Commercial, Facilities Support Services, Janitorial Service","Tallahassee, Florida, United States",Uni Cleaning Crew is a cleaning company that provides janitorial services.,"2,405,576",,Active,,,,,For Profit,https://unicleaningcrew.com,,https://www.linkedin.com/company/uni-cleaning-crew,,,"East Coast, Southern US",,,,,,,,,,,,,,,,,"Administrative Services, Other, Real Estate",,,11-50,,,,,,,,,,,,,,,,,,,,,,,,,,,Private,,,,,,,,,,,,,,,1,,,,,,,,,,
AccountSend.com,https://www.crunchbase.com/organization/accountsend-com,2021-01-01,year,B2B,"Weston, Florida, United States",AccountSend.com is a Data Infrastructure and Analytics industry.,"2,405,481",,Active,,,,,For Profit,,,https://www.linkedin.com/company/accountsend/about,"Data company providing MILLIONS of B2B and B2C Data records. Buy verified data including Name, Email, Phone, Linkedin Address, Job Title, Location and more. Plans start at $49 for 10,000 records.....",,"Greater Miami Area, East Coast, Southern US",,,,,,,,,,,,,,,,,Other,1,Jonathan Bomser,1-10,,,,,,,,,,,,,,,,,,,,,,,,,,,Private,,,,,,,,,,,,,,,,,,,,,,,,,
Stylepick,https://www.crunchbase.com/organization/stylepick,2018-06-23,day,"E-Commerce, Fashion, Marketplace, Wholesale","Los Angeles, California, United States",STYLEPICK is the fastest growing Online Wholesale Marketplace. It is a B2B eCommerce solution empowering wholesalers and retailers.,"2,405,445",,Active,,,,,For Profit,https://stylepick.net/,https://twitter.com/style_pick,,STYLEPICK is the fastest growing Online Wholesale Marketplace. It is a B2B eCommerce solution empowering wholesalers and retailers to streamline their business operations. We are a disruptive technology revolutionizing how wholesale business is conducted. Showcase your products to thousands of buyers with new buyers joining every day.,https://www.facebook.com/stylepickusa,"Greater Los Angeles Area, West Coast, Western US",,,,,,,,,,,,,,,,,"Clothing and Apparel, Commerce and Shopping, Design",,,1-10,,,,,,,,,,,,,,,,,,,,,,,,,,,Private,,,,,,,,,,,,,,,5,1,,,,,,,,,
Windmill Manor,https://www.crunchbase.com/organization/windmill-manor,2018-01-01,year,"Elder Care, Health Care, Non Profit, Nursing and Residential Care, Rehabilitation","Coralville, Iowa, United States",Windmill Manor provides rehabilitation and nursing services for the senior community.,"2,405,415",,Active,,,,,Non-profit,https://windmillmanor.com,,https://www.linkedin.com/company/windmill-manor/,"Windmill Manor is a non-profit organization that is pleased to provide various levels of care to satisfy the requirements of the community. Skilled nursing, bounce back rehabilitation, AJ's fitness center and wellness program, outpatient therapy services, and garden court alzheimer's, dementia care are among the services offered. Their garden court alzheimer's program aims to give stability in a safe setting with trained and motivated people to help reduce fear and disorientation.",https://www.facebook.com/WindmillManor/,Midwestern US,,,,,,,,,,,,,,,,,"Health Care, Other, Social Impact",,,51-100,,,,,,,,,,,,,,,,,,,,,,,,,,,Private,,,,,,,,,,,,,,,11,,,,,,,,,,
Univaleo,https://www.crunchbase.com/organization/univaleo,2021-01-01,year,"Human Resources, Recruiting, Staffing Agency","Beverly Hills, California, United States",Univaleo is a staffing agency that offers human resources and bi-lingual medical staffing solutions for the medical industry.,"2,405,363",,Active,,,,,For Profit,https://univaleo.net,,https://www.linkedin.com/company/univaleo,,https://www.facebook.com/univaleo,"Greater Los Angeles Area, West Coast, Western US",,,,,,,,,,,,,,,,,"Administrative Services, Professional Services",,,51-100,,,,,,,,,,,,,,,,,,,,,,,,,,,Private,,,,,,,,,,,,,,,12,,,,0,0,,Advertising; business,,,
Five Star Social Media Agency,https://www.crunchbase.com/organization/five-star-social-media-agency,2019-01-01,year,"Advertising, Digital Media, Marketing, Social Media","Houston, Texas, United States","Five Star Social Media Agency provides facebook advertising, social media management, and SEO services.","2,405,362",$1M to $10M,Active,,,,,For Profit,https://www.fivestarsocialmediaagency.com,https://twitter.com/fivestarsocial1,https://www.linkedin.com/company/fivestarsocialmediaagency,"Five Star Social Media Agency is a brand marketing company. They provide content writing, website audits, keyword research, and page optimization. Their services include customer services.",https://www.facebook.com/FiveStarSocialMedia,"Greater Houston Area, Southern US",,,,,,,,,,,,,,,,,"Advertising, Internet Services, Media and Entertainment, Sales and Marketing",,,11-50,,,,,,,,,,,,,,,,,,,,,,,,,,,Private,,,,,,,,,,,,,,,3,,,,,,,,,,
The 420 Hotels,https://www.crunchbase.com/organization/the-420-hotels,2021-01-01,year,"Hospitality, Hotel","Denver, Colorado, United States",The 420 Hotels is the first to bring together overnight accommodations paired with legal and licensed on-site cannabis consumption.,"2,405,284",,Active,,,,,For Profit,https://the420hotels.com,,https://www.linkedin.com/company/the-420-hotels-inc/,The 420 Hotel Inc. is building the nation's first hotel chain where guests can consume cannabis on-site in a legally licensed lounge adding one of the most unique and exciting amenities in hospitality today.,https://www.facebook.com/420Hotels,"Greater Denver Area, Western US",,,,,,,,,,,,,,,,,Travel and Tourism,,,1-10,,,,,,,,,,,,,,,,,,,,,,,,,,,Private,,,,,,,,,,,,,,,3,,,,,,,,,,
CMF Homebuilders,https://www.crunchbase.com/organization/cmf-homebuilders,2019-01-01,year,"Commercial, Construction, Residential","Beverly Hills, California, United States",CMF Homebuilders is a construction company.,"2,405,153",Less than $1M,Active,,,,,For Profit,https://www.cmfhomebuilders.com,,https://www.linkedin.com/company/cmf-homebuilders/about/,"CMF Homebuilders is a company that specializes in commercial and residential construction. It allows them to provide an unmatched level of operational and project excellence on all of their custom home projects, always embracing the values of accountability and reliability.",https://www.facebook.com/cmfhomebuilders,"Greater Los Angeles Area, West Coast, Western US",,,,,,,,,,,,,,,,,"Other, Real Estate",,,1-10,,,,,,,,,,,,,,,,,,,,,,,,,,,Private,,,,,,,,,,,,,,,4,,,,,,,,,,
Twenties,https://www.crunchbase.com/organization/twenties,2021-01-01,year,"E-Commerce, Jewelry, Retail","Chicago, Illinois, United States","Twenties is a jewelry company that provides earrings, necklaces, and rings.","2,405,103",,Active,,,,,For Profit,https://www.twentieschi.com,https://mobile.twitter.com/twentieschi,https://www.linkedin.com/company/twenties-chicago/,"Twenties offers bracelets, rings, and set jewelries. They provide necklaces, link bracelets, band rings, and hoops. They also offer gift card services.",https://www.facebook.com/thetwenties.chi,"Greater Chicago Area, Great Lakes, Midwestern US",,,,,,,,,,,,,,,,,"Commerce and Shopping, Consumer Goods",1,Zainab Kolade O.,1-10,,,,,,,,,,,,,,,,,,,,,,,,,,,Private,,,,,,,,,,,,,,,2,,,,,,,,,,
LDS Investments,https://www.crunchbase.com/organization/lds-investments,2021-01-01,year,"Asset Management, Consulting, Financial Exchanges, Market Research, Wealth Management","New York, New York, United States",LDS Investments provides and offers consultation services on wealth and asset management.,"2,405,054",,Active,,,,,For Profit,https://www.ldsinvestments.com/,,https://www.linkedin.com/company/lds-investments,"LDS Investments provides and offers consultation services on wealth and asset management. It conducts research and analysis on various markets to place investment in. LDS Investments is based in New York, USA.",,"Greater New York Area, East Coast, Northeastern US",,,,,,,,,,,,,,,,,"Data and Analytics, Design, Financial Services, Lending and Investments, Professional Services",,,,,,,,,,,,,,,,,,,,,,,,,,,,,,Private,,,,,,,,,,,,,,,3,,,,0,2,,Insurance; financial affairs,,,
iPlasma Technology,https://www.crunchbase.com/organization/iplasma,2019-12-01,month,Health Care,"Delray Beach, Florida, United States",iPlasma Technology Inc. is a global blood plasma technology.,"2,405,036",,Active,,,,,For Profit,https://iplasma.life,,https://www.linkedin.com/company/iplasmatechnology,"iPlasma Technology Inc. is a global blood plasma technology company based in Delray Beach, Florida. We bring donors and plasma centers together on the world's only social community for blood plasma. Normalizing the act of donating source plasma through education, news, and media.",,"Greater Miami Area, East Coast, Southern US",,,,,,,,,,,,,,,,,Health Care,1,Omegadson Saint-Felix,1-10,,,,,,,,,,,,,,,,,,,,,,,,,,,Private,,,,,,,,,,,,,,,5,,,,,,,,,,
Lucky Green Ladies,https://www.crunchbase.com/organization/lucky-green-ladies,2020-01-01,year,"Adult, Cannabis, Customer Service","Norton, Massachusetts, United States",Lucky Green Ladies is a seller of adult-use cannabis.,"2,404,883",,Active,,,,,For Profit,https://www.luckygreenladies.com,https://twitter.com/LGLdelivery420,https://www.linkedin.com/company/lucky-green-ladies,,https://www.facebook.com/people/Lucky-Green-Ladies/100078019999110,"East Coast, New England, Northeastern US",,,,,,,,,,,,,,,,,"Community and Lifestyle, Food and Beverage, Health Care, Other, Professional Services",1,Alissa Nowak,11-50,,,,,,,,,,,,,,,,,,,,,,,,,,,Private,,,,,,,,,,,,,,,,,,,,,,,,,
"Feel Good, Human",https://www.crunchbase.com/organization/feel-good-human,2021-01-01,day,Business Development,"Portland, Oregon, United States",Non-profit Marketplace for Brands that Create Positive Impact,"2,404,879",,Active,,,,,Non-profit,https://www.feelgoodhuman.com/,,https://www.linkedin.com/company/feel-good-human,"Non-profit marketplace for positive brands cultivating businesses, community spaces, and content that promote  a more compassionate, transparent and responsible world",,"West Coast, Western US",,,,,,,,,,,,,,,,,Professional Services,1,Jean-Louis Ledanois,1-10,,,,,,,,,,,,,,,,,,,,,,,,,,,Private,,,,,,,,,,,,,,,8,,,,,,,,,,
Blosm Brands,https://www.crunchbase.com/organization/blosm-brands,2018-01-01,year,"Advertising, Content, Email, Marketing, Social Media","Dallas, Texas, United States","Blosm Brands is a marketing agency that offers paid media, advertising, content, email automation, and landing page optimization services.","2,404,815",$1M to $10M,Active,,,,,For Profit,https://blosmbrands.com,,https://www.linkedin.com/company/blosm-brands/,,https://www.facebook.com/blosmbrandsagency/,"Dallas/Fort Worth Metroplex, Southern US",,,,,,,,,,,,,,,,,"Advertising, Information Technology, Internet Services, Media and Entertainment, Messaging and Telecommunications, Sales and Marketing",1,Sanam Ghaneeian,1-10,,,,,,,,,,,,,,,,,,,,,,,,,,,Private,,,,,,,,,,,,,,,,,,,,,,,,,
AscendPad Agency,https://www.crunchbase.com/organization/ascendpad-agency,2020-01-01,year,"Advertising, Consulting, Content Creators, Email Marketing, Graphic Design, Information Technology, Web Design","Atlanta, Georgia, United States","AscendPad Agency offers social media strategy, graphic design, web design, email marketing, content creation, and IT consulting services.","2,404,730",,Active,,,,,For Profit,https://ascendpad.com,,https://www.linkedin.com/company/ascendpad-agency/,,https://www.facebook.com/ascendpad/,"Greater Atlanta Area, East Coast, Southern US",,,,,,,,,,,,,,,,,"Advertising, Design, Information Technology, Media and Entertainment, Professional Services, Sales and Marketing",,,,,,,,,,,,,,,,,,,,,,,,,,,,,,Private,,,,,,,,,,,,,,,2,,,,,,,,,,
Stark Family Dental,https://www.crunchbase.com/organization/stark-family-dental,2020-03-01,month,"Dental, Health Care, Medical","Massillon, Ohio, United States",Stark Family Dental in Massillon provides personalized dental care using modern methods and equipment.,"2,404,645",$1M to $10M,Active,,,,,For Profit,https://starkfamilydental.com,,https://www.linkedin.com/company/stark-family-dental,,https://www.facebook.com/StarkFamilyDental,"Great Lakes, Midwestern US",,,,,,,,,,,,,,,,,Health Care,,,1-10,,,,,,,,,,,,,,,,,,,,,,,,,,,Private,,,,,,,,,,,,,,,,,,,,,,,,,
Cobb Enterprises Elite,https://www.crunchbase.com/organization/cobb-enterprises-elite,2020-01-01,year,"Commercial Lending, Finance, Financial Services","Snellville, Georgia, United States","Cobb Elite Funding provides business funding solutions, including short-term loans, long-term loans, SBA loans, and invoice factoring.","2,404,603",,Active,,,,,For Profit,https://www.cobbelitefunding.com,,https://www.linkedin.com/company/cobb-enterprises-elite-llc,,,"Greater Atlanta Area, East Coast, Southern US",,,,,,,,,,,,,,,,,"Financial Services, Lending and Investments",,,1-10,,,,,,,,,,,,,,,,,,,,,,,,,,,Private,,,,,,,,,,,,,,,9,,,,,,,,,,
Agrinzonis Management Group,https://www.crunchbase.com/organization/agrinzonis-management-group,2020-01-01,year,"Advice, Consulting, Legal, Soccer","Atlanta, Georgia, United States","Agrinzonis Management Group is a soccer-only player management agency that offers a range of player, manager, and club services.","2,404,602",$1M to $10M,Active,,,,,For Profit,https://www.agrinzonis.com,https://twitter.com/AgrinzonisMG,https://www.linkedin.com/company/agrinzonis,,https://www.facebook.com/agrinzonissudamerica,"Greater Atlanta Area, East Coast, Southern US",,,,,,,,,,,,,,,,,"Media and Entertainment, Professional Services, Sports",,,11-50,,,,,,,,,,,,,,,,,,,,,,,,,,,Private,,,,,,,,,,,,,,68.26%,4,,,,,,,,,,
NY Building Violation Consulting,https://www.crunchbase.com/organization/ny-building-violation-consulting,2020-01-01,year,"Building Maintenance, Consulting, Real Estate","Brooklyn, New York, United States","NY Building Violation Consulting is a violation removal firm that provides DSNY tickets, DOT, and DEP violation services.","2,404,572",,Active,,,,,For Profit,https://nybvc.com,,https://www.linkedin.com/company/nybvc,"NY Building Violation Consulting is a building violation removal firm with many years of real estate experience. They work with their clients, not for their clients, they handle their client's violations as their own, because they know they want someone to resolve their violation not just take on their violation. They resolve violations by assisting with the certificate of correction paperwork and filing at the DOB and representation at ECB OATH hearings. They believe in transparency when it comes to their profession, and they do this by communicating with their clients from consultation to resolution, and even after their work is done to make sure their clients are complete satisfaction.",,"Greater New York Area, East Coast, Northeastern US",,,,,,,,,,,,,,,,,"Professional Services, Real Estate",,,1-10,,,,,,,,,,,,,,,,,,,,,,,,,,,Private,,,,,,,,,,,,,,,1,,,,,,,,,,
Shard Security,https://www.crunchbase.com/organization/shard-security,2020-01-01,year,Software,"Austin, Texas, United States",ShardSecurity offers simple yet powerful protection for your sensitive files. Render hacked files USELESS to the offenders,"2,404,569",,Active,,,,,For Profit,https://www.shardsecurity.com,,https://www.linkedin.com/company/shardsecurity,"ShardSecurity offers simple yet powerful protection for your sensitive files. ShardSecurity is built on a proprietary, patent-pending security platform that encrypts, shards and stores files on a decentralized multi-cloud storage network providing, multi-layer protection from internal or external threats. We offer both B2C & B2B solutions. Use Shard Security as an obfuscation layer to your Local, OnPremise or Cloud drives.",,Southern US,,,,,,,,,,,,,,,,,Software,2,"Apoorva Chintala, Sree Chintala",1-10,1,,2020-10-21,,,,Non-equity Assistance,,,,,,,,,USD,,MassChallenge,1,1,,,,,,,Private,,,,,,,,,,,,,,,,,,,,,,,,,
Treleven & Klingensmith,https://www.crunchbase.com/organization/treleven-klingensmith,2019-01-01,year,,"Cincinnati, Ohio, United States","Attorneys with offices in Cincinnati and Oxford, defending those charged with a DUI or Criminal Offense.","2,404,482",,Active,,,,,For Profit,https://tkcincinnati.com,,https://www.linkedin.com/company/treleven-klingensmith,"In 2020 and 2021 the readers of CityBeat voted Treleven & Klingensmith the best law firm in Cincinnati. It means the world to us that Cincinnatians, our former clients and colleagues, took the time to vote us #1. This award is a recognition of our dedication to not only providing high level legal representation but also caring for our clients like they are our friends and family.  Our goal is to help you with all of your legal needs.  Our attorneys have diverse backgrounds, from former prosecutors with years of DUI and criminal defense experience, to attorneys with business consulting and estate planning experience.  The attorneys of Treleven & Klingensmith dedicate themselves to different areas of the law and we will make sure you are connected with the right attorney. We are available 24-7 to answer any question you have.  When you call with a legal issue our team will get you in touch with the right attorney right away.  We understand that representation isn’t just fighting for your rights in the courthouse, but it means working to keep your job, keep your family and protecting your interests.",https://www.facebook.com/CincinnatiLawyers/,"Great Lakes, Midwestern US",,,,,,,,,,,,,,,,,,,,11-50,,,,,,,,,,,,,,,,,,,,,,,,,,,Private,,,,,,,,,,,,,,,22,,,,,,,,,,
Lot Club,https://www.crunchbase.com/organization/lotclub,2020-07-01,month,"Communities, Mobile Apps, Private Social Networking","Santa Monica, California, United States",A private community for select entertainment pros.,"2,404,413",,Active,,,,,For Profit,https://thelotclub.com,https://twitter.com/lotclubapp,https://www.linkedin.com/company/lotclub/,"Lot Club is a private community for select entertainment professionals. Accepted members will have profiles created by Lot Club with official industry information to showcase their past work experience. Member profiles will be customizable, with additions like social links, personal website links, ice breakers, and a regularly updated “Next Up” section where members can showcase their current goals and needs so that others can get in touch to help, or give applause to show support.  Early members of the new Lot Club community have worked on film and television projects with some of the top studios, production companies, and distributors.  The co-founders of Lot Club have been in entertainment and tech for over a decade, working on 400+ feature films, including 20+ Oscar winners. They bring an experienced perspective to this space.",https://www.facebook.com/lotclubapp,"Greater Los Angeles Area, West Coast, Western US",,,,,,,,,,,,,,,,,"Apps, Community and Lifestyle, Mobile, Software",2,"Elliott Staffer, Kate Ferguson",1-10,,,,,,,,,,,,,,,,,,,,,,,,,,,Private,,,,,,,,,,,,,,,7,,,,,,,,,,
Rays IT Technologies,https://www.crunchbase.com/organization/rays-it-technologies,2021-01-01,year,"Consulting, Recruiting, SEO, Web Development","Dallas, Texas, United States",Rays IT Technologies is an IT recruitment and consulting company that provides web development and SEO services.,"2,404,321",,Active,,,,,For Profit,https://raysittech.com,,https://www.linkedin.com/company/rays-it-tech,"Rays IT Technologies offers personal advice, strategic planning, trades, and stocks. They provide travel and aviation consulting, business services consulting, consumer products consulting, and financial services consulting. They also provide energy consulting, transport consulting, and logistics consulting services.",https://www.facebook.com/profile.php?id=100077388176958,"Dallas/Fort Worth Metroplex, Southern US",,,,,,,,,,,,,,,,,"Internet Services, Professional Services, Sales and Marketing, Software",,,1-10,,,,,,,,,,,,,,,,,,,,,,,,,,,Private,,,,,,,,,,,,,,,7,,,,,,,,,,
The Sleep NP,https://www.crunchbase.com/organization/the-sleep-np,2021-01-01,year,"Health Care, Information Technology","Turner, Maine, United States",The Sleep NP helps to turn the tables on untreated sleep-disordered breathing.,"2,404,307",,Active,,,,,For Profit,https://www.thesleepnp.com/,,https://www.linkedin.com/company/the-sleep-np-llc/,The Sleep NP helps to turn the tables on untreated sleep-disordered breathing.,https://www.facebook.com/TheSleepNP,"East Coast, New England, Northeastern US",,,,,,,,,,,,,,,,,"Health Care, Information Technology",,,1-10,,,,,,,,,,,,,,,,,,,,,,,,,,,Private,,,,,,,,,,,,,,,6,,,,,,,,,,
A Chance Re-Employment Agency,https://www.crunchbase.com/organization/a-chance-re-employment-agency,2018-01-01,year,"Career Planning, Employment, Recruiting","Fort Wayne, Indiana, United States",A Chance Re-Employment Agency offers training and placement services.,"2,404,256",,Active,,,,,For Profit,https://acre-careers.com,,https://www.linkedin.com/company/a-chance-re-employment-and-training-agency-llc,"A Chance Re-Employment Agency offers services in workplace etiquette, resume development, career counseling, skills development, and career assessments. They provide employment services for healthcare, manufacturing, retail, food services, logistics, administration, and clerical work. They also provide monthly onsite client visits, outreach services, and social service information.",https://www.facebook.com/profile.php?id=100063573731242,"Great Lakes, Midwestern US",,,,,,,,,,,,,,,,,Professional Services,,,11-50,,,,,,,,,,,,,,,,,,,,,,,,,,,Private,,,,,,,,,,,,,,,3,,,,,,,,,,
RENT BETTA,https://www.crunchbase.com/organization/rent-betta,2021-01-01,year,Internet,"New York, New York, United States",No fee NYC apartments directly from building owners and leasing offices.,"2,404,113",,Active,,,,,For Profit,https://rentbetta.com,https://twitter.com/RENTBETTA,https://www.linkedin.com/company/rent-betta-nyc,"Find your next apartment without paying a broker fee.  RENTBETTA.com connects you directly with no fee building owners and leasing offices throughout NYC, so you can see all the no fee apartments available on one website, and easily book a tour and apply.",https://www.facebook.com/nofeenycapartments/,"Greater New York Area, East Coast, Northeastern US",,,,,,,,,,,,,,,,,Internet Services,,,1-10,,,,,,,,,,,,,,,,,,,,,,,,,,,Private,,,,,,,,,,,,,,53.71%,6,,,,0,2,,Advertising; business,,,
Knowles Creative,https://www.crunchbase.com/organization/knowles-creative,2019-01-01,year,Advertising,"Amarillo, Texas, United States",Knowles Creative is a full-service digital agency specializing in web design for small businesses.,"2,403,871",,Active,,,,,For Profit,https://www.knowlescreative.com,,https://linkedin.com/company/knowles-creative/,,https://www.facebook.com/knowlescreative/,Southern US,,,,,,,,,,,,,,,,,"Advertising, Sales and Marketing",,,,,,,,,,,,,,,,,,,,,,,,,,,,,,Private,,,,,,,,,,,,,,,28,,,,,,,,,,
Oazis,https://www.crunchbase.com/organization/oazis-fund,2020-01-01,year,,"Los Angeles, California, United States",The Oazis Fund helps resolve the needs of different underserved causes and communities globally through social innovation.,"2,403,725",,Active,,,,,Non-profit,https://www.oazisf.org,,https://www.linkedin.com/company/oazisf,"Oazis works to help resolve the needs of underserved causes and communities globally for Urgent Issues, Poverty Alleviation, the Environment, Global Health, and Education. Our Approach: Prioritizing and concentrating on underserved communities and causes, using technology to lower our expenses to give more to the people, fundraising through pledges rather than donations, establishing personal partnerships with smaller organizations globally, and committing to the application of social innovation to our organization's programs. We firmly believe that our success is defined by how people will live better off because we were involved, proving our belief by being transparent with our donors and keeping them well-informed, because our intention to deliver a better world through love and service is pure.",,"Greater Los Angeles Area, West Coast, Western US",,,,,,,,,,,,,,,,,,1,Kareem El-Sisi,,,,,,,,,,,,,,,,,,,,,,,,,,,,Private,,,,,,,,,,,,,,,4,,,,,,,,,,
Hands At Home Care Services,https://www.crunchbase.com/organization/hands-at-home-care-services,2018-01-01,year,"Health Care, Home Health Care, Nursing and Residential Care","Waitsfield, Vermont, United States",Hands At Home Care Services is a home care center that offers non-medical services.,"2,403,724",,Active,,,,,For Profit,https://handsathomecareservices.com,,https://www.linkedin.com/company/hands-at-home-care-services,,https://www.facebook.com/HandsAtHomeCS,"New England, Northeastern US",,,,,,,,,,,,,,,,,Health Care,,,51-100,,,,,,,,,,,,,,,,,,,,,,,,,,,Private,,,,,,,,,,,,,,,3,,,,,,,,,,
Stemtric,https://www.crunchbase.com/organization/stemtric,2021-01-01,year,"EdTech, Education, Tutoring","Baltimore, Maryland, United States",Stemtric is an online education platform that provides group tutoring and SAT math hub for students at affordable prices.,"2,403,554",,Active,,,,,For Profit,https://stemtric.com/,,https://www.linkedin.com/company/stemtric-benefit-llc,,https://www.facebook.com/Stemtric/,"Greater Baltimore-Maryland Area, East Coast, Southern US",,,,,,,,,,,,,,,,,"Education, Software",,,1-10,,,,,,,,,,,,,,,,,,,,,,,,,,,Private,,,,,,,,,,,,,,,38,,,,,,,,,,
