website,text_len,source,text,type,closest_snapshot,closest_snapshot_time,snapshot_in_window
https://savvysum.com/,16780,crunchbase,"Services list – SavvySum Skip to content Call: Twitter Home Services Clients Software Clients Pricing Blog Contact Us Services list You Are Here: Home Services list Services list Monthly Books Simply need your books closed on a monthly basis? We turn your transactional data into an accurate financial picture so you can make timely & smart Tech Stack We implement cloud technology that provides you with instant For an affordable price, modern cloud systems will talk to your accounting system & scale with your Cash Forecasting We use a simple & practical approach to forecast cash flow that will help you avoid hair on fire situations & confidently plan for the Historical Things are behind, and it’s We will your books and keep your books current going Fractional CFO From financial models to selecting Key Performance Indicators (KPIs) to founder friendly Term Sheets & LOI negotiations – we want to see our founders win! KPIs Creating a foundation of several KPIs for software & companies is important for asking “What Will Happen?” HR Help We recommend Gusto as a modern payroll system that also manages As employees make benefit dependent changes & contribution changes, you want that data to automatically sync to your payroll Plus, the ability to new hires with digital offer Receivables & Invoicing Quickly turning receivables into cash is critical to your We make the process easy for clients to pay with modern merchant providers & a collections process when Collections customers are We use technology + a personal touch to keep your customers aligned paying Merchant Services Making it easy for clients to pay you is Syncing Stripe with Xero will embed a link within your online invoice and your clients simply pay without creating a For more complex invoicing, Recurly is a good When evaluating merchants you want a modern system that can easily calculate gross of fees & net of fees & easily exports Stripe is our preferred Payables Integrate to Xero to streamline the bill pay process so you simply review & A really nice feature is will automate the data entry on invoices so you no longer need to manually input We also time the payment of bills with your cash collection Employee Expense Automation A shoe box full of receipts? Your employees are more productive using Expensify’s automated expense Fractional Controller Your Controller binds everything together & oversees the Finalizing financial statements, investor reports, bank covenants, KPIs, due diligence, receivables management, and maintaining your accounting tech stack are the core responsibilities for a modern Accounting for companies, we add: inventory management, Gross Margin per SKU, & managing the inventory management About Savvy Sum utilizes the latest accounting integrations to automate your We are a boutique firm and as a client, you will work directly with our Savvy Sum provides accounting services to software and Contacts Home Services Clients Software Clients Pricing Blog Contact Us © All Rights Twitter Sign up Already have an account? Log in Sign up Login Don t have an account? Click here to Sign up Remember me Log in   Monthly Books – SavvySum Skip to content Call: Twitter Home Services Clients Software Clients Pricing Blog Contact Us Monthly Books You Are Here: Home Monthly Books Monthly Books SERVICE OVERVIEW Simply need your books closed on a monthly basis? We turn your transactional data into an accurate financial picture so you can make timely & smart About Savvy Sum utilizes the latest accounting integrations to automate your We are a boutique firm and as a client, you will work directly with our Savvy Sum provides accounting services to software and Contacts Home Services Clients Software Clients Pricing Blog Contact Us © All Rights Twitter Sign up Already have an account? Log in Sign up Login Don t have an account? Click here to Sign up Remember me Log in   Pricing – SavvySum Skip to content Call: Twitter Home Services Clients Software Clients Pricing Blog Contact Us Pricing You Are Here: Home Pricing Pricing PRICING TABLES Check our pricing tables to know what options is right for You can contact our Customer Service representative to calculate approximate price for your project depending on your area and amount of work that needs to be Savvy Core Ideal for small $275 mo Monthly Dedicated Bookkeeper 1 bank & 1 credit card reconciled monthly Financials closed before the of the month Basic Xero Implementation Ability to Scale Sign Me Up Savvy Plus Book A Free Custom Pricing Dedicated Bookkeeper, Controller or Multiple banks & credit Multiple Xero API Historical Custom Financial Close Key Performance Indicators (KPIs). Schedule a Call About Savvy Sum utilizes the latest accounting integrations to automate your We are a boutique firm and as a client, you will work directly with our Savvy Sum provides accounting services to software and Contacts Home Services Clients Software Clients Pricing Blog Contact Us © All Rights Twitter Sign up Already have a",startup,"{'status': '200', 'available': True, 'url': 'http://web.archive.org/web/20180818123520/https://savvysum.com/', 'timestamp': '20180818123520'}",20180818123520.0,1.0
https://quadramarketplace.com/,9987,crunchbase,"How It Works | Quadra Marketplace Home About Product Catalog How It Works Shopify Support Get Started How It Works Get Started Launch Quadra Marketplace Products in 5 Easy Steps Pick The Quadra Marketplace is full of unique print on demand and dropship products for you to sell Pick the product you want to launch on your store from our Design Use our templates to create the perfect design for your Upload Your Design The Quadra Marketplace app will put your uploaded design on your chosen product and create mockups for you to use on your online Publish Once you’ve uploaded your design, with a push of a button the Quadra Marketplace app will automatically publish your product to your online Product descriptions, tags, and images are instantly published to your store and ready to sell! Peace Of Mind Once it sells, our team prints and ships the product directly to your You can relax knowing that your customer is getting a quality product they’ll Now you can focus on growing your sales and business! Ready To Start Selling? Publish your first product now! Get Started Our Product Get Started How It Works Support Helpful Links Privacy Policy Terms of Service Follow Us Follow Copyright © • All Rights Reserved • Quadra Ecommerce | Designed by   Shopify | Quadra Marketplace Home About Product Catalog How It Works Shopify Support Get Started Integrate With Shopify Power your Shopify store with an easy Quadra Marketplace Connect Your Store  Login Or Create A Shopify Account Sign up or Login to existing your Shopify Shopify has several monthly pricing options starting at $9.99  Connect Your Shopify Store Connecting your store to the Quadra Marketplace is easy! Go to the Shopify App Store and search Quadra Click the “install” button and you’re ready to start launching  Focus On We Handle The Rest Once you’ve published products on your store, we handle all the fulfillment and product shipping to your That means you just need focus on selling and scaling your winning products! Why Choose Shopify Easy To Use Shopify is an platform no matter what your skill Marketing Tools Shopify makes marketing your store a With native integration with Facebook, Google, TikTok, you can start promoting your store on some of the most powerful advertising platforms Hosting Done For you Shopify is a setup and hosted solution, which means you don’t have to worry about servers or Payment Gateway Shopify handles your payment processing, making it easy for you to start making payments on your No technical or coding required to star taking payments on your Simplify Ecommerce With The Quadra Marketplace App  Free To Use Using the Quadra App is % You only pay once you make a We make money when you make money!  Shipped From The USA! All our products are printed and shipped from the Feel confident knowing your customers will receive their products in a timely manner  Winning Products We loaded our marketplace with products that are proven to Browse our catalog to find the perfect product to sell on your online  Easy To Customize Our app allows you to easily customize our products with your We also automatically publish it to your online Connect Your Shopify Store Today Power your Shopify store with an easy Quadra Marketplace Connect Your Store Our Product Get Started How It Works Support Helpful Links Privacy Policy Terms of Service Follow Us Follow Copyright © • All Rights Reserved • Quadra Ecommerce | Designed by   Support | Quadra Marketplace Home About Product Catalog How It Works Shopify Support Get Started Support Get Started Your content goes Edit or remove this text inline or in the module Content You can also style every aspect of this content in the module Design settings and even apply custom CSS to this text in the module Advanced Full Name Email Address Website URL Platform --- Shopify WooCommerce Etsy Describe your issue Our Product Get Started How It Works Support Helpful Links Privacy Policy Terms of Service Follow Us Follow Copyright © • All Rights Reserved • Quadra Ecommerce | Designed by   About | Quadra Marketplace Home About Product Catalog How It Works Shopify Support Get Started About Get Started Quadra’s Guiding Principle: Ecommerce Simplified From the beginning, Quadra’s mission has been to simplify the process of selling unique products We’ve done that by connecting product manufacturers with ecommerce Whether you’re a drop ship store or a print on demand seller, you will find exciting and unique products curated by our highly experienced Quadra Built by Online Sellers for Online Sellers Launching ads, finding winning products, creating product These are just a few of the many tasks you manage as a We get it! We run our own online stores, and we’re in the trenches with The key to online selling success is finding winning We grew tired of selling the same boring print on demand and drop ship products that other platforms were In this business, boring products equal no We knew that if we could find incredible products that ",startup,"{'status': '200', 'available': True, 'url': 'http://web.archive.org/web/20210919070051/https://quadramarketplace.com/', 'timestamp': '20210919070051'}",20210919070051.0,0.0
https://www.mypureoasis.com,111,crunchbase, PureOasis Coming Soon Business with a commitment to Social Justice! Stayed tuned for updates! © PureOasis LLC ,startup,"{'status': '200', 'available': True, 'url': 'http://web.archive.org/web/20190803072914/http://mypureoasis.com/', 'timestamp': '20190803072914'}",20190803072914.0,1.0
https://www.hartandhighland.com,8962,crunchbase,"Contact — Hart & Highland Projects Services PHOTO VIDEO The Neighborhood Our Studio Contact Back Beauty & Wellness Food & Bev Back STUDIO ADS UGC Projects Services PHOTO Beauty & Wellness Food & Bev VIDEO STUDIO ADS UGC The Neighborhood Our Studio Contact Scroll contact us let’s Name First Name Last Name Email Company Website http: Subject Message What is your monthly budget? This allows us to have the most effective conversation and present the best options for $5K - $10K $10K - $25K $25K - $50K $50K and up Not applicable We need your help with that! I m interested Which of the following services would you like to receive more information regarding and or pricing? Marketing Strategy Marketing & Influencer Campaigns Organic Social Media Paid Social Media UGC Content Creation Photography Videography Ad Design Graphic Design Email Marketing SMS MMS Marketing Employment Opportunities Other How did you hear about us? Email Ads Social Referral Thank you so much! We’ll be in touch very Contact Intro Contact Main email is so not dead weekly marketing trends straight to your inbox Email Address Subscribe You rock! See you in your inbox… reach out follow the good stuff Our Work Contact Us The Studio Blog Join Our Team Terms Hours your modern marketing studio Hart & Highland ©   Hart & Highland Projects Services PHOTO VIDEO The Neighborhood Our Studio Contact Back Beauty & Wellness Food & Bev Back STUDIO ADS UGC Projects Services PHOTO Beauty & Wellness Food & Bev VIDEO STUDIO ADS UGC The Neighborhood Our Studio Contact See more email is so not dead weekly marketing trends straight to your inbox Email Address Subscribe You rock! See you in your inbox… reach out follow the good stuff Our Work Contact Us The Studio Blog Join Our Team Terms Hours your modern marketing studio Hart & Highland ©   Services — Hart & Highland Projects Services PHOTO VIDEO The Neighborhood Our Studio Contact Back Beauty & Wellness Food & Bev Back STUDIO ADS UGC Projects Services PHOTO Beauty & Wellness Food & Bev VIDEO STUDIO ADS UGC The Neighborhood Our Studio Contact Scroll our services Hart & Highland is redefining the experience of growing a dynamic CPG brand with outside experts in marketing and We build a , personalized, effective marketing ecosystem for brands to get in front of their targeted consumers - point Work With Us strategy & consulting + Marketing Strategy + Marketing Planning + Social Strategy + Email Strategy + Paid Social Strategy creative services + Photography + Video + Graphic Design + Production + Styling digital marketing + Social Media Management + Social Media Advertising + Email & SMS Marketing + Partnerships + Brand Ambassador Affiliate Marketing + Influencer Marketing creative campaigns + Concept Development + Creative Guidelines + Production & Execution ready to dive in? We’re ready to help your brand be seen, heard, and Let’s develop a marketing ecosystem together that works for Reach Out Services Intro Service Breakdown Work with Us email is so not dead weekly marketing trends straight to your inbox Email Address Subscribe You rock! See you in your inbox… reach out follow the good stuff Our Work Contact Us The Studio Blog Join Our Team Terms Hours your modern marketing studio Hart & Highland ©   Projects — Hart & Highland Projects Services PHOTO VIDEO The Neighborhood Our Studio Contact Back Beauty & Wellness Food & Bev Back STUDIO ADS UGC Projects Services PHOTO Beauty & Wellness Food & Bev VIDEO STUDIO ADS UGC The Neighborhood Our Studio Contact Scroll our work partake foods VIEW PROJECT → luzern labs VIEW PROJECT → cybele’s free to eat VIEW PROJECT → smize cream VIEW PROJECT → splendid VIEW PROJECT → alden’s VIEW GALLERY → Projects Header Projects Main email is so not dead weekly marketing trends straight to your inbox Email Address Subscribe You rock! See you in your inbox… reach out follow the good stuff Our Work Contact Us The Studio Blog Join Our Team Terms Hours your modern marketing studio Hart & Highland ©   Hart & Highland Projects Services Our Studio Contact Projects Services Our Studio Contact Scroll we help dynamic brands be seen, heard, and VIEW OUR WORK → luzern labs A pioneer in clean ingredients and process, Luzern aimed to expand their digital footprint and drive revenue VIEW PROJECT → luzern labs A pioneer in clean ingredients and process, Luzern aimed to expand their digital footprint and drive revenue VIEW PROJECT → partake foods The cookie brand, Partake Foods, expanded its digital community through conscious social strategy & craveable VIEW PROJECT → partake foods The cookie brand, Partake Foods, expanded its digital community through conscious social strategy & craveable VIEW PROJECT → alden’s The ‘dessert that sparks a good time’ brand leveled up with photography that begs for one more Is there anything better than ice cream?! Maybe photos of ice cream… VIEW GALLERY → alden s The ‘dessert that sparks a good time’ brand leveled up with photography that begs for one more Is there anyth",startup,"{'status': '200', 'available': True, 'url': 'http://web.archive.org/web/20210104220227/https://www.hartandhighland.com/', 'timestamp': '20210104220227'}",20210104220227.0,0.0
https://www.onyxmotorbikes.com/,10209,crunchbase,"Wayback Machine We will keep fighting for all libraries - stand with us! Internet Archive logo A line drawing of the Internet Archive headquarters building faÃ§ade. Donate icon An illustration of a heart shape ""Donate to the archive"" Search icon An illustration of a magnifying Search icon An illustration of a magnifying Upload icon An illustration of a horizontal line over an up pointing Upload User icon An illustration of a person s head and Sign up | Log in Web icon An illustration of a computer application window Wayback Machine Texts icon An illustration of an open Books Video icon An illustration of two cells of a film Video Audio icon An illustration of an audio Audio Software icon An illustration of a "" floppy Software Images icon An illustration of two Images Donate icon An illustration of a heart shape Donate Ellipses icon An illustration of text More Hamburger icon An icon used to represent a menu that can be toggled by interacting with this Internet Archive Audio Live Music Archive Librivox Free Audio Featured All Audio This Just In Grateful Dead Netlabels Old Time Radio RPMs and Cylinder Recordings Top Audio Books & Poetry Computers, Technology and Science Music, Arts & Culture News & Public Affairs Spirituality & Religion Podcasts Radio News Archive Images Metropolitan Museum Cleveland Museum of Art Featured All Images This Just In Flickr Commons Occupy Wall Street Flickr Cover Art USGS Maps Top NASA Images Solar System Collection Ames Research Center Software Internet Arcade Console Living Room Featured All Software This Just In Old School Emulation Games Historical Software Classic PC Games Software Library Top Kodi Archive and Support File Vintage Software APK Software Software Library Software Sites Tucows Software Library Shareware Software Capsules Compilation Images ZX Spectrum DOOM Level CD Books Books to Borrow Open Library Featured All Books All Texts This Just In Smithsonian Libraries FEDLINK (US) Genealogy Lincoln Collection Top American Libraries Canadian Libraries Universal Library Project Gutenberg Children s Library Biodiversity Heritage Library Books by Language Additional Collections Video TV News Understanding 9 11 Featured All Video This Just In Prelinger Archives Democracy Now! Occupy Wall Street TV NSA Clip Library Top Animation & Cartoons Arts & Music Computers & Technology Cultural & Academic Films Ephemeral Films Movies News & Public Affairs Spirituality & Religion Sports Videos Television Videogame Videos Vlogs Youth Media Search the history of over billion web pages on the Search the Wayback Machine Search icon An illustration of a magnifying Mobile Apps Wayback Machine (iOS) Wayback Machine (Android) Browser Extensions Chrome Firefox Safari Edge Subscription Explore the Collections Learn More Build Collections Save Page Now Capture a web page as it appears now for use as a trusted citation in the Please enter a valid web address About Blog Projects Help Donate Contact Jobs Volunteer People Sign up for free Log in Search metadata Search text contents Search TV news captions Search radio transcripts Search archived web sites Advanced Search About Blog Projects Help Donate Donate icon An illustration of a heart shape Contact Jobs Volunteer People DONATE Latest Show All The Wayback Machine has not archived that Click here to search for all archived pages under https: onyxmotorbikes.com terms-conditions . The Wayback Machine requires your browser to support JavaScript, please email if you have any questions about The Wayback Machine is an initiative of the Internet Archive , a (c)(3) , building a digital library of Internet sites and other cultural artifacts in digital Other projects include Open Library & . Your use of the Wayback Machine is subject to the Internet Archive s Terms of Use .   ONYX MOTORBIKES – MOPEDS ARE BACK! CTY RCR OUR STORY FAQ CONTACT ORDER NOW! https: www.youtube.com watch?v=zkhzv6GtVac MOPEDS ARE BACK Head over to Indiegogo we are now officially launched! now for updates! Your Email Address CTY THE FREE SPIRIT Go Anywhere With Style volts of instant torque at the twist of the Clean simple fun with speeds at + mph, and a mile range to get you all around MILE MAX RANGE + MPH TOP SPEED HORSEPOWER MOTOR Hub Motor HEAVY DUTY DISC BRAKES Front Rotor POWERFUL BATTERY REGENERATIVE BRAKING Efficient recharging when braking in ONYX CTY % % Quick clean fun! Get around town while having the most fun you ve had in a long Being electric lets you take it anywhere a bike can Park it on sidewalks, ride in the bike lane, and even take it up the elevator to your PERFORMANCE Max Power Output @ Max Speed +MPH Max Horsepower @ Acceleration Seconds Max Riding Range @ Max Torque Max Electric RPM ,800RPM DRIVETRAIN Throttle Control Motor Hub Motor Regenerative Braking Max Regen Drive Modes Eco Normal Sport Motor Controller Sinusoidal MOSFET CONSTRUCTION Frame Steel Tube Chassis Battery Chassis Aluminum + Mahogany Veneer Front Suspension EBR Steel Rear Suspension Adjustabl",startup,"{'status': '200', 'available': True, 'url': 'http://web.archive.org/web/20181221001317/https://onyxmotorbikes.com/', 'timestamp': '20181221001317'}",20181221001317.0,1.0
