website,text_len,source,text,type,closest_snapshot,closest_snapshot_time,snapshot_in_window
https://www.cdindmaint.com,8471,crunchbase,"Order Parts - C & D Industrial Maintenance Skip to content Menu × Home Compactor Baler Docks Doors Order Parts Tech Support Join Our Team About Us Contact Us Pay Invoice × Home Compactor Baler Docks Doors Order Parts Tech Support Join Our Team About Us Contact Us Pay Invoice (833) Order Parts Need Help Finding a Part for a DIY Request a Free Quote on Compactor, Baler, Door, and Dock Leveler Parts We can help find replacement parts for your Simply fill out the form below and our Technician will immediately get to work finding your Please provide as much detail as possible to ensure you receive the right Name: Email: Phone: Name of Manufacturer: Model: Serial Number: Description of each part you need: (If listing multiple parts, please make sure to list them in an orderly manner so that we can process your request as quickly as ) Upload an Image This iframe contains the logic required to handle Ajax powered Gravity (833) Mon - Fri: 8 AM - 5 PM Sat & Sun By Appointment (24 7 service) Lena Road, Unit , Bradenton, FL Home Compactor Baler Docks Doors Order Parts Tech Support Join Our Team About Us Contact Us Pay Invoice © C & D Industrial Maintenance   Docks Doors - C & D Industrial Maintenance Skip to content Menu × Home Compactor Baler Docks Doors Order Parts Tech Support Join Our Team About Us Contact Us Pay Invoice × Home Compactor Baler Docks Doors Order Parts Tech Support Join Our Team About Us Contact Us Pay Invoice (833) Docks Doors Let Us Address Your Commercial Door and Loading Dock Needs Our Technicians are trained in the repair and maintenance of all types of overhead doors and dock From broken springs, missing rollers, or bent panels - we can take care of all your door Proper operating dock equipment is critical when receiving shipping Call us to today to address your loading dock Our Technicians are trained on most makes models of dock Supported by a Senior Technician with over years of experience in the Commercial Doors You can count on to make sure your commercial door is in excellent condition at all We service various types of commercial doors, including the following: Rolling Service Doors Metal Doors Sectional Steel Doors Insulated Sectional Doors Insulated Fabric Doors Thermacore® Doors Fabric Doors Rubber Doors Glass Doors Doors Rolling Shutters Counter Doors Rolling Sheet Doors Security Grilles Wind Load Doors Dock Levelers and Lifts Our team is here to maintain and repair your dock levelers and You can depend on us to work on the following equipment: Mechanical Dock Levelers Hydraulic Dock Levelers Dock Levelers Specialty Dock Levelers Loading Dock Leveler Options Dock and Lifts Set an Appointment (833) Mon - Fri: 8 AM - 5 PM Sat & Sun By Appointment (24 7 service) Lena Road, Unit , Bradenton, FL Home Compactor Baler Docks Doors Order Parts Tech Support Join Our Team About Us Contact Us Pay Invoice © C & D Industrial Maintenance   About Us - C & D Industrial Maintenance Skip to content Menu × Home Compactor Baler Docks Doors Order Parts Tech Support Join Our Team About Us Contact Us Pay Invoice × Home Compactor Baler Docks Doors Order Parts Tech Support Join Our Team About Us Contact Us Pay Invoice (833) About Us A Owned Small Business Who We Are C & D Industrial Maintenance is a owned small business that specializes in the service and repair of loading dock equipment, commercial doors, compactors and C & D Industrial is owned operated by Cris Wood, Dan Foulks, and Tom Cris Wood is a Veteran of the United States Air Force - where he worked on the B2 bombers and developed his expertise in hydraulic and electrical His experience working as a Maintenance Foreman in the coal mines and later as a Field Technician with Craft Equipment and Miner Corp helped develop his strong reputation for being able to diagnose and repair about Dan Foulks has been working in the Commercial Door industry since he graduated high With over + years in the field, Dan brings unmatched expertise on all makes models of commercial loading dock equipment, doors, and security Tom Hendon is a Veteran of the United States Army, retiring as a Sergeant Major in Tom brings + years of organizational leadership to the company and manages the Tom was set to enjoy some late tee times and long days on his boat ""Problem Solved"" until Cris called with a Tom jumped on board like any younger brother would Established in , our little company has grown from one Technician in Plant City to our Team of providing coverage to the entire state of Florida, southern Alabama and We look forward to growing with We Would Love to Hear From You If you are interested in learning more about our company, please feel free to get in touch with You may also reach out to our dependable team to learn more about the services we (833) Mon - Fri: 8 AM - 5 PM Sat & Sun By Appointment (24 7 service) Lena Road, Unit , Bradenton, FL Home Compactor Baler Docks Doors Order Parts Tech Support Join Our Team About Us Contact Us Pay Invoice © C & D Industrial Maintenan",startup,"{'status': '200', 'available': True, 'url': 'http://web.archive.org/web/20200814044408/https://cdindmaint.com/', 'timestamp': '20200814044408'}",20200814044408.0,1.0
https://missionfirstops.com/,3908,crunchbase," MISSION FIRST OPS OUR SERVICES HOW IT WORKS WHO WE ARE CONTACT US Menu You focus on your Let us handle your accounting and LEARN MORE Reliability Accuracy Experience WHAT WE DO We know that running a nonprofit is Here are a few tasks we handle to help you focus on your Bookkeeping & Financial Reporting Financial Statements Financial Advising Employee Onboarding Credit Card Management Insurance Management Employee Compliance Payroll Management Payment Processing Donor to Bank Reconciliation A Full Operations Team Without The Hassle What small or nonprofit wants to staff and manage an internal team that does everything from data entry to CFO functions? By choosing Mission First Operations, you’ll have all the results of a , operations team without having to manage and pay that entire team We offer a team of specialists that can efficiently handle all your Our team can seamlessly interface with your staff without you having to manage the Accounting That’s Valuable Anyone with a basic handle of QuickBooks can churn out reports, though there’s more to accounting than Accounting done the right way leads to financial reports that your organization can actually use to make important We deliver simple, clean reports that tell you what you need to better manage your What information do you need to know to make timely decisions? How can you structure your financials to easily have grant reports ready to go and show donors that you spend their donations wisely? With our experience in nonprofits we’re eager to take your accounting from being a chore to being an effective management How it Works You determine what staff will work with We’ll need a key point of contact that will scan over bills and fill us in on basic We’ll also work with your management team to determine what information you need and how to customize your accounting to make it an effective management We’ll provide timely, monthly reports and are also available to walk you through your reports, provide analysis, and determine how to use your financials to make effective WHO WE ARE Denise Chaykun Weaver Executive Director Denise has over fifteen years of nonprofit Early in her career Denise noticed that while most folks are passionate about their organizations’ missions, there’s also a critical need to help nonprofits to run in a smooth and professional way–and that’s the gap she hopes to Her previous work experience includes Ceterus, the State Policy Network, and the Charles Koch She lives outside of Josh Murdock Director of Finance Josh graduated from Western Michigan University in with a bachelor’s degree in He’s compiled over 6 years of experience managing finance and accounting operations for many non profit During that time he learned the value in implementing cloud based software solutions for these organizations to increase efficiency and Born and raised in Southwest Michigan, he still lives in the Kalamazoo area with his wife and two Lacey Jade Lanzo Client Success Manager Lacey has seven years of experience in property preservation, including three years in reports In this time, she took on training and leading an offshore Ops Analyst Her knowledge of Excel and macros, helped her to cut reporting time in half for over Lacey now brings this thinking of detailed analysis and time efficiency into everything she She lives on the outskirts of Austin, Texas with her husband and Carl Oberg Senior Accountant Carl has over a decade of nonprofit work experience, focused on accounting, financial organization and planning, as well as administration and programmatic His work experience includes Americans for Prosperity, the Cato Institute, the Foundation for Economic Education, Mountain States Legal Foundation, Ceterus, , and CliftonLarsonAllen, LET’S START A CONVERSATION FIRST NAME LAST NAME EMAIL ADDRESS PHONE NUMBER ORGANIZATION Copyright © Mission First Ops, All rights Scroll to top ",startup,"{'status': '200', 'available': True, 'url': 'http://web.archive.org/web/20190417143241/https://missionfirstops.com/', 'timestamp': '20190417143241'}",20190417143241.0,1.0
https://www.arboretumdermatology.com,2961,crunchbase," Services – Arboretum Dermatology   Patient Portal – Arboretum Dermatology Skip to content Facebook Twitter Instagram Home About Medical Services Cosmetic Services Patient Portal Contact Patient Portal Patient Portal PamNilzon :54:59+00:00 Patient Portal Login Welcome to our Patient If you already have a Patient Portal account, please sign in and complete our secure online forms before your You may use our portal to access information related to your visit, including your care plan, laboratory results and New patients will receive an email invitation to join the Patient Portal after scheduling their first appointment with Arboretum If you are an established patient and do not have a log in, you may request an invitation to the Patient Portal by emailing . If you have any login and or password issues, please contact our office at Access Patient Portal Pay Your Bill We accept credit, debit, and HSA cards for You may pay your bill online via our secure Patient balance PayJunction Quick Links Home About Medical Services Cosmetic Services Patient Portal Contact Stay Connected Facebook Twitter Instagram Hours Monday – Friday Closed each day from Contact Us SEATTLE East Madison Street #205 Seattle, Washington Copyright © Arboretum All Rights   Arboretum Dermatology Skip to content SCHEDULE A CONSULTATION: Facebook Twitter Instagram Home About Services Patient Portal Contact Home PamNilzon :33:29+00:00 Welcome Arboretum Dermatology is a medical and cosmetic dermatology clinic for both adults and We provide outstanding medical care for skin disorders and offer a curated selection of cosmetic skin treatments for maintenance of healthy Excellent medical care is our top Carmen Berger, a board certified dermatologist, and Rebecca Patton, a certified physician assistant, are specialized dermatology We have over years combined clinical dermatology experience in the Seattle We utilize current, knowledge and technologies in our practices, including a paperless electronic medical record and patient We aim to make each visit a positive, personal, comfortable Our patients include our friends, families and members of the communities we live We strive to offer professional service and customized care, anticipating long term relationships with our Our medical staff at Arboretum Dermatology is All members of our staff are fully trained and certified, with hands on experience in dermatology and in depth knowledge about our procedures and Our modern medical facility was completed in Located next to the Washington Park Arboretum, our clinic is filled with abundant natural light and offers pleasing views of the surrounding Location Madison St, Suite Seattle, Washington Quick Links Home About Services Patient Portal Contact Stay Connected Facebook Twitter Instagram Hours Monday – Friday Closed each day from Contact Us SEATTLE East Madison Street #205 Seattle, Washington Copyright © Arboretum All Rights   Contact – Arboretum Dermatology ",startup,"{'status': '200', 'available': True, 'url': 'http://web.archive.org/web/20181017215958/https://www.arboretumdermatology.com/', 'timestamp': '20181017215958'}",20181017215958.0,1.0
https://www.olledo.com,2079,crunchbase," Olledo - The Social Marketplace Hello there! welcome to the Olledo tribe! The Olledo App connects businesses with clients in a simple, user friendly Our app boasts a blend of a marketplace and a social network which ensures maximum engagement beneficial to both businesses and clients! Sounds amazing, right?! Well, we are working very hard in preparation for launch on 20! So why not sign up for early access? We know you are as excited as we are! In addition to enjoying early access, we will also throw in a free premium membership for LIFE! So what are you waiting for?! See you on 20! OLLEDO: Olledo is a smooth blend of a service hub and a social It is a consolidated platform which connects service providers with clients in the simplest of The app also features a forum where users can engage with More Information Subscribe Now! The Social Marketplace Ever traveled to a new city and wondered âHow on earth do I find a chef within a mile radius?â No? Well, neither have we, but it can get quite difficult finding highly rated service providers based on proximity, especially independent professionals who have no physical business With the Olledo app, users can search for service providers based on their location and can also schedule appointments within the As a service provider, Olledo is your online portfolio to showcase your services and brings you closer to a network of potential What Makes Us Different Olledo differs from other similar apps in that we offer a social networking space in addition to the Users can engage in discussions based on their areas of interest, which can range from makeup artistry to plumbing Join the Olledo tribe, a new type of social Best of both worlds Once in a blue moon Piece of cake Whole nine yards Get In Touch Have questions or remarks? Send Message Address Greenes Promise Ct Bowie, MD, Email Phone +1 (434) © OLLEDO Are you ready? Get Started Touch anywhere to preload sound for an optimum experience PLAY SOUND SKIP INTRO Subscribe now Want early access when we launch on September ? Sign up to get Get Notified × ",startup,"{'status': '200', 'available': True, 'url': 'http://web.archive.org/web/20180804183353/http://olledo.com/', 'timestamp': '20180804183353'}",20180804183353.0,1.0
https://elitefunds.com,1773,crunchbase," Webmail Login JavaScript is disabled in your For Webmail to function properly, you must enable If you do not enable JavaScript, certain features in Webmail will not function You have logged The system has detected that you are using Internet Explorer cPanel & WHM no longer supports Internet Explorer For more information, read the cPanel Blog . Please select a locale: X Close العربية čeština dansk Deutsch Ελληνικά English español español latinoamericano español de España suomi Filipino français עברית magyar i_en Bahasa Indonesia italiano 日本語 한국어 Bahasa Melayu norsk bokmål Nederlands polski português português do Brasil română русский svenska ไทย Türkçe українська Tiếng Việt 中文 中文（台湾） Continue Email Address Password Log in Change locale العربية čeština dansk Deutsch Ελληνικά English español español latinoamericano español de España suomi Filipino français עברית magyar i_en Bahasa Indonesia italiano 日本語 한국어 Bahasa Melayu norsk bokmål Nederlands polski português português do Brasil română русский svenska ไทย Türkçe українська Tiếng Việt 中文 中文（台湾） Change العربية čeština dansk Deutsch Ελληνικά English español español latinoamericano … Select a locale: English Copyright© cPanel, Privacy Policy   Web Hosting by InMotion Hosting Website coming soon! Stay This page belongs to a member of the InMotion Hosting If you are visiting this site, please check back If you own this site, your new web hosting account is now activated! Please make sure to replace this page with your own Products & Services Web Hosting Shared Hosting WordPress Hosting Managed VPS Hosting VPS Reseller Hosting Dedicated Server Hosting Website Builder Website Domains Quick Links InMotion Hosting Support Center Contact InMotion Hosting Log Into Your Control Panel Log Into Your Webmail ",startup,"{'status': '200', 'available': True, 'url': 'http://web.archive.org/web/20190408143323/http://www.elitefunds.com/', 'timestamp': '20190408143323'}",20190408143323.0,1.0
https://apertureinvestors.com,89495,crunchbase,"Aperture Investors - Active Management with Accountability Aperture Investors Managers and Funds Why We’re Different The Aperture Story Our Thinking Press Int l Int l English Italiano Menu Aperture is active management with We provide access to strategies with fees, aligning our interests with Aperture utilizes fee The strategies employed charge a fee competitive with that of passive ETFs in the same category when performance is at or below its stated As outperformance is generated, each strategy is charged a fee of % on returns generated in excess of the stated % fee The Why & How Aperture is a response to the proliferation of fixed fees in active asset management, which reward managers regardless of whether they produce outperformance for their Aperture was founded in by Peter Kraus, former CEO of Alliance Bernstein and of Investment Management at Goldman Sachs, and by Generali, one of the largest insurance companies in the world 1 . Generali will contribute up to $4BN in investment capital to the individual strategies on the Aperture platform which are intended to create better, fairer outcomes for Aperture’s investment teams receive modest base salaries by industry 2 standards, and stand to earn most of their compensation from Our investment team can receive up to % of the fees due to Aperture on realised outperformance, or % of total outperformance . % Investment teams’ max fees paid on realised Source: Generali . Total premium income exceeding EUR billion in (present in countries). Generali’s total AUM was €500 billion at the end of June We compared our typical investment team professional’s base compensation to the salaries of people with the titles “Chief Investment Officer” and “Senior Portfolio Manager” in the Greater London, United Kingdom area using LinkedIn Salary, which bases its estimates on information voluntarily provided by members and employers as of 08 18. Important information: Investments involve Past performance is not a reliable indicator of future performance and can be There can be no assurance that an investment objective will be achieved or that there will be a return on You may not get back the amount initially Before taking any investment decision, please always read the associated legal Aperture Twitter Facebook Instagram LinkedIn Follow us for updates on our firm and honest commentary on the asset management Peter Kraus Chairman and CEO Twitter Linkedin Facebook Instagram An industry veteran sharing thoughts on investing, asset management and the occasional grandchild or dog Read More See Blog Posts Simon Thorp CIO, Aperture Credit Opportunities Twitter Linkedin Facebook Instagram Follow Simon for a critical perspective on credit markets and the state of the global Read More See Blog Posts Peter Marber CIO, Aperture New World Opportunities Twitter Linkedin Facebook Instagram Peter shares over two decades’ experience investing in emerging markets and much more in his virtual Read More See Blog Posts Aperture is changing the way investment teams engage and We use digital platforms and direct engagement to make our thinking transparent because we believe that the thinking of investment professionals should be Follow our firm and our investment teams on your favorite social Our Mission Produce outperformance by aligning investors with their Our Vision To redefine the revenue model of the asset management industry by providing outperformance at a fair Investments involve Past performance is not a reliable indicator of future There can be no assurance that an investment objective will be achieved or that there will be a return on You may not get back the amount initially Our Values These are the qualities that matter most to They guide our actions and reflect our behavior with each other and with Human We embrace the best of what makes us We believe that the path to outperformance is a uniquely human It requires humility, patience, and focus – all qualities we model in our investment assessment process, in the operation of our firm, and in our interactions with Finding alpha is hard, and it relies on the distinct perspectives of active We are entrepreneurs who question our assumptions, even in the face of success, and make changes when we believe they will generate better While we leverage all the tools, data and technologies at our disposal, we fundamentally believe that it is our humanity which ultimately creates unique Read More Aligned Our incentives are the same as our clients . Our fee and compensation structures are intentionally designed to align our interests with those of our It is our fees paid on realised outperformance generated from the Aperture model that drive our earnings We charge fees similar to comparable passive products when strategies perform at or below their stated benchmarks, and only charge increased fees based on returns that exceed such stated Our investment teams aim to generate consistent performance, not to take excess They limit the assets in their",startup,"{'status': '200', 'available': True, 'url': 'http://web.archive.org/web/20181223115805/https://apertureinvestors.com/', 'timestamp': '20181223115805'}",20181223115805.0,1.0
https://www.jenlocompliance.com,1328,crunchbase," fda Legal Compliance Support | JENLO Compliance LLC | United States JENLO COMPLIANCE, LLC Solving Compliance Challenges Impacting FDA Regulated Industry Contact Us Home About Us Industry Segments Practice Areas Quality and Regulatory Compliance Blog Contact More JENLO COMPLIANCE: GLOBAL SOLUTIONS A legal and consulting firm dedicated to helping clients navigate , EU and global regulatory compliance challenges across the total product life Welcome to JENLO Compliance, a Legal and Consulting Services firm helping businesses like yours achieve their unique Through our Principal, Neil Pankau, who brings over years of experience in legal, compliance and commercial roles across multiple global life sciences organizations as well as an experienced team of consultants providing Regulatory, Quality, Operational, Manufacturing and Commercial expertise we will partner with your business to deliver practical solutions, Email Phone JENLO COMPLIANCE SERVICES Discover Our Expertise PRACTICE AREAS Expert Guidance INDUSTRY SEGMENTS Expertise Covering the Spectrum of Regulated Products QUALITY AND REGULATORY COMPLIANCE Simplifying the Complex to Achieve Business Goals CONTACT US Submit Thanks for submitting! Address: Estate Circle Gurnee, IL Email: Phone: JENLO Compliance, LLC ©2020 by JENLO Compliance Proudly created with ",startup,"{'status': '200', 'available': True, 'url': 'http://web.archive.org/web/20201217022745/https://www.jenlocompliance.com/', 'timestamp': '20201217022745'}",20201217022745.0,1.0
https://www.blmtgrp.com,136,crunchbase, For full functionality of this site it is necessary to enable Here are the instructions how to enable JavaScript in your web browser . ,startup,"{'status': '200', 'available': True, 'url': 'http://web.archive.org/web/20211126044656/http://blmtgrp.com/', 'timestamp': '20211126044656'}",20211126044656.0,0.0
