website,text_len,source,text,type,closest_snapshot,closest_snapshot_time,snapshot_in_window
https://cyberfishing.com/,9918,crunchbase,"»¿ THE ULTIMATE SMART FISHING ROD SENSOR Preorder now Learn more CES Innovation Awards Honoree Even before its global launch date, Cyberfishing and its Smart Rod Sensor has been recognized by the worldâs leading judges of new The Cyberfishing Smart Rod Sensor is among the select few launches shortlisted as an Honoree in the Innovation Awards at the prestigious CES show in Las Vegas, the annual showcase for new consumer The world is embracing a technical revolution â be at the forefront in angling with Make your fishing rod smarter with Cyberfishing Cyberfishing brings fishing rods into the modern A world where every cast is counted and saved where all your catches are recorded with a single touch and where you can build an online map of your fishing With the Cyberfishing Smart Rod Sensor attached to your rod you get all the information you need to make every trip Be Fishing will never be the same Itâs as simple as Attach, Catch and ATTACH It is so easy to attach the Sensor to a rod blank with the two hardwearing rubber Its minimal weight means it will not interfere with the performance of the CATCH Simply enjoy your dayâs fishing and let the Smart Rod Sensor instinctively do the work of recording all your fishing When you catch your trophy, save the location with a single MATCH The Cyberfishing App plots the locations of all your casts and You will know exactly where to return next time â your hotspots have been successfully Cyberfishing captures your data as you fish By combining the lightweight Smart Rod Sensor and the Cyberfishing smartphone app, you can now record all the data from your fishing trips and find big fish more And once you are part of the Cyberfishing online community with uploads and images, you can share information of fishing hotspots with other anglers to make bigger catches even more The ingenious Cyberfishing Smart Rod Sensor simply snaps onto your rod then records everything that happens as you fish â and it is so lightweight you wonât even notice it as you enjoy your day on the The Smart Rod Sensor automatically captures data on the number of casts you make and the surrounding And when you catch a fish all it takes is a simple touch of a button and the Smart Rod Sensor saves the location Thatâs saved and stored no matter how long you fight the fish or however far the wind or the current takes you away from your original And when the day is done? Thatâs when the Cyberfishing app comes into The Smart Rod Sensor connects to smartphones via Bluetooth and the Cyberfishing mobile app saves the captured data for easy access and Charge up your Smart Rod Sensor, attach it to your rod, then get casting and catching â safe in the knowledge that itâs doing the hard recording for you and you will soon have invaluable records to review and The Cyberfishing app â your fishing history mapped The Cyberfishing app records all the details of every fishing trip you make with your Smart Rod Sensor, giving your invaluable data for plotting your next HOTSPOTS Cyberfishing knows where you have been, and exactly what happened out on the In time, you will build up a complete map of your fishing CATCHES Touch the button on your Smart Rod Sensor whenever you catch a fish and you will capture all the details, saving the moment for TROPHY FISH Thatâs the weight and species plus the time and date of your greatest PERSONAL PROFILE Add your personal details to customize your Cyberfishing Plus upload photos so they are stored next to the all important hotspot PREORDER YOUR NEW SMART FISHING ROD SENSOR TODAY Be among the first anglers in the world to own the ultimate smart rod Fill application form to your Cyberfishing Smart Rod $ Package includes: 1 x Smart Rod Sensor 1 x charging cable 1 x attachment set details to download the Cyberfishing app Thank you for your order Your rod is one step closer to being smarter than ever At the end of January, you will be contacted to confirm your details and to arrange delivery of your Cyberfishing Smart Rod Sensor and smartphone Best wishes The Cyberfishing team Choose your country Afghanistan Albania Algeria Andorra Angola Antigua and Barbuda Argentina Armenia Australia Austria Azerbaijan The Bahamas Bahrain Bangladesh Barbados Belarus Belgium Belize Benin Bhutan Bolivia Bosnia and Herzegovina Botswana Brazil Brunei Bulgaria Burkina Faso Burundi Cabo Verde Cambodia Cameroon Canada Central African Republic Chad Chile China Colombia Comoros Congo, Democratic Republic of the Congo, Republic of the Costa Rica CÃ´te dâIvoire Croatia Cuba Cyprus Czech Republic Denmark Djibouti Dominica Dominican Republic East Timor (Timor-Leste) Ecuador Egypt El Salvador Equatorial Guinea Eritrea Estonia Ethiopia Advertisement Fiji Finland France Gabon The Gambia Georgia Germany Ghana Greece Grenada Guatemala Guinea Guyana Haiti Honduras Hungary Iceland India Indonesia Iran Iraq Ireland Israel Italy Jamaica Japan Jordan Kazakhstan Kenya Kiribati Korea, North Korea, South",startup,"{'status': '200', 'available': True, 'url': 'http://web.archive.org/web/20190106151732/https://cyberfishing.com/', 'timestamp': '20190106151732'}",20190106151732.0,1.0
https://www.ownerly.com/,24053,crunchbase,"Top Home Warranty Providers | Ownerly Mortgage Questions? Call Free Home Values Top Warranties Mortgages Refinancing HELOC Insurance LOG IN MENU Free Home Values Top Warranties Mortgages Refinancing Insurance HELOC LOG IN Top Home Warranty Providers Home warranties can be a great resource to help protect you from repair and replacement costs on some appliances and systems in your We’ve compiled a list of top home warranties for you to compare so you can find the right provider for your Mortgage Questions? Call 1 #1 Home Warranty Provider View Rates The Trusted Industry Leader Tested reputation with over million customers Low premiums paired with quality customer service Offers and personalized warranty coverage plans Nationwide with over ,000 skilled technicians View Rates 2 View Rates Superior Technician Network Connects you to the right technicians for your claims Free roof coverage included claims line Affordable premiums and deductibles View Rates 3 View Rates Competitive Pricing, Quality Coverage Frequently offers promotions and low rates Has a dedicated support team to help customers Offers a repair guarantee Adjustable plans based on budget View Rates 4 View Rates Plan Flexibility to Match Your Preferences Offers four plans from basic systems to platinum coverage Free credit monitoring and emergency family services Thousands of nationwide contractors to choose from View Rates 5 View Rates Plans Starting at Less Than $1 per Day One of the industry’s most affordable providers Customizable plans and coverage options Affordable while maintaining an rating from BBB View Rates 6 View Rates Lower Fees for Service Calls Among lowest service call fees from $75-$100 Competitive premiums and multiple plan options 7 support and claims line View Rates 7 View Rates Low Flat Rate Service Fee Offers a $60 flat rate service fee Two plan options with customizable No home inspection needed to begin coverage View Rates 8 View Rates Repair and Service Guarantee Excellent guarantee on repair and service Three available plans to choose from View Rates WANT HELP MAKING A GOOD MORTGAGE DECISION? Call us at What is Your Home Really Worth? Get your free HOME VALUE REPORT Stop guessing your home’s See what professional home valuation models have to GET VALUE Powered by More Home Resources Home Mortgages Home Refinancing Home HELOC Home Insurance WANT HELP MAKING A GOOD MORTGAGE DECISION? Call us at Disclaimer: The above is solely intended for informational purposes and in no way constitutes legal advice or specific © , all Rights Reserved JOIN OUR PARTNER NETWORK ABOUT US LEARN TERMS AND CONDITIONS PRIVACY POLICY DO NOT SELL MY INFORMATION CONTACT US FOLLOW US Disclaimer: Please note that Ownerly data partners calculate estimates off their Automated Valuation Models (AVMs), but you should not use these in lieu of a specific, live, on site Ownerly data is a great point of departure, but many variables exist in home valuation and we cannot guarantee that data sources will always be fully complete, accurate or predictive of actual sales and Accessibility   Top Mortgage Refinance Providers | Ownerly Mortgage Questions? Call Free Home Values Top Refinancing Mortgages HELOC Insurance Warranties LOG IN MENU Free Home Values Top Refinancing Mortgages HELOC Insurance Warranties LOG IN Top Mortgage Refinance Providers With interest rates near lows, refinancing could be a great option for lowering your rate or monthly If you’re thinking about a refinance, you’ll want to know your options Check out our list of top mortgage refinancing providers to help you make the best Mortgage Questions? Call 1 #1 Refinance Lender View Rates Simple Refinancing Done Online Quick and streamlined online application Built for those looking for a option Rated Highest Customer Satisfaction by Power Customizable solutions to help achieve your goals View Rates 2 View Rates America’s Largest Mortgage Lender Long history of customer satisfaction Can choose between easy online access or human help Extensive refinancing resources and tools One of the largest mortgage providers in the View Rates 3 View Rates Refinance Now While Rates Are Low View rates without affecting your credit Low refinance rates No SSN needed to start process Available 7 View Rates 4 View Rates Try to Unlock Savings with Comparisons Largest American lending marketplace In 5 minutes, you can compare up to 5 lenders Also helps with personal loans, home insurance and debt relief View Rates 5 View Rates Find Out How You Can Save Money by Refinancing No hidden fees Multiple refinance options including debt consolidation and Easy to track applications online View Rates 6 View Rates Do You Need Credit? A+ rating from the Better Business Bureau Conventional, FHA, Cash Out, Fixed, VA, Jumbo, and more Over $30 billion in home loans completed View Rates 7 View Rates Guaranteed Competitor Price Match Seamless and easy online experience Don’t deal with loan officers Quick process View Rates 8 View Rates Qu",startup,"{'status': '200', 'available': True, 'url': 'http://web.archive.org/web/20200504234609/https://www.ownerly.com/', 'timestamp': '20200504234609'}",20200504234609.0,1.0
https://www.thesuperfoodcopackers.com/,4347,crunchbase," The Superfood Copacker 0 Skip to Content English Copack with Us Open Menu Close Menu English Copack with Us Open Menu Close Menu English Back Copack with Us Location Contract Packaging Facilities (Globel Copacking LLC): Sherman St Hollywood FL Bakery Contract Manufacturing Facilities (Protano’s Bakery LLC): N Ave, Hollywood, FL Hours Monday — Friday 9:00am — 5:00pm Contact (305)-586-8368   The Superfood Copacker 0 Skip to Content English Copack with Us Open Menu Close Menu English Copack with Us Open Menu Close Menu English Back Copack with Us You We Products with a Let s pack Do you Want To Grow by Outsourcing your Product Packaging? Globel Copacking is a CPA Member and leading for turnkey primary and secondary packaging and specialty bakery contract manufacturing for premium and super premium superfood cookies, crackers and dry We are owned by two companies with over years in the food and packaging Our leaders built and sold market leading bakery and snacks companies to multinational corporations with global revenues of over $65 billion We have packed millions of units with an automated capacity to over million units a year and an industrial bakery operation positioned as one of the largest in the South East United Our superfood clients are looking to build brand value instead of just selling commodities, they want to accelerate , innovate a never before seen product or disrupt an existing Truth be told, many times it’s all of the “Globel’s purpose is to support innovative food companies by embracing their vision to change the world one superfood at a ” Request a Quote Full Name First Name Last Name Company Website http: Email Phone (###) ### #### Packaging Requirements Thank you! Baked Superfood Cookies Specialty Bakery Contract Manufacturing & Contract Packaging Standard Cookies: Organic, Keto, Paleo, & Kosher Specialty Cookies: Cannabis, CBD, THC & Hemp Other Superfood Snacks Retail Contract Packaging (Bulk-to-Retail) Premium Snacks Cannabis Infused Snacks Specialty Snacks Services Contract Packaging Retail Food Service BTR (Bulk-to Retail) Private Label Bakery Contract Manufacturing Premium Cookie Contract Manufacturing Specialty Bakery Contract Manufacturing Private Label Contract Manufacturing Flexible Packaging Experts Units Packed (Millions) + Premier Packaging Technology = Unmatched Quality & Standard: Pillow Bag Gusseted Bag Flat Bottom Bag Premium: Pouch (EZ-Stand) ® Face Zipper All of the flexible packaging formats available can be integrated with ® Face Globel is one of a handful of companies that can pack ® Face Zipper and Globel is not a traditional We love to push ourselves and innovate with our From contract manufacturing new products, to innovative retail packaging That’s the fun in working with Here are some ideas… Chia Cookies Hemp Heart Bites Multigrain and Seed Chips Coconut CBD Infused Treats Crunch Granola Bites Chia and Hemp Crackers Sprouted Seeds Snack Chia Fruit Crunch Gluten Free Cookies Hemp Snacks CBD Edibles Pili Nut Snacks Fruit Crisps Crunchy Chickpeas Probiotic Snacks Quinoa Rice Cakes Chocolate Chip Cookies Infused Coffee Snacks Peanut Butter Cookies Crackers: Salt, Cuban, , Protein Bites Sleep Aid Snacks Vegetables Chips Detox Bites Cannabis Infused Cookies CBD Snacks Bean Quinoa Lentil and Chia Chips Biscotti Chia and Quinoa Tortilla Chips Chocolate Hemp Seeds Oatmeal Raisin Cookies Keto Snacks Energy Balls Certification Disclaimer: Certifications correspond to Globel Copacking LLC (“Globel”), Protano’s Bakery LLC or related party Globel does not warrant that any product that it manufactures or packages is, and will be, Certifications may vary per product, facility and Some certifications are product and client Not all products will apply to receive Product or client specific applications may be Products may be manufactured or packaged in facilities with some, or none, of these Marketing Disclaimer: The photos, products and brands depicted on this site are for design purposes and meant to be examples only and not portray, in any way, a business or current client relationship with Globel Copacking Location Contract Packaging Facilities (Globel Copacking LLC): Sherman St Hollywood FL Bakery Contract Manufacturing Facilities (Protano’s Bakery LLC): N Ave, Hollywood, FL Hours Monday — Friday 9:00am — 5:00pm Contact (305)-586-8368 ",startup,"{'status': '200', 'available': True, 'url': 'http://web.archive.org/web/20220404074406/https://www.thesuperfoodcopackers.com/', 'timestamp': '20220404074406'}",20220404074406.0,0.0
https://forestsoftware.com/,101,crunchbase, This site requires JavaScript and Cookies to be Please change your browser settings or upgrade your ,startup,"{'status': '200', 'available': True, 'url': 'http://web.archive.org/web/20180807053334/http://forestsoftware.com/', 'timestamp': '20180807053334'}",20180807053334.0,1.0
https://www.papertrl.com,3511,crunchbase," PaperTrl Call Us : (410) Fax : (410) Facebook Twitter Products Solutions Industries About Us Contact Us Demo Access We Provide TAILORED SOLUTIONS FOR YOUR UNIQUE NEEDS MOBILE SOLUTIONS PRODUCTIVITY IN THE PALM OF YOUR HAND Why PaperTrl? Reduce emails by % Lower cost by % Improve Predictability Enhanced Process Consistency Reduce Risks More Reliable Backups Facilitated Collaboration Better Version Control Improved Timeliness Increased Document Security and Control Better Knowledge Management and Search Integrated Cloud Solutions We provide tailored solutions for your unique operational needs At PaperTrlÂ® our focus is to provide you tailor made business process automation tools uniquely packaged to simplify your unique organization and its highly specific About PaperTrl Relationships We work in unison with you, to add value to your Customer Focus By listening to your needs, we streamline your workï¬ows and increase your productivity the way Transform to cloud Cutting edge technology for you to do business from anywhere on the Easy to Customize Seamless integration of our products to fit the needs of your unique business How It Works At PaperTrlÂ® we understand that you and your needs are unique which deserve customized business process automation We help you increase your productivity in order to serve your customer with added efficiency and PaperTrlÂ® is a java based cloud platform which enables you to automate all of your business processes, by packaging several customized tools to manage each workï¬ow within a single PaperTrlÂ® also promotes the seamless capture of critical data within the same integrated PaperTrlÂ® gives you the unique ability to control any process and access stored data from anywhere on the planet via its secure mobile applications available for both Android and IOS mobile Happy Clients Overland Surveyors Consortium Inc Weâve been using PaperTrl for a few months now, the system is easy to access, and we have not experienced any down PaperTrl easily uploads vendor invoices for internal Using Papertrl has impacted our Accounts Payable department in the following ways: vendor invoices donât get lost in employee emails, vendor invoices get submitted one time directly into PaperTrl, and vendor invoice approvals are stamped on front of each invoice for easy Using PaperTrl has reduced our emails by % our accounting department doesnât have to spend countless hours to research emails looking for missing vendor Tidewater Inc Before implementing PaperTrl, the preparation, storage, approval, and retrieval process was fragmented among many different applications and network PaperTrl offered a solution that would consolidate all steps of our complex documentation approval and retention process all in one We chose this package because the capabilities of this system was as versatile as our We would highly recommend PaperTrl to anyone looking to streamline their operations and how their information flows through their Sustainable Design Consortium Inc We have been working with PaperTrl for over a period of one year, and extremely happy with the support given to The team is experienced, highly professional, dynamic and understands our requirements, very flexible to work with and built a good relationship with our Company Info MARYLAND Carlins Park Dr Suite B Baltimore, MD Call Us : (410) Fax : (410) Email : Copyright © Powered By Vigorous IT (Pvt) Ltd - PaperTrl - All Rights Reserved Products Solutions Industries About Us Contact Us ",startup,"{'status': '200', 'available': True, 'url': 'http://web.archive.org/web/20180805011753/http://papertrl.com/', 'timestamp': '20180805011753'}",20180805011753.0,1.0
https://www.coloradophc.com,21644,crunchbase,"Hospice Diagnosis – Colorado Palliative & Hospice Care Skip to content (303) S Revere Parkway, Suite Centennial, CO Office Hours 9:00AM to 5:00PM Welcome Our Mission Christian Principles Hospice Care Hospice Diagnosis Hospice Resources Recommended Reading Faith Initiative Veterans Palliative Care Professionals Contact Hospice Careers Patient Referrals Volunteers Donations Social Media Press Releases Employees Menu Close Hospice Diagnosis When is a patient appropriate for hospice care? This information is designed to help you determine the appropriateness for Colorado Palliative & Hospice Care . If you have any questions on how this applies to your situation or that of a loved one, please contact us or consult with your How to use Find the diagnosis that matches that of the Check indicators under the If the patient matches ANY of the criteria listed (unless otherwise stated), a referral may be made for a hospice care consultation with Colorado Palliative & Hospice Care . Cancer | Dementia | ALS | Heart disease | Liver disease | HIV | Pulmonary disease | Renal disease | Stroke Please feel free to direct any other questions regarding hospice care to: . Services provided must be related to the terminal Colorado Palliative & Hospice Care provides services without regard to race, color, national origin, disability, or age as required by Title VI of the Civil Rights Act of , Section of the Rehabilitation Act of , and the Age Discrimination Act of Pages Welcome Our Mission Christian Principles Hospice Care Hospice Diagnosis Hospice Resources Recommended Reading Faith Initiative Veterans Palliative Care Professionals Contact Hospice Careers Patient Referrals Volunteers Donations Social Media Press Releases Employees Meta Log in Entries RSS Comments RSS S Revere Parkway, Suite Centennial, CO Office: (303) Fax: (303) Mark Dabling Blvd, Suite Colorado Springs, CO Office: (719) Fax: (719) COMPANY CONTACT INFO Email (888) Billing Department Fax (303) S Revere Parkway, Suite Centennial, CO Office Hours 9:00AM to 5:00PM Copyright © Colorado Palliative & Hospice Care . Proudly powered by WordPress & The WP Theme by .   Recommended Reading – Colorado Palliative & Hospice Care Skip to content (303) S Revere Parkway, Suite Centennial, CO Office Hours 9:00AM to 5:00PM Welcome Our Mission Christian Principles Hospice Care Hospice Diagnosis Hospice Resources Recommended Reading Faith Initiative Veterans Palliative Care Professionals Contact Hospice Careers Patient Referrals Volunteers Donations Social Media Press Releases Employees Menu Close Recommended Reading Children’s Grief (for children) I Know I Made It Happen The Fall of Freddie The Leaf The Secret Places Everett Anderson’s Goodbye Annie and the Sand Dobbies: A Story about Death for Children and Their Parents Losing Uncle Tim Mundy, Sad Isn’t Bad The Kids’ Book about Death and Dying: By and for Kids The Jester Has Lost His Jingle Summerland, a Story about Death and Hope Help Me Say Goodbye A Taste of Blackberries The Empty Place The Snowman Healing your Grieving Heart for Kids Grieving Children (for adult caregivers) Recovering from the Loss of a Sibling Grief in Children The Grieving Child Talking About Death: A Dialogue between Parent and Child Jackson, Telling Children about Death Tell Me, Pap: A Family Book for Children’s Questions About Death and Funerals Keys to Helping Children Deal with Death and Grief Sad But OK: My Daddy Died Today: A Child’s View of Death On Children and Death Rosen, Unspoken Grief: Coping With Childhood Sibling Loss How Do We Tell The Children? Sibling Grief: How Parents can Help the Child Whose Brother or Sister has Died Never Too Young To Know Helping Bereaved Children: A Handbook for Practitioners A Child’s View of Grief Helping Children Cope with Grief Healing the Bereaved Child Children and Grief: When a Parent Dies Children’s Grief (Age ) Thumpy’s Story: A Story of Love and Grief Shared by Thumpy, the Bunny Daddy’s Chair I Heard Your Mommy Died I Heard Your Daddy Died Water Bugs and Dragonflies The Tenth Good Thing about Barney Children’s Grief (Age ) Sadako and the Thousand Paper Cranes The Brightest Star Geranium Morning A Quilt For Elizabeth Children’s Grief (Age ) Tiger Eyes Coping with Grief Farley, The Garden is Doing Fine Teenagers Face to Face with Bereavement Shira: A Legacy of Courage There is a Rainbow Behind Every Dark Cloud How It Feels When a Parent Dies Learning to Say : When a Parent Dies There Are Two Kinds of Terrible Bridge to Terabithia Death of a Sibling or a Friend Dusty Was My Friend: Coming to Terms with Loss I Had a Friend Named Peter: Talking to Children About the Death of a Friend When a Friend Dies (for a teenager) Last Week My Brother Anthony Died A Summer to Die (for a teenager) The Empty Place Am I Still a Big Sister? Losing Someone You Love: When a Brother or Sister Dies (for a teenager) Death of a Spouse Widow Why Her Why Now: A Man’s Journey through Love and Death and Grief I’m Grieving As Fast As I Can",startup,"{'status': '200', 'available': True, 'url': 'http://web.archive.org/web/20180805210216/http://coloradophc.com/', 'timestamp': '20180805210216'}",20180805210216.0,1.0
