website,text_len,source,text,type,closest_snapshot,closest_snapshot_time,snapshot_in_window
https://findsellers.com,11540,crunchbase,"Learn — Find Sellers Home Seller Types Retiree Landlord Deferred Maintenance FAQ Learn Pricing FAQ Login Home Seller Types Retiree Landlord Deferred Maintenance FAQ Learn Pricing FAQ Login Intelligent Direct Marketing Lists Your prospecting list is the most important component of any direct marketing Get your message in front of the right property owner, and you’ve already won half the Send your message to the wrong people, and your response rates will suffer So who are the “right property owners?” Cue predictive analytics! How Predictive Analytics Increases Response Rates Predictive analytics, or more broadly, Artificial Intelligence, can help us identify which property owners are most likely to sell in a given Advances in machine learning and artificial intelligence have enabled us to analyze vast amounts of property, financial, and demographic data in order to observe trends among current Broadly speaking, predictive analytics looks at patterns in data and assigns a predictive score based on some outcome of In our case, this outcome is whether or not a property owner is likely to Using predictive analytics, both real estate agents and investors alike can create a prospecting list to maximize response rates on a direct marketing But what exactly is direct marketing you may ask? Opposed to putting up a billboard or sending a radio blast to a wide audience, direct marketing is a marketing strategy where you directly target the individual of In real estate, often takes the form of mailing a postcard or , , or a property owner in your prospecting In real estate , predictive analytics can help you reach the right audience by giving you more control over who receives your With the ability to segment your list by demographic data and , targeted direct marketing can increase traditional response rates from less than 1% to over %, saving you money on your overall cost of mailing while generating more leads for your real estate We Make Targeted Direct Marketing Easy Pulling off a successful targeted campaign is no easy Thankfully, Find Sellers has simplified the lead generation process by developing a predictive algorithm that ranks each property owner given their current propensity to Real estate investors can use our Distressed Score , which predicts the likelihood of the property owner selling % or more below current market value, and real estate agents use our Conventional Seller Score , which predicts the likelihood of the property owner selling at full market We also provide proprietary search filters to narrow down your list by owner demographics and property characteristics, allowing users to craft their prospecting letter to a specific audience and increase response rates on , , and campaigns across the Visit to generate your intelligent direct marketing list and become more efficient and effective in your lead generation With daily updates, you can be confident that you’re targeting the right property owners whenever you decide to send your next mailer, make your next , or go out At $49 mo for unlimited seller prospecting lists, Find Sellers is a cost effective tool to increase response rates on your next campaign, Home Seller Trends by Zip Code October - October View the average income, ethnicity, and sale price of home sellers by Zip Navigate the map or click the search icon in the top left corner to search by zip Back to Top Letter Generator Learn Contact Powered by:   Deferred Maintenance — Find Sellers Home Seller Types Retiree Landlord Deferred Maintenance FAQ Learn Pricing FAQ Login Home Seller Types Retiree Landlord Deferred Maintenance FAQ Learn Pricing FAQ Login Seller Types Retiree Landlord Deferred Maintenance FAQ Deferred Maintenance Seller Older properties can be a money pit and oftentimes a seller will accept a discounted offer in order to part ways with the property, especially when they have deferred Make the seller feel as if you are his or her only way out, and give them an Criteria : Oldest homes in Owned home longer than most owners in the Home is relative to other homes in the Residence is Letter Example Dear (First Name), My name is (Your Name) and I’m a real estate professional who has a personal interest in your The current housing market is favorable to sellers and this may be the perfect time to think about selling your Older properties can be a bit of a money pit and oftentimes it’s simply better to sell and purchase a newer home, rather than perform all the necessary improvements on the property And typically, the longer you wait to perform needed improvements, the more expensive they get! There’s no pressure! I just want you to have the right information whenever you’re ready to I can provide you with a market overview and an estimated sale price of your Please call me if you’d like to learn more and I’d love to help you in whatever way I Sincerely, Your Name Your Phone Your Email Back to Top Letter Generator Learn Contact Powered by:   Landlord — Find Sellers Home Seller Ty",startup,"{'status': '200', 'available': True, 'url': 'http://web.archive.org/web/20180817162039/https://www.findsellers.com/', 'timestamp': '20180817162039'}",20180817162039.0,1.0
https://prestigiousturfinc.com/,10135,crunchbase,"Flea & Tick Treatment Programs - Prestigious Turf Management - Yorktown FALL SEEDING & AERATION IS A MUST! --- Call to get started! Seeding & Aeration Prestigious Turf Management About Prestigious Turf Rate Our Service Lawn Care Programs Services Mosquito Control Flea & Tick Treatment Programs Seeding & Aeration Soil Testing Gallery Contact Us Prestigious Turf Management - About Prestigious Turf - Rate Our Service Lawn Care Programs Services - Mosquito Control - Flea & Tick Treatment Programs - Seeding & Aeration - Soil Testing Gallery Contact Us Flea & Tick Treatment Programs Home Services Flea & Tick Treatment Programs Flea & Tick Treatment Programs The Prestigious Turf Management service provides an effective flea & tick treatment for the Hampton Roads area of Flea s and ticks can resided in your lawn or a field or tree line surrounding your The Prestigious Lawn Care program targets the fleas and ticks that could effect you or your pets with lyme disease . Prestigious Lawn Care service the Yorktown Virginia area Williamsburg, Hampton, Yorktown, Newport News, and the Hampton Roads area of Call Us at To Get Started Get a Quote For a greener lawn contact Prestigious Turf! indicates required field Name: Email: Phone: Address: Affordable Lawn Care Are you looking for an affordable lawn care in the Yorktown area of Virginia please consider Prestigious Turf Management! Prestigious provides comprehensive lawn care programs including lawn fertilization programs , insect protection , flea & Tick control , mosquito treatment programs , seeding & aeration packages . We service Yorktown, Newport News, Williamsburg, York County, Hampton, James City Our Services Blog Contact Us Gallery Lawn Care Programs Prestigious Turf Management About Prestigious Turf Rate Our Service Services Flea & Tick Treatment Programs Mosquito Control Seeding & Aeration Soil Testing For a greener lawn contact Prestigious Turf! indicates required field Name: Email: Phone: Address: Contact Us Email Phone Address Grafton Drive Yorktown, Virginia Prestigious Turf Management Lawn Care Programs Services Gallery Contact Us Website by Designs by Rosier, LLC - Williamsburg Virginia   Rate Our Service - Prestigious Turf Management - Top Quality Lawn Care FALL SEEDING & AERATION IS A MUST! --- Call to get started! Seeding & Aeration Prestigious Turf Management About Prestigious Turf Rate Our Service Lawn Care Programs Services Mosquito Control Flea & Tick Treatment Programs Seeding & Aeration Soil Testing Gallery Contact Us Prestigious Turf Management - About Prestigious Turf - Rate Our Service Lawn Care Programs Services - Mosquito Control - Flea & Tick Treatment Programs - Seeding & Aeration - Soil Testing Gallery Contact Us Rate Our Service Rate Our Service Home Prestigious Turf Management Rate Our Service Rate Our Service Rate Our Service - Your feedback is critical to our lawn maintenance Prestigious Turf Management wants you to have a weed free, health lawn, that will get you through the hot Virginia Our turf management programs are for both commercial and residential We provide weed control, Fertilization, weed control, tree & shrub treatment, and grass seed We Welcome Your Comments Rate our service - Tell us how we indicates required field Name: Email: Rate Our Service: Fair Good Excellent Your Comments: Prestigious Turf Management Prestigious offers three turf management programs, 9, 7, and 5 applications, that include Fertilization, Weed Control, Fungicide Treatments, plus Tree & Shrub We provide lawn care service for Williamsburg, Yorktown, Newport News, York County, Our Services Blog Contact Us Gallery Lawn Care Programs Prestigious Turf Management About Prestigious Turf Rate Our Service Services Flea & Tick Treatment Programs Mosquito Control Seeding & Aeration Soil Testing For a greener lawn contact Prestigious Turf! indicates required field Name: Email: Phone: Address: Contact Us Email Phone Address Grafton Drive Yorktown, Virginia Prestigious Turf Management Lawn Care Programs Services Gallery Contact Us Website by Designs by Rosier, LLC - Williamsburg Virginia   Mosquito Control - Prestigious Turf Management - Yorktown Virginia FALL SEEDING & AERATION IS A MUST! --- Call to get started! Seeding & Aeration Prestigious Turf Management About Prestigious Turf Rate Our Service Lawn Care Programs Services Mosquito Control Flea & Tick Treatment Programs Seeding & Aeration Soil Testing Gallery Contact Us Prestigious Turf Management - About Prestigious Turf - Rate Our Service Lawn Care Programs Services - Mosquito Control - Flea & Tick Treatment Programs - Seeding & Aeration - Soil Testing Gallery Contact Us Mosquito Control Home Services Mosquito Control Mosquito Control One of our Prestigious trained lawn care technicians will come to your property and inspect the area for potential mosquito breeding Our Mosquito Control will then use a backpack sprayer on targeted We spray foliage , shrubs , and trees to create a barrier of repellent for the ",startup,"{'status': '200', 'available': True, 'url': 'http://web.archive.org/web/20180806173809/http://prestigiousturfinc.com/', 'timestamp': '20180806173809'}",20180806173809.0,1.0
https://www.winehouse.com,21326,crunchbase,"My Account – The Wine House Login Create Account Wine Futures All France Italy California Spirits All Scotch Tequila Cordials Vermouth Vodka North American Whiskey Bourbon Gin Rum Mixer Brandy Cognac Other Whiskey Other Armagnac Beer All USA Other Belgium Germany England Japan Classes & Events All Classes Dinners Events WSET Now Tasting Staff Picks About Locations & Hours Shipping & Returns Search Our Shop Login Remember me Forgot password? Do not have an account? Create Account Stay up to date on the latest wines and events at The Wine House Email Sign up Wine Futures Spirits Beer Classes & Events Now Tasting Staff Picks About Gift Cards Contact (310) 0 [email protected] Hours Monday – Thursday: – Friday: – Saturday: – Sunday: – © The Wine House Shipping & Returns Privacy & Security ×   Wine – The Wine House Login Create Account Wine Futures All France Italy California Spirits All Scotch Tequila Cordials Vermouth Vodka North American Whiskey Bourbon Gin Rum Mixer Brandy Cognac Other Whiskey Other Armagnac Beer All USA Other Belgium Germany England Japan Classes & Events All Classes Dinners Events WSET Now Tasting Staff Picks About Locations & Hours Shipping & Returns The store will be open from to on Sunday, February 3, Ratings Guide The experts below rate all wines on a When ratings are made in a range ( ), we show the low end of the range (i.e. ). We round up when the average rating is a TP = The Tasting Panel W&S = Wine & Spirits JH = James Halliday LM = Luca Maroni JD = Jeb Dunnuck DE = Decanter CG = Connoisseurs Guide to California Wine ST = Stephen Tanzer s International Wine Cellar V = Vinous JS = James Suckling WE = Wine Enthusiast BH = Burghound WH = The Wine House WS = Wine Spectator WA = Robert Parker s Wine Advocate Search Our Shop Showing 1–15 of results Default sorting Name: ascending Name: descending Vintage: newest to oldest Vintage: oldest to newest Sort by price: low to high Sort by price: high to low Handpicked Regional Selection Pinot Noir Rose Yarra Valley in stock $ Add to cart Oyster Bay Wines Sauvignon Blanc Marlborough in stock $ Add to cart Cloudy Bay Vineyards Sauvignon Blanc Marlborough + in stock $ Add to cart Bird in Hand Sparkling Pinot Noir Rose Adelaide Hills in stock $ Add to cart Innocent Bystander Sauvignon Blanc Marlborough in stock $ Add to cart Craggy Range Sauvignon Blanc Te Muna Vineyards Martinborough 5 in stock $ Add to cart A A Badenhorst Family Wines Secateurs Rose Swartland in stock $ Add to cart Cep by Peay Vineyards Sauvignon Blanc Hopkins Ranch Russian River Vally in stock $ Add to cart Matias Riccitelli Hey Rose! Lujan de Cuyo WA in stock $ Add to cart Whitehaven Sauvignon Blanc Marlborough in stock $ Add to cart 1+ for $13.99 ea. Banshee Wines Rose Mendocino in stock $ Add to cart Maison Patrick Piuze Chablis ""Butteaux"" Cru in stock $ Add to cart Chantereves L’Intrus Vin de France Rouge in stock $ Add to cart Bindi Wines Chardonnay Kostas Rind Macedon Ranges, Australia in stock $ Add to cart Bodegas Zarate Caino Tinto, Rias Baixas 6 in stock $ Add to cart 1 2 … Variety Pinot Noir (781) Other Red (624) Chardonnay (549) Cabernet Sauvignon (496) Other White (469) Bordeaux Blend (345) Sangiovese (277) Syrah (212) Nebbiolo (192) Rhone Red Blend (186) Champagne Blend (173) Riesling (162) Italian Blend (149) Sauvignon Blanc (134) Sparkling (111) Rose (107) Tempranillo (93) Port Blends (81) Zinfandel (66) Grenache (56) Rice (50) Semillon (50) Chenin Blanc (48) Malbec (36) Merlot (36) Gamay (35) Barbera (30) Blanc De Blancs (28) Aglianico (26) Gruner Veltliner (25) Shiraz (23) Pinot Gris (19) Cabernet Franc (18) Albarino (17) Pinot Grigio (16) Viognier (15) Muscat (14) Petite Sirah (11) Dolcetto (10) Montepulciano (9) Nero D avola (7) Blanc De Noirs (6) Gewurztraminer (4) Pinot Blanc (3) Othre Red (2) Bl De Blancs (2) Rhone Blend (2) Red Blend (2) Shriaz (1) Kosher (1) Semillion (1) Petitie Syrah (1) Other Italian (1) Roussanne (1) Tannat (1) Red Rhone Blend (1) Shochu (1) Barbaresco (1) Other Blend (1) Vermentino (1) Bordeaux Blends (1) View All Fewer Varieties Price Under $10 (86) $10 - $20 (969) $20 - $30 (923) $30 - $40 (637) $40 - $50 (554) $50 - $100 (1375) $100 And Over (1296) View All Fewer Prices Rating + Rated (520) + Rated (294) Country State California (1750) France (1653) Italy (1293) Spain (301) Germany (138) Oregon (108) Portugal (107) Australia (100) Argentina (64) Other Imports (60) Japan (55) Austria (52) Washington (40) New Zealand (37) Chile (37) South Africa (31) Other Usa (11) Gourmet (2) View All Fewer Countries States Regions Napa (697) Sonoma (381) Other California (352) Other Italy (249) Burgundy Cote De Beaune (238) Santa Barbara (235) Burgundy Cote De Nuits (217) Champagne (207) Other France (189) Brunello Di Montalcino (166) Other Spain (137) Other Piedmonte (124) Super Tuscan (122) Northern Rhone (115) Barolo (104) Sicily (102) Loire (101) Other Burgundy (100) Other Australia (89) Chateauneuf Du Pape (87) Paso Robles (85) Port (82) So",startup,"{'status': '200', 'available': True, 'url': 'http://web.archive.org/web/20190120165318/https://www.winehouse.com/', 'timestamp': '20190120165318'}",20190120165318.0,1.0
https://houndstoothstudios.com,84,crunchbase, Houndstooth Studios Houndstooth Studios Coming INDEPENDENT DESIGN + CONTENT STUDIO ,startup,"{'status': '200', 'available': True, 'url': 'http://web.archive.org/web/20180904164925/https://houndstoothstudios.com/', 'timestamp': '20180904164925'}",20180904164925.0,1.0
https://matrubials.com/,1166,crunchbase," FOUNDERS | Matrubials, Home FOUNDERS More Home FOUNDERS Home FOUNDERS Founders Ishita Shah, Associate Director, FFHI CEO, Matrubials Bruce German, Professor, UC Davis Director, FFHI David Mills, Professor, Shields Endowed Chair UC Davis Carlito Lebrilla, Distinguished Professor, UC Davis Copyright © Matrubials, - All Rights   Matrubials, Home FOUNDERS More Home FOUNDERS Home FOUNDERS Focused on natural protection from mothers to combat severe bacterial infections and modern diseases A from University of California, Davis Contact Us About Us Innovation Our discovery addresses the dire need for novel antibacterial therapeutics from a food mammalian milk, to address and emerging antimicrobial Inspiration Millions of years of evolution resulting in nature’s perfect food, milk - a complete source of nourishment and protection for the Founders We are a collaborative, entrepreneurial, and team of scientists at UC Davis with combined years of experience studying microbiology, chemistry and food Contact Us Send Message Company Name Contact Name (First, Last) Email Phone Send Matrubials, Davis, California, United States Copyright © Matrubials, - All Rights ",startup,"{'status': '200', 'available': True, 'url': 'http://web.archive.org/web/20200824120331/https://matrubials.com/', 'timestamp': '20200824120331'}",20200824120331.0,1.0
https://www.intrepidbioprocess.com/,188,crunchbase, Intrepid Bio Process Welcome Intrepid Bioprocess Technologies is the industry’s trusted manufacturer s representative for bioprocess equipment and engineered Office: | Direct: Contact us ,startup,"{'status': '200', 'available': True, 'url': 'http://web.archive.org/web/20180828035524/https://www.intrepidbioprocess.com/', 'timestamp': '20180828035524'}",20180828035524.0,1.0
https://www.orionconsultgroup.com/,8999,crunchbase,"Veterinarian M&A — Orion Consult Group Cart 0 Home Veterinarian M&A M&A Advisory Strategic Consult Capital Partners Contact Cart 0 Home Veterinarian M&A M&A Advisory Strategic Consult Capital Partners Contact Business Acquisition and Capital Financing Scroll VETERINARIAN M&A EXPERTS Sell your Vet clinic Sell your Vet Clinic (Vet M&A Website) Name First Name Last Name Email Phone (###) ### #### Website http: Message Thank you! One of our team members will reach out as soon as they can Significant Experience Marketing, Negotiating, and Structuring Vet Clinic Merger & Acquisition Transactions Over the past year, Orion has sold 6 veterinarian clinics for over $75mm in total During this process our team has created the optimal strategies for value maximization for the business sellers and the Most recently, we strategically combined three clinics to exceed the expected offering by %. Connect with our team to discuss Vet Clinic M&A web page form (bottom) Name First Name Last Name Email Phone (###) ### #### Website http: Message Thank you! One of our team members will reach out Vetineray M&A vet m&A Dayton Street Greenwood Village, United States Hours Mon - Tue - Wed - Thu - Fri - Terms + Conditions Contact Copyright © - Orion Consult Group, All Rights   Capital Partners — Orion Consult Group Cart 0 Home Veterinarian M&A M&A Advisory Strategic Consult Capital Partners Contact Cart 0 Home Veterinarian M&A M&A Advisory Strategic Consult Capital Partners Contact Business Acquisition and Capital Financing ORION CAPITAL Connect if you would like to learn about our Capital Capital Name First Name Last Name Phone Number Email Message Thank you! Dayton Street Greenwood Village, United States Hours Mon - Tue - Wed - Thu - Fri - Terms + Conditions Contact Copyright © - Orion Consult Group, All Rights   M&A Advisory — Orion Consult Group Cart 0 Home Veterinarian M&A M&A Advisory Strategic Consult Capital Partners Contact Cart 0 Home Veterinarian M&A M&A Advisory Strategic Consult Capital Partners Contact Business Acquisition and Capital Financing Scroll Our dedication to the details and our commitment to creating relationships sets us Bringing two parties together is one piece of a puzzle that requires rolling up our sleeves and doing the work necessary to create a great outcome for both the seller and RELATIONSHIP INDUSTRY PRECISE AND IMPACTFUL Part of our focus in relationships revolves around the importance of efficiency and our awareness of how time is In the process of selling a business, everyone’s time matters and the impactful use of time is vital as there are still businesses that need to be Our experience helps us to identify the strengths and weaknesses of the parties involved so as to assimilate the needed pieces in order to conduct a thorough evaluation of a Data Compilation Evaluation and Analysis Strategy and Planning Trajectory and Goals Feedback Outcome Focused POSITIONING TO SELL Beginning with learning about the business owner and what they may be looking for, we progress into a thorough evaluation of the company’s infrastructure including the employees, the culture, the financials, the growth, the areas of need, and the tangible and intangible From there we align the owner with a synergistic match of potential suitors for discussions and opportunities for each party to learn more about each We are engaged in every step of the sale, and maintain the relationship long after the business is SERVICE FOCUSED We are a firm that specializes in strategic planning and network Our founder began in the financial industry performing audit analysis of privately and publicly held Orion’s approach includes thorough analysis of the financials and helping the business owner paint an honest picture of where the company is currently, and the potential that exists for it to Strategic Consulting Capital Analysis — Recapitlization & Growth Requirements Business & Business Owner — Needs & Desires Relationships — Aligning Mutually Beneficial Relationships Merger & Acquisitions — Positioning Both Parties for a Connect with us New Form Name First Name Last Name Phone Number Email Website http: Message Thank you! We will get in touch as soon as INDUSTRIES Veterinary Staffing Construction Manufacturing Distribution Software Every business is unique and so is every At Orion, we understand the importance of learning the unique dynamic of every business and their culture so we can provide talent that delivers value for years to From veterinary to construction to healthcare and everything in between, our team pays close attention to the details of your needs and customizes the service to deliver high return Healthcare Financial Real Estate Accounting +more work with us M&A Advisory Merger and Acquisition Industries Dayton Street Greenwood Village, United States Hours Mon - Tue - Wed - Thu - Fri - Terms + Conditions Contact Copyright © - Orion Consult Group, All Rights   Orion Consult Group Cart 0 Home Veterinarian M&A M&A Advisory Stra",startup,"{'status': '200', 'available': True, 'url': 'http://web.archive.org/web/20220317011216/https://www.orionconsultgroup.com/', 'timestamp': '20220317011216'}",20220317011216.0,0.0
