513,819,Lalo,2019-01-01,https://meetlalo.com,"New York, New York, United States","Clothing and Apparel, Commerce and Shopping, Community and Lifestyle, Consumer Goods, Design",3.0,Early Stage Venture,2023-06-13,10100000.0,Series A,15700000.0,Private,,,0.0,1.0,,4,2019,1831,False,"{'status': '200', 'available': True, 'url': 'http://web.archive.org/web/20200102040714/https://meetlalo.com/', 'timestamp': '20200102040714'}",20200102040714
514,912,Unstatiq,2022-01-01,https://www.unstatiq.com/,"San Francisco, California, United States","Artificial Intelligence, Data and Analytics, Information Technology, Science and Engineering, Software",1.0,Seed,2023-04-05,500000.0,Pre-Seed,500000.0,Private,,,,,,1,2022,11385,False,"{'status': '200', 'available': True, 'url': 'http://web.archive.org/web/20230131044259/https://www.unstatiq.com/', 'timestamp': '20230131044259'}",20230131044259
515,339,Findem,2019-01-01,https://www.findem.ai/,"Redwood City, California, United States","Administrative Services, Artificial Intelligence, Consumer Electronics, Data and Analytics, Hardware, Professional Services, Science and Engineering, Software",2.0,Early Stage Venture,2021-12-09,30000000.0,Series B,37300000.0,Private,,,,,,4,2019,879,False,"{'status': '200', 'available': True, 'url': 'http://web.archive.org/web/20201019132928/https://www.findem.ai/', 'timestamp': '20201019132928'}",20201019132928
516,638,TENYX,2021-06-15,http://www.tenyx.com,"Palo Alto, California, United States","Artificial Intelligence, Data and Analytics, Science and Engineering, Software",1.0,Seed,2022-05-10,15000000.0,Seed,15000000.0,Private,,,,,,2,2021,4627,False,"{'status': '200', 'available': True, 'url': 'http://web.archive.org/web/20220510130536/https://www.tenyx.com/', 'timestamp': '20220510130536'}",20220510130536
517,917,Snowpoint Ventures,2021-01-01,https://snowpoint.vc/,"San Francisco, California, United States","Financial Services, Lending and Investments, Science and Engineering",1.0,,2023-01-01,,Venture - Series Unknown,,Private,,,0.0,1.0,,2,2021,8082,False,"{'status': '200', 'available': True, 'url': 'http://web.archive.org/web/20220124105135/https://snowpoint.vc/', 'timestamp': '20220124105135'}",20220124105135
518,58,3Fifteen,2020-01-01,https://3fifteen.com/,"Columbia, Missouri, United States","Community and Lifestyle, Food and Beverage, Health Care",1.0,M&A,2022-01-26,730000.0,Debt Financing,730000.0,Private,,,,,,3,2020,15090,False,"{'status': '200', 'available': True, 'url': 'http://web.archive.org/web/20201215180356/https://3fifteen.com/', 'timestamp': '20201215180356'}",20201215180356
519,507,abe,2019-01-01,http://www.abebets.com,"Philadelphia, Pennsylvania, United States","Commerce and Shopping, Sports",1.0,Seed,2019-05-13,1300000.0,Pre-Seed,1300000.0,Private,,,,,,4,2019,6715,False,"{'status': '200', 'available': True, 'url': 'http://web.archive.org/web/20200809151136/https://abebets.com/', 'timestamp': '20200809151136'}",20200809151136
520,171,Manatee,2018-06-05,http://getmanatee.com,"Denver, Colorado, United States","Artificial Intelligence, Data and Analytics, Health Care, Science and Engineering, Software",3.0,,2023-04-12,4951659.0,Venture - Series Unknown,6626659.0,Private,,,,,,5,2018,3904,False,"{'status': '200', 'available': True, 'url': 'http://web.archive.org/web/20191224063540/https://getmanatee.com/', 'timestamp': '20191224063540'}",20191224063540
521,774,Bilinge,2020-01-01,https://www.bilingue4kids.com/,"Philadelphia, Pennsylvania, United States","Education, Software",1.0,,2022-08-01,10000.0,Grant,10000.0,Private,,,,,,3,2020,13586,False,"{'status': '200', 'available': True, 'url': 'http://web.archive.org/web/20211019210602/https://www.bilingue4kids.com/', 'timestamp': '20211019210602'}",20211019210602
522,801,Mycocycle,2018-10-12,https://mycocycle.com/,"Bolingbrook, Illinois, United States","Agriculture and Farming, Biotechnology, Manufacturing, Science and Engineering, Sustainability",4.0,Seed,2023-05-09,2200000.0,Seed,2829353.0,Private,,,,,,5,2018,4674,False,"{'status': '200', 'available': True, 'url': 'http://web.archive.org/web/20190718224848/http://mycocycle.com/', 'timestamp': '20190718224848'}",20190718224848
523,157,Revolution RE,2019-01-01,https://www.revolutionre.com,"Phoenix, Arizona, United States","Real Estate, Software",3.0,Seed,2022-06-09,3000000.0,Seed,3120000.0,Private,,,0.0,1.0,,4,2019,8624,False,"{'status': '200', 'available': True, 'url': 'http://web.archive.org/web/20220609170957/https://www.revolutionre.com/', 'timestamp': '20220609170957'}",20220609170957
524,110,Intown Golf Club,2019-01-01,https://www.intowngolfclub.com,"Atlanta, Georgia, United States","Sports, Travel and Tourism",1.0,Seed,2020-09-02,2350000.0,Seed,2350000.0,Private,,,,,,4,2019,11203,False,"{'status': '200', 'available': True, 'url': 'http://web.archive.org/web/20201202235853/https://www.intowngolfclub.com/', 'timestamp': '20201202235853'}",20201202235853
525,404,New Culture,2018-01-01,https://www.newculturefood.com,"San Francisco, California, United States",Food and Beverage,8.0,,2022-11-03,,Corporate Round,28500000.0,Private,,,5.0,2.0,"Foods Or Foodstuffs; Their Treatment, Not Covered By Other Classes",5,2018,3104,False,"{'status': '200', 'available': True, 'url': 'http://web.archive.org/web/20190612060758/https://www.newculturefood.com/', 'timestamp': '20190612060758'}",20190612060758
526,697,Granica,2019-01-01,https://granica.ai/,"Mountain View, California, United States","Information Technology, Software",1.0,Early Stage Venture,2023-06-08,45000000.0,Series A,45000000.0,Private,,,,,,4,2019,978,False,"{'status': '200', 'available': True, 'url': 'http://web.archive.org/web/20230608132122/http://granica.ai/', 'timestamp': '20230608132122'}",20230608132122
527,530,Valorant Health,2018-01-01,https://www.valoranthealth.com/,"Berkeley, California, United States","Government and Military, Health Care, Information Technology, Mobile, Software",3.0,,2022-09-21,1098077.0,Venture - Series Unknown,1343077.0,Private,,,0.0,0.0,,5,2018,10680,False,"{'status': '200', 'available': True, 'url': 'http://web.archive.org/web/20210602173825/https://www.valoranthealth.com/', 'timestamp': '20210602173825'}",20210602173825
528,671,Forge,2020-01-01,https://www.forgeco.com/,"Boston, Massachusetts, United States",,2.0,Early Stage Venture,2021-12-22,17000000.0,Series A,17000000.0,Private,,,,,,3,2020,4056,False,"{'status': '200', 'available': True, 'url': 'http://web.archive.org/web/20211203162420/http://forgeco.com/', 'timestamp': '20211203162420'}",20211203162420
529,405,Hypori,2021-01-01,http://www.hypori.com,"Reston, Virginia, United States","Hardware, Information Technology, Privacy and Security, Software",2.0,Early Stage Venture,2023-01-18,23000000.0,Series B,43000000.0,Private,,,3.0,0.0,Computing; Calculating,2,2021,1692,False,"{'status': '200', 'available': True, 'url': 'http://web.archive.org/web/20220113205419/https://hypori.com/', 'timestamp': '20220113205419'}",20220113205419
530,811,CuraFi,2022-01-01,https://www.curafi.com,"San Francisco, California, United States",Health Care,2.0,Seed,2023-02-19,5000000.0,Seed,6800000.0,Private,,,,,,1,2022,8999,False,"{'status': '200', 'available': True, 'url': 'http://web.archive.org/web/20230203162648/https://www.curafi.com/', 'timestamp': '20230203162648'}",20230203162648
531,392,"SucceedSmart, Inc.",2020-07-01,https://succeedsmart.com/,"Los Altos, California, United States",Professional Services,1.0,Seed,2022-03-24,6000000.0,Seed,6000000.0,Private,,,0.0,2.0,,3,2020,5391,False,"{'status': '200', 'available': True, 'url': 'http://web.archive.org/web/20210727165151/https://succeedsmart.com/', 'timestamp': '20210727165151'}",20210727165151
532,768,Gemini Sports Analytics,2021-01-01,https://geminisports.co,"Miami, Florida, United States","Artificial Intelligence, Data and Analytics, Information Technology, Science and Engineering, Software, Sports",2.0,,2023-08-18,5745161.0,Venture - Series Unknown,7245161.0,Private,,,,,,2,2021,4080,False,"{'status': '200', 'available': True, 'url': 'http://web.archive.org/web/20211127202446/https://geminisports.co/', 'timestamp': '20211127202446'}",20211127202446
533,44,FibroBiologics,2021-01-01,https://www.fibrobiologics.com/,"Houston, Texas, United States",,2.0,,2023-03-17,4999986.0,Equity Crowdfunding,104999986.0,Private,,,,,,2,2021,4453,False,"{'status': '200', 'available': True, 'url': 'http://web.archive.org/web/20220108025049/https://www.fibrobiologics.com/', 'timestamp': '20220108025049'}",20220108025049
534,665,Streamlytics,2018-10-01,http://www.streamlytics.co,"Miami, Florida, United States","Data and Analytics, Information Technology, Software",10.0,,2022-01-06,1187957.0,Equity Crowdfunding,3501298.0,Private,,,1.0,1.0,,5,2018,9201,False,"{'status': '200', 'available': True, 'url': 'http://web.archive.org/web/20191109035454/https://www.streamlytics.co/', 'timestamp': '20191109035454'}",20191109035454
535,299,"Vengreso, Inc.",2022-04-05,https://vengreso.com,"Walnut Creek, California, United States","Education, Information Technology, Internet Services, Professional Services, Sales and Marketing, Software",1.0,Seed,2022-08-01,625000.0,Pre-Seed,625000.0,Private,,,0.0,3.0,,1,2022,8169,False,"{'status': '200', 'available': True, 'url': 'http://web.archive.org/web/20230105170031/https://vengreso.com/', 'timestamp': '20230105170031'}",20230105170031
536,90,KredosAI,2021-01-07,https://www.kredosai.com,"Bellevue, Washington, United States","Financial Services, Software",1.0,Seed,2021-12-03,825000.0,Angel,825000.0,Private,,,,,,2,2021,13449,False,"{'status': '200', 'available': True, 'url': 'http://web.archive.org/web/20220112175617/https://kredosai.com/', 'timestamp': '20220112175617'}",20220112175617
537,268,1stCollab,2022-01-01,https://www.1stcollab.com,"San Francisco, California, United States","Commerce and Shopping, Sales and Marketing",1.0,Seed,2023-04-05,500000.0,Pre-Seed,500000.0,Private,,,,,,1,2022,8163,False,"{'status': '200', 'available': True, 'url': 'http://web.archive.org/web/20230111141616/https://www.1stcollab.com/', 'timestamp': '20230111141616'}",20230111141616
538,422,Camp,2018-01-01,https://camp.com/,"New York, New York, United States","Commerce and Shopping, Community and Lifestyle",6.0,,2023-06-12,17898646.0,Venture - Series Unknown,72331584.0,Private,,,0.0,15.0,,5,2018,1178,False,"{'status': '200', 'available': True, 'url': 'http://web.archive.org/web/20181101064245/http://camp.com/', 'timestamp': '20181101064245'}",20181101064245
539,330,ROAM Maui,2021-01-01,https://www.roam-maui.com/,"Nevada, Ohio, United States",Travel and Tourism,1.0,,2023-01-06,2000000.0,Venture - Series Unknown,2000000.0,Private,,,,,,2,2021,14353,False,"{'status': '200', 'available': True, 'url': 'http://web.archive.org/web/20220413073647/https://roam-maui.com/', 'timestamp': '20220413073647'}",20220413073647
540,107,Finch,2020-01-01,https://tryfinch.com/,"San Francisco, California, United States","Administrative Services, Health Care, Software",5.0,,2023-06-07,3500000.0,Undisclosed,62125000.0,Private,,,,,,3,2020,7132,False,"{'status': '200', 'available': True, 'url': 'http://web.archive.org/web/20210115143705/https://tryfinch.com/', 'timestamp': '20210115143705'}",20210115143705
541,635,Bonfire Analytics,2022-01-01,https://www.jagadirimu.com,"New York, New York, United States","Artificial Intelligence, Data and Analytics, Science and Engineering, Software",1.0,Seed,2023-08-24,1000000.0,Pre-Seed,1000000.0,Private,,,,,,1,2022,4344,False,None,
542,632,UpLyft,2018-01-01,https://myuplyft.com/,"San Diego, California, United States",Health Care,1.0,,2022-11-21,10000000.0,Debt Financing,10000000.0,Private,,,,,,5,2018,12853,False,"{'status': '200', 'available': True, 'url': 'http://web.archive.org/web/20201024082950/https://myuplyft.com/', 'timestamp': '20201024082950'}",20201024082950
543,13,DevShaft,2023-01-27,https://devshaft.net/,"Phoenix, Arizona, United States","Artificial Intelligence, Data and Analytics, Science and Engineering, Software",2.0,Early Stage Venture,2023-05-10,1121000.0,Series A,1271000.0,Private,,,,,,0,2023,10569,False,"{'status': '200', 'available': True, 'url': 'http://web.archive.org/web/20230722175131/https://devshaft.net/', 'timestamp': '20230722175131'}",20230722175131
544,794,ModernTax,2020-01-01,http://moderntax.io,"San Francisco, California, United States","Financial Services, Information Technology, Professional Services, Software",5.0,Seed,2023-10-09,100000.0,Seed,2242500.0,Private,,,,,,3,2020,2380,False,"{'status': '200', 'available': True, 'url': 'http://web.archive.org/web/20210202232415/https://www.moderntax.io/', 'timestamp': '20210202232415'}",20210202232415
545,397,The Games Fund,2020-04-15,http://gamesfund.vc,"Los Angeles, California, United States",Gaming,,,,,,,Private,,,,,,3,2020,5118,False,"{'status': '200', 'available': True, 'url': 'http://web.archive.org/web/20210414151040/https://gamesfund.vc/', 'timestamp': '20210414151040'}",20210414151040
546,19,Rubbrband,2022-01-01,https://rubbrband.com,"San Francisco, California, United States","Artificial Intelligence, Data and Analytics, Science and Engineering, Software",2.0,Seed,2023-05-04,,Seed,500000.0,Private,,,,,,1,2022,9289,False,"{'status': '200', 'available': True, 'url': 'http://web.archive.org/web/20221221213518/https://rubbrband.com/', 'timestamp': '20221221213518'}",20221221213518
547,797,Pendulum Holdings,2019-01-01,https://pendulumholdings.com,"Beverly Hills, California, United States","Financial Services, Lending and Investments, Professional Services",1.0,,2022-05-24,,Venture - Series Unknown,,Private,,,,,,4,2019,11964,False,"{'status': '200', 'available': True, 'url': 'http://web.archive.org/web/20190527031801/http://pendulumholdings.com/', 'timestamp': '20190527031801'}",20190527031801
548,563,Levelfield Financial,2018-01-31,https://levelfield.us/,"Houston, Texas, United States","Blockchain and Cryptocurrency, Financial Services, Lending and Investments, Payments, Software",4.0,,2022-07-21,1000000.0,Venture - Series Unknown,10333800.0,Private,,,,,,5,2018,6729,False,"{'status': '200', 'available': True, 'url': 'http://web.archive.org/web/20220522011857/https://levelfield.us', 'timestamp': '20220522011857'}",20220522011857
549,722,Hireguide,2021-01-01,https://www.hireguide.com/,"Santa Monica, California, United States","Administrative Services, Professional Services, Software",1.0,Seed,2021-11-10,20000.0,Pre-Seed,20000.0,Private,,,,,,2,2021,12700,False,"{'status': '200', 'available': True, 'url': 'http://web.archive.org/web/20220207192904/https://www.hireguide.com/', 'timestamp': '20220207192904'}",20220207192904
550,78,Wugen,2018-01-01,https://www.wugen.com/,"St Louis, Missouri, United States","Biotechnology, Health Care, Science and Engineering",2.0,Early Stage Venture,2021-07-15,172000000.0,Series B,172000000.0,Private,,,,,,5,2018,2749,False,"{'status': '200', 'available': True, 'url': 'http://web.archive.org/web/20190525014948/https://www.wugen.com/', 'timestamp': '20190525014948'}",20190525014948
551,778,Hook Security,2019-01-01,https://hooksecurity.co,"Lakeland, Florida, United States","Education, Information Technology, Internet Services, Privacy and Security, Professional Services, Software",6.0,Seed,2023-05-15,2300000.0,Seed,3925000.0,Private,,,0.0,1.0,,4,2019,3220,False,"{'status': '200', 'available': True, 'url': 'http://web.archive.org/web/20200201204607/https://hooksecurity.co/', 'timestamp': '20200201204607'}",20200201204607
552,405,Rinri Therapeutics,2018-01-01,https://rinri-therapeutics.com/,"Sheffield, Massachusetts, United States","Biotechnology, Health Care, Science and Engineering",3.0,,2021-05-13,4494817.0,Grant,18309225.0,Private,,,,,,5,2018,10026,False,"{'status': '200', 'available': True, 'url': 'http://web.archive.org/web/20191022105245/https://rinri-therapeutics.com/', 'timestamp': '20191022105245'}",20191022105245
553,377,IOT Cars,2022-01-10,https://iotcars.io,"Austin, Texas, United States",Internet Services,2.0,Seed,2023-02-10,1000000.0,Seed,1200000.0,Private,,,,,,1,2022,15154,False,None,
554,655,Afterparty,2021-01-01,https://afterparty.com,"Los Angeles, California, United States","Blockchain and Cryptocurrency, Financial Services, Internet Services, Media and Entertainment, Payments, Software",5.0,,2023-09-20,5000000.0,Venture - Series Unknown,25825663.0,Private,,,0.0,8.0,,2,2021,731,False,"{'status': '200', 'available': True, 'url': 'http://web.archive.org/web/20220119134906/https://www.afterparty.com/', 'timestamp': '20220119134906'}",20220119134906
555,930,Tetra,2021-12-01,https://www.tetra.com,"Boston, Massachusetts, United States","Consumer Goods, Real Estate",2.0,Seed,2021-12-20,4300000.0,Seed,4300000.0,Private,,,,,,2,2021,6829,False,"{'status': '200', 'available': True, 'url': 'http://web.archive.org/web/20220120051406/http://www.tetra.com/', 'timestamp': '20220120051406'}",20220120051406
556,27,DappHero,2019-12-31,http://www.dapphero.io,"New York, New York, United States","Blockchain and Cryptocurrency, Financial Services, Other, Software",1.0,Seed,2021-05-17,1500000.0,Seed,1500000.0,Private,,,,,,3,2019,12564,False,"{'status': '200', 'available': True, 'url': 'http://web.archive.org/web/20200806093549/https://www.dapphero.io/', 'timestamp': '20200806093549'}",20200806093549
557,272,Cuanto,2018-01-01,https://web.cuanto.app,"San Francisco, California, United States","Financial Services, Information Technology, Mobile, Payments, Software",2.0,Seed,2019-03-18,1450000.0,Pre-Seed,1450000.0,Private,,,,,,5,2018,14345,False,"{'status': '200', 'available': True, 'url': 'http://web.archive.org/web/20200512040617/https://web.cuanto.app/', 'timestamp': '20200512040617'}",20200512040617
558,799,Phosio Corporation,2021-01-01,https://phosio.com,"Corvallis, Oregon, United States","Hardware, Science and Engineering",5.0,Seed,2023-06-22,500000.0,Pre-Seed,1176000.0,Private,,,0.0,0.0,,2,2021,13938,False,"{'status': '200', 'available': True, 'url': 'http://web.archive.org/web/20220221125127/https://phosio.com/', 'timestamp': '20220221125127'}",20220221125127
559,712,GroceryList,2020-05-09,https://grocerylistgroup.com/,"Longwood, Florida, United States","Administrative Services, Commerce and Shopping, Food and Beverage",1.0,Seed,2023-08-14,120000.0,Pre-Seed,120000.0,Private,,,,,,3,2020,12328,False,None,
560,805,LiveWire,2022-01-01,https://www.livewire.com,"Malibu, California, United States","Manufacturing, Transportation",2.0,IPO,2022-09-27,200000000.0,Post-IPO Equity,300000000.0,Public,2022-10-07,,,,,1,2022,1826,False,"{'status': '200', 'available': True, 'url': 'http://web.archive.org/web/20221230151129/https://www.livewire.com/', 'timestamp': '20221230151129'}",20221230151129
561,839,BloomJoy,2018-01-01,https://bloomjoy.com/,"Austin, Texas, United States","Advertising, Content and Publishing, Internet Services, Media and Entertainment, Sales and Marketing",2.0,Seed,2018-04-15,1190000.0,Seed,1310000.0,Private,,,,,,5,2018,8783,False,"{'status': '200', 'available': True, 'url': 'http://web.archive.org/web/20190102121046/https://www.bloomjoy.com/', 'timestamp': '20190102121046'}",20190102121046
562,566,Magic,2022-03-01,https://magic.dev,"San Francisco, California, United States","Artificial Intelligence, Data and Analytics, Information Technology, Science and Engineering, Software",2.0,Early Stage Venture,2023-02-06,23000000.0,Series A,28125000.0,Private,,,0.0,1.0,,1,2022,12295,False,"{'status': '200', 'available': True, 'url': 'http://web.archive.org/web/20221202192528/https://magic.dev/', 'timestamp': '20221202192528'}",20221202192528
563,643,Ecellix,2018-01-01,http://www.ecellix.com,"Seattle, Washington, United States","Biotechnology, Data and Analytics, Design, Energy, Science and Engineering, Sustainability",3.0,,2021-01-01,,Venture - Series Unknown,1005000.0,Private,,,0.0,0.0,,5,2018,11107,False,"{'status': '200', 'available': True, 'url': 'http://web.archive.org/web/20180820195942/https://ecellix.com/', 'timestamp': '20180820195942'}",20180820195942
564,456,Blackdot,2019-01-11,https://www.blackdot.tattoo,"Austin, Texas, United States","Media and Entertainment, Other",2.0,Seed,2021-05-12,4500000.0,Seed,4500000.0,Private,,,4.0,1.0,Medical Or Veterinary Science; Hygiene,4,2019,6976,False,"{'status': '200', 'available': True, 'url': 'http://web.archive.org/web/20210201144237/https://www.blackdot.tattoo/', 'timestamp': '20210201144237'}",20210201144237
565,419,Photys Therapeutics,2021-01-01,https://www.photys.com/,"Cambridge, Massachusetts, United States","Biotechnology, Science and Engineering",1.0,Early Stage Venture,2022-09-08,75000000.0,Series A,75000000.0,Private,,,,,,2,2021,3981,False,"{'status': '200', 'available': True, 'url': 'http://web.archive.org/web/20211220204054/http://photys.com/', 'timestamp': '20211220204054'}",20211220204054
566,148,Cloud Water Filters,2021-05-01,https://www.cloudwaterfilters.com/,"San Diego, California, United States","Apps, Consumer Electronics, Food and Beverage, Hardware, Information Technology, Internet Services, Mobile, Software, Sustainability",2.0,Seed,2021-10-12,1500000.0,Seed,2300000.0,Private,,,1.0,1.0,Physical Or Chemical Processes Or Apparatus In General,2,2021,9315,False,None,
567,420,Laguna Games,2019-01-01,https://laguna.games/,"San Francisco, California, United States",Gaming,1.0,Seed,2021-10-15,5000000.0,Seed,5000000.0,Private,,,,,,4,2019,8427,False,"{'status': '200', 'available': True, 'url': 'http://web.archive.org/web/20210420040028/https://laguna.games/', 'timestamp': '20210420040028'}",20210420040028
568,41,Actio Biosciences,2021-01-01,https://www.actiobiosciences.com,"San Diego, California, United States","Biotechnology, Data and Analytics, Health Care, Science and Engineering",1.0,Early Stage Venture,2023-09-12,55000000.0,Series A,55000000.0,Private,,,,,,2,2021,1060,False,"{'status': '200', 'available': True, 'url': 'http://web.archive.org/web/20211125113500/http://actiobiosciences.com/', 'timestamp': '20211125113500'}",20211125113500
569,36,MetaSpark Corporation,2020-05-09,https://metaspark.io,"Los Angeles, California, United States","Artificial Intelligence, Data and Analytics, Science and Engineering, Software",1.0,Seed,2021-06-07,500000.0,Seed,500000.0,Private,,,,,,3,2020,12739,False,"{'status': '200', 'available': True, 'url': 'http://web.archive.org/web/20210116022307/https://www.metaspark.io/', 'timestamp': '20210116022307'}",20210116022307
570,630,Coflyt,2019-02-01,https://coflyt.com,"Pensacola, Florida, United States","Science and Engineering, Software",1.0,Seed,2020-05-12,500000.0,Seed,500000.0,Private,,,0.0,1.0,,4,2019,15194,False,"{'status': '200', 'available': True, 'url': 'http://web.archive.org/web/20200809020630/https://coflyt.com/', 'timestamp': '20200809020630'}",20200809020630
571,658,Transit Gigs,2023-09-23,https://transitgigs.com/,"Miami, Florida, United States","Information Technology, Internet Services, Media and Entertainment, Sales and Marketing, Transportation",1.0,Seed,2020-08-20,52000.0,Pre-Seed,52000.0,Private,,,,,,0,2023,7538,False,"{'status': '200', 'available': True, 'url': 'http://web.archive.org/web/20231110004055/http://transitgigs.com/', 'timestamp': '20231110004055'}",20231110004055
572,650,Chloris Geospatial,2021-01-01,https://chloris.earth/,"Newtonville, Massachusetts, United States","Hardware, Natural Resources, Sustainability",2.0,Seed,2023-03-01,,Seed,2499999.0,Private,,,,,,2,2021,7020,False,"{'status': '200', 'available': True, 'url': 'http://web.archive.org/web/20220108160655/https://chloris.earth/', 'timestamp': '20220108160655'}",20220108160655
573,684,Unlock,2019-01-01,https://www.unlock.com,"New York, New York, United States","Financial Services, Real Estate",2.0,,2023-09-13,100000000.0,Debt Financing,400000000.0,Private,,,,,,4,2019,1252,False,"{'status': '200', 'available': True, 'url': 'http://web.archive.org/web/20191229040406/http://www.unlock.com:80/?', 'timestamp': '20191229040406'}",20191229040406
574,493,Zeni,2019-01-01,https://www.zeni.ai/,"Palo Alto, California, United States","Artificial Intelligence, Data and Analytics, Financial Services, Professional Services, Science and Engineering, Software",3.0,Early Stage Venture,2021-08-04,34000000.0,Series B,47500000.0,Private,,,0.0,6.0,,4,2019,675,False,"{'status': '200', 'available': True, 'url': 'http://web.archive.org/web/20200803150419/https://www.zeni.ai/', 'timestamp': '20200803150419'}",20200803150419
575,807,Peertol,2021-09-01,https://peertol.com,"San Francisco, California, United States","Blockchain and Cryptocurrency, Information Technology, Other",1.0,Seed,2021-09-01,10000000.0,Seed,10000000.0,Private,,,,,,2,2021,13760,False,None,
576,67,MetaCX,2018-01-01,https://metacx.com,"Indianapolis, Indiana, United States","Information Technology, Professional Services, Software",9.0,,2023-08-25,6850000.0,Debt Financing,40701454.0,Private,,,0.0,2.0,,5,2018,2440,False,"{'status': '200', 'available': True, 'url': 'http://web.archive.org/web/20181211190215/https://metacx.com/', 'timestamp': '20181211190215'}",20181211190215
577,378,VerImmune,2020-01-01,https://www.verimmune.com/,"Baltimore, Maryland, United States","Biotechnology, Health Care, Science and Engineering",3.0,Seed,2023-09-20,3125000.0,Seed,6480844.0,Private,,,3.0,2.0,Medical Or Veterinary Science; Hygiene,3,2020,3967,False,"{'status': '200', 'available': True, 'url': 'http://web.archive.org/web/20220208184847/https://www.verimmune.com/', 'timestamp': '20220208184847'}",20220208184847
578,85,BENQI Finance,2021-01-01,https://benqi.fi,"Newark, New Jersey, United States","Blockchain and Cryptocurrency, Financial Services, Other, Payments, Software",1.0,Private Equity,2021-04-01,6000000.0,Private Equity,6000000.0,Private,,,,,,2,2021,4174,False,"{'status': '200', 'available': True, 'url': 'http://web.archive.org/web/20220101130340/https://benqi.fi/', 'timestamp': '20220101130340'}",20220101130340
