website,text_len,source,text,type,closest_snapshot,closest_snapshot_time,snapshot_in_window
https://vantagefinancialwi.com/,5245,crunchbase,"admin – Vantage Financial Partners Skip to content HOME ABOUT SERVICES WORK Florida Heath Facility Maine Modernity Exclusive Urban Living Blue Concrete House ARTICLES GET QUOTE admin About admin This author has not yet filled in any So far admin has created 4 blog Hello world! By admin | :04:33+00:00 July , | Uncategorized | Welcome to This is your first Edit or delete it, then start blogging! Read More Redeveloping Florida’s Remote Southern Coast Gallery Redeveloping Florida’s Remote Southern Coast Architecture , Buildings , Construction , News Redeveloping Florida’s Remote Southern Coast By admin | :33:55+00:00 December , | Architecture , Buildings , Construction , News | Technology is Here to Stay Lorem ipsum dolor sit amet, consectetur adipiscing Vivamus purus nisl, elementum vitae consequat at, tristique ut Sed ut dignissim Nullam sed metus id sapien faucibus rhoncus sed at Nullam eget ornare leo, eget aliquam Sed cursus malesuada Cras porta ipsum sed nibh consectetur, Read More How We Manage Large Construction Projects Gallery How We Manage Large Construction Projects Architecture , Construction , Engineering How We Manage Large Construction Projects By admin | :33:55+00:00 December , | Architecture , Construction , Engineering | Technology is Here to Stay Lorem ipsum dolor sit amet, consectetur adipiscing Vivamus purus nisl, elementum vitae consequat at, tristique ut Sed ut dignissim Nullam sed metus id sapien faucibus rhoncus sed at Nullam eget ornare leo, eget aliquam Sed cursus malesuada Cras porta ipsum sed nibh consectetur, Read More Future proofing a modern home Gallery Future proofing a modern home Architecture , Construction , Marketing Future proofing a modern home By admin | :33:55+00:00 December , | Architecture , Construction , Marketing | Technology is Here to Stay Lorem ipsum dolor sit amet, consectetur adipiscing Vivamus purus nisl, elementum vitae consequat at, tristique ut Sed ut dignissim Nullam sed metus id sapien faucibus rhoncus sed at Nullam eget ornare leo, eget aliquam Sed cursus malesuada Cras porta ipsum sed nibh consectetur, Read More We are specialists in the construction of unique and exclusive Our work We pride ourselves on delivering outstanding quality and design for leading clients across the Learn More LATEST TWEETS Tweets by Theme_Fusion CONTACT US TODAY Corporate Location Amphitheatre Parkway London WC1 Residential Location Broadsberry Avenue Paddington RC7 Monday - Friday: 9:00 AM - 6:00 PM Saturday - Sunday: 9:00 AM - :00 PM FIND US COPYRIGHT - AVADA THEME BY THEME FUSION | ALL RIGHTS RESERVED | POWERED BY WORDPRESS Facebook Twitter YouTube Rss Email   Vantage Financial Partners – Your Your Skip to content Home admin :17:54+00:00 PLANNING FOR YOUR FUTURE FINANCIAL SECURITY STARTS The good news? You don’t have to do it You have PLANNING FOR YOUR FUTURE FINANCIAL SECURITY STARTS The good news? You don’t have to do it You have YOUR YOUR At any stage of life, Vantage Financial is your partner in planning for your Our expertise, experience and holistic approach make us the financial friend and professional advocate you never You define ‘success,’ and we’ll help you get there – with Vantage, you always know where you YOUR YOUR At any stage of life, Vantage Financial is your partner in planning for your Our expertise, experience and holistic approach make us the financial friend and professional advocate you never You define ‘success,’ and we’ll help you get there – with Vantage, you always know where you RETIREMENT | INVESTMENTS | EDUCATION | BUDGETING | ESTATE PLANNING Committed to comprehensive and transparent financial planning for hard working RETIREMENT | INVESTMENTS | EDUCATION BUDGETING | ESTATE PLANNING Committed to comprehensive and transparent financial planning for hard working IT ALL STARTS WITH A SIMPLE We are ready when you We’d love to meet, talk about your financial goals, and share a cup of coffee at our Elm Grove Leave us a We’ll get back to you as soon as FIRST NAME LAST NAME EMAIL ADDRESS PHONE NUMBER I prefer to be contacted by (please check): Email Phone What s on your mind? (Please do not include any sensitive or confidential ) × IT ALL STARTS WITH A SIMPLE We are ready when you We’d love to meet, talk about your financial goals, and share a cup of coffee at our Elm Grove Leave us a We’ll get back to you as soon as FIRST NAME LAST NAME EMAIL ADDRESS PHONE NUMBER I prefer to be contacted by (please check): Email Phone What s on your mind? (Please do not include any sensitive or confidential ) × Watertown Plank Elm Grove, WI P | F | E | Watertown Plank Elm Grove, WI P | F | E | © Vantage Financial Partners | All Rights | Privacy Policy | Thrivent and its financial professionals do not provide legal, accounting, or tax Consult your attorney or tax THRIVENT IS THE MARKETING NAME FOR THRIVENT FINANCIAL FOR Insurance products issued by Not available in all Securities and investment advisory services offered through Thrivent Investment Management A reg",startup,"{'status': '200', 'available': True, 'url': 'http://web.archive.org/web/20181008114930/https://www.vantagefinancialwi.com/', 'timestamp': '20181008114930'}",20181008114930.0,1.0
https://www.nessle.com/,13439,crunchbase,"Our Story - Nessle nessle Home How Nessle Works Our Story For Experts Blog JoinÂ Nessle Join Login Our Story Founder Carly Buxton gave birth to her first child in Boston in , far from the support of family and close As an overwhelmed new parent, Carly spent countless hours online, trying to research her way out of all of the problems she was having feeding and caring for a new babyâand for her own postpartum As a user researcher, she couldnât believe there wasnât a better way for parents to get the tailored perinatal guidance they needed online, free of judgmental trolls, but outdated advice, and sponsored â Carly was determined to build a She founded Nessle in , earned her certifications as a postpartum doula and lactation counselor, and started supporting families in person and Since then, she has partnered with a dynamic technical , Michelle Cunningham who, as a fellow mother, is deeply motivated to improve the lives of parents through Supported by a team of strategists, marketers, and designers, Nessle is helping new and expectant parents to get the immediate support they need online from qualified perinatal Meet The Team Carly Buxton, PhD - and CEO - Carly is a postpartum doula and Certified Lactation Consultant (CLC) based in the West End of Richmond, â Also a historian, user experience researcher, and writer, her mission is to promote empathy in everyday action: in our communities, in research, in education, and in â After many years of living away from home (in Chicago, Boston, China, and Japan), Carly has returned to her hometown of Richmond, Virginia, where she lives with her husband and their two Michelle Cunningham - and CTO - is an engineering leader, web developer and startup veteran with a passion for protecting the earth and improving the lives of the people who inhabit She lives in the San Francisco Bay Area with her husband and 2 Maryann Snow - Head of Customer Experience - Has an extensive background in all aspects of product As an energetic and driven business leader she has a passion for teamwork, solving problems Â and building products that go above and beyond to delight Â She lives in Boston with her husband and three young Ethan Parker - Brand and Product Designer - A strategic designer that s focused on the intersection of product and brand through He loves solving problems and crafting for mission driven During his free time, you can find him working on his bonsai trees or building something that he could ve bought for Our values Always Learning Rooted in research, our approach is open, flexible, and as we learn from science and from our customers Genuine Connection Weâre dedicated to building authentic, trusting relationshipsâwhether online or Compassion We know that health and wellbeing blossom when caregivers listen with empathy Personalization Our experts meet you where you are, giving support thatâs tailored to your style, history, and goals Meet our Experts Here are just a few of the growing number of experts who support Nessle Browse Experts Pauline I am a gentle and holistic Sleep Coach for babies Trained at the Holistic Sleep Coaching Program in the UK, my methods are entirely and genuinely gentle and promote Lakesha Q Hi my name is Lakesha, I love to have fun and educate Carly B Carly is a postpartum doula and Certified Lactation Consultant (CLC) based in the West End of Richmond, Ellen J I provide concrete information and strategies that are easily woven into your day Holly K I seek to help you find that confidence that comes with being about what you re Sara V I have a passion for seeing all members of the family thrive, not just the Allison M I believe that all parents have a right to rest and recover after birth in a safe, calming space for as long as they Yvonna R I love what I do and it is my passion to provide support and care for all women and black nessle Personalized support for every stage of Here for you when you need it î  î  î  Blog For Employers Gift Cards Onboard as anÂ Expert Press Kit Parents Terms and Conditions Experts Terms and Conditions Privacy Policy (804)  East Cary Richmond, VA Â© by NessleÂ   Nessle For Experts nessle Home How Nessle Works Our Story For Experts Blog JoinÂ Nessle Join Login For Experts Easily connect with new and expectant parents and expand your Nessle is a digital health platform that connects our active network of new and expectant parents with experts for tailored guidance on all things pregnancy, postpartum, and Nessle takes the burden of finding the ideal expert off of overwhelmed parents and makes it easy for experts to provide tailored support Join as an Expert Nessle is built Trained birth and postpartum doulas Lactation counselors and educators Midwives Sleep specialists Maternal wellness coaches Nutritionists Perinatal fitness experts Childbirth experts Pelvic floor therapists Other trained experts in perinatal topics The ideal Nessle expert Passionate about providing the highest level of care ",startup,"{'status': '200', 'available': True, 'url': 'http://web.archive.org/web/20220926031700/https://www.nessle.com/', 'timestamp': '20220926031700'}",20220926031700.0,0.0
https://tsundoku.ventures/,18995,crunchbase,"Wayback Machine We will keep fighting for all libraries - stand with us! Internet Archive logo A line drawing of the Internet Archive headquarters building faÃ§ade. Donate icon An illustration of a heart shape ""Donate to the archive"" Search icon An illustration of a magnifying Search icon An illustration of a magnifying Upload icon An illustration of a horizontal line over an up pointing Upload User icon An illustration of a person s head and Sign up | Log in Web icon An illustration of a computer application window Wayback Machine Texts icon An illustration of an open Books Video icon An illustration of two cells of a film Video Audio icon An illustration of an audio Audio Software icon An illustration of a "" floppy Software Images icon An illustration of two Images Donate icon An illustration of a heart shape Donate Ellipses icon An illustration of text More Hamburger icon An icon used to represent a menu that can be toggled by interacting with this Internet Archive Audio Live Music Archive Librivox Free Audio Featured All Audio This Just In Grateful Dead Netlabels Old Time Radio RPMs and Cylinder Recordings Top Audio Books & Poetry Computers, Technology and Science Music, Arts & Culture News & Public Affairs Spirituality & Religion Podcasts Radio News Archive Images Metropolitan Museum Cleveland Museum of Art Featured All Images This Just In Flickr Commons Occupy Wall Street Flickr Cover Art USGS Maps Top NASA Images Solar System Collection Ames Research Center Software Internet Arcade Console Living Room Featured All Software This Just In Old School Emulation Games Historical Software Classic PC Games Software Library Top Kodi Archive and Support File Vintage Software APK Software Software Library Software Sites Tucows Software Library Shareware Software Capsules Compilation Images ZX Spectrum DOOM Level CD Books Books to Borrow Open Library Featured All Books All Texts This Just In Smithsonian Libraries FEDLINK (US) Genealogy Lincoln Collection Top American Libraries Canadian Libraries Universal Library Project Gutenberg Children s Library Biodiversity Heritage Library Books by Language Additional Collections Video TV News Understanding 9 11 Featured All Video This Just In Prelinger Archives Democracy Now! Occupy Wall Street TV NSA Clip Library Top Animation & Cartoons Arts & Music Computers & Technology Cultural & Academic Films Ephemeral Films Movies News & Public Affairs Spirituality & Religion Sports Videos Television Videogame Videos Vlogs Youth Media Search the history of over billion web pages on the Search the Wayback Machine Search icon An illustration of a magnifying Mobile Apps Wayback Machine (iOS) Wayback Machine (Android) Browser Extensions Chrome Firefox Safari Edge Subscription Explore the Collections Learn More Build Collections Save Page Now Capture a web page as it appears now for use as a trusted citation in the Please enter a valid web address About Blog Projects Help Donate Contact Jobs Volunteer People Sign up for free Log in Search metadata Search text contents Search TV news captions Search radio transcripts Search archived web sites Advanced Search About Blog Projects Help Donate Donate icon An illustration of a heart shape Contact Jobs Volunteer People DONATE Latest Show All The Wayback Machine has not archived that Click here to search for all archived pages under https: tsundoku.ventures . The Wayback Machine requires your browser to support JavaScript, please email if you have any questions about The Wayback Machine is an initiative of the Internet Archive , a (c)(3) , building a digital library of Internet sites and other cultural artifacts in digital Other projects include Open Library & . Your use of the Wayback Machine is subject to the Internet Archive s Terms of Use .   Inspiration and Further Reading — TSUNDOKU VENTURES TSUNDOKU VENTURES home Ecosystems Team Events Inspiration home TSUNDOKU VENTURES Ecosystems Team Events Inspiration News, Inspiration and Further Reading Here’s a list of curated articles that we found helpful or Featured How to get security right in digital transformation: best practices Here is a article offering areas where companies can improve their processes and workflows to boost the security of their organization when undergoing digital Oh and BTW, technology is ranked only Follow almost Top CyberSecurity Startups with one single click Patrick Coomans keeps an list on Twitter with almost cybersecurity startups and Helping small businesses fight cybercrime benefits the global ecosystem Interesting article from the World Economic Forum on the importance of small businesses, and how they can increase their cybersecurity resilience using a toolkit from the Global Cyber Alliance . EU Digital Transformation Scoreboard The EU Digital Transformation Scoreboard data analysis show that more Member States perform considerably above the average in terms of digital technology Thanks to its high overall performance, Belgium ranks as a European front runne",startup,"{'status': '200', 'available': True, 'url': 'http://web.archive.org/web/20190930212046/https://tsundoku.ventures/', 'timestamp': '20190930212046'}",20190930212046.0,1.0
https://ayr.ai,29101,crunchbase,"Blog - Skip to content Solutions Advantages The SingularityAI Platform Resources All Resources Blog Use Cases Company About News Contact Us X Schedule Demo Stay up to Date with Tech Trends and More Out Latest Stories Blog Everything You Have Been Asking About Intelligent Document Processing If you have been wondering what all the fuss is about when it comes to Intelligent Document Processing (IDP), then this blog post is for Read More » Blog Data is the Oil that Fuels Businesses – Intelligent Document Processing Solutions Extract and Process Enterprise Data If you’ve been paying attention to the business world over the last few years, you’ve probably noticed that automation is becoming more and more Read More » Blog How Intelligent Document Processing Helps Automation Leaders to Do More With Less In today’s business world, automation is key to The ability to streamline processes and eliminate manual tasks can mean the difference between a thriving Read More » Blog Successful Enterprise Automation is Driven by Intelligent Document Processing The volume of data and documents that enterprises must manage continues to increase at an exponential Businesses are looking for ways to automate Read More » Meet Our Team AYR Spotlight: Ujjwal Gutta, Machine Learning Engineer Are You Ready to improve the future of work? Ujjwal is Ready! And that’s why he’s busy working on developing solutions to help enterprises Read More » Blog Preparing for the Next Era of Work – AYR: What’s behind the new Singularity Systems Brand We at AYR recently introduced a new brand identity and challenge the Intelligent Document Processing (IDP) industry and its users with a question – ARE Read More » Blog HFS Names the Hottest of the Hot Vendors of HFS Names the Hottest of the Hot Vendors of In the rapidly changing space of digital operations, enterprises realize they cannot be everything to Read More » Blog How Can Intelligent Document Processing (IDP) Help Organizations Succeed? How Can Intelligent Document Processing (IDP) Help Organizations Succeed? Intelligent Document Processing (IDP) converts manual forms and analog data into a digital format to integrate Read More » Blog Your Ticket Out of POC Purgatory Your Ticket Out of POC Purgatory Does this sound familiar? Your company just started a POC with an IDP You hope it will Read More » Blog 5 Reasons Companies Fail to Automate 5 Reasons Companies Fail to Automate According to a recent McKinsey Global Survey, the share of companies adopting automation technologies is steadily However, few of Read More » No more posts to show Transformation starts with you Let s Take Back Time, Save Money, and Change the World Together Get Started The Intelligent Document Processing (IDP) Linkedin Twitter Youtube Instagram services StreamlineThe Trial Constan Innovation Cloud Based Data Storage CTMS Platform Integrated User Platform 6 Support quick links About Us Services Pricing Blog Contact Contact Bali, Indonesia +62-864-349-1 Copyright © AYR, All Rights Privacy Policy Terms & Conditions   Resources - Skip to content Solutions Advantages The SingularityAI Platform Resources All Resources Blog Use Cases Company About News Contact Us X Schedule Demo RESOURCES Analyst Report HFS OneOffice™ Hot Vendors: Q2 Read More Click Here Video Webinar: The Future of Data Maximization for the Insurance Industry - Munich Re and Great American Insurance Watch White paper How to Become Truly Digitalized Through Intelligent Document Processing Read More Q&A Session with Tianhao Wu and Adam Devine The Next Generation of IDP Watch Video Previous Next All Gallery Item Gallery Item Gallery Item Gallery Item Gallery Item Gallery Item Webinar - The Future of Data Maximization for the Insurance Industry HFS OneOffice™ Hot Vendor: Q2 Report Everest Group Intelligent Document Processing (IDP) PEAK Matrix® Report Q&A Session with Tianhao Wu, CTO AYR Company Brochure An Approach to IRS Tax Forms AI for Digital Agility in Insurance Webinar - How Machine Learning Makes Touchless Claims Possible Intelligent Document Processing for Banks Intelligent Document Processing for Oil & Gas Leases CIO Applications - Top Ten Machine Learning Models How to Become Truly Digitalized Through Intelligent Document Processing How to Efficiently Implement AI Projects at Scale Load More Transformation starts with you Let s Take Back Time, Save Money, and Change the World Together Get Started The Intelligent Document Processing (IDP) Linkedin Twitter Youtube Instagram services StreamlineThe Trial Constan Innovation Cloud Based Data Storage CTMS Platform Integrated User Platform 6 Support quick links About Us Services Pricing Blog Contact Contact Bali, Indonesia +62-864-349-1 Copyright © AYR, All Rights Privacy Policy Terms & Conditions   Advantages - Skip to content Solutions Advantages The SingularityAI Platform Resources All Resources Blog Use Cases Company About News Contact Us X Schedule Demo The AYR Advantage The SingularityAI Platform optimally laye",startup,"{'status': '200', 'available': True, 'url': 'http://web.archive.org/web/20221021052734/https://ayr.ai/', 'timestamp': '20221021052734'}",20221021052734.0,0.0
