website,text_len,source,text,type,closest_snapshot,closest_snapshot_time,snapshot_in_window
https://www.imbriumthera.com/,7151,crunchbase,"About Us - Imbrium Therapeutics About Us - Imbrium Therapeutics About Us MENU About Us Pipeline Collaboration News Contact Us Imbrium Therapeutics is a clinical stage biopharmaceutical company dedicated to advancing medical science through the development of important new therapies to treat cancer, pain and disorders of the central nervous Imbrium Therapeutics was founded in as an operating subsidiary of Purdue With its distinct mission, therapy area focus, and leadership team, Imbrium is committed to applying its capabilities in science and medicine to rapidly advance the development of new, favorably differentiated therapeutic agents in the areas of cancer, CNS and Imbrium Therapeutics is committed to operating ethically and in full compliance with laws and regulations governing the pharmaceutical Contact Us FIND OUT MORE © Imbrium Therapeutics All Rights Imbrium Therapeutics is a subsidiary of Purdue Pharma Privacy Policy Terms & Conditions   Pipeline - Imbrium Therapeutics Pipeline - Imbrium Therapeutics Pipeline MENU About Us Pipeline Collaboration News Contact Us Imbrium Therapeutics Pipeline Our robust and diversified pipeline of investigational therapy candidates has been built to address many serious medical Preclinical Phase I Phase II Phase III Registration CANDIDATE INDICATION Tinostamustine Phase II INDICATION: Oncology Tinostomustine is a potentially alkylating deacetylase inhibiting molecule in development for the treatment of certain In preclinical studies, Tinostomustine has been shown to improve access to the DNA strands within cancer cells, disrupt them and counteract damage Etoposide Toniribate Phase II INDICATION: Oncology Etoposide toniribate is a novel etoposide in development for the treatment of certain solid tumor In preclinical studies, the agent is activated in cells expressing carboxylesterase 2, an enzyme found in the gastrointestinal tract and is particularly active in tumor Phase I INDICATION: IAAC 1 is an internally discovered compound with a novel mechanism of action in clinical development for the treatment of insomnia associated with alcohol Preclinical INDICATION: Chronic Low Back Pain is a preclinical stage, novel formulation of a compound for use in chronic low back Preclinical INDICATION: Bladder Pain is a preclinical stage, formulation of a compound for use in pain associated with interstitial † Preclinical INDICATION: Neuropathic Pain is a preclinical stage program advancing drug candidates with an undisclosed mechanism of The program targets a genetically and pharmacologically validated target in neuropathic † Preclinical INDICATION: Neuropathic Pain is a preclinical stage program advancing drug candidates with an undisclosed mechanism of The program targets a genetically validated ion channel target in neuropathic 1 IAAC = Insomnia Associated with Alcohol Cessation Development Collaboration † Discovery Collaboration The safety and efficacy of the agents and or uses under investigation have not been There is no guarantee that the investigational agents will successfully complete clinical development or gain health authority Collaboration Find Out More © Imbrium Therapeutics All Rights Imbrium Therapeutics is a subsidiary of Purdue Pharma Privacy Policy Terms & Conditions   News - Imbrium Therapeutics News - Imbrium Therapeutics News MENU About Us Pipeline Collaboration News Contact Us Older Posts CATEGORIES Press Release ARCHIVE (8) IMBRIUM THERAPEUTICS AND SPINETHERA, ANNOUNCE FIRST PATIENT DOSED IN PHASE 1 2 CLINICAL STUDY Imbrium Therapeutics Announces First Patient Dosed in Phase 2 Study of Potential Molecule for Insomnia Associated with Alcohol Cessation Imbrium Therapeutics and SpineThera Announce Issuance of Patent Covering Composition of Matter Protection for SX600, a Product in Development for Epidural Steroid Injection for the Treatment of Low Back Pain Imbrium Therapeutics Advances Insomnia Pipeline Through Initiation of a Phase 2 Study of Potential Molecule for Insomnia Associated with Alcohol Cessation Imbrium Therapeutics Announces FDA Orphan Drug Designation for Tinostamustine for the Treatment of Prolymphocytic Leukemia Imbrium Therapeutics Announces Enrollment of the First Patient in Expansion Phase of Tinostamustine Trial in Patients with Blood Cancers Imbrium Therapeutics and TetraGenetics Announce Strategic Research Collaboration and License Option to Develop Novel Biologic Therapeutics for Pain Imbrium Therapeutics Announces FDA Orphan Drug Designation for Etoposide Toniribate for the Treatment of Relapsed Refractory Biliary Tract Cancer © Imbrium Therapeutics All Rights Imbrium Therapeutics is a subsidiary of Purdue Pharma Privacy Policy Terms & Conditions   Contact Us - Imbrium Therapeutics Contact Us - Imbrium Therapeutics Contact Us MENU About Us Pipeline Collaboration News Contact Us Tresser Boulevard, Stamford, CT Name Email Company Phone Message Email Submit About Us Find out more © Imbrium Therapeutics All Rights Imbrium Therapeutics i",startup,"{'status': '200', 'available': True, 'url': 'http://web.archive.org/web/20200101234005/https://www.imbriumthera.com/', 'timestamp': '20200101234005'}",20200101234005.0,1.0
https://wesolvehr.com/,22442,crunchbase,"Tampa Bay Payroll Services, Payroll Companies | JanusHR Skip to content Call Us Today: Contact Us Employee Portal Client Portal Response PEO Services PEO Services Payroll Human Resources Risk Management Benefits Administration Industry Solutions Hospitality Hotels Light Manufacturing Marketing Companies Property Management Professional Organizations Franchises FAQs About Us Our History Our Team News Locations Clearwater Bradenton Payroll Services from JanusHR Paying your employees is one of the most essential responsibilities of your Your employees want to be certain that they’re being paid fairly and on time, and you want to make sure that every aspect of the process is properly completed and documented – both to keep employees happy and to mitigate potential risks for your At JanusHR, we understand those concerns and seek to solve them by managing your payroll for you, helping to take some of the administrative burdens off your As a PEO based in Tampa and serving all of Florida, our experienced team can find the most appropriate solution to your needs, as well as ensure that your payroll is accurate and on Plus, we offer an online program to provide the flexibility that business owners and their teams both require in today’s To help you understand the scope of our offerings, consider the following payroll services: Tax Reporting In addition to managing ongoing payroll, we ensure that all local, state, and federal taxes are collected, reported, and deposited through the proper channels in the required Trusting JanusHR to tackle these challenges means that you can feel confident in our experienced team’s capabilities to accurately document and pay all necessary Plus, it can help you reduce your liability should an error ever Job Costing In many industries, such as construction, every job or project has a different cost associated with materials and manpower required to complete For that reason, keeping track of costs is simultaneously vital and downright However, it is important to see how the cost and revenue compare so you can make informed At JanusHR, we know how essential this knowledge is, so no matter how complex your needs may be, turn to us to make sense of even the most complex payroll Customized Reports We pride ourselves on making every aspect of our services as transparent and accessible as One of the ways we do this is by providing customized reports that thoroughly break down your company’s payroll expenses and allow you to easily view relevant We can even tailor these reports to speak to your specific needs and Filing As you probably know, employers must mail or deliver the previous year’s to their employees by January st (or the following business day). When JanusHR handles your payroll, we’ll also manage W2 administration , allowing you to focus more time and attention on hitting your business’s goals for the first A Shop As a PEO, our offerings extend far beyond payroll Depending on your needs, we’re also happy to offer you the human resources , risk management , and benefits administration services that you require to streamline your If you’d like to find out more, contact us We’re proud to serve small to businesses throughout the Tampa Bay area and the rest of Learn More Discover the difference Janus HR can make for you! Contact our experts today to learn more Contact Us Product of Interest Payroll Human Resources Risk Management Benefits Administration PEO Services Submit Do Not Fill This Out We Can Solve Your HR Contact Us Rely on Expertise Learn More PEO Services Industry Solutions FAQ About Us Locations Client Portal Employee Portal Areas Served Clearwater Court Street, Suite B Clearwater, FL Bradenton South Bay Blvd, Suite B2 PO Box Anna Maria, FL © JanusHR | All rights Payroll Human Resources Risk Management Benefits Administration Contact Us Services Available Call Us Today: Contact Us Employee Portal Client Portal Response PEO Services PEO Services Payroll Human Resources Risk Management Benefits Administration Industry Solutions Hospitality Hotels Light Manufacturing Marketing Companies Property Management Professional Organizations Franchises FAQs About Us Our History Our Team News Locations Clearwater Bradenton Discover the difference Janus HR can make for you! — Contact our experts today to learn more Product of Interest Payroll Human Resources Risk Management Benefits Administration PEO Services Submit Do Not Fill This Out Response PEO Services PEO Services Payroll Human Resources Risk Management Benefits Administration Industry Solutions Hospitality Hotels Light Manufacturing Marketing Companies Property Management Professional Organizations Franchises FAQs About Us Our History Our Team News Locations Clearwater Bradenton Contact Us Employee Portal Client Portal   Responding to | JanusHR Skip to content Call Us Today: Contact Us Response PEO Services PEO Services Payroll Human Resources Risk Management Benefits Administration Industry Solutions Hospitality Hotels Light Man",startup,"{'status': '200', 'available': True, 'url': 'http://web.archive.org/web/20200804135622/https://www.wesolvehr.com/', 'timestamp': '20200804135622'}",20200804135622.0,1.0
https://www.risk-q.com,400,crunchbase, - Registered at This domain is registered at Namecheap This domain was recently registered at Please check back later! This domain is registered at Namecheap This domain was recently registered at Please check back later! All Rights The Sponsored Listings displayed above are served automatically by a third Neither Parkingcrew nor the domain owner maintain any relationship with the Privacy Policy ,startup,"{'status': '200', 'available': True, 'url': 'http://web.archive.org/web/20160402102651/http://www.risk-q.com/', 'timestamp': '20160402102651'}",20160402102651.0,1.0
https://croptomize.com,7971,crunchbase,"About – Croptomize Skip to content Home Product About Blog Contact About Ben :10:19+00:00 Our Mission Our mission is to provide users with the necessary tools to stay competitive in today’s grain commodity Croptomize has set out to disrupt the agricultural industry by leveraging modern technology in ways that have not yet been used and integrating data from multiple resources to a convenient mobile By utilizing these technologies, we can bring the tools previously only available to large corporations to users at an affordable price We Are: Traders Farm CFO Designers Tech Enthusiasts Our Founders Janie Hanson Janie’s background as a generation landowner and manager of her Minnesota family farm has acted as the basis for her work ethic and entrepreneurial expertise throughout her She is the of Hanson Lahre, with previous roles in business development and project finance at John Deere and General While employed with John Deere she oversaw the development and construction of a large windfarm near Greensburg, With Hanson Lahre , Janie is overseeing the development of an iOS application called This app will allow for its users to view commodity trading information for Corn, Wheat, and Soybeans to assist with the process of selling their harvested She has a MBA in Finance from Columbia Business School and a BA in Environmental Studies from Gustavus Adolphus College with minors in Economics and Studio Deanna Lahre Deanna has over years of experience as a grain trader and member of the Chicago Board of Trade and Kansas City Board of She was one of the founding trading partners of TransMarket Group in Chicago, of K2B, , StatFutures, , and of Hanson Lahre, With Hanson Lahre, , Deanna is creating artificial intelligence software and overseeing a new iOS application called This app will provide robust market data for its users to view regarding pricing for Corn, Wheat, and Soybeans and model hedging strategies that utilize the commodity She has a BS in Finance from Indiana University, Kelley School of Business, with minors in Mathematics and Menu Home Product About Blog Contact Get Support Location Our headquarters are located in Blue Earth, MN Recent Posts China Buy Prompts Corn Rebound May 7, Ethanol perks up May 6, Corn % planted vs % year ago May 4, © Copyright | Croptomize is a product of Hanson Lahre, Terms & Conditions | Privacy Policy | All Rights Reserved Facebook Twitter Instagram Email   Product – Croptomize Skip to content Home Product About Blog Contact Product Ben :55:18+00:00 Our App The Croptomize app is now available on the Apple App Store Localized Grain Pricing Reduce the need to access different source sites for pricing The Croptomize app offers the capability to select and compare your basis pricing in one convenient All the price details you need at a Select your crops from available grain commodities and compare pricing Checker Navigating market trends can be With the Checker you can validate your market intuition through the use of the Croptomize Frame to analyze the probability of predicted Comparing prices to historical data gives you a sense of how the current market stacks up versus years Croptomize Pro The Croptomize Farm is an idealized farming operation that uses advanced data analytics and statistics to optimize grain Compare your grain marketing strategies to that of the Croptomize Farm to learn more about market Croptomize Pro will be released in Farm CFO The Farm CFO is a hub for managing farm With the Farm CFO you can calculate your cost of production, keep track of your production estimates, manage contracts, and so much Farm CFO will be released in Menu Home Product About Blog Contact Get Support Location Our headquarters are located in Blue Earth, MN Recent Posts China Buy Prompts Corn Rebound May 7, Ethanol perks up May 6, Corn % planted vs % year ago May 4, © Copyright | Croptomize is a product of Hanson Lahre, Terms & Conditions | Privacy Policy | All Rights Reserved Facebook Twitter Instagram Email   Croptomize – A New Tool for Farm Profitability Skip to content Home Product About Blog Contact Home Ben :11:07+00:00 Welcome to Croptomize! What is Croptomize? Through the use of big data and modern technology, Croptomize brings the financial and marketing tools previously reserved for big corporations to the These tools will enable farmers to make better financial decisions in the hope of building a sustainable and profitable farming operation for generations to About Us Our App Through an intuitive application, Croptomize allows you to visualize opportunities in the markets to enhance Local Pricing The Croptomize app offers the capability to select and compare your basis pricing in one convenient Pricing Graphs Detailed pricing graphs allow you to see market trends across different crops and contract Checker With the Checker you can validate your market intuition by seeing how current prices compare to historical See the App Latest News See More Stories Austin Damiani :49:20+00:",startup,"{'status': '200', 'available': True, 'url': 'http://web.archive.org/web/20200508171849/https://croptomize.com/', 'timestamp': '20200508171849'}",20200508171849.0,1.0
https://www.sayana.app/,18614,crunchbase,"Sayana Privacy Policy Your privacy is important to It is Sayana, s policy to respect your privacy regarding any information we may collect from you via our app, Sayana, and its associated Information we collect Log data When you access our servers via Sayana, we may automatically log the standard usage data provided by your This data may include your deviceâs Internet Protocol (IP) address, your device type and version, your activity within the app, time and date, and other Additionally, when you encounter certain errors while using the app, we automatically collect data about the error and the circumstances surrounding its This data may include technical details about your device, what you were trying to do when the error happened, and other technical information that may have contributed to the Device data Our app may also access and collect data via your device s tools, such as: Notifications Mobile data What we collect can depend on the individual settings of your device and the permissions you grant when you install and use the Personal information We may ask for personal information, such as your: Name Email Payment information Business data Business data refers to data that accumulates over the normal course of operation on our This may include transaction records, stored files, user profiles, analytics data and other metrics, as well as other types of information, created or generated, as users interact with our Legal bases for processing We will process your personal information lawfully, fairly and in a transparent We collect and process information about you only where we have legal bases for doing These legal bases depend on the services you use and how you use them, meaning we collect and use your information only where: itâs necessary for the performance of a contract to which you are a party or to take steps at your request before entering into such a contract (for example, when we provide a service you request from us) it satisfies a legitimate interest (which is not overridden by your data protection interests), such as for research and development, to market and promote our services, and to protect our legal rights and interests you give us consent to do so for a specific purpose (for example, you might consent to us sending you our newsletter) or we need to process your data to comply with a legal Where you consent to our use of information about you for a specific purpose, you have the right to change your mind at any time (but this will not affect any processing that has already taken place). We donât keep personal information for longer than is While we retain this information, we will protect it within commercially acceptable means to prevent loss and theft, as well as unauthorised access, disclosure, copying, use or That said, we advise that no method of electronic transmission or storage is % secure and cannot guarantee absolute data If necessary, we may retain your personal information for our compliance with a legal obligation or in order to protect your vital interests or the vital interests of another natural Collection and use of information We may collect, hold, use and disclose information for the following purposes and personal information will not be further processed in a manner that is incompatible with these purposes: for technical assessment, including to operate and improve our app, associated applications and associated social media platforms to provide you with our app and platform s core features to process any transactional or ongoing payments to enable you to access and use our app, associated platforms and associated social media channels to contact and communicate with you for internal record keeping and administrative purposes for analytics, market research and business development, including to operate and improve our app, associated applications and associated social media platforms for advertising and marketing, including to send you promotional information about our products and services and information about third parties that we consider may be of interest to you and to comply with our legal obligations and resolve any disputes that we may Disclosure of personal information to third parties We may disclose personal information to: third party service providers for the purpose of enabling them to provide their services, including (without limitation) IT service providers, data storage, hosting and server providers, ad networks, analytics, error loggers, debt collectors, maintenance or providers, marketing or advertising providers, professional advisors and payment systems operators our employees, contractors and or related entities and third parties, including agents or , who assist us in providing information, products, services or direct marketing to International transfers of personal information The personal information we collect is stored and processed in United States, or where we or our partners, affiliates and providers maintain By providin",startup,"{'status': '200', 'available': True, 'url': 'http://web.archive.org/web/20200129061811/https://sayana.app/', 'timestamp': '20200129061811'}",20200129061811.0,1.0
