website,text_len,source,text,type,closest_snapshot,closest_snapshot_time,snapshot_in_window
https://professional3dservices.com/,5857,crunchbase,"Modeling, Rendering and Animation Services Company - ThePro3DStudio Portfolio Modeling Architecture Modeling Product Modeling Furniture Modeling Mechanical Modeling Sculpting Printing Design Rendering Architecture Rendering Interior Rendering Exterior Rendering Walkthrough Floor Plan Design Product Rendering Animation Portfolio Contact Us EXPERIENCE TOP CLASS DESIGN SERVICES FROM THEPRO3DSTUDIO ThePro3DStudio has been endowing clients with stunning visual experience crafted by leveraging matchless forte of computer Irrespective of the size and scope of the project, we are competitively fortified to offer our clients with a range of aesthetically appealing designs, carefully crafted to meet all type of Our creative talent, advanced technology, and infrastructural capabilities help us to deliver the projects unfailingly to the clients just the way they Our designing company provides collaborative project environment and service propositions for all your custom design Our Exclusive Services Modeling We have highly experienced team of artist who provide top class custom models for various industry Read More Rendering We offer high quality and photorealistic rendering services for various industries including ecommerce, real estate, manufacturing Read More Animation Thepro3DStudio creates realistic animation for characters, products, architecture and games with high quality Read More ThePro3DStudioâs Architecture & Product visualization ThePro3DStudio has exceptional expertise in handling diverse visualization projects for global industry Our company offers affordable architecture and product visualization solutions that helps to convert clientâs ideas into reality by delivering the best quality visuals under tight Our services include walkthroughs, product animations, and virtual tours Our talented designer team provides photorealistic renderings using already exisiting CAD files or create new models with apt color balance, lighting, texture, and composition that enable clients to envision their ideas to the smallest Industries We Support Education We master various design concepts to produce interactive eLearning solutions that improves the reception level of students or We have a workforce trained in the latest technologies that work with the education based business vertical to create models that can be used for providing information to learners and help them gain skills to become knowledgeable through animated Architecture Our architectural renderings allow to experience the feel of the property before the construction is We use shading and texturing techniques to create realistic interior and exterior renders of residential and commercial Our company provide panoramic views, virtual walkthroughs, floor plan designs , and flythroughs to display property features in the best possible Entertainment ThePro3DStudio provide solutions to the entertainment and film industry in order to help clients to grab the attention of the Our creative design team uses advanced computer graphics techniques to produce dynamic and characters design , visual effects (VFX), digital models and props that contribute to films, videos, commercials, and television Advertisement and Marketing We offer a wide range of design support for the advertising and marketing industry . We provide assistance regarding digital strategy models, PR (public relation) models, social media marketing models, branding models, We can assist our clients to ensure that their products or services stand out from the crowd by providing them with Manufacturing We offer mechanical CAD solutions that help companies to develop complex design structures with ease while significantly reducing the marketing We have extensive experience in creating virtual models that can represent the required product or Our mechanical designs can be perfectly use for printing and animations and Retail We provide flexible and effective support for retail industry by offering product modeling , renderings , augmented reality, and animations to showcase the product attribute to the targeted customers in detailed This, in turn, results in improving brand visibility, experience, and sales of the Benefits of Outsourcing Design Services To Us Expertise Our highly skilled professionals bring unequalled values to all projects for diverse Affordable We have various custom plans that can effectively improve the value of the Turnaround time We have systematic service delivery time helps us never fall short of the schedules agreed Reliable As a company, we ensure to meet even their most strenuous and unique Our Work Samples Interior Rendering Rendering Furniture Model Modeling Exterior Rendering Rendering View Our Portfolio What Our Clients Say < "" I was really surprised to see the quality and the professionalism ThePro3DStudio displayed while executing my mechanical engineering I will definitely recommend "" Design Engineer, Manufacturing Company New York, USA "" Thank you guys the CGI animat",startup,"{'status': '200', 'available': True, 'url': 'http://web.archive.org/web/20190514103012/https://professional3dservices.com/', 'timestamp': '20190514103012'}",20190514103012.0,1.0
https://aimcleaningcompany.com,1279,crunchbase," AIM Cleaning LLC - Commercial Cleaning, Janitorial Services We AIM to please! AIM Cleaning LLC (616) Signed in as: Sign out AIM Cleaning LLC (616) Welcome to AIM Cleaning LLC commercial cleaning service Helping keep your business spotless! Contact Us About Us A Cleaner Environment We offer cleaning services for schools, churches, medical facilities, office buildings, and We customize our services to meet your specific Ask us about daily, weekly, and weekly Contracts Call for a free What We Offer Our services include: cleaning and sanitizing restrooms, sweeping, mopping, and vacuuming floors, hardwood floor care, high and low dusting, removing cobwebs, baseboard cleaning, interior glass touch up, cabinetry face cleaning, cleaning and shining of office kitchen We AIM to please! Your Business is Ours AIM Cleaning LLC is fully insured . We promise a quality, reliable cleaning service every We work hard to be the Our products are and We focus on the details so you have a clean, orderly office environment which makes your workspace more AIM Cleaning Video #1 Check out this great video Contact Us For Quotes and Questions: Send AIM Cleaning LLC (616) Join Our Mailing List Sign up Copyright © AIM Cleaning LLC - All Rights Powered by GoDaddy GoCentral Website Builder ",startup,"{'status': '200', 'available': True, 'url': 'http://web.archive.org/web/20180828012454/https://aimcleaningcompany.com/', 'timestamp': '20180828012454'}",20180828012454.0,1.0
https://www.trustalchemy.com/,13837,crunchbase,"Alchemy Services - Alchemy Alchemy – FinTech Infrastructure Company See our offerings Search for: Search for: Home About Alchemy Our Alchemists Alchemy Services Alchemy Lending Platform Alchemy Alchemy Point of Sale Alchemy Pay Alchemy Open API Alchemy Servicing News New Careers Contact Home About Alchemy Our Alchemists Alchemy Services Alchemy Lending Platform Alchemy Alchemy Point of Sale Alchemy Pay Alchemy Open API Alchemy Servicing News New Careers Contact Home Alchemy Services Alchemy Services Copied! Lending Platform Experience Alchemy offers a full range of lending as a service Starting with our white labelled lending It is designed to launch your lending product quickly and Our lending solution is also for specialty financing FinTech clients in areas of mechanics financing, construction loans, and student With Alchemy , we have a team of data scientists that build state of the art Machine Learning and Artificial Intelligent algorithms that have demonstrated effectiveness in a variety of lending Alchemy Lending Platform Alchemy Lending Platform is a robust lending platform that serves as the operating system for many of the FinTech lenders Discover more Alchemy Machine learning and Artificial Intelligence is revolutionizing our Banking, Financial Services and especially FinTech startups are starting to embrace Alchemy is the decision engine that drives the next generations of Discover more Alchemy Point of Sale Point of Sale verticals is the next evolution in Whether you want to expand into financing or starting new products in construction Alchemy PoS (Point of Sale) solution enables your partners to underwrite in real time in front of their Discover more Alchemy Pay Alchemy payment gateway works with a variety of banks and payment Whether we use NACHA or API, all payments and reversals are Our payment system also allows for split transactions so your Point of Sales partners gets paid in real Discover more Alchemy Open API Alchemy’s lending platform is You can use any part of the platform with an easy to use Alchemy APIs for your Whether you want to preserve your own servicing platform or starting with our Alchemy technology, we can help you to develop those plug and play end Discover more Alchemy Servicing In addition to technology and We have a group of highly trained lending experts that can help you with customer service, underwriting and portfolio This group of lending specialists can help you quickly launch your Discover more Share this page Copied! Contact us for a demo of Alchemy lending technology today! Meet our technology team Alchemy Alchemy FinTech Infrastructure Company Cases About Team News Careers Get in Touch   Our Alchemist - Alchemy Alchemy – Next Generation Lending Platform See how we can help Search for: Search for: Home About Alchemy Our Alchemist Alchemy Services Alchemy Lending Platform Alchemy Alchemy Point of Sale Alchemy Pay Alchemy Open API Alchemy Servicing News New Case Studies Careers Contact Home About Alchemy Our Alchemist Alchemy Services Alchemy Lending Platform Alchemy Alchemy Point of Sale Alchemy Pay Alchemy Open API Alchemy Servicing News New Case Studies Careers Contact Home Our Alchemist Our Alchemist Copied! Timothy Li founded Alchemy in after successfully launched several other FinTech startups in Tim is an accomplished entrepreneur with a successful track record in building multimillion dollar companies in the FinTech Shawn is an accomplished entrepreneur over years of experience in the technology, banking and lending Tim is the Founder of Alchemy, a financial technology company with an innovative, lending software Prior to starting Alchemy, he founded, MaxDecisions, and Kuber Financial, Timothy also serves on several advisory boards including Rocket Loans, a Quicken Loans Prior to his FinTech ventures, he serves as senior executives at LoanDepot, Realty Mogul, Think Finance and JPMorgan Timothy holds several patents in Banking Technology with JPMorgan He is also a Faculty at the University of Southern California, Viterbi School of Under his leadership, Alchemy Technology has explored and conquered new lending verticals integrated new lending technology partners, developing new service lines, and entering areas in traditional banking and community Alchemy is servicing the greater FinTech industry continually broadening our breadth of lending He also seeks opportunities to expand our capabilities, allowing us to provide a more holistic service offering to our Banking and FinTech Timothy Li Founder Hugely passionate about the FinTech and LegalTech industry, his breadth of knowledge and desire to exceed expectations is at the forefront of his approach to providing superior services to our Banking, Specialty Financing and FinTech Timothy Li Founder Rick Russell Chief Technology Officer Jason Larson Principal Systems Architect JaNall Haynes Developer Bracken Mudrow Project Management & Quality Assurance Rodney Price Full Stack Engineer Matt Francis Full Stack",startup,"{'status': '200', 'available': True, 'url': 'http://web.archive.org/web/20190824185820/https://www.trustalchemy.com/', 'timestamp': '20190824185820'}",20190824185820.0,1.0
https://mokablox.com,580,crunchbase," MOKA BLOX Welcome to MOKA BLOX Future of BLOCKCHAIN TECHNOLOGY Security, Efficiency, Scalability Contact Us About Us Security We are building the MOKA Platform from ground up using the highest security Efficiency IT HAS TO BE FAST AND Otherwise you got Our PHD Engineers love speed and that is the core to our MOKA Scalability You are going to grow your business weather you build software or move We are building MOKA Platform to handle the next years of Contact Us Send us an We will let you know when we release the Send MOKA BLOX Copyright © MOKA BLOX - All Rights MOKA BLOX ",startup,"{'status': '200', 'available': True, 'url': 'http://web.archive.org/web/20180829183946/https://mokablox.com/', 'timestamp': '20180829183946'}",20180829183946.0,1.0
https://www.granitestatetechnical.com/,11089,crunchbase,"CONTACT | GST top of page Exceptional Security Systems and Services for Home and Businesses HOME MISSION SERVICES Business Solutions Home Solutions VENDORS CAREERS SHOWROOM CONTACT More Use tab to navigate through the menu CONTACT US Security Systems and Services Home & Business Solutions Granite State Technical (603) - ​ Success! Message Send © - Granite State Technical bottom of page   Wayback Machine We will keep fighting for all libraries - stand with us! Internet Archive logo A line drawing of the Internet Archive headquarters building faÃ§ade. Donate icon An illustration of a heart shape ""Donate to the archive"" Search icon An illustration of a magnifying Search icon An illustration of a magnifying Upload icon An illustration of a horizontal line over an up pointing Upload User icon An illustration of a person s head and Sign up | Log in Web icon An illustration of a computer application window Wayback Machine Texts icon An illustration of an open Books Video icon An illustration of two cells of a film Video Audio icon An illustration of an audio Audio Software icon An illustration of a "" floppy Software Images icon An illustration of two Images Donate icon An illustration of a heart shape Donate Ellipses icon An illustration of text More Hamburger icon An icon used to represent a menu that can be toggled by interacting with this Internet Archive Audio Live Music Archive Librivox Free Audio Featured All Audio This Just In Grateful Dead Netlabels Old Time Radio RPMs and Cylinder Recordings Top Audio Books & Poetry Computers, Technology and Science Music, Arts & Culture News & Public Affairs Spirituality & Religion Podcasts Radio News Archive Images Metropolitan Museum Cleveland Museum of Art Featured All Images This Just In Flickr Commons Occupy Wall Street Flickr Cover Art USGS Maps Top NASA Images Solar System Collection Ames Research Center Software Internet Arcade Console Living Room Featured All Software This Just In Old School Emulation Games Historical Software Classic PC Games Software Library Top Kodi Archive and Support File Vintage Software APK Software Software Library Software Sites Tucows Software Library Shareware Software Capsules Compilation Images ZX Spectrum DOOM Level CD Books Books to Borrow Open Library Featured All Books All Texts This Just In Smithsonian Libraries FEDLINK (US) Genealogy Lincoln Collection Top American Libraries Canadian Libraries Universal Library Project Gutenberg Children s Library Biodiversity Heritage Library Books by Language Additional Collections Video TV News Understanding 9 11 Featured All Video This Just In Prelinger Archives Democracy Now! Occupy Wall Street TV NSA Clip Library Top Animation & Cartoons Arts & Music Computers & Technology Cultural & Academic Films Ephemeral Films Movies News & Public Affairs Spirituality & Religion Sports Videos Television Videogame Videos Vlogs Youth Media Search the history of over billion web pages on the Search the Wayback Machine Search icon An illustration of a magnifying Mobile Apps Wayback Machine (iOS) Wayback Machine (Android) Browser Extensions Chrome Firefox Safari Edge Subscription Explore the Collections Learn More Build Collections Save Page Now Capture a web page as it appears now for use as a trusted citation in the Please enter a valid web address About Blog Projects Help Donate Contact Jobs Volunteer People Sign up for free Log in Search metadata Search text contents Search TV news captions Search radio transcripts Search archived web sites Advanced Search About Blog Projects Help Donate Donate icon An illustration of a heart shape Contact Jobs Volunteer People DONATE Sorry You have already reached the limit of active Save Page Now Please wait for a minute and then try Return to Save Page Now The Wayback Machine requires your browser to support JavaScript, please email if you have any questions about The Wayback Machine is an initiative of the Internet Archive , a (c)(3) , building a digital library of Internet sites and other cultural artifacts in digital Other projects include Open Library & . Your use of the Wayback Machine is subject to the Internet Archive s Terms of Use .   SERVICES | GST top of page Exceptional Security Systems and Services for Home and Businesses HOME MISSION SERVICES Business Solutions Home Solutions VENDORS CAREERS SHOWROOM CONTACT More Use tab to navigate through the menu SERVICES We deliver reliable, security solutions that fit your business and home No project is too small or too big for us, for more information on types of services we offer, please select one of our solutions © - Granite State Technical bottom of page   MISSION | GST top of page Exceptional Security Systems and Services for Home and Businesses HOME MISSION SERVICES Business Solutions Home Solutions VENDORS CAREERS SHOWROOM CONTACT More Use tab to navigate through the menu MISSION When it comes to your home and business, we understand that safety is always of the utmost That’s why at Granite State Techni",startup,"{'status': '200', 'available': True, 'url': 'http://web.archive.org/web/20220107172507/https://www.granitestatetechnical.com/', 'timestamp': '20220107172507'}",20220107172507.0,0.0
https://www.omegalendinggroup.com/,25422,crunchbase,"Mortgage Calculator - Omega Lending Group - Lender in Royal Oak, MI Close Mortgage Calculator   Wayback Machine We will keep fighting for all libraries - stand with us! Internet Archive logo A line drawing of the Internet Archive headquarters building faÃ§ade. Donate icon An illustration of a heart shape ""Donate to the archive"" Search icon An illustration of a magnifying Search icon An illustration of a magnifying Upload icon An illustration of a horizontal line over an up pointing Upload User icon An illustration of a person s head and Sign up | Log in Web icon An illustration of a computer application window Wayback Machine Texts icon An illustration of an open Books Video icon An illustration of two cells of a film Video Audio icon An illustration of an audio Audio Software icon An illustration of a "" floppy Software Images icon An illustration of two Images Donate icon An illustration of a heart shape Donate Ellipses icon An illustration of text More Hamburger icon An icon used to represent a menu that can be toggled by interacting with this Internet Archive Audio Live Music Archive Librivox Free Audio Featured All Audio This Just In Grateful Dead Netlabels Old Time Radio RPMs and Cylinder Recordings Top Audio Books & Poetry Computers, Technology and Science Music, Arts & Culture News & Public Affairs Spirituality & Religion Podcasts Radio News Archive Images Metropolitan Museum Cleveland Museum of Art Featured All Images This Just In Flickr Commons Occupy Wall Street Flickr Cover Art USGS Maps Top NASA Images Solar System Collection Ames Research Center Software Internet Arcade Console Living Room Featured All Software This Just In Old School Emulation Games Historical Software Classic PC Games Software Library Top Kodi Archive and Support File Vintage Software APK Software Software Library Software Sites Tucows Software Library Shareware Software Capsules Compilation Images ZX Spectrum DOOM Level CD Books Books to Borrow Open Library Featured All Books All Texts This Just In Smithsonian Libraries FEDLINK (US) Genealogy Lincoln Collection Top American Libraries Canadian Libraries Universal Library Project Gutenberg Children s Library Biodiversity Heritage Library Books by Language Additional Collections Video TV News Understanding 9 11 Featured All Video This Just In Prelinger Archives Democracy Now! Occupy Wall Street TV NSA Clip Library Top Animation & Cartoons Arts & Music Computers & Technology Cultural & Academic Films Ephemeral Films Movies News & Public Affairs Spirituality & Religion Sports Videos Television Videogame Videos Vlogs Youth Media Search the history of over billion web pages on the Search the Wayback Machine Search icon An illustration of a magnifying Mobile Apps Wayback Machine (iOS) Wayback Machine (Android) Browser Extensions Chrome Firefox Safari Edge Subscription Explore the Collections Learn More Build Collections Save Page Now Capture a web page as it appears now for use as a trusted citation in the Please enter a valid web address About Blog Projects Help Donate Contact Jobs Volunteer People Sign up for free Log in Search metadata Search text contents Search TV news captions Search radio transcripts Search archived web sites Advanced Search About Blog Projects Help Donate Donate icon An illustration of a heart shape Contact Jobs Volunteer People DONATE Sorry Job failed Return to Save Page Now The Wayback Machine requires your browser to support JavaScript, please email if you have any questions about The Wayback Machine is an initiative of the Internet Archive , a (c)(3) , building a digital library of Internet sites and other cultural artifacts in digital Other projects include Open Library & . Your use of the Wayback Machine is subject to the Internet Archive s Terms of Use .   Wayback Machine We will keep fighting for all libraries - stand with us! Internet Archive logo A line drawing of the Internet Archive headquarters building faÃ§ade. Donate icon An illustration of a heart shape ""Donate to the archive"" Search icon An illustration of a magnifying Search icon An illustration of a magnifying Upload icon An illustration of a horizontal line over an up pointing Upload User icon An illustration of a person s head and Sign up | Log in Web icon An illustration of a computer application window Wayback Machine Texts icon An illustration of an open Books Video icon An illustration of two cells of a film Video Audio icon An illustration of an audio Audio Software icon An illustration of a "" floppy Software Images icon An illustration of two Images Donate icon An illustration of a heart shape Donate Ellipses icon An illustration of text More Hamburger icon An icon used to represent a menu that can be toggled by interacting with this Internet Archive Audio Live Music Archive Librivox Free Audio Featured All Audio This Just In Grateful Dead Netlabels Old Time Radio RPMs and Cylinder Recordings Top Audio Books & Poetry Computers, Technology and Science Music, Arts & Culture News & P",startup,"{'status': '200', 'available': True, 'url': 'http://web.archive.org/web/20190124024720/https://www.omegalendinggroup.com/', 'timestamp': '20190124024720'}",20190124024720.0,1.0
https://www.landaero.com,874,crunchbase," Land Aero Group, Fairgrounds Parkway, San Antonio, Texas , United States | Land Aero Group, Manufacturing Services for Aerospace and IGT Manufacturing Services Tooling Manufacturing Land Aero Group manufactures precision aircraft and engine Repair Development Our manufacturing experts can assist in the development of new repairs - including the documentation of all required processes and CNC Machining We offer full service machining and provide customized solutions to fit your needs in turning, milling, drilling, and Subscribe Sign up to hear from us about specials, sales, and Email Address Sign up Contact Us Drop us a line! Name Email Send Better yet, see us in person! We love our customers, so feel free to visit during normal business Land Aero Group, Fairgrounds Parkway, San Antonio, Texas , United States Copyright © Land Aero Group, - All Rights Cage Code: ",startup,"{'status': '200', 'available': True, 'url': 'http://web.archive.org/web/20181005025140/https://landaero.com/', 'timestamp': '20181005025140'}",20181005025140.0,1.0
https://www.cwl.law,54,crunchbase, Crawford Wishnew Lang | Texas Litigation Attorneys | ,startup,"{'status': '200', 'available': True, 'url': 'http://web.archive.org/web/20180902003635/https://www.cwl.law/', 'timestamp': '20180902003635'}",20180902003635.0,1.0
